title,company,location,posted,description,applicants,work_mode,link,titulo_descr,senioridade,idioma,certificado,cluster
Cientista de Dados,Stocci,"São Paulo, São Paulo, Brazil",2 days ago,"Procuramos uma pessoa Cientista de Dados para integrar nosso time de Soluções IA e contribuir com o desenvolvimento de análises avançadas, modelos preditivos e algoritmos que impactem diretamente objetivos estratégicos de nossos clientes.Esta pessoa terá um papel relevante na aplicação de machine learning e inteligência artificial, colaborando com equipes multidisciplinares para transformar dados em soluções acionáveis e de alto valor para o negócio. A posição está aberta para profissionais com diferentes níveis de experiência, desde quem está iniciando na área até quem já possui trajetória consolidada.Se você possui paixão por ciência de dados, inovação e busca um ambiente desafiador e dinâmico, queremos conhecer você!Responsabilidades:Integrar ou liderar projetos de ciência de dados, desde a identificação de problemas de negócios até a entrega de soluções analíticas que gerem impacto mensurável.Criar, implementar e manter modelos preditivos e soluções de machine learning, utilizando grandes volumes de dados estruturados e não estruturados.Conduzir análises exploratórias, fornecendo insights estratégicos e recomendações baseadas em dados para apoiar a tomada de decisão.Colaborar com equipes de engenharia de dados, produto e negócios para integrar modelos e algoritmos aos sistemas e fluxos operacionais.Pesquisar e implementar novas técnicas, ferramentas e frameworks em machine learning e inteligência artificial, acompanhando tendências de mercado e tecnologia.Compartilhar boas práticas com o time, promovendo uma cultura de excelência técnica e colaboração.Garantir que as soluções entregues sejam escaláveis, interpretáveis e alinhadas às melhores práticas de ciência de dados e engenharia.Monitorar e avaliar o desempenho dos modelos implementados, propondo melhorias contínuas.Requisitos:Graduação completa ou em andamento em Ciência da Computação, Estatística, Matemática, Engenharia ou áreas correlatas.Programação em Python ou R.Bibliotecas e frameworks de análise e modelagem de dados (ex.: Pandas, Scikit-learn, TensorFlow, etc.).Fundamentos de estatística, probabilidade e modelagem preditiva.Manipulação de bancos de dados relacionais (SQL) e/ou não relacionais.Ferramentas de visualização de dados (Power BI, Tableau ou similares).Diferenciais:Experiência prática com Deploy e monitoramento de modelos em produção.Vivência com ambientes de computação em nuvem (AWS, Azure ou GCP).Conhecimento em frameworks de MLOps.Participação em projetos estratégicos de ciência de dados aplicados ao negócio.Perfil profissional:Visão analítica e foco em resultados.Curiosidade intelectual e disposição para explorar novas abordagens e tecnologias.Capacidade de trabalhar em equipe, colaborar com diferentes áreas e comunicar soluções técnicas de forma clara.Proatividade, organização e autonomia para conduzir projetos.Facilidade para lidar com desafios complexos, propondo soluções criativas e práticas.Se você se identificou com a oportunidade, inscreva-se! Valorizamos potenciais, trajetórias diversas e acreditamos no desenvolvimento contínuo.Show moreShow less",,On-site/Hybrid,https://www.linkedin.com/jobs-guest/jobs/api/jobPosting/4242248792,"Cientista de Dados Procuramos uma pessoa Cientista de Dados para integrar nosso time de Soluções IA e contribuir com o desenvolvimento de análises avançadas, modelos preditivos e algoritmos que impactem diretamente objetivos estratégicos de nossos clientes.Esta pessoa terá um papel relevante na aplicação de machine learning e inteligência artificial, colaborando com equipes multidisciplinares para transformar dados em soluções acionáveis e de alto valor para o negócio. A posição está aberta para profissionais com diferentes níveis de experiência, desde quem está iniciando na área até quem já possui trajetória consolidada.Se você possui paixão por ciência de dados, inovação e busca um ambiente desafiador e dinâmico, queremos conhecer você!Responsabilidades:Integrar ou liderar projetos de ciência de dados, desde a identificação de problemas de negócios até a entrega de soluções analíticas que gerem impacto mensurável.Criar, implementar e manter modelos preditivos e soluções de machine learning, utilizando grandes volumes de dados estruturados e não estruturados.Conduzir análises exploratórias, fornecendo insights estratégicos e recomendações baseadas em dados para apoiar a tomada de decisão.Colaborar com equipes de engenharia de dados, produto e negócios para integrar modelos e algoritmos aos sistemas e fluxos operacionais.Pesquisar e implementar novas técnicas, ferramentas e frameworks em machine learning e inteligência artificial, acompanhando tendências de mercado e tecnologia.Compartilhar boas práticas com o time, promovendo uma cultura de excelência técnica e colaboração.Garantir que as soluções entregues sejam escaláveis, interpretáveis e alinhadas às melhores práticas de ciência de dados e engenharia.Monitorar e avaliar o desempenho dos modelos implementados, propondo melhorias contínuas.Requisitos:Graduação completa ou em andamento em Ciência da Computação, Estatística, Matemática, Engenharia ou áreas correlatas.Programação em Python ou R.Bibliotecas e frameworks de análise e modelagem de dados (ex.: Pandas, Scikit-learn, TensorFlow, etc.).Fundamentos de estatística, probabilidade e modelagem preditiva.Manipulação de bancos de dados relacionais (SQL) e/ou não relacionais.Ferramentas de visualização de dados (Power BI, Tableau ou similares).Diferenciais:Experiência prática com Deploy e monitoramento de modelos em produção.Vivência com ambientes de computação em nuvem (AWS, Azure ou GCP).Conhecimento em frameworks de MLOps.Participação em projetos estratégicos de ciência de dados aplicados ao negócio.Perfil profissional:Visão analítica e foco em resultados.Curiosidade intelectual e disposição para explorar novas abordagens e tecnologias.Capacidade de trabalhar em equipe, colaborar com diferentes áreas e comunicar soluções técnicas de forma clara.Proatividade, organização e autonomia para conduzir projetos.Facilidade para lidar com desafios complexos, propondo soluções criativas e práticas.Se você se identificou com a oportunidade, inscreva-se! Valorizamos potenciais, trajetórias diversas e acreditamos no desenvolvimento contínuo.Show moreShow less",Não especificado,Não especificado,Microsoft Azure,1
Consultor Performance Negócios (Cientista / Dados),SulAmérica,"São Paulo, São Paulo, Brazil",1 week ago,"DescriçãoResponsável por centralizar todos os dados e analises da Diretoria, desde as ingestões de dados em ambientes produtivos e, principalmente estudos e geração de insights para tomadas de decisão.Desafios e responsabilidades desta vagaFacilidade para se desenvolver e auxiliar o time em um ambiente de trabalho dinâmico, capaz de priorizartarefas através da compreensão das metas de negócios de curto e longo prazo.Outros RequisitosFluência em SQL,Ferramentas de visualização de dadosPython ou programação R são imprescindíveisExperiência com técnicas de modelagem, como modelos de classificação, séries temporais, análise de sobrevivência, cluster, etc.Superior completoConhecimento profundo estatística (modelagem)Desafio: Manter-se à frente da construção de subsídios para embasamento da estratégia de gestão da diretoria, adaptando-se e aprimorando constantemente as abordagens, algoritmos e modelos para garantir pleno andamento das açõesDesejávelExperiência com o mercado de Saúde;LLM;Show moreShow less",,On-site/Hybrid,https://www.linkedin.com/jobs-guest/jobs/api/jobPosting/4233975838,"Consultor Performance Negócios (Cientista / Dados) DescriçãoResponsável por centralizar todos os dados e analises da Diretoria, desde as ingestões de dados em ambientes produtivos e, principalmente estudos e geração de insights para tomadas de decisão.Desafios e responsabilidades desta vagaFacilidade para se desenvolver e auxiliar o time em um ambiente de trabalho dinâmico, capaz de priorizartarefas através da compreensão das metas de negócios de curto e longo prazo.Outros RequisitosFluência em SQL,Ferramentas de visualização de dadosPython ou programação R são imprescindíveisExperiência com técnicas de modelagem, como modelos de classificação, séries temporais, análise de sobrevivência, cluster, etc.Superior completoConhecimento profundo estatística (modelagem)Desafio: Manter-se à frente da construção de subsídios para embasamento da estratégia de gestão da diretoria, adaptando-se e aprimorando constantemente as abordagens, algoritmos e modelos para garantir pleno andamento das açõesDesejávelExperiência com o mercado de Saúde;LLM;Show moreShow less",Pleno,Não especificado,Não especificado,1
Cientista de Dados (Pleno/Sênior),Accenture Brasil,"São Paulo, São Paulo, Brazil",1 week ago,"Supply Chain Analytics - Foco em PreditivaUm time que faz parte da mudançaAbraçamos o poder da mudança para criar valor e sucesso compartilhado para nossos clientes, funcionários, acionistas, parceiros e comunidades. Contamos com a maior rede mundial de centros de tecnologia avançada e operações inteligentes.Provocamos a mudança no mercadoTrabalhamos juntos mundo afora para fazer um mundo de diferenças. A Accenture é uma empresa global de serviços profissionais líder em soluções para digital, nuvem e segurança. Ao combinar experiência incomparável e habilidades especializadas em mais de 40 setores, oferecemos serviços em Estratégia e Consultoria, Tecnologia, Operações, Industry X e a Accenture Song. Ao trabalharmos juntos, a mudança se torna a fonte de progresso mais dinâmica e poderosa que você tem. Somos mais de 738 mil pessoas, presentes em mais de 120 países, engajados em fazer inovação todos os dias e transformar o mundo em um lugar melhor para as pessoas.Junte-se a nós – Strategy & ConsultingA reinvenção começa aqui. Abrangendo todos os setores e funções empresariais, nossos especialistas em estratégia e consultoria trabalham com os clientes para ativar novos níveis de inovação e lançar transformações executivas comprimidas com tecnologia, dados e IA no centro de tudo o que fazemos. Olhamos através das lentes da experiência – em setores, funções, geografias – para definir e projetar soluções que liberem nossa velocidade e escala. Entregue, diariamente, soluções de transformação por meio de nossos métodos, ativos, dados, soluções e aceleradores para atingir o ponto inicial em todos os compromissos, em todos os setores e em todas as funções.Conheça a equipe de Applied IntelligenceComo parte da área de Applied Intelligence Strategy, você trabalhará com diversos clientes em múltiplas indústrias, fornecendo soluções analíticas e ajudando os clientes a transformar dados em percepções acionáveis que conduzam a resultados tangíveis, melhorem o desempenho e ajudem os clientes a liderar o mercado.O que você vai fazer no seu dia a dia:Trabalhar com clientes para compreender como os dados e as análises podem ajudar os seus negócios, nos diferentes setores da indústria. Compreender e decompor os problemas dos clientes, partindo da compreensão de tecnologia, métodos, ferramentas analíticas e abordagens de modelos operacionais;Analisar dados, gerar e avaliar hipóteses de trabalho, preparar e analisar dados históricos, propondo variáveis que ajudem a descobrir tendências e suporte para as modelagens analíticas;Realizar modelagens preditivas com uso de técnicas estatísticas e de machine learning/deep learning, incluindo avaliação e ajustes dos modelos analíticos desenvolvidos. Propor formas de visualizar os resultados obtidos, de forma objetiva e orientada ao problema de negócio sob foco das análises;Trazer conhecimento detalhado e abrangente da indústria a partir de experiências anteriores, como estratégia de suporte durante a atuação nos diferentes projetos;Gerir a relação com os clientes frente aos desafios do projeto, além de estabelecer parcerias com os membros do time, como forma de implementar e potencializar o valor entregue pelas soluções desenvolvidas;Alem disso, é necessário conhecimento:Ensino superior em Engenharia, Matemática, Computação, Estatística, Economia, Gestão ou área quantitativa/comercial. MBAs, mestrados e/ou doutorados, serão um diferencial;Capacidade excepcional de análise e pensamento crítico, sendo desejável a capacidade de comunicar resultados e e técnicas utilizadas de forma clara e objetiva;Conhecimentos em desenvolvimento de casos de negócios, identificação de oportunidades de valor para dados e análises, processos e concepção de modelos operacionais, concepção e implementação de jornadas de transformação ágeis, conhecimento no planejamento, concepção, desenvolvimento e implementação de soluções analíticas utilizando soluções ágeis;Conhecimento dos processos da cadeia de abastecimento, tais como planejamento, suprimentos, manufatura, operações, logística, estratégias de inventário;O que a Accenture oferece:Formato de trabalho: (Flexível/híbrido)Contratação: CLTProjetos globais;Plano de Carreira e Desenvolvimento;Incentivos de estudo: Certificações nas principais tecnologias, plataforma de cursos, parcerias;Curso de idiomas;Vale Refeição ou Alimentação sem descontos;Ajuda de Custo Home Office/HibridoAssistência Médica – custeada 100% pela empresa (titular e dependentes);Assistência Odontológica;Seguro de Vida, subsidiado pela empresa;Previdência privada;PPR;Gympass;Opção de compra de ações da empresa com desconto;Conte Comigo: Assistência jurídica, psicológica, Gestão financeira;Programa novos filhos: Licença maternidade e paternidade extendida;Acesso constante à informações e tecnologias de ponta.INCLUSÃO E DIVERSIDADE NA ACCENTUREA Accenture é comprometida com a aceleração da igualdade, isso possibilita um melhor desempenho e sustenta uma cultura na qual todos sentem que têm oportunidades iguais de pertencer e de construir uma carreira!Conheça nossos pilares de diversidade:COLOR BRAVE –Programa de Talentos para Pretos e PardosSEM BARREIRAS –Programa de Talentos para Pessoas com deficiênciaPRIDE –Programa de Talentos para pessoas LGBTQIA+AWAKE –Programa de Talentos para MulheresGRAND MASTERS –Programa de Talentos para pessoas 50+As Melhores PessoasNosso principal valor é o Respeito pelo Indivíduo. O nosso maior ativo são as pessoas, não fazemos distinção de gênero, cor, orientação sexual, posição social ou deficiências. Todos têm oportunidades iguais de construir sua carreira em uma empresa inclusiva e diversificada.Conheça mais sobre a Accenture:https://www.accenture.com/br-ptShow moreShow less",,On-site/Hybrid,https://www.linkedin.com/jobs-guest/jobs/api/jobPosting/4238095840,"Cientista de Dados (Pleno/Sênior) Supply Chain Analytics - Foco em PreditivaUm time que faz parte da mudançaAbraçamos o poder da mudança para criar valor e sucesso compartilhado para nossos clientes, funcionários, acionistas, parceiros e comunidades. Contamos com a maior rede mundial de centros de tecnologia avançada e operações inteligentes.Provocamos a mudança no mercadoTrabalhamos juntos mundo afora para fazer um mundo de diferenças. A Accenture é uma empresa global de serviços profissionais líder em soluções para digital, nuvem e segurança. Ao combinar experiência incomparável e habilidades especializadas em mais de 40 setores, oferecemos serviços em Estratégia e Consultoria, Tecnologia, Operações, Industry X e a Accenture Song. Ao trabalharmos juntos, a mudança se torna a fonte de progresso mais dinâmica e poderosa que você tem. Somos mais de 738 mil pessoas, presentes em mais de 120 países, engajados em fazer inovação todos os dias e transformar o mundo em um lugar melhor para as pessoas.Junte-se a nós – Strategy & ConsultingA reinvenção começa aqui. Abrangendo todos os setores e funções empresariais, nossos especialistas em estratégia e consultoria trabalham com os clientes para ativar novos níveis de inovação e lançar transformações executivas comprimidas com tecnologia, dados e IA no centro de tudo o que fazemos. Olhamos através das lentes da experiência – em setores, funções, geografias – para definir e projetar soluções que liberem nossa velocidade e escala. Entregue, diariamente, soluções de transformação por meio de nossos métodos, ativos, dados, soluções e aceleradores para atingir o ponto inicial em todos os compromissos, em todos os setores e em todas as funções.Conheça a equipe de Applied IntelligenceComo parte da área de Applied Intelligence Strategy, você trabalhará com diversos clientes em múltiplas indústrias, fornecendo soluções analíticas e ajudando os clientes a transformar dados em percepções acionáveis que conduzam a resultados tangíveis, melhorem o desempenho e ajudem os clientes a liderar o mercado.O que você vai fazer no seu dia a dia:Trabalhar com clientes para compreender como os dados e as análises podem ajudar os seus negócios, nos diferentes setores da indústria. Compreender e decompor os problemas dos clientes, partindo da compreensão de tecnologia, métodos, ferramentas analíticas e abordagens de modelos operacionais;Analisar dados, gerar e avaliar hipóteses de trabalho, preparar e analisar dados históricos, propondo variáveis que ajudem a descobrir tendências e suporte para as modelagens analíticas;Realizar modelagens preditivas com uso de técnicas estatísticas e de machine learning/deep learning, incluindo avaliação e ajustes dos modelos analíticos desenvolvidos. Propor formas de visualizar os resultados obtidos, de forma objetiva e orientada ao problema de negócio sob foco das análises;Trazer conhecimento detalhado e abrangente da indústria a partir de experiências anteriores, como estratégia de suporte durante a atuação nos diferentes projetos;Gerir a relação com os clientes frente aos desafios do projeto, além de estabelecer parcerias com os membros do time, como forma de implementar e potencializar o valor entregue pelas soluções desenvolvidas;Alem disso, é necessário conhecimento:Ensino superior em Engenharia, Matemática, Computação, Estatística, Economia, Gestão ou área quantitativa/comercial. MBAs, mestrados e/ou doutorados, serão um diferencial;Capacidade excepcional de análise e pensamento crítico, sendo desejável a capacidade de comunicar resultados e e técnicas utilizadas de forma clara e objetiva;Conhecimentos em desenvolvimento de casos de negócios, identificação de oportunidades de valor para dados e análises, processos e concepção de modelos operacionais, concepção e implementação de jornadas de transformação ágeis, conhecimento no planejamento, concepção, desenvolvimento e implementação de soluções analíticas utilizando soluções ágeis;Conhecimento dos processos da cadeia de abastecimento, tais como planejamento, suprimentos, manufatura, operações, logística, estratégias de inventário;O que a Accenture oferece:Formato de trabalho: (Flexível/híbrido)Contratação: CLTProjetos globais;Plano de Carreira e Desenvolvimento;Incentivos de estudo: Certificações nas principais tecnologias, plataforma de cursos, parcerias;Curso de idiomas;Vale Refeição ou Alimentação sem descontos;Ajuda de Custo Home Office/HibridoAssistência Médica – custeada 100% pela empresa (titular e dependentes);Assistência Odontológica;Seguro de Vida, subsidiado pela empresa;Previdência privada;PPR;Gympass;Opção de compra de ações da empresa com desconto;Conte Comigo: Assistência jurídica, psicológica, Gestão financeira;Programa novos filhos: Licença maternidade e paternidade extendida;Acesso constante à informações e tecnologias de ponta.INCLUSÃO E DIVERSIDADE NA ACCENTUREA Accenture é comprometida com a aceleração da igualdade, isso possibilita um melhor desempenho e sustenta uma cultura na qual todos sentem que têm oportunidades iguais de pertencer e de construir uma carreira!Conheça nossos pilares de diversidade:COLOR BRAVE –Programa de Talentos para Pretos e PardosSEM BARREIRAS –Programa de Talentos para Pessoas com deficiênciaPRIDE –Programa de Talentos para pessoas LGBTQIA+AWAKE –Programa de Talentos para MulheresGRAND MASTERS –Programa de Talentos para pessoas 50+As Melhores PessoasNosso principal valor é o Respeito pelo Indivíduo. O nosso maior ativo são as pessoas, não fazemos distinção de gênero, cor, orientação sexual, posição social ou deficiências. Todos têm oportunidades iguais de construir sua carreira em uma empresa inclusiva e diversificada.Conheça mais sobre a Accenture:https://www.accenture.com/br-ptShow moreShow less",Sênior,Não especificado,Não especificado,2
