title,company,location,posted,description,applicants,work_mode,link,titulo_descr,senioridade,idioma,certificado,cluster
Cientista de Dados Júnior,GOL Linhas Aéreas,"São Paulo, São Paulo, Brazil",1 week ago,"Job DescriptionEstamos em busca de talentos que dominem Python, SQL e tenham familiaridade commodelagem e exploração de dadospara integrar nosso Time de Águias. Se você curte transformar dados em soluções inteligentes e busca desafios em um ambiente inclusivo, diverso e estimulante, essa é a oportunidade certa para decolar na sua carreira!Responsibilities and assignmentsOs desafios que aguardam por você no próximo destino são:Apoiar o time em projetos de análise e modelagem de dados, contribuindo com código, exploração e validação de hipóteses;Realizar análises exploratórias, construção de dashboards e estudos ad hoc para dar suporte à tomada de decisão;Desenvolver scripts e notebooks em Python e SQL com foco em eficiência e clareza;Colaborar na manutenção de modelos já existentes, ajustando parâmetros e contribuindo para a melhoria contínua;Participar das rotinas de versionamento, documentação e boas práticas de codificação;Trabalhar em conjunto com engenheiros de dados, analistas e cientistas mais experientes na entrega de soluções robustas.Requirements And QualificationsNão pode faltar em sua bagagem:Ensino superior completo em Estatística, Engenharia, Computação, Matemática, Astronomia, Física ou áreas relacionadas (diploma ou colação de grau);Conhecimento básico de Python e bibliotecas como Pandas, Numpy e Scikit-learn;Experiência com SQL para análise de dados;Facilidade para aprender novas ferramentas e conceitos técnicos;Boa comunicação, proatividade e trabalho em equipe.O Que Pode Somar Ainda MaisConhecimento em plataformas cloud (Azure, AWS ou GCP);Experiência acadêmica ou projetos próprios envolvendo machine learning, visualização de dados ou automação de análises;Familiaridade com Git, Jupyter Notebooks;Conhecimento em inglês.Additional informationAqui, você voa mais alto com o Benefício Viagem,que te permite emitir passagens aéreas nacionais e internacionais com descontos especiais para você, familiares e amigos.E Não Podemos Esquecer Dos BenefíciosPlano de saúde;Plano odontológico;Seguro de vida em grupo;Vale-refeição;Vale-alimentação;Vale-transporte;PLR;Gympass ou Totalpass;Clube de parcerias com centenas de empresas conveniadas;Day off de aniversário.Informações ImportantesLocal de Trabalho: Sede - Granja Julieta.Horário: 8h-17h24.Modelo de Trabalho: Híbrido 4x1 (Segunda a Quinta-feira - Presencial / Sexta-feira - Home Office).Se você se identifica com o nosso Jeito, inscreva-se agora e faça parte do Time de Águias! Venha decolar conosco!Process stagesStep 1: Registration1RegistrationStep 2: Mapeamento Comportamental2Mapeamento ComportamentalStep 3: Entrevista Gente e Cultura3Entrevista Gente e CulturaStep 4: Entrevista Gestor4Entrevista GestorStep 5: Stand By5Stand ByStep 6: Carta Proposta6Carta PropostaStep 7: Hiring7HiringSer uma Águia é fazer parte do time que revolucionou a aviação brasileira!Democratizamos o acesso ao transporte aéreo em nosso país e estamos entre as companhias aéreas que mais crescem no mundo. Fomos pioneiros ao lançar o serviço de check-in feito por reconhecimento facial, wi-fi a bordo, geolocalização móvel para Clientes e um site com recursos de acessibilidade para atender pessoas com deficiência.Tudo isso só foi possível porque contamos com o melhor Time da aviação brasileira: as nossas Águias. Com elas, entregamos dedicação e oJeito de Ser e de Fazerque só a GOL tem, paraconectar pessoas e criar novas histórias.Temos uma cultura diversa, com valores que estão presentes a cada novo embarque, sempre garantindo a nossa essência:Simples, Humana e Inteligente. Ao nosso lado, estão Colaboradores dedicados que carregam em suas bagagens o orgulho de serSangue Laranjae cumprem com maestria o nosso propósito de ser aPrimeira para Todos.Oferecemos um ambiente desafiador, diverso e inclusivo para você colocar em prática todo o seu talento. Seja no céu ou em solo,aqui, você voa mais alto!Você se identificou com o nosso Jeito?Confira as vagas para decolar sua carreira e fazer parte do Time de Águias.Show moreShow less",,On-site/Hybrid,https://www.linkedin.com/jobs-guest/jobs/api/jobPosting/4236389810,"Cientista de Dados Júnior Job DescriptionEstamos em busca de talentos que dominem Python, SQL e tenham familiaridade commodelagem e exploração de dadospara integrar nosso Time de Águias. Se você curte transformar dados em soluções inteligentes e busca desafios em um ambiente inclusivo, diverso e estimulante, essa é a oportunidade certa para decolar na sua carreira!Responsibilities and assignmentsOs desafios que aguardam por você no próximo destino são:Apoiar o time em projetos de análise e modelagem de dados, contribuindo com código, exploração e validação de hipóteses;Realizar análises exploratórias, construção de dashboards e estudos ad hoc para dar suporte à tomada de decisão;Desenvolver scripts e notebooks em Python e SQL com foco em eficiência e clareza;Colaborar na manutenção de modelos já existentes, ajustando parâmetros e contribuindo para a melhoria contínua;Participar das rotinas de versionamento, documentação e boas práticas de codificação;Trabalhar em conjunto com engenheiros de dados, analistas e cientistas mais experientes na entrega de soluções robustas.Requirements And QualificationsNão pode faltar em sua bagagem:Ensino superior completo em Estatística, Engenharia, Computação, Matemática, Astronomia, Física ou áreas relacionadas (diploma ou colação de grau);Conhecimento básico de Python e bibliotecas como Pandas, Numpy e Scikit-learn;Experiência com SQL para análise de dados;Facilidade para aprender novas ferramentas e conceitos técnicos;Boa comunicação, proatividade e trabalho em equipe.O Que Pode Somar Ainda MaisConhecimento em plataformas cloud (Azure, AWS ou GCP);Experiência acadêmica ou projetos próprios envolvendo machine learning, visualização de dados ou automação de análises;Familiaridade com Git, Jupyter Notebooks;Conhecimento em inglês.Additional informationAqui, você voa mais alto com o Benefício Viagem,que te permite emitir passagens aéreas nacionais e internacionais com descontos especiais para você, familiares e amigos.E Não Podemos Esquecer Dos BenefíciosPlano de saúde;Plano odontológico;Seguro de vida em grupo;Vale-refeição;Vale-alimentação;Vale-transporte;PLR;Gympass ou Totalpass;Clube de parcerias com centenas de empresas conveniadas;Day off de aniversário.Informações ImportantesLocal de Trabalho: Sede - Granja Julieta.Horário: 8h-17h24.Modelo de Trabalho: Híbrido 4x1 (Segunda a Quinta-feira - Presencial / Sexta-feira - Home Office).Se você se identifica com o nosso Jeito, inscreva-se agora e faça parte do Time de Águias! Venha decolar conosco!Process stagesStep 1: Registration1RegistrationStep 2: Mapeamento Comportamental2Mapeamento ComportamentalStep 3: Entrevista Gente e Cultura3Entrevista Gente e CulturaStep 4: Entrevista Gestor4Entrevista GestorStep 5: Stand By5Stand ByStep 6: Carta Proposta6Carta PropostaStep 7: Hiring7HiringSer uma Águia é fazer parte do time que revolucionou a aviação brasileira!Democratizamos o acesso ao transporte aéreo em nosso país e estamos entre as companhias aéreas que mais crescem no mundo. Fomos pioneiros ao lançar o serviço de check-in feito por reconhecimento facial, wi-fi a bordo, geolocalização móvel para Clientes e um site com recursos de acessibilidade para atender pessoas com deficiência.Tudo isso só foi possível porque contamos com o melhor Time da aviação brasileira: as nossas Águias. Com elas, entregamos dedicação e oJeito de Ser e de Fazerque só a GOL tem, paraconectar pessoas e criar novas histórias.Temos uma cultura diversa, com valores que estão presentes a cada novo embarque, sempre garantindo a nossa essência:Simples, Humana e Inteligente. Ao nosso lado, estão Colaboradores dedicados que carregam em suas bagagens o orgulho de serSangue Laranjae cumprem com maestria o nosso propósito de ser aPrimeira para Todos.Oferecemos um ambiente desafiador, diverso e inclusivo para você colocar em prática todo o seu talento. Seja no céu ou em solo,aqui, você voa mais alto!Você se identificou com o nosso Jeito?Confira as vagas para decolar sua carreira e fazer parte do Time de Águias.Show moreShow less",Júnior,Inglês,Microsoft Azure,2
Cientista de dados genia,Netvagas,"São Paulo, São Paulo, Brazil",5 hours ago,"A Xertica é o maior parceiro Latam do Google e está fazendo uma verdadeira revolução no mercado!Estamos em busca de um Cientista de dados Prompt.O Profissional Será Responsável PorDesenvolver e adaptar algoritimos em Python para constuir soluções completas em Google Cloud Platafor (BigQuery, Vertex AI, Cloud Functions, Looker Studio, Cloud Storage), desde a coleta e tratamento até processamento de visualização de dados.Usar Técnicas de engenharia de Prompt para aprimorar a interação com modelos de linguagem natural (LLM) e criar soluções personalizadasIntegrar APIs com os modelos de linguagem natural para ampliar as funcionalidades das soluções.RequisitosExperiência em análise de dados e desenvolvimento em Python;Conhecimento Sólido em GCP (BigQuery, Vertex AI, Cloud Functions, Looker Studio, Cloud Storage);Familiaridade com técnicas de engenharia de prompt;Experiência com integrações de APISDiferencial: Conhecimento em mineração de dados;Espanhol fluente.Show moreShow less",,On-site/Hybrid,https://www.linkedin.com/jobs-guest/jobs/api/jobPosting/4245877136,"Cientista de dados genia A Xertica é o maior parceiro Latam do Google e está fazendo uma verdadeira revolução no mercado!Estamos em busca de um Cientista de dados Prompt.O Profissional Será Responsável PorDesenvolver e adaptar algoritimos em Python para constuir soluções completas em Google Cloud Platafor (BigQuery, Vertex AI, Cloud Functions, Looker Studio, Cloud Storage), desde a coleta e tratamento até processamento de visualização de dados.Usar Técnicas de engenharia de Prompt para aprimorar a interação com modelos de linguagem natural (LLM) e criar soluções personalizadasIntegrar APIs com os modelos de linguagem natural para ampliar as funcionalidades das soluções.RequisitosExperiência em análise de dados e desenvolvimento em Python;Conhecimento Sólido em GCP (BigQuery, Vertex AI, Cloud Functions, Looker Studio, Cloud Storage);Familiaridade com técnicas de engenharia de prompt;Experiência com integrações de APISDiferencial: Conhecimento em mineração de dados;Espanhol fluente.Show moreShow less",Não especificado,Espanhol,Google Cloud,4
Especialista Cientista de Dados,Porto,"São Paulo, São Paulo, Brazil",3 days ago,"Job DescriptionA área de validação de modelos do Porto Bank é responsável pela validação independente e monitoramento dos modelos de risco de crédito (concessão, behaviour, collection) e demais modelos utilizados na gestão dos diversos produtos do banco, visando a garantir que esses modelos sejam tecnicamente adequados, robustos e precisos.Responsibilities and assignmentsO Especialista de Validação de Modelos será responsável por definir e implementar o processo de validação conforme o grau de materialidade de cada modelo, efetuar a validação dos novos modelos, implementar e acompanhar o monitoramento dos modelos vigentes e realizar a interlocução com as áreas corporativas de riscos.Garantir que os modelos utilizados pela Porto Bank sejam tecnicamente adequados, robustos, precisos e devidamente documentados, assim como identificar oportunidades de melhoria e necessidade de substituição dos modelos.Requirements And QualificationsFormação em Estatística ou cursos correlatos de ciências exatas (desejável pós graduação);-Profundo conhecimento de modelagem estatística (modelos de regressão, modelos lineares generalizados, séries temporais, machine learning, árvores de decisão, etc);Ótimos conhecimentos em programação e ferramentas de análise de dados (Databricks, SAS, Python, R, etc);Ótimo raciocínio lógico e quantitativo;Boas habilidades de relacionamento interpessoal;Senso de urgência;Experiência prévia na atividade de validação de modelos.Additional informationNossos benefícios:Crescimento profissional e financeiro: Aqui nós incentivamos o seu protagonismo e reconhecemos financeiramente sua performance.Porto em Ação: Ser dono do negócio através do nosso novo programa complementar à PLR, disponibilizando anualmente, até 2025, uma porcentagem de valor do seu salário em ações da Porto;Participação nos Lucros: Pois sabemos que só vamos crescer, se crescermos juntos;Mamães: Auxílio creche ou babá, para o seu bem mais precioso ser muito bem cuidado!Plano de Saúde, Odontológico e Seguro de Vida: Para que você possa se cuidar, e também cuidar de seus dependentes;Vale Alimentação e Refeição: Seu VR e VA são flexíveis, para que você atenda às suas necessidades e defina a melhor maneira de utilizá-los;Gympass: Para você possa se exercitar e cuidar da sua saúde física em diversas academias, onde estiver;Previdência Privada - PortoPrev: Para você garantir um futuro mais tranquilo;Bolsa de estudos: Para você começar uma graduação ou que sonha em fazer uma segunda faculdade ou pós-graduação;Cursos de Idiomas: Subsídio para cursos de Inglês e Espanhol;Programa Saúde Integral: Série de benefícios e iniciativas para te apoiar a encontrar equilíbrio de forma integral, através de três pilares: saúde mental, saúde física e saúde financeira;Vale-Transporte: Para nos encontrarmos na Porto;Descontos em produtos e serviços da Porto que só nossos #Portolover tem!Process stagesStep 1: Registration1RegistrationStep 2: Triagem2TriagemStep 3: Teste/Case3Teste/CaseStep 4: Entrevista RH4Entrevista RHStep 5: Entrevista Gestor(a)5Entrevista Gestor(a)Step 6: Hiring6HiringNa Porto, Você Importa!A Porto é muito mais que uma seguradora: é um ecossistema gigante que utiliza tecnologia para criar soluções, através de quatro verticais de negócio:Porto Bank, Porto Saúde, Porto Seguro e Porto Serviço.A reputação e o reconhecimento conquistados ao longo de mais de 7 décadas reforçam o tamanho da Porto, uma empresa referência em negócios, feita para e por pessoas.Aqui, bate no peito de 13 mil colaboradores oorgulho de fazer parte de uma organização sólida e ética,que transforma sonhos em realidades fantásticaspara os nossos mais de 15,8 milhões de clientes. São mais de 101 sucursais e escritórios regionais em todo o Brasil.O aprendizado faz parte do nosso DNA, e aqui, você teráincentivos, ferramentas e gente boa para você aprender e crescer, a cada dia,um ambiente de acolhimento e segurança, onde cada um possa ser e se orgulhar de quem se é, promovendo um espaço de respeito evivendo de forma integral e com bem-estar, em uma empresa genuinamente humana.DIVERSIDADE & INCLUSÃO NA PORTOAqui na Porto, valorizamos a diversidade e acreditamos que um time plural é imprescindível para o desenvolvimento de todo o nosso negócio, da sociedade, e de cada pessoa, pois entendemos que cada indivíduo é único na construção de um ambiente mais inovador e inclusivo. Juntos, trabalhamos diariamente para construirmos um espaço seguro, livre e acolhedor, com mais pluralidade e respeito. Por isso,incentivamos fortemente a inscrição de mulheres, de pessoas negras e indígenas, de pessoas com deficiência e de pessoas LGBTQIA+em todas as nossas vagas.Show moreShow less",,On-site/Hybrid,https://www.linkedin.com/jobs-guest/jobs/api/jobPosting/4243021779,"Especialista Cientista de Dados Job DescriptionA área de validação de modelos do Porto Bank é responsável pela validação independente e monitoramento dos modelos de risco de crédito (concessão, behaviour, collection) e demais modelos utilizados na gestão dos diversos produtos do banco, visando a garantir que esses modelos sejam tecnicamente adequados, robustos e precisos.Responsibilities and assignmentsO Especialista de Validação de Modelos será responsável por definir e implementar o processo de validação conforme o grau de materialidade de cada modelo, efetuar a validação dos novos modelos, implementar e acompanhar o monitoramento dos modelos vigentes e realizar a interlocução com as áreas corporativas de riscos.Garantir que os modelos utilizados pela Porto Bank sejam tecnicamente adequados, robustos, precisos e devidamente documentados, assim como identificar oportunidades de melhoria e necessidade de substituição dos modelos.Requirements And QualificationsFormação em Estatística ou cursos correlatos de ciências exatas (desejável pós graduação);-Profundo conhecimento de modelagem estatística (modelos de regressão, modelos lineares generalizados, séries temporais, machine learning, árvores de decisão, etc);Ótimos conhecimentos em programação e ferramentas de análise de dados (Databricks, SAS, Python, R, etc);Ótimo raciocínio lógico e quantitativo;Boas habilidades de relacionamento interpessoal;Senso de urgência;Experiência prévia na atividade de validação de modelos.Additional informationNossos benefícios:Crescimento profissional e financeiro: Aqui nós incentivamos o seu protagonismo e reconhecemos financeiramente sua performance.Porto em Ação: Ser dono do negócio através do nosso novo programa complementar à PLR, disponibilizando anualmente, até 2025, uma porcentagem de valor do seu salário em ações da Porto;Participação nos Lucros: Pois sabemos que só vamos crescer, se crescermos juntos;Mamães: Auxílio creche ou babá, para o seu bem mais precioso ser muito bem cuidado!Plano de Saúde, Odontológico e Seguro de Vida: Para que você possa se cuidar, e também cuidar de seus dependentes;Vale Alimentação e Refeição: Seu VR e VA são flexíveis, para que você atenda às suas necessidades e defina a melhor maneira de utilizá-los;Gympass: Para você possa se exercitar e cuidar da sua saúde física em diversas academias, onde estiver;Previdência Privada - PortoPrev: Para você garantir um futuro mais tranquilo;Bolsa de estudos: Para você começar uma graduação ou que sonha em fazer uma segunda faculdade ou pós-graduação;Cursos de Idiomas: Subsídio para cursos de Inglês e Espanhol;Programa Saúde Integral: Série de benefícios e iniciativas para te apoiar a encontrar equilíbrio de forma integral, através de três pilares: saúde mental, saúde física e saúde financeira;Vale-Transporte: Para nos encontrarmos na Porto;Descontos em produtos e serviços da Porto que só nossos #Portolover tem!Process stagesStep 1: Registration1RegistrationStep 2: Triagem2TriagemStep 3: Teste/Case3Teste/CaseStep 4: Entrevista RH4Entrevista RHStep 5: Entrevista Gestor(a)5Entrevista Gestor(a)Step 6: Hiring6HiringNa Porto, Você Importa!A Porto é muito mais que uma seguradora: é um ecossistema gigante que utiliza tecnologia para criar soluções, através de quatro verticais de negócio:Porto Bank, Porto Saúde, Porto Seguro e Porto Serviço.A reputação e o reconhecimento conquistados ao longo de mais de 7 décadas reforçam o tamanho da Porto, uma empresa referência em negócios, feita para e por pessoas.Aqui, bate no peito de 13 mil colaboradores oorgulho de fazer parte de uma organização sólida e ética,que transforma sonhos em realidades fantásticaspara os nossos mais de 15,8 milhões de clientes. São mais de 101 sucursais e escritórios regionais em todo o Brasil.O aprendizado faz parte do nosso DNA, e aqui, você teráincentivos, ferramentas e gente boa para você aprender e crescer, a cada dia,um ambiente de acolhimento e segurança, onde cada um possa ser e se orgulhar de quem se é, promovendo um espaço de respeito evivendo de forma integral e com bem-estar, em uma empresa genuinamente humana.DIVERSIDADE & INCLUSÃO NA PORTOAqui na Porto, valorizamos a diversidade e acreditamos que um time plural é imprescindível para o desenvolvimento de todo o nosso negócio, da sociedade, e de cada pessoa, pois entendemos que cada indivíduo é único na construção de um ambiente mais inovador e inclusivo. Juntos, trabalhamos diariamente para construirmos um espaço seguro, livre e acolhedor, com mais pluralidade e respeito. Por isso,incentivamos fortemente a inscrição de mulheres, de pessoas negras e indígenas, de pessoas com deficiência e de pessoas LGBTQIA+em todas as nossas vagas.Show moreShow less",Não especificado,Inglês,Não especificado,3
Cientista de Dados Especialista - Prevenção à Fraude,PicPay,"São Paulo, São Paulo, Brazil",3 weeks ago,"Sobre o PicPayCom mais de dez anos de história, o PicPay é um ecossistema completo de serviços financeiros e não-financeiros que tem como objetivo atender as necessidades diárias de milhares de pessoas e negócios, tornando-se a sua principal conta do dia a dia.Combinar tecnologias avançadas, modelos de Machine Learning e análises estatísticas para construir e aprimorar continuamente a estratégia de prevenção de fraudes transacionais no PicPayResponsabilidade e atribuições:Responsável por desenvolver e otimizar estratégias de prevenção de fraudes transacionais do PicPay, utilizando análise de dados, Machine Learning e tecnologias inovadoras. O profissional deverá analisar as causas centrais de problemas complexos, propor soluções eficazes e contribuir para o desenvolvimento técnico da equipe.Requisitos e qualificações:Experiência comprovada em prevenção de fraudes transacionais ou áreas de riscos.Domínio em análise de dados (SQL, Python ou similar) e análise estatística.Experiência prática com modelos de Machine Learning.Forte capacidade de análise crítica de dados e indicadores, identificando insights e oportunidades.Excelentes habilidades de comunicação e apresentação de dados (Storytelling).Proatividade, autonomia e atenção aos detalhes.Qualificações Desejáveis (Diferenciais):Experiência prévia em Fintech ou Meios de Pagamento;Experiência com plataformas de prevenção de fraudes;criação/gestão de regras de prevenção a fraude.O que oferecemos:Saúde e Bem-estarAssistência Médica e Odontológica;Seguro de Vida;Programa Lado a Lado, com apoio jurídico, social, psicológico e financeiro;TotalPass.Alimentação/ Mobilidade ou Teletrabalho:Cartão de crédito PicPay Benefícios, com ampla aceitação, onde você recebe seu saldo de Alimentação/Refeição e Mobilidade ou Teletrabalho (de acordo com o seu contrato de trabalho).Licença Paternidade e Maternidade:Licença Maternidade estendida de 6 meses, e de Paternidade também estendida de 20 dias.Programa ""Novo Ser"", que acompanha nossas mamães durante toda a gestação e no retorno da licença. Falando nisso, ao retornar da licença maternidade, as mamães ainda contam com a ajuda do Auxílio Creche e também os papais que possuem guarda unilateral ou compartilhada.Reconhecemos resultados: PPR-Participação nos Resultados do PicPay.#VemserPicpayLover #PicpayShow moreShow less",,On-site/Hybrid,https://www.linkedin.com/jobs-guest/jobs/api/jobPosting/4216721477,"Cientista de Dados Especialista - Prevenção à Fraude Sobre o PicPayCom mais de dez anos de história, o PicPay é um ecossistema completo de serviços financeiros e não-financeiros que tem como objetivo atender as necessidades diárias de milhares de pessoas e negócios, tornando-se a sua principal conta do dia a dia.Combinar tecnologias avançadas, modelos de Machine Learning e análises estatísticas para construir e aprimorar continuamente a estratégia de prevenção de fraudes transacionais no PicPayResponsabilidade e atribuições:Responsável por desenvolver e otimizar estratégias de prevenção de fraudes transacionais do PicPay, utilizando análise de dados, Machine Learning e tecnologias inovadoras. O profissional deverá analisar as causas centrais de problemas complexos, propor soluções eficazes e contribuir para o desenvolvimento técnico da equipe.Requisitos e qualificações:Experiência comprovada em prevenção de fraudes transacionais ou áreas de riscos.Domínio em análise de dados (SQL, Python ou similar) e análise estatística.Experiência prática com modelos de Machine Learning.Forte capacidade de análise crítica de dados e indicadores, identificando insights e oportunidades.Excelentes habilidades de comunicação e apresentação de dados (Storytelling).Proatividade, autonomia e atenção aos detalhes.Qualificações Desejáveis (Diferenciais):Experiência prévia em Fintech ou Meios de Pagamento;Experiência com plataformas de prevenção de fraudes;criação/gestão de regras de prevenção a fraude.O que oferecemos:Saúde e Bem-estarAssistência Médica e Odontológica;Seguro de Vida;Programa Lado a Lado, com apoio jurídico, social, psicológico e financeiro;TotalPass.Alimentação/ Mobilidade ou Teletrabalho:Cartão de crédito PicPay Benefícios, com ampla aceitação, onde você recebe seu saldo de Alimentação/Refeição e Mobilidade ou Teletrabalho (de acordo com o seu contrato de trabalho).Licença Paternidade e Maternidade:Licença Maternidade estendida de 6 meses, e de Paternidade também estendida de 20 dias.Programa ""Novo Ser"", que acompanha nossas mamães durante toda a gestação e no retorno da licença. Falando nisso, ao retornar da licença maternidade, as mamães ainda contam com a ajuda do Auxílio Creche e também os papais que possuem guarda unilateral ou compartilhada.Reconhecemos resultados: PPR-Participação nos Resultados do PicPay.#VemserPicpayLover #PicpayShow moreShow less",Não especificado,Não especificado,Não especificado,1
