title,company,location,posted,description,applicants,work_mode,link,data_coleta,titulo_descr,senioridade,idioma,certificado,cluster
Cientista de Dados Especialista - Precificação,Porto,"São Paulo, São Paulo, Brazil",4 days ago,"Descrição da vagaNossa área tem grande participação na precificação de todos os produtos de seguro auto da Vertical. Trabalhamos com grandes volumes de dados para desenvolver modelos estatísticos sofisticados, que nos permitem gerar as melhores estimativas de risco. Essas estimativas são essenciais para a definição de preços na rua e para a elaboração de relatórios internos estratégicos. Aqui, você terá a chance de impactar diretamente as decisões de negócio através da ciência de dados.Responsabilidades e atribuiçõesLiderar projetos e atividades de modelagem estatística, entendendo as necessidades dos clientes internos, definindo os objetivos de modelagem, identificando as melhores técnicas a serem utilizadas.Estar alinhado com as melhores práticas da atualidade e trazer benchmarks de inovação de outras áreas/mercados.Colaborar de perto com a equipe de Pricing para dar suporte na precificação de produtos de Automóvel;Pesquisar e aplicar novas métricas e técnicas de modelagem, mantendo nossos métodos sempre atualizados e eficazes;Certificar o ciclo de vida dos modelos, desde a concepção até a implementação, garantindo a correta aplicação e o sucesso das soluções.Requisitos e qualificaçõesPré requisito:Formação superior e desejável pós graduação em áreas como Estatística, Ciências Atuariais, Matemática ou áreas correlatas.Experiência sólida e conhecimento avançado em modelagem estatística e aprendizado de máquina;Conhecimento com linguagens de programação para análise de dados como Python e SQL;Excelentes habilidades de comunicação para apresentar ideias de forma clara e objetiva e interagir com diferentes públicos;Atitude colaborativa e capacidade de trabalhar em equipe em um ambiente dinâmico;Orientado para solução, capaz de identificar e implementar caminhos práticos e eficientes;Diferenciais:Conhecimento da área de seguros, experiência com ferramentas de precificação, conhecimento em GCPInformações adicionaisBENEFÍCIOSVale Alimentação e Refeição Flexíveis;Plano de Saúde;Plano Odontológico;Wellhub e TotalPass;Academia Bio Ritmo exclusiva para Colaboradores:no Complexo Matriz;Participação nos Lucros - PLR;Programa de Ações: Porto em Ação:complementar à PLR até 2025;Quadras de Areia e Poliesportiva:no Complexo Matriz;Vale-Transporte;Serviços de Transporte de Vans;disponibilizadas nas principais estações de acesso à Porto (Luz, Barra Funda, Santa Cecília e Júlio Prestes);Licença Parental Estendida:até 40 dias para todas as configurações familiares;Licença Maternidade Estendidade 6 meses.;Ambulatório Médico com Especialidades:no Complexo Matriz e Barra Funda;Auxílio creche ou babá;Seguro de Vida;Previdência Privada - PortoPrev;Desconto em Produtos e Serviços;Bolsa de estudos: Reembolso para graduação, pós ou MBA;Corridas mensais:subsídio para as principais corridas de ruas de São PauloReembolso para idiomas (inglês ou espanhol);Teatro Porto:sessões exclusivas para Colaboradores;Biblioteca;Sala de descanso:no completo MatrizSalão de jogos:no complexo MatrizServiços de massagem e podologia:no completo MatrizLocal de trabalho:HíbridosNa Porto, Você Importa!A Porto é muito mais que uma seguradora: é um ecossistema gigante que utiliza tecnologia para criar soluções, através de quatro verticais de negócio:Porto Bank, Porto Saúde, Porto Seguro e Porto Serviço.A reputação e o reconhecimento conquistados ao longo de mais de 7 décadas reforçam o tamanho da Porto, uma empresa referência em negócios, feita para e por pessoas.Aqui, bate no peito de 13 mil colaboradores oorgulho de fazer parte de uma organização sólida e ética,que transforma sonhos em realidades fantásticaspara os nossos mais de 15,8 milhões de clientes. São mais de 101 sucursais e escritórios regionais em todo o Brasil.O aprendizado faz parte do nosso DNA, e aqui, você teráincentivos, ferramentas e gente boa para você aprender e crescer, a cada dia,um ambiente de acolhimento e segurança, onde cada um possa ser e se orgulhar de quem se é, promovendo um espaço de respeito evivendo de forma integral e com bem-estar, em uma empresa genuinamente humana.DIVERSIDADE & INCLUSÃO NA PORTOAqui na Porto, valorizamos a diversidade e acreditamos que um time plural é imprescindível para o desenvolvimento de todo o nosso negócio, da sociedade, e de cada pessoa, pois entendemos que cada indivíduo é único na construção de um ambiente mais inovador e inclusivo. Juntos, trabalhamos diariamente para construirmos um espaço seguro, livre e acolhedor, com mais pluralidade e respeito. Por isso,incentivamos fortemente a inscrição de mulheres, de pessoas negras e indígenas, de pessoas com deficiência e de pessoas LGBTQIA+em todas as nossas vagas.Show moreShow less",,On-site/Hybrid,https://www.linkedin.com/jobs-guest/jobs/api/jobPosting/4314699155,2025-12-01,"Cientista de Dados Especialista - Precificação Descrição da vagaNossa área tem grande participação na precificação de todos os produtos de seguro auto da Vertical. Trabalhamos com grandes volumes de dados para desenvolver modelos estatísticos sofisticados, que nos permitem gerar as melhores estimativas de risco. Essas estimativas são essenciais para a definição de preços na rua e para a elaboração de relatórios internos estratégicos. Aqui, você terá a chance de impactar diretamente as decisões de negócio através da ciência de dados.Responsabilidades e atribuiçõesLiderar projetos e atividades de modelagem estatística, entendendo as necessidades dos clientes internos, definindo os objetivos de modelagem, identificando as melhores técnicas a serem utilizadas.Estar alinhado com as melhores práticas da atualidade e trazer benchmarks de inovação de outras áreas/mercados.Colaborar de perto com a equipe de Pricing para dar suporte na precificação de produtos de Automóvel;Pesquisar e aplicar novas métricas e técnicas de modelagem, mantendo nossos métodos sempre atualizados e eficazes;Certificar o ciclo de vida dos modelos, desde a concepção até a implementação, garantindo a correta aplicação e o sucesso das soluções.Requisitos e qualificaçõesPré requisito:Formação superior e desejável pós graduação em áreas como Estatística, Ciências Atuariais, Matemática ou áreas correlatas.Experiência sólida e conhecimento avançado em modelagem estatística e aprendizado de máquina;Conhecimento com linguagens de programação para análise de dados como Python e SQL;Excelentes habilidades de comunicação para apresentar ideias de forma clara e objetiva e interagir com diferentes públicos;Atitude colaborativa e capacidade de trabalhar em equipe em um ambiente dinâmico;Orientado para solução, capaz de identificar e implementar caminhos práticos e eficientes;Diferenciais:Conhecimento da área de seguros, experiência com ferramentas de precificação, conhecimento em GCPInformações adicionaisBENEFÍCIOSVale Alimentação e Refeição Flexíveis;Plano de Saúde;Plano Odontológico;Wellhub e TotalPass;Academia Bio Ritmo exclusiva para Colaboradores:no Complexo Matriz;Participação nos Lucros - PLR;Programa de Ações: Porto em Ação:complementar à PLR até 2025;Quadras de Areia e Poliesportiva:no Complexo Matriz;Vale-Transporte;Serviços de Transporte de Vans;disponibilizadas nas principais estações de acesso à Porto (Luz, Barra Funda, Santa Cecília e Júlio Prestes);Licença Parental Estendida:até 40 dias para todas as configurações familiares;Licença Maternidade Estendidade 6 meses.;Ambulatório Médico com Especialidades:no Complexo Matriz e Barra Funda;Auxílio creche ou babá;Seguro de Vida;Previdência Privada - PortoPrev;Desconto em Produtos e Serviços;Bolsa de estudos: Reembolso para graduação, pós ou MBA;Corridas mensais:subsídio para as principais corridas de ruas de São PauloReembolso para idiomas (inglês ou espanhol);Teatro Porto:sessões exclusivas para Colaboradores;Biblioteca;Sala de descanso:no completo MatrizSalão de jogos:no complexo MatrizServiços de massagem e podologia:no completo MatrizLocal de trabalho:HíbridosNa Porto, Você Importa!A Porto é muito mais que uma seguradora: é um ecossistema gigante que utiliza tecnologia para criar soluções, através de quatro verticais de negócio:Porto Bank, Porto Saúde, Porto Seguro e Porto Serviço.A reputação e o reconhecimento conquistados ao longo de mais de 7 décadas reforçam o tamanho da Porto, uma empresa referência em negócios, feita para e por pessoas.Aqui, bate no peito de 13 mil colaboradores oorgulho de fazer parte de uma organização sólida e ética,que transforma sonhos em realidades fantásticaspara os nossos mais de 15,8 milhões de clientes. São mais de 101 sucursais e escritórios regionais em todo o Brasil.O aprendizado faz parte do nosso DNA, e aqui, você teráincentivos, ferramentas e gente boa para você aprender e crescer, a cada dia,um ambiente de acolhimento e segurança, onde cada um possa ser e se orgulhar de quem se é, promovendo um espaço de respeito evivendo de forma integral e com bem-estar, em uma empresa genuinamente humana.DIVERSIDADE & INCLUSÃO NA PORTOAqui na Porto, valorizamos a diversidade e acreditamos que um time plural é imprescindível para o desenvolvimento de todo o nosso negócio, da sociedade, e de cada pessoa, pois entendemos que cada indivíduo é único na construção de um ambiente mais inovador e inclusivo. Juntos, trabalhamos diariamente para construirmos um espaço seguro, livre e acolhedor, com mais pluralidade e respeito. Por isso,incentivamos fortemente a inscrição de mulheres, de pessoas negras e indígenas, de pessoas com deficiência e de pessoas LGBTQIA+em todas as nossas vagas.Show moreShow less",Não especificado,Inglês,Google Cloud,3
Analista de Privacidade Sr - Seara,Seara,"São Paulo, São Paulo, Brazil",2 weeks ago,"Descrição da vagaContamos com um time que trabalha com disciplina, determinação e humildade e que reconhece seu papel como agente de transformação para gerar as mudanças que o mundo precisa, movidos pelo propósito de alimentar o mundo com o que há de melhor.Conheça Mais Sobre a SearaA Seara atua com mais de 95 mil colaboradores 👩‍🍳👨‍🍳, com um portfólio de produtos diversificado e marcas reconhecidas. É a maior produtora de frango do país 🐔.Líder no segmento de alimentos preparados e de carne suína 🐖, a Seara atende milhares de consumidores ao redor do mundo 🌐 e possui uma equipe dedicada de profissionais 👩🏭 que garantem a qualidade e a inovação de seus produtos.Algumas Curiosidades Sobre a SearaReconhecimento Global: A Seara é conhecida internacionalmente pela qualidade e sabor de seus produtos, oferecendo uma ampla gama de opções que vão desde carnes congeladas até pratos prontos e refeições práticas.Inovação no Segmento: A Seara está sempre inovando, desenvolvendo produtos que atendem às necessidades dos consumidores modernos, como opções saudáveis, práticas e deliciosas, incluindo a linha Seara Gourmet e Seara Nature.Práticas Sustentáveis: A Seara adota práticas sustentáveis em toda a sua cadeia produtiva, priorizando o bem-estar animal, a eficiência energética e a gestão responsável de recursos.Junte-se à nossa equipe e faça parte de uma história de sucesso e inovação na JBS!Responsabilidades e atribuiçõesGestão da Privacidade e Proteção de Dados;Governança de uso de IAAtuar na área de Segurança da Informação, em atividades relacionadas a privacidade e proteção de dados, gestão de riscos e governança de uso de IA;Mapear e revisar, junto as áreas de negócio, processos que envolvam tratamento de dados pessoais ou uso de inteligência artificial e administrar ferramenta de governança;Gestão de políticas, termos, manuais e conscientização dos colaboradores;Avaliar riscos de privacidade e segurança nos processos e nos tratos com terceiros, recomendando planos de ação. Avaliar cláusulas contratuais;Atuar na gestão de incidentes de privacidade e administrar ferramenta de prevenção de perda de dados;Atender as solicitações de titulares.Requisitos e qualificaçõesSuperior completo em TI ou Direito;Sólida atuação em privacidade e proteção de dados;Desejável que resida próximo;Será um diferencial ter conhecimentos sólidos em segurança da informação e certificação em privacidade e proteção de dados.Informações adicionais🕘 Horário de trabalho das 08:00 às 18:00 com 01:12 de almoço;🏢 Vaga 100% presencial - Marginal Direita do Tietê, 500;🍽 Vale-Refeição e Vale-Alimentação flexível - Picpay🍛 Restaurante no local🚌 Vale-Transporte🚘 Estacionamento gratuito❤ Sempre Cuida (Clínica Digital) -Plataforma de Teleatendimento em Saúde para cuidar do seu bem-estar, incluindo saúde mental, física, nutricional, entre outras.🏥 Assistência Médica/Odontológica e Seguro de Vida -Opcionais e por modelo de parcerias, garantindo cuidados com sua saúde.🏋 Wellhub (antigo Gympass) e/ou Total Pass -Convênio de academias para promover sua saúde e bem-estar físico.🏷 Descontos e promoções exclusivas para os colaboradores -Vantagens exclusivas para a compra de produtos e serviços.📚 Descontos em Instituições de Ensino e de Idiomas -Incentivos para seu desenvolvimento acadêmico e profissional.💵 Participação nos resultadosEtapas do processoCadastroEntrevista com o RH e GestorEntrevista com Diretor, Gerente e BPComitê de Seleção JBSExame MédicoContrataçãoShow moreShow less",,On-site/Hybrid,https://www.linkedin.com/jobs-guest/jobs/api/jobPosting/4315481601,2025-12-01,"Analista de Privacidade Sr - Seara Descrição da vagaContamos com um time que trabalha com disciplina, determinação e humildade e que reconhece seu papel como agente de transformação para gerar as mudanças que o mundo precisa, movidos pelo propósito de alimentar o mundo com o que há de melhor.Conheça Mais Sobre a SearaA Seara atua com mais de 95 mil colaboradores 👩‍🍳👨‍🍳, com um portfólio de produtos diversificado e marcas reconhecidas. É a maior produtora de frango do país 🐔.Líder no segmento de alimentos preparados e de carne suína 🐖, a Seara atende milhares de consumidores ao redor do mundo 🌐 e possui uma equipe dedicada de profissionais 👩🏭 que garantem a qualidade e a inovação de seus produtos.Algumas Curiosidades Sobre a SearaReconhecimento Global: A Seara é conhecida internacionalmente pela qualidade e sabor de seus produtos, oferecendo uma ampla gama de opções que vão desde carnes congeladas até pratos prontos e refeições práticas.Inovação no Segmento: A Seara está sempre inovando, desenvolvendo produtos que atendem às necessidades dos consumidores modernos, como opções saudáveis, práticas e deliciosas, incluindo a linha Seara Gourmet e Seara Nature.Práticas Sustentáveis: A Seara adota práticas sustentáveis em toda a sua cadeia produtiva, priorizando o bem-estar animal, a eficiência energética e a gestão responsável de recursos.Junte-se à nossa equipe e faça parte de uma história de sucesso e inovação na JBS!Responsabilidades e atribuiçõesGestão da Privacidade e Proteção de Dados;Governança de uso de IAAtuar na área de Segurança da Informação, em atividades relacionadas a privacidade e proteção de dados, gestão de riscos e governança de uso de IA;Mapear e revisar, junto as áreas de negócio, processos que envolvam tratamento de dados pessoais ou uso de inteligência artificial e administrar ferramenta de governança;Gestão de políticas, termos, manuais e conscientização dos colaboradores;Avaliar riscos de privacidade e segurança nos processos e nos tratos com terceiros, recomendando planos de ação. Avaliar cláusulas contratuais;Atuar na gestão de incidentes de privacidade e administrar ferramenta de prevenção de perda de dados;Atender as solicitações de titulares.Requisitos e qualificaçõesSuperior completo em TI ou Direito;Sólida atuação em privacidade e proteção de dados;Desejável que resida próximo;Será um diferencial ter conhecimentos sólidos em segurança da informação e certificação em privacidade e proteção de dados.Informações adicionais🕘 Horário de trabalho das 08:00 às 18:00 com 01:12 de almoço;🏢 Vaga 100% presencial - Marginal Direita do Tietê, 500;🍽 Vale-Refeição e Vale-Alimentação flexível - Picpay🍛 Restaurante no local🚌 Vale-Transporte🚘 Estacionamento gratuito❤ Sempre Cuida (Clínica Digital) -Plataforma de Teleatendimento em Saúde para cuidar do seu bem-estar, incluindo saúde mental, física, nutricional, entre outras.🏥 Assistência Médica/Odontológica e Seguro de Vida -Opcionais e por modelo de parcerias, garantindo cuidados com sua saúde.🏋 Wellhub (antigo Gympass) e/ou Total Pass -Convênio de academias para promover sua saúde e bem-estar físico.🏷 Descontos e promoções exclusivas para os colaboradores -Vantagens exclusivas para a compra de produtos e serviços.📚 Descontos em Instituições de Ensino e de Idiomas -Incentivos para seu desenvolvimento acadêmico e profissional.💵 Participação nos resultadosEtapas do processoCadastroEntrevista com o RH e GestorEntrevista com Diretor, Gerente e BPComitê de Seleção JBSExame MédicoContrataçãoShow moreShow less",Não especificado,Não especificado,Não especificado,3
Programa Philips Desenvolve 2026 - Estágio em Ciência de Dados,Philips,"Barueri, São Paulo, Brazil",1 day ago,"Job TitlePrograma Philips Desenvolve 2026 - Estágio em Ciência de DadosJob DescriptionEstágio em Suporte a VendasFaça parte do Programa de Estágio Philips Desenvolve 2026! Desenvolva-se em um ambiente global e inovador atuando em projetos que melhoram a saúde e bem-estar das pessoas.Oportunidade para atuar no com comissões apoiando o time de Excelência de Vendas.Sua funçãoSuportar na confecção de relatórios;Alinharmentos/interações com outros times (finanças, vendas...);Participação em reuniões;Auxiliar na gestão dos pagamentos;Auxiliar abertura de PR/PO no SAP.Apoiar no desenvolvimento de KPIs estratégicos, acompanhando metas e apoiando representantes comerciais com análises de treinamento e performance.Você é a Pessoa Certa SeEstiver cursando ensino superior em Ciência de Dados, Egenharia de dados, Administração, Ciências Contábeis, Econômia ou áreas afins;Possuir previsão de conclusão do curso a partir de Junho/2027;Possuir conhecimento em Inglês;Possuir conhecimento Avançado em Excel;Possui conhecimento em Power BI e/ou Looker Studio e/ou SQL e/oude conVBA e/ou Python será um diferencial;For uma pessoa proativa, dinâmica, comunicativa, organizada, que goste de interação com outras pessoas, que possua senso de urgência e interesse em aprender e se desenvolver.Como trabalhamos juntosAcreditamos que geramos um impacto maior quando estamos juntos do que separados. Para nossos membros da equipe do escritório, isso significa trabalhar de modo presencial ao menos três dias da semana, para colaborar e estabelecer ligações com os outros. Os cargos presenciais requerem a presença do colaborador o tempo inteiro nas instalações da empresa. Para os colaboradores que ocupam um cargo na área de campo, suas funções são desempenhadas de maneira mais eficaz fora das instalações da empresa, geralmente em instalações de clientes ou fornecedores.Esta função se trata de uma posição no escritório.Sobre a PhilipsSomos uma empresa de tecnologia em saúde. Nós criamos toda a nossa empresa com base na crença de que todos os seres humanos são importantes e não vamos parar até que todos, em todos os lugares, tenham acesso aos cuidados de saúde de qualidade que todos nós merecemos. Realize o trabalho da sua vida para ajudar a melhorar a vida dos outros.Saiba mais sobre nossos negócios.Descubra nossa história rica e emocionante.Saiba mais sobre o nosso objetivo.Se você estiver interessado nesta função e tiver muitas, mas não todas, as experiências necessárias, nós o encorajamos a se candidatar. Você ainda pode ser o candidato certo para esta ou outras oportunidades na Philips. Saiba mais sobre nosso compromisso com a diversidade e inclusãoaqui.Show moreShow less",,On-site/Hybrid,https://www.linkedin.com/jobs-guest/jobs/api/jobPosting/4305749272,2025-12-01,"Programa Philips Desenvolve 2026 - Estágio em Ciência de Dados Job TitlePrograma Philips Desenvolve 2026 - Estágio em Ciência de DadosJob DescriptionEstágio em Suporte a VendasFaça parte do Programa de Estágio Philips Desenvolve 2026! Desenvolva-se em um ambiente global e inovador atuando em projetos que melhoram a saúde e bem-estar das pessoas.Oportunidade para atuar no com comissões apoiando o time de Excelência de Vendas.Sua funçãoSuportar na confecção de relatórios;Alinharmentos/interações com outros times (finanças, vendas...);Participação em reuniões;Auxiliar na gestão dos pagamentos;Auxiliar abertura de PR/PO no SAP.Apoiar no desenvolvimento de KPIs estratégicos, acompanhando metas e apoiando representantes comerciais com análises de treinamento e performance.Você é a Pessoa Certa SeEstiver cursando ensino superior em Ciência de Dados, Egenharia de dados, Administração, Ciências Contábeis, Econômia ou áreas afins;Possuir previsão de conclusão do curso a partir de Junho/2027;Possuir conhecimento em Inglês;Possuir conhecimento Avançado em Excel;Possui conhecimento em Power BI e/ou Looker Studio e/ou SQL e/oude conVBA e/ou Python será um diferencial;For uma pessoa proativa, dinâmica, comunicativa, organizada, que goste de interação com outras pessoas, que possua senso de urgência e interesse em aprender e se desenvolver.Como trabalhamos juntosAcreditamos que geramos um impacto maior quando estamos juntos do que separados. Para nossos membros da equipe do escritório, isso significa trabalhar de modo presencial ao menos três dias da semana, para colaborar e estabelecer ligações com os outros. Os cargos presenciais requerem a presença do colaborador o tempo inteiro nas instalações da empresa. Para os colaboradores que ocupam um cargo na área de campo, suas funções são desempenhadas de maneira mais eficaz fora das instalações da empresa, geralmente em instalações de clientes ou fornecedores.Esta função se trata de uma posição no escritório.Sobre a PhilipsSomos uma empresa de tecnologia em saúde. Nós criamos toda a nossa empresa com base na crença de que todos os seres humanos são importantes e não vamos parar até que todos, em todos os lugares, tenham acesso aos cuidados de saúde de qualidade que todos nós merecemos. Realize o trabalho da sua vida para ajudar a melhorar a vida dos outros.Saiba mais sobre nossos negócios.Descubra nossa história rica e emocionante.Saiba mais sobre o nosso objetivo.Se você estiver interessado nesta função e tiver muitas, mas não todas, as experiências necessárias, nós o encorajamos a se candidatar. Você ainda pode ser o candidato certo para esta ou outras oportunidades na Philips. Saiba mais sobre nosso compromisso com a diversidade e inclusãoaqui.Show moreShow less",Não especificado,Inglês,Não especificado,4
