title,company,location,posted,description,applicants,work_mode,link,data_coleta,titulo_descr,senioridade,idioma,certificado,cluster
Estágio em Cientista de Dados - Vaga afirmativa para mulheres cis e trans,Artefact,"São Paulo, São Paulo, Brazil",2 weeks ago,"A abertura atual é para a Artefact do Brasil, estamos em modelo Free Office.Quem nós somosNós da Artefact LatAm acreditamos e vivemos uma cultura com base na empatia!Um ambiente de trabalho saudável é um lugar onde todas as vozes são ouvidas, respeitadas e valorizadas.Temos como nosso compromisso a construção de um ambiente mais diverso e inclusivo, porque a empatia é para todas as pessoas, independentemente de etnia, cor, gênero, orientação sexual, identidade de gênero, deficiência ou crença religiosa.Queremos conosco mentes e corações incríveis! Venha ser Artefact!O Que Você Estará FazendoVocê se juntará à nossa equipe de Dados e Consultoria, que ajuda os clientes a transformar e melhorar sua estratégia de dados aplicando análises avançadas para gerar insights que criam valor de negócio a partir de big data e inteligência artificial.Inovar. Você trabalhará com sua equipe, composta por consultores, cientistas de dados, e engenheiros, para identificar as necessidades dos clientes e definir soluções inovadoras.Aprender e Compartilhar. Você trabalhará em uma equipe colaborativa que promove o compartilhamento de conhecimento. Você aprenderá com outras pessoas, compartilhará conhecimento e ficará a par das novidades/atualizações do setor.Desenvolver. Você participará da solução do início ao fim. Com o auxílio de cientistas seniores você gerenciará a concepção e a implementação, além de otimizar o desempenho e a escalabilidade.Atuar em toda a cadeia de valor dos projetos (coleta e tratamento de dados, análise exploratória de dados, aplicação de modelos de aprendizado de máquina, produtização de modelos)Popularizar termos técnicos ou soluções para perfis mais orientados a negócios, pode trabalhar em uma equipe com perfis muito diversificadosPriorizar suas tarefas, respeitar prazos e se levantar a mão em caso de riscos ou problemasO Que Nós Estamos ProcurandoEstar cursando um curso de graduação em ciência de dados, aprendizado de máquina, matemática, ciência da computação, estatística, engenharia, economia ou uma área relacionada.Desejável um primeiro conhecimento em estatística e programação (Python/R).Curiosidade: você está sempre buscando soluções inovadoras para seus clientes, você está envolvido em toda a cadeia de valorColaboração: o compartilhamento de conhecimento é essencial para você e você participa ativamente da difusão de informações dentro da ArtefactEmpreendedorismo: você traz soluções, novas ideias, inovaçõesO que oferecemosVR/VTFree office (trabalhe de casa ou de onde quiser!)GympassSeguros: Vida, saúde e odontológicoEncontros Bimestrais (Famoso “Get Together” onde nos encontramos para estarmos juntos, com oficinas, palestras, treinamentos e aquele happy hour!)Woba (pode marcar para trabalhar em coworking onde quiser!)Avaliações semestrais (com oportunidade de promoção)Por que você deveria se juntar a nósArtefact é o lugar para estar: venha e construa o futuro da área de dadosProgresso: cada dia oferece novos desafios e novas oportunidades de aprenderCultura: Empatia e Colaboração está no nosso DNAEmpreendedorismo: você se juntará a uma equipe de empreendedores motivados. Não desistiremos até que façamos uma grande diferença nesta indústria!Junte-se a nós!Show moreShow less",,On-site/Hybrid,https://www.linkedin.com/jobs-guest/jobs/api/jobPosting/4308654572,2025-12-01,"Estágio em Cientista de Dados - Vaga afirmativa para mulheres cis e trans A abertura atual é para a Artefact do Brasil, estamos em modelo Free Office.Quem nós somosNós da Artefact LatAm acreditamos e vivemos uma cultura com base na empatia!Um ambiente de trabalho saudável é um lugar onde todas as vozes são ouvidas, respeitadas e valorizadas.Temos como nosso compromisso a construção de um ambiente mais diverso e inclusivo, porque a empatia é para todas as pessoas, independentemente de etnia, cor, gênero, orientação sexual, identidade de gênero, deficiência ou crença religiosa.Queremos conosco mentes e corações incríveis! Venha ser Artefact!O Que Você Estará FazendoVocê se juntará à nossa equipe de Dados e Consultoria, que ajuda os clientes a transformar e melhorar sua estratégia de dados aplicando análises avançadas para gerar insights que criam valor de negócio a partir de big data e inteligência artificial.Inovar. Você trabalhará com sua equipe, composta por consultores, cientistas de dados, e engenheiros, para identificar as necessidades dos clientes e definir soluções inovadoras.Aprender e Compartilhar. Você trabalhará em uma equipe colaborativa que promove o compartilhamento de conhecimento. Você aprenderá com outras pessoas, compartilhará conhecimento e ficará a par das novidades/atualizações do setor.Desenvolver. Você participará da solução do início ao fim. Com o auxílio de cientistas seniores você gerenciará a concepção e a implementação, além de otimizar o desempenho e a escalabilidade.Atuar em toda a cadeia de valor dos projetos (coleta e tratamento de dados, análise exploratória de dados, aplicação de modelos de aprendizado de máquina, produtização de modelos)Popularizar termos técnicos ou soluções para perfis mais orientados a negócios, pode trabalhar em uma equipe com perfis muito diversificadosPriorizar suas tarefas, respeitar prazos e se levantar a mão em caso de riscos ou problemasO Que Nós Estamos ProcurandoEstar cursando um curso de graduação em ciência de dados, aprendizado de máquina, matemática, ciência da computação, estatística, engenharia, economia ou uma área relacionada.Desejável um primeiro conhecimento em estatística e programação (Python/R).Curiosidade: você está sempre buscando soluções inovadoras para seus clientes, você está envolvido em toda a cadeia de valorColaboração: o compartilhamento de conhecimento é essencial para você e você participa ativamente da difusão de informações dentro da ArtefactEmpreendedorismo: você traz soluções, novas ideias, inovaçõesO que oferecemosVR/VTFree office (trabalhe de casa ou de onde quiser!)GympassSeguros: Vida, saúde e odontológicoEncontros Bimestrais (Famoso “Get Together” onde nos encontramos para estarmos juntos, com oficinas, palestras, treinamentos e aquele happy hour!)Woba (pode marcar para trabalhar em coworking onde quiser!)Avaliações semestrais (com oportunidade de promoção)Por que você deveria se juntar a nósArtefact é o lugar para estar: venha e construa o futuro da área de dadosProgresso: cada dia oferece novos desafios e novas oportunidades de aprenderCultura: Empatia e Colaboração está no nosso DNAEmpreendedorismo: você se juntará a uma equipe de empreendedores motivados. Não desistiremos até que façamos uma grande diferença nesta indústria!Junte-se a nós!Show moreShow less",Sênior,Não especificado,Não especificado,3
Data Scientist,Tata Consultancy Services,Greater São Paulo Area,3 weeks ago,"Venha para uma das maiores empresas de Serviços IT do mundo!! Aqui você pode transformar sua carreira!Por que fazer parte da TCS? Aqui na TCS acreditamos que as pessoas fazem a diferença, por isso vivemos uma cultura de aprendizado ilimitado cheio de oportunidades de melhorias e desenvolvimento mútuo. O cenário ideal para expandir ideias através das ferramentas certas, contribuindo para nosso sucesso num ambiente colaborativo.ProcuramosCientista de Dadosque queira aprender e transformar sua carreira.Nesta função você irá: (responsabilidades)DescriçãoCientista de Dados para atuar com Modelagem de Documentos e Visão ComputacionalDescrição da Vaga:Estamos em busca de um(a) Cientista de Dados com sólida experiência em Python e forte capacidade analítica para atuar em projetos voltados à identificação de padrões em documentos, com foco em canais físicos. O profissional selecionado será entrevistado pelo time de Gerência de Dados e trabalhará em colaboração com a comunidade de Cientistas de Dados da área.Responsabilidades:Desenvolver soluções em Python para análise e extração de informações de documentos.Aplicar técnicas de engenharia de prompts voltadas à identificação de padrões, com foco em IA não-generativa.Utilizar serviços baseados em LLMs (como ChatGPT ou similares) para apoiar tarefas de classificação e validação de dados.Avaliar a acuracidade de modelos de extração de dados, gerando métricas e estatísticas detalhadas.Construir gabaritos de validação a partir de massas de testes, verificando a precisão por campo (ex.: nome, CPF, número de documento).Garantir que os modelos atinjam níveis mínimos de acuracidade (ex.: 80% por campo).Contribuir com insights e melhorias contínuas junto ao time de dados e canais físicos.*Requisitos Técnicos: *Domínio da linguagem Python.Experiência com engenharia de prompts e visão computacional aplicada a documentos.Conhecimento em serviços de LLMs como ChatGPT, Claude, Mistral, entre outros.Capacidade de gerar e interpretar métricas de desempenho de modelos.Experiência em validação de dados extraídos de documentos oficiais (ex.: RG, CPF).Conhecimento em serviços da AWS (como S3, Lambda, SageMaker, entre outros).Habilidade para trabalhar em equipe multidisciplinar e comunicar resultados de forma clara.*Diferenciais: *Vivência prévia em ambiente Itaú ou conhecimento dos processos e padrões internos da instituição.*Cientista de Dados ou Engenheiro de Machine Learning*O que você pode esperar de nós?Desenvolvimento profissional e evolução constante das suas competências, sempre de acordo com os seus interesses.Oportunidades para trabalho fora do BrasilUm ambiente colaborativo, diverso e inovador, que incentiva o trabalho em equipe.O que oferecemos?Benefícios TCS – Brasil:Plano de SaúdePlano OdontológicoSeguro de VidaVale TransporteVale Refeição/AlimentaçãoAuxílio CrecheGympassTCS Cares – 0800 gratuito que fornece assistência psicológica (24 hrs/dia), jurídica, social e financeira aos associadosParceria com SESCReembolso de CertificaçõesPortal de aprendizagem gratuito da TCS – cursos online e treinamentos ao vivoOportunidade de experiência internacionalParceria de Descontos com Universidades e Escolas de IdiomasBring Your Buddy – Ao indicar pessoas você se torna elegível a receber um bônus para cada contrataçãoTCS Gems – Reconhecimento por performanceXcelerate – Plataforma de carreira com mentoria gratuitaNa TATA Consultancy Services promovemos uma cultura inclusiva, trabalhamos sempre pela equidade. Isso se aplica em Gênero, Pessoas com Deficiência, LGBTQIA+, Religião, Raça, Etnia, ou seja, todas as nossas oportunidades são trabalhadas com esses princípios. Pensamos em ações diversas de inclusão e de responsabilidade social, a fim de construir uma TCS que respeita a individualidade. Seja um TCSer!#BuildingonbeliefID: 10365659Show moreShow less",,On-site/Hybrid,https://www.linkedin.com/jobs-guest/jobs/api/jobPosting/4334736360,2025-12-01,"Data Scientist Venha para uma das maiores empresas de Serviços IT do mundo!! Aqui você pode transformar sua carreira!Por que fazer parte da TCS? Aqui na TCS acreditamos que as pessoas fazem a diferença, por isso vivemos uma cultura de aprendizado ilimitado cheio de oportunidades de melhorias e desenvolvimento mútuo. O cenário ideal para expandir ideias através das ferramentas certas, contribuindo para nosso sucesso num ambiente colaborativo.ProcuramosCientista de Dadosque queira aprender e transformar sua carreira.Nesta função você irá: (responsabilidades)DescriçãoCientista de Dados para atuar com Modelagem de Documentos e Visão ComputacionalDescrição da Vaga:Estamos em busca de um(a) Cientista de Dados com sólida experiência em Python e forte capacidade analítica para atuar em projetos voltados à identificação de padrões em documentos, com foco em canais físicos. O profissional selecionado será entrevistado pelo time de Gerência de Dados e trabalhará em colaboração com a comunidade de Cientistas de Dados da área.Responsabilidades:Desenvolver soluções em Python para análise e extração de informações de documentos.Aplicar técnicas de engenharia de prompts voltadas à identificação de padrões, com foco em IA não-generativa.Utilizar serviços baseados em LLMs (como ChatGPT ou similares) para apoiar tarefas de classificação e validação de dados.Avaliar a acuracidade de modelos de extração de dados, gerando métricas e estatísticas detalhadas.Construir gabaritos de validação a partir de massas de testes, verificando a precisão por campo (ex.: nome, CPF, número de documento).Garantir que os modelos atinjam níveis mínimos de acuracidade (ex.: 80% por campo).Contribuir com insights e melhorias contínuas junto ao time de dados e canais físicos.*Requisitos Técnicos: *Domínio da linguagem Python.Experiência com engenharia de prompts e visão computacional aplicada a documentos.Conhecimento em serviços de LLMs como ChatGPT, Claude, Mistral, entre outros.Capacidade de gerar e interpretar métricas de desempenho de modelos.Experiência em validação de dados extraídos de documentos oficiais (ex.: RG, CPF).Conhecimento em serviços da AWS (como S3, Lambda, SageMaker, entre outros).Habilidade para trabalhar em equipe multidisciplinar e comunicar resultados de forma clara.*Diferenciais: *Vivência prévia em ambiente Itaú ou conhecimento dos processos e padrões internos da instituição.*Cientista de Dados ou Engenheiro de Machine Learning*O que você pode esperar de nós?Desenvolvimento profissional e evolução constante das suas competências, sempre de acordo com os seus interesses.Oportunidades para trabalho fora do BrasilUm ambiente colaborativo, diverso e inovador, que incentiva o trabalho em equipe.O que oferecemos?Benefícios TCS – Brasil:Plano de SaúdePlano OdontológicoSeguro de VidaVale TransporteVale Refeição/AlimentaçãoAuxílio CrecheGympassTCS Cares – 0800 gratuito que fornece assistência psicológica (24 hrs/dia), jurídica, social e financeira aos associadosParceria com SESCReembolso de CertificaçõesPortal de aprendizagem gratuito da TCS – cursos online e treinamentos ao vivoOportunidade de experiência internacionalParceria de Descontos com Universidades e Escolas de IdiomasBring Your Buddy – Ao indicar pessoas você se torna elegível a receber um bônus para cada contrataçãoTCS Gems – Reconhecimento por performanceXcelerate – Plataforma de carreira com mentoria gratuitaNa TATA Consultancy Services promovemos uma cultura inclusiva, trabalhamos sempre pela equidade. Isso se aplica em Gênero, Pessoas com Deficiência, LGBTQIA+, Religião, Raça, Etnia, ou seja, todas as nossas oportunidades são trabalhadas com esses princípios. Pensamos em ações diversas de inclusão e de responsabilidade social, a fim de construir uma TCS que respeita a individualidade. Seja um TCSer!#BuildingonbeliefID: 10365659Show moreShow less",Não especificado,Não especificado,Amazon Web Service,4
"Cientista de Dados Sênior, Crédito [Remoto]",PicPay,"São Paulo, São Paulo, Brazil",1 week ago,"Sobre o PicPayCom mais de dez anos de história, o PicPay é um ecossistema completo de serviços financeiros e não-financeiros que tem como objetivo atender as necessidades diárias de milhares de pessoas e negócios, tornando-se a sua principal conta do dia a dia.Fundada em Vitória (ES), a empresa já conta com mais de 35 milhões de clientes ativos e faz parte do grupo J&F, um dos maiores conglomerados empresariais do Brasil. A companhia atua em diversas frentes, como Serviços Financeiros para Pessoa Física, Serviços Financeiros para Pessoa Jurídica, Investimentos e PicPay Shop.Pautados pela nossa cultura, seguimos no propósito de dar muito mais pique para a vida de milhões de brasileiros. Conheça nossos valores: Atitude de Dono(a), Disciplina, Determinação, Disponibilidade, Simplicidade, Humildade e Franqueza.O respeito, a ética, a busca pela equidade e a valorização da pluralidade são elementos inegociáveis e fazem parte da prática no nosso dia a dia aqui no PicPay. Por isso, esta vaga está aberta para todas as pessoas, independente de gênero, religião, etnia, deficiência, idade, orientação sexual ou qualquer outro fator.Sobre a vaga:Estamos em busca de umCientista de Dados Sêniorpara integrar nosso time deCrédito. Esse profissional será responsável pelo desenvolvimento de modelos estatísticos massificados que serão utilizados pelas políticas de crédito e na condução de estudos analíticos gerais. O profissional atuará de forma autônoma e colaborativa, focando prover soluções baseadas em dados/AI na tomada de decisões garantindo modelos de qualidade e consistentes. O ambiente é dinâmico e o profissional terá que se relacionar com áreas de engenharia e negócios no decorrer dos projetos.Responsabilidade e atribuições:Trabalhar com dados brutos, para desenvolver novas features e book de dados para uso em modelos e estudos;Desenvolver novos modelos de avaliação de risco e renda presumida;Participar da entrega de ponta a ponta: desde o entendimento das informações/necessidades junto ao time de políticas/negócios até os testes/aplicação dos modelos em estratégias de crédito em produção;Realizar homologações prévias de suas construções, assegurando os resultados esperados e alcançando a máxima velocidade na execução dos desenvolvimentos;Realizar estudos analíticos de comportamento de público, inadimplência, contratação;Identificar e atuar proativamente em melhorias de processos/desenvolvimentos e em novas metodologias analíticas.Requisitos e qualificações:Conhecimentos em modelagem geral: bancos, seguradoras, telecomms, varejo em geral etc;Experiência em Crédito (conhecimentos em Modelagem, Indicadores, Estratégias, Estudos Ad-hocs, etc.);Experiência com algoritmos de machine learning (árvores, ensemble models, redes neurais, etc)Experiência em programação com linguagens e experiência em manipulação de grandes volumes de dados (preferencialmente: python, pyspark, pandas e sql);Capacidade de traduzir dados em storytelling, um problema de negócios em análises e soluções técnicas/processuais;Ter boa base de estatística e matemática;Comunicação efetiva e gerenciamento eficaz do tempoColaboração e trabalho em equipe;Foco na melhoria contínua, com orientação para resultados.O que oferecemos:Saúde e Bem-estarAssistência Médica e Odontológica;Seguro de Vida;Programa Lado a Lado, com apoio jurídico, social, psicológico e financeiro;Wellhub.Alimentação/ Mobilidade ou Teletrabalho:Cartão de crédito PicPay Benefícios, com ampla aceitação, onde você recebe seu saldo de Alimentação/Refeição e Mobilidade ou Teletrabalho (de acordo com o seu contrato de trabalho).Licença Paternidade e Maternidade:Licença Maternidade estendida de 6 meses, e de Paternidade também estendida de 20 dias.Programa ""Novo Ser"", que acompanha nossas mamães durante toda a gestação e no retorno da licença. Falando nisso, ao retornar da licença maternidade, as mamães ainda contam com a ajuda do Auxílio Creche e também os papais que possuem guarda unilateral ou compartilhada.Reconhecemos resultados: PPR-Participação nos Resultados do PicPay.#VemserPicpayLover #PicpayShow moreShow less",,On-site/Hybrid,https://www.linkedin.com/jobs-guest/jobs/api/jobPosting/4332487879,2025-12-01,"Cientista de Dados Sênior, Crédito [Remoto] Sobre o PicPayCom mais de dez anos de história, o PicPay é um ecossistema completo de serviços financeiros e não-financeiros que tem como objetivo atender as necessidades diárias de milhares de pessoas e negócios, tornando-se a sua principal conta do dia a dia.Fundada em Vitória (ES), a empresa já conta com mais de 35 milhões de clientes ativos e faz parte do grupo J&F, um dos maiores conglomerados empresariais do Brasil. A companhia atua em diversas frentes, como Serviços Financeiros para Pessoa Física, Serviços Financeiros para Pessoa Jurídica, Investimentos e PicPay Shop.Pautados pela nossa cultura, seguimos no propósito de dar muito mais pique para a vida de milhões de brasileiros. Conheça nossos valores: Atitude de Dono(a), Disciplina, Determinação, Disponibilidade, Simplicidade, Humildade e Franqueza.O respeito, a ética, a busca pela equidade e a valorização da pluralidade são elementos inegociáveis e fazem parte da prática no nosso dia a dia aqui no PicPay. Por isso, esta vaga está aberta para todas as pessoas, independente de gênero, religião, etnia, deficiência, idade, orientação sexual ou qualquer outro fator.Sobre a vaga:Estamos em busca de umCientista de Dados Sêniorpara integrar nosso time deCrédito. Esse profissional será responsável pelo desenvolvimento de modelos estatísticos massificados que serão utilizados pelas políticas de crédito e na condução de estudos analíticos gerais. O profissional atuará de forma autônoma e colaborativa, focando prover soluções baseadas em dados/AI na tomada de decisões garantindo modelos de qualidade e consistentes. O ambiente é dinâmico e o profissional terá que se relacionar com áreas de engenharia e negócios no decorrer dos projetos.Responsabilidade e atribuições:Trabalhar com dados brutos, para desenvolver novas features e book de dados para uso em modelos e estudos;Desenvolver novos modelos de avaliação de risco e renda presumida;Participar da entrega de ponta a ponta: desde o entendimento das informações/necessidades junto ao time de políticas/negócios até os testes/aplicação dos modelos em estratégias de crédito em produção;Realizar homologações prévias de suas construções, assegurando os resultados esperados e alcançando a máxima velocidade na execução dos desenvolvimentos;Realizar estudos analíticos de comportamento de público, inadimplência, contratação;Identificar e atuar proativamente em melhorias de processos/desenvolvimentos e em novas metodologias analíticas.Requisitos e qualificações:Conhecimentos em modelagem geral: bancos, seguradoras, telecomms, varejo em geral etc;Experiência em Crédito (conhecimentos em Modelagem, Indicadores, Estratégias, Estudos Ad-hocs, etc.);Experiência com algoritmos de machine learning (árvores, ensemble models, redes neurais, etc)Experiência em programação com linguagens e experiência em manipulação de grandes volumes de dados (preferencialmente: python, pyspark, pandas e sql);Capacidade de traduzir dados em storytelling, um problema de negócios em análises e soluções técnicas/processuais;Ter boa base de estatística e matemática;Comunicação efetiva e gerenciamento eficaz do tempoColaboração e trabalho em equipe;Foco na melhoria contínua, com orientação para resultados.O que oferecemos:Saúde e Bem-estarAssistência Médica e Odontológica;Seguro de Vida;Programa Lado a Lado, com apoio jurídico, social, psicológico e financeiro;Wellhub.Alimentação/ Mobilidade ou Teletrabalho:Cartão de crédito PicPay Benefícios, com ampla aceitação, onde você recebe seu saldo de Alimentação/Refeição e Mobilidade ou Teletrabalho (de acordo com o seu contrato de trabalho).Licença Paternidade e Maternidade:Licença Maternidade estendida de 6 meses, e de Paternidade também estendida de 20 dias.Programa ""Novo Ser"", que acompanha nossas mamães durante toda a gestação e no retorno da licença. Falando nisso, ao retornar da licença maternidade, as mamães ainda contam com a ajuda do Auxílio Creche e também os papais que possuem guarda unilateral ou compartilhada.Reconhecemos resultados: PPR-Participação nos Resultados do PicPay.#VemserPicpayLover #PicpayShow moreShow less",Sênior,Não especificado,Não especificado,3
