title,company,location,posted,description,applicants,work_mode,link,data_coleta,titulo_descr,senioridade,idioma,certificado,cluster
Data Scientist I,Banco Bradesco,"Osasco, São Paulo, Brazil",4 days ago,"Sobre o BradescoO Bradesco é um dos maiores grupos financeiros do Brasil, com uma história marcada pelo pioneirismo e inovação. Por meio da nossa carteira amplamente diversificada de produtos financeiros, serviços bancários e de seguros contribuímos com a realização das pessoas e o crescimento sustentável de empresas e sociedade. Venha fazer parte do nosso ecossistema financeiro e impactar a experiência de milhões de pessoas!No Bradesco valorizamos a diversidade em todas as suas formas. Por isso, as nossas vagas são abertas a todas as pessoas, independentemente de gênero, raça, orientação sexual, deficiência, idade ou qualquer outra característica.Saiba mais em https://banco.bradesco/html/classic/sobre/index.shtmResponsabilidades e atribuiçõesO que é o nosso time de Ouvidoria?Transformamos a experiência do cliente em melhorias que impactem a organização e a sociedade de forma sustentável.Modelo de trabalho : Híbrido - 3X PresencialUnidade: Osasco - SPComo será seu dia a dia?Sendo Data Scientist I, atuará na gerência Inteligência Competitiva e Sistemas e suas principais atividades serão:Estudar bases de dados da ouvidoria e do banco.Buscar oportunidades preditivas para evitar reclamações.Gerar insights para melhoria de produtos e serviços.Explorar dados estruturados e não estruturados com apoio de ferramentas como Python, SQL, SAS e Databricks.Requisitos e QualificaçõesO que você precisa ter ou saber?Ensino superior completo ou cursando em Estatística, Matemática, Física, Engenharias, Administração, Economia, Sistemas, Tecnologia ou áreas correlatas.Conhecimento em Python, SQL, SAS ou DatabricksVivência com modelagem estatística e análise de dados.Será um diferencial se você tiver:Vivência com dados de ouvidoria ou tratativas de reclamações.O que nós oferecemosNo Bradesco valorizamos a saúde e bem-estar, oferecendo um extenso portfólio de benefícios a todas nossas pessoas funcionárias:PLR ou Bônus: Conforme a elegibilidade de cargo*Convênio MédicoConvênio OdontológicoSeguro de VidaVale AlimentaçãoVale Refeição13º Cesta AlimentaçãoTotal PassVale Transporte (adesão opcional)Descontos em produtos e serviços em empresas parceirasPrevidência Privada (adesão opcional, com participação financeira da Organização Bradesco)Viva Bem Bradesco: programa de saúde, bem-estar e qualidade de vidaUnibrad: Universidade Corporativa BradescoIsenção de Tarifas: condições especiais em diversos produtos e serviçosAuxílio Creche ou BabáLicença Paternidade estendida de 20 diasLicença Maternidade de 180 dias, acompanhamento assistencial da gestação até o pós-partoShow moreShow less",,On-site/Hybrid,https://www.linkedin.com/jobs-guest/jobs/api/jobPosting/4314681574,2025-10-19,"Data Scientist I Sobre o BradescoO Bradesco é um dos maiores grupos financeiros do Brasil, com uma história marcada pelo pioneirismo e inovação. Por meio da nossa carteira amplamente diversificada de produtos financeiros, serviços bancários e de seguros contribuímos com a realização das pessoas e o crescimento sustentável de empresas e sociedade. Venha fazer parte do nosso ecossistema financeiro e impactar a experiência de milhões de pessoas!No Bradesco valorizamos a diversidade em todas as suas formas. Por isso, as nossas vagas são abertas a todas as pessoas, independentemente de gênero, raça, orientação sexual, deficiência, idade ou qualquer outra característica.Saiba mais em https://banco.bradesco/html/classic/sobre/index.shtmResponsabilidades e atribuiçõesO que é o nosso time de Ouvidoria?Transformamos a experiência do cliente em melhorias que impactem a organização e a sociedade de forma sustentável.Modelo de trabalho : Híbrido - 3X PresencialUnidade: Osasco - SPComo será seu dia a dia?Sendo Data Scientist I, atuará na gerência Inteligência Competitiva e Sistemas e suas principais atividades serão:Estudar bases de dados da ouvidoria e do banco.Buscar oportunidades preditivas para evitar reclamações.Gerar insights para melhoria de produtos e serviços.Explorar dados estruturados e não estruturados com apoio de ferramentas como Python, SQL, SAS e Databricks.Requisitos e QualificaçõesO que você precisa ter ou saber?Ensino superior completo ou cursando em Estatística, Matemática, Física, Engenharias, Administração, Economia, Sistemas, Tecnologia ou áreas correlatas.Conhecimento em Python, SQL, SAS ou DatabricksVivência com modelagem estatística e análise de dados.Será um diferencial se você tiver:Vivência com dados de ouvidoria ou tratativas de reclamações.O que nós oferecemosNo Bradesco valorizamos a saúde e bem-estar, oferecendo um extenso portfólio de benefícios a todas nossas pessoas funcionárias:PLR ou Bônus: Conforme a elegibilidade de cargo*Convênio MédicoConvênio OdontológicoSeguro de VidaVale AlimentaçãoVale Refeição13º Cesta AlimentaçãoTotal PassVale Transporte (adesão opcional)Descontos em produtos e serviços em empresas parceirasPrevidência Privada (adesão opcional, com participação financeira da Organização Bradesco)Viva Bem Bradesco: programa de saúde, bem-estar e qualidade de vidaUnibrad: Universidade Corporativa BradescoIsenção de Tarifas: condições especiais em diversos produtos e serviçosAuxílio Creche ou BabáLicença Paternidade estendida de 20 diasLicença Maternidade de 180 dias, acompanhamento assistencial da gestação até o pós-partoShow moreShow less",Não especificado,Não especificado,Não especificado,4
Cientista de Dados Jr.,UOL,"São Paulo, São Paulo, Brazil",1 day ago,"Responsabilidades e atribuiçõesModelar e analisar grandes volumes de dados transacionais para identificar padrões, tendências e oportunidades de melhoria nos processos.Criar relatórios e apresentações para divulgar os resultados dos estudos para stakeholdersTrabalhar em colaboração com equipes de engenharia, produto e negócios para definir e implementar soluções de dados que atendam às necessidades do cliente e da empresa.Monitorar os resultados de modelos de machine learning em produção, garantindo sua robustez e precisão ao longo do tempo.Fornecer insights de maneira clara para stakeholders não técnicos, ajudando na tomada de decisões estratégicas.Requisitos e qualificaçõesSuperior completo em Ciências da Computação, Engenharia, Matemática, Estatística ou áreas relacionadas.Experiência com análise de grande volume de dadosExperiência em modelagem de dados para a otimização de análises.Experiência com ferramentas de análise de dados e programação como SQL, R e PythonConhecimento dos métodos estatísticos e técnicas de machine learning, incluindo regressão, árvores de decisão, redes neurais, clustering, etc. é um diferencial.Diferencial:Conhecimento de Bibliotecas de machine learning (TensorFlow, PyTorch, Scikit-Learn, etc.).Habilidade para resolver problemas complexos de maneira criativa e inovadora.Habilidades de comunicação e capacidade de trabalhar de forma colaborativa.Show moreShow less",,On-site/Hybrid,https://www.linkedin.com/jobs-guest/jobs/api/jobPosting/4313390052,2025-10-19,"Cientista de Dados Jr. Responsabilidades e atribuiçõesModelar e analisar grandes volumes de dados transacionais para identificar padrões, tendências e oportunidades de melhoria nos processos.Criar relatórios e apresentações para divulgar os resultados dos estudos para stakeholdersTrabalhar em colaboração com equipes de engenharia, produto e negócios para definir e implementar soluções de dados que atendam às necessidades do cliente e da empresa.Monitorar os resultados de modelos de machine learning em produção, garantindo sua robustez e precisão ao longo do tempo.Fornecer insights de maneira clara para stakeholders não técnicos, ajudando na tomada de decisões estratégicas.Requisitos e qualificaçõesSuperior completo em Ciências da Computação, Engenharia, Matemática, Estatística ou áreas relacionadas.Experiência com análise de grande volume de dadosExperiência em modelagem de dados para a otimização de análises.Experiência com ferramentas de análise de dados e programação como SQL, R e PythonConhecimento dos métodos estatísticos e técnicas de machine learning, incluindo regressão, árvores de decisão, redes neurais, clustering, etc. é um diferencial.Diferencial:Conhecimento de Bibliotecas de machine learning (TensorFlow, PyTorch, Scikit-Learn, etc.).Habilidade para resolver problemas complexos de maneira criativa e inovadora.Habilidades de comunicação e capacidade de trabalhar de forma colaborativa.Show moreShow less",Não especificado,Não especificado,Não especificado,1
Cientista de Dados Junior,EY,"São Paulo, São Paulo, Brazil",3 days ago,"A EY é líder global em serviços de Auditoria, Impostos, Transações Corporativas e Consultoria. Desenvolvemos líderes de excelência e, unidos por valores pautados pela ética e pelo compromisso constante com a qualidade, contribuímos para gerar confiança no mercado de capitais e em economias em todo o mundo. Dessa forma, exercemos um papel crítico na construção de um mundo de negócios melhor para nossos profissionais, nossos clientes e nossas comunidades.Quase 35.000 profissionais especializados em atender a indústria financeira em todo o mundo, prestam serviços de auditoria, impostos, transações e assessoria empresarial para bancos, seguradoras e gestoras de patrimônio. Nas Américas, é a única organização de contabilidade pública com uma unidade de negócios dedicada a este mercado. A EY é líder em servir o mercado global de serviços financeiros.O Financial Services Office hoje inclui mais de 4.000 profissionais em 50 localidades por todo EUA, Caribe e América Latina, com especializações que nos permite obter uma compreensão ampla das questões de negócios e dos desafios do setor financeiro, bem como oferecer serviços integrados para nossos clientes. No Brasil atuam junto aos principais centros mundiais para compartilhar conhecimento relacionado às tendências e regulamentações atuais e emergentes, a fim de ajudar nossos clientes a resolver questões fundamentais em gestão de riscos, controles internos, estratégia, operações e tecnologia da informação.Este grupo de profissionais, dinâmico e talentoso, busca neste momento o candidato certo para integrar o time e desenvolver uma carreira sólida e ascendente.Sabemos que carreiras podem ser tão diferentes quanto as próprias pessoas. Por isso, na EY, você terá a liberdade, as ferramentas e as condições para se desenvolver e construir uma carreira tão única quanto você.Em Tech Financial Services (Tech FSO), estamos construindo um mundo de negócios melhor apoiando as necessidades e desafios tecnológicos dos nossos clientes do segmento financeiro (Mercado de Capitais, Bancos, Fintechs, Seguros e Gestão de Ativos). Entregamos soluções sob medida com base nas necessidades específicas de cada negócio, a partir de uma equipe multidisciplinar de especialistas com diferentes perfis, como especialistas em Dados, UX, até analistas de negócios e scrum masters.TechEYQual será o seu papel nesse propósito?Como Cientista de Dados Junior você irá atuar em cliente de grande porte, com oportunidade de crescimento em frentes diversas na área de dados voltados para o segmento financeiro. Você poderá contar com ferramentas, conhecimentos e oportunidades para avançar e estar pronto/a para construir um mundo de negócios melhor para nossas pessoas, clientes e as comunidades que nos apoiam.Poderá atuar diretamente com as tecnologias mais avançadas de IA Generativa e LLMs (como GPT, LLaMA e Mistral). Ambiente inovador, com forte incentivo à pesquisa aplicada e experimentação em IA. Terá oportunidade de participar do desenvolvimento de soluções reais e escaláveis. Cultura colaborativa e times multidisciplinares. Possibilidade de crescimento acelerado e envolvimento em projetos estratégicos de alto impacto.Por que você?Se você é apaixonado(a) por dados, colaboração e tem as seguintes qualificações, queremos você em nossa equipe:Formação completa nas áreas de Tecnologia, Matemática, Estatística, Economia, Administração, Engenharias e ou correlatas;Ampla experiência em Python, especialmente para aplicações de IA. Domínio de frameworks de LLMs (ex: Transformers, HuggingFace, LangChain, OpenAI API);Proficiência com pipelines de dados, ETL, Apache NiFi, Apache Kafka. Prática com versionamento de código (ex: Git), testes automatizados e programação orientada a objetos;Vivência com integração entre sistemas via APIs ou mensagens. Prompt engineering e fine-tuning de modelos;Inglês intermediário/avançado para leitura técnica e ferramentas.Desejável - Serão considerados diferenciais:Experiência prática em projetos de IA ou Data Science, preferencialmente em empresas do setor financeiro, como bancos e seguradoras, tecnologia, consultorias ou startups;Atuação em ambientes cloud (AWS, Azure, GCP) e participação em comunidades ou projetos open source de IA.Familiaridade com publicações, artigos, ou apresentações em eventos de tecnologia.Experiência prévia com validação humana de modelos (human-in-the-loop).Certificações em Data Science (ex: IBM Data Science, AWS Certified Machine Learning, Google Professional Data Engineer), ou cursos reconhecidos em Machine Learning, IA ou Big Data.Principais Responsabilidades:Como Cientista de Dados você atuará na evolução de modelos baseados em LLMs, desde o prompt engineering até a implantação em produção;Será responsável por criar, manter e otimizar pipelines de dados utilizando ferramentas de mercado (NiFi, Kafka);Irá automatizar processos de ETL e integração entre sistemas;Irá garantir a qualidade, versionamento e testabilidade das soluções desenvolvidas e atuar de forma colaborativa com equipes multidisciplinares.Oportunidade disponível em modelo presencial (com flexibilidade para o remoto) nos escritórios da EY Brasil.O que oferecemos:Vale Alimentação, Vale Refeição, Vale Transporte, Plano de saúde, Assistência odontológica, Universidade Corporativa e outros benefícios Educacionais, Gympass, PLR, e muito mais. Clique aqui e conheça nosso universo debenefícios.Quem somos: Somos uma das maiores empresas de serviços do mundo, em Auditoria, Consultoria, Impostos, Estratégia e Transações, orientados à Tecnologia. Com presença em mais de 150 países, aqui você terá a oportunidade de viver as experiências excepcionais que só a EY pode oferecer, com alcance global, cultura inclusiva e tecnologia para se tornar a sua melhor versão.Aqui, acreditamos que a força que impulsiona a inovação vem da diversidade de pessoas e ideias. Segundo o Great Place to Work 2022, somos a melhor empresa para pessoas LGBTQ+ do Brasil, e a 2a melhor empresa para Mulheres e para Pessoas Pretas. Assim, você poderá fazer parte de nossos programas e grupos que, juntos a inúmeras iniciativas internas, apoiam nossa constante busca pela equidade.Quer se sentir desafiado/a, motivado/a e valorizado/a todos os dias? Inspirar mudanças e deixar um legado?Faça parte do nosso time e ajude-nos na construção de um mundo de negócios melhor!Saiba mais sobre como é trabalhar na EY:Carreiras na EY LinkedIn @EY Instagram @eybrasilcarreirasA EY acredita na igualdade de oportunidades. Independentemente de gênero, idade, raça, cor, credo, orientação sexual e deficiência, todos os candidatos qualificados serão considerados em nossos processos.Show moreShow less",,On-site/Hybrid,https://www.linkedin.com/jobs-guest/jobs/api/jobPosting/4315011873,2025-10-19,"Cientista de Dados Junior A EY é líder global em serviços de Auditoria, Impostos, Transações Corporativas e Consultoria. Desenvolvemos líderes de excelência e, unidos por valores pautados pela ética e pelo compromisso constante com a qualidade, contribuímos para gerar confiança no mercado de capitais e em economias em todo o mundo. Dessa forma, exercemos um papel crítico na construção de um mundo de negócios melhor para nossos profissionais, nossos clientes e nossas comunidades.Quase 35.000 profissionais especializados em atender a indústria financeira em todo o mundo, prestam serviços de auditoria, impostos, transações e assessoria empresarial para bancos, seguradoras e gestoras de patrimônio. Nas Américas, é a única organização de contabilidade pública com uma unidade de negócios dedicada a este mercado. A EY é líder em servir o mercado global de serviços financeiros.O Financial Services Office hoje inclui mais de 4.000 profissionais em 50 localidades por todo EUA, Caribe e América Latina, com especializações que nos permite obter uma compreensão ampla das questões de negócios e dos desafios do setor financeiro, bem como oferecer serviços integrados para nossos clientes. No Brasil atuam junto aos principais centros mundiais para compartilhar conhecimento relacionado às tendências e regulamentações atuais e emergentes, a fim de ajudar nossos clientes a resolver questões fundamentais em gestão de riscos, controles internos, estratégia, operações e tecnologia da informação.Este grupo de profissionais, dinâmico e talentoso, busca neste momento o candidato certo para integrar o time e desenvolver uma carreira sólida e ascendente.Sabemos que carreiras podem ser tão diferentes quanto as próprias pessoas. Por isso, na EY, você terá a liberdade, as ferramentas e as condições para se desenvolver e construir uma carreira tão única quanto você.Em Tech Financial Services (Tech FSO), estamos construindo um mundo de negócios melhor apoiando as necessidades e desafios tecnológicos dos nossos clientes do segmento financeiro (Mercado de Capitais, Bancos, Fintechs, Seguros e Gestão de Ativos). Entregamos soluções sob medida com base nas necessidades específicas de cada negócio, a partir de uma equipe multidisciplinar de especialistas com diferentes perfis, como especialistas em Dados, UX, até analistas de negócios e scrum masters.TechEYQual será o seu papel nesse propósito?Como Cientista de Dados Junior você irá atuar em cliente de grande porte, com oportunidade de crescimento em frentes diversas na área de dados voltados para o segmento financeiro. Você poderá contar com ferramentas, conhecimentos e oportunidades para avançar e estar pronto/a para construir um mundo de negócios melhor para nossas pessoas, clientes e as comunidades que nos apoiam.Poderá atuar diretamente com as tecnologias mais avançadas de IA Generativa e LLMs (como GPT, LLaMA e Mistral). Ambiente inovador, com forte incentivo à pesquisa aplicada e experimentação em IA. Terá oportunidade de participar do desenvolvimento de soluções reais e escaláveis. Cultura colaborativa e times multidisciplinares. Possibilidade de crescimento acelerado e envolvimento em projetos estratégicos de alto impacto.Por que você?Se você é apaixonado(a) por dados, colaboração e tem as seguintes qualificações, queremos você em nossa equipe:Formação completa nas áreas de Tecnologia, Matemática, Estatística, Economia, Administração, Engenharias e ou correlatas;Ampla experiência em Python, especialmente para aplicações de IA. Domínio de frameworks de LLMs (ex: Transformers, HuggingFace, LangChain, OpenAI API);Proficiência com pipelines de dados, ETL, Apache NiFi, Apache Kafka. Prática com versionamento de código (ex: Git), testes automatizados e programação orientada a objetos;Vivência com integração entre sistemas via APIs ou mensagens. Prompt engineering e fine-tuning de modelos;Inglês intermediário/avançado para leitura técnica e ferramentas.Desejável - Serão considerados diferenciais:Experiência prática em projetos de IA ou Data Science, preferencialmente em empresas do setor financeiro, como bancos e seguradoras, tecnologia, consultorias ou startups;Atuação em ambientes cloud (AWS, Azure, GCP) e participação em comunidades ou projetos open source de IA.Familiaridade com publicações, artigos, ou apresentações em eventos de tecnologia.Experiência prévia com validação humana de modelos (human-in-the-loop).Certificações em Data Science (ex: IBM Data Science, AWS Certified Machine Learning, Google Professional Data Engineer), ou cursos reconhecidos em Machine Learning, IA ou Big Data.Principais Responsabilidades:Como Cientista de Dados você atuará na evolução de modelos baseados em LLMs, desde o prompt engineering até a implantação em produção;Será responsável por criar, manter e otimizar pipelines de dados utilizando ferramentas de mercado (NiFi, Kafka);Irá automatizar processos de ETL e integração entre sistemas;Irá garantir a qualidade, versionamento e testabilidade das soluções desenvolvidas e atuar de forma colaborativa com equipes multidisciplinares.Oportunidade disponível em modelo presencial (com flexibilidade para o remoto) nos escritórios da EY Brasil.O que oferecemos:Vale Alimentação, Vale Refeição, Vale Transporte, Plano de saúde, Assistência odontológica, Universidade Corporativa e outros benefícios Educacionais, Gympass, PLR, e muito mais. Clique aqui e conheça nosso universo debenefícios.Quem somos: Somos uma das maiores empresas de serviços do mundo, em Auditoria, Consultoria, Impostos, Estratégia e Transações, orientados à Tecnologia. Com presença em mais de 150 países, aqui você terá a oportunidade de viver as experiências excepcionais que só a EY pode oferecer, com alcance global, cultura inclusiva e tecnologia para se tornar a sua melhor versão.Aqui, acreditamos que a força que impulsiona a inovação vem da diversidade de pessoas e ideias. Segundo o Great Place to Work 2022, somos a melhor empresa para pessoas LGBTQ+ do Brasil, e a 2a melhor empresa para Mulheres e para Pessoas Pretas. Assim, você poderá fazer parte de nossos programas e grupos que, juntos a inúmeras iniciativas internas, apoiam nossa constante busca pela equidade.Quer se sentir desafiado/a, motivado/a e valorizado/a todos os dias? Inspirar mudanças e deixar um legado?Faça parte do nosso time e ajude-nos na construção de um mundo de negócios melhor!Saiba mais sobre como é trabalhar na EY:Carreiras na EY LinkedIn @EY Instagram @eybrasilcarreirasA EY acredita na igualdade de oportunidades. Independentemente de gênero, idade, raça, cor, credo, orientação sexual e deficiência, todos os candidatos qualificados serão considerados em nossos processos.Show moreShow less",Júnior,Inglês,Microsoft Azure,2
