title,company,location,posted,description,applicants,work_mode,link,data_coleta,titulo_descr,senioridade,idioma,certificado,cluster
CIENTISTA DE DADOS SR - SP,Icomon Tecnologia Ltda,"São Paulo, São Paulo, Brazil",1 week ago,"A Icomon Tecnologia Ltda. está há mais de 30 anos realizando projetos de implantação e manutenção de infraestrutura no país. A Icomon atua para as principais operadoras e prestadoras de serviços do segmento de telecom e detém a maior parte das operações na região metropolitana de São Paulo. Além disso, a empresa está em constante evolução e sempre em busca de novas tecnologias para otimizar os processos, oferecendo as melhores soluções do mercado. CLIMA ORGANIZACIONAL A Icomon oferece programas e benefícios focados na atração de talentos, retenção e à motivação de seu público interno. Além disso, a empresa possui canais de comunicação interna, que proporcionam a atualização e interação dos colaboradores. A Icomon também atua com programas de flexibilização de trabalho, que englobam banco de horas e home office. A opinião de nossos colaboradores é coletada por meio do nosso Canal de Apoio ao Colaborador Icomon e através do Mapeamento de Cultura que realizamos na empresa. Planos de ação são elaborados e executados para garantir nosso clima de acolhida e de satisfação em fazer parte da nossa equipe. DIVERSIDADE A empresa conta com um ambiente organizacional inclusivo, reunindo diferentes perfis e estilos profissionais para atuarem frente aos constantes desafios do dia a dia. A multiplicidade faz parte do DNA da Icomon, com diferentes visões de mundo e estilos de liderança, que valorizam a inclusão social e a equidade de gênero. CARREIRA E DESENVOLVIMENTO A ICOMON tem como princípio apoiar a formação e o desenvolvimento de seus colaboradores (funcionários) com grande amplitude em seus Programas.Responsabilidades e atribuiçõesEntender problemas de negócio, formular hipóteses e definir métricas de sucesso.Conduz projetos ponta a ponta.Explorar dados, criar features e selecionar algoritmos apropriados.Desenvolver, validar e comparar modelos e medir impacto offline/online.Desenhar e analisar experimentos (A/B/n, amostragem, poder estatístico, causalidade quando aplicável).Construir pipelines reprodutíveis e versionados (treino, inferência, monitoramento, retraining).monitorar performance, drift de dados/targets, custo, fairness e estabilidade.Documentar datasets, features, modelos e decisões; comunicar achados com storytelling claro.Promover governança e segurança dos dados (LGPD: minimização, anonimização, RLS/CLS, consentimento).Apoiar a cultura data-driven com workshops rápidos e guias de boas práticas.Requisitos e qualificaçõesEscolaridade:Graduação em Ciência da Computação, Engenharia, Estatística, Matemática ou áreas correlatas.Tempo na função:Sr - 5+ anos de experienciaConhecimento de Informática:Python (pandas/numpy/scikit-learn) e SQL avançadoVivência em Microsoft FabricGit, ambientes reprodutíveis e boas práticas de visualizaçãoExperiência com ferramentas de análise de dados e machine learning.Familiaridade com bancos de dados relacionais e não relacionais.Competências:Compromisso com a Excelência; Comunicação; Conhecimento técnico; Orientações para o resultado; Relacionamento Interpessoal; Resolução de problemas; Tolerância a pressão e mudanças.Específicos da área:Estatística/Probabilidade (inferência, testes, regressão) e ML clássico (árvores/ensembles, regressão/classificação).Show moreShow less",,On-site/Hybrid,https://www.linkedin.com/jobs-guest/jobs/api/jobPosting/4299274364,2025-09-23,"CIENTISTA DE DADOS SR - SP A Icomon Tecnologia Ltda. está há mais de 30 anos realizando projetos de implantação e manutenção de infraestrutura no país. A Icomon atua para as principais operadoras e prestadoras de serviços do segmento de telecom e detém a maior parte das operações na região metropolitana de São Paulo. Além disso, a empresa está em constante evolução e sempre em busca de novas tecnologias para otimizar os processos, oferecendo as melhores soluções do mercado. CLIMA ORGANIZACIONAL A Icomon oferece programas e benefícios focados na atração de talentos, retenção e à motivação de seu público interno. Além disso, a empresa possui canais de comunicação interna, que proporcionam a atualização e interação dos colaboradores. A Icomon também atua com programas de flexibilização de trabalho, que englobam banco de horas e home office. A opinião de nossos colaboradores é coletada por meio do nosso Canal de Apoio ao Colaborador Icomon e através do Mapeamento de Cultura que realizamos na empresa. Planos de ação são elaborados e executados para garantir nosso clima de acolhida e de satisfação em fazer parte da nossa equipe. DIVERSIDADE A empresa conta com um ambiente organizacional inclusivo, reunindo diferentes perfis e estilos profissionais para atuarem frente aos constantes desafios do dia a dia. A multiplicidade faz parte do DNA da Icomon, com diferentes visões de mundo e estilos de liderança, que valorizam a inclusão social e a equidade de gênero. CARREIRA E DESENVOLVIMENTO A ICOMON tem como princípio apoiar a formação e o desenvolvimento de seus colaboradores (funcionários) com grande amplitude em seus Programas.Responsabilidades e atribuiçõesEntender problemas de negócio, formular hipóteses e definir métricas de sucesso.Conduz projetos ponta a ponta.Explorar dados, criar features e selecionar algoritmos apropriados.Desenvolver, validar e comparar modelos e medir impacto offline/online.Desenhar e analisar experimentos (A/B/n, amostragem, poder estatístico, causalidade quando aplicável).Construir pipelines reprodutíveis e versionados (treino, inferência, monitoramento, retraining).monitorar performance, drift de dados/targets, custo, fairness e estabilidade.Documentar datasets, features, modelos e decisões; comunicar achados com storytelling claro.Promover governança e segurança dos dados (LGPD: minimização, anonimização, RLS/CLS, consentimento).Apoiar a cultura data-driven com workshops rápidos e guias de boas práticas.Requisitos e qualificaçõesEscolaridade:Graduação em Ciência da Computação, Engenharia, Estatística, Matemática ou áreas correlatas.Tempo na função:Sr - 5+ anos de experienciaConhecimento de Informática:Python (pandas/numpy/scikit-learn) e SQL avançadoVivência em Microsoft FabricGit, ambientes reprodutíveis e boas práticas de visualizaçãoExperiência com ferramentas de análise de dados e machine learning.Familiaridade com bancos de dados relacionais e não relacionais.Competências:Compromisso com a Excelência; Comunicação; Conhecimento técnico; Orientações para o resultado; Relacionamento Interpessoal; Resolução de problemas; Tolerância a pressão e mudanças.Específicos da área:Estatística/Probabilidade (inferência, testes, regressão) e ML clássico (árvores/ensembles, regressão/classificação).Show moreShow less",Não especificado,Não especificado,Não especificado,1
Programa de Estágio - Verão 2026,Hyundai Motor Company,Greater São Paulo Area,29 minutes ago,"AHyundai Motor Brasilestá com inscrições abertas para oPrograma de Estágio de Verão 2026.Se você busca iniciar sua carreira em um ambiente desafiador, inovador e com projetos de impacto real, essa é a sua oportunidade.Sobre as Vagas:Duração:7 semanas (07/01 a 20/02/2026);Local:Presencial nas unidades da Hyundai em São Paulo (SP) e Piracicaba (SP).Requisitos:Estar regularmente matriculado em cursos de Engenharia, Ciência da Computação, Estatística ou áreas correlatas;Inglês intermediário;Conhecimento em Pacote Office;Proatividade, criatividade e capacidade de trabalho em equipe;Familiaridade com análise de dados, programação e/ou processos industriais.Benefícios:Acomodação custeada para estudantes de fora das cidades atendidas por transporte fretado;Alimentação no refeitório da empresa e/ou vale-refeição;Vale-alimentação;Transporte (vale-transporte ou fretado);Assistência médica e odontológica;Programa de bem-estar corporativo (WellHub).Observação: benefícios podem variar conforme a localidade.Veja quais são os projetos disponíveis, e escolha o seu!Projeto 1 – Área: Marketing (São Paulo)Tema:Automação de Controle de Verba com IA e Power BIDesenvolver soluções automatizadas com uso de Inteligência Artificial e Power BI para controle de verba do time de Marketing, substituindo processos manuais e suscetíveis a erros. O projeto visa integrar notas fiscais às ordens de compra e desenvolver dashboards que apresentem a distribuição do orçamento por time, modelo e atividade.Projeto 2 – Área: Vendas (São Paulo)Tema:Estratégia Comercial com DashboardsCriar uma estrutura de dados e dashboards temáticos no Power BI para suportar a estratégia de vendas da Hyundai. O projeto inclui mapeamento de fontes de dados, modelagem, visualizações por mercado, região e canal, além de garantir segurança no acesso e navegação intuitiva para diferentes perfis de usuários.Projeto 3 – Área: Logística (Piracicaba)Tema:Otimização de Rotas e Layout FabrilOtimizar os processos de logística interna e layout da fábrica em Piracicaba, com foco em aumentar a eficiência operacional, reduzir atividades que não agregam valor e melhorar a organização dos processos produtivos. O projeto envolve mapeamento de rotas, reorganização de abastecimento, padronização de embalagens e análise de dados para tomada de decisão.Projeto 4 – Área: R&D - Pesquisa e Desenvolvimento (Piracicaba)Tema:Construção e Validação de Tubo de Impedância com Pós-Processamento em PythonProjetar, construir e validar um tubo de impedância com dois microfones para caracterização acústica de materiais, conforme normasISO 10534‑2 / ASTM E1050. O projeto inclui desenvolvimento de um script em Python para pós-processamento automático dos dados medidos, cálculo do coeficiente de absorção sonora α(f), geração de relatórios e validação com material de referência.Projeto 5 – Área: PMO / Gestão de Projetos (Piracicaba)Tema:Automação de Rotinas e Governança de ProjetosDesenvolvimento de soluções para automatizar rotinas do PMO e aumentar a conformidade na gestão de projetos. O projeto inclui criação de dashboards automáticos em Power BI ou Google Data Studio, geração de relatórios semanais via scripts, checklist de kick-off com formulários integrados, bot de validação de documentos obrigatórios e sistema automatizado de controle de mudanças. A execução será dividida em 7 semanas, com etapas de imersão, prototipagem, desenvolvimento, testes e entrega final.Projeto 6 – Área: Manutenção (Piracicaba)Tema:Desenvolvimento de Dashboard Web para Monitoramento de MáquinasCriação de uma interface web interativa para visualização e análise de dados coletados de máquinas industriais (motores, robôs, inversores). O sistema será acessível via intranet, com foco em desempenho e usabilidade, permitindo filtros, login, seleção de gráficos e personalização da visualização. O dashboard utilizará banco de dados local como fonte, apresentando tendências e indicadores em tempo real com base em parâmetros pré-estabelecidos.Como Participar:Se você quer transformar seu conhecimento acadêmico em experiência prática em uma das empresas mais inovadoras do setor automotivo, essa é a sua chance!Inscreva-se e venha construir o futuro da mobilidade com a Hyundai!Come Grow With Us!Venha Crescer Conosco!Show moreShow less",,On-site/Hybrid,https://www.linkedin.com/jobs-guest/jobs/api/jobPosting/4304668839,2025-09-23,"Programa de Estágio - Verão 2026 AHyundai Motor Brasilestá com inscrições abertas para oPrograma de Estágio de Verão 2026.Se você busca iniciar sua carreira em um ambiente desafiador, inovador e com projetos de impacto real, essa é a sua oportunidade.Sobre as Vagas:Duração:7 semanas (07/01 a 20/02/2026);Local:Presencial nas unidades da Hyundai em São Paulo (SP) e Piracicaba (SP).Requisitos:Estar regularmente matriculado em cursos de Engenharia, Ciência da Computação, Estatística ou áreas correlatas;Inglês intermediário;Conhecimento em Pacote Office;Proatividade, criatividade e capacidade de trabalho em equipe;Familiaridade com análise de dados, programação e/ou processos industriais.Benefícios:Acomodação custeada para estudantes de fora das cidades atendidas por transporte fretado;Alimentação no refeitório da empresa e/ou vale-refeição;Vale-alimentação;Transporte (vale-transporte ou fretado);Assistência médica e odontológica;Programa de bem-estar corporativo (WellHub).Observação: benefícios podem variar conforme a localidade.Veja quais são os projetos disponíveis, e escolha o seu!Projeto 1 – Área: Marketing (São Paulo)Tema:Automação de Controle de Verba com IA e Power BIDesenvolver soluções automatizadas com uso de Inteligência Artificial e Power BI para controle de verba do time de Marketing, substituindo processos manuais e suscetíveis a erros. O projeto visa integrar notas fiscais às ordens de compra e desenvolver dashboards que apresentem a distribuição do orçamento por time, modelo e atividade.Projeto 2 – Área: Vendas (São Paulo)Tema:Estratégia Comercial com DashboardsCriar uma estrutura de dados e dashboards temáticos no Power BI para suportar a estratégia de vendas da Hyundai. O projeto inclui mapeamento de fontes de dados, modelagem, visualizações por mercado, região e canal, além de garantir segurança no acesso e navegação intuitiva para diferentes perfis de usuários.Projeto 3 – Área: Logística (Piracicaba)Tema:Otimização de Rotas e Layout FabrilOtimizar os processos de logística interna e layout da fábrica em Piracicaba, com foco em aumentar a eficiência operacional, reduzir atividades que não agregam valor e melhorar a organização dos processos produtivos. O projeto envolve mapeamento de rotas, reorganização de abastecimento, padronização de embalagens e análise de dados para tomada de decisão.Projeto 4 – Área: R&D - Pesquisa e Desenvolvimento (Piracicaba)Tema:Construção e Validação de Tubo de Impedância com Pós-Processamento em PythonProjetar, construir e validar um tubo de impedância com dois microfones para caracterização acústica de materiais, conforme normasISO 10534‑2 / ASTM E1050. O projeto inclui desenvolvimento de um script em Python para pós-processamento automático dos dados medidos, cálculo do coeficiente de absorção sonora α(f), geração de relatórios e validação com material de referência.Projeto 5 – Área: PMO / Gestão de Projetos (Piracicaba)Tema:Automação de Rotinas e Governança de ProjetosDesenvolvimento de soluções para automatizar rotinas do PMO e aumentar a conformidade na gestão de projetos. O projeto inclui criação de dashboards automáticos em Power BI ou Google Data Studio, geração de relatórios semanais via scripts, checklist de kick-off com formulários integrados, bot de validação de documentos obrigatórios e sistema automatizado de controle de mudanças. A execução será dividida em 7 semanas, com etapas de imersão, prototipagem, desenvolvimento, testes e entrega final.Projeto 6 – Área: Manutenção (Piracicaba)Tema:Desenvolvimento de Dashboard Web para Monitoramento de MáquinasCriação de uma interface web interativa para visualização e análise de dados coletados de máquinas industriais (motores, robôs, inversores). O sistema será acessível via intranet, com foco em desempenho e usabilidade, permitindo filtros, login, seleção de gráficos e personalização da visualização. O dashboard utilizará banco de dados local como fonte, apresentando tendências e indicadores em tempo real com base em parâmetros pré-estabelecidos.Como Participar:Se você quer transformar seu conhecimento acadêmico em experiência prática em uma das empresas mais inovadoras do setor automotivo, essa é a sua chance!Inscreva-se e venha construir o futuro da mobilidade com a Hyundai!Come Grow With Us!Venha Crescer Conosco!Show moreShow less",Não especificado,Inglês,Google Cloud,1
Data Scientist,"CloudWalk, Inc.","São Paulo, São Paulo, Brazil",5 days ago,"About CloudWalk:We are not just another fintech unicorn. We are a pack of dreamers, makers, and tech enthusiasts building the future of payments. With millions of happy customers and a hunger for innovation, we're now expanding our neural network - literally and metaphorically.What You Need To SucceedMachine LearningAWS CertificationsGCP CertificationsPython/TypeScriptBonus Points IfYou have a love for or studying physicsJoin us at CloudWalk, where we’re not just engineering solutions; we’re building a smarter, AI-driven future for payments—together.By applying for this position, your data will be processed as per CloudWalk's Privacy Policy that you can read here in Portuguese and here in English.Show moreShow less",,On-site/Hybrid,https://www.linkedin.com/jobs-guest/jobs/api/jobPosting/4278848183,2025-09-23,"Data Scientist About CloudWalk:We are not just another fintech unicorn. We are a pack of dreamers, makers, and tech enthusiasts building the future of payments. With millions of happy customers and a hunger for innovation, we're now expanding our neural network - literally and metaphorically.What You Need To SucceedMachine LearningAWS CertificationsGCP CertificationsPython/TypeScriptBonus Points IfYou have a love for or studying physicsJoin us at CloudWalk, where we’re not just engineering solutions; we’re building a smarter, AI-driven future for payments—together.By applying for this position, your data will be processed as per CloudWalk's Privacy Policy that you can read here in Portuguese and here in English.Show moreShow less",Não especificado,Não especificado,Amazon Web Service,3
Analista de Processos de Inteligência Artificial Júnior/ Pleno,Volkswagen Group Services - South America,"São Paulo, São Paulo, Brazil",2 weeks ago,"Estamos em busca de um(a) Analista de Inteligência Artificial Júnior/ Pleno para integrar nosso time. Esse(a) profissional terá como missão aplicar soluções de IA para otimizar processos, melhorar a eficiência operacional e conectar áreas estratégicas como Finanças, RH, Jurídico, Administrativo, entre outras.Buscamos alguém com perfil analítico, colaborativo e com boa capacidade de comunicação, que saiba traduzir desafios de negócio em soluções baseadas em dados e algoritmos.Responsabilidades e atribuiçõesResponsabilidadesDesenvolver e implementar modelos de inteligência artificial e aprendizado de máquina;Identificar oportunidades de automação e otimização de processos internos;Atuar em conjunto com áreas como Finanças, Recursos Humanos, Jurídico e Administrativo, entre outras, para mapear necessidades e entregar soluções de valor;Analisar dados e construir pipelines para alimentar modelos preditivos;Monitorar a performance de modelos e realizar ajustes para garantir precisão e escalabilidade;Apoiar iniciativas de inovação e transformação digital;Produzir documentação técnica e relatórios de resultados para stakeholders.Requisitos e qualificaçõesRequisitosExperiência com ferramentas e bibliotecas de IA (ex: Python, scikit-learn, TensorFlow, PyTorch, etc.);Conhecimento em manipulação e análise de dados (Pandas, SQL, Power BI ou similares);Familiaridade com metodologias ágeis (Scrum/Kanban);Inglês intermediário (leitura e comunicação técnica);Capacidade de atuar de forma autônoma e colaborativa com diferentes áreas da empresa.Experiência anterior em projetos corporativos de automação ou IA aplicada;DesejáveisConhecimento de ferramentas de MLOps e deploy de modelos (ex: Docker, MLflow, Airflow);Experiência com ferramentas de visualização de dados (ex: Tableau, Power BI, Streamlit).Informações adicionaisCondições:Contratação CLT, no modelo híbrido, com presença necessária em nosso escritório no bairro do Jabaquara, São Paulo/SP, 3 vezes por semana, bem como visitas/reuniões em São Bernardo do Campo/SP.Benefícios:Vale AlimentaçãoVale RefeiçãoPlano de Saúde SulamericaPlano Odontológico SulamericaPrevidência PrivadaSeguro de VidaAuxílio CrechePLRVale TransportePrograma Bem-Estar (Wellhub/Gympass, Conexa e Psicologia Viva)Show moreShow less",,On-site/Hybrid,https://www.linkedin.com/jobs-guest/jobs/api/jobPosting/4295718173,2025-09-23,"Analista de Processos de Inteligência Artificial Júnior/ Pleno Estamos em busca de um(a) Analista de Inteligência Artificial Júnior/ Pleno para integrar nosso time. Esse(a) profissional terá como missão aplicar soluções de IA para otimizar processos, melhorar a eficiência operacional e conectar áreas estratégicas como Finanças, RH, Jurídico, Administrativo, entre outras.Buscamos alguém com perfil analítico, colaborativo e com boa capacidade de comunicação, que saiba traduzir desafios de negócio em soluções baseadas em dados e algoritmos.Responsabilidades e atribuiçõesResponsabilidadesDesenvolver e implementar modelos de inteligência artificial e aprendizado de máquina;Identificar oportunidades de automação e otimização de processos internos;Atuar em conjunto com áreas como Finanças, Recursos Humanos, Jurídico e Administrativo, entre outras, para mapear necessidades e entregar soluções de valor;Analisar dados e construir pipelines para alimentar modelos preditivos;Monitorar a performance de modelos e realizar ajustes para garantir precisão e escalabilidade;Apoiar iniciativas de inovação e transformação digital;Produzir documentação técnica e relatórios de resultados para stakeholders.Requisitos e qualificaçõesRequisitosExperiência com ferramentas e bibliotecas de IA (ex: Python, scikit-learn, TensorFlow, PyTorch, etc.);Conhecimento em manipulação e análise de dados (Pandas, SQL, Power BI ou similares);Familiaridade com metodologias ágeis (Scrum/Kanban);Inglês intermediário (leitura e comunicação técnica);Capacidade de atuar de forma autônoma e colaborativa com diferentes áreas da empresa.Experiência anterior em projetos corporativos de automação ou IA aplicada;DesejáveisConhecimento de ferramentas de MLOps e deploy de modelos (ex: Docker, MLflow, Airflow);Experiência com ferramentas de visualização de dados (ex: Tableau, Power BI, Streamlit).Informações adicionaisCondições:Contratação CLT, no modelo híbrido, com presença necessária em nosso escritório no bairro do Jabaquara, São Paulo/SP, 3 vezes por semana, bem como visitas/reuniões em São Bernardo do Campo/SP.Benefícios:Vale AlimentaçãoVale RefeiçãoPlano de Saúde SulamericaPlano Odontológico SulamericaPrevidência PrivadaSeguro de VidaAuxílio CrechePLRVale TransportePrograma Bem-Estar (Wellhub/Gympass, Conexa e Psicologia Viva)Show moreShow less",Pleno,Inglês,Não especificado,1
