title,company,location,posted,description,applicants,work_mode,link,data_coleta,titulo_descr,senioridade,idioma,certificado,cluster
Pesquisador,Pamcary,"São Paulo, São Paulo, Brazil",2 days ago,"DescriçãoVocê é curioso(a) por natureza, adora investigar, buscar informações e transformar dados em respostas? Gosta de um ambiente dinâmico, colaborativo e com propósito? Então essa vaga é para você!Estamos em busca de pessoas proativas, comunicativas e com sede de conhecimento para integrar nosso time de Pesquisa e Inteligência de Dados. Aqui, você terá um papel essencial na coleta e análise de informações que apoiam decisões estratégicas e operacionais da empresa.O Que Você Vai FazerNavegar por sistemas internos e bases de dados para localizar e validar informações;Realizar pesquisas em fontes públicas e confiáveis na internet;Fazer contato telefônico com fontes externas para coleta de dados;Atender clientes e parceiros via WhatsApp com empatia e agilidade;Interagir com motoristas e transportadoras para garantir a precisão das informações.O Perfil Que BuscamosPessoas naturalmente curiosas, investigativas e com iniciativa;Boa comunicação verbal e escrita;Organização e atenção aos detalhes;Facilidade para trabalhar com metas e prazos;Espírito colaborativo e vontade de aprender.RequisitosEnsino médio completo;Conhecimento básico em pacote Office;Boa comunicação interpessoal.O Que OferecemosContrato CLT com início imediato (40 vagas disponíveis);Vale-transporte;Vale-refeição;Plano de saúde e odontológico;Seguro de vida;Programa de Assistência Social (apoio emocional, financeiro e jurídico);Programa Futuros Pais (acompanhamento para mamães e papais + auxílio creche);Parcerias com o SESC, escolas, universidades e comércios locais;Acesso ao Boon + Wellhub (bem-estar físico e mental)Show moreShow less",,On-site/Hybrid,https://www.linkedin.com/jobs-guest/jobs/api/jobPosting/4369157927,2026-02-08,"Pesquisador DescriçãoVocê é curioso(a) por natureza, adora investigar, buscar informações e transformar dados em respostas? Gosta de um ambiente dinâmico, colaborativo e com propósito? Então essa vaga é para você!Estamos em busca de pessoas proativas, comunicativas e com sede de conhecimento para integrar nosso time de Pesquisa e Inteligência de Dados. Aqui, você terá um papel essencial na coleta e análise de informações que apoiam decisões estratégicas e operacionais da empresa.O Que Você Vai FazerNavegar por sistemas internos e bases de dados para localizar e validar informações;Realizar pesquisas em fontes públicas e confiáveis na internet;Fazer contato telefônico com fontes externas para coleta de dados;Atender clientes e parceiros via WhatsApp com empatia e agilidade;Interagir com motoristas e transportadoras para garantir a precisão das informações.O Perfil Que BuscamosPessoas naturalmente curiosas, investigativas e com iniciativa;Boa comunicação verbal e escrita;Organização e atenção aos detalhes;Facilidade para trabalhar com metas e prazos;Espírito colaborativo e vontade de aprender.RequisitosEnsino médio completo;Conhecimento básico em pacote Office;Boa comunicação interpessoal.O Que OferecemosContrato CLT com início imediato (40 vagas disponíveis);Vale-transporte;Vale-refeição;Plano de saúde e odontológico;Seguro de vida;Programa de Assistência Social (apoio emocional, financeiro e jurídico);Programa Futuros Pais (acompanhamento para mamães e papais + auxílio creche);Parcerias com o SESC, escolas, universidades e comércios locais;Acesso ao Boon + Wellhub (bem-estar físico e mental)Show moreShow less",Não especificado,Não especificado,Não especificado,4
Cientista de Dados,Vendemmia Logística Integrada,"São Paulo, São Paulo, Brazil",2 days ago,"Somos umaplataforma digital de logísticaque nasceu dentro da operação real, entendendo de perto os gargalos daimportação, do armazém e do transporte. Por isso, entregamos algo que o mercado ainda não conseguiu:tecnologia construída por quem vive a operação.Com oAnalytics, você enxerga cada detalhe da sua cadeia em tempo real, conecta sistemas sem fricção e transforma dados em decisões inteligentes. O que antes era invisível, agora está claro. O que era fragmentado, agora é colaborativo. O que era reativo, agora é preditivo.Essa é a nova era da Logística Movida por Inteligência.Estamos em busca de um(a)Cientista de Dadospara atuar no desenvolvimento de soluções analíticas e modelos orientados a dados, apoiando decisões estratégicas do negócio. Essa pessoa terá papel central na transformação de dados brutos em insights acionáveis, trabalhando de forma próxima a áreas técnicas e de negócio.O(a) profissional atuará desde a exploração e tratamento dos dados até a construção de modelos estatísticos e de machine learning, participando também da definição de métricas, experimentos e visualizações que apoiem a tomada de decisão.Responsabilidades e atribuiçõesColetar, tratar e analisar grandes volumes de dados estruturados e não estruturados (vindos de WMS, ERP, TMS, YMS e outros sistemas de registro e gestão);Desenvolver modelos estatísticos, preditivos e de machine learning;Criar métricas, indicadores e análises exploratórias para suporte ao negócio;Construir e manter pipelines de dados e processos analíticos;Validar hipóteses e realizar experimentos (A/B tests, análises estatísticas, etc.);Comunicar resultados e insights de forma clara para públicos técnicos e não técnicos;Trabalhar em conjunto com times de tecnologia, produto e negócio.Requisitos e qualificaçõesFormação em áreas como Sistemas de Informação, Ciência de Dados, Estatística, Matemática, Engenharia, Computação ou correlatas;Experiência com análise de dados e modelagem estatística;Conhecimento em Python ou R para análise e modelagem;Experiência com SQL e bancos de dados;Conhecimento em técnicas de machine learning;Capacidade analítica, pensamento crítico e boa comunicação.Informações adicionaisLocal de trabalho: Vila Olímpia/SPModelo de trabalho: Híbrido (2 dias de home office por semana)Jornada: Segunda a sexta-feira, das 08h30 às 18h00 (com 1h30 de intervalo para almoço)Show moreShow less",,On-site/Hybrid,https://www.linkedin.com/jobs-guest/jobs/api/jobPosting/4369372246,2026-02-08,"Cientista de Dados Somos umaplataforma digital de logísticaque nasceu dentro da operação real, entendendo de perto os gargalos daimportação, do armazém e do transporte. Por isso, entregamos algo que o mercado ainda não conseguiu:tecnologia construída por quem vive a operação.Com oAnalytics, você enxerga cada detalhe da sua cadeia em tempo real, conecta sistemas sem fricção e transforma dados em decisões inteligentes. O que antes era invisível, agora está claro. O que era fragmentado, agora é colaborativo. O que era reativo, agora é preditivo.Essa é a nova era da Logística Movida por Inteligência.Estamos em busca de um(a)Cientista de Dadospara atuar no desenvolvimento de soluções analíticas e modelos orientados a dados, apoiando decisões estratégicas do negócio. Essa pessoa terá papel central na transformação de dados brutos em insights acionáveis, trabalhando de forma próxima a áreas técnicas e de negócio.O(a) profissional atuará desde a exploração e tratamento dos dados até a construção de modelos estatísticos e de machine learning, participando também da definição de métricas, experimentos e visualizações que apoiem a tomada de decisão.Responsabilidades e atribuiçõesColetar, tratar e analisar grandes volumes de dados estruturados e não estruturados (vindos de WMS, ERP, TMS, YMS e outros sistemas de registro e gestão);Desenvolver modelos estatísticos, preditivos e de machine learning;Criar métricas, indicadores e análises exploratórias para suporte ao negócio;Construir e manter pipelines de dados e processos analíticos;Validar hipóteses e realizar experimentos (A/B tests, análises estatísticas, etc.);Comunicar resultados e insights de forma clara para públicos técnicos e não técnicos;Trabalhar em conjunto com times de tecnologia, produto e negócio.Requisitos e qualificaçõesFormação em áreas como Sistemas de Informação, Ciência de Dados, Estatística, Matemática, Engenharia, Computação ou correlatas;Experiência com análise de dados e modelagem estatística;Conhecimento em Python ou R para análise e modelagem;Experiência com SQL e bancos de dados;Conhecimento em técnicas de machine learning;Capacidade analítica, pensamento crítico e boa comunicação.Informações adicionaisLocal de trabalho: Vila Olímpia/SPModelo de trabalho: Híbrido (2 dias de home office por semana)Jornada: Segunda a sexta-feira, das 08h30 às 18h00 (com 1h30 de intervalo para almoço)Show moreShow less",Não especificado,Não especificado,Não especificado,1
Product Data Scientist,NielsenIQ,"Cotia, São Paulo, Brazil",1 week ago,"R25_0014938In 100 countries around the world, NielsenIQ provides clients the most complete understanding of how the FMCG market evolves and what consumers buy. As a global leader in measurement and information, we believe providing our clients a precise understanding of the consumer is the key to making the right decisions -- decisions that can lead to profitable growth. At NielsenIQ, we’re always innovating to keep pace with emerging market trends and the increasingly diverse, demanding and connected consumer.The Product organization drives forward our product strategy for NielsenIQ’s product portfolio. From measurement strategy to delivery mechanism and applications suite, the Product Organization identifies market opportunities and shapes product offerings to enable our clients’ strategic business decision making.Job DescriptionBeing a Data Scientist in theProduct Data Science, you will play a critical role in developing the next generation of solutions we offer our clients, powered by algorithms and AI and leveraging large volumes of internal data, client data and third-party data.You’ll be actively participating with other team members in the overall Product creation process. You will be participating with other team members in the overall Product creation process. You’ll work alongside a group of talented individuals with different areas of expertise including best in class data scientists.On a daily basis you’ll be expected to:Read, write, comment, maintain, enhance, and share legible, well documented, and quality computer code translated from technical specification to fulfill product requirementsAdapt and plan implementation of statistical and analytical models (including ML/AI approaches) to production platform, guiding their integration with other production processesMaintain data integrity and quality throughout the development lifecycleActively participate in Agile workflows with the broader team which incQualificationsBachelors or Masters degree in Computer Science, Data Science, Statistics, Mathematics, Engineering or related field requiring outstanding analytical expertise and strong technical background3+ years of experience in data science/analytics/software engineering related product development and/or data solutions developmentKnowledge of statistical and machine learning methodologies: Sampling theory, Probability Theory, Variation analysis, Outlier identification techniques, Regressions, Classification, Time series analysis, Clustering, Neural Networks, etcAbility to prototype as well as support pilot programs for R&D purposes. The primary areas include – but not limited to – trend analyses, identifying gaps for improvements in coverage, representation/sampling, bias reduction, indirect estimation, data integration, automation, generalization, harmonization as well as working with different data sourcesProficient inPython, SQL, Statistical packages(scipy, sklearn, statsmodels, etc), and version control (Github)Proficient in English languagePreferred:Experience withCloud computing, ETL,advanced data processing techniques (Spark, pySpark, Hadoop, etc)Additional InformationFlexible working environmentVolunteer time offLinkedIn LearningEmployee-Assistance-Program (EAP)Our BenefitsFlexible working environmentVolunteer time offLinkedIn LearningEmployee-Assistance-Program (EAP)About NIQNIQ is the world’s leading consumer intelligence company, delivering the most complete understanding of consumer buying behavior and revealing new pathways to growth. In 2023, NIQ combined with GfK, bringing together the two industry leaders with unparalleled global reach. With a holistic retail read and the most comprehensive consumer insights—delivered with advanced analytics through state-of-the-art platforms—NIQ delivers the Full View™. NIQ is an Advent International portfolio company with operations in 100+ markets, covering more than 90% of the world’s population.For more information, visit NIQ.comWant to keep up with our latest updates?Follow us on: LinkedIn | Instagram | Twitter | FacebookOur commitment to Diversity, Equity, and InclusionNIQ is committed to reflecting the diversity of the clients, communities, and markets we measure within our own workforce. We exist to count everyone and are on a mission to systematically embed inclusion and diversity into all aspects of our workforce, measurement, and products. We enthusiastically invite candidates who share that mission to join us. We are proud to be an Equal Opportunity/Affirmative Action-Employer, making decisions without regard to race, color, religion, gender, gender identity or expression, sexual orientation, national origin, genetics, disability status, age, marital status, protected veteran status or any other protected class. Our global non-discrimination policy covers these protected classes in every market in which we do business worldwide. Learn more about how we are driving diversity and inclusion in everything we do by visiting the NIQ News Center: https://nielseniq.com/global/en/news-center/diversity-inclusionShow moreShow less",,On-site/Hybrid,https://www.linkedin.com/jobs-guest/jobs/api/jobPosting/4339036457,2026-02-08,"Product Data Scientist R25_0014938In 100 countries around the world, NielsenIQ provides clients the most complete understanding of how the FMCG market evolves and what consumers buy. As a global leader in measurement and information, we believe providing our clients a precise understanding of the consumer is the key to making the right decisions -- decisions that can lead to profitable growth. At NielsenIQ, we’re always innovating to keep pace with emerging market trends and the increasingly diverse, demanding and connected consumer.The Product organization drives forward our product strategy for NielsenIQ’s product portfolio. From measurement strategy to delivery mechanism and applications suite, the Product Organization identifies market opportunities and shapes product offerings to enable our clients’ strategic business decision making.Job DescriptionBeing a Data Scientist in theProduct Data Science, you will play a critical role in developing the next generation of solutions we offer our clients, powered by algorithms and AI and leveraging large volumes of internal data, client data and third-party data.You’ll be actively participating with other team members in the overall Product creation process. You will be participating with other team members in the overall Product creation process. You’ll work alongside a group of talented individuals with different areas of expertise including best in class data scientists.On a daily basis you’ll be expected to:Read, write, comment, maintain, enhance, and share legible, well documented, and quality computer code translated from technical specification to fulfill product requirementsAdapt and plan implementation of statistical and analytical models (including ML/AI approaches) to production platform, guiding their integration with other production processesMaintain data integrity and quality throughout the development lifecycleActively participate in Agile workflows with the broader team which incQualificationsBachelors or Masters degree in Computer Science, Data Science, Statistics, Mathematics, Engineering or related field requiring outstanding analytical expertise and strong technical background3+ years of experience in data science/analytics/software engineering related product development and/or data solutions developmentKnowledge of statistical and machine learning methodologies: Sampling theory, Probability Theory, Variation analysis, Outlier identification techniques, Regressions, Classification, Time series analysis, Clustering, Neural Networks, etcAbility to prototype as well as support pilot programs for R&D purposes. The primary areas include – but not limited to – trend analyses, identifying gaps for improvements in coverage, representation/sampling, bias reduction, indirect estimation, data integration, automation, generalization, harmonization as well as working with different data sourcesProficient inPython, SQL, Statistical packages(scipy, sklearn, statsmodels, etc), and version control (Github)Proficient in English languagePreferred:Experience withCloud computing, ETL,advanced data processing techniques (Spark, pySpark, Hadoop, etc)Additional InformationFlexible working environmentVolunteer time offLinkedIn LearningEmployee-Assistance-Program (EAP)Our BenefitsFlexible working environmentVolunteer time offLinkedIn LearningEmployee-Assistance-Program (EAP)About NIQNIQ is the world’s leading consumer intelligence company, delivering the most complete understanding of consumer buying behavior and revealing new pathways to growth. In 2023, NIQ combined with GfK, bringing together the two industry leaders with unparalleled global reach. With a holistic retail read and the most comprehensive consumer insights—delivered with advanced analytics through state-of-the-art platforms—NIQ delivers the Full View™. NIQ is an Advent International portfolio company with operations in 100+ markets, covering more than 90% of the world’s population.For more information, visit NIQ.comWant to keep up with our latest updates?Follow us on: LinkedIn | Instagram | Twitter | FacebookOur commitment to Diversity, Equity, and InclusionNIQ is committed to reflecting the diversity of the clients, communities, and markets we measure within our own workforce. We exist to count everyone and are on a mission to systematically embed inclusion and diversity into all aspects of our workforce, measurement, and products. We enthusiastically invite candidates who share that mission to join us. We are proud to be an Equal Opportunity/Affirmative Action-Employer, making decisions without regard to race, color, religion, gender, gender identity or expression, sexual orientation, national origin, genetics, disability status, age, marital status, protected veteran status or any other protected class. Our global non-discrimination policy covers these protected classes in every market in which we do business worldwide. Learn more about how we are driving diversity and inclusion in everything we do by visiting the NIQ News Center: https://nielseniq.com/global/en/news-center/diversity-inclusionShow moreShow less",Não especificado,Não especificado,Não especificado,0
Analista de Dados Jr,Telecárdio,Greater São Paulo Area,5 days ago,"Se você é apaixonado por dados, gosta de transformar números em insights e está em busca de desenvolvimento na área, essa vaga é para você! Estamos em busca de um Analista de Dados Júnior para atuar junto ao nosso time, apoiando na geração de análises, relatórios e dashboards, contribuindo para a tomada de decisão estratégica da empresa.ResponsabilidadesColetar, organizar e analisar dados de diferentes fontes; Construir e manter dashboards e relatórios gerenciais; Auxiliar na geração de insights para apoio na tomada de decisões; Garantir a integridade e a qualidade dos dados; Trabalhar em conjunto com as áreas de negócios para entender demandas e traduzir em soluções de dados. Requisitos:Ensino superior cursando ou completo em Estatística, Ciência de Dados, Engenharia, TI, Economia, Administração ou áreas correlatas; Conhecimento em Excel e ferramentas de visualização de dados (Power BI, Tableau ou similares); Conhecimento básico em SQL para consultas em banco de dados; Raciocínio lógico, organização, atenção aos detalhes e boa comunicação.Show moreShow less",,On-site/Hybrid,https://www.linkedin.com/jobs-guest/jobs/api/jobPosting/4368493929,2026-02-08,"Analista de Dados Jr Se você é apaixonado por dados, gosta de transformar números em insights e está em busca de desenvolvimento na área, essa vaga é para você! Estamos em busca de um Analista de Dados Júnior para atuar junto ao nosso time, apoiando na geração de análises, relatórios e dashboards, contribuindo para a tomada de decisão estratégica da empresa.ResponsabilidadesColetar, organizar e analisar dados de diferentes fontes; Construir e manter dashboards e relatórios gerenciais; Auxiliar na geração de insights para apoio na tomada de decisões; Garantir a integridade e a qualidade dos dados; Trabalhar em conjunto com as áreas de negócios para entender demandas e traduzir em soluções de dados. Requisitos:Ensino superior cursando ou completo em Estatística, Ciência de Dados, Engenharia, TI, Economia, Administração ou áreas correlatas; Conhecimento em Excel e ferramentas de visualização de dados (Power BI, Tableau ou similares); Conhecimento básico em SQL para consultas em banco de dados; Raciocínio lógico, organização, atenção aos detalhes e boa comunicação.Show moreShow less",Júnior,Não especificado,Não especificado,1
