title,company,location,posted,description,applicants,work_mode,link,data_coleta,titulo_descr,senioridade,idioma,certificado,cluster
Pessoa Coordenadora Cientista de Dados | Crédito,C6 Bank,"São Paulo, São Paulo, Brazil",3 days ago,"Nossa área de Ciência de DadosNosso ambiente de trabalho é extremamente leve e colaborativo, que estimula a autonomia e liberdade, sempre muito próximos dos times de negócios e com a entrega final em mente. Nossa Cultura é forte e foi construída para estimular a inovação e garantir relações verdadeiras com clientes e colaboradores.Suas atividades como CSixerTrabalhar com parceiros de negócios, engenheiros de dados e times de tecnologia para desenvolvimento e deploy de soluções de machine learning como parte dos produtos;Analisar dados para validar hipóteses e gerar insights de negócio;Manipular dados para tratamento, limpeza e exploração;Implementar, testar, fazer deploy, documentar e depurar processos de dados e de machine learning;Contribuir com os repositórios de código e documentação da equipe e qualificar a discussão técnica com referências científicas e metodológicas.Requisitos e experiênciaExperiência com técnicas de modelagem descritiva e preditiva;Experiência na construção de ETL usando SQL;Experiência com Python e/ou R para construção de modelos.Nossos BenefíciosVale-Refeição;Vale-Alimentação;Plano de saúde e odontológico;Auxílio-Creche;Seguro de Vida;WellHub;Conexa | Psicologia Viva - Terapia online sem custo;Cartão de Crédito C6 Bank Carbon;Carbon Spa - Salão de beleza localizado em nosso escritório;Sala de amamentação;Empresa Cidadã - Prorrogação do prazo da licença-maternidade e licença-paternidade;Bicicletário;Vestiário;Espaço de convivência - Videogame, mesa de sinuca, playball, churrasqueira, chopeira, lanchonete, diversos locais de descanso, redes, cesta de basquete e horta colaborativa e orgânica.C6 BANKO BANCO DA SUA VIDAAtendemos pessoas físicas, MEIs e PMEs em todos os estados do Brasil. Sem agências físicas, oferecemos mais de 90 produtos e serviços financeiros feitos para todos os perfis de clientes.Estamos localizados em São Paulo-SP e contamos com mais de 3.000 CSixers que estão sempre a mil por hora. Em pouco mais de cinco anos, conquistamos muitos prêmios e reconhecimentos.No C6 Bank, acreditamos que a diversidade impulsiona a inovação e fortalece nosso ambiente de trabalho. Por isso, promovemos uma cultura inclusiva, que valoriza a equidade e garante oportunidades para todas as pessoas, independentemente de raça, cor, idade, credo, deficiência, nacionalidade, estado civil, orientação sexual, identidade ou expressão de gênero. Aqui, todo mundo é bem-vindo para ser quem é.Confira mais informações no vídeo abaixo:Show moreShow less",,On-site/Hybrid,https://www.linkedin.com/jobs-guest/jobs/api/jobPosting/3923094040,2025-09-10,"Pessoa Coordenadora Cientista de Dados | Crédito Nossa área de Ciência de DadosNosso ambiente de trabalho é extremamente leve e colaborativo, que estimula a autonomia e liberdade, sempre muito próximos dos times de negócios e com a entrega final em mente. Nossa Cultura é forte e foi construída para estimular a inovação e garantir relações verdadeiras com clientes e colaboradores.Suas atividades como CSixerTrabalhar com parceiros de negócios, engenheiros de dados e times de tecnologia para desenvolvimento e deploy de soluções de machine learning como parte dos produtos;Analisar dados para validar hipóteses e gerar insights de negócio;Manipular dados para tratamento, limpeza e exploração;Implementar, testar, fazer deploy, documentar e depurar processos de dados e de machine learning;Contribuir com os repositórios de código e documentação da equipe e qualificar a discussão técnica com referências científicas e metodológicas.Requisitos e experiênciaExperiência com técnicas de modelagem descritiva e preditiva;Experiência na construção de ETL usando SQL;Experiência com Python e/ou R para construção de modelos.Nossos BenefíciosVale-Refeição;Vale-Alimentação;Plano de saúde e odontológico;Auxílio-Creche;Seguro de Vida;WellHub;Conexa | Psicologia Viva - Terapia online sem custo;Cartão de Crédito C6 Bank Carbon;Carbon Spa - Salão de beleza localizado em nosso escritório;Sala de amamentação;Empresa Cidadã - Prorrogação do prazo da licença-maternidade e licença-paternidade;Bicicletário;Vestiário;Espaço de convivência - Videogame, mesa de sinuca, playball, churrasqueira, chopeira, lanchonete, diversos locais de descanso, redes, cesta de basquete e horta colaborativa e orgânica.C6 BANKO BANCO DA SUA VIDAAtendemos pessoas físicas, MEIs e PMEs em todos os estados do Brasil. Sem agências físicas, oferecemos mais de 90 produtos e serviços financeiros feitos para todos os perfis de clientes.Estamos localizados em São Paulo-SP e contamos com mais de 3.000 CSixers que estão sempre a mil por hora. Em pouco mais de cinco anos, conquistamos muitos prêmios e reconhecimentos.No C6 Bank, acreditamos que a diversidade impulsiona a inovação e fortalece nosso ambiente de trabalho. Por isso, promovemos uma cultura inclusiva, que valoriza a equidade e garante oportunidades para todas as pessoas, independentemente de raça, cor, idade, credo, deficiência, nacionalidade, estado civil, orientação sexual, identidade ou expressão de gênero. Aqui, todo mundo é bem-vindo para ser quem é.Confira mais informações no vídeo abaixo:Show moreShow less",Não especificado,Não especificado,Não especificado,4
Senior Data Scientist,Cognizant,Greater São Paulo Area,2 weeks ago,"A Cognizant Technology Solutions is a North American IT multinational company based in New Jersey that has been in Brazil for 11 years, with offices in Sao Paulo and Curitiba. We currently have a team of almost one thousand and five hundred associates, but we continue to grow exponentially and look for new talents who are interested in a career opportunity in one of the largest IT companies in the world.We operate on several fronts: Digital Business, Digital Operations, Digital Systems and Technology (infrastructure, SAP, Mulesoft, QE&A, among others).Our company believes in the power of diversity and inclusion, and it was this belief that has led us to win several awards, such as GPTW and Top Employer in recent years. In our hiring, we only consider the candidate's talent and willingness to be part of the digital transformation of our clients, regardless of gender, sexual orientation, ethnicity or religion. For us, the empowerment of our employees is very important, as we believe that our team can contribute to the constant evolution that we experience daily.Job SummaryWe are seeking a highly motivated Senior Data Scientist with an extensive background in environmental modeling, particularly in row crops such as soy and cotton.The ideal candidate will have strong experience in data processing and machine learning programming in Python, as well as proficiency in building scalable solutions on the AWS platform. Experience with remote sensing data in modeling is highly preferred. This role will focus on leveraging data-driven insights to enhance agricultural process.ResponsibilitiesDevelop and implement sophisticated environmental models to assess the impact of various factors on the growth and yield of row crops, specifically soy and cotton.Utilize Python for data processing, analysis, and machine learning to extract actionable insights from complex datasets, including remote sensing data.Build and deploy machine learning models and data solutions on the AWS platform, ensuring scalability, reliability, and performance.Collaborate with agronomists, environmental scientists, and other stakeholders to integrate domain knowledge into modeling efforts and data solutions.Conduct research on environmental variables affecting crop performance, utilizing remote sensing data to enhance model accuracy and predictive capabilities.Present analytical findings and model outputs to technical and non-technical stakeholders through comprehensive reports and visualizations.Mentor and support junior data scientists in best practices for data analysis, machine learning, and environmental modeling. Stay updated on industry trends, technological advancements, and best practices in agricultural data science, environmental modeling, and remote sensingCertifications RequiredGoogle cloud Professional CertificationWhat are we offering?Support in the development of your career, portal with several online courses in addition to the best market benefits such as: Pension Plan, Medical and Dental Plan, Meal voucher, Transportation voucher and Variable pay, among others.We are a company that values, take care of and cares about the health and well-being of its employees. In addition to the conventional benefits, we provide the Employee Assistance Program with confidential assistance available to help you and your family to find solutions to personal and professional challenges.We encourage applicants who are people with disabilities to apply for a position of interest from among all of our available opportunities. Evaluate your profile and if there is no fit with the job opening, we will redirect your application.Show moreShow less",,Remote,https://www.linkedin.com/jobs-guest/jobs/api/jobPosting/4245612322,2025-09-10,"Senior Data Scientist A Cognizant Technology Solutions is a North American IT multinational company based in New Jersey that has been in Brazil for 11 years, with offices in Sao Paulo and Curitiba. We currently have a team of almost one thousand and five hundred associates, but we continue to grow exponentially and look for new talents who are interested in a career opportunity in one of the largest IT companies in the world.We operate on several fronts: Digital Business, Digital Operations, Digital Systems and Technology (infrastructure, SAP, Mulesoft, QE&A, among others).Our company believes in the power of diversity and inclusion, and it was this belief that has led us to win several awards, such as GPTW and Top Employer in recent years. In our hiring, we only consider the candidate's talent and willingness to be part of the digital transformation of our clients, regardless of gender, sexual orientation, ethnicity or religion. For us, the empowerment of our employees is very important, as we believe that our team can contribute to the constant evolution that we experience daily.Job SummaryWe are seeking a highly motivated Senior Data Scientist with an extensive background in environmental modeling, particularly in row crops such as soy and cotton.The ideal candidate will have strong experience in data processing and machine learning programming in Python, as well as proficiency in building scalable solutions on the AWS platform. Experience with remote sensing data in modeling is highly preferred. This role will focus on leveraging data-driven insights to enhance agricultural process.ResponsibilitiesDevelop and implement sophisticated environmental models to assess the impact of various factors on the growth and yield of row crops, specifically soy and cotton.Utilize Python for data processing, analysis, and machine learning to extract actionable insights from complex datasets, including remote sensing data.Build and deploy machine learning models and data solutions on the AWS platform, ensuring scalability, reliability, and performance.Collaborate with agronomists, environmental scientists, and other stakeholders to integrate domain knowledge into modeling efforts and data solutions.Conduct research on environmental variables affecting crop performance, utilizing remote sensing data to enhance model accuracy and predictive capabilities.Present analytical findings and model outputs to technical and non-technical stakeholders through comprehensive reports and visualizations.Mentor and support junior data scientists in best practices for data analysis, machine learning, and environmental modeling. Stay updated on industry trends, technological advancements, and best practices in agricultural data science, environmental modeling, and remote sensingCertifications RequiredGoogle cloud Professional CertificationWhat are we offering?Support in the development of your career, portal with several online courses in addition to the best market benefits such as: Pension Plan, Medical and Dental Plan, Meal voucher, Transportation voucher and Variable pay, among others.We are a company that values, take care of and cares about the health and well-being of its employees. In addition to the conventional benefits, we provide the Employee Assistance Program with confidential assistance available to help you and your family to find solutions to personal and professional challenges.We encourage applicants who are people with disabilities to apply for a position of interest from among all of our available opportunities. Evaluate your profile and if there is no fit with the job opening, we will redirect your application.Show moreShow less",Sênior,Não especificado,Amazon Web Service,1
Data Scientist - LATAM,WITHIN,"São Paulo, São Paulo, Brazil",2 weeks ago,"About the Role: We are looking for a versatile Data Scientist with a strong marketing background to join our dynamic team. As part of WITHIN, you will work on innovative end-to-end data solutions that drive growth for some of the most iconic brands in the world. This role is perfect for someone who enjoys thinking critically about complex data problems, building and testing models with a strong emphasis on interpretability,turning innovative ideas into actionable solutions. You will be responsible for solving complex business challenges, designing and refining data pipelines, and applying statistical methods to real-world problems.Responsibilities include but are not limited to;Develop and test new data science models, including Marketing Mix Modeling, time series forecasting and advanced regression models, to solve business problems and improve marketing strategies while ensuring model interpretabilityRun statistical experiments to measure and optimize performance for clients to uncover key insights from large datasets.Implement and refine data models, ensuring they align with dynamic client business objectives and data engineering workflows, offering scalable solutionsCollaborate with cross-functional teams, including media, creative, and lifecycle marketing, to integrate data-driven insights into performance branding strategiesCommunicate complex data findings effectively, both in written and spoken formats, to clients and internal stakeholdersRequirements:3-5 years of experience as a Data Scientist, preferably with a focus on marketing applicationsStrong Bayesian statistics and mathematics background with the ability to understand complex algorithms and how they can be applied to solve real-world business challengesProficiency in Python, SQL, and RExperience with optimization methodsExperience working with Google Cloud Platform (GCP) or another cloud platform (AWS, Azure)Deep understanding of standard data science algorithms(optional) - Experience with Terraform, microservices and cloud infrastructure automationExcellent written and verbal communication skillsA problem-solving mindset with the ability to adapt in a fast-paced environmentOur interview process includes, but is not limited to the following:Excel and Typing TestWe offer a competitive salary and benefits based on ability level, including:Base salary DOEUnlimited vacation policyMonthly phone/internet and food stipendHealth insurance coverageProfessional Development ProgramRemote work opportunity - must be based in a Latin America countryNote. Please submit your resume in EnglishAbout WITHIN & Brkfst.ioWITHINis the world's first Performance Branding company, partnering with some of the biggest brands in the world to drive business growth through innovative marketing strategies. Our integrated operating model collapses the traditional marketing silos between creative and media, performance and brand, and across media channels. With a full suite of offerings including media, creative, SEO, Lifecycle, Retail Media, Affiliate and Influencer, we're able to work with our brand partners in an integrated fashion, allowing us to align marketing strategies back to core business objectives. Client teams at WITHIN are trained on how to always act as a trusted business partner, acting as a fiduciary to client needs above our own.Teams at WITHIN have the ability to work with iconic brands such as The North Face, Timberland, Ben and Jerry's and Jose Cuervo. Everyone at WITHIN wants to grow and be challenged. It's a collaborative place made up of small, closely knit and versatile teams that are fast and adaptive to solve problems and build systems.Check out some of ourwork!Brkfst.iois an incubated venture within WITHIN, focused on connecting creators with major brands to produce impactful ads at scale.We are, and we connect creators with big brands to make impactful ads at scale. We have a network of thousands of content creators with a variety of different skill-sets, and we're looking to build a program that empowers them to create great ads for brands like Corkcicle, Perfume.com, Casper Mattresses, & more!This is a very ambitious project and our roadmap is full of exciting features, so we're looking for people who love innovation and want to be challenged. We're a small team of scrappy individuals who are growing fast, and we're looking for someone to grow with us.Weweave AI into everything we do, using the latest tech across all teams to innovate, work smarter, and make better decisions. Whether it's in creative, operations, or anything else, AI helps us level up and do things at a whole new scale. We expect our people to use AI in their daily work, fully embracing it as a critical tool to help us succeed.Join Our Network!Stay connected with us and be the first to know about new opportunities, industry insights, and updates.Follow us on:LinkedInWhatsApp CommunityInstagramTik TokLocationsNew York City:43-01 22nd St, Suite 602, Queens, New York, 11101Bogotá:WeWork Av. Cra 19 #100-45, 10th Floor, Bogotá, ColombiaMexico City:Av Paseo de la Reforma 296, Floor 25, Office 111, Mexico City, MexicoShow moreShow less",,Remote,https://www.linkedin.com/jobs-guest/jobs/api/jobPosting/4291509130,2025-09-10,"Data Scientist - LATAM About the Role: We are looking for a versatile Data Scientist with a strong marketing background to join our dynamic team. As part of WITHIN, you will work on innovative end-to-end data solutions that drive growth for some of the most iconic brands in the world. This role is perfect for someone who enjoys thinking critically about complex data problems, building and testing models with a strong emphasis on interpretability,turning innovative ideas into actionable solutions. You will be responsible for solving complex business challenges, designing and refining data pipelines, and applying statistical methods to real-world problems.Responsibilities include but are not limited to;Develop and test new data science models, including Marketing Mix Modeling, time series forecasting and advanced regression models, to solve business problems and improve marketing strategies while ensuring model interpretabilityRun statistical experiments to measure and optimize performance for clients to uncover key insights from large datasets.Implement and refine data models, ensuring they align with dynamic client business objectives and data engineering workflows, offering scalable solutionsCollaborate with cross-functional teams, including media, creative, and lifecycle marketing, to integrate data-driven insights into performance branding strategiesCommunicate complex data findings effectively, both in written and spoken formats, to clients and internal stakeholdersRequirements:3-5 years of experience as a Data Scientist, preferably with a focus on marketing applicationsStrong Bayesian statistics and mathematics background with the ability to understand complex algorithms and how they can be applied to solve real-world business challengesProficiency in Python, SQL, and RExperience with optimization methodsExperience working with Google Cloud Platform (GCP) or another cloud platform (AWS, Azure)Deep understanding of standard data science algorithms(optional) - Experience with Terraform, microservices and cloud infrastructure automationExcellent written and verbal communication skillsA problem-solving mindset with the ability to adapt in a fast-paced environmentOur interview process includes, but is not limited to the following:Excel and Typing TestWe offer a competitive salary and benefits based on ability level, including:Base salary DOEUnlimited vacation policyMonthly phone/internet and food stipendHealth insurance coverageProfessional Development ProgramRemote work opportunity - must be based in a Latin America countryNote. Please submit your resume in EnglishAbout WITHIN & Brkfst.ioWITHINis the world's first Performance Branding company, partnering with some of the biggest brands in the world to drive business growth through innovative marketing strategies. Our integrated operating model collapses the traditional marketing silos between creative and media, performance and brand, and across media channels. With a full suite of offerings including media, creative, SEO, Lifecycle, Retail Media, Affiliate and Influencer, we're able to work with our brand partners in an integrated fashion, allowing us to align marketing strategies back to core business objectives. Client teams at WITHIN are trained on how to always act as a trusted business partner, acting as a fiduciary to client needs above our own.Teams at WITHIN have the ability to work with iconic brands such as The North Face, Timberland, Ben and Jerry's and Jose Cuervo. Everyone at WITHIN wants to grow and be challenged. It's a collaborative place made up of small, closely knit and versatile teams that are fast and adaptive to solve problems and build systems.Check out some of ourwork!Brkfst.iois an incubated venture within WITHIN, focused on connecting creators with major brands to produce impactful ads at scale.We are, and we connect creators with big brands to make impactful ads at scale. We have a network of thousands of content creators with a variety of different skill-sets, and we're looking to build a program that empowers them to create great ads for brands like Corkcicle, Perfume.com, Casper Mattresses, & more!This is a very ambitious project and our roadmap is full of exciting features, so we're looking for people who love innovation and want to be challenged. We're a small team of scrappy individuals who are growing fast, and we're looking for someone to grow with us.Weweave AI into everything we do, using the latest tech across all teams to innovate, work smarter, and make better decisions. Whether it's in creative, operations, or anything else, AI helps us level up and do things at a whole new scale. We expect our people to use AI in their daily work, fully embracing it as a critical tool to help us succeed.Join Our Network!Stay connected with us and be the first to know about new opportunities, industry insights, and updates.Follow us on:LinkedInWhatsApp CommunityInstagramTik TokLocationsNew York City:43-01 22nd St, Suite 602, Queens, New York, 11101Bogotá:WeWork Av. Cra 19 #100-45, 10th Floor, Bogotá, ColombiaMexico City:Av Paseo de la Reforma 296, Floor 25, Office 111, Mexico City, MexicoShow moreShow less",Não especificado,Não especificado,Microsoft Azure,1
