title,company,location,posted,description,applicants,work_mode,link,data_coleta,titulo_descr,senioridade,idioma,certificado,cluster
Cientista de Dados Jr,Banco Bmg,"São Paulo, São Paulo, Brazil",1 week ago,"Há mais de 90 anos, o Banco Bmg atua com foco em democratizar o acesso a soluções financeiras, colocando sempre o cliente no centro de tudo o que fazemos. Somos referência em crédito consignado e estamos presentes em todo o Brasil, com agências, franquias, correspondentes bancários e um app completo que conecta milhões de pessoas a serviços financeiros de forma simples, acessível e inovadora.Crescer e gerar resultados sustentáveis que tragam valor para nossos clientes, acionistas, colaboradores e para a sociedade em geral é uma prioridade para nós. Nossos resultados evidenciam esse comprometimento.Guiados por princípios, construímos uma cultura organizacional que valoriza pessoas, impulsiona o protagonismo e transforma impacto social em legado. Atuamos com times que prezam pela autonomia, pelo comprometimento e pela excelência. Investimos continuamente em conhecimento e inovação para transformar a jornada dos colaboradores e clientes.Esse cuidado com as pessoas nos levou a conquistar, em 2025, o reconhecimento como top 3 melhores instituições financeiras para se trabalhar no Brasil, ocupando a 3ª posição no ranking Great Place To Work®. Um orgulho que reforça nosso compromisso de colocar o Jeito Bmg de Ser em prática todos os dias.Esses pilares impulsionam uma transformação contínua, promovendo revisões diárias de processos, da jornada do cliente, da tomada de decisão e da forma como os times se conectam para gerar valor. No Bmg, somos movidos por fazer diferente e melhor, com integridade, simplicidade e um jeito único de ser: o Jeito Bmg.Responsabilidades e atribuiçõesResponsabilidades e atribuições:Construir, treinar e otimizar modelos utilizando técnicas de aprendizado de máquina;Fazer gestão, acompanhamento e recalibragem dos modelos já implantados;Gerar insights, ad hoc's e estudos analíticos diversos;Construir segmentações baseadas em algoritmos de clusterização;Busca por novas fontes de dados, além das tradicionais disponíveis e estruturadas;Apresentar resultados de projetos de forma compreensível, sem perda de rigor científico;Auxiliar na expansão da cultura do uso da ciência de dados em outras frentes de negócio.Requisitos e qualificaçõesRequisitos e qualificações:Domínio em linguagem de programação Python e modelagem estatística;Habilidade com banco de dados (SQL, ORACLE, etc), visando a extração, limpeza, tratamento e organização dos dados;Entendimento de técnicas de Modelagem Estatística e Machine Learning;Vivência no desenvolvimento e acompanhamento de modelos preditivos e/ou prescritivos.Ter boa comunicação, proatividade, flexibilidade e foco em resultado também são essenciais para você fazer parte do time de Ciência de Dados.Formação superior completa preferencialmente em áreas de exatas.Disponibilidade para atuação híbrida em São Paulo.Informações adicionaisBenefícios, saúde e bem-estarPlano de saúde sem mensalidade e Telemedicina;Plano odontológico;Vale Refeição e Alimentação;Seguro de vida;Previdência privada;Remuneração variável anual (bônus) competitiva;PPR - Programa de Participação nos Resultados;Único Skill (Benefício Educação gratuito);Bicicletário e vestiário;Auxílio creche;Auxílio internet;Programas de qualidade de vida;Ambulatório;Programa da Gestante;Licença Maternidade e Paternidade estendidasPsicologia Viva - Sessões de terapia online gratuita;PAP - Programa de assessoria financeira, jurídica e psicológica;Gympass - Desconto em academias;Frutas todos os dias;Day Off de Aniversário;Dress Code Flexível;Modelo híbrido de trabalho.E aí? Quer vestir a camisa e brilhar em campo com um banco presente na vida de milhões de brasileiros e reconhecido como um dos melhores lugares para se trabalhar?#VamosPraCimaShow moreShow less",,On-site/Hybrid,https://www.linkedin.com/jobs-guest/jobs/api/jobPosting/4278850277,2025-09-10,"Cientista de Dados Jr Há mais de 90 anos, o Banco Bmg atua com foco em democratizar o acesso a soluções financeiras, colocando sempre o cliente no centro de tudo o que fazemos. Somos referência em crédito consignado e estamos presentes em todo o Brasil, com agências, franquias, correspondentes bancários e um app completo que conecta milhões de pessoas a serviços financeiros de forma simples, acessível e inovadora.Crescer e gerar resultados sustentáveis que tragam valor para nossos clientes, acionistas, colaboradores e para a sociedade em geral é uma prioridade para nós. Nossos resultados evidenciam esse comprometimento.Guiados por princípios, construímos uma cultura organizacional que valoriza pessoas, impulsiona o protagonismo e transforma impacto social em legado. Atuamos com times que prezam pela autonomia, pelo comprometimento e pela excelência. Investimos continuamente em conhecimento e inovação para transformar a jornada dos colaboradores e clientes.Esse cuidado com as pessoas nos levou a conquistar, em 2025, o reconhecimento como top 3 melhores instituições financeiras para se trabalhar no Brasil, ocupando a 3ª posição no ranking Great Place To Work®. Um orgulho que reforça nosso compromisso de colocar o Jeito Bmg de Ser em prática todos os dias.Esses pilares impulsionam uma transformação contínua, promovendo revisões diárias de processos, da jornada do cliente, da tomada de decisão e da forma como os times se conectam para gerar valor. No Bmg, somos movidos por fazer diferente e melhor, com integridade, simplicidade e um jeito único de ser: o Jeito Bmg.Responsabilidades e atribuiçõesResponsabilidades e atribuições:Construir, treinar e otimizar modelos utilizando técnicas de aprendizado de máquina;Fazer gestão, acompanhamento e recalibragem dos modelos já implantados;Gerar insights, ad hoc's e estudos analíticos diversos;Construir segmentações baseadas em algoritmos de clusterização;Busca por novas fontes de dados, além das tradicionais disponíveis e estruturadas;Apresentar resultados de projetos de forma compreensível, sem perda de rigor científico;Auxiliar na expansão da cultura do uso da ciência de dados em outras frentes de negócio.Requisitos e qualificaçõesRequisitos e qualificações:Domínio em linguagem de programação Python e modelagem estatística;Habilidade com banco de dados (SQL, ORACLE, etc), visando a extração, limpeza, tratamento e organização dos dados;Entendimento de técnicas de Modelagem Estatística e Machine Learning;Vivência no desenvolvimento e acompanhamento de modelos preditivos e/ou prescritivos.Ter boa comunicação, proatividade, flexibilidade e foco em resultado também são essenciais para você fazer parte do time de Ciência de Dados.Formação superior completa preferencialmente em áreas de exatas.Disponibilidade para atuação híbrida em São Paulo.Informações adicionaisBenefícios, saúde e bem-estarPlano de saúde sem mensalidade e Telemedicina;Plano odontológico;Vale Refeição e Alimentação;Seguro de vida;Previdência privada;Remuneração variável anual (bônus) competitiva;PPR - Programa de Participação nos Resultados;Único Skill (Benefício Educação gratuito);Bicicletário e vestiário;Auxílio creche;Auxílio internet;Programas de qualidade de vida;Ambulatório;Programa da Gestante;Licença Maternidade e Paternidade estendidasPsicologia Viva - Sessões de terapia online gratuita;PAP - Programa de assessoria financeira, jurídica e psicológica;Gympass - Desconto em academias;Frutas todos os dias;Day Off de Aniversário;Dress Code Flexível;Modelo híbrido de trabalho.E aí? Quer vestir a camisa e brilhar em campo com um banco presente na vida de milhões de brasileiros e reconhecido como um dos melhores lugares para se trabalhar?#VamosPraCimaShow moreShow less",Não especificado,Não especificado,Não especificado,4
Desenvolvedor Trainee,TIVIT,"São Paulo, São Paulo, Brazil",2 weeks ago,"Localidade: São Paulo – Modelo Híbrido (2x a 3x por semana no escritório)Horário: Segunda a sexta-feira – 9h às 18h (40h semanais)Disponibilidade: Acima de 18 anosNa TIVIT, acreditamos que a tecnologia transforma negócios e gera impacto positivo na sociedade.Valorizamos o desenvolvimento sustentável, a diversidade e a inovação, colocando as pessoas no centro da nossa transformação digital.Vocêdesenvolvedor(a)que está buscando uma carreira sólida e promissora não pode perder essa oportunidade.Responsibilities and assignmentsCrescimento:Trilha de desenvolvimento focada em skills tech digitais.Participação em projetos reais com impacto no negócio desde o primeiro dia.Acesso a treinamentos, certificações e mentoria técnica.Mais de100 horas de treinamento.Protagonismo:Você no centro da sua jornada de desenvolvimento.Feedbacks constantes e plano estruturado de crescimento.Acompanhamento próximo da liderança.Reconhecimento pelo seu impacto e evolução.Tecnologia que transforma:Contribuir para transformar negócios e a sociedade por meio da tecnologia.Fazer parte de uma empresa que investe em inovação, diversidade e sustentabilidade.Requisitos:Formação:Engenharia (5 anos) – 2º ano em dianteBacharelado (4 anos) – 2º ano em dianteTecnologia (3 anos) – 2º ano em dianteFormados há no máximo 2 anosCursos tecnólogos (2 anos) e EAD não são elegíveis.Experiência:Mínimo de 1 ano de experiênciaCompetências Técnicas:Inglês intermediárioLógica programaçãoLinguagem de programação orientada a objetosPensamento computacionalGit hubNoções de banco de dadosConhecimento básico de Cloud & InfraSegurança Digital básicaCompetências Comportamentais:Pensamento críticoResolução de problemas complexosAdaptabilidade, resiliência e tolerância à ambiguidadeAprendizagem contínua e curiosidade ativa (learnability)Colaboração digitalInformações Adicionais:O que oferecemos para você?Vale Refeição ou Alimentação;Vale transporte;Convênio Academia;Convênio Farmácia;Assistência médica e Odontológica;PAC - Programa de aceleração de carreira;Reembolso para certificações;MOBIFLIX – Nossa academia corporativa tem cursos presenciais e online, alinhados as novas tendências do mercado de tecnologia;Acreditamos que o presente é plural e a inclusão transforma, por isso, todas as pessoas são bem-vindas em nossas vagas, para promovermos um ambiente de trabalho inclusivo, de respeito, justiça e equidade.Topa embarcar nesse desafio com a gente? #vemserTIVITShow moreShow less",,On-site/Hybrid,https://www.linkedin.com/jobs-guest/jobs/api/jobPosting/4288571716,2025-09-10,"Desenvolvedor Trainee Localidade: São Paulo – Modelo Híbrido (2x a 3x por semana no escritório)Horário: Segunda a sexta-feira – 9h às 18h (40h semanais)Disponibilidade: Acima de 18 anosNa TIVIT, acreditamos que a tecnologia transforma negócios e gera impacto positivo na sociedade.Valorizamos o desenvolvimento sustentável, a diversidade e a inovação, colocando as pessoas no centro da nossa transformação digital.Vocêdesenvolvedor(a)que está buscando uma carreira sólida e promissora não pode perder essa oportunidade.Responsibilities and assignmentsCrescimento:Trilha de desenvolvimento focada em skills tech digitais.Participação em projetos reais com impacto no negócio desde o primeiro dia.Acesso a treinamentos, certificações e mentoria técnica.Mais de100 horas de treinamento.Protagonismo:Você no centro da sua jornada de desenvolvimento.Feedbacks constantes e plano estruturado de crescimento.Acompanhamento próximo da liderança.Reconhecimento pelo seu impacto e evolução.Tecnologia que transforma:Contribuir para transformar negócios e a sociedade por meio da tecnologia.Fazer parte de uma empresa que investe em inovação, diversidade e sustentabilidade.Requisitos:Formação:Engenharia (5 anos) – 2º ano em dianteBacharelado (4 anos) – 2º ano em dianteTecnologia (3 anos) – 2º ano em dianteFormados há no máximo 2 anosCursos tecnólogos (2 anos) e EAD não são elegíveis.Experiência:Mínimo de 1 ano de experiênciaCompetências Técnicas:Inglês intermediárioLógica programaçãoLinguagem de programação orientada a objetosPensamento computacionalGit hubNoções de banco de dadosConhecimento básico de Cloud & InfraSegurança Digital básicaCompetências Comportamentais:Pensamento críticoResolução de problemas complexosAdaptabilidade, resiliência e tolerância à ambiguidadeAprendizagem contínua e curiosidade ativa (learnability)Colaboração digitalInformações Adicionais:O que oferecemos para você?Vale Refeição ou Alimentação;Vale transporte;Convênio Academia;Convênio Farmácia;Assistência médica e Odontológica;PAC - Programa de aceleração de carreira;Reembolso para certificações;MOBIFLIX – Nossa academia corporativa tem cursos presenciais e online, alinhados as novas tendências do mercado de tecnologia;Acreditamos que o presente é plural e a inclusão transforma, por isso, todas as pessoas são bem-vindas em nossas vagas, para promovermos um ambiente de trabalho inclusivo, de respeito, justiça e equidade.Topa embarcar nesse desafio com a gente? #vemserTIVITShow moreShow less",Não especificado,Inglês,Não especificado,3
Cientista de Dados (área Business Development) - São Paulo/SP,Shopee,"São Paulo, São Paulo, Brazil",5 days ago,"About The TeamSobre a ShôAqui na Shô, acreditamos que cada membro de nossa equipe é fundamental para o nosso sucesso, e que diversidade de perspectivas e vivências são essenciais para movimentar nosso negócio e impulsionar o nosso propósito de mudar o mundo para melhor.Fazer parte do nosso time é a oportunidade de se desenvolver dentro de uma cultura de muita agilidade. Se você ama assumir grandes responsabilidades e fazer o que nunca foi feito, a Shô é seu lugar. Aqui você terá grandes desafios, trabalhará em colaboração com um time diverso e contribuirá para o futuro do e-commerce no Brasil, criamos impacto positivo na vida de milhões de pessoas.Modelo de TrabalhoAdotamos um modelo de trabalho híbrido, esse modelo permite que as pessoas ajustem seu ambiente de trabalho de acordo com suas necessidades pessoais, ao mesmo tempo em que promove a colaboração e interação no escritório.Qual será a sua missãoVocê atuará no time de Business Development e será responsável por estruturar e automatizar processos de coleta, classificação, organização e análise de dados que apoiem decisões estratégicas em um ambiente de negócio altamente dinâmico e competitivo.Buscamos alguém com perfil técnico e aplicado, que saiba construir soluções escaláveis, com forte raciocínio analítico e autonomia.Job DescriptionComo será o seu dia a diaProjetar e implementar pipelines robustos para processamento de dados em larga escala;Participar ativamente da evolução da esteira de dados e modelos, com foco em escalabilidade, confiabilidade e impacto;Colaborar com desenvolvedores, analistas de negócio e stakeholders de outras áreas, mantendo uma comunicação clara e objetiva;Desenvolver dashboards e relatórios com dados processados, apoiando a geração de insights para o negócio;Construir soluções com mentalidade DevOps e MLOps, utilizando automações, versionamento, CI/CD e monitoramento.RequirementsO que você precisa para assumir o desafioExperiência sólida com Python e bibliotecas de dados e machine learning (Pandas, Scikit-learn, etc.);Vivência com PySpark ou ferramentas de processamento distribuído;Experiência no tratamento e classificação de dados textuais não estruturados (ex: nomes e descrições de produtos, marcas, categorias), usando regex, Fuzzy Matching, embeddings ou LLMs;Experiência com machine learning aplicado a problemas como classificação e segmentação;Domínio de SQL, com experiência em modelagem de dados, otimização de consultas e organização de bases relacionais para consumo analítico;Habilidade de colaborar em equipes multidisciplinares, com boa comunicação e visão de negócio;Diferencial: domínio de frameworks como TensorFlow ou PyTorch;Diferencial: experiência com sistemas de recomendação, otimização ou personalização em larga escala;Diferencial: experiência com ingestão de dados externos e integração com fontes diversas (APIs, arquivos, dados públicos em escala);Diferencial: familiaridade com ferramentas de orquestração como Airflow ou Kubeflow;Diferencial: vivência em ambientes de e-commerce ou mercados com alta complexidade competitiva.BenefíciosAssistência médica e odontológica, estendendo-se aos dependentes;Parceira com Gympass e TotalPass;Vale Refeição/Alimentação flexível;Vale Transporte, Vale Mobilidade ou Estacionamento no local;Benefício flexível;Zenklub;Bônus anual discricionário, atrelado à performance.VEM FAZER HISTÓRIA COM A GENTE.O QUE TE FAZ ÚNICO, NOS FAZ MELHORES! 🧡Show moreShow less",,On-site/Hybrid,https://www.linkedin.com/jobs-guest/jobs/api/jobPosting/4260617702,2025-09-10,"Cientista de Dados (área Business Development) - São Paulo/SP About The TeamSobre a ShôAqui na Shô, acreditamos que cada membro de nossa equipe é fundamental para o nosso sucesso, e que diversidade de perspectivas e vivências são essenciais para movimentar nosso negócio e impulsionar o nosso propósito de mudar o mundo para melhor.Fazer parte do nosso time é a oportunidade de se desenvolver dentro de uma cultura de muita agilidade. Se você ama assumir grandes responsabilidades e fazer o que nunca foi feito, a Shô é seu lugar. Aqui você terá grandes desafios, trabalhará em colaboração com um time diverso e contribuirá para o futuro do e-commerce no Brasil, criamos impacto positivo na vida de milhões de pessoas.Modelo de TrabalhoAdotamos um modelo de trabalho híbrido, esse modelo permite que as pessoas ajustem seu ambiente de trabalho de acordo com suas necessidades pessoais, ao mesmo tempo em que promove a colaboração e interação no escritório.Qual será a sua missãoVocê atuará no time de Business Development e será responsável por estruturar e automatizar processos de coleta, classificação, organização e análise de dados que apoiem decisões estratégicas em um ambiente de negócio altamente dinâmico e competitivo.Buscamos alguém com perfil técnico e aplicado, que saiba construir soluções escaláveis, com forte raciocínio analítico e autonomia.Job DescriptionComo será o seu dia a diaProjetar e implementar pipelines robustos para processamento de dados em larga escala;Participar ativamente da evolução da esteira de dados e modelos, com foco em escalabilidade, confiabilidade e impacto;Colaborar com desenvolvedores, analistas de negócio e stakeholders de outras áreas, mantendo uma comunicação clara e objetiva;Desenvolver dashboards e relatórios com dados processados, apoiando a geração de insights para o negócio;Construir soluções com mentalidade DevOps e MLOps, utilizando automações, versionamento, CI/CD e monitoramento.RequirementsO que você precisa para assumir o desafioExperiência sólida com Python e bibliotecas de dados e machine learning (Pandas, Scikit-learn, etc.);Vivência com PySpark ou ferramentas de processamento distribuído;Experiência no tratamento e classificação de dados textuais não estruturados (ex: nomes e descrições de produtos, marcas, categorias), usando regex, Fuzzy Matching, embeddings ou LLMs;Experiência com machine learning aplicado a problemas como classificação e segmentação;Domínio de SQL, com experiência em modelagem de dados, otimização de consultas e organização de bases relacionais para consumo analítico;Habilidade de colaborar em equipes multidisciplinares, com boa comunicação e visão de negócio;Diferencial: domínio de frameworks como TensorFlow ou PyTorch;Diferencial: experiência com sistemas de recomendação, otimização ou personalização em larga escala;Diferencial: experiência com ingestão de dados externos e integração com fontes diversas (APIs, arquivos, dados públicos em escala);Diferencial: familiaridade com ferramentas de orquestração como Airflow ou Kubeflow;Diferencial: vivência em ambientes de e-commerce ou mercados com alta complexidade competitiva.BenefíciosAssistência médica e odontológica, estendendo-se aos dependentes;Parceira com Gympass e TotalPass;Vale Refeição/Alimentação flexível;Vale Transporte, Vale Mobilidade ou Estacionamento no local;Benefício flexível;Zenklub;Bônus anual discricionário, atrelado à performance.VEM FAZER HISTÓRIA COM A GENTE.O QUE TE FAZ ÚNICO, NOS FAZ MELHORES! 🧡Show moreShow less",Não especificado,Não especificado,Não especificado,2
