title,company,location,posted,description,applicants,work_mode,link,data_coleta,titulo_descr,senioridade,idioma,certificado,cluster
Data Scientist JR,Banco Bradesco,"Osasco, São Paulo, Brazil",6 days ago,"Sobre o BradescoO Bradesco é um dos maiores grupos financeiros do Brasil, com uma história marcada pelo pioneirismo e inovação. Por meio da nossa carteira amplamente diversificada de produtos financeiros, serviços bancários e de seguros contribuímos com a realização das pessoas e o crescimento sustentável de empresas e sociedade. Venha fazer parte do nosso ecossistema financeiro e impactar a experiência de milhões de pessoas!No Bradesco valorizamos a diversidade em todas as suas formas. Por isso, as nossas vagas são abertas a todas as pessoas, independentemente de gênero, raça, orientação sexual, deficiência, idade ou qualquer outra característica.Saiba mais em https://banco.bradesco/html/classic/sobre/index.shtmResponsabilidades e atribuiçõesO que é o nosso time de Avaliação Independente de Modelos (AVIM) ?Em se tratando de simplificações da realidade, os modelos são sujeitos a riscos, que podem desencadear perdas relacionadas a decisões baseadas em estimativas incorretas ou obsoletas ou, ainda, uso inapropriado. Para identificar e mitigar esses riscos, nós da Área de Avaliação Independente de Modelos (AVIM) atuamos efetivamente no fortalecimento do uso de modelos, realizando ações de aculturamento e disseminando as boas práticas em modelagemModelo de trabalho : Híbrido - 2x PresencialUnidade: Osasco - SPComo será seu dia a dia?Sendo Data Scientist JR, atuará na gerência de Validação de Modelo Quântico, Risco e Mercado e suas principais atividades serão:Avaliar tecnicamente modelos matemáticos utilizados pela organização;Realizar análises quantitativas de risco de mercado, com foco em produtos de tesouraria como derivativos, títulos públicos e privados;Desenvolver e aplicar metodologias de precificação de ativos, utilizando ferramentas computacionais como Python ou R;Produzir relatórios técnicos de validação, documentando os resultados das análises;Interagir com áreas correlatas para entender os modelos desenvolvidos, propondo melhorias e assegurando que os modelos estejam alinhados com as políticas de risco da organização.Requisitos e QualificaçõesO que você precisa ter ou saber?Formação superior em Física, Matemática, Estatística, Finanças, Engenharia ou áreas correlatas;Conhecimentos em Estatística descritiva, técnicas de amostragem, ajuste de séries temporais;Conhecimentos de Matemática Financeira; Fundamentos de precificação de derivativos (Black-Scholes, binomial, Monte Carlo);Conhecimento de instrumentos financeiros: swaps, opções, futuros, etc. Medidas de risco: VaR (Value at Risk), Expected Shortfall, Greeks Modelos de liquidez e risco de liquidez (ex: Liquidity-adjusted VaR).Será um diferencial se você tiver:Conhecimento prático em precificação de ativos e avaliação de risco;Interesse genuíno por matemática aplicada e finanças quantitativas;Perfil analítico e capacidade de trabalhar com soluções computacionais.O que nós oferecemosNo Bradesco valorizamos a saúde e bem-estar, oferecendo um extenso portfólio de benefícios a todas nossas pessoas funcionárias:PLR ou Bônus: Conforme a elegibilidade de cargo*Convênio MédicoConvênio OdontológicoSeguro de VidaVale AlimentaçãoVale Refeição13º Cesta AlimentaçãoTotal PassVale Transporte (adesão opcional)Descontos em produtos e serviços em empresas parceirasPrevidência Privada (adesão opcional, com participação financeira da Organização Bradesco)Viva Bem Bradesco: programa de saúde, bem-estar e qualidade de vidaUnibrad: Universidade Corporativa BradescoIsenção de Tarifas: condições especiais em diversos produtos e serviçosAuxílio Creche ou BabáLicença Paternidade estendida de 20 diasLicença Maternidade de 180 dias, acompanhamento assistencial da gestação até o pós-partoShow moreShow less",,On-site/Hybrid,https://www.linkedin.com/jobs-guest/jobs/api/jobPosting/4332988268,2025-11-27,"Data Scientist JR Sobre o BradescoO Bradesco é um dos maiores grupos financeiros do Brasil, com uma história marcada pelo pioneirismo e inovação. Por meio da nossa carteira amplamente diversificada de produtos financeiros, serviços bancários e de seguros contribuímos com a realização das pessoas e o crescimento sustentável de empresas e sociedade. Venha fazer parte do nosso ecossistema financeiro e impactar a experiência de milhões de pessoas!No Bradesco valorizamos a diversidade em todas as suas formas. Por isso, as nossas vagas são abertas a todas as pessoas, independentemente de gênero, raça, orientação sexual, deficiência, idade ou qualquer outra característica.Saiba mais em https://banco.bradesco/html/classic/sobre/index.shtmResponsabilidades e atribuiçõesO que é o nosso time de Avaliação Independente de Modelos (AVIM) ?Em se tratando de simplificações da realidade, os modelos são sujeitos a riscos, que podem desencadear perdas relacionadas a decisões baseadas em estimativas incorretas ou obsoletas ou, ainda, uso inapropriado. Para identificar e mitigar esses riscos, nós da Área de Avaliação Independente de Modelos (AVIM) atuamos efetivamente no fortalecimento do uso de modelos, realizando ações de aculturamento e disseminando as boas práticas em modelagemModelo de trabalho : Híbrido - 2x PresencialUnidade: Osasco - SPComo será seu dia a dia?Sendo Data Scientist JR, atuará na gerência de Validação de Modelo Quântico, Risco e Mercado e suas principais atividades serão:Avaliar tecnicamente modelos matemáticos utilizados pela organização;Realizar análises quantitativas de risco de mercado, com foco em produtos de tesouraria como derivativos, títulos públicos e privados;Desenvolver e aplicar metodologias de precificação de ativos, utilizando ferramentas computacionais como Python ou R;Produzir relatórios técnicos de validação, documentando os resultados das análises;Interagir com áreas correlatas para entender os modelos desenvolvidos, propondo melhorias e assegurando que os modelos estejam alinhados com as políticas de risco da organização.Requisitos e QualificaçõesO que você precisa ter ou saber?Formação superior em Física, Matemática, Estatística, Finanças, Engenharia ou áreas correlatas;Conhecimentos em Estatística descritiva, técnicas de amostragem, ajuste de séries temporais;Conhecimentos de Matemática Financeira; Fundamentos de precificação de derivativos (Black-Scholes, binomial, Monte Carlo);Conhecimento de instrumentos financeiros: swaps, opções, futuros, etc. Medidas de risco: VaR (Value at Risk), Expected Shortfall, Greeks Modelos de liquidez e risco de liquidez (ex: Liquidity-adjusted VaR).Será um diferencial se você tiver:Conhecimento prático em precificação de ativos e avaliação de risco;Interesse genuíno por matemática aplicada e finanças quantitativas;Perfil analítico e capacidade de trabalhar com soluções computacionais.O que nós oferecemosNo Bradesco valorizamos a saúde e bem-estar, oferecendo um extenso portfólio de benefícios a todas nossas pessoas funcionárias:PLR ou Bônus: Conforme a elegibilidade de cargo*Convênio MédicoConvênio OdontológicoSeguro de VidaVale AlimentaçãoVale Refeição13º Cesta AlimentaçãoTotal PassVale Transporte (adesão opcional)Descontos em produtos e serviços em empresas parceirasPrevidência Privada (adesão opcional, com participação financeira da Organização Bradesco)Viva Bem Bradesco: programa de saúde, bem-estar e qualidade de vidaUnibrad: Universidade Corporativa BradescoIsenção de Tarifas: condições especiais em diversos produtos e serviçosAuxílio Creche ou BabáLicença Paternidade estendida de 20 diasLicença Maternidade de 180 dias, acompanhamento assistencial da gestação até o pós-partoShow moreShow less",Não especificado,Não especificado,Não especificado,4
Cientista de Dados Jr. (Finanças),Banco PAN,"São Paulo, São Paulo, Brazil",2 weeks ago,"Somos oPANÁgeis, flexíveis e criativos, exploramos possibilidades com disposição e desejo de fazer acontecer. Sempre prontos para encarar novos desafios, nutrimos líderes que, além de ter garra, são abertos e empáticos, veem na proximidade das relações, o elo entre cada um.Nossa missão, se faz cumprida quando transformamos a vida dos outros através dos nossos conhecimentos. Nossos pilares de cultura, reforçam nossa postura idealizadora e com desejo de fazer acontecer:Trabalho em equipe, Transparência , Excelência e Eficiência com profundidade.Dominamos nossos processos e trazemos melhorias para quem deseja ter umavida financeira mais inteligente.Principais desafios:Apoiar na validação e desenvolvimento de modelos estatísticos voltados à redução de ações cíveis, análise de propensão e crédito;Contribuir tecnicamente utilizando ferramentas como AWS, SQL, Python e Excel, com oportunidade de aprendizado contínuo;Colaborar com diferentes áreas e times em uma estrutura horizontal e dinâmica, com foco no desenvolvimento profissional.Quais as principais competências para a posição?Formação superior em áreas de Exatas (Engenharia, Estatística, Ciência da Computação, Matemática, entre outras);Conhecimento básico em modelagem estatística e ciência de dados (projetos acadêmicos ou experiências iniciais são bem-vindos);Perfil curioso, colaborativo e com boa capacidade analítica para levantar hipóteses e aprender com os desafios;Familiaridade com ferramentas como AWS, SQL, Python e Excel (não é necessário domínio completo, mas disposição para aprender);Experiência prévia em qualquer segmento é um diferencial, mas não obrigatória (buscamos pessoas com vontade de crescer na área).Modelo de atuação: Híbrido (4 dias presenciais no escritório e 1 dia de home office)Benefícios do PAN:Bônus / PLRVale RefeiçãoVale Alimentação13º de Vale AlimentaçãoConvênio Médico (internação em apartamento para titular e dependentes)Convênio Odonto/OrtodônticoAmbulatório Médico no escritórioTelemedicina Dr. Alper (Einstein Conecta) ilimitado.Seguro de VidaDescontos em mais de 10 mil farmácias4 Sessões de psicoterapia por mêsLicença familiar estendida (Responsável 6 meses e corresponsável 30 dias)Auxílio Creche / BabáAcomPANha (programa de acompanhamento para gestantes)Wellhub/TotalpassAuxílio tecnologia assistivas (reembolso de 85% para colaboradores com deficiência)Programas de desenvolvimentoMassagem e AuriculoterapiaSalão de beleza no escritórioPAE (Orientação Jurídica, Financeira, Psicológica e Social)Portal de descontos em diversos segmentos (Allya)Campanha de vacinação (colaborador e dependente)Facilitação no financiamento de veículos (Mediante análise)Cartão de crédito PAN com limite diferenciado (Mediante análise)Vale Transporte (desconto de apenas 4%)Assistência FuneralAssim como todas as nossas vagas, essa também é destinada à diversidade e inclusão. Independentemente de qualquer fator, perfil ou característica,Expanda sua carreira no PAN!Para conhecer mais sobre nossos benefícios e cultura, acesse o Trabalhe Conosco:https://www.bancopan.com.br/trabalhe-conosco/Show moreShow less",,On-site/Hybrid,https://www.linkedin.com/jobs-guest/jobs/api/jobPosting/4334687984,2025-11-27,"Cientista de Dados Jr. (Finanças) Somos oPANÁgeis, flexíveis e criativos, exploramos possibilidades com disposição e desejo de fazer acontecer. Sempre prontos para encarar novos desafios, nutrimos líderes que, além de ter garra, são abertos e empáticos, veem na proximidade das relações, o elo entre cada um.Nossa missão, se faz cumprida quando transformamos a vida dos outros através dos nossos conhecimentos. Nossos pilares de cultura, reforçam nossa postura idealizadora e com desejo de fazer acontecer:Trabalho em equipe, Transparência , Excelência e Eficiência com profundidade.Dominamos nossos processos e trazemos melhorias para quem deseja ter umavida financeira mais inteligente.Principais desafios:Apoiar na validação e desenvolvimento de modelos estatísticos voltados à redução de ações cíveis, análise de propensão e crédito;Contribuir tecnicamente utilizando ferramentas como AWS, SQL, Python e Excel, com oportunidade de aprendizado contínuo;Colaborar com diferentes áreas e times em uma estrutura horizontal e dinâmica, com foco no desenvolvimento profissional.Quais as principais competências para a posição?Formação superior em áreas de Exatas (Engenharia, Estatística, Ciência da Computação, Matemática, entre outras);Conhecimento básico em modelagem estatística e ciência de dados (projetos acadêmicos ou experiências iniciais são bem-vindos);Perfil curioso, colaborativo e com boa capacidade analítica para levantar hipóteses e aprender com os desafios;Familiaridade com ferramentas como AWS, SQL, Python e Excel (não é necessário domínio completo, mas disposição para aprender);Experiência prévia em qualquer segmento é um diferencial, mas não obrigatória (buscamos pessoas com vontade de crescer na área).Modelo de atuação: Híbrido (4 dias presenciais no escritório e 1 dia de home office)Benefícios do PAN:Bônus / PLRVale RefeiçãoVale Alimentação13º de Vale AlimentaçãoConvênio Médico (internação em apartamento para titular e dependentes)Convênio Odonto/OrtodônticoAmbulatório Médico no escritórioTelemedicina Dr. Alper (Einstein Conecta) ilimitado.Seguro de VidaDescontos em mais de 10 mil farmácias4 Sessões de psicoterapia por mêsLicença familiar estendida (Responsável 6 meses e corresponsável 30 dias)Auxílio Creche / BabáAcomPANha (programa de acompanhamento para gestantes)Wellhub/TotalpassAuxílio tecnologia assistivas (reembolso de 85% para colaboradores com deficiência)Programas de desenvolvimentoMassagem e AuriculoterapiaSalão de beleza no escritórioPAE (Orientação Jurídica, Financeira, Psicológica e Social)Portal de descontos em diversos segmentos (Allya)Campanha de vacinação (colaborador e dependente)Facilitação no financiamento de veículos (Mediante análise)Cartão de crédito PAN com limite diferenciado (Mediante análise)Vale Transporte (desconto de apenas 4%)Assistência FuneralAssim como todas as nossas vagas, essa também é destinada à diversidade e inclusão. Independentemente de qualquer fator, perfil ou característica,Expanda sua carreira no PAN!Para conhecer mais sobre nossos benefícios e cultura, acesse o Trabalhe Conosco:https://www.bancopan.com.br/trabalhe-conosco/Show moreShow less",Não especificado,Não especificado,Amazon Web Service,2
Data Scientist,Tata Consultancy Services,Greater São Paulo Area,1 day ago,"Come to one of the biggest IT Services companies in the world!! Here you can transform your career!Why to join TCS? Here at TCS we believe that people make the difference, that's why we live a culture of unlimited learning full of opportunities for improvement and mutual development. The ideal scenario to expand ideas through the right tools, contributing to our success in a collaborative environment.We are looking forData Scientist Expert, who wants to learn and transform his career.In this role you will:Designs robust, scalable APIs, handles auth & versioningExtracting insights from data to support business decisions.Data wranglingStatistical analysisDesign ML systems, evaluate trade-offsLeads innovation with GenAI, custom model developmentAnd much better if you stand out for:Analytical Thinking & Problem SolvingStructure complex problems methodicallyModeling techniques, and experimental validation to deliver resultsCommunication Skills: capable of articulating complex technical concepts clearly to both technical and non-technical stakeholdersBusiness Acumen: demonstrates understanding of business drivers, balancing analytical depth with strategic and operational impactEnglish;Technical proficiency in SQL, Generative Ai, CloudExperience in Machine Learning, Natural Language Processing, Large Language ModelsStrong proficiency in Python and associated data science and AI frameworksExperience designing and deploying LLMs with considerations for efficiency, scalability, and reliabilityAwareness of model interpretability, model evaluation methodologies and evaluation metrics for factual consistency and alignmentDesirable Skills:CI/CD pipelinesAWSBig Data (Spark, cloud storage, Big Query, etc.)<<<< Please attach resume in English>>>>>>What do we offer?• TCS Benefits – Brazil:• Health insurance• Dental Plan• Life insurance• Transportation vouchers• Meal/Food Voucher• Childcare assistance• Gympass• TCS Cares – free 0800 that provides psychological assistance (24 hrs/day), legal, social and financial assistance to associates• Partnership with SESC• Reimbursement of Certifications• Free TCS Learning Portal – Online courses and live training• International experience opportunity• Discount Partnership with Universities and Language Schools• Bring Your Buddy – By referring people you become eligible to receive a bonus for each hire• TCS Gems – Recognition for performance• Xcelerate – Free Mentoring Career Platform• Tata Consultancy Services is an equal opportunity employer, our commitment to diversity & inclusion drives our efforts to provide equal opportunity to all candidates who meet our required knowledge & competency needs, irrespective of any socio-economic background, race, color, national origin, religion, sex, gender identity/expression , age, marital status, disability, sexual orientation or any others. We encourage anyone interested to build a career in TCS to participate in our recruitment & selection process.• At Tata Consultancy Services we promote an inclusive culture, we always work for equity. This applies to Gender, People with Disabilities, LGBTQIA+, Religion, Race, Ethnicity. All our opportunities are based on these principles. We think of different actions of inclusion and social responsibility, in order to build a TCS that respects each person. Our motto is Inclusion without exception.At TATA Consultancy Services we promote an inclusive culture, we always work for equity. This applies to Gender, People with Disabilities, LGBTQIA+, Religion, Race, Ethnicity. All our opportunities are based on these principles. We think of different actions of inclusion and social responsibility, in order to build a TCS that respects individuality. Come to be a TCSer!#BuildingonbeliefRGS - 10331967Show moreShow less",,On-site/Hybrid,https://www.linkedin.com/jobs-guest/jobs/api/jobPosting/4339111185,2025-11-27,"Data Scientist Come to one of the biggest IT Services companies in the world!! Here you can transform your career!Why to join TCS? Here at TCS we believe that people make the difference, that's why we live a culture of unlimited learning full of opportunities for improvement and mutual development. The ideal scenario to expand ideas through the right tools, contributing to our success in a collaborative environment.We are looking forData Scientist Expert, who wants to learn and transform his career.In this role you will:Designs robust, scalable APIs, handles auth & versioningExtracting insights from data to support business decisions.Data wranglingStatistical analysisDesign ML systems, evaluate trade-offsLeads innovation with GenAI, custom model developmentAnd much better if you stand out for:Analytical Thinking & Problem SolvingStructure complex problems methodicallyModeling techniques, and experimental validation to deliver resultsCommunication Skills: capable of articulating complex technical concepts clearly to both technical and non-technical stakeholdersBusiness Acumen: demonstrates understanding of business drivers, balancing analytical depth with strategic and operational impactEnglish;Technical proficiency in SQL, Generative Ai, CloudExperience in Machine Learning, Natural Language Processing, Large Language ModelsStrong proficiency in Python and associated data science and AI frameworksExperience designing and deploying LLMs with considerations for efficiency, scalability, and reliabilityAwareness of model interpretability, model evaluation methodologies and evaluation metrics for factual consistency and alignmentDesirable Skills:CI/CD pipelinesAWSBig Data (Spark, cloud storage, Big Query, etc.)<<<< Please attach resume in English>>>>>>What do we offer?• TCS Benefits – Brazil:• Health insurance• Dental Plan• Life insurance• Transportation vouchers• Meal/Food Voucher• Childcare assistance• Gympass• TCS Cares – free 0800 that provides psychological assistance (24 hrs/day), legal, social and financial assistance to associates• Partnership with SESC• Reimbursement of Certifications• Free TCS Learning Portal – Online courses and live training• International experience opportunity• Discount Partnership with Universities and Language Schools• Bring Your Buddy – By referring people you become eligible to receive a bonus for each hire• TCS Gems – Recognition for performance• Xcelerate – Free Mentoring Career Platform• Tata Consultancy Services is an equal opportunity employer, our commitment to diversity & inclusion drives our efforts to provide equal opportunity to all candidates who meet our required knowledge & competency needs, irrespective of any socio-economic background, race, color, national origin, religion, sex, gender identity/expression , age, marital status, disability, sexual orientation or any others. We encourage anyone interested to build a career in TCS to participate in our recruitment & selection process.• At Tata Consultancy Services we promote an inclusive culture, we always work for equity. This applies to Gender, People with Disabilities, LGBTQIA+, Religion, Race, Ethnicity. All our opportunities are based on these principles. We think of different actions of inclusion and social responsibility, in order to build a TCS that respects each person. Our motto is Inclusion without exception.At TATA Consultancy Services we promote an inclusive culture, we always work for equity. This applies to Gender, People with Disabilities, LGBTQIA+, Religion, Race, Ethnicity. All our opportunities are based on these principles. We think of different actions of inclusion and social responsibility, in order to build a TCS that respects individuality. Come to be a TCSer!#BuildingonbeliefRGS - 10331967Show moreShow less",Não especificado,Não especificado,Amazon Web Service,1
