title,company,location,posted,description,applicants,work_mode,link,data_coleta,titulo_descr,senioridade,idioma,certificado,cluster
Data Scientist (Core ML & Statistics),"CloudWalk, Inc.","São Paulo, São Paulo, Brazil",2 weeks ago,"Who we are:CloudWalk is a fintech company reimagining the future of financial services. We are building intelligent infrastructure powered by AI, blockchain, and thoughtful design. Our products serve millions of entrepreneurs across Brazil and the US every day, helping them grow with tools that are fast, fair, and built for how business actually works. Learn more at cloudwalk.io .About the Role:We’re hiring a Data Scientist with strong foundations instatistics, causal inference, and experimental design.Your work will be centered on rigorous analysis: designing robust experiments, validating assumptions, and extracting clear insights from complex data. This is not a “dashboards and KPIs” role — it’s about applying statistical thinking and careful modeling to answer hard questions and guide product direction.We want someone who can think critically with data, separate signal from noise, and provide results that stand up to scrutiny.What You'll Do:Design, run, and analyze A/B tests and other experimental frameworks.Apply statistical inference, hypothesis testing, and causal analysis to evaluate product changes.Build, tune, and interpret classical ML models (regression, classification, ranking) with a focus on explainability and robustness.Use rigorous exploratory analysis to uncover hidden patterns or validate product hypotheses.Develop reproducible workflows for experimentation and modeling.Collaborate with product and engineering to ensure experiments and analyses translate into well-grounded decisions.Contribute to a culture of statistical rigor, clarity, and curiosity.What We Value:Deep understanding of statistics, probability, and causal inference.Comfort moving between theory and practice: from modeling assumptions to implementation details.Clear, precise communication of methods, assumptions, and results.Patience to validate before scaling, and rigor in separating correlation from causation.Bonus Points:Experience with uplift modeling.Experience in product analytics or growth-focused DS.Experience working with Airflow, BigQuery, dbt, or similar data infra.Experience in training and shipping models to production.Familiarity with basic experimentation pitfalls (SRM, novelty effects, power issues).How We Hire:Online assessment: technical logic and fundamentals (Math/Calculus, Statistics, Probability, Machine Learning/Deep Learning, Code).Technical interview: deep dive into theory and reasoning for fraud detection (no code).Cultural interview.If you are not willing to take an online quiz, do not apply.Show moreShow less",,On-site/Hybrid,https://www.linkedin.com/jobs-guest/jobs/api/jobPosting/4286740390,2025-09-10,"Data Scientist (Core ML & Statistics) Who we are:CloudWalk is a fintech company reimagining the future of financial services. We are building intelligent infrastructure powered by AI, blockchain, and thoughtful design. Our products serve millions of entrepreneurs across Brazil and the US every day, helping them grow with tools that are fast, fair, and built for how business actually works. Learn more at cloudwalk.io .About the Role:We’re hiring a Data Scientist with strong foundations instatistics, causal inference, and experimental design.Your work will be centered on rigorous analysis: designing robust experiments, validating assumptions, and extracting clear insights from complex data. This is not a “dashboards and KPIs” role — it’s about applying statistical thinking and careful modeling to answer hard questions and guide product direction.We want someone who can think critically with data, separate signal from noise, and provide results that stand up to scrutiny.What You'll Do:Design, run, and analyze A/B tests and other experimental frameworks.Apply statistical inference, hypothesis testing, and causal analysis to evaluate product changes.Build, tune, and interpret classical ML models (regression, classification, ranking) with a focus on explainability and robustness.Use rigorous exploratory analysis to uncover hidden patterns or validate product hypotheses.Develop reproducible workflows for experimentation and modeling.Collaborate with product and engineering to ensure experiments and analyses translate into well-grounded decisions.Contribute to a culture of statistical rigor, clarity, and curiosity.What We Value:Deep understanding of statistics, probability, and causal inference.Comfort moving between theory and practice: from modeling assumptions to implementation details.Clear, precise communication of methods, assumptions, and results.Patience to validate before scaling, and rigor in separating correlation from causation.Bonus Points:Experience with uplift modeling.Experience in product analytics or growth-focused DS.Experience working with Airflow, BigQuery, dbt, or similar data infra.Experience in training and shipping models to production.Familiarity with basic experimentation pitfalls (SRM, novelty effects, power issues).How We Hire:Online assessment: technical logic and fundamentals (Math/Calculus, Statistics, Probability, Machine Learning/Deep Learning, Code).Technical interview: deep dive into theory and reasoning for fraud detection (no code).Cultural interview.If you are not willing to take an online quiz, do not apply.Show moreShow less",Não especificado,Não especificado,Não especificado,0
Data Scientist III,Banco Bradesco,"Osasco, São Paulo, Brazil",2 weeks ago,"Sobre o BradescoO Bradesco é um dos maiores grupos financeiros do Brasil, com uma história marcada pelo pioneirismo e inovação. Por meio da nossa carteira amplamente diversificada de produtos financeiros, serviços bancários e de seguros contribuímos com a realização das pessoas e o crescimento sustentável de empresas e sociedade. Venha fazer parte do nosso ecossistema financeiro e impactar a experiência de milhões de pessoas!Saiba mais em https://banco.bradesco/html/classic/sobre/index.shtmResponsabilidades e atribuiçõesO que é o nosso time de Compras?A área de Compras tem como missão gerir a Cadeia de Suprimentos, agregando valor desde a origem da necessidade até a gestão de contratos e fornecedores.Modelo de trabalho :Híbrido, 3x presencialUnidade: Osasco - MatrizComo será seu dia a dia?Sendo Data Scientist III, atuará na gerência Data Analytics e suas principais atividades serão:Conduzir projetos avançados de análise de dados que impulsionem os resultados estratégicos da companhia.Desenvolver e implementar modelos preditivos e descritivos utilizando técnicas de Machine Learning e Deep Learning.Aplicar Inteligência Artificial Generativa para resolver desafios complexos e identificar novas oportunidades de negócio.Propor soluções analíticas e estratégias baseadas em dados, desenvolvendo hipóteses e identificando oportunidades de melhoria.Extrair, tratar e preparar grandes volumes de dados, garantindo sua qualidade e integridade.Interpretar resultados e gerar insights acionáveis que apoiem decisões estratégicas nas áreas de Compras e Patrimônio.Monitorar o desempenho dos modelos implementados, realizando ajustes e promovendo melhorias contínuas.Identificar padrões, tendências e oportunidades por meio de análises exploratórias e estatísticas.Requisitos e QualificaçõesO que você precisa ter ou saber?Ensino superior completo em Ciência da Computação, Matemática, Estatística, Engenharia ou áreas correlatas.Conhecimento intermediario SAPExperiência com ferramentas de análise e visualização de dados como Power BIDomínio de linguagens como Python e SQL, Power Automate, com uso de bibliotecas voltadas à ciência de dados e inteligência artificial.Certificações Técnicas em IA GenerativaSerá um diferencial se você tiver:MBA em cursos relacionadosInglês AvançadoO que nós oferecemosNo Bradesco valorizamos a saúde e bem-estar, oferecendo um extenso portfólio de benefícios a todas nossas pessoas funcionárias:PLR ou Bônus: Conforme a elegibilidade de cargo*Convênio MédicoConvênio OdontológicoSeguro de VidaVale AlimentaçãoVale Refeição13º Cesta AlimentaçãoTotal PassVale Transporte (adesão opcional)Descontos em produtos e serviços em empresas parceirasPrevidência Privada (adesão opcional, com participação financeira da Organização Bradesco)Viva Bem Bradesco: programa de saúde, bem-estar e qualidade de vidaUnibrad: Universidade Corporativa BradescoIsenção de Tarifas: condições especiais em diversos produtos e serviçosAuxílio Creche ou BabáLicença Paternidade estendida de 20 diasLicença Maternidade de 180 dias, acompanhamento assistencial da gestação até o pós-partoShow moreShow less",,On-site/Hybrid,https://www.linkedin.com/jobs-guest/jobs/api/jobPosting/4290210661,2025-09-10,"Data Scientist III Sobre o BradescoO Bradesco é um dos maiores grupos financeiros do Brasil, com uma história marcada pelo pioneirismo e inovação. Por meio da nossa carteira amplamente diversificada de produtos financeiros, serviços bancários e de seguros contribuímos com a realização das pessoas e o crescimento sustentável de empresas e sociedade. Venha fazer parte do nosso ecossistema financeiro e impactar a experiência de milhões de pessoas!Saiba mais em https://banco.bradesco/html/classic/sobre/index.shtmResponsabilidades e atribuiçõesO que é o nosso time de Compras?A área de Compras tem como missão gerir a Cadeia de Suprimentos, agregando valor desde a origem da necessidade até a gestão de contratos e fornecedores.Modelo de trabalho :Híbrido, 3x presencialUnidade: Osasco - MatrizComo será seu dia a dia?Sendo Data Scientist III, atuará na gerência Data Analytics e suas principais atividades serão:Conduzir projetos avançados de análise de dados que impulsionem os resultados estratégicos da companhia.Desenvolver e implementar modelos preditivos e descritivos utilizando técnicas de Machine Learning e Deep Learning.Aplicar Inteligência Artificial Generativa para resolver desafios complexos e identificar novas oportunidades de negócio.Propor soluções analíticas e estratégias baseadas em dados, desenvolvendo hipóteses e identificando oportunidades de melhoria.Extrair, tratar e preparar grandes volumes de dados, garantindo sua qualidade e integridade.Interpretar resultados e gerar insights acionáveis que apoiem decisões estratégicas nas áreas de Compras e Patrimônio.Monitorar o desempenho dos modelos implementados, realizando ajustes e promovendo melhorias contínuas.Identificar padrões, tendências e oportunidades por meio de análises exploratórias e estatísticas.Requisitos e QualificaçõesO que você precisa ter ou saber?Ensino superior completo em Ciência da Computação, Matemática, Estatística, Engenharia ou áreas correlatas.Conhecimento intermediario SAPExperiência com ferramentas de análise e visualização de dados como Power BIDomínio de linguagens como Python e SQL, Power Automate, com uso de bibliotecas voltadas à ciência de dados e inteligência artificial.Certificações Técnicas em IA GenerativaSerá um diferencial se você tiver:MBA em cursos relacionadosInglês AvançadoO que nós oferecemosNo Bradesco valorizamos a saúde e bem-estar, oferecendo um extenso portfólio de benefícios a todas nossas pessoas funcionárias:PLR ou Bônus: Conforme a elegibilidade de cargo*Convênio MédicoConvênio OdontológicoSeguro de VidaVale AlimentaçãoVale Refeição13º Cesta AlimentaçãoTotal PassVale Transporte (adesão opcional)Descontos em produtos e serviços em empresas parceirasPrevidência Privada (adesão opcional, com participação financeira da Organização Bradesco)Viva Bem Bradesco: programa de saúde, bem-estar e qualidade de vidaUnibrad: Universidade Corporativa BradescoIsenção de Tarifas: condições especiais em diversos produtos e serviçosAuxílio Creche ou BabáLicença Paternidade estendida de 20 diasLicença Maternidade de 180 dias, acompanhamento assistencial da gestação até o pós-partoShow moreShow less",Não especificado,Inglês,Não especificado,4
Gen AI Scientist,AVANTTi,"São Paulo, São Paulo, Brazil",1 month ago,"Estamos em busca de um(a) Cientista de IA Generativa talentoso(a) e inovador(a) para se juntar à nossa equipe.Neste cargo, você desempenhará um papel fundamental ao utilizar Modelos de Linguagem de Grande Escala (LLMs) para oferecer respostas mais precisas, sensíveis ao contexto e criativamente elaboradas, com aplicações no mundo real. Como Cientista de IA Generativa, você será responsável por desenvolver e melhorar a usabilidade e criatividade das respostas geradas por nossos LLMs.Você trabalhará em estreita colaboração com nossa equipe multidisciplinar de cientistas de dados e engenheiros, com o objetivo não apenas de avançar nos aspectos técnicos, mas também de trazer relevância prática e criatividade às soluções baseadas em modelos de linguagem.O(a) candidato(a) ideal utilizará as mais recentes inovações em NLP (Processamento de Linguagem Natural) e LLMs para propor soluções de software que melhorem a experiência do cliente. O Cientista de Dados de IA Generativa irá projetar e testar algoritmos, realizar protótipos para avaliar possíveis cenários e aplicar técnicas computacionais e estatísticas no desenvolvimento de abordagens inovadoras para dados de texto e imagem.RequisitosHabilidades exigidas:Doutorado (ou Mestrado com mais de 10 anos de experiência após o título) em Ciência da Computação, Engenharia Elétrica, Física, Matemática, Estatística ou áreas relacionadas à Análise de Dados.Mais de 7 anos de experiência profissional.Capacidade de escrever código pronto para produção em Python ou outra linguagem de programação de alto nível.Bom entendimento do funcionamento interno dos LLMs.Experiência no desenvolvimento de modelos estatísticos e de aprendizado de máquina.Experiência em análise e apresentação de dados complexos, com habilidades comprovadas em resolução de problemas.Show moreShow less",,On-site/Hybrid,https://www.linkedin.com/jobs-guest/jobs/api/jobPosting/4268464881,2025-09-10,"Gen AI Scientist Estamos em busca de um(a) Cientista de IA Generativa talentoso(a) e inovador(a) para se juntar à nossa equipe.Neste cargo, você desempenhará um papel fundamental ao utilizar Modelos de Linguagem de Grande Escala (LLMs) para oferecer respostas mais precisas, sensíveis ao contexto e criativamente elaboradas, com aplicações no mundo real. Como Cientista de IA Generativa, você será responsável por desenvolver e melhorar a usabilidade e criatividade das respostas geradas por nossos LLMs.Você trabalhará em estreita colaboração com nossa equipe multidisciplinar de cientistas de dados e engenheiros, com o objetivo não apenas de avançar nos aspectos técnicos, mas também de trazer relevância prática e criatividade às soluções baseadas em modelos de linguagem.O(a) candidato(a) ideal utilizará as mais recentes inovações em NLP (Processamento de Linguagem Natural) e LLMs para propor soluções de software que melhorem a experiência do cliente. O Cientista de Dados de IA Generativa irá projetar e testar algoritmos, realizar protótipos para avaliar possíveis cenários e aplicar técnicas computacionais e estatísticas no desenvolvimento de abordagens inovadoras para dados de texto e imagem.RequisitosHabilidades exigidas:Doutorado (ou Mestrado com mais de 10 anos de experiência após o título) em Ciência da Computação, Engenharia Elétrica, Física, Matemática, Estatística ou áreas relacionadas à Análise de Dados.Mais de 7 anos de experiência profissional.Capacidade de escrever código pronto para produção em Python ou outra linguagem de programação de alto nível.Bom entendimento do funcionamento interno dos LLMs.Experiência no desenvolvimento de modelos estatísticos e de aprendizado de máquina.Experiência em análise e apresentação de dados complexos, com habilidades comprovadas em resolução de problemas.Show moreShow less",Não especificado,Não especificado,Não especificado,2
Vem ser Ituber – Oportunidades direcionadas para Mulheres na Tecnologia 💪🏽,Itaú Unibanco,"São Paulo, São Paulo, Brazil",1 week ago,"vem construir o Itaú_Ei, você que émulher (cis e trans)na tecnologia, quer criar soluções que impactem a vida de milhares de pessoas todos os dias?Então vamos de turma!Se inscrever nessa oportunidade ajuda nossa liderança e recrutadores a te encontrar. Sempre que aparece uma posição com seu perfil, nós podemos acionar você😉Aqui no Itaú, trabalhamos paraevoluir e construir uma sociedade mais inclusiva e equânimecom ações para dentro e fora do banco, ampliando a representatividade, respeito e inclusão. Temos o objetivo de sermos cada vez mais diversos, o que também significa termos mais mulheres na tecnologia, área essencial rumo à transformação que desejamos 🚀E aí, bora?Essa é uma oportunidade exclusiva para todas as identidades femininas. Se interessou? Queremos um Itaú mais diverso e#feitocomvc.O que esperamos de você?Aqui nos organizamos por modelos de comunidades (tribos) e você, mulher na tecnologia, fará parte de um time robusto e inovador.Buscamos aprendizado constanteFocamos na melhor experiência para o clienteSomos colaborativas e sabemos oferecer e pedir ajudaSomos proativas! Pensamos e agimos como donasTemos resiliência e não nos limitamosÉtica para nós é inegociávelEsse é um conjunto de conhecimentos que compõe as carreiras de tecnologia que fazem a diferença no nosso time.Se você se identifica com alguma das carreiras abaixo, inscreva-se!Engenharia de Software Back-end: JAVA | .Net | Kotlin | Entre outrasEngenharia de Software Mobile: iOS e Android - Swift | Java | KotlinEngenharia de Software Qualidade: Silktest e SilkCentral, ferramentas de qualidade de testesEngenharia de Software Front-end: (Angular | React | JavaScript)Engenharia de dados: (Ex: Python, Hadoop, Big Data, Spark, Hive , Kafka, Banco de dados)Projetos e Processos: Metodologias de projetos ágeis (Scrum l Método Kanban l Safe) econhecimento em Melhoria contínua e suas ferramentas (A3,PDCA, Kaizen)💡Conhecimento em AWS será um grande diferencial!Cada pessoa é única e valorizamos isso, afinal, ser Ituber é ser tão diverso quanto nossos clientes!🧡 nossos valores_Pra gente, ética é inegociávelA gente trabalha para o clienteA gente não sabe tudoA gente vai de turmaA gente quer diversidadeA gente é movido por resultadoCom quais benefícios vou poder contar?Vale TransporteVale Refeição (Restaurantes) / Vale Alimentação (Supermercados)Convênio médico e odontológicoSeguro de VidaPLR (Mediante resultados do banco)Previdência privadaDescontos exclusivos em nossos produtos financeirosLicença maternidade estendidaAuxílio Creche / Babá (para papais e mamães)Incentivo a estudosGym Pass (Mas se preferir temos Bio Ritmo em alguns polos)Acesso aos Clubes Itaú (Guarapiranga / Itanhaém e São Sebastião)+ Algumas vantagens que você pode conhecer durante o processo 😊O Itaú irá utilizar os dados fornecidos para fins de processos seletivos, inclusive em bancos de vagas alocados em plataformas terceiras. Caso deseje solicitar oposição a este uso, ou exercer quaisquer um dos seus direitos, entre em contato através de nossos canais, disponíveis na Política de Privacidade de candidatos do Itaú Unibanco (https://www.itau.com.br/privacidade/candidatos/). Não há necessidade de aceitar, trata-se apenas de uma ciência.Show moreShow less",,On-site/Hybrid,https://www.linkedin.com/jobs-guest/jobs/api/jobPosting/4197742008,2025-09-10,"Vem ser Ituber – Oportunidades direcionadas para Mulheres na Tecnologia 💪🏽 vem construir o Itaú_Ei, você que émulher (cis e trans)na tecnologia, quer criar soluções que impactem a vida de milhares de pessoas todos os dias?Então vamos de turma!Se inscrever nessa oportunidade ajuda nossa liderança e recrutadores a te encontrar. Sempre que aparece uma posição com seu perfil, nós podemos acionar você😉Aqui no Itaú, trabalhamos paraevoluir e construir uma sociedade mais inclusiva e equânimecom ações para dentro e fora do banco, ampliando a representatividade, respeito e inclusão. Temos o objetivo de sermos cada vez mais diversos, o que também significa termos mais mulheres na tecnologia, área essencial rumo à transformação que desejamos 🚀E aí, bora?Essa é uma oportunidade exclusiva para todas as identidades femininas. Se interessou? Queremos um Itaú mais diverso e#feitocomvc.O que esperamos de você?Aqui nos organizamos por modelos de comunidades (tribos) e você, mulher na tecnologia, fará parte de um time robusto e inovador.Buscamos aprendizado constanteFocamos na melhor experiência para o clienteSomos colaborativas e sabemos oferecer e pedir ajudaSomos proativas! Pensamos e agimos como donasTemos resiliência e não nos limitamosÉtica para nós é inegociávelEsse é um conjunto de conhecimentos que compõe as carreiras de tecnologia que fazem a diferença no nosso time.Se você se identifica com alguma das carreiras abaixo, inscreva-se!Engenharia de Software Back-end: JAVA | .Net | Kotlin | Entre outrasEngenharia de Software Mobile: iOS e Android - Swift | Java | KotlinEngenharia de Software Qualidade: Silktest e SilkCentral, ferramentas de qualidade de testesEngenharia de Software Front-end: (Angular | React | JavaScript)Engenharia de dados: (Ex: Python, Hadoop, Big Data, Spark, Hive , Kafka, Banco de dados)Projetos e Processos: Metodologias de projetos ágeis (Scrum l Método Kanban l Safe) econhecimento em Melhoria contínua e suas ferramentas (A3,PDCA, Kaizen)💡Conhecimento em AWS será um grande diferencial!Cada pessoa é única e valorizamos isso, afinal, ser Ituber é ser tão diverso quanto nossos clientes!🧡 nossos valores_Pra gente, ética é inegociávelA gente trabalha para o clienteA gente não sabe tudoA gente vai de turmaA gente quer diversidadeA gente é movido por resultadoCom quais benefícios vou poder contar?Vale TransporteVale Refeição (Restaurantes) / Vale Alimentação (Supermercados)Convênio médico e odontológicoSeguro de VidaPLR (Mediante resultados do banco)Previdência privadaDescontos exclusivos em nossos produtos financeirosLicença maternidade estendidaAuxílio Creche / Babá (para papais e mamães)Incentivo a estudosGym Pass (Mas se preferir temos Bio Ritmo em alguns polos)Acesso aos Clubes Itaú (Guarapiranga / Itanhaém e São Sebastião)+ Algumas vantagens que você pode conhecer durante o processo 😊O Itaú irá utilizar os dados fornecidos para fins de processos seletivos, inclusive em bancos de vagas alocados em plataformas terceiras. Caso deseje solicitar oposição a este uso, ou exercer quaisquer um dos seus direitos, entre em contato através de nossos canais, disponíveis na Política de Privacidade de candidatos do Itaú Unibanco (https://www.itau.com.br/privacidade/candidatos/). Não há necessidade de aceitar, trata-se apenas de uma ciência.Show moreShow less",Não especificado,Não especificado,Amazon Web Service,2
