title,company,location,posted,description,applicants,work_mode,link,data_coleta,titulo_descr,senioridade,idioma,certificado,cluster
Consultor Júnior,Grape Consulting,"São Paulo, São Paulo, Brazil",1 day ago,"Consultor JúniorNa Grape, acreditamos que profissionais crescem através de formação teórica e executando na prática, dando responsabilidade, exposição e execução a grandes desafios.Procuramos profissionais em início de carreira que desejam acelerar seu desenvolvimento participando da solução de problemas reais de negócio em grandes organizações.Você atuará diretamente em projetos de eficiência operacional, otimização de despesas, melhoria de performance comercial e reestruturação de processos utilizando métodos de gestão amplamente reconhecidos difundidos nas maiores companhias do mundo.O que você fará:Estruturará análises quantitativas e qualitativas para levantar oportunidades de aumento de resultado e melhoria do modelo de gestão de grandes companhiasConstruirá planos de ação de maneira colaborativa com os clientes, propondo e implantando iniciativas para resolver os problemasTrabalhará ao lado de consultores experientes em projetos de alta complexidade, com seu esforço sendo diretamente reconhecido conforme o resultado geradoRequisitosFormação em Engenharia, Economia, Administração, Estatística, Matemática, Ciência de Dados, Ciência da Computação ou correlatasForte capacidade analíticaExcelente comunicação escrita e verbalOrganização e disciplinaDisponibilidade para viagens frequentesDiferenciaisExperiência prévia em consultoriaFormação em Lean e Seis SigmaFormação complementar em ferramentas analíticas (Power BI, SQL, Python)O que valorizamosCuriosidade intelectualResponsabilidade individual elevadaVontade genuína de aprenderCapacidade de lidar com desafios complexosCompromisso com qualidade e caprichoNossos colaboradores contam com:Remuneração diferenciadaRemuneração variável diretamente vinculada aos resultados individuaisPlano de carreira estruturadoProgramas de treinamento internos e externosBenefícios acima do mercadoExposição frequente com profissionais/executivos de referênciaShow moreShow less",,On-site/Hybrid,https://www.linkedin.com/jobs-guest/jobs/api/jobPosting/4419278255,2026-06-03,"Consultor Júnior Consultor JúniorNa Grape, acreditamos que profissionais crescem através de formação teórica e executando na prática, dando responsabilidade, exposição e execução a grandes desafios.Procuramos profissionais em início de carreira que desejam acelerar seu desenvolvimento participando da solução de problemas reais de negócio em grandes organizações.Você atuará diretamente em projetos de eficiência operacional, otimização de despesas, melhoria de performance comercial e reestruturação de processos utilizando métodos de gestão amplamente reconhecidos difundidos nas maiores companhias do mundo.O que você fará:Estruturará análises quantitativas e qualitativas para levantar oportunidades de aumento de resultado e melhoria do modelo de gestão de grandes companhiasConstruirá planos de ação de maneira colaborativa com os clientes, propondo e implantando iniciativas para resolver os problemasTrabalhará ao lado de consultores experientes em projetos de alta complexidade, com seu esforço sendo diretamente reconhecido conforme o resultado geradoRequisitosFormação em Engenharia, Economia, Administração, Estatística, Matemática, Ciência de Dados, Ciência da Computação ou correlatasForte capacidade analíticaExcelente comunicação escrita e verbalOrganização e disciplinaDisponibilidade para viagens frequentesDiferenciaisExperiência prévia em consultoriaFormação em Lean e Seis SigmaFormação complementar em ferramentas analíticas (Power BI, SQL, Python)O que valorizamosCuriosidade intelectualResponsabilidade individual elevadaVontade genuína de aprenderCapacidade de lidar com desafios complexosCompromisso com qualidade e caprichoNossos colaboradores contam com:Remuneração diferenciadaRemuneração variável diretamente vinculada aos resultados individuaisPlano de carreira estruturadoProgramas de treinamento internos e externosBenefícios acima do mercadoExposição frequente com profissionais/executivos de referênciaShow moreShow less",Júnior,Não especificado,Não especificado,3
AI Trainer - Freelance Data Annotator,Toloka Annotators,"São Paulo, São Paulo, Brazil",1 week ago,"Please submit your resume in English and indicate your level of English.At Toloka, we connect smart, curious people from around the world with freelance online tasks that train and improve artificial intelligence.What We DoThe Toloka Annotators connects individuals with Generative AI projects from leading tech innovators. Our mission is to unlock the full potential of AI by involving real people from around the world in the development process.About The RoleAnnotation is what helps AI make sense of the world. As an annotator, you may be invited to take part in online projects such as rating AI-generated content, evaluating factual accuracy, or comparing responses - when projects are available.Responsibilities:Carefully review provided data (text, images, or videos)Label or classify content based on project guidelinesIdentify and flag factually incorrect, sensitive, inappropriate, or unclear materialImportant note:This is project-based work. Tasks are availableonly when projects are active. You may be invited to one or more projects depending on your profile and current opportunities.Each project has its own compensation level based on scope and expertise required. On this project, AI trainers earn up to$9 per hour equivalent.RequirementsBachelor's degree in any disciplineMinimum 1 year of experience in any professional roleAdvanced level of English (C1 or higher), both written and spokenLogical thinking, fact-checking and reasoning abilitiesStrong attention to detail and ability to understand and follow complex instructionsStrong communication skills, including the ability to ask clarifying questions when neededGenuine interest in technology and artificial intelligenceBenefitsWhy this freelance opportunity might be a great fit for you?Take part in a part-time, remote, freelance project that fits around your primary professional or academic commitmentsWork on advanced AI projects and gain valuable experience that enhances your portfolioInfluence how future AI models understand and communicate in your field of expertiseShow moreShow less",,Remote,https://www.linkedin.com/jobs-guest/jobs/api/jobPosting/4418962387,2026-06-03,"AI Trainer - Freelance Data Annotator Please submit your resume in English and indicate your level of English.At Toloka, we connect smart, curious people from around the world with freelance online tasks that train and improve artificial intelligence.What We DoThe Toloka Annotators connects individuals with Generative AI projects from leading tech innovators. Our mission is to unlock the full potential of AI by involving real people from around the world in the development process.About The RoleAnnotation is what helps AI make sense of the world. As an annotator, you may be invited to take part in online projects such as rating AI-generated content, evaluating factual accuracy, or comparing responses - when projects are available.Responsibilities:Carefully review provided data (text, images, or videos)Label or classify content based on project guidelinesIdentify and flag factually incorrect, sensitive, inappropriate, or unclear materialImportant note:This is project-based work. Tasks are availableonly when projects are active. You may be invited to one or more projects depending on your profile and current opportunities.Each project has its own compensation level based on scope and expertise required. On this project, AI trainers earn up to$9 per hour equivalent.RequirementsBachelor's degree in any disciplineMinimum 1 year of experience in any professional roleAdvanced level of English (C1 or higher), both written and spokenLogical thinking, fact-checking and reasoning abilitiesStrong attention to detail and ability to understand and follow complex instructionsStrong communication skills, including the ability to ask clarifying questions when neededGenuine interest in technology and artificial intelligenceBenefitsWhy this freelance opportunity might be a great fit for you?Take part in a part-time, remote, freelance project that fits around your primary professional or academic commitmentsWork on advanced AI projects and gain valuable experience that enhances your portfolioInfluence how future AI models understand and communicate in your field of expertiseShow moreShow less",Não especificado,Não especificado,Não especificado,0
Cientista de Dados Sênior,Serasa Experian,"São Paulo, São Paulo, Brazil",20 hours ago,"Company DescriptionA Serasa Experian é a primeira e a maior Datatech do Brasil. Líder em soluções de inteligência para análise de riscos e oportunidades, com foco nas jornadas de crédito, autenticação e prevenção à fraude. Com tecnologia de ponta, inovação e os melhores talentos, transforma a incerteza do risco na melhor decisão, ajudando pessoas a realizarem seus sonhos e empresas de todos os portes e segmentos a prosperarem.Temos 22.000 pessoas operando em 32 países e a cada dia estamos investindo em novas tecnologias, profissionais talentosos e inovação para ajudar todos os clientes a maximizarem cada oportunidade. Com sede corporativa em Dublin, Irlanda, a Experian está listada na Bolsa de Valores de Londres (EXPN) e compõe o índice FTSE 100.Job DescriptionDescrição do trabalhoO(a) Cientista de Dados Sênior será responsável por liderar tecnicamente o desenvolvimento de modelos avançados, produtos analíticos e soluções baseadas em IA/ML que suportem decisões estratégicas e entreguem valor direto para clientes e áreas de negócio da Serasa Experian.Esta posição atua como referência técnica, conectando estratégia, tecnologia e negócio, garantindo excelência em modelagem, boas práticas de engenharia, escalabilidade e impacto mensurável.ResponsabilidadesAtuar como referência técnica no desenvolvimento de soluções de Dados (Machine Learning, estatística avançada e IA).Liderar tecnicamente projetos de dados end-to-end, desde a concepção até a implementação em produção.Garantir boas práticas de engenharia analítica, MLOps e governança de modelos.Desenvolver e otimizar modelos de Machine Learning com foco em performance, interpretabilidade e escalabilidade.Garantir monitoramento, manutenção e evolução contínua dos modelos em produção.Traduzir problemas de negócio em hipóteses analíticas e soluções robustas.Apoiar decisões estratégicas por meio de análises, experimentos e mensuração de impacto.Colaborar com times multidisciplinares (negócio, engenharia, produto) na construção de soluções.Comunicar resultados complexos de forma clara para públicos técnicos e executivos.Avaliar viabilidade técnica, ROI e riscos de iniciativas baseadas em dados.Atuar como mentor técnico para profissionais mais juniores, contribuindo para evolução do time.QualificationsQualificaçõesGraduação em áreas como Computação, Estatística, Engenharia ou correlatas.Proficiência em Python (ou R) e bibliotecas de dados/ML.Vivência no ciclo de ponta a ponta de modelos (exploração, treino, validação e deploy).Experiência prática de desenvolvimento com Databricks (notebooks, jobs/workflows e/ou Databricks SQL).Experiência sólida com desenvolvimento de modelos de Machine Learning e análise de dados.Familiaridade com ambientes de cloud (AWS, Azure ou GCP).Additional InformationA Serasa Experian é muito mais do que você imagina. Com o propósito de criar um futuro melhor, ampliando oportunidades para pessoas e empresas, no Brasil somos mais de 4 mil pessoas que atuam em diversos times e especialidades. Aqui, cada conhecimento e diversidade se complementa e você pode trabalhar no que mais ama, estamos comprometidos a construir uma cultura inclusiva e um ambiente no qual pessoas possam equilibrar a carreira com seus compromissos e interesses pessoais, prezando pelo bem-estar.A gente se dedica muito em ser uma das melhores e mais inovadoras empresas para se trabalhar do país, possibilitando experiências e carreiras incríveis para nossas pessoas. Nossa forte abordagem de pessoas em primeiro lugar é reconhecida externamente por meio de diversas certificações de mercado: fomos premiados pelo Great Place To Work™ em 24 países e pela certificação internacional Top Employers, além de sermos reconhecidos como uma das melhores empresas para jovens profissionais e contarmos com uma avaliação de 4,6 no Glassdoor. Cada reconhecimento nos indica que estamos no caminho certo, proporcionando um ambiente de trabalho cada vez melhor para nossos talentos.Experian Careers - Creating a better tomorrow togetherFind out what its like to work for Experian by clicking hereShow moreShow less",,On-site/Hybrid,https://www.linkedin.com/jobs-guest/jobs/api/jobPosting/4422481554,2026-06-03,"Cientista de Dados Sênior Company DescriptionA Serasa Experian é a primeira e a maior Datatech do Brasil. Líder em soluções de inteligência para análise de riscos e oportunidades, com foco nas jornadas de crédito, autenticação e prevenção à fraude. Com tecnologia de ponta, inovação e os melhores talentos, transforma a incerteza do risco na melhor decisão, ajudando pessoas a realizarem seus sonhos e empresas de todos os portes e segmentos a prosperarem.Temos 22.000 pessoas operando em 32 países e a cada dia estamos investindo em novas tecnologias, profissionais talentosos e inovação para ajudar todos os clientes a maximizarem cada oportunidade. Com sede corporativa em Dublin, Irlanda, a Experian está listada na Bolsa de Valores de Londres (EXPN) e compõe o índice FTSE 100.Job DescriptionDescrição do trabalhoO(a) Cientista de Dados Sênior será responsável por liderar tecnicamente o desenvolvimento de modelos avançados, produtos analíticos e soluções baseadas em IA/ML que suportem decisões estratégicas e entreguem valor direto para clientes e áreas de negócio da Serasa Experian.Esta posição atua como referência técnica, conectando estratégia, tecnologia e negócio, garantindo excelência em modelagem, boas práticas de engenharia, escalabilidade e impacto mensurável.ResponsabilidadesAtuar como referência técnica no desenvolvimento de soluções de Dados (Machine Learning, estatística avançada e IA).Liderar tecnicamente projetos de dados end-to-end, desde a concepção até a implementação em produção.Garantir boas práticas de engenharia analítica, MLOps e governança de modelos.Desenvolver e otimizar modelos de Machine Learning com foco em performance, interpretabilidade e escalabilidade.Garantir monitoramento, manutenção e evolução contínua dos modelos em produção.Traduzir problemas de negócio em hipóteses analíticas e soluções robustas.Apoiar decisões estratégicas por meio de análises, experimentos e mensuração de impacto.Colaborar com times multidisciplinares (negócio, engenharia, produto) na construção de soluções.Comunicar resultados complexos de forma clara para públicos técnicos e executivos.Avaliar viabilidade técnica, ROI e riscos de iniciativas baseadas em dados.Atuar como mentor técnico para profissionais mais juniores, contribuindo para evolução do time.QualificationsQualificaçõesGraduação em áreas como Computação, Estatística, Engenharia ou correlatas.Proficiência em Python (ou R) e bibliotecas de dados/ML.Vivência no ciclo de ponta a ponta de modelos (exploração, treino, validação e deploy).Experiência prática de desenvolvimento com Databricks (notebooks, jobs/workflows e/ou Databricks SQL).Experiência sólida com desenvolvimento de modelos de Machine Learning e análise de dados.Familiaridade com ambientes de cloud (AWS, Azure ou GCP).Additional InformationA Serasa Experian é muito mais do que você imagina. Com o propósito de criar um futuro melhor, ampliando oportunidades para pessoas e empresas, no Brasil somos mais de 4 mil pessoas que atuam em diversos times e especialidades. Aqui, cada conhecimento e diversidade se complementa e você pode trabalhar no que mais ama, estamos comprometidos a construir uma cultura inclusiva e um ambiente no qual pessoas possam equilibrar a carreira com seus compromissos e interesses pessoais, prezando pelo bem-estar.A gente se dedica muito em ser uma das melhores e mais inovadoras empresas para se trabalhar do país, possibilitando experiências e carreiras incríveis para nossas pessoas. Nossa forte abordagem de pessoas em primeiro lugar é reconhecida externamente por meio de diversas certificações de mercado: fomos premiados pelo Great Place To Work™ em 24 países e pela certificação internacional Top Employers, além de sermos reconhecidos como uma das melhores empresas para jovens profissionais e contarmos com uma avaliação de 4,6 no Glassdoor. Cada reconhecimento nos indica que estamos no caminho certo, proporcionando um ambiente de trabalho cada vez melhor para nossos talentos.Experian Careers - Creating a better tomorrow togetherFind out what its like to work for Experian by clicking hereShow moreShow less",Sênior,Não especificado,Microsoft Azure,4
Clone: Cientista de Dados Senior,WTime Business Intelligence,"São Paulo, São Paulo, Brazil",1 month ago,"A Wtime é uma empresa com mais de 10 anos no mercado, especializada em tecnologia e inovação, obtendo reconhecimento pela qualidade e entrega. Além de carregarmos com muito orgulho o selo TETRA GPTW, ranqueada entre as 100 melhores empresas para se trabalhar no estado de São Paulo.RequisitosRequisitos:Graduação concluída em Estatística, Ciência da Computação, Engenharia, Matemática, Economia ou áreas correlatas.Experiência prévia com projetos de ciência de dados ou análise de dados.Experiência no setor de saúde será considerada um diferencial.Programação: Conhecimento básico em Python (pandas, scikit-learn) e SQL.Modelagem: Familiaridade com técnicas como regressão, classificação e séries temporais.Ferramentas: Noções de Git, MLflow e uso de ambientes em nuvem (Azure, AWS ou GCP).Visualização de dados: Experiência com Power BI ou ferramentas similares será um diferencial.Principais ResponsabilidadesRealizar tradução de problemas de negócio em hipóteses e análises exploratórias.Participar da construção e avaliação de modelos de machine learning.Desenvolver scripts e pipelines simples para tratamento e análise de dados.Colaborar com engenheiros de dados, equipes clínicas e áreas de negócio.Documentar aprendizados e garantir organização do código.Contribuir com dashboards e relatórios para comunicação dos resultados.Show moreShow less",,On-site/Hybrid,https://www.linkedin.com/jobs-guest/jobs/api/jobPosting/4406249536,2026-06-03,"Clone: Cientista de Dados Senior A Wtime é uma empresa com mais de 10 anos no mercado, especializada em tecnologia e inovação, obtendo reconhecimento pela qualidade e entrega. Além de carregarmos com muito orgulho o selo TETRA GPTW, ranqueada entre as 100 melhores empresas para se trabalhar no estado de São Paulo.RequisitosRequisitos:Graduação concluída em Estatística, Ciência da Computação, Engenharia, Matemática, Economia ou áreas correlatas.Experiência prévia com projetos de ciência de dados ou análise de dados.Experiência no setor de saúde será considerada um diferencial.Programação: Conhecimento básico em Python (pandas, scikit-learn) e SQL.Modelagem: Familiaridade com técnicas como regressão, classificação e séries temporais.Ferramentas: Noções de Git, MLflow e uso de ambientes em nuvem (Azure, AWS ou GCP).Visualização de dados: Experiência com Power BI ou ferramentas similares será um diferencial.Principais ResponsabilidadesRealizar tradução de problemas de negócio em hipóteses e análises exploratórias.Participar da construção e avaliação de modelos de machine learning.Desenvolver scripts e pipelines simples para tratamento e análise de dados.Colaborar com engenheiros de dados, equipes clínicas e áreas de negócio.Documentar aprendizados e garantir organização do código.Contribuir com dashboards e relatórios para comunicação dos resultados.Show moreShow less",Sênior,Não especificado,Microsoft Azure,1
