title,company,location,posted,description,applicants,work_mode,link,data_coleta,titulo_descr,senioridade,idioma,certificado,cluster
CIENTISTA DE DADOS PL - 14178,Marketdata,"São Paulo, São Paulo, Brazil",1 month ago,"AMarketdata&Matché a união de duas líderes em Customer Experience e Marketing Automation, formando uma das maiores potências do setor na América Latina. Atuamos com excelência em dados, tecnologia e marketing, implementando e operando plataformas como Salesforce Marketing Cloud. Unimos inteligência analítica, personalização e performance para impulsionar estratégias de CRM e Customer Experience.Integramos uma equipe multidisciplinar e uma metodologia orientada a resultados, entregando soluções que fortalecem o relacionamento entre marcas e consumidores e promovem experiências relevantes, mensuráveis e escaláveis. Somos reconhecidos comoParceira do Ano no ecossistema Salesforce, e integramos o maior hub de Martech e CX da América Latina, entregando excelência em toda a jornada de consumo.Aqui, dados não são apenas números — são direcionamento estratégico. Você vai conectar dados ao negócio e transformar informação em decisões concretas. Seu papel será provocar discussões, estruturar hipóteses, desenvolver análises profundas e criar modelos preditivos que realmente impactem resultados. Mais do que gerar relatórios, você irá interpretar cenários, identificar oportunidades, mensurar campanhas com rigor e construir sistemas de acompanhamento que elevem o nível das decisões.Se você gosta de questionar, investigar, modelar e influenciar com dados — esse desafio é para você.Desafios e AtividadesElo Analítico: Atuar como o braço de inteligência da squad, contribuindo com a geração de insights para orientar os trabalhos.Planejamento Estratégico: Discutir demandas com a gestão e participar ativamente no planejamento das atividades de Analytics que alimentam a squad.Modelagem e Investigação: Desenvolver análises de dados, estudos investigativos e modelos preditivos, aplicando senso crítico apurado aos resultados obtidos.Visão de Negócio: Interpretar os resultados das análises sob a perspectiva estratégica e gerar relatórios, dashboards e materiais executivos de alto impacto.Mensuração: Criar sistemas de acompanhamento de resultados e métodos robustos para mensuração de campanhas.Governança: Manter uma documentação organizada de todas as etapas de trabalho durante a elaboração das análises e modelos.Para Assumir Esse Desafio, Você Precisa TerEstatística e Modelagem: Experiência sólida em modelagem estatística, com foco em segmentação e modelos de propensão.Conhecimento de Marketing: Familiaridade com métodos de mensuração de campanhas e métricas de performance.Programação: Domínio de R ou Python para execução e automação de modelos.Manipulação de Dados: SQL Avançado para extração e tratamento de grandes volumes de informação.Idiomas: Fluência em inglês (essencial para colaboração e documentação).Ferramentas de Apoio: Domínio de Excel e PowerPoint para análises rápidas e apresentações executivas.Formato De AtuaçãoModelo híbrido, com atuação presencial média de 2x por semana na região da Vila Leopoldina (São Paulo).Como atuamos diretamente com diferentes clientes, pode haver necessidade de presença adicional de acordo com o projeto ou demanda. Buscamos profissionais com flexibilidade.O Que OferecemosAuxílio Educacional (inglês, espanhol, graduação e pós-graduação)Plataforma exclusiva de IA + Academia própria de formação em Inteligência ArtificialMarketdata Academy (Treinamentos mensais à disposição dos colaboradores)Parcerias com diversas instituições de ensinoPLR e Happy Day (day off no dia do aniversário)Assistência Médica e OdontológicaAuxílio home office*Programa interno de orientação psicológica, financeira e jurídicaTotalPass e Ginástica LaboralVale Refeição e/ou Alimentação (inclusive no mês das férias)Vale Transporte (opcional)Seguro de Vida e Banco de HorasLicença Maternidade/Paternidade Estendidos e Auxílio CrecheConvênio com CinemarkNa VML, estamos comprometidos em promover um ambiente de trabalho totalmente inclusivo que seja gratificante e que impulsione a carreira. Acreditamos na criação de um ambiente de trabalho dinâmico que valorize a diversidade e a inclusão e nos esforçamos para recrutar uma lista diversificada de candidatos para nos ajudar a atingir esse objetivo. Teremos o prazer de fornecer adaptações razoáveis a pessoas com deficiência que precisem de uma adaptação para usar ou acessar o site de carreiras da VML ou para participar plenamente do processo de candidatura. Caso necessite de uma adaptação para concluir a sua candidatura ou outro aspeto do nosso processo de recrutamento devido a uma deficiência, entre em contato com o nosso departamento de Recursos Humanos ou envie um e-mail para (contato de RH) para solicitar uma adaptação.Ao clicar em ""Enviar Candidatura"", as informações que você inserir abaixo serão encaminhadas para a VML. Recomendamos que, antes de prosseguir, você consulte a nossa Política de Privacidade de Recrutamento. Residentes da Califórnia devem consultar o nosso Aviso de Privacidade de Recrutamento da Califórnia. Nestes documentos, explicamos como tratamos os seus dados pessoais no âmbito do processo de candidatura, bem como a forma como poderá atualizar ou remover as informações que nos forneceu.Show moreShow less",,On-site/Hybrid,https://www.linkedin.com/jobs-guest/jobs/api/jobPosting/4376802611,2026-04-17,"CIENTISTA DE DADOS PL - 14178 AMarketdata&Matché a união de duas líderes em Customer Experience e Marketing Automation, formando uma das maiores potências do setor na América Latina. Atuamos com excelência em dados, tecnologia e marketing, implementando e operando plataformas como Salesforce Marketing Cloud. Unimos inteligência analítica, personalização e performance para impulsionar estratégias de CRM e Customer Experience.Integramos uma equipe multidisciplinar e uma metodologia orientada a resultados, entregando soluções que fortalecem o relacionamento entre marcas e consumidores e promovem experiências relevantes, mensuráveis e escaláveis. Somos reconhecidos comoParceira do Ano no ecossistema Salesforce, e integramos o maior hub de Martech e CX da América Latina, entregando excelência em toda a jornada de consumo.Aqui, dados não são apenas números — são direcionamento estratégico. Você vai conectar dados ao negócio e transformar informação em decisões concretas. Seu papel será provocar discussões, estruturar hipóteses, desenvolver análises profundas e criar modelos preditivos que realmente impactem resultados. Mais do que gerar relatórios, você irá interpretar cenários, identificar oportunidades, mensurar campanhas com rigor e construir sistemas de acompanhamento que elevem o nível das decisões.Se você gosta de questionar, investigar, modelar e influenciar com dados — esse desafio é para você.Desafios e AtividadesElo Analítico: Atuar como o braço de inteligência da squad, contribuindo com a geração de insights para orientar os trabalhos.Planejamento Estratégico: Discutir demandas com a gestão e participar ativamente no planejamento das atividades de Analytics que alimentam a squad.Modelagem e Investigação: Desenvolver análises de dados, estudos investigativos e modelos preditivos, aplicando senso crítico apurado aos resultados obtidos.Visão de Negócio: Interpretar os resultados das análises sob a perspectiva estratégica e gerar relatórios, dashboards e materiais executivos de alto impacto.Mensuração: Criar sistemas de acompanhamento de resultados e métodos robustos para mensuração de campanhas.Governança: Manter uma documentação organizada de todas as etapas de trabalho durante a elaboração das análises e modelos.Para Assumir Esse Desafio, Você Precisa TerEstatística e Modelagem: Experiência sólida em modelagem estatística, com foco em segmentação e modelos de propensão.Conhecimento de Marketing: Familiaridade com métodos de mensuração de campanhas e métricas de performance.Programação: Domínio de R ou Python para execução e automação de modelos.Manipulação de Dados: SQL Avançado para extração e tratamento de grandes volumes de informação.Idiomas: Fluência em inglês (essencial para colaboração e documentação).Ferramentas de Apoio: Domínio de Excel e PowerPoint para análises rápidas e apresentações executivas.Formato De AtuaçãoModelo híbrido, com atuação presencial média de 2x por semana na região da Vila Leopoldina (São Paulo).Como atuamos diretamente com diferentes clientes, pode haver necessidade de presença adicional de acordo com o projeto ou demanda. Buscamos profissionais com flexibilidade.O Que OferecemosAuxílio Educacional (inglês, espanhol, graduação e pós-graduação)Plataforma exclusiva de IA + Academia própria de formação em Inteligência ArtificialMarketdata Academy (Treinamentos mensais à disposição dos colaboradores)Parcerias com diversas instituições de ensinoPLR e Happy Day (day off no dia do aniversário)Assistência Médica e OdontológicaAuxílio home office*Programa interno de orientação psicológica, financeira e jurídicaTotalPass e Ginástica LaboralVale Refeição e/ou Alimentação (inclusive no mês das férias)Vale Transporte (opcional)Seguro de Vida e Banco de HorasLicença Maternidade/Paternidade Estendidos e Auxílio CrecheConvênio com CinemarkNa VML, estamos comprometidos em promover um ambiente de trabalho totalmente inclusivo que seja gratificante e que impulsione a carreira. Acreditamos na criação de um ambiente de trabalho dinâmico que valorize a diversidade e a inclusão e nos esforçamos para recrutar uma lista diversificada de candidatos para nos ajudar a atingir esse objetivo. Teremos o prazer de fornecer adaptações razoáveis a pessoas com deficiência que precisem de uma adaptação para usar ou acessar o site de carreiras da VML ou para participar plenamente do processo de candidatura. Caso necessite de uma adaptação para concluir a sua candidatura ou outro aspeto do nosso processo de recrutamento devido a uma deficiência, entre em contato com o nosso departamento de Recursos Humanos ou envie um e-mail para (contato de RH) para solicitar uma adaptação.Ao clicar em ""Enviar Candidatura"", as informações que você inserir abaixo serão encaminhadas para a VML. Recomendamos que, antes de prosseguir, você consulte a nossa Política de Privacidade de Recrutamento. Residentes da Califórnia devem consultar o nosso Aviso de Privacidade de Recrutamento da Califórnia. Nestes documentos, explicamos como tratamos os seus dados pessoais no âmbito do processo de candidatura, bem como a forma como poderá atualizar ou remover as informações que nos forneceu.Show moreShow less",Não especificado,Inglês,Não especificado,3
Cientista de Dados Especialista,Claro Brasil,"São Paulo, São Paulo, Brazil",1 week ago,"Responsabilidades e atribuiçõesO que te espera no dia a dia:Planejar a evolução da rede fixa, construindo uma visão otimizada traduzida em planos de curto, médio e longo prazo;Desenvolver estudos de rentabilidade, modelos de priorização e otimização de investimentos, com foco na eficiência do CAPEX em rede fixa;Conduzir, em parceria com especialistas técnicos, análises estratégicas para identificação de oportunidades de expansão de cobertura, melhoria de qualidade e evolução tecnológica da rede;Estruturar análises, relatórios e apresentações executivas para suporte à tomada de decisão em fóruns estratégicos e executivos;Apoiar as áreas de implantação e execução, garantindo alinhamento entre planejamento, priorizações estratégicas e entrega em campo;Definir e aprimorar modelos, métricas e processos, com foco em melhoria contínua dos planos e resultados de planejamento;Assegurar que os dados utilizados no planejamento estejam estruturados conforme a governança de dados, bem como apoiar a construção das rotinas de implantação dos modelos em produção;Requisitos e qualificaçõesBuscamos alguém que:Pensa e age a partir das perspectivas dos clientes. Demonstra interesse e curiosidade de conhecer os clientes, seus comportamentos e preferências para atender e superar suas expectativas;Demonstra compromisso permanente em aprender, ensinar e desenvolver, contribuindo para um ambiente descontraído, respeitoso e colaborativo, incentivando a diversidade;É flexível para se desprender de paradigmas e modelos mentais existentes. Busca soluções inovadoras e sustentáveis, para criar vantagens competitivas para o negócio, equilibrando os interesses econômicos, ambientais e sociais.Para fazer parte do nosso time, é essencial:Residir em São PauloGraduação em Administração, Engenharia, Economia e/ou áreas correlatas;Experiência com modelagem de priorização e otimização de investimentos;Expertise com análises complexas de dados, estruturando insights acionáveis para o negócio;Conhecimento em modelos de projeção, planejamento estratégico, segmentação e otimização;Domínio de ferramentas analíticas: Excel, Python, Power BI e Tableau;É diferencial:Experiência em planejamento estratégico, analytics e/ou engenharia de redes;Experiência em interação com lideranças executivas e fóruns estratégicos;Vivência em empresas do setor de telecomunicações;Informações adicionaisNaClaro, pessoas é um dos nossos valores.Com este pensamento, investimos sempre no cuidado com a saúde, bem-estar e qualidade de vida dos nossos colaboradores! Para que você tenha a melhor experiência em sua jornada com a gente, oferecemos um atraente pacote de benefícios. Veja só:Jornada Flexível;Vale-Refeição e Alimentação;Assistência Médica e Odontológica;Auxílio para patologias graves;Auxílio ao dependente com deficiência;Benefício Farmácia;Auxílio Creche/Babá;Programa de Apoio Pessoal;Claro Running;Previdência Privada;Seguro de Vida;Combo Colaborador;Wellhub (Gympass)Meu Pet ClubConvênios e Parcerias;Programa de Reconhecimento por tempo de casa;E muito mais!Na nossa empresa, valorizamos um ambiente inclusivo, diverso, ético, colaborativo e harmônico. Não fazemos distinção de gênero, raça, cor, orientação sexual, posição social ou deficiências. Todos e todas são bem-vindos(as)!Show moreShow less",,On-site/Hybrid,https://www.linkedin.com/jobs-guest/jobs/api/jobPosting/4399881019,2026-04-17,"Cientista de Dados Especialista Responsabilidades e atribuiçõesO que te espera no dia a dia:Planejar a evolução da rede fixa, construindo uma visão otimizada traduzida em planos de curto, médio e longo prazo;Desenvolver estudos de rentabilidade, modelos de priorização e otimização de investimentos, com foco na eficiência do CAPEX em rede fixa;Conduzir, em parceria com especialistas técnicos, análises estratégicas para identificação de oportunidades de expansão de cobertura, melhoria de qualidade e evolução tecnológica da rede;Estruturar análises, relatórios e apresentações executivas para suporte à tomada de decisão em fóruns estratégicos e executivos;Apoiar as áreas de implantação e execução, garantindo alinhamento entre planejamento, priorizações estratégicas e entrega em campo;Definir e aprimorar modelos, métricas e processos, com foco em melhoria contínua dos planos e resultados de planejamento;Assegurar que os dados utilizados no planejamento estejam estruturados conforme a governança de dados, bem como apoiar a construção das rotinas de implantação dos modelos em produção;Requisitos e qualificaçõesBuscamos alguém que:Pensa e age a partir das perspectivas dos clientes. Demonstra interesse e curiosidade de conhecer os clientes, seus comportamentos e preferências para atender e superar suas expectativas;Demonstra compromisso permanente em aprender, ensinar e desenvolver, contribuindo para um ambiente descontraído, respeitoso e colaborativo, incentivando a diversidade;É flexível para se desprender de paradigmas e modelos mentais existentes. Busca soluções inovadoras e sustentáveis, para criar vantagens competitivas para o negócio, equilibrando os interesses econômicos, ambientais e sociais.Para fazer parte do nosso time, é essencial:Residir em São PauloGraduação em Administração, Engenharia, Economia e/ou áreas correlatas;Experiência com modelagem de priorização e otimização de investimentos;Expertise com análises complexas de dados, estruturando insights acionáveis para o negócio;Conhecimento em modelos de projeção, planejamento estratégico, segmentação e otimização;Domínio de ferramentas analíticas: Excel, Python, Power BI e Tableau;É diferencial:Experiência em planejamento estratégico, analytics e/ou engenharia de redes;Experiência em interação com lideranças executivas e fóruns estratégicos;Vivência em empresas do setor de telecomunicações;Informações adicionaisNaClaro, pessoas é um dos nossos valores.Com este pensamento, investimos sempre no cuidado com a saúde, bem-estar e qualidade de vida dos nossos colaboradores! Para que você tenha a melhor experiência em sua jornada com a gente, oferecemos um atraente pacote de benefícios. Veja só:Jornada Flexível;Vale-Refeição e Alimentação;Assistência Médica e Odontológica;Auxílio para patologias graves;Auxílio ao dependente com deficiência;Benefício Farmácia;Auxílio Creche/Babá;Programa de Apoio Pessoal;Claro Running;Previdência Privada;Seguro de Vida;Combo Colaborador;Wellhub (Gympass)Meu Pet ClubConvênios e Parcerias;Programa de Reconhecimento por tempo de casa;E muito mais!Na nossa empresa, valorizamos um ambiente inclusivo, diverso, ético, colaborativo e harmônico. Não fazemos distinção de gênero, raça, cor, orientação sexual, posição social ou deficiências. Todos e todas são bem-vindos(as)!Show moreShow less",Não especificado,Não especificado,Não especificado,4
Data Scientist (Risk),"CloudWalk, Inc.","São Paulo, São Paulo, Brazil",4 days ago,"About CloudWalk:We are not just another fintech unicorn. We are a pack of dreamers, makers, and tech enthusiasts building the future of payments. With millions of customers and a hunger for innovation, we're now expanding our neural network - literally and metaphorically.About The Team:The Risk Team is responsible for building the defense layer that keeps CloudWalk, its merchants, and users safe. We keep our ecosystem healthy by tracking down malicious activity and maintaining regulatory compliance while providing the best user experience. You will be part of a multidisciplinary team comprising risk analysts, data scientists, and software engineers, working collaboratively to enhance our risk management strategies.About The Job:As a Data Scientist on our Risk Team, your role is crucial in developing and optimizing machine learning models to detect and prevent fraud. You will be a key player in analyzing data, building predictive models, and implementing robust data-driven strategies to enhance our risk management processes.You will bridge the gap between theoretical data science and practical, scalable solutions in the fintech sector, with a specific focus on risk assessment and mitigation. Your work will involve handling large-scale datasets, extracting meaningful insights, and developing sophisticated algorithms to protect our ecosystem.What You'll Need to Succeed:Fluency in Python and SQL.Proficient in ML libraries like Scikit, PyTorch , TensorFlow, etc.Experience with cloud-based services like the Google Cloud platform.Solid Data Visualization skills to create charts and dashboards.Strong analytical skills, ability to collect, organize, analyze, and disseminate significant amounts of information with attention to detail and accuracy.Detail-oriented with a strong research mindset.As a member of a fully remote and distributed team, you are expected to complete tasks autonomously, being highly collaborative and self-driven. We expect you to have the curiosity of a child with the responsibility of a grown-up.Communication skills. You should be able to communicate effectively with multiple teams.Ability to communicate and debate in English and Portuguese.Nice-to-have skills:Experience with financial or payment industryKnowledge of distributed systems and parallel computingDevOps practices: Understanding DevOps practices, including continuous integration, continuous deployment, and containerization.Recruiting Process Outline:Online technical assessmentTechnical interviewCultural interview.If you are not willing to do an online-quiz, please do not apply.Join us at CloudWalk, where we’re not just engineering solutions; we’re building a smarter, AI-driven future for payments—together.By applying for this position, your data will be processed as per CloudWalk's Privacy Policy that you can read here in Portuguese and here in English.We may use artificial intelligence (AI) tools to support parts of the hiring process, such as reviewing applications, analyzing resumes, or assessing responses. These tools assist our recruitment team but do not replace human judgment. Final hiring decisions are ultimately made by humans. If you would like more information about how your data is processed, please contact us.Show moreShow less",,Remote,https://www.linkedin.com/jobs-guest/jobs/api/jobPosting/4376208651,2026-04-17,"Data Scientist (Risk) About CloudWalk:We are not just another fintech unicorn. We are a pack of dreamers, makers, and tech enthusiasts building the future of payments. With millions of customers and a hunger for innovation, we're now expanding our neural network - literally and metaphorically.About The Team:The Risk Team is responsible for building the defense layer that keeps CloudWalk, its merchants, and users safe. We keep our ecosystem healthy by tracking down malicious activity and maintaining regulatory compliance while providing the best user experience. You will be part of a multidisciplinary team comprising risk analysts, data scientists, and software engineers, working collaboratively to enhance our risk management strategies.About The Job:As a Data Scientist on our Risk Team, your role is crucial in developing and optimizing machine learning models to detect and prevent fraud. You will be a key player in analyzing data, building predictive models, and implementing robust data-driven strategies to enhance our risk management processes.You will bridge the gap between theoretical data science and practical, scalable solutions in the fintech sector, with a specific focus on risk assessment and mitigation. Your work will involve handling large-scale datasets, extracting meaningful insights, and developing sophisticated algorithms to protect our ecosystem.What You'll Need to Succeed:Fluency in Python and SQL.Proficient in ML libraries like Scikit, PyTorch , TensorFlow, etc.Experience with cloud-based services like the Google Cloud platform.Solid Data Visualization skills to create charts and dashboards.Strong analytical skills, ability to collect, organize, analyze, and disseminate significant amounts of information with attention to detail and accuracy.Detail-oriented with a strong research mindset.As a member of a fully remote and distributed team, you are expected to complete tasks autonomously, being highly collaborative and self-driven. We expect you to have the curiosity of a child with the responsibility of a grown-up.Communication skills. You should be able to communicate effectively with multiple teams.Ability to communicate and debate in English and Portuguese.Nice-to-have skills:Experience with financial or payment industryKnowledge of distributed systems and parallel computingDevOps practices: Understanding DevOps practices, including continuous integration, continuous deployment, and containerization.Recruiting Process Outline:Online technical assessmentTechnical interviewCultural interview.If you are not willing to do an online-quiz, please do not apply.Join us at CloudWalk, where we’re not just engineering solutions; we’re building a smarter, AI-driven future for payments—together.By applying for this position, your data will be processed as per CloudWalk's Privacy Policy that you can read here in Portuguese and here in English.We may use artificial intelligence (AI) tools to support parts of the hiring process, such as reviewing applications, analyzing resumes, or assessing responses. These tools assist our recruitment team but do not replace human judgment. Final hiring decisions are ultimately made by humans. If you would like more information about how your data is processed, please contact us.Show moreShow less",Não especificado,Não especificado,Google Cloud,1
