title,company,location,posted,description,applicants,work_mode,link,data_coleta,titulo_descr,senioridade,idioma,certificado,cluster
Data Science Manager,Banco Bradesco,"Osasco, São Paulo, Brazil",1 week ago,"Sobre o BradescoO Bradesco é um dos maiores grupos financeiros do Brasil, com uma história marcada pelo pioneirismo e inovação. Por meio da nossa carteira amplamente diversificada de produtos financeiros, serviços bancários e de seguros contribuímos com a realização das pessoas e o crescimento sustentável de empresas e sociedade. Venha fazer parte do nosso ecossistema financeiro e impactar a experiência de milhões de pessoas!No Bradesco valorizamos a diversidade em todas as suas formas. Por isso, as nossas vagas são abertas a todas as pessoas, independentemente de gênero, raça, orientação sexual, deficiência, idade ou qualquer outra característica.Saiba mais em https://banco.bradesco/html/classic/sobre/index.shtmResponsabilidades e atribuiçõesO que é o nosso time de Crédito?A área tem a missão de fazer a gestão dos produtos do prime de validar e construir estratégias.Modelo de trabalho: Híbrido - 2x presencialUnidade: Osasco/SPComo será seu dia a dia?Sendo Data Science Manager, atuará na gerênciaCrédito I Visão Clientee suas principais atividades serão:Apoiar a equipe no processo de tomada de decisão estratégico do Departamento de Crédito, equilibrando o conhecimento técnico de dados, técnicas de estatística e machine learning, conectando-as ao contexto e valor do negócio;Usufruir da comunicação efetiva para transmitir aos diferentes públicos os resultados e ações propostos nas revisões de política do Portfolio;Fazer interlocução e conduzir reuniões com as áreas parceiras técnicas e do Negócio;Desenvolver o potencial da equipe com a formação de novos líderes e sucessores.Requisitos e QualificaçõesO que você precisa ter ou saber?Formação Acadêmica necessária para o pleno desempenho da função) em Estatística, Ciências Econômicas, Matemática, Engenharia ou Administração de Empresas;Experiência com estratégia de crédito;Experiência profissional superior a 7 anos em políticas de crédito varejo;Conhecimentos dos indicadores chaves de inadimplência e rentabilidade;Liderança de time de alta performance;Conhecimentos avançados em Databricks, Python, cloud / azure.Será um diferencial se você tiver:Sólido conhecimento em ciclo de crédito;Atuação em projetos de estratégia de crédito em nuvem.O que nós oferecemosNo Bradesco valorizamos a saúde e bem-estar, oferecendo um extenso portfólio de benefícios a todas nossas pessoas funcionárias:PLR ou Bônus: Conforme a elegibilidade de cargo*Convênio MédicoConvênio OdontológicoSeguro de VidaVale AlimentaçãoVale Refeição13º Cesta AlimentaçãoTotal PassVale Transporte (adesão opcional)Descontos em produtos e serviços em empresas parceirasPrevidência Privada (adesão opcional, com participação financeira da Organização Bradesco)Viva Bem Bradesco: programa de saúde, bem-estar e qualidade de vidaUnibrad: Universidade Corporativa BradescoIsenção de Tarifas: condições especiais em diversos produtos e serviçosAuxílio Creche ou BabáLicença Paternidade estendida de 20 diasLicença Maternidade de 180 dias, acompanhamento assistencial da gestação até o pós-partoShow moreShow less",,On-site/Hybrid,https://www.linkedin.com/jobs-guest/jobs/api/jobPosting/4311167744,2025-10-19,"Data Science Manager Sobre o BradescoO Bradesco é um dos maiores grupos financeiros do Brasil, com uma história marcada pelo pioneirismo e inovação. Por meio da nossa carteira amplamente diversificada de produtos financeiros, serviços bancários e de seguros contribuímos com a realização das pessoas e o crescimento sustentável de empresas e sociedade. Venha fazer parte do nosso ecossistema financeiro e impactar a experiência de milhões de pessoas!No Bradesco valorizamos a diversidade em todas as suas formas. Por isso, as nossas vagas são abertas a todas as pessoas, independentemente de gênero, raça, orientação sexual, deficiência, idade ou qualquer outra característica.Saiba mais em https://banco.bradesco/html/classic/sobre/index.shtmResponsabilidades e atribuiçõesO que é o nosso time de Crédito?A área tem a missão de fazer a gestão dos produtos do prime de validar e construir estratégias.Modelo de trabalho: Híbrido - 2x presencialUnidade: Osasco/SPComo será seu dia a dia?Sendo Data Science Manager, atuará na gerênciaCrédito I Visão Clientee suas principais atividades serão:Apoiar a equipe no processo de tomada de decisão estratégico do Departamento de Crédito, equilibrando o conhecimento técnico de dados, técnicas de estatística e machine learning, conectando-as ao contexto e valor do negócio;Usufruir da comunicação efetiva para transmitir aos diferentes públicos os resultados e ações propostos nas revisões de política do Portfolio;Fazer interlocução e conduzir reuniões com as áreas parceiras técnicas e do Negócio;Desenvolver o potencial da equipe com a formação de novos líderes e sucessores.Requisitos e QualificaçõesO que você precisa ter ou saber?Formação Acadêmica necessária para o pleno desempenho da função) em Estatística, Ciências Econômicas, Matemática, Engenharia ou Administração de Empresas;Experiência com estratégia de crédito;Experiência profissional superior a 7 anos em políticas de crédito varejo;Conhecimentos dos indicadores chaves de inadimplência e rentabilidade;Liderança de time de alta performance;Conhecimentos avançados em Databricks, Python, cloud / azure.Será um diferencial se você tiver:Sólido conhecimento em ciclo de crédito;Atuação em projetos de estratégia de crédito em nuvem.O que nós oferecemosNo Bradesco valorizamos a saúde e bem-estar, oferecendo um extenso portfólio de benefícios a todas nossas pessoas funcionárias:PLR ou Bônus: Conforme a elegibilidade de cargo*Convênio MédicoConvênio OdontológicoSeguro de VidaVale AlimentaçãoVale Refeição13º Cesta AlimentaçãoTotal PassVale Transporte (adesão opcional)Descontos em produtos e serviços em empresas parceirasPrevidência Privada (adesão opcional, com participação financeira da Organização Bradesco)Viva Bem Bradesco: programa de saúde, bem-estar e qualidade de vidaUnibrad: Universidade Corporativa BradescoIsenção de Tarifas: condições especiais em diversos produtos e serviçosAuxílio Creche ou BabáLicença Paternidade estendida de 20 diasLicença Maternidade de 180 dias, acompanhamento assistencial da gestação até o pós-partoShow moreShow less",Pleno,Não especificado,Microsoft Azure,4
Data Scientist III,Banco Bradesco,"Osasco, São Paulo, Brazil",2 weeks ago,"Sobre o BradescoO Bradesco é um dos maiores grupos financeiros do Brasil, com uma história marcada pelo pioneirismo e inovação. Por meio da nossa carteira amplamente diversificada de produtos financeiros, serviços bancários e de seguros contribuímos com a realização das pessoas e o crescimento sustentável de empresas e sociedade. Venha fazer parte do nosso ecossistema financeiro e impactar a experiência de milhões de pessoas!No Bradesco valorizamos a diversidade em todas as suas formas. Por isso, as nossas vagas são abertas a todas as pessoas, independentemente de gênero, raça, orientação sexual, deficiência, idade ou qualquer outra característica.Saiba mais em https://banco.bradesco/html/classic/sobre/index.shtmResponsabilidades e atribuiçõesO que é o nosso time de Crédito?A área de Crédito tem como missão, garantir uma gestão eficiente na concessão e manutenção de crédito, que assegure rentabilidade e o crescimento com solidez dos ativos da Organização.Modelo de trabalho : Híbrido - 3x presencialUnidade: Osasco/SPComo será seu dia a dia?Sendo Data Scientist III, atuará na gerência Pricing e suas principais atividades serão:Elaboração das curvas de demanda para todos os produtos de crédito, alavancando a visão cliente e alterações nas dinâmicas de mercado, monitorando continuamente a performance dos modelos existentes, realizando recalibrações e ajustes conforme necessário para garantir sua acurácia e relevância;Conduzir análises de sensibilidade para entender como mudanças nas variáveis de precificação e nas condições de mercado afetam a demanda por empréstimos;Traduzir os resultados dos modelos em insights acionáveis, ajudando a definir estratégias de financiamento que maximizem a rentabilidade e o volume, considerando a elasticidade da demanda;Comunicar insights acionáveis e relevantes para desenvolvimento da estratégia de forma clara e concisa para stakeholders não técnicos.Requisitos e QualificaçõesO que você precisa ter ou saber?Superior completo em áreas como Economia, Engenharia, Estatística, Ciência da Computação ou áreas correlatas;Profundo conhecimento em modelos de precificação e análise de rentabilidade;Proficiência em ferramentas de dados, Python (mandatório), SQL, Psypark, Excel Avançado;Sólido entendimento do mercado de financiamento e regulamentação do setor;Sólida experiência com modelagem de preço, preferencialmente com produtos de crédito.Será um diferencial se você tiver:Pós-graduação em áreas quantitativas como Ciências de Dados;Visão estratégica de negócios e conhecimento sobre financiamento;Power BI;Experiência com modelagem de preço para produtos de financiamento.O que nós oferecemosNo Bradesco valorizamos a saúde e bem-estar, oferecendo um extenso portfólio de benefícios a todas nossas pessoas funcionárias:PLR ou Bônus: Conforme a elegibilidade de cargo*Convênio MédicoConvênio OdontológicoSeguro de VidaVale AlimentaçãoVale Refeição13º Cesta AlimentaçãoTotal PassVale Transporte (adesão opcional)Descontos em produtos e serviços em empresas parceirasPrevidência Privada (adesão opcional, com participação financeira da Organização Bradesco)Viva Bem Bradesco: programa de saúde, bem-estar e qualidade de vidaUnibrad: Universidade Corporativa BradescoIsenção de Tarifas: condições especiais em diversos produtos e serviçosAuxílio Creche ou BabáLicença Paternidade estendida de 20 diasLicença Maternidade de 180 dias, acompanhamento assistencial da gestação até o pós-partoShow moreShow less",,On-site/Hybrid,https://www.linkedin.com/jobs-guest/jobs/api/jobPosting/4309813509,2025-10-19,"Data Scientist III Sobre o BradescoO Bradesco é um dos maiores grupos financeiros do Brasil, com uma história marcada pelo pioneirismo e inovação. Por meio da nossa carteira amplamente diversificada de produtos financeiros, serviços bancários e de seguros contribuímos com a realização das pessoas e o crescimento sustentável de empresas e sociedade. Venha fazer parte do nosso ecossistema financeiro e impactar a experiência de milhões de pessoas!No Bradesco valorizamos a diversidade em todas as suas formas. Por isso, as nossas vagas são abertas a todas as pessoas, independentemente de gênero, raça, orientação sexual, deficiência, idade ou qualquer outra característica.Saiba mais em https://banco.bradesco/html/classic/sobre/index.shtmResponsabilidades e atribuiçõesO que é o nosso time de Crédito?A área de Crédito tem como missão, garantir uma gestão eficiente na concessão e manutenção de crédito, que assegure rentabilidade e o crescimento com solidez dos ativos da Organização.Modelo de trabalho : Híbrido - 3x presencialUnidade: Osasco/SPComo será seu dia a dia?Sendo Data Scientist III, atuará na gerência Pricing e suas principais atividades serão:Elaboração das curvas de demanda para todos os produtos de crédito, alavancando a visão cliente e alterações nas dinâmicas de mercado, monitorando continuamente a performance dos modelos existentes, realizando recalibrações e ajustes conforme necessário para garantir sua acurácia e relevância;Conduzir análises de sensibilidade para entender como mudanças nas variáveis de precificação e nas condições de mercado afetam a demanda por empréstimos;Traduzir os resultados dos modelos em insights acionáveis, ajudando a definir estratégias de financiamento que maximizem a rentabilidade e o volume, considerando a elasticidade da demanda;Comunicar insights acionáveis e relevantes para desenvolvimento da estratégia de forma clara e concisa para stakeholders não técnicos.Requisitos e QualificaçõesO que você precisa ter ou saber?Superior completo em áreas como Economia, Engenharia, Estatística, Ciência da Computação ou áreas correlatas;Profundo conhecimento em modelos de precificação e análise de rentabilidade;Proficiência em ferramentas de dados, Python (mandatório), SQL, Psypark, Excel Avançado;Sólido entendimento do mercado de financiamento e regulamentação do setor;Sólida experiência com modelagem de preço, preferencialmente com produtos de crédito.Será um diferencial se você tiver:Pós-graduação em áreas quantitativas como Ciências de Dados;Visão estratégica de negócios e conhecimento sobre financiamento;Power BI;Experiência com modelagem de preço para produtos de financiamento.O que nós oferecemosNo Bradesco valorizamos a saúde e bem-estar, oferecendo um extenso portfólio de benefícios a todas nossas pessoas funcionárias:PLR ou Bônus: Conforme a elegibilidade de cargo*Convênio MédicoConvênio OdontológicoSeguro de VidaVale AlimentaçãoVale Refeição13º Cesta AlimentaçãoTotal PassVale Transporte (adesão opcional)Descontos em produtos e serviços em empresas parceirasPrevidência Privada (adesão opcional, com participação financeira da Organização Bradesco)Viva Bem Bradesco: programa de saúde, bem-estar e qualidade de vidaUnibrad: Universidade Corporativa BradescoIsenção de Tarifas: condições especiais em diversos produtos e serviçosAuxílio Creche ou BabáLicença Paternidade estendida de 20 diasLicença Maternidade de 180 dias, acompanhamento assistencial da gestação até o pós-partoShow moreShow less",Não especificado,Não especificado,Não especificado,4
Cientista de dados - Berrini/São Paulo,DXON,"São Paulo, São Paulo, Brazil",4 months ago,"Desenvolver e aprimorar modelos preditivos, análise de risco e estratégias baseadas em dados. O(a) profissional será responsável por explorar grandes volumes de dados, construir modelos estatísticos e de machine learning, além de gerar insights que otimizem a tomada de decisão no processo de concessão de crédito.ResponsabilidadesDesenvolver, testar e implantar modelos de risco de crédito, incluindo credit scoring, propensão de inadimplência e recuperação de crédito.Explorar e tratar grandes volumes de dados para identificar padrões e tendências que impactam o risco de crédito.Criar e otimizar modelos de machine learning para melhorar a acurácia das decisões de crédito.Trabalhar com times de engenharia de dados para garantir a disponibilidade e qualidade dos dados utilizados.Implementar e monitorar modelos de crédito em produção, garantindo performance e compliance com regulamentações vigentes.Desenvolver dashboards e relatórios para acompanhar métricas de crédito e comportamento da carteira.Aplicar técnicas de Explainable AI (XAI) para garantir transparência nas decisões baseadas em modelos preditivos.Colaborar com times de negócios, risco e produtos financeiros para alinhar estratégias baseadas em dados.RequisitosFormação em Estatística, Engenharia, Ciência da Computação, Matemática, Economia ou áreas correlatas.Experiência sólida com modelagem estatística e machine learning, especialmente em problemas de crédito.Conhecimento avançado em Python, R ou SQL para análise e modelagem de dados.Experiência com bibliotecas e frameworks de machine learning, como Scikit-learn, XGBoost, TensorFlow ou PyTorch.Familiaridade com bancos de dados relacionais e não relacionais (SQL, NoSQL).Experiência com manipulação e limpeza de grandes volumes de dados.Habilidade em comunicação e visualização de dados, utilizando Power BI, Tableau ou Matplotlib/Seaborn.Conhecimento em regulamentações de crédito, como Basileia, LGPD e SCR, é um diferencial.Experiência em deploy de modelos em ambiente produtivo (MLOps) é um plus.DiferenciaisExperiência em modelagem de crédito em bancos, fintechs ou bureaus de crédito.Conhecimento em técnicas avançadas de machine learning, como modelos generativos e deep learning aplicados a crédito.Experiência com Big Data e computação em nuvem (AWS, Azure, GCP).Experiência com modelos de precificação e otimização de portfólio de crédito.BenefíciosSalário competitivo e compatível com o mercado.Modelo de trabalho híbrido.Oportunidade de crescimento e desenvolvimento profissional.Se você é apaixonado por dados e quer ajudar a construir soluções inovadoras para crédito, venha fazer parte do nosso time!Candidate-se agora!A vaga aceita trabalho remoto?NãoShow moreShow less",,On-site/Hybrid,https://www.linkedin.com/jobs-guest/jobs/api/jobPosting/4243100867,2025-10-19,"Cientista de dados - Berrini/São Paulo Desenvolver e aprimorar modelos preditivos, análise de risco e estratégias baseadas em dados. O(a) profissional será responsável por explorar grandes volumes de dados, construir modelos estatísticos e de machine learning, além de gerar insights que otimizem a tomada de decisão no processo de concessão de crédito.ResponsabilidadesDesenvolver, testar e implantar modelos de risco de crédito, incluindo credit scoring, propensão de inadimplência e recuperação de crédito.Explorar e tratar grandes volumes de dados para identificar padrões e tendências que impactam o risco de crédito.Criar e otimizar modelos de machine learning para melhorar a acurácia das decisões de crédito.Trabalhar com times de engenharia de dados para garantir a disponibilidade e qualidade dos dados utilizados.Implementar e monitorar modelos de crédito em produção, garantindo performance e compliance com regulamentações vigentes.Desenvolver dashboards e relatórios para acompanhar métricas de crédito e comportamento da carteira.Aplicar técnicas de Explainable AI (XAI) para garantir transparência nas decisões baseadas em modelos preditivos.Colaborar com times de negócios, risco e produtos financeiros para alinhar estratégias baseadas em dados.RequisitosFormação em Estatística, Engenharia, Ciência da Computação, Matemática, Economia ou áreas correlatas.Experiência sólida com modelagem estatística e machine learning, especialmente em problemas de crédito.Conhecimento avançado em Python, R ou SQL para análise e modelagem de dados.Experiência com bibliotecas e frameworks de machine learning, como Scikit-learn, XGBoost, TensorFlow ou PyTorch.Familiaridade com bancos de dados relacionais e não relacionais (SQL, NoSQL).Experiência com manipulação e limpeza de grandes volumes de dados.Habilidade em comunicação e visualização de dados, utilizando Power BI, Tableau ou Matplotlib/Seaborn.Conhecimento em regulamentações de crédito, como Basileia, LGPD e SCR, é um diferencial.Experiência em deploy de modelos em ambiente produtivo (MLOps) é um plus.DiferenciaisExperiência em modelagem de crédito em bancos, fintechs ou bureaus de crédito.Conhecimento em técnicas avançadas de machine learning, como modelos generativos e deep learning aplicados a crédito.Experiência com Big Data e computação em nuvem (AWS, Azure, GCP).Experiência com modelos de precificação e otimização de portfólio de crédito.BenefíciosSalário competitivo e compatível com o mercado.Modelo de trabalho híbrido.Oportunidade de crescimento e desenvolvimento profissional.Se você é apaixonado por dados e quer ajudar a construir soluções inovadoras para crédito, venha fazer parte do nosso time!Candidate-se agora!A vaga aceita trabalho remoto?NãoShow moreShow less",Não especificado,Não especificado,Microsoft Azure,0
Cientista de Dados SR,Banco Sofisa S/A,"São Paulo, São Paulo, Brazil",4 days ago,"Descrição da vagaOrgulhosamente, somos um dos principais bancos do Brasil. Aqui, não nos contentamos com o status quo. Estamos sempre em busca de melhorias, aprendizado contínuo e inovação. Procuramos pessoas que sejam apaixonadas por mudanças, que tenham vontade de aprender e queiram crescer no mercado financeiro. Se você se identifica, venha fazer parte do nosso time!Responsabilidades e atribuiçõesConstrução de Modelos e estudos Estatísticos para Crédito no segmento PJConectar dados de Negócio com soluções de dados (classificação, regressão, agrupamento, métricas de avaliação)Manipulação de dados para construção de data lake, ETL, BooksConstrução das políticas de crédito em motor de regras de decisãoAtuação em todo o ciclo de vida dos dadosRequisitos imprescindíveis:Domínio em programação para manipulação de banco de dados e de modelagem estatística (Python, R ou SAS)Experiência com SQLManipulação e tratamento de dados (ETL)Experiência em construção e implantação de modelos preditivosAlguns diferenciais interessantes para a vaga:Experiencia em validação e acompanhamento dos ratings e políticas de crédito (NEUROTECH) para manutenção/ajustesExperiência em modelagem para crédito PJExperiência em construção e implantação de modelos preditivosExperiência em políticas de crédito PJExperiência em construção de modelos de PropensãoExperiência em DatabricksInformações adicionaisVale-Refeição;Vale-Alimentação;Seguro Saúde;Plano Odontológico;Seguro de Vida;Auxílio Nascimento;Auxílio Casamento;Auxílio Creche/Babá;Bônus Aniversário;Apoio Pass;Convênio Academia;Vale Transporte;PLR;Bônus anual.Show moreShow less",,On-site/Hybrid,https://www.linkedin.com/jobs-guest/jobs/api/jobPosting/4314805763,2025-10-19,"Cientista de Dados SR Descrição da vagaOrgulhosamente, somos um dos principais bancos do Brasil. Aqui, não nos contentamos com o status quo. Estamos sempre em busca de melhorias, aprendizado contínuo e inovação. Procuramos pessoas que sejam apaixonadas por mudanças, que tenham vontade de aprender e queiram crescer no mercado financeiro. Se você se identifica, venha fazer parte do nosso time!Responsabilidades e atribuiçõesConstrução de Modelos e estudos Estatísticos para Crédito no segmento PJConectar dados de Negócio com soluções de dados (classificação, regressão, agrupamento, métricas de avaliação)Manipulação de dados para construção de data lake, ETL, BooksConstrução das políticas de crédito em motor de regras de decisãoAtuação em todo o ciclo de vida dos dadosRequisitos imprescindíveis:Domínio em programação para manipulação de banco de dados e de modelagem estatística (Python, R ou SAS)Experiência com SQLManipulação e tratamento de dados (ETL)Experiência em construção e implantação de modelos preditivosAlguns diferenciais interessantes para a vaga:Experiencia em validação e acompanhamento dos ratings e políticas de crédito (NEUROTECH) para manutenção/ajustesExperiência em modelagem para crédito PJExperiência em construção e implantação de modelos preditivosExperiência em políticas de crédito PJExperiência em construção de modelos de PropensãoExperiência em DatabricksInformações adicionaisVale-Refeição;Vale-Alimentação;Seguro Saúde;Plano Odontológico;Seguro de Vida;Auxílio Nascimento;Auxílio Casamento;Auxílio Creche/Babá;Bônus Aniversário;Apoio Pass;Convênio Academia;Vale Transporte;PLR;Bônus anual.Show moreShow less",Não especificado,Não especificado,Não especificado,0
