title,company,location,posted,description,applicants,work_mode,link,data_coleta,titulo_descr,senioridade,idioma,certificado,cluster
Cientista de Dados Jr. (Finanças),Banco PAN,"São Paulo, São Paulo, Brazil",3 days ago,"Somos oPANÁgeis, flexíveis e criativos, exploramos possibilidades com disposição e desejo de fazer acontecer. Sempre prontos para encarar novos desafios, nutrimos líderes que, além de ter garra, são abertos e empáticos, veem na proximidade das relações, o elo entre cada um.Nossa missão, se faz cumprida quando transformamos a vida dos outros através dos nossos conhecimentos. Nossos pilares de cultura, reforçam nossa postura idealizadora e com desejo de fazer acontecer:Trabalho em equipe, Transparência , Excelência e Eficiência com profundidade.Dominamos nossos processos e trazemos melhorias para quem deseja ter umavida financeira mais inteligente.Principais desafios:Apoiar na validação e desenvolvimento de modelos estatísticos voltados à redução de ações cíveis, análise de propensão e crédito;Contribuir tecnicamente utilizando ferramentas como AWS, SQL, Python e Excel, com oportunidade de aprendizado contínuo;Colaborar com diferentes áreas e times em uma estrutura horizontal e dinâmica, com foco no desenvolvimento profissional.Quais as principais competências para a posição?Formação superior em áreas de Exatas (Engenharia, Estatística, Ciência da Computação, Matemática, entre outras);Conhecimento básico em modelagem estatística e ciência de dados (projetos acadêmicos ou experiências iniciais são bem-vindos);Perfil curioso, colaborativo e com boa capacidade analítica para levantar hipóteses e aprender com os desafios;Familiaridade com ferramentas como AWS, SQL, Python e Excel (não é necessário domínio completo, mas disposição para aprender);Experiência prévia em qualquer segmento é um diferencial, mas não obrigatória (buscamos pessoas com vontade de crescer na área).Modelo de atuação: Híbrido (4 dias presenciais no escritório e 1 dia de home office)Benefícios do PAN:Bônus / PLRVale RefeiçãoVale Alimentação13º de Vale AlimentaçãoConvênio Médico (internação em apartamento para titular e dependentes)Convênio Odonto/OrtodônticoAmbulatório Médico no escritórioTelemedicina Dr. Alper (Einstein Conecta) ilimitado.Seguro de VidaDescontos em mais de 10 mil farmácias4 Sessões de psicoterapia por mêsLicença familiar estendida (Responsável 6 meses e corresponsável 30 dias)Auxílio Creche / BabáAcomPANha (programa de acompanhamento para gestantes)Wellhub/TotalpassAuxílio tecnologia assistivas (reembolso de 85% para colaboradores com deficiência)Programas de desenvolvimentoMassagem e AuriculoterapiaSalão de beleza no escritórioPAE (Orientação Jurídica, Financeira, Psicológica e Social)Portal de descontos em diversos segmentos (Allya)Campanha de vacinação (colaborador e dependente)Facilitação no financiamento de veículos (Mediante análise)Cartão de crédito PAN com limite diferenciado (Mediante análise)Vale Transporte (desconto de apenas 4%)Assistência FuneralAssim como todas as nossas vagas, essa também é destinada à diversidade e inclusão. Independentemente de qualquer fator, perfil ou característica,Expanda sua carreira no PAN!Para conhecer mais sobre nossos benefícios e cultura, acesse o Trabalhe Conosco:https://www.bancopan.com.br/trabalhe-conosco/Show moreShow less",,On-site/Hybrid,https://www.linkedin.com/jobs-guest/jobs/api/jobPosting/4328719995,2025-12-27,"Cientista de Dados Jr. (Finanças) Somos oPANÁgeis, flexíveis e criativos, exploramos possibilidades com disposição e desejo de fazer acontecer. Sempre prontos para encarar novos desafios, nutrimos líderes que, além de ter garra, são abertos e empáticos, veem na proximidade das relações, o elo entre cada um.Nossa missão, se faz cumprida quando transformamos a vida dos outros através dos nossos conhecimentos. Nossos pilares de cultura, reforçam nossa postura idealizadora e com desejo de fazer acontecer:Trabalho em equipe, Transparência , Excelência e Eficiência com profundidade.Dominamos nossos processos e trazemos melhorias para quem deseja ter umavida financeira mais inteligente.Principais desafios:Apoiar na validação e desenvolvimento de modelos estatísticos voltados à redução de ações cíveis, análise de propensão e crédito;Contribuir tecnicamente utilizando ferramentas como AWS, SQL, Python e Excel, com oportunidade de aprendizado contínuo;Colaborar com diferentes áreas e times em uma estrutura horizontal e dinâmica, com foco no desenvolvimento profissional.Quais as principais competências para a posição?Formação superior em áreas de Exatas (Engenharia, Estatística, Ciência da Computação, Matemática, entre outras);Conhecimento básico em modelagem estatística e ciência de dados (projetos acadêmicos ou experiências iniciais são bem-vindos);Perfil curioso, colaborativo e com boa capacidade analítica para levantar hipóteses e aprender com os desafios;Familiaridade com ferramentas como AWS, SQL, Python e Excel (não é necessário domínio completo, mas disposição para aprender);Experiência prévia em qualquer segmento é um diferencial, mas não obrigatória (buscamos pessoas com vontade de crescer na área).Modelo de atuação: Híbrido (4 dias presenciais no escritório e 1 dia de home office)Benefícios do PAN:Bônus / PLRVale RefeiçãoVale Alimentação13º de Vale AlimentaçãoConvênio Médico (internação em apartamento para titular e dependentes)Convênio Odonto/OrtodônticoAmbulatório Médico no escritórioTelemedicina Dr. Alper (Einstein Conecta) ilimitado.Seguro de VidaDescontos em mais de 10 mil farmácias4 Sessões de psicoterapia por mêsLicença familiar estendida (Responsável 6 meses e corresponsável 30 dias)Auxílio Creche / BabáAcomPANha (programa de acompanhamento para gestantes)Wellhub/TotalpassAuxílio tecnologia assistivas (reembolso de 85% para colaboradores com deficiência)Programas de desenvolvimentoMassagem e AuriculoterapiaSalão de beleza no escritórioPAE (Orientação Jurídica, Financeira, Psicológica e Social)Portal de descontos em diversos segmentos (Allya)Campanha de vacinação (colaborador e dependente)Facilitação no financiamento de veículos (Mediante análise)Cartão de crédito PAN com limite diferenciado (Mediante análise)Vale Transporte (desconto de apenas 4%)Assistência FuneralAssim como todas as nossas vagas, essa também é destinada à diversidade e inclusão. Independentemente de qualquer fator, perfil ou característica,Expanda sua carreira no PAN!Para conhecer mais sobre nossos benefícios e cultura, acesse o Trabalhe Conosco:https://www.bancopan.com.br/trabalhe-conosco/Show moreShow less",Não especificado,Não especificado,Amazon Web Service,4
Cientista de Dados Sênior (foco em IA Generativa),Itaú Unibanco,"São Paulo, São Paulo, Brazil",3 weeks ago,"Vem ser Ituber!O Itaú é a marca mais valiosa do Brasil, a melhor empresa para trabalhar segundo o Great Place to Work e o maior banco da América Latina. Nós impactamos diariamente mais de 60 milhões de clientes em 18 países. Somos feitos de pessoas e acreditamos que ter um quadro com pluralidade de origens, culturas, crenças, experiências, raças, deficiências, gêneros, orientações afetivo-sexuais e gerações ampliam as perspectivas e contribuem para um clima de respeito e valorização das diferenças. Não queremos você apenas por achar que tem a nossa cara. Queremos ter um pouco da sua também!Modelo de trabalho:Híbrido com escala (8x no mês presencial em São Paulo)Local: CEIC - Centro Empresarial Itaú Conceição (próximo ao metrô Conceição, Linha 1-Azul)O que você precisa para ser Ituber?Estamos buscando pessoas que queiram se desenvolver e aprender constantemente, compartilhando, colaborando, inovando e entregando valor para todos os nossos clientes. Aqui a gente não sabe tudo, a gente vai de turmaComo é o dia a dia de uma pessoa Ituber nessa área?Quer fazer parte de um time que está na vanguarda da Inteligência Artificial aplicada a interações inteligentes?No papel deCientista de Dados Sênior, você será protagonista na concepção e evolução de soluções baseadas em IA Generativa, criando experiências conversacionais inovadoras para oChat Inteligência Emps.Você vai trabalhar com arquiteturas modernas, pipelines escaláveis e práticas de MLOps, garantindo qualidade, segurança e governança dos modelos em produção.Estamos buscando uma pessoa para a posição deCientista de Dados Sênior, que queira se desenvolver e aprender, compartilhar, colaborar e inovar, entregando valor para todos os nossos clientes.Essa vaga pode ser a sua cara pois através dela você poderá:Atuar em projetos inovadores comtecnologias de pontaTer autonomia para pesquisa e experimentação.Atuar em impacto direto na estratégia deIANessa função você vai:Desenvolver modelos deIA generativaearquiteturas RAGCriarpipelinespara treinamento, fine-tuning e avaliaçãoGarantirgovernançaemonitoramentodos modelos em produçãoColaborar com times de produto e engenharia para integração de soluçõesNo que você precisa mandar bem?Experiência sólida com modelos deIA Generativa, agentes eRAG.Capacidade de avaliararquiteturas, medir métricas e propor melhorias.Conhecimento emMachine Learningclássico e boas práticas de engenharia.Curiosidade para pesquisar tendências e separar hype de valor real.Conhecimento em construções de modelos para chatbots é fortementedesejávelDiferenciais:Fine-tuning avançado de modelosopen-sourceCertificações emIA ou CloudAo se tornar Ituber você tem• Vale Transporte• Vale Refeição (Restaurantes) / Vale Alimentação (Supermercados)• Convênio médico e odontológico• Seguro de Vida• PLR – Participação nos Lucros e Resultados (Mediante resultados do banco)• Previdência privada• Descontos exclusivos em nossos produtos financeiros• Licença maternidade estendida & paternidade• Auxílio Creche / Babá (para papais e mamães)• Incentivo a estudos• GymPass ou TotalPass• Acesso aos Clubes Itaú (Guarapiranga / Itanhaém e São Sebastião)• + Algumas vantagens que você pode conhecer durante o processoConheça mais sobre nossa cultura: https://www.itau.com.br/relacoes-com-investidores/noticias/cultura-itubers-e-nosso-novo-conjunto-de-valores/*Estimulamos candidaturas de pessoas com deficiência em todas as nossas posições, sendo assim, sinta-se à vontade para se candidatar em vagas sinalizadas como exclusivas ou não para pessoas com deficiência. Somos comprometidos com a inclusão e valorizamos a diversidade.#VemProItaú #VemSerItuberShow moreShow less",,On-site/Hybrid,https://www.linkedin.com/jobs-guest/jobs/api/jobPosting/4348500631,2025-12-27,"Cientista de Dados Sênior (foco em IA Generativa) Vem ser Ituber!O Itaú é a marca mais valiosa do Brasil, a melhor empresa para trabalhar segundo o Great Place to Work e o maior banco da América Latina. Nós impactamos diariamente mais de 60 milhões de clientes em 18 países. Somos feitos de pessoas e acreditamos que ter um quadro com pluralidade de origens, culturas, crenças, experiências, raças, deficiências, gêneros, orientações afetivo-sexuais e gerações ampliam as perspectivas e contribuem para um clima de respeito e valorização das diferenças. Não queremos você apenas por achar que tem a nossa cara. Queremos ter um pouco da sua também!Modelo de trabalho:Híbrido com escala (8x no mês presencial em São Paulo)Local: CEIC - Centro Empresarial Itaú Conceição (próximo ao metrô Conceição, Linha 1-Azul)O que você precisa para ser Ituber?Estamos buscando pessoas que queiram se desenvolver e aprender constantemente, compartilhando, colaborando, inovando e entregando valor para todos os nossos clientes. Aqui a gente não sabe tudo, a gente vai de turmaComo é o dia a dia de uma pessoa Ituber nessa área?Quer fazer parte de um time que está na vanguarda da Inteligência Artificial aplicada a interações inteligentes?No papel deCientista de Dados Sênior, você será protagonista na concepção e evolução de soluções baseadas em IA Generativa, criando experiências conversacionais inovadoras para oChat Inteligência Emps.Você vai trabalhar com arquiteturas modernas, pipelines escaláveis e práticas de MLOps, garantindo qualidade, segurança e governança dos modelos em produção.Estamos buscando uma pessoa para a posição deCientista de Dados Sênior, que queira se desenvolver e aprender, compartilhar, colaborar e inovar, entregando valor para todos os nossos clientes.Essa vaga pode ser a sua cara pois através dela você poderá:Atuar em projetos inovadores comtecnologias de pontaTer autonomia para pesquisa e experimentação.Atuar em impacto direto na estratégia deIANessa função você vai:Desenvolver modelos deIA generativaearquiteturas RAGCriarpipelinespara treinamento, fine-tuning e avaliaçãoGarantirgovernançaemonitoramentodos modelos em produçãoColaborar com times de produto e engenharia para integração de soluçõesNo que você precisa mandar bem?Experiência sólida com modelos deIA Generativa, agentes eRAG.Capacidade de avaliararquiteturas, medir métricas e propor melhorias.Conhecimento emMachine Learningclássico e boas práticas de engenharia.Curiosidade para pesquisar tendências e separar hype de valor real.Conhecimento em construções de modelos para chatbots é fortementedesejávelDiferenciais:Fine-tuning avançado de modelosopen-sourceCertificações emIA ou CloudAo se tornar Ituber você tem• Vale Transporte• Vale Refeição (Restaurantes) / Vale Alimentação (Supermercados)• Convênio médico e odontológico• Seguro de Vida• PLR – Participação nos Lucros e Resultados (Mediante resultados do banco)• Previdência privada• Descontos exclusivos em nossos produtos financeiros• Licença maternidade estendida & paternidade• Auxílio Creche / Babá (para papais e mamães)• Incentivo a estudos• GymPass ou TotalPass• Acesso aos Clubes Itaú (Guarapiranga / Itanhaém e São Sebastião)• + Algumas vantagens que você pode conhecer durante o processoConheça mais sobre nossa cultura: https://www.itau.com.br/relacoes-com-investidores/noticias/cultura-itubers-e-nosso-novo-conjunto-de-valores/*Estimulamos candidaturas de pessoas com deficiência em todas as nossas posições, sendo assim, sinta-se à vontade para se candidatar em vagas sinalizadas como exclusivas ou não para pessoas com deficiência. Somos comprometidos com a inclusão e valorizamos a diversidade.#VemProItaú #VemSerItuberShow moreShow less",Sênior,Não especificado,Não especificado,1
Cientista de dados,Safra,"São Paulo, São Paulo, Brazil",15 hours ago,"No Banco Safra, a Inteligência Artificial é um pilar estratégico que impulsiona a transformação digital com foco em eficiência, inovação e geração de valor. Integrada aos processos críticos do banco, a IA atua de forma coordenada com as áreas de negócio para apoiar decisões com base em dados e tecnologia de ponta.Dentro dessa estrutura, a prática de Ciência de Dados tem papel central. Com atuação transversal, essa frente é responsável por organizar, estruturar e interpretar dados para gerar visibilidade estratégica e apoiar a tomada de decisão em diversas áreas de negócio. A equipe é composta por perfis especializados — como cientistas de dados, engenheiros de dados e profissionais de ML Ops — que combinam profundidade técnica com visão de negócio.Responsabilidades:Estamos em busca de Cientistas de Dados para integrar nossa Squad dedicada à construção de modelos preditivos, descritivos e diagnósticos voltados para diversas áreas de negócio soluções analíticas voltadas para diversas áreas estratégicas. O profissional atuará em projetos de alto impacto, desde o diagnóstico até a modelagem preditiva, com foco em gerar valor para o negócio por meio de dados.Principais responsabilidades:- Desenvolver e implementar modelos estatísticos e de machine learning.- Traduzir problemas de negócio em soluções analíticas.- Trabalhar com grandes volumes de dados estruturados e não estruturados.- Colaborar com áreas de negócio e engenharia de dados.- Monitorar e manter modelos em produção (MLOps).- Participar da definição de KPIs e processos da Squad.- Atuar com autonomia e protagonismo em entregas estratégicas.Requisitos Indispensáveis:- Linguagens: Python (avançado), SQL (avançado).- Bibliotecas: Pandas, NumPy, Scikit-learn, TensorFlow, PyTorch.- Plataformas: Cloudera, Spark, Hive.- MLOps: Deploy, monitoramento e manutenção de modelos.- Modelagem estatística: regressões, árvores de decisão, boosting, clustering.- Feature engineering e avaliação de modelos.- Machine learning- ETL em camada de negócios- Visualização de dados e storytelling analíticoDesejáveis:- Conhecimento em NoSQL.- Experiência com notebooks Jupyter.- Ferramentas de visualização: Power BI, Tableau.- Experiência com sistemas de recomendação e séries temporais.Show moreShow less",,On-site/Hybrid,https://www.linkedin.com/jobs-guest/jobs/api/jobPosting/4350485339,2025-12-27,"Cientista de dados No Banco Safra, a Inteligência Artificial é um pilar estratégico que impulsiona a transformação digital com foco em eficiência, inovação e geração de valor. Integrada aos processos críticos do banco, a IA atua de forma coordenada com as áreas de negócio para apoiar decisões com base em dados e tecnologia de ponta.Dentro dessa estrutura, a prática de Ciência de Dados tem papel central. Com atuação transversal, essa frente é responsável por organizar, estruturar e interpretar dados para gerar visibilidade estratégica e apoiar a tomada de decisão em diversas áreas de negócio. A equipe é composta por perfis especializados — como cientistas de dados, engenheiros de dados e profissionais de ML Ops — que combinam profundidade técnica com visão de negócio.Responsabilidades:Estamos em busca de Cientistas de Dados para integrar nossa Squad dedicada à construção de modelos preditivos, descritivos e diagnósticos voltados para diversas áreas de negócio soluções analíticas voltadas para diversas áreas estratégicas. O profissional atuará em projetos de alto impacto, desde o diagnóstico até a modelagem preditiva, com foco em gerar valor para o negócio por meio de dados.Principais responsabilidades:- Desenvolver e implementar modelos estatísticos e de machine learning.- Traduzir problemas de negócio em soluções analíticas.- Trabalhar com grandes volumes de dados estruturados e não estruturados.- Colaborar com áreas de negócio e engenharia de dados.- Monitorar e manter modelos em produção (MLOps).- Participar da definição de KPIs e processos da Squad.- Atuar com autonomia e protagonismo em entregas estratégicas.Requisitos Indispensáveis:- Linguagens: Python (avançado), SQL (avançado).- Bibliotecas: Pandas, NumPy, Scikit-learn, TensorFlow, PyTorch.- Plataformas: Cloudera, Spark, Hive.- MLOps: Deploy, monitoramento e manutenção de modelos.- Modelagem estatística: regressões, árvores de decisão, boosting, clustering.- Feature engineering e avaliação de modelos.- Machine learning- ETL em camada de negócios- Visualização de dados e storytelling analíticoDesejáveis:- Conhecimento em NoSQL.- Experiência com notebooks Jupyter.- Ferramentas de visualização: Power BI, Tableau.- Experiência com sistemas de recomendação e séries temporais.Show moreShow less",Não especificado,Não especificado,Não especificado,1
