title,company,location,posted,description,applicants,work_mode,link,data_coleta,titulo_descr,senioridade,idioma,certificado,cluster
Lean Coach - Remote Work,BairesDev,Greater São Paulo Area,3 days ago,"At BairesDev®, we've been leading the way in technology projects for over 15 years. We deliver cutting-edge solutions to giants like Google and the most innovative startups in Silicon Valley.Our diverse 4,000+ team, composed of the world's Top 1% of tech talent, works remotely on roles that drive significant impact worldwide.When you apply for this position, you're taking the first step in a process that goes beyond the ordinary. We aim to align your passions and skills with our vacancies, setting you on a path to exceptional career development and success.Lean Coach at BairesDevOur Lean Coach engineers are senior developers deeply committed to quality. They enable the creation of highly-optimized, production-ready code every day. They don’t need to be sold on the importance of documentation or teamwork because they see them as cornerstones of their work. They are passionate, active members of our community who enjoy sharing knowledge, challenging, and being challenged by other developers and are genuinely committed to improving themselves and those around them.What You Will Do:- Assist the team in preparation of ART and Solution Train using various tools, such as the Program and Solution Kanbans and other information radiators.- Coach teams in Lean-Agile practices and mindsets.- Provide input on resourcing to address critical bottlenecks.- Encourage collaboration between teams and System and Solution Architects/Engineering.- Work with Product and Solution Management, Product Owners, and other stakeholders to help ensure strategy and execution alignment.- Improve the flow of value through value streams using Continuous Delivery Pipeline and DevOps.- Facilitate System Demos and Solution Demos.Here’s what we are looking for:- Solid experience in similar roles.- Use of agile methodologies.- Excellent communication skills.- Certifications chords (desirable).- Advanced English level.How we do make your work (and your life) easier:- 100% remote work (from anywhere).- Excellent compensation in USD or your local currency if preferred- Hardware and software setup for you to work from home.- Flexible hours: create your own schedule.- Paid parental leaves, vacations, and national holidays.- Innovative and multicultural work environment: collaborate and learn from the global Top 1% of talent.- Supportive environment with mentorship, promotions, skill development, and diverse growth opportunities.Apply now and become part of a global team where your unique talents can truly thrive!Show moreShow less",,Remote,https://www.linkedin.com/jobs-guest/jobs/api/jobPosting/4399625755,2026-04-17,"Lean Coach - Remote Work At BairesDev®, we've been leading the way in technology projects for over 15 years. We deliver cutting-edge solutions to giants like Google and the most innovative startups in Silicon Valley.Our diverse 4,000+ team, composed of the world's Top 1% of tech talent, works remotely on roles that drive significant impact worldwide.When you apply for this position, you're taking the first step in a process that goes beyond the ordinary. We aim to align your passions and skills with our vacancies, setting you on a path to exceptional career development and success.Lean Coach at BairesDevOur Lean Coach engineers are senior developers deeply committed to quality. They enable the creation of highly-optimized, production-ready code every day. They don’t need to be sold on the importance of documentation or teamwork because they see them as cornerstones of their work. They are passionate, active members of our community who enjoy sharing knowledge, challenging, and being challenged by other developers and are genuinely committed to improving themselves and those around them.What You Will Do:- Assist the team in preparation of ART and Solution Train using various tools, such as the Program and Solution Kanbans and other information radiators.- Coach teams in Lean-Agile practices and mindsets.- Provide input on resourcing to address critical bottlenecks.- Encourage collaboration between teams and System and Solution Architects/Engineering.- Work with Product and Solution Management, Product Owners, and other stakeholders to help ensure strategy and execution alignment.- Improve the flow of value through value streams using Continuous Delivery Pipeline and DevOps.- Facilitate System Demos and Solution Demos.Here’s what we are looking for:- Solid experience in similar roles.- Use of agile methodologies.- Excellent communication skills.- Certifications chords (desirable).- Advanced English level.How we do make your work (and your life) easier:- 100% remote work (from anywhere).- Excellent compensation in USD or your local currency if preferred- Hardware and software setup for you to work from home.- Flexible hours: create your own schedule.- Paid parental leaves, vacations, and national holidays.- Innovative and multicultural work environment: collaborate and learn from the global Top 1% of talent.- Supportive environment with mentorship, promotions, skill development, and diverse growth opportunities.Apply now and become part of a global team where your unique talents can truly thrive!Show moreShow less",Sênior,Não especificado,Google Cloud,1
Data Science Project Leader - Fraud Prevention,Mercado Livre Brasil,"Osasco, São Paulo, Brazil",16 hours ago,"ComoProject Leadno Mercado Livre, você projetará e escalará sistemas inovadores e seguros que resolvem problemas reais e de alto impacto. Trabalhará em um ambiente dinâmico com tecnologia de ponta, aplicando boas práticas de engenharia, modelos próprios de IA e aprendizado contínuo, com o propósito de democratizar o comércio eletrônico e os serviços financeiros na América Latina.Imagine-se empreendendo projetos desafiadores, dinâmicos e inovadorese sendo responsável por:Liderar a gestão e a execução dos tracks de ciência de dados da vertical de Account Lifecycle, voltados para: detecção de fraude no cadastro de novas contas, identificação de roubo de identidade e uso indevido de contas existentes.Liderar as cerimônias de trabalho da equipe como planejamento, refinamento, fechamento, e retrospectiva, garantindo um adequado planejamento de iniciativas, incluindo Q+1, e uma execução alinhada ao impacto no negócio.Fazer a gestão do backlog de trabalho, bem como identificar dependências e efetuar a devida priorização.Criar e liderar estratégias para evoluir as dinâmicas de trabalho da equipe, com foco em: networking e comunicação, avanço e repriorização.Liderar o desenvolvimento da equipe: planos de desenvolvimento individuais, mentoring e coaching, construção e acompanhamento de OKRs de equipe e individuais alinhados à estratégia de Prevenção de Fraude – Account Lifecycle.O que buscamos em você?Ter experiência em liderança de equipes de ciência de dadosPossuir sólida experiência em gestão de projetos e frameworks ágeisVocê se anima a deixar sua marca na tecnologia da América Latina? Candidate-se e junte-se ao nosso propósito!Modalidade de trabalho híbrida. Escritório Osasco, SPShow moreShow less",,On-site/Hybrid,https://www.linkedin.com/jobs-guest/jobs/api/jobPosting/4400452602,2026-04-17,"Data Science Project Leader - Fraud Prevention ComoProject Leadno Mercado Livre, você projetará e escalará sistemas inovadores e seguros que resolvem problemas reais e de alto impacto. Trabalhará em um ambiente dinâmico com tecnologia de ponta, aplicando boas práticas de engenharia, modelos próprios de IA e aprendizado contínuo, com o propósito de democratizar o comércio eletrônico e os serviços financeiros na América Latina.Imagine-se empreendendo projetos desafiadores, dinâmicos e inovadorese sendo responsável por:Liderar a gestão e a execução dos tracks de ciência de dados da vertical de Account Lifecycle, voltados para: detecção de fraude no cadastro de novas contas, identificação de roubo de identidade e uso indevido de contas existentes.Liderar as cerimônias de trabalho da equipe como planejamento, refinamento, fechamento, e retrospectiva, garantindo um adequado planejamento de iniciativas, incluindo Q+1, e uma execução alinhada ao impacto no negócio.Fazer a gestão do backlog de trabalho, bem como identificar dependências e efetuar a devida priorização.Criar e liderar estratégias para evoluir as dinâmicas de trabalho da equipe, com foco em: networking e comunicação, avanço e repriorização.Liderar o desenvolvimento da equipe: planos de desenvolvimento individuais, mentoring e coaching, construção e acompanhamento de OKRs de equipe e individuais alinhados à estratégia de Prevenção de Fraude – Account Lifecycle.O que buscamos em você?Ter experiência em liderança de equipes de ciência de dadosPossuir sólida experiência em gestão de projetos e frameworks ágeisVocê se anima a deixar sua marca na tecnologia da América Latina? Candidate-se e junte-se ao nosso propósito!Modalidade de trabalho híbrida. Escritório Osasco, SPShow moreShow less",Não especificado,Não especificado,Não especificado,0
Cientista de Dados I Consultor,Vivo (Telefônica Brasil),"São Paulo, São Paulo, Brazil",2 days ago,"Descrição da vagaVice Presidência de TIDiretoria Dados e Inteligência ArtificialLocal de trabalho: São Paulo/SP | EcoBerriniSomos uma empresa do Grupo Telefônica, líder em telecomunicações no Brasil.Nosso propósito é Digitalizar para Aproximar pessoas, negócios e toda sociedade, construindo uma nação mais conectada e transformando a vida dos brasileiros.O Cientista de Dados será um protagonista na transformação digital, sempre promovendo a cultura data driven e a inovação.Excelente oportunidade para trabalhar, como Cientista de Dados, em um dos maiores lagos de dados da América Latina, minerando, manipulando e interpretando um grande volume de dados, e explorar novas tecnologias e ferramentas cloud com análises estatísticas, modelos de machine learning e IA.Responsabilidades e atribuiçõesConduzir análises exploratórias e desenvolver novas variáveis através de feature engineering.Criar e otimizar modelos preditivos utilizando diversos algoritmos estatísticos e técnicas de Machine Learning.Identificar padrões de perfis e comportamentos de clientes essenciais para o negócio.Colaborar em squads multidisciplinares e trazer insights criativos na resolução de problemas complexos.Propor e implementar novas soluções, testando metodologias inovadoras e ferramentas tecnológicas que otimizem processos e gerem valor.Liderar tecnicamente projetos relacionados ao desenvolvimento de modelos, clusterizações e ciência de dados, com habilidade para apresentar resultados para diversos stakeholders.Conduzir iniciativas em modelos LLM, RAG e Inteligência Artificial, testando e desenvolvendo novos algoritmos.Requisitos e qualificaçõesProfundo conhecimento em infraestruturas de banco de dados relacionais e não relacionais (Teradata, Oracle), ambientes Big Data (Hadoop, Hive, Spark, Scala) e Cloud (Databricks, Azure, GCP).Sólidos conhecimentos em ferramentas de tratamento e análise de dados, como SAS, R e SQL.Expertise em estatística, incluindo probabilidades, simulações, previsões, árvores de decisão, regressão linear/logística, análise preditiva e clusterização.Domínio em Python na utilização de bibliotecas relevantes para ciência de dados e algoritmos machine learning.Familiaridade com metodologias LLM, RAG e Inteligência Artificial.Visão analítica e orientada a dados.Habilidade de trabalho em equipe, proatividade e excelente comunicação.Superior completo em Ciência da Computação, Estatística, Matemática, Física ou Engenharias.Diferencial mestrado e doutorado.Informações adicionaisVeja o que ofereceremos para você: Na Vivo não medimos esforços em apoiar e valorizar nossos colaboradores. Não são apenas excelentes benefícios, mas também flexíveis.Escolher o benefício ideal para você e seus dependentes, numa plataforma digital com diversas categorias de Academia, VR, VA, Auxílio Farmácia, Assistência Médica, Odontológica e Seguro de Vida;Celular corporativo. Sim, um smartphone novinho para você!Plano de voz e Dados ilimitado! Sim ilimitado! Com a melhor rede móvel, ainda mais rápida com o 5G da Vivo!Uma oferta exclusiva da Vivo, com desconto especial em linha fixa, banda larga, TV e apps;Terá direito a receber Bônus ou PPR anual;Planejará seu futuro através do plano de Previdência Privada;Tem filhos? Terá direito a um subsídio para ajudar nas despesas com escola, creche ou babá;Viver em um ambiente que respeitará sua personalidade, seu estilo de se vestir, seu jeito de ser e poderá ser autêntico. #VemdeVocêTrabalhar remotamente até 2 vezes por semana. #MobilityTer flexibilidade de horário;Aproveitar um dia de folga (Day off) para comemorar seu aniversário;Participar de um dos maiores programas de voluntariado corporativo para você transformar o mundo;Usufruir do nosso Programa de Desenvolvimento Educacional que oferece parcerias em instituições de ensino com desconto; certificações e cursos online.Potencializar sua carreira por meio do nosso Programa de Recrutamento Interno, no Brasil ou fora, afinal estamos presentes em mais de 17 países! #VivoMinhaCarreiraContar com uma série de iniciativas para melhorar a sua saúde física, emocional e social! Por aqui, temos o #VivoBemEstar, que estimula o nosso time a ter hábitos saudáveis e mais qualidade de vida! Disponibilizados aos nossos colaboradores consultas com nutricionista, psicólogos, serviço social, telemedicina, e muito mais!Todas as nossas vagas são elegíveis a pessoas com deficiência e/ou reabilitados. Temos uma cultura que valoriza a diversidade, as diferenças e o potencial das pessoas! #VivoDiversidade #VemPraVivo Importante: A única forma de participar de processos seletivos da Vivo é por meio das páginas da empresa na plataforma Gupy https://vivo.gupy.io e não há pagamento de taxa de participação ou contratação.Etapas do processoCadastroTriagemAvaliação comportamental MAPAEntrevista com RHAvaliação comportamental PPA (DISC)Entrevista com GestorPropostaContrataçãoSobre nósSomos uma empresa do Grupo Telefônica, líder em telecomunicações no Brasil. Trabalhamos com o propósito deDigitalizar para Aproximarpessoas, negócios e toda sociedade, construindo uma nação mais conectada e transformando a vida dos brasileiros. Buscamos ampliar a autonomia, a personalização e as escolhas em tempo real dos nossos clientes, colocando-os no comando da sua vida digital, com segurança e confiabilidade – tudo isso com a qualidade que só a Vivo tem.Para que isso seja possível, lideramos um processo de transformação digital e estamos revolucionando nossa companhia de dentro para fora. Implementamos metodologias ágeis por toda a empresa, buscando nos conectar com as formas mais inovadoras e colaborativas de trabalho. Atuamos para fomentar um ambiente diverso e inclusivo, que estimula a criatividade, gerando inovação e aumentando o engajamento.Acreditamos que adiversidadede pessoas, vivência, culturas, comportamentos, habilidades e atitudes é um diferencial, que reflete a sociedade em que vivemos. Temos um sólido programa interno, pautados nos pilares de Gênero, LGBTI+, Raça, PcD e 50+ para assegurar uma cultura mais inclusiva e um ambiente mais diverso e representativo. Somos uma empresa detecnologia,inspirada na diversidade e nainovação,que oferece espaço para todos, apoia e acolhe as diferenças.Acreditamos que o caminho para oferecer a melhor experiência ao nosso cliente começa pela boa experiência do nosso colaborador.#VemPraVivoShow moreShow less",,On-site/Hybrid,https://www.linkedin.com/jobs-guest/jobs/api/jobPosting/4401781897,2026-04-17,"Cientista de Dados I Consultor Descrição da vagaVice Presidência de TIDiretoria Dados e Inteligência ArtificialLocal de trabalho: São Paulo/SP | EcoBerriniSomos uma empresa do Grupo Telefônica, líder em telecomunicações no Brasil.Nosso propósito é Digitalizar para Aproximar pessoas, negócios e toda sociedade, construindo uma nação mais conectada e transformando a vida dos brasileiros.O Cientista de Dados será um protagonista na transformação digital, sempre promovendo a cultura data driven e a inovação.Excelente oportunidade para trabalhar, como Cientista de Dados, em um dos maiores lagos de dados da América Latina, minerando, manipulando e interpretando um grande volume de dados, e explorar novas tecnologias e ferramentas cloud com análises estatísticas, modelos de machine learning e IA.Responsabilidades e atribuiçõesConduzir análises exploratórias e desenvolver novas variáveis através de feature engineering.Criar e otimizar modelos preditivos utilizando diversos algoritmos estatísticos e técnicas de Machine Learning.Identificar padrões de perfis e comportamentos de clientes essenciais para o negócio.Colaborar em squads multidisciplinares e trazer insights criativos na resolução de problemas complexos.Propor e implementar novas soluções, testando metodologias inovadoras e ferramentas tecnológicas que otimizem processos e gerem valor.Liderar tecnicamente projetos relacionados ao desenvolvimento de modelos, clusterizações e ciência de dados, com habilidade para apresentar resultados para diversos stakeholders.Conduzir iniciativas em modelos LLM, RAG e Inteligência Artificial, testando e desenvolvendo novos algoritmos.Requisitos e qualificaçõesProfundo conhecimento em infraestruturas de banco de dados relacionais e não relacionais (Teradata, Oracle), ambientes Big Data (Hadoop, Hive, Spark, Scala) e Cloud (Databricks, Azure, GCP).Sólidos conhecimentos em ferramentas de tratamento e análise de dados, como SAS, R e SQL.Expertise em estatística, incluindo probabilidades, simulações, previsões, árvores de decisão, regressão linear/logística, análise preditiva e clusterização.Domínio em Python na utilização de bibliotecas relevantes para ciência de dados e algoritmos machine learning.Familiaridade com metodologias LLM, RAG e Inteligência Artificial.Visão analítica e orientada a dados.Habilidade de trabalho em equipe, proatividade e excelente comunicação.Superior completo em Ciência da Computação, Estatística, Matemática, Física ou Engenharias.Diferencial mestrado e doutorado.Informações adicionaisVeja o que ofereceremos para você: Na Vivo não medimos esforços em apoiar e valorizar nossos colaboradores. Não são apenas excelentes benefícios, mas também flexíveis.Escolher o benefício ideal para você e seus dependentes, numa plataforma digital com diversas categorias de Academia, VR, VA, Auxílio Farmácia, Assistência Médica, Odontológica e Seguro de Vida;Celular corporativo. Sim, um smartphone novinho para você!Plano de voz e Dados ilimitado! Sim ilimitado! Com a melhor rede móvel, ainda mais rápida com o 5G da Vivo!Uma oferta exclusiva da Vivo, com desconto especial em linha fixa, banda larga, TV e apps;Terá direito a receber Bônus ou PPR anual;Planejará seu futuro através do plano de Previdência Privada;Tem filhos? Terá direito a um subsídio para ajudar nas despesas com escola, creche ou babá;Viver em um ambiente que respeitará sua personalidade, seu estilo de se vestir, seu jeito de ser e poderá ser autêntico. #VemdeVocêTrabalhar remotamente até 2 vezes por semana. #MobilityTer flexibilidade de horário;Aproveitar um dia de folga (Day off) para comemorar seu aniversário;Participar de um dos maiores programas de voluntariado corporativo para você transformar o mundo;Usufruir do nosso Programa de Desenvolvimento Educacional que oferece parcerias em instituições de ensino com desconto; certificações e cursos online.Potencializar sua carreira por meio do nosso Programa de Recrutamento Interno, no Brasil ou fora, afinal estamos presentes em mais de 17 países! #VivoMinhaCarreiraContar com uma série de iniciativas para melhorar a sua saúde física, emocional e social! Por aqui, temos o #VivoBemEstar, que estimula o nosso time a ter hábitos saudáveis e mais qualidade de vida! Disponibilizados aos nossos colaboradores consultas com nutricionista, psicólogos, serviço social, telemedicina, e muito mais!Todas as nossas vagas são elegíveis a pessoas com deficiência e/ou reabilitados. Temos uma cultura que valoriza a diversidade, as diferenças e o potencial das pessoas! #VivoDiversidade #VemPraVivo Importante: A única forma de participar de processos seletivos da Vivo é por meio das páginas da empresa na plataforma Gupy https://vivo.gupy.io e não há pagamento de taxa de participação ou contratação.Etapas do processoCadastroTriagemAvaliação comportamental MAPAEntrevista com RHAvaliação comportamental PPA (DISC)Entrevista com GestorPropostaContrataçãoSobre nósSomos uma empresa do Grupo Telefônica, líder em telecomunicações no Brasil. Trabalhamos com o propósito deDigitalizar para Aproximarpessoas, negócios e toda sociedade, construindo uma nação mais conectada e transformando a vida dos brasileiros. Buscamos ampliar a autonomia, a personalização e as escolhas em tempo real dos nossos clientes, colocando-os no comando da sua vida digital, com segurança e confiabilidade – tudo isso com a qualidade que só a Vivo tem.Para que isso seja possível, lideramos um processo de transformação digital e estamos revolucionando nossa companhia de dentro para fora. Implementamos metodologias ágeis por toda a empresa, buscando nos conectar com as formas mais inovadoras e colaborativas de trabalho. Atuamos para fomentar um ambiente diverso e inclusivo, que estimula a criatividade, gerando inovação e aumentando o engajamento.Acreditamos que adiversidadede pessoas, vivência, culturas, comportamentos, habilidades e atitudes é um diferencial, que reflete a sociedade em que vivemos. Temos um sólido programa interno, pautados nos pilares de Gênero, LGBTI+, Raça, PcD e 50+ para assegurar uma cultura mais inclusiva e um ambiente mais diverso e representativo. Somos uma empresa detecnologia,inspirada na diversidade e nainovação,que oferece espaço para todos, apoia e acolhe as diferenças.Acreditamos que o caminho para oferecer a melhor experiência ao nosso cliente começa pela boa experiência do nosso colaborador.#VemPraVivoShow moreShow less",Não especificado,Não especificado,Microsoft Azure,3
