title,company,location,posted,description,applicants,work_mode,link,data_coleta,titulo_descr,senioridade,idioma,certificado,cluster
Data Scientist [All Levels],Nubank,"São Paulo, São Paulo, Brazil",2 weeks ago,"About UsNu was born in 2013 with the mission to fight complexity to empower people in their daily lives by reinventing financial services. We are one of the world’s largest digital banking platforms, serving millions of customers across Brazil, Mexico, and Colombia. For more information, visit our institutional page https://international.nubank.com.br/careers/Data Science at NubankData Science is essential to every part of the business at Nubank, since Day 1. Most areas of the company use data science to some extent. Data Scientists are responsible for translating business needs into models and other types of data-driven solutions.As a Data Scientist, you’re expected toInteract with other team members to understand how to best apply data science and artificial intelligence to Nubank’s problems;Investigate problems and discover insights through exploratory data analysis and other quantitative methods;Have great numerical and analytical literacy, including knowledge of statistics and linear algebra as needed;Work on multiple stages of the ML model lifecycle–from ideation to training and steady-state operation;Work across multiple types of models, algorithms and learning paradigms;Communicate technical points, decisions and tradeoffs to peers and stakeholders;Our ideal candidateHas experience working with ML models in a production environment;Understands possible pitfalls and tradeoffs when applying ML to real-word, sometimes messy problems;Is familiar with the technical aspects of learning theory and algorithms and is able to discuss details if needed;Has experience working with the Python scientific stack (Numpy, Pandas, Scipy, Sklearn, Boosted Tree Libraries, etc);Has experience working with Tensor/Deep Learning libraries such as Tensorflow and Pytorch;Is able to connect analytical outcomes to business priorities and advise stakeholders on the best course of action;Has good communication skills and is able to convey technical topics and decision points to diverse audiences;Has experience writing general-purpose code using modern tools;Understands the implications of causality when applying ML to problems;Is up-to-date with recent developments in the area as a whole and is able to identify opportunities for improvement and innovation;Our BenefitsChance of earning equity at NubankFood/ Meal Card (Vale-Refeição and/or Vale Alimentação)Public Transportation Commuting Benefit (Vale-Transporte)NuCare – Psychological, Financial and Legal Assistance ProgramLife InsuranceMedical PlanDental PlanNuLanguage – Language Course ProgramNucleo - Our learning platform of coursesExtended Parental LeaveDaycare AllowanceParental ConsultancyWork-from-home AllowanceGym Partnerships30 days of paid vacationWork Model for this RoleHybrid 2-3 times/week:Our hybrid work model brings us to the office at least twice a week, on strategic days designed to maximize team connection and collaboration. For more details, visit https://building.nubank.com/nu-hybrid-work-model/Show moreShow less",,On-site/Hybrid,https://www.linkedin.com/jobs-guest/jobs/api/jobPosting/4364197061,2026-04-17,"Data Scientist [All Levels] About UsNu was born in 2013 with the mission to fight complexity to empower people in their daily lives by reinventing financial services. We are one of the world’s largest digital banking platforms, serving millions of customers across Brazil, Mexico, and Colombia. For more information, visit our institutional page https://international.nubank.com.br/careers/Data Science at NubankData Science is essential to every part of the business at Nubank, since Day 1. Most areas of the company use data science to some extent. Data Scientists are responsible for translating business needs into models and other types of data-driven solutions.As a Data Scientist, you’re expected toInteract with other team members to understand how to best apply data science and artificial intelligence to Nubank’s problems;Investigate problems and discover insights through exploratory data analysis and other quantitative methods;Have great numerical and analytical literacy, including knowledge of statistics and linear algebra as needed;Work on multiple stages of the ML model lifecycle–from ideation to training and steady-state operation;Work across multiple types of models, algorithms and learning paradigms;Communicate technical points, decisions and tradeoffs to peers and stakeholders;Our ideal candidateHas experience working with ML models in a production environment;Understands possible pitfalls and tradeoffs when applying ML to real-word, sometimes messy problems;Is familiar with the technical aspects of learning theory and algorithms and is able to discuss details if needed;Has experience working with the Python scientific stack (Numpy, Pandas, Scipy, Sklearn, Boosted Tree Libraries, etc);Has experience working with Tensor/Deep Learning libraries such as Tensorflow and Pytorch;Is able to connect analytical outcomes to business priorities and advise stakeholders on the best course of action;Has good communication skills and is able to convey technical topics and decision points to diverse audiences;Has experience writing general-purpose code using modern tools;Understands the implications of causality when applying ML to problems;Is up-to-date with recent developments in the area as a whole and is able to identify opportunities for improvement and innovation;Our BenefitsChance of earning equity at NubankFood/ Meal Card (Vale-Refeição and/or Vale Alimentação)Public Transportation Commuting Benefit (Vale-Transporte)NuCare – Psychological, Financial and Legal Assistance ProgramLife InsuranceMedical PlanDental PlanNuLanguage – Language Course ProgramNucleo - Our learning platform of coursesExtended Parental LeaveDaycare AllowanceParental ConsultancyWork-from-home AllowanceGym Partnerships30 days of paid vacationWork Model for this RoleHybrid 2-3 times/week:Our hybrid work model brings us to the office at least twice a week, on strategic days designed to maximize team connection and collaboration. For more details, visit https://building.nubank.com/nu-hybrid-work-model/Show moreShow less",Não especificado,Não especificado,Não especificado,1
Espec I - Cientista de Dados,Safra,"São Paulo, São Paulo, Brazil",2 days ago,"No Banco Safra, a Inteligência Artificial é um pilar estratégico que impulsiona a transformação digital com foco em eficiência, inovação e geração de valor. Integrada aos processos críticos do banco, a IA atua de forma coordenada com as áreas de negócio para apoiar decisões com base em dados e tecnologia de ponta.Dentro dessa estrutura, a prática de Ciência de Dados tem papel central. Com atuação transversal, essa frente é responsável por organizar, estruturar e interpretar dados para gerar visibilidade estratégica e apoiar a tomada de decisão em diversas áreas de negócio. A equipe é composta por perfis especializados — como cientistas de dados, engenheiros de dados e profissionais de ML Ops que combinam profundidade técnica com visão de negócio.Responsabilidades:Estamos em busca de Cientistas de Dados para integrar nossa Squad dedicada à construção de modelos preditivos, descritivos e diagnósticos voltados para diversas áreas de negócio soluções analíticas voltadas para diversas áreas estratégicas. O profissional atuará em projetos de alto impacto, desde o diagnóstico até a modelagem preditiva, com foco em gerar valor para o negócio por meio de dados.Principais responsabilidades:- Desenvolver e implementar modelos estatísticos e de machine learning.- Traduzir problemas de negócio em soluções analíticas.- Trabalhar com grandes volumes de dados estruturados e não estruturados.- Colaborar com áreas de negócio e engenharia de dados.- Monitorar e manter modelos em produção (MLOps).- Participar da definição de KPIs e processos da Squad.- Atuar com autonomia e protagonismo em entregas estratégicas.Requisitos Indispensáveis:- Linguagens: Python (avançado), SQL (avançado).- Bibliotecas: Pandas, NumPy, Scikit-learn, TensorFlow, PyTorch.- Plataformas: Cloudera, Spark, Hive.- MLOps: Deploy, monitoramento e manutenção de modelos.- Modelagem estatística: regressões, árvores de decisão, boosting, clustering.- Feature engineering e avaliação de modelos.- Machine learning- ETL em camada de negócios- Visualização de dados e storytelling analíticoDesejáveis:- Conhecimento em NoSQL.- Experiência com notebooks Jupyter.- Ferramentas de visualização: Power BI, Tableau.- Experiência com sistemas de recomendação e séries temporais.Show moreShow less",,On-site/Hybrid,https://www.linkedin.com/jobs-guest/jobs/api/jobPosting/4399758790,2026-04-17,"Espec I - Cientista de Dados No Banco Safra, a Inteligência Artificial é um pilar estratégico que impulsiona a transformação digital com foco em eficiência, inovação e geração de valor. Integrada aos processos críticos do banco, a IA atua de forma coordenada com as áreas de negócio para apoiar decisões com base em dados e tecnologia de ponta.Dentro dessa estrutura, a prática de Ciência de Dados tem papel central. Com atuação transversal, essa frente é responsável por organizar, estruturar e interpretar dados para gerar visibilidade estratégica e apoiar a tomada de decisão em diversas áreas de negócio. A equipe é composta por perfis especializados — como cientistas de dados, engenheiros de dados e profissionais de ML Ops que combinam profundidade técnica com visão de negócio.Responsabilidades:Estamos em busca de Cientistas de Dados para integrar nossa Squad dedicada à construção de modelos preditivos, descritivos e diagnósticos voltados para diversas áreas de negócio soluções analíticas voltadas para diversas áreas estratégicas. O profissional atuará em projetos de alto impacto, desde o diagnóstico até a modelagem preditiva, com foco em gerar valor para o negócio por meio de dados.Principais responsabilidades:- Desenvolver e implementar modelos estatísticos e de machine learning.- Traduzir problemas de negócio em soluções analíticas.- Trabalhar com grandes volumes de dados estruturados e não estruturados.- Colaborar com áreas de negócio e engenharia de dados.- Monitorar e manter modelos em produção (MLOps).- Participar da definição de KPIs e processos da Squad.- Atuar com autonomia e protagonismo em entregas estratégicas.Requisitos Indispensáveis:- Linguagens: Python (avançado), SQL (avançado).- Bibliotecas: Pandas, NumPy, Scikit-learn, TensorFlow, PyTorch.- Plataformas: Cloudera, Spark, Hive.- MLOps: Deploy, monitoramento e manutenção de modelos.- Modelagem estatística: regressões, árvores de decisão, boosting, clustering.- Feature engineering e avaliação de modelos.- Machine learning- ETL em camada de negócios- Visualização de dados e storytelling analíticoDesejáveis:- Conhecimento em NoSQL.- Experiência com notebooks Jupyter.- Ferramentas de visualização: Power BI, Tableau.- Experiência com sistemas de recomendação e séries temporais.Show moreShow less",Não especificado,Não especificado,Não especificado,3
"Cientista de Dados (Brasil, Remoto)",Dell Technologies,"São Paulo, São Paulo, Brazil",1 week ago,"A área de Engenharia Centrada em IA é dinâmica e empolgante, fazendo parte do Escritório do CTO (OCTO) da Dell. Conduzimos pesquisas e engenharia voltadas para o futuro da Dell Technologies em um ambiente de alta visibilidade e colaboração intensa. Nossa equipe é especializada no desenvolvimento de soluções avançadas de IA que capacitam empresas a inovar, se comunicar e otimizar operações de maneiras nunca antes possíveis. Somos compostos por pessoas apaixonadas e dedicadas a ultrapassar os limites da tecnologia de IA.Junte-se a nós para realizar o melhor trabalho da sua carreira e causar um impacto social profundo comoCientista de Dadosem nossa equipe no Brasil (remoto).O que você conquistaráComoCientista de Dadosvocê será responsável por contribuir com a estratégia de negócios e influenciar a tomada de decisões com base em informações obtidas por meio de análises aprofundadas. Você produzirá recomendações acionáveis e envolventes ao interpretar insights de conjuntos de dados complexos. Também irá projetar processos para consolidar e examinar dados não estruturados, gerando insights relevantes. Além disso, colaborará com líderes de negócios, engenheiros e especialistas da indústria para construir modelos preditivos, algoritmos e motores de probabilidade.Você IráColaborar com equipes internas e externas para entender os requisitos dos clientes e desenvolver soluções personalizadas utilizando modelos de IA generativa;Desenvolver aplicações de IA utilizadas em diferentes áreas da Dell, com o objetivo de transformar e modernizar a empresa;Desenvolver e conduzir testes para avaliar a eficácia de algoritmos em diferentes casos analíticos;Manter-se atualizado com os avanços mais recentes em pesquisa de IA e aplicar técnicas de ponta para aprimorar o desempenho dos modelos;Realizar testes rigorosos, validação e avaliação de desempenho das soluções de IA.Dê o primeiro passo em direção à carreira dos seus sonhosCada Membro Da Equipe Da Dell Technologies Traz Algo Único Para a Mesa. Aqui Está o Que Estamos Procurando, Com Esta FunçãoRequisitos EssenciaisFormação acadêmica: Graduação completa em Ciência da Computação, Engenharia (Computação, Software, Elétrica, Controle e Automação), Estatística, Matemática, Física ou áreas correlatas. Pós-graduação stricto sensu (Mestrado ou Doutorado) em áreas relacionadas à Inteligência Artificial, Aprendizado de Máquina ou Ciência de Dados;Domínio avançado do inglês, necessário para interação constante com times internacionais;Sólidas habilidades de programação em Python;Compreensão dos conceitos de Aprendizado de Máquina (Machine Learning);Conhecimento e familiaridade com os conceitos fundamentais de design e análise de algoritmos, além de forte conhecimento em matemática e estatística.Requisitos DesejáveisCompreensão sólida de arquiteturas de Deep Learning, com experiência em ajuste fino e personalização de modelos pré-treinados para aplicações específicas. Proficiência em Python e nas bibliotecas/frameworks relevantes (ex.: TensorFlow, PyTorch);Experiência com modelos de linguagem de grande escala e familiaridade com técnicas e aplicações de processamento de linguagem natural (PLN).Quem somosAcreditamos que cada pessoa tem o poder de gerar impacto. É por isso que colocamos as pessoas da nossa equipe no centro de tudo o que fazemos. Se você está procurando uma oportunidade de desenvolver a sua carreira em um ambiente de trabalho inclusivo e diverso, com a tecnologia mais avançada do setor, estamos procurando por você.A Dell Technologies é uma família única de empresas que ajuda pessoas e organizações a transformar a forma como trabalham, vivem e se divertem. Junte-se a nós para construir um futuro que funcione para todas as pessoas, porque o progresso precisa de nós.A Dell Technologies está comprometida com o princípio de oportunidades iguais de emprego para todas as pessoas, e em fornecer às pessoas da equipe um ambiente de trabalho livre de discriminação e assédio. Leia a nossa Política de Oportunidades de Emprego aqui.Job ID:R283866Show moreShow less",,On-site/Hybrid,https://www.linkedin.com/jobs-guest/jobs/api/jobPosting/4344395115,2026-04-17,"Cientista de Dados (Brasil, Remoto) A área de Engenharia Centrada em IA é dinâmica e empolgante, fazendo parte do Escritório do CTO (OCTO) da Dell. Conduzimos pesquisas e engenharia voltadas para o futuro da Dell Technologies em um ambiente de alta visibilidade e colaboração intensa. Nossa equipe é especializada no desenvolvimento de soluções avançadas de IA que capacitam empresas a inovar, se comunicar e otimizar operações de maneiras nunca antes possíveis. Somos compostos por pessoas apaixonadas e dedicadas a ultrapassar os limites da tecnologia de IA.Junte-se a nós para realizar o melhor trabalho da sua carreira e causar um impacto social profundo comoCientista de Dadosem nossa equipe no Brasil (remoto).O que você conquistaráComoCientista de Dadosvocê será responsável por contribuir com a estratégia de negócios e influenciar a tomada de decisões com base em informações obtidas por meio de análises aprofundadas. Você produzirá recomendações acionáveis e envolventes ao interpretar insights de conjuntos de dados complexos. Também irá projetar processos para consolidar e examinar dados não estruturados, gerando insights relevantes. Além disso, colaborará com líderes de negócios, engenheiros e especialistas da indústria para construir modelos preditivos, algoritmos e motores de probabilidade.Você IráColaborar com equipes internas e externas para entender os requisitos dos clientes e desenvolver soluções personalizadas utilizando modelos de IA generativa;Desenvolver aplicações de IA utilizadas em diferentes áreas da Dell, com o objetivo de transformar e modernizar a empresa;Desenvolver e conduzir testes para avaliar a eficácia de algoritmos em diferentes casos analíticos;Manter-se atualizado com os avanços mais recentes em pesquisa de IA e aplicar técnicas de ponta para aprimorar o desempenho dos modelos;Realizar testes rigorosos, validação e avaliação de desempenho das soluções de IA.Dê o primeiro passo em direção à carreira dos seus sonhosCada Membro Da Equipe Da Dell Technologies Traz Algo Único Para a Mesa. Aqui Está o Que Estamos Procurando, Com Esta FunçãoRequisitos EssenciaisFormação acadêmica: Graduação completa em Ciência da Computação, Engenharia (Computação, Software, Elétrica, Controle e Automação), Estatística, Matemática, Física ou áreas correlatas. Pós-graduação stricto sensu (Mestrado ou Doutorado) em áreas relacionadas à Inteligência Artificial, Aprendizado de Máquina ou Ciência de Dados;Domínio avançado do inglês, necessário para interação constante com times internacionais;Sólidas habilidades de programação em Python;Compreensão dos conceitos de Aprendizado de Máquina (Machine Learning);Conhecimento e familiaridade com os conceitos fundamentais de design e análise de algoritmos, além de forte conhecimento em matemática e estatística.Requisitos DesejáveisCompreensão sólida de arquiteturas de Deep Learning, com experiência em ajuste fino e personalização de modelos pré-treinados para aplicações específicas. Proficiência em Python e nas bibliotecas/frameworks relevantes (ex.: TensorFlow, PyTorch);Experiência com modelos de linguagem de grande escala e familiaridade com técnicas e aplicações de processamento de linguagem natural (PLN).Quem somosAcreditamos que cada pessoa tem o poder de gerar impacto. É por isso que colocamos as pessoas da nossa equipe no centro de tudo o que fazemos. Se você está procurando uma oportunidade de desenvolver a sua carreira em um ambiente de trabalho inclusivo e diverso, com a tecnologia mais avançada do setor, estamos procurando por você.A Dell Technologies é uma família única de empresas que ajuda pessoas e organizações a transformar a forma como trabalham, vivem e se divertem. Junte-se a nós para construir um futuro que funcione para todas as pessoas, porque o progresso precisa de nós.A Dell Technologies está comprometida com o princípio de oportunidades iguais de emprego para todas as pessoas, e em fornecer às pessoas da equipe um ambiente de trabalho livre de discriminação e assédio. Leia a nossa Política de Oportunidades de Emprego aqui.Job ID:R283866Show moreShow less",Não especificado,Inglês,Não especificado,3
