title,company,location,posted,description,applicants,work_mode,link,data_coleta,titulo_descr,senioridade,idioma,certificado,cluster
Cientista de Dados Senior (área Business Development) - São Paulo/SP,Shopee,"São Paulo, São Paulo, Brazil",1 day ago,"About The TeamSobre a ShôAqui na Shô, acreditamos que cada membro de nossa equipe é fundamental para o nosso sucesso, e que diversidade de perspectivas e vivências são essenciais para movimentar nosso negócio e impulsionar o nosso propósito de mudar o mundo para melhor.Fazer parte do nosso time é a oportunidade de se desenvolver dentro de uma cultura de muita agilidade. Se você ama assumir grandes responsabilidades e fazer o que nunca foi feito, a Shô é seu lugar. Aqui você terá grandes desafios, trabalhará em colaboração com um time diverso e contribuirá para o futuro do e-commerce no Brasil, criamos impacto positivo na vida de milhões de pessoas.Modelo de TrabalhoAdotamos um modelo de trabalho híbrido, esse modelo permite que as pessoas ajustem seu ambiente de trabalho de acordo com suas necessidades pessoais, ao mesmo tempo em que promove a colaboração e interação no escritório.Qual será a sua missãoVocê atuará no time de Business Development e será responsável por estruturar e automatizar processos de coleta, classificação, organização e análise de dados que apoiem decisões estratégicas em um ambiente de negócio altamente dinâmico e competitivo.Buscamos alguém com perfil técnico e aplicado, que saiba construir soluções escaláveis, com forte raciocínio analítico e autonomia.Job DescriptionComo será o seu dia a diaProjetar e implementar pipelines robustos para processamento de dados em larga escala;Participar ativamente da evolução da esteira de dados e modelos, com foco em escalabilidade, confiabilidade e impacto;Colaborar com desenvolvedores, analistas de negócio e stakeholders de outras áreas, mantendo uma comunicação clara e objetiva;Desenvolver dashboards e relatórios com dados processados, apoiando a geração de insights para o negócio;Construir soluções com mentalidade DevOps e MLOps, utilizando automações, versionamento, CI/CD e monitoramento.RequirementsO que você precisa para assumir o desafioExperiência sólida com Python e bibliotecas de dados e machine learning (Pandas, Scikit-learn, etc.);Vivência com PySpark ou ferramentas de processamento distribuído;Experiência no tratamento e classificação de dados textuais não estruturados (ex: nomes e descrições de produtos, marcas, categorias), usando regex, Fuzzy Matching, embeddings ou LLMs;Experiência com machine learning aplicado a problemas como classificação e regressão;Domínio de SQL, com experiência em modelagem de dados, otimização de consultas e organização de bases relacionais para consumo analítico;Habilidade de colaborar em equipes multidisciplinares, com boa comunicação e visão de negócio;Diferencial: domínio de frameworks como TensorFlow ou PyTorch;Diferencial: experiência/base sólida em webscrapping;Diferencial: experiência com sistemas de recomendação, otimização ou personalização em larga escala;Diferencial: experiência com ingestão de dados externos e integração com fontes diversas (APIs, arquivos, dados públicos em escala);Diferencial: familiaridade com ferramentas de orquestração como Airflow ou Kubeflow;Diferencial: vivência em ambientes de e-commerce ou mercados com alta complexidade competitiva.BenefíciosAssistência médica e odontológica, estendendo-se aos dependentes;Parceira com Gympass e TotalPass;Vale Refeição/Alimentação flexível;Vale Transporte, Vale Mobilidade ou Estacionamento no local;Benefício flexível;Zenklub;Bônus anual discricionário, atrelado à performance.VEM FAZER HISTÓRIA COM A GENTE.O QUE TE FAZ ÚNICO, NOS FAZ MELHORES! 🧡Show moreShow less",,On-site/Hybrid,https://www.linkedin.com/jobs-guest/jobs/api/jobPosting/4260617702,2025-10-19,"Cientista de Dados Senior (área Business Development) - São Paulo/SP About The TeamSobre a ShôAqui na Shô, acreditamos que cada membro de nossa equipe é fundamental para o nosso sucesso, e que diversidade de perspectivas e vivências são essenciais para movimentar nosso negócio e impulsionar o nosso propósito de mudar o mundo para melhor.Fazer parte do nosso time é a oportunidade de se desenvolver dentro de uma cultura de muita agilidade. Se você ama assumir grandes responsabilidades e fazer o que nunca foi feito, a Shô é seu lugar. Aqui você terá grandes desafios, trabalhará em colaboração com um time diverso e contribuirá para o futuro do e-commerce no Brasil, criamos impacto positivo na vida de milhões de pessoas.Modelo de TrabalhoAdotamos um modelo de trabalho híbrido, esse modelo permite que as pessoas ajustem seu ambiente de trabalho de acordo com suas necessidades pessoais, ao mesmo tempo em que promove a colaboração e interação no escritório.Qual será a sua missãoVocê atuará no time de Business Development e será responsável por estruturar e automatizar processos de coleta, classificação, organização e análise de dados que apoiem decisões estratégicas em um ambiente de negócio altamente dinâmico e competitivo.Buscamos alguém com perfil técnico e aplicado, que saiba construir soluções escaláveis, com forte raciocínio analítico e autonomia.Job DescriptionComo será o seu dia a diaProjetar e implementar pipelines robustos para processamento de dados em larga escala;Participar ativamente da evolução da esteira de dados e modelos, com foco em escalabilidade, confiabilidade e impacto;Colaborar com desenvolvedores, analistas de negócio e stakeholders de outras áreas, mantendo uma comunicação clara e objetiva;Desenvolver dashboards e relatórios com dados processados, apoiando a geração de insights para o negócio;Construir soluções com mentalidade DevOps e MLOps, utilizando automações, versionamento, CI/CD e monitoramento.RequirementsO que você precisa para assumir o desafioExperiência sólida com Python e bibliotecas de dados e machine learning (Pandas, Scikit-learn, etc.);Vivência com PySpark ou ferramentas de processamento distribuído;Experiência no tratamento e classificação de dados textuais não estruturados (ex: nomes e descrições de produtos, marcas, categorias), usando regex, Fuzzy Matching, embeddings ou LLMs;Experiência com machine learning aplicado a problemas como classificação e regressão;Domínio de SQL, com experiência em modelagem de dados, otimização de consultas e organização de bases relacionais para consumo analítico;Habilidade de colaborar em equipes multidisciplinares, com boa comunicação e visão de negócio;Diferencial: domínio de frameworks como TensorFlow ou PyTorch;Diferencial: experiência/base sólida em webscrapping;Diferencial: experiência com sistemas de recomendação, otimização ou personalização em larga escala;Diferencial: experiência com ingestão de dados externos e integração com fontes diversas (APIs, arquivos, dados públicos em escala);Diferencial: familiaridade com ferramentas de orquestração como Airflow ou Kubeflow;Diferencial: vivência em ambientes de e-commerce ou mercados com alta complexidade competitiva.BenefíciosAssistência médica e odontológica, estendendo-se aos dependentes;Parceira com Gympass e TotalPass;Vale Refeição/Alimentação flexível;Vale Transporte, Vale Mobilidade ou Estacionamento no local;Benefício flexível;Zenklub;Bônus anual discricionário, atrelado à performance.VEM FAZER HISTÓRIA COM A GENTE.O QUE TE FAZ ÚNICO, NOS FAZ MELHORES! 🧡Show moreShow less",Sênior,Não especificado,Não especificado,2
Analista de Privacidade Sr - Seara,Seara,"São Paulo, São Paulo, Brazil",4 days ago,"Descrição da vagaContamos com um time que trabalha com disciplina, determinação e humildade e que reconhece seu papel como agente de transformação para gerar as mudanças que o mundo precisa, movidos pelo propósito de alimentar o mundo com o que há de melhor.Conheça Mais Sobre a SearaA Seara atua com mais de 95 mil colaboradores 👩‍🍳👨‍🍳, com um portfólio de produtos diversificado e marcas reconhecidas. É a maior produtora de frango do país 🐔.Líder no segmento de alimentos preparados e de carne suína 🐖, a Seara atende milhares de consumidores ao redor do mundo 🌐 e possui uma equipe dedicada de profissionais 👩🏭 que garantem a qualidade e a inovação de seus produtos.Algumas Curiosidades Sobre a SearaReconhecimento Global: A Seara é conhecida internacionalmente pela qualidade e sabor de seus produtos, oferecendo uma ampla gama de opções que vão desde carnes congeladas até pratos prontos e refeições práticas.Inovação no Segmento: A Seara está sempre inovando, desenvolvendo produtos que atendem às necessidades dos consumidores modernos, como opções saudáveis, práticas e deliciosas, incluindo a linha Seara Gourmet e Seara Nature.Práticas Sustentáveis: A Seara adota práticas sustentáveis em toda a sua cadeia produtiva, priorizando o bem-estar animal, a eficiência energética e a gestão responsável de recursos.Junte-se à nossa equipe e faça parte de uma história de sucesso e inovação na JBS!Responsabilidades e atribuiçõesGestão da Privacidade e Proteção de Dados;Governança de uso de IAAtuar na área de Segurança da Informação, em atividades relacionadas a privacidade e proteção de dados, gestão de riscos e governança de uso de IA;Mapear e revisar, junto as áreas de negócio, processos que envolvam tratamento de dados pessoais ou uso de inteligência artificial e administrar ferramenta de governança;Gestão de políticas, termos, manuais e conscientização dos colaboradores;Avaliar riscos de privacidade e segurança nos processos e nos tratos com terceiros, recomendando planos de ação. Avaliar cláusulas contratuais;Atuar na gestão de incidentes de privacidade e administrar ferramenta de prevenção de perda de dados;Atender as solicitações de titulares.Requisitos e qualificaçõesSuperior completo em TI ou Direito;Sólida atuação em privacidade e proteção de dados;Desejável que resida próximo;Será um diferencial ter conhecimentos sólidos em segurança da informação e certificação em privacidade e proteção de dados.Informações adicionais🕘 Horário de trabalho das 08:00 às 18:00 com 01:12 de almoço;🏢 Vaga 100% presencial - Marginal Direita do Tietê, 500;🍽 Vale-Refeição e Vale-Alimentação flexível - Picpay🍛 Restaurante no local🚌 Vale-Transporte🚘 Estacionamento gratuito❤ Sempre Cuida (Clínica Digital) -Plataforma de Teleatendimento em Saúde para cuidar do seu bem-estar, incluindo saúde mental, física, nutricional, entre outras.🏥 Assistência Médica/Odontológica e Seguro de Vida -Opcionais e por modelo de parcerias, garantindo cuidados com sua saúde.🏋 Wellhub (antigo Gympass) e/ou Total Pass -Convênio de academias para promover sua saúde e bem-estar físico.🏷 Descontos e promoções exclusivas para os colaboradores -Vantagens exclusivas para a compra de produtos e serviços.📚 Descontos em Instituições de Ensino e de Idiomas -Incentivos para seu desenvolvimento acadêmico e profissional.💵 Participação nos resultadosEtapas do processoCadastroEntrevista com o RH e GestorEntrevista com Diretor, Gerente e BPComitê de Seleção JBSExame MédicoContrataçãoShow moreShow less",,On-site/Hybrid,https://www.linkedin.com/jobs-guest/jobs/api/jobPosting/4312206830,2025-10-19,"Analista de Privacidade Sr - Seara Descrição da vagaContamos com um time que trabalha com disciplina, determinação e humildade e que reconhece seu papel como agente de transformação para gerar as mudanças que o mundo precisa, movidos pelo propósito de alimentar o mundo com o que há de melhor.Conheça Mais Sobre a SearaA Seara atua com mais de 95 mil colaboradores 👩‍🍳👨‍🍳, com um portfólio de produtos diversificado e marcas reconhecidas. É a maior produtora de frango do país 🐔.Líder no segmento de alimentos preparados e de carne suína 🐖, a Seara atende milhares de consumidores ao redor do mundo 🌐 e possui uma equipe dedicada de profissionais 👩🏭 que garantem a qualidade e a inovação de seus produtos.Algumas Curiosidades Sobre a SearaReconhecimento Global: A Seara é conhecida internacionalmente pela qualidade e sabor de seus produtos, oferecendo uma ampla gama de opções que vão desde carnes congeladas até pratos prontos e refeições práticas.Inovação no Segmento: A Seara está sempre inovando, desenvolvendo produtos que atendem às necessidades dos consumidores modernos, como opções saudáveis, práticas e deliciosas, incluindo a linha Seara Gourmet e Seara Nature.Práticas Sustentáveis: A Seara adota práticas sustentáveis em toda a sua cadeia produtiva, priorizando o bem-estar animal, a eficiência energética e a gestão responsável de recursos.Junte-se à nossa equipe e faça parte de uma história de sucesso e inovação na JBS!Responsabilidades e atribuiçõesGestão da Privacidade e Proteção de Dados;Governança de uso de IAAtuar na área de Segurança da Informação, em atividades relacionadas a privacidade e proteção de dados, gestão de riscos e governança de uso de IA;Mapear e revisar, junto as áreas de negócio, processos que envolvam tratamento de dados pessoais ou uso de inteligência artificial e administrar ferramenta de governança;Gestão de políticas, termos, manuais e conscientização dos colaboradores;Avaliar riscos de privacidade e segurança nos processos e nos tratos com terceiros, recomendando planos de ação. Avaliar cláusulas contratuais;Atuar na gestão de incidentes de privacidade e administrar ferramenta de prevenção de perda de dados;Atender as solicitações de titulares.Requisitos e qualificaçõesSuperior completo em TI ou Direito;Sólida atuação em privacidade e proteção de dados;Desejável que resida próximo;Será um diferencial ter conhecimentos sólidos em segurança da informação e certificação em privacidade e proteção de dados.Informações adicionais🕘 Horário de trabalho das 08:00 às 18:00 com 01:12 de almoço;🏢 Vaga 100% presencial - Marginal Direita do Tietê, 500;🍽 Vale-Refeição e Vale-Alimentação flexível - Picpay🍛 Restaurante no local🚌 Vale-Transporte🚘 Estacionamento gratuito❤ Sempre Cuida (Clínica Digital) -Plataforma de Teleatendimento em Saúde para cuidar do seu bem-estar, incluindo saúde mental, física, nutricional, entre outras.🏥 Assistência Médica/Odontológica e Seguro de Vida -Opcionais e por modelo de parcerias, garantindo cuidados com sua saúde.🏋 Wellhub (antigo Gympass) e/ou Total Pass -Convênio de academias para promover sua saúde e bem-estar físico.🏷 Descontos e promoções exclusivas para os colaboradores -Vantagens exclusivas para a compra de produtos e serviços.📚 Descontos em Instituições de Ensino e de Idiomas -Incentivos para seu desenvolvimento acadêmico e profissional.💵 Participação nos resultadosEtapas do processoCadastroEntrevista com o RH e GestorEntrevista com Diretor, Gerente e BPComitê de Seleção JBSExame MédicoContrataçãoShow moreShow less",Não especificado,Não especificado,Não especificado,2
Bolsas de estudo,OTOH -Smart Sound Monitoring,"São Paulo, São Paulo, Brazil",2 weeks ago,"Projeto de pesquisa busca bolsista de Treinamento Técnico nível quatro – TT-IV (FAPESP) para atuar no desenvolvimento de soluções com Modelos de Linguagem (LLMs) voltadas à gestão de ruído em canteiros de obras. O bolsista auxiliará na estruturação e parametrização de uma base de dados composta por medições acústicas e informações de obra. Com essa base, aplicará técnicas de fine-tuning e Retrieval-Augmented Generation (RAG) para treinar uma LLM capaz de contextualizar eventos sonoros e apoiar a gestão automatizada de ruído na construção civil.Requisitos:1. Graduação em Ciência da Computação, Sistemas de Informação ou Engenharia;2. Dois anos de experiência após graduação ou título de mestre em área relacionada;3.Conhecimento em SQL/NoSQL, modelagem de dados, Python 3, POO, HTTP, Git;4. Inglês para leitura e escrita;5. Perfil colaborativo.Diferenciais: experiência em banco vetorial, processamento de linguagem natural (NLP), agentes de IA, Serverless, AWS Lambda, API OpenAI ou similares.Mais informações sobre requisitos e benefícios da Bolsa FAPESP TT-IV estão em fapesp.br/4727 e fapesp.br/3162.Show moreShow less",,On-site/Hybrid,https://www.linkedin.com/jobs-guest/jobs/api/jobPosting/4307260273,2025-10-19,"Bolsas de estudo Projeto de pesquisa busca bolsista de Treinamento Técnico nível quatro – TT-IV (FAPESP) para atuar no desenvolvimento de soluções com Modelos de Linguagem (LLMs) voltadas à gestão de ruído em canteiros de obras. O bolsista auxiliará na estruturação e parametrização de uma base de dados composta por medições acústicas e informações de obra. Com essa base, aplicará técnicas de fine-tuning e Retrieval-Augmented Generation (RAG) para treinar uma LLM capaz de contextualizar eventos sonoros e apoiar a gestão automatizada de ruído na construção civil.Requisitos:1. Graduação em Ciência da Computação, Sistemas de Informação ou Engenharia;2. Dois anos de experiência após graduação ou título de mestre em área relacionada;3.Conhecimento em SQL/NoSQL, modelagem de dados, Python 3, POO, HTTP, Git;4. Inglês para leitura e escrita;5. Perfil colaborativo.Diferenciais: experiência em banco vetorial, processamento de linguagem natural (NLP), agentes de IA, Serverless, AWS Lambda, API OpenAI ou similares.Mais informações sobre requisitos e benefícios da Bolsa FAPESP TT-IV estão em fapesp.br/4727 e fapesp.br/3162.Show moreShow less",Não especificado,Inglês,Amazon Web Service,2
Vem ser Ituber – Oportunidades direcionadas para Mulheres na Tecnologia 💪🏽,Itaú Unibanco,"São Paulo, São Paulo, Brazil",5 days ago,"vem construir o Itaú_Ei, você que émulher (cis e trans)na tecnologia, quer criar soluções que impactem a vida de milhares de pessoas todos os dias?Então vamos de turma!Se inscrever nessa oportunidade ajuda nossa liderança e recrutadores a te encontrar. Sempre que aparece uma posição com seu perfil, nós podemos acionar você😉Aqui no Itaú, trabalhamos paraevoluir e construir uma sociedade mais inclusiva e equânimecom ações para dentro e fora do banco, ampliando a representatividade, respeito e inclusão. Temos o objetivo de sermos cada vez mais diversos, o que também significa termos mais mulheres na tecnologia, área essencial rumo à transformação que desejamos 🚀E aí, bora?Essa é uma oportunidade exclusiva para todas as identidades femininas. Se interessou? Queremos um Itaú mais diverso e#feitocomvc.O que esperamos de você?Aqui nos organizamos por modelos de comunidades (tribos) e você, mulher na tecnologia, fará parte de um time robusto e inovador.Buscamos aprendizado constanteFocamos na melhor experiência para o clienteSomos colaborativas e sabemos oferecer e pedir ajudaSomos proativas! Pensamos e agimos como donasTemos resiliência e não nos limitamosÉtica para nós é inegociávelEsse é um conjunto de conhecimentos que compõe as carreiras de tecnologia que fazem a diferença no nosso time.Se você se identifica com alguma das carreiras abaixo, inscreva-se!Engenharia de Software Back-end: JAVA | .Net | Kotlin | Entre outrasEngenharia de Software Mobile: iOS e Android - Swift | Java | KotlinEngenharia de Software Qualidade: Silktest e SilkCentral, ferramentas de qualidade de testesEngenharia de Software Front-end: (Angular | React | JavaScript)Engenharia de dados: (Ex: Python, Hadoop, Big Data, Spark, Hive , Kafka, Banco de dados)Projetos e Processos: Metodologias de projetos ágeis (Scrum l Método Kanban l Safe) econhecimento em Melhoria contínua e suas ferramentas (A3,PDCA, Kaizen)💡Conhecimento em AWS será um grande diferencial!Cada pessoa é única e valorizamos isso, afinal, ser Ituber é ser tão diverso quanto nossos clientes!🧡 nossos valores_Pra gente, ética é inegociávelA gente trabalha para o clienteA gente não sabe tudoA gente vai de turmaA gente quer diversidadeA gente é movido por resultadoCom quais benefícios vou poder contar?Vale TransporteVale Refeição (Restaurantes) / Vale Alimentação (Supermercados)Convênio médico e odontológicoSeguro de VidaPLR (Mediante resultados do banco)Previdência privadaDescontos exclusivos em nossos produtos financeirosLicença maternidade estendidaAuxílio Creche / Babá (para papais e mamães)Incentivo a estudosGym Pass (Mas se preferir temos Bio Ritmo em alguns polos)Acesso aos Clubes Itaú (Guarapiranga / Itanhaém e São Sebastião)+ Algumas vantagens que você pode conhecer durante o processo 😊O Itaú irá utilizar os dados fornecidos para fins de processos seletivos, inclusive em bancos de vagas alocados em plataformas terceiras. Caso deseje solicitar oposição a este uso, ou exercer quaisquer um dos seus direitos, entre em contato através de nossos canais, disponíveis na Política de Privacidade de candidatos do Itaú Unibanco (https://www.itau.com.br/privacidade/candidatos/). Não há necessidade de aceitar, trata-se apenas de uma ciência.Show moreShow less",,On-site/Hybrid,https://www.linkedin.com/jobs-guest/jobs/api/jobPosting/4197742008,2025-10-19,"Vem ser Ituber – Oportunidades direcionadas para Mulheres na Tecnologia 💪🏽 vem construir o Itaú_Ei, você que émulher (cis e trans)na tecnologia, quer criar soluções que impactem a vida de milhares de pessoas todos os dias?Então vamos de turma!Se inscrever nessa oportunidade ajuda nossa liderança e recrutadores a te encontrar. Sempre que aparece uma posição com seu perfil, nós podemos acionar você😉Aqui no Itaú, trabalhamos paraevoluir e construir uma sociedade mais inclusiva e equânimecom ações para dentro e fora do banco, ampliando a representatividade, respeito e inclusão. Temos o objetivo de sermos cada vez mais diversos, o que também significa termos mais mulheres na tecnologia, área essencial rumo à transformação que desejamos 🚀E aí, bora?Essa é uma oportunidade exclusiva para todas as identidades femininas. Se interessou? Queremos um Itaú mais diverso e#feitocomvc.O que esperamos de você?Aqui nos organizamos por modelos de comunidades (tribos) e você, mulher na tecnologia, fará parte de um time robusto e inovador.Buscamos aprendizado constanteFocamos na melhor experiência para o clienteSomos colaborativas e sabemos oferecer e pedir ajudaSomos proativas! Pensamos e agimos como donasTemos resiliência e não nos limitamosÉtica para nós é inegociávelEsse é um conjunto de conhecimentos que compõe as carreiras de tecnologia que fazem a diferença no nosso time.Se você se identifica com alguma das carreiras abaixo, inscreva-se!Engenharia de Software Back-end: JAVA | .Net | Kotlin | Entre outrasEngenharia de Software Mobile: iOS e Android - Swift | Java | KotlinEngenharia de Software Qualidade: Silktest e SilkCentral, ferramentas de qualidade de testesEngenharia de Software Front-end: (Angular | React | JavaScript)Engenharia de dados: (Ex: Python, Hadoop, Big Data, Spark, Hive , Kafka, Banco de dados)Projetos e Processos: Metodologias de projetos ágeis (Scrum l Método Kanban l Safe) econhecimento em Melhoria contínua e suas ferramentas (A3,PDCA, Kaizen)💡Conhecimento em AWS será um grande diferencial!Cada pessoa é única e valorizamos isso, afinal, ser Ituber é ser tão diverso quanto nossos clientes!🧡 nossos valores_Pra gente, ética é inegociávelA gente trabalha para o clienteA gente não sabe tudoA gente vai de turmaA gente quer diversidadeA gente é movido por resultadoCom quais benefícios vou poder contar?Vale TransporteVale Refeição (Restaurantes) / Vale Alimentação (Supermercados)Convênio médico e odontológicoSeguro de VidaPLR (Mediante resultados do banco)Previdência privadaDescontos exclusivos em nossos produtos financeirosLicença maternidade estendidaAuxílio Creche / Babá (para papais e mamães)Incentivo a estudosGym Pass (Mas se preferir temos Bio Ritmo em alguns polos)Acesso aos Clubes Itaú (Guarapiranga / Itanhaém e São Sebastião)+ Algumas vantagens que você pode conhecer durante o processo 😊O Itaú irá utilizar os dados fornecidos para fins de processos seletivos, inclusive em bancos de vagas alocados em plataformas terceiras. Caso deseje solicitar oposição a este uso, ou exercer quaisquer um dos seus direitos, entre em contato através de nossos canais, disponíveis na Política de Privacidade de candidatos do Itaú Unibanco (https://www.itau.com.br/privacidade/candidatos/). Não há necessidade de aceitar, trata-se apenas de uma ciência.Show moreShow less",Não especificado,Não especificado,Amazon Web Service,2
