title,company,location,posted,description,applicants,work_mode,link,data_coleta,titulo_descr,senioridade,idioma,certificado,cluster
Cientista de Dados | Berrini - SP,Grupo Casas Bahia,"São Paulo, São Paulo, Brazil",10 hours ago,"Descrição da vagaSobre nós:﻿Junte-se ao Grupo Casas Bahia, o maior e mais inovador grupo varejista do Brasil, com mais de 70 anos de história e a missão de realizar os sonhos de mais de 90 milhões de brasileiros. Estamos em uma jornada de constante crescimento e transformação, colocando o cliente nocentro de tudo. Valorizamos o respeito, a diversidade e o desenvolvimento pessoal e profissional de cada um de nossos colaboradores. Aqui, você terá a oportunidade de crescer, se desenvolver e fazer parte de um time apaixonado por transformar o varejo.Estamos prontos para recebê-lo!🏷️Cientista de Dados📍 Local: Região da Berrini - SP📅 Regime:CLT | Presencial💼 Área:OperaçõesPor aqui, a dedicação total nunca foi tão forte!💙 ❤️Responsabilidades e atribuiçõesMissão:Transformar grandes volumes de dados em análises e visualizações claras, precisas e oportunas, apoiando decisões estratégicas e táticas que impulsionem a performance da operação.Principais ResponsabilidadesDesenvolver, aprimorar e validar modelos estatísticos e preditivos, suportando a resolução de problemas complexos do negócio (demanda, performance, eficiência operacional, entre outros).Conduzir análises exploratórias e diagnósticas profundas, utilizando técnicas estatísticas e modelagem para identificar padrões, tendências e oportunidades de melhoria.Atuar em todo o ciclo de vida dos modelos, incluindo ideação, prototipagem, experimentação, validação, deployment e monitoramento, em parceria com Engenharia e Tecnologia.Construir e manter pipelines analíticos que garantam dados limpos, consistentes e atualizados para análises e modelos.Colaborar com times de Engenharia, Produto, Operações e Negócios, transformando problemas reais em soluções baseadas em dados.Produzir visualizações, relatórios e narrativas analíticas claras, traduzindo insights complexos para públicos não técnicos e influenciando a tomada de decisão.Apoiar a disseminação da cultura de dados dentro da área, propondo métricas, testes e modelos que incrementem maturidade analítica.Requisitos e qualificaçõesExperiência comprovada em Data Science, Analytics ou áreas correlatas, com histórico de resolução de problemas reais de negócio.Domínio de Python, incluindo bibliotecas para análise e modelagem (pandas, numpy, scikit-learn etc.).Forte conhecimento em métodos estatísticos, experimentação (A/B test), modelagem preditiva e análise de séries temporais (desejável).Experiência com SQL para manipulação e extração de grandes volumes de dados.Capacidade de estruturar problemas complexos com mindset analítico e orientado à solução.Boa comunicação e habilidade para traduzir resultados técnicos em mensagens objetivas para stakeholders.Experiência com ferramentas de visualização (Power BI, Looker, Tableau).Informações adicionais🏷️Cientista de Dados📍 Local: Região da Berrini - SP📅 Regime:CLT | Presencial💼 Área:Operações👩‍⚕️ Saúde e Bem-EstarAssistência Médica e OdontológicaCuide de você e da sua família com segurança e conforto.Dr. SaúdeAtendimento psicológico e telemedicina gratuitos para você e seus familiares.Assistência FuneralApoio em um momento delicado, para você não estar sozinho.🧘 Qualidade de VidaWellhub (Gympass) e/ou Total PassAcesso a academias e atividades físicas para manter o corpo em movimento.Programa de GestantesApoio completo durante a gravidez, com suporte médico e emocional.Enxoval Bebê + Cartão MamãePara acolher com carinho esse momento tão especial.👶 Licenças EstendidasLicença Maternidade de 180 diasMais tempo para curtir os primeiros momentos com o bebê.Licença Paternidade de 20 diasPara que os pais também estejam presentes nos primeiros dias de vida.💰 Financeiro e SegurançaPLR / BônusReconhecimento extra pelo seu esforço e dedicação.Vale AlimentaçãoAlimentação de qualidade para o seu dia a dia.Vale TransporteTranquilidade no deslocamento até o trabalho.Seguro de VidaProteção para você e sua família.Previdência PrivadaUm passo a mais para o seu futuro financeiro.🎉 Vantagens ExclusivasDay-off no AniversárioUm dia de descanso para celebrar sua vida!Clube de DescontosAté70%em mais de 2.000 parceiros no Brasil e América Latina.Loja do ColaboradorCondições especiais em produtos do grupo.Descontos em todos os produtos do Grupo Casas BahiaEconomia garantida nas suas compras.Convênio com o SESCCultura, lazer e serviços para toda a família.📚 Desenvolvimento Profissional e ApoioUniversidade CorporativaCapacitação e crescimento dentro da empresa.Programa AcolherConsultorias gratuitasprevidenciária, financeira, jurídicae suporte social.Nosso compromisso é proporcionar não só um ambiente de trabalho, mas também uma experiência que valorize e cuide de você como pessoa! Estamos aqui para apoiar o seu crescimento pessoal e profissional.🚀Modelo de trabalho: 100% Presencial#VEMPROGRUPOCASASBAHIAPor aqui, a dedicação total nunca foi tão forte! 💙Grupo Casas BahiaO Grupo Casas Bahia é uma das empresas mais emblemáticas do Brasil, com uma história rica que se estende por décadas. Sua jornada é marcada por superação, inovação e dedicação total a você! Nossa dedicação é incansável, nossa vontade de trazer solução, e de conversar olho no olho nos faz humanos.Somos mais de 30 mil colaboradores, com a maior e mais digital rede logística do Brasil conectada a mais de mil lojas físicas, 29 centros de distribuição, hubs de entregas, tudo isso pensando nos mais de 200 milhões de clientes.Se você é movido pela paixão, pelo jeito de ser simples, pela transformação e pela dedicação que temos a você e a todos os brasileiros, desejamos boas-vindas, sinta-se em casa e conheça nossas oportunidades de carreira, no Grupo Casas Bahia.Show moreShow less",,On-site/Hybrid,https://www.linkedin.com/jobs-guest/jobs/api/jobPosting/4346249732,2025-12-27,"Cientista de Dados | Berrini - SP Descrição da vagaSobre nós:﻿Junte-se ao Grupo Casas Bahia, o maior e mais inovador grupo varejista do Brasil, com mais de 70 anos de história e a missão de realizar os sonhos de mais de 90 milhões de brasileiros. Estamos em uma jornada de constante crescimento e transformação, colocando o cliente nocentro de tudo. Valorizamos o respeito, a diversidade e o desenvolvimento pessoal e profissional de cada um de nossos colaboradores. Aqui, você terá a oportunidade de crescer, se desenvolver e fazer parte de um time apaixonado por transformar o varejo.Estamos prontos para recebê-lo!🏷️Cientista de Dados📍 Local: Região da Berrini - SP📅 Regime:CLT | Presencial💼 Área:OperaçõesPor aqui, a dedicação total nunca foi tão forte!💙 ❤️Responsabilidades e atribuiçõesMissão:Transformar grandes volumes de dados em análises e visualizações claras, precisas e oportunas, apoiando decisões estratégicas e táticas que impulsionem a performance da operação.Principais ResponsabilidadesDesenvolver, aprimorar e validar modelos estatísticos e preditivos, suportando a resolução de problemas complexos do negócio (demanda, performance, eficiência operacional, entre outros).Conduzir análises exploratórias e diagnósticas profundas, utilizando técnicas estatísticas e modelagem para identificar padrões, tendências e oportunidades de melhoria.Atuar em todo o ciclo de vida dos modelos, incluindo ideação, prototipagem, experimentação, validação, deployment e monitoramento, em parceria com Engenharia e Tecnologia.Construir e manter pipelines analíticos que garantam dados limpos, consistentes e atualizados para análises e modelos.Colaborar com times de Engenharia, Produto, Operações e Negócios, transformando problemas reais em soluções baseadas em dados.Produzir visualizações, relatórios e narrativas analíticas claras, traduzindo insights complexos para públicos não técnicos e influenciando a tomada de decisão.Apoiar a disseminação da cultura de dados dentro da área, propondo métricas, testes e modelos que incrementem maturidade analítica.Requisitos e qualificaçõesExperiência comprovada em Data Science, Analytics ou áreas correlatas, com histórico de resolução de problemas reais de negócio.Domínio de Python, incluindo bibliotecas para análise e modelagem (pandas, numpy, scikit-learn etc.).Forte conhecimento em métodos estatísticos, experimentação (A/B test), modelagem preditiva e análise de séries temporais (desejável).Experiência com SQL para manipulação e extração de grandes volumes de dados.Capacidade de estruturar problemas complexos com mindset analítico e orientado à solução.Boa comunicação e habilidade para traduzir resultados técnicos em mensagens objetivas para stakeholders.Experiência com ferramentas de visualização (Power BI, Looker, Tableau).Informações adicionais🏷️Cientista de Dados📍 Local: Região da Berrini - SP📅 Regime:CLT | Presencial💼 Área:Operações👩‍⚕️ Saúde e Bem-EstarAssistência Médica e OdontológicaCuide de você e da sua família com segurança e conforto.Dr. SaúdeAtendimento psicológico e telemedicina gratuitos para você e seus familiares.Assistência FuneralApoio em um momento delicado, para você não estar sozinho.🧘 Qualidade de VidaWellhub (Gympass) e/ou Total PassAcesso a academias e atividades físicas para manter o corpo em movimento.Programa de GestantesApoio completo durante a gravidez, com suporte médico e emocional.Enxoval Bebê + Cartão MamãePara acolher com carinho esse momento tão especial.👶 Licenças EstendidasLicença Maternidade de 180 diasMais tempo para curtir os primeiros momentos com o bebê.Licença Paternidade de 20 diasPara que os pais também estejam presentes nos primeiros dias de vida.💰 Financeiro e SegurançaPLR / BônusReconhecimento extra pelo seu esforço e dedicação.Vale AlimentaçãoAlimentação de qualidade para o seu dia a dia.Vale TransporteTranquilidade no deslocamento até o trabalho.Seguro de VidaProteção para você e sua família.Previdência PrivadaUm passo a mais para o seu futuro financeiro.🎉 Vantagens ExclusivasDay-off no AniversárioUm dia de descanso para celebrar sua vida!Clube de DescontosAté70%em mais de 2.000 parceiros no Brasil e América Latina.Loja do ColaboradorCondições especiais em produtos do grupo.Descontos em todos os produtos do Grupo Casas BahiaEconomia garantida nas suas compras.Convênio com o SESCCultura, lazer e serviços para toda a família.📚 Desenvolvimento Profissional e ApoioUniversidade CorporativaCapacitação e crescimento dentro da empresa.Programa AcolherConsultorias gratuitasprevidenciária, financeira, jurídicae suporte social.Nosso compromisso é proporcionar não só um ambiente de trabalho, mas também uma experiência que valorize e cuide de você como pessoa! Estamos aqui para apoiar o seu crescimento pessoal e profissional.🚀Modelo de trabalho: 100% Presencial#VEMPROGRUPOCASASBAHIAPor aqui, a dedicação total nunca foi tão forte! 💙Grupo Casas BahiaO Grupo Casas Bahia é uma das empresas mais emblemáticas do Brasil, com uma história rica que se estende por décadas. Sua jornada é marcada por superação, inovação e dedicação total a você! Nossa dedicação é incansável, nossa vontade de trazer solução, e de conversar olho no olho nos faz humanos.Somos mais de 30 mil colaboradores, com a maior e mais digital rede logística do Brasil conectada a mais de mil lojas físicas, 29 centros de distribuição, hubs de entregas, tudo isso pensando nos mais de 200 milhões de clientes.Se você é movido pela paixão, pelo jeito de ser simples, pela transformação e pela dedicação que temos a você e a todos os brasileiros, desejamos boas-vindas, sinta-se em casa e conheça nossas oportunidades de carreira, no Grupo Casas Bahia.Show moreShow less",Não especificado,Não especificado,Não especificado,1
Analista de Aquisição de Dados - Jr,Equifax,"Barueri, São Paulo, Brazil",1 week ago,"Estamos em busca de uma pessoa motivada para integrar nosso time e atuar estrategicamente na expansão de nossas fontes de informação. Se você busca desenvolvimento em um ambiente dinâmico e focado em inovação, essa vaga é para você!Principais Responsabilidades:Expansão de Dados: Auxiliar na prospecção e parceria com novas empresas provedoras de fontes de informação para o Cadastro Positivo.Inteligência de Produtos: Atuar em conjunto com membros da equipe para identificar e pesquisar fontes de dados que aprimorem produtos existentes ou impulsionem o desenvolvimento de novos serviços.Documentação e Relatórios: Contribuir na preparação de relatórios e documentações de fornecedores de dados, seguindo as práticas e processos padrão da companhia.Pesquisa de Mercado: Desenvolver habilidades para realizar pesquisas de mercado e identificar alvos estratégicos.Qualidade de Dados: Aprofundar o conhecimento em práticas de monitoramento e garantia da qualidade de dados.Requisitos Técnicos:SQL:Capacidade de realizar consultasPython:Conhecimento para manipulação e limpeza de dadosShow moreShow less",,On-site/Hybrid,https://www.linkedin.com/jobs-guest/jobs/api/jobPosting/4344489931,2025-12-27,"Analista de Aquisição de Dados - Jr Estamos em busca de uma pessoa motivada para integrar nosso time e atuar estrategicamente na expansão de nossas fontes de informação. Se você busca desenvolvimento em um ambiente dinâmico e focado em inovação, essa vaga é para você!Principais Responsabilidades:Expansão de Dados: Auxiliar na prospecção e parceria com novas empresas provedoras de fontes de informação para o Cadastro Positivo.Inteligência de Produtos: Atuar em conjunto com membros da equipe para identificar e pesquisar fontes de dados que aprimorem produtos existentes ou impulsionem o desenvolvimento de novos serviços.Documentação e Relatórios: Contribuir na preparação de relatórios e documentações de fornecedores de dados, seguindo as práticas e processos padrão da companhia.Pesquisa de Mercado: Desenvolver habilidades para realizar pesquisas de mercado e identificar alvos estratégicos.Qualidade de Dados: Aprofundar o conhecimento em práticas de monitoramento e garantia da qualidade de dados.Requisitos Técnicos:SQL:Capacidade de realizar consultasPython:Conhecimento para manipulação e limpeza de dadosShow moreShow less",Não especificado,Não especificado,Não especificado,1
Cientista de Dados II,Bunge,"São Paulo, São Paulo, Brazil",2 weeks ago,"A Bunge (NYSE: BG) é líder mundial em abastecimento, processamento e fornecimento de produtos e ingredientes de grãos e sementes oleaginosas. Fundada em 1818, a Bunge alimenta um mundo em crescimento, criando produtos e oportunidades sustentáveis para mais de 70.000 agricultores e seus consumidores em todo o mundo. A empresa está sediada em St. Louis, Missouri, e tem 25.000 funcionários, que estão por trás de mais de 350 terminais portuários, fábricas de processamento de sementes oleaginosas, silos de grãos e instalações de produção e embalagem de alimentos e ingredientes em todo o mundo.At Bunge, people do not just come here to work, they come here to grow – solving challenges that directly impact the world with a diverse team of thinkers and doers. Bunge offers a strong compensation and benefits package, generous paid time off program, flexible work arrangements, and opportunity to progress. Our hybrid work environment provides a balance of in-office and remote work.Most importantly, in all we do we live our values:Act as One Team by fostering inclusion, collaboration, and respectDrive for Excellence by being agile, innovative, and efficientDo What's Right by acting safely, ethically, and sustainablyOverviewWe are seeking a highly motivated and experienced Senior Data Scientist with strong expertise in predictice and prescriptive model applied to industrial operations to join our growing team. As Senior Data Scientist, you will be responsible for driving the construction of models to solve business problems, communicate to the technical team, and assure the delivery matches business expectations. You will also be responsible for working with cross-functional teams to identify and prioritize data analytics initiatives.Main AccountabilitiesDesign, create, test, and implement complex models and algorithms that drive analytical solutions throughout the organization.Gives technical support for data scientists across multiple squads.Collaborate with business analyst and understand business problems to implement scalable and sustainable solutions.Define development standards and solution approach.Design and structure reusable codebaseCoordinate with MIS, Digital Specialists, and Data Engineers to deliver holistic analytical solutionsCommunicates the design, functioning and output of the analytical models/solutions developedEnsure timely analysis and testing for regular maintenance of solutions over timeCommunicate data insights to stakeholders.Knowledge and Technical CompetenciesMake decisions aligned to Bunge’s global strategy, business needs and financial goals and explore new perspectives by driving innovation.Cultivate strong relationships and networks, effectively influence others, and develop talent to excel in their current and future roles.Develop data driven strategies aligned with Bunge’s priorities, energize others to action through clear and compelling communication.Proficient in data science, machine learning, programming languages like Python or R, SQL, data analysis, analytical skills, teamwork, and communication skills.Can help business structure the problems/hypotheses they want to address and convert it into an advanced analytics approach including machine learning and optimization components (e.g., Constraints, penalties, and objective functionDevelop business awareness of possible use cases and help them to understand the necessary concepts of data science and optimization to ensure better communication across functions.Education/ExperienceAdvanced knowledge in math, analytics and computer science, knowledge of machine learning methods, statistical models, advanced data science programming.Avoid greenhorn mistakes, avoid logical flaws in the models, revisit high-performing systems, write reusable code, build resilient data pipelines in the cloud environment, and prepare immaculate data.Capable of mentoring Associates and other Data scientists and answer business questions to higher authorities and management.Model behavior as a great team player and teach new ideas.Communications with the project stakeholders on a regular basisBunge (NYSE: BG) is a world leader in sourcing, processing and supplying oilseed and grain products and ingredients. Founded in 1818, Bunge’s expansive network feeds and fuels a growing world, creating sustainable products and opportunities for more than 70,000 farmers and the consumers they serve across the globe. The company is headquartered in St. Louis, Missouri and has 25,000 employees worldwide who stand behind more than 350 port terminals, oilseed processing plants, grain facilities, and food and ingredient production and packaging facilities around the world.Bunge is an Equal Opportunity Employer. All qualified applicants will receive consideration for employment without regard to race, color, religion, sex, sexual orientation, gender identity, gender expression, transgender status, national origin, citizenship, age, disability or military or veteran status, or any other legally protected status. Bunge is an Equal Opportunity Employer. Minorities/Women/Veterans/DisabledShow moreShow less",,Remote,https://www.linkedin.com/jobs-guest/jobs/api/jobPosting/4255394150,2025-12-27,"Cientista de Dados II A Bunge (NYSE: BG) é líder mundial em abastecimento, processamento e fornecimento de produtos e ingredientes de grãos e sementes oleaginosas. Fundada em 1818, a Bunge alimenta um mundo em crescimento, criando produtos e oportunidades sustentáveis para mais de 70.000 agricultores e seus consumidores em todo o mundo. A empresa está sediada em St. Louis, Missouri, e tem 25.000 funcionários, que estão por trás de mais de 350 terminais portuários, fábricas de processamento de sementes oleaginosas, silos de grãos e instalações de produção e embalagem de alimentos e ingredientes em todo o mundo.At Bunge, people do not just come here to work, they come here to grow – solving challenges that directly impact the world with a diverse team of thinkers and doers. Bunge offers a strong compensation and benefits package, generous paid time off program, flexible work arrangements, and opportunity to progress. Our hybrid work environment provides a balance of in-office and remote work.Most importantly, in all we do we live our values:Act as One Team by fostering inclusion, collaboration, and respectDrive for Excellence by being agile, innovative, and efficientDo What's Right by acting safely, ethically, and sustainablyOverviewWe are seeking a highly motivated and experienced Senior Data Scientist with strong expertise in predictice and prescriptive model applied to industrial operations to join our growing team. As Senior Data Scientist, you will be responsible for driving the construction of models to solve business problems, communicate to the technical team, and assure the delivery matches business expectations. You will also be responsible for working with cross-functional teams to identify and prioritize data analytics initiatives.Main AccountabilitiesDesign, create, test, and implement complex models and algorithms that drive analytical solutions throughout the organization.Gives technical support for data scientists across multiple squads.Collaborate with business analyst and understand business problems to implement scalable and sustainable solutions.Define development standards and solution approach.Design and structure reusable codebaseCoordinate with MIS, Digital Specialists, and Data Engineers to deliver holistic analytical solutionsCommunicates the design, functioning and output of the analytical models/solutions developedEnsure timely analysis and testing for regular maintenance of solutions over timeCommunicate data insights to stakeholders.Knowledge and Technical CompetenciesMake decisions aligned to Bunge’s global strategy, business needs and financial goals and explore new perspectives by driving innovation.Cultivate strong relationships and networks, effectively influence others, and develop talent to excel in their current and future roles.Develop data driven strategies aligned with Bunge’s priorities, energize others to action through clear and compelling communication.Proficient in data science, machine learning, programming languages like Python or R, SQL, data analysis, analytical skills, teamwork, and communication skills.Can help business structure the problems/hypotheses they want to address and convert it into an advanced analytics approach including machine learning and optimization components (e.g., Constraints, penalties, and objective functionDevelop business awareness of possible use cases and help them to understand the necessary concepts of data science and optimization to ensure better communication across functions.Education/ExperienceAdvanced knowledge in math, analytics and computer science, knowledge of machine learning methods, statistical models, advanced data science programming.Avoid greenhorn mistakes, avoid logical flaws in the models, revisit high-performing systems, write reusable code, build resilient data pipelines in the cloud environment, and prepare immaculate data.Capable of mentoring Associates and other Data scientists and answer business questions to higher authorities and management.Model behavior as a great team player and teach new ideas.Communications with the project stakeholders on a regular basisBunge (NYSE: BG) is a world leader in sourcing, processing and supplying oilseed and grain products and ingredients. Founded in 1818, Bunge’s expansive network feeds and fuels a growing world, creating sustainable products and opportunities for more than 70,000 farmers and the consumers they serve across the globe. The company is headquartered in St. Louis, Missouri and has 25,000 employees worldwide who stand behind more than 350 port terminals, oilseed processing plants, grain facilities, and food and ingredient production and packaging facilities around the world.Bunge is an Equal Opportunity Employer. All qualified applicants will receive consideration for employment without regard to race, color, religion, sex, sexual orientation, gender identity, gender expression, transgender status, national origin, citizenship, age, disability or military or veteran status, or any other legally protected status. Bunge is an Equal Opportunity Employer. Minorities/Women/Veterans/DisabledShow moreShow less",Sênior,Não especificado,Amazon Web Service,3
