title,company,location,posted,description,applicants,work_mode,link,data_coleta,titulo_descr,senioridade,idioma,certificado,cluster
Cientista de Dados Jr.,PagBank,"São Paulo, São Paulo, Brazil",1 week ago,"Descrição da vagaQuando você pensa em carreira, o que vem à sua mente? Propósito? Colaboração? Ser protagonista para fazer a diferença? No PagBank temos tudo isso e muito mais. 💛Estamos em busca de pessoas que vistam a camisa com orgulho. Gente com vontade de facilitar a vida financeira das pessoas e impulsionar negócios!Tá a fim de uma carreira que rende mais?Confira essa oportunidade e #VemProPags!Responsabilidades e atribuiçõesDesenvolver modelos para otimização de processos de banking ou adquirência.Analisar grandes volumes de dados transacionais para identificar padrões, tendências e oportunidades de melhoria nos processos.Implementar algoritmos de segmentação de clientes e predição de comportamento para aumentar a eficiência e a personalização dos serviços oferecidos.Trabalhar em estreita colaboração com equipes de engenharia, produto e negócios para definir e implementar soluções de dados que atendam às necessidades do cliente e da empresa.Fornecer insights complexos de maneira clara e eficaz para stakeholders não técnicos, ajudando na tomada de decisões estratégicas.Requisitos e qualificaçõesSuperior completo ou em andamento em Ciências da Computação, Engenharia, Matemática, Estatística ou áreas relacionadas.Experiência com análise de grandes volumes de dados para a geração de insights para times de negócio.Experiência com ferramentas de análise de dados e programação como SQL, Python, R ou bibliotecas de machine learning (TensorFlow, PyTorch, Scikit-Learn, etc.).Habilidade para resolver problemas complexos de maneira criativa e inovadora.Conhecimento de processos de versionamento de código (Git, Github).Habilidade para traduzir dúvidas e necessidades dos times de negócios em requisitos para as análises.Olá, somos o PagBank!Talvez você nos conheça por maquininhas ou comerciais que ficam na memória, mas somos muito mais!Todos os dias desenvolvemos produtos e soluções inspiradas pelo nosso propósito: facilitar a vida financeira das pessoas e negócios.Trabalhamos para transformar a forma como as pessoas lidam com dinheiro abrindo novas possibilidades para alcançarem seus sonhos.Como fazemos tudo isso?💛Com genteSomos um time que joga junto! Aqui valorizamos todas as diversidades, seja de raça/etnia, gênero, idade, origem, pessoa com deficiência, orientação afetivo-sexual, constituição familiar e estética.💛Com tecnologiaO espírito disruptivo e inovador está no nosso DNA: somos parte do Grupo UOL, empresa 100% brasileira, foi pioneira na internet e transforma a vida das pessoas desde 1996.💛Com uma só culturaTemos uma cultura forte e única, capaz de nos levar além, para continuarmos crescendo e perpetuando o nosso negócio.Somos um dos maiores bancos digitais do país e uma das fintechs mais rentáveis do segmento e certificados como um Excelente Lugar para Trabalhar pela Great Place to Work.Para vivenciar tudo isso, você terá um pacote completo de benefícios que fazem toda a diferença:Vale-alimentação e/ou refeição.Plano de saúde e odontológico.Seguro de vida.Parceria com TotalPass e ZenKlub.Licença maternidade e paternidade estendidas.Auxílio-creche.Descontos de até 50% em pós-graduação e MBA de grandes instituições, como FIA, FAAP e PUCRS.E tem mais:No dress code: o importante é você usar o que te faz bem.#TáDeParabéns: Day off no aniversário.Baby Gift: presente para recém-nascidos.Tá a fim de uma carreira que rende mais?Vem pro nosso time imbatível!#VemProPags.Show moreShow less",,On-site/Hybrid,https://www.linkedin.com/jobs-guest/jobs/api/jobPosting/4416323402,2026-06-03,"Cientista de Dados Jr. Descrição da vagaQuando você pensa em carreira, o que vem à sua mente? Propósito? Colaboração? Ser protagonista para fazer a diferença? No PagBank temos tudo isso e muito mais. 💛Estamos em busca de pessoas que vistam a camisa com orgulho. Gente com vontade de facilitar a vida financeira das pessoas e impulsionar negócios!Tá a fim de uma carreira que rende mais?Confira essa oportunidade e #VemProPags!Responsabilidades e atribuiçõesDesenvolver modelos para otimização de processos de banking ou adquirência.Analisar grandes volumes de dados transacionais para identificar padrões, tendências e oportunidades de melhoria nos processos.Implementar algoritmos de segmentação de clientes e predição de comportamento para aumentar a eficiência e a personalização dos serviços oferecidos.Trabalhar em estreita colaboração com equipes de engenharia, produto e negócios para definir e implementar soluções de dados que atendam às necessidades do cliente e da empresa.Fornecer insights complexos de maneira clara e eficaz para stakeholders não técnicos, ajudando na tomada de decisões estratégicas.Requisitos e qualificaçõesSuperior completo ou em andamento em Ciências da Computação, Engenharia, Matemática, Estatística ou áreas relacionadas.Experiência com análise de grandes volumes de dados para a geração de insights para times de negócio.Experiência com ferramentas de análise de dados e programação como SQL, Python, R ou bibliotecas de machine learning (TensorFlow, PyTorch, Scikit-Learn, etc.).Habilidade para resolver problemas complexos de maneira criativa e inovadora.Conhecimento de processos de versionamento de código (Git, Github).Habilidade para traduzir dúvidas e necessidades dos times de negócios em requisitos para as análises.Olá, somos o PagBank!Talvez você nos conheça por maquininhas ou comerciais que ficam na memória, mas somos muito mais!Todos os dias desenvolvemos produtos e soluções inspiradas pelo nosso propósito: facilitar a vida financeira das pessoas e negócios.Trabalhamos para transformar a forma como as pessoas lidam com dinheiro abrindo novas possibilidades para alcançarem seus sonhos.Como fazemos tudo isso?💛Com genteSomos um time que joga junto! Aqui valorizamos todas as diversidades, seja de raça/etnia, gênero, idade, origem, pessoa com deficiência, orientação afetivo-sexual, constituição familiar e estética.💛Com tecnologiaO espírito disruptivo e inovador está no nosso DNA: somos parte do Grupo UOL, empresa 100% brasileira, foi pioneira na internet e transforma a vida das pessoas desde 1996.💛Com uma só culturaTemos uma cultura forte e única, capaz de nos levar além, para continuarmos crescendo e perpetuando o nosso negócio.Somos um dos maiores bancos digitais do país e uma das fintechs mais rentáveis do segmento e certificados como um Excelente Lugar para Trabalhar pela Great Place to Work.Para vivenciar tudo isso, você terá um pacote completo de benefícios que fazem toda a diferença:Vale-alimentação e/ou refeição.Plano de saúde e odontológico.Seguro de vida.Parceria com TotalPass e ZenKlub.Licença maternidade e paternidade estendidas.Auxílio-creche.Descontos de até 50% em pós-graduação e MBA de grandes instituições, como FIA, FAAP e PUCRS.E tem mais:No dress code: o importante é você usar o que te faz bem.#TáDeParabéns: Day off no aniversário.Baby Gift: presente para recém-nascidos.Tá a fim de uma carreira que rende mais?Vem pro nosso time imbatível!#VemProPags.Show moreShow less",Não especificado,Não especificado,Não especificado,3
Banco de Talentos - Pessoa Desenvolvedora SR (C#) - Afirmativa para Pessoas Pretas e Pardas,F1RST Digital Services,"São Paulo, São Paulo, Brazil",2 weeks ago,"A Toro Corretora agora éSantander Investimentos, e o seu DNA de agilidade, tecnologia e Corretagem Zero se une à solidez e credibilidade global do Santander.Nosso propósito é gerar liberdade financeira para as pessoas.Santander Investimentoscomo a casa completa de investimentos, oferecendo solidez e infraestrutura para operar e a marca Toro como plataforma de trading do Santander Brasil, dedicada a quem respira o mercado.Buscamos inovação contínua para ajudar clientes a encontrar as melhores oportunidades de um jeito fácil e seguro. Para isso, combinamos pessoas e tecnologia, valorizando e preservando o espírito colaborativo, diverso e inovador de nosso time.Temos uma vaga para você se tornarIT Analyst III (C# / Angular).Aqui, seu papel será:Buscar por novas técnicas e tecnologias que multipliquem nossa eficiência através de ferramentas e bibliotecas;Escalar microsserviços (alta disponibilidade, alta capacidade, baixa latência);Comunicação microsserviços (incluindo ambientes nuvem c/ on-premise);Atuar com desenvolvimento e manutenção de frontends quando necessário (juntamente com outros desenvolvedores especializados em frontend);Integração contínua, devops e deployment contínuo;Monitoramento de serviços com CloudWatch, Kibana e Grafana.ImplementarRequisitos Imprescindíveis:Sólida experiência em projetar, construir, gerenciar e escalar soluções escaláveis de microsserviços;Nossos serviços backend e apis são em sua maioria escritas em C# (.Net Framework e .Net Core) e TypeScript (NodeJS);Facilidade e disposição para assimilar uma a outra stack caso não tenha experiência prévia;Construção e manutenção de soluções frontend usando algum framework JavaScript/TypeScript;Experiência com Angular;Experiência com Cultura Agile (Scrum, Kanban, Pair programming, TDD);Experiência com DevOps;Conhecimento em automatização de pipelines de builds, testes e deployments (AzureDevOps ou TFS).Requisitos Desejáveis:Experiência com arquitetura em nuvem (preferencialmente, AWS);Experiência com arquitetura Serverless;Experiência com containers;Conhecimentos de Clean Architecture e Domain Driven Design;Ter influência no ecossistema de IA para desenvolvimento;Kafka e/ou Redis.Local de Trabalho:Radar - Rua Amador Bueno, 474 - Santo Amaro - SPBenefícios:➡️ Auxílio refeição;➡️ Convênio médico;➡️ Convênio Odontológico: Plano básico e intermediário;➡️ Vale Transporte;➡️ Flex Férias: 24 dias úteis de férias podendo ser divididos em até 6 vezes, e a cada 2 meses trabalhados você já pode aproveitar 4 dias úteis;➡️ DayOff Aniversário;➡️ Parceiros de academia: Wellhub, Totalpass;➡️ Flex Working: Modelo de trabalho híbrido: 2 dias Home Office e 3 dias presenciais;➡️ Plataformas de treinamento com mais de 100 mil cursos;➡️ Linhas de carreira para o seu desenvolvimento profissional;➡️ Flex Learning: Incentivo para estudos exclusivo a funcionários com Alta Performance;➡️ Auxílio Creche;➡️ Programa Nascer;➡️ Licença Maternidade e Paternidade estendida;➡️ Seguro de Vida;➡️ Be Healthy - Programa que incentiva todos a terem hábitos mais saudáveis;➡️ PAPE - Programa de apoio pessoal especializado.Show moreShow less",,On-site/Hybrid,https://www.linkedin.com/jobs-guest/jobs/api/jobPosting/4413337679,2026-06-03,"Banco de Talentos - Pessoa Desenvolvedora SR (C#) - Afirmativa para Pessoas Pretas e Pardas A Toro Corretora agora éSantander Investimentos, e o seu DNA de agilidade, tecnologia e Corretagem Zero se une à solidez e credibilidade global do Santander.Nosso propósito é gerar liberdade financeira para as pessoas.Santander Investimentoscomo a casa completa de investimentos, oferecendo solidez e infraestrutura para operar e a marca Toro como plataforma de trading do Santander Brasil, dedicada a quem respira o mercado.Buscamos inovação contínua para ajudar clientes a encontrar as melhores oportunidades de um jeito fácil e seguro. Para isso, combinamos pessoas e tecnologia, valorizando e preservando o espírito colaborativo, diverso e inovador de nosso time.Temos uma vaga para você se tornarIT Analyst III (C# / Angular).Aqui, seu papel será:Buscar por novas técnicas e tecnologias que multipliquem nossa eficiência através de ferramentas e bibliotecas;Escalar microsserviços (alta disponibilidade, alta capacidade, baixa latência);Comunicação microsserviços (incluindo ambientes nuvem c/ on-premise);Atuar com desenvolvimento e manutenção de frontends quando necessário (juntamente com outros desenvolvedores especializados em frontend);Integração contínua, devops e deployment contínuo;Monitoramento de serviços com CloudWatch, Kibana e Grafana.ImplementarRequisitos Imprescindíveis:Sólida experiência em projetar, construir, gerenciar e escalar soluções escaláveis de microsserviços;Nossos serviços backend e apis são em sua maioria escritas em C# (.Net Framework e .Net Core) e TypeScript (NodeJS);Facilidade e disposição para assimilar uma a outra stack caso não tenha experiência prévia;Construção e manutenção de soluções frontend usando algum framework JavaScript/TypeScript;Experiência com Angular;Experiência com Cultura Agile (Scrum, Kanban, Pair programming, TDD);Experiência com DevOps;Conhecimento em automatização de pipelines de builds, testes e deployments (AzureDevOps ou TFS).Requisitos Desejáveis:Experiência com arquitetura em nuvem (preferencialmente, AWS);Experiência com arquitetura Serverless;Experiência com containers;Conhecimentos de Clean Architecture e Domain Driven Design;Ter influência no ecossistema de IA para desenvolvimento;Kafka e/ou Redis.Local de Trabalho:Radar - Rua Amador Bueno, 474 - Santo Amaro - SPBenefícios:➡️ Auxílio refeição;➡️ Convênio médico;➡️ Convênio Odontológico: Plano básico e intermediário;➡️ Vale Transporte;➡️ Flex Férias: 24 dias úteis de férias podendo ser divididos em até 6 vezes, e a cada 2 meses trabalhados você já pode aproveitar 4 dias úteis;➡️ DayOff Aniversário;➡️ Parceiros de academia: Wellhub, Totalpass;➡️ Flex Working: Modelo de trabalho híbrido: 2 dias Home Office e 3 dias presenciais;➡️ Plataformas de treinamento com mais de 100 mil cursos;➡️ Linhas de carreira para o seu desenvolvimento profissional;➡️ Flex Learning: Incentivo para estudos exclusivo a funcionários com Alta Performance;➡️ Auxílio Creche;➡️ Programa Nascer;➡️ Licença Maternidade e Paternidade estendida;➡️ Seguro de Vida;➡️ Be Healthy - Programa que incentiva todos a terem hábitos mais saudáveis;➡️ PAPE - Programa de apoio pessoal especializado.Show moreShow less",Não especificado,Não especificado,Microsoft Azure,0
Data Scientist Specialist,Banco Bradesco,"Osasco, São Paulo, Brazil",1 week ago,"Sobre o BradescoO Bradesco é um dos maiores grupos financeiros do Brasil, com uma história marcada pelo pioneirismo e inovação. Por meio da nossa carteira amplamente diversificada de produtos financeiros, serviços bancários e de seguros contribuímos com a realização das pessoas e o crescimento sustentável de empresas e sociedade. Venha fazer parte do nosso ecossistema financeiro e impactar a experiência de milhões de pessoas!No Bradesco valorizamos a diversidade em todas as suas formas. Por isso, as nossas vagas são abertas a todas as pessoas, independentemente de gênero, raça, orientação sexual, deficiência, idade ou qualquer outra característica.Saiba mais em https://banco.bradesco/html/classic/sobre/index.shtmResponsabilidades e atribuiçõesO que é o nosso time de Crédito?Temos como missão garantir uma gestão eficiente na concessão e manutenção de crédito, que assegure rentabilidade e o crescimento com solidez dos ativos da Organização.Modelo de trabalho : Híbrido - 2x PresencialUnidade: São Paulo - OsascoComo será seu dia a dia?Sendo Data Scientist Specialist, atuará na gerência Crédito e suas principais atividades serão:Modelagem específica para provisionamento (resolução 4966, PD/EAD/LGD);Identificação de oportunidade nas aplicações dos modelos;Identificação de melhorias em modelos existentes;Análise de dados;Melhoria de processo.Requisitos e QualificaçõesO que você precisa ter ou saber?É necessário conhecimentos em provisionamento/Resolução 4966 e mercado financeiroSerá um diferencial se você tiver:Conhecimentos em Python / Databricks e estatística.O que nós oferecemosNo Bradesco valorizamos a saúde e bem-estar, oferecendo um extenso portfólio de benefícios a todas nossas pessoas funcionárias:PLR ou Bônus: Conforme a elegibilidade de cargo*Convênio MédicoConvênio OdontológicoSeguro de VidaVale AlimentaçãoVale Refeição13º Cesta AlimentaçãoTotal PassVale Transporte (adesão opcional)Descontos em produtos e serviços em empresas parceirasPrevidência Privada (adesão opcional, com participação financeira da Organização Bradesco)Viva Bem Bradesco: programa de saúde, bem-estar e qualidade de vidaUnibrad: Universidade Corporativa BradescoIsenção de Tarifas: condições especiais em diversos produtos e serviçosAuxílio Creche ou BabáLicença Paternidade estendida de 20 diasLicença Maternidade de 180 dias, acompanhamento assistencial da gestação até o pós-partoShow moreShow less",,On-site/Hybrid,https://www.linkedin.com/jobs-guest/jobs/api/jobPosting/4418031756,2026-06-03,"Data Scientist Specialist Sobre o BradescoO Bradesco é um dos maiores grupos financeiros do Brasil, com uma história marcada pelo pioneirismo e inovação. Por meio da nossa carteira amplamente diversificada de produtos financeiros, serviços bancários e de seguros contribuímos com a realização das pessoas e o crescimento sustentável de empresas e sociedade. Venha fazer parte do nosso ecossistema financeiro e impactar a experiência de milhões de pessoas!No Bradesco valorizamos a diversidade em todas as suas formas. Por isso, as nossas vagas são abertas a todas as pessoas, independentemente de gênero, raça, orientação sexual, deficiência, idade ou qualquer outra característica.Saiba mais em https://banco.bradesco/html/classic/sobre/index.shtmResponsabilidades e atribuiçõesO que é o nosso time de Crédito?Temos como missão garantir uma gestão eficiente na concessão e manutenção de crédito, que assegure rentabilidade e o crescimento com solidez dos ativos da Organização.Modelo de trabalho : Híbrido - 2x PresencialUnidade: São Paulo - OsascoComo será seu dia a dia?Sendo Data Scientist Specialist, atuará na gerência Crédito e suas principais atividades serão:Modelagem específica para provisionamento (resolução 4966, PD/EAD/LGD);Identificação de oportunidade nas aplicações dos modelos;Identificação de melhorias em modelos existentes;Análise de dados;Melhoria de processo.Requisitos e QualificaçõesO que você precisa ter ou saber?É necessário conhecimentos em provisionamento/Resolução 4966 e mercado financeiroSerá um diferencial se você tiver:Conhecimentos em Python / Databricks e estatística.O que nós oferecemosNo Bradesco valorizamos a saúde e bem-estar, oferecendo um extenso portfólio de benefícios a todas nossas pessoas funcionárias:PLR ou Bônus: Conforme a elegibilidade de cargo*Convênio MédicoConvênio OdontológicoSeguro de VidaVale AlimentaçãoVale Refeição13º Cesta AlimentaçãoTotal PassVale Transporte (adesão opcional)Descontos em produtos e serviços em empresas parceirasPrevidência Privada (adesão opcional, com participação financeira da Organização Bradesco)Viva Bem Bradesco: programa de saúde, bem-estar e qualidade de vidaUnibrad: Universidade Corporativa BradescoIsenção de Tarifas: condições especiais em diversos produtos e serviçosAuxílio Creche ou BabáLicença Paternidade estendida de 20 diasLicença Maternidade de 180 dias, acompanhamento assistencial da gestação até o pós-partoShow moreShow less",Não especificado,Não especificado,Não especificado,2
