title,company,location,posted,description,applicants,work_mode,link,data_coleta,titulo_descr,senioridade,idioma,certificado,cluster
Data Scientist II,Banco Bradesco,"Osasco, São Paulo, Brazil",1 week ago,"Sobre o BradescoO Bradesco é um dos maiores grupos financeiros do Brasil, com uma história marcada pelo pioneirismo e inovação. Por meio da nossa carteira amplamente diversificada de produtos financeiros, serviços bancários e de seguros contribuímos com a realização das pessoas e o crescimento sustentável de empresas e sociedade. Venha fazer parte do nosso ecossistema financeiro e impactar a experiência de milhões de pessoas!No Bradesco valorizamos a diversidade em todas as suas formas. Por isso, as nossas vagas são abertas a todas as pessoas, independentemente de gênero, raça, orientação sexual, deficiência, idade ou qualquer outra característica.Saiba mais em https://banco.bradesco/html/classic/sobre/index.shtmResponsabilidades e atribuiçõesO que é o nosso time de CRM?Temos como objetivo centralizar e liderar o relacionamento com o cliente na Organização Bradesco, no que toca a prática de abordagens ativas através da execução de ações comerciais para oferta de produtos e de relacionamento com foco em fidelização e engajamento, buscando de forma corporativa garantir uma atuação centrada no cliente.Modelo de trabalho : Híbrido - 1x PresencialUnidade: Osasco/SPComo será seu dia a dia?Sendo Data Scientist II, atuará na gerência CRM - Modelagem e suas principais atividades serão:Desenvolver modelos de machine learning ou estatísticos (ex.: propensão, classificação, regressão, segmentação ou recomendação), abrangendo todas as etapas essenciais: tratamento de dados, seleção de variáveis, validação, definição de métricas de performance e documentação mínima para sustentação;Conduzir análises exploratórias de dados (EDA) estruturadas para responder a perguntas de negócio, identificar padrões, alavancas e riscos, traduzindo resultados técnicos em insights claros, hipóteses testáveis e recomendações práticas para stakeholders;Criar ou manter pipelines de preparação de dados e engenharia de features (ex.: Spark/Databricks ou SQL), com código versionado, organizado, eficiente e aderente às boas práticas, apoiando a escalabilidade dos modelos e análises;Elaborar documentação técnica de modelos (objetivo, premissas, variáveis, métricas, limitações e riscos), contribuindo para processos de governança, recertificação, auditoria e transferência de conhecimento dentro do time;Atuar de forma ativa em code reviews, discussões técnicas e refinamentos junto a cientistas de dados juniores e seniores, além de propor melhorias incrementais em modelos existentes (performance, estabilidade, monitoramento e aplicabilidade).Requisitos e QualificaçõesO que você precisa ter ou saber?Superior completo em Ciências de Dados, Ciências Contábeis, Matemática, Estatística, Economia, Engenharia ou Computação, Sistema de Informação, Análise e Desenvolvimento;Conhecimento em modelagem estatística;Conhecimentos de programação, analytics e DataViz;Experiência em modelos de recomendação de produtos - sistemas de recomendação e modelos de NBO / NBA;Experiência em modelos de classificação de textos - análises de sentimento;Vivência com Databricks / cloud.Será um diferencial se você tiver:Vivência em criação de modelos em nuvem.Show moreShow less",,On-site/Hybrid,https://www.linkedin.com/jobs-guest/jobs/api/jobPosting/4400239230,2026-04-17,"Data Scientist II Sobre o BradescoO Bradesco é um dos maiores grupos financeiros do Brasil, com uma história marcada pelo pioneirismo e inovação. Por meio da nossa carteira amplamente diversificada de produtos financeiros, serviços bancários e de seguros contribuímos com a realização das pessoas e o crescimento sustentável de empresas e sociedade. Venha fazer parte do nosso ecossistema financeiro e impactar a experiência de milhões de pessoas!No Bradesco valorizamos a diversidade em todas as suas formas. Por isso, as nossas vagas são abertas a todas as pessoas, independentemente de gênero, raça, orientação sexual, deficiência, idade ou qualquer outra característica.Saiba mais em https://banco.bradesco/html/classic/sobre/index.shtmResponsabilidades e atribuiçõesO que é o nosso time de CRM?Temos como objetivo centralizar e liderar o relacionamento com o cliente na Organização Bradesco, no que toca a prática de abordagens ativas através da execução de ações comerciais para oferta de produtos e de relacionamento com foco em fidelização e engajamento, buscando de forma corporativa garantir uma atuação centrada no cliente.Modelo de trabalho : Híbrido - 1x PresencialUnidade: Osasco/SPComo será seu dia a dia?Sendo Data Scientist II, atuará na gerência CRM - Modelagem e suas principais atividades serão:Desenvolver modelos de machine learning ou estatísticos (ex.: propensão, classificação, regressão, segmentação ou recomendação), abrangendo todas as etapas essenciais: tratamento de dados, seleção de variáveis, validação, definição de métricas de performance e documentação mínima para sustentação;Conduzir análises exploratórias de dados (EDA) estruturadas para responder a perguntas de negócio, identificar padrões, alavancas e riscos, traduzindo resultados técnicos em insights claros, hipóteses testáveis e recomendações práticas para stakeholders;Criar ou manter pipelines de preparação de dados e engenharia de features (ex.: Spark/Databricks ou SQL), com código versionado, organizado, eficiente e aderente às boas práticas, apoiando a escalabilidade dos modelos e análises;Elaborar documentação técnica de modelos (objetivo, premissas, variáveis, métricas, limitações e riscos), contribuindo para processos de governança, recertificação, auditoria e transferência de conhecimento dentro do time;Atuar de forma ativa em code reviews, discussões técnicas e refinamentos junto a cientistas de dados juniores e seniores, além de propor melhorias incrementais em modelos existentes (performance, estabilidade, monitoramento e aplicabilidade).Requisitos e QualificaçõesO que você precisa ter ou saber?Superior completo em Ciências de Dados, Ciências Contábeis, Matemática, Estatística, Economia, Engenharia ou Computação, Sistema de Informação, Análise e Desenvolvimento;Conhecimento em modelagem estatística;Conhecimentos de programação, analytics e DataViz;Experiência em modelos de recomendação de produtos - sistemas de recomendação e modelos de NBO / NBA;Experiência em modelos de classificação de textos - análises de sentimento;Vivência com Databricks / cloud.Será um diferencial se você tiver:Vivência em criação de modelos em nuvem.Show moreShow less",Sênior,Não especificado,Não especificado,2
Data Scientist II - Rentabilidade de Produtos de Crédito Agro,Banco Bradesco,"Osasco, São Paulo, Brazil",1 week ago,"Sobre o BradescoO Bradesco é um dos maiores grupos financeiros do Brasil, com uma história marcada pelo pioneirismo e inovação. Por meio da nossa carteira amplamente diversificada de produtos financeiros, serviços bancários e de seguros contribuímos com a realização das pessoas e o crescimento sustentável de empresas e sociedade. Venha fazer parte do nosso ecossistema financeiro e impactar a experiência de milhões de pessoas!No Bradesco valorizamos a diversidade em todas as suas formas. Por isso, as nossas vagas são abertas a todas as pessoas, independentemente de gênero, raça, orientação sexual, deficiência, idade ou qualquer outra característica.Saiba mais em https://banco.bradesco/html/classic/sobre/index.shtmResponsabilidades e atribuiçõesO que é o nosso time de Crédito?Temos como missão garantir uma gestão eficiente na concessão e manutenção de crédito, que assegure rentabilidade e o crescimento com solidez dos ativos da Organização.Modelo de trabalho : Híbrido - 3x PresencialUnidade: Osasco/SPComo será seu dia a dia?Sendo Data Scientist II, atuará na gerência Pricing Agro e suas principais atividades serão:Definir e implementar estratégias de precificação que maximizem a rentabilidade dos produtos de crédito Agro.Conduzir análises setoriais e de concorrência profundas, identificando ameaças, oportunidades e propondo ajustes estratégicos.Atuar em parceria com as equipes de Produto e Crédito para evolução de processos e melhorias contínuas.Monitorar o desempenho dos principais indicadores de rentabilidade, como: spread bruto, perda esperada rentabilidade ajustada ao risco e valor econômico adicionado.Suportar a evolução dos indicadores e das estratégias associadas.Ser um agente de promoção da cultura de decisão orientada à rentabilidade, influenciando times internos e parceiros do segmento.Requisitos e QualificaçõesO que você precisa ter ou saber?Ensino Superior completo em áreas de Engenharias, Matemática e Administração.Experiência prática em mensuração de risco de crédito ou precificação de produtos de crédito, com evidências de resultados atingidos.Excel avançado (imprescindível), SAS, Databricks e Python.O que nós oferecemosNo Bradesco valorizamos a saúde e bem-estar, oferecendo um extenso portfólio de benefícios a todas nossas pessoas funcionárias:PLR ou Bônus: Conforme a elegibilidade de cargo*Convênio MédicoConvênio OdontológicoSeguro de VidaVale AlimentaçãoVale Refeição13º Cesta AlimentaçãoTotal PassVale Transporte (adesão opcional)Descontos em produtos e serviços em empresas parceirasPrevidência Privada (adesão opcional, com participação financeira da Organização Bradesco)Viva Bem Bradesco: programa de saúde, bem-estar e qualidade de vidaUnibrad: Universidade Corporativa BradescoIsenção de Tarifas: condições especiais em diversos produtos e serviçosAuxílio Creche ou BabáLicença Paternidade estendida de 20 diasLicença Maternidade de 180 dias, acompanhamento assistencial da gestação até o pós-partoShow moreShow less",,On-site/Hybrid,https://www.linkedin.com/jobs-guest/jobs/api/jobPosting/4386976752,2026-04-17,"Data Scientist II - Rentabilidade de Produtos de Crédito Agro Sobre o BradescoO Bradesco é um dos maiores grupos financeiros do Brasil, com uma história marcada pelo pioneirismo e inovação. Por meio da nossa carteira amplamente diversificada de produtos financeiros, serviços bancários e de seguros contribuímos com a realização das pessoas e o crescimento sustentável de empresas e sociedade. Venha fazer parte do nosso ecossistema financeiro e impactar a experiência de milhões de pessoas!No Bradesco valorizamos a diversidade em todas as suas formas. Por isso, as nossas vagas são abertas a todas as pessoas, independentemente de gênero, raça, orientação sexual, deficiência, idade ou qualquer outra característica.Saiba mais em https://banco.bradesco/html/classic/sobre/index.shtmResponsabilidades e atribuiçõesO que é o nosso time de Crédito?Temos como missão garantir uma gestão eficiente na concessão e manutenção de crédito, que assegure rentabilidade e o crescimento com solidez dos ativos da Organização.Modelo de trabalho : Híbrido - 3x PresencialUnidade: Osasco/SPComo será seu dia a dia?Sendo Data Scientist II, atuará na gerência Pricing Agro e suas principais atividades serão:Definir e implementar estratégias de precificação que maximizem a rentabilidade dos produtos de crédito Agro.Conduzir análises setoriais e de concorrência profundas, identificando ameaças, oportunidades e propondo ajustes estratégicos.Atuar em parceria com as equipes de Produto e Crédito para evolução de processos e melhorias contínuas.Monitorar o desempenho dos principais indicadores de rentabilidade, como: spread bruto, perda esperada rentabilidade ajustada ao risco e valor econômico adicionado.Suportar a evolução dos indicadores e das estratégias associadas.Ser um agente de promoção da cultura de decisão orientada à rentabilidade, influenciando times internos e parceiros do segmento.Requisitos e QualificaçõesO que você precisa ter ou saber?Ensino Superior completo em áreas de Engenharias, Matemática e Administração.Experiência prática em mensuração de risco de crédito ou precificação de produtos de crédito, com evidências de resultados atingidos.Excel avançado (imprescindível), SAS, Databricks e Python.O que nós oferecemosNo Bradesco valorizamos a saúde e bem-estar, oferecendo um extenso portfólio de benefícios a todas nossas pessoas funcionárias:PLR ou Bônus: Conforme a elegibilidade de cargo*Convênio MédicoConvênio OdontológicoSeguro de VidaVale AlimentaçãoVale Refeição13º Cesta AlimentaçãoTotal PassVale Transporte (adesão opcional)Descontos em produtos e serviços em empresas parceirasPrevidência Privada (adesão opcional, com participação financeira da Organização Bradesco)Viva Bem Bradesco: programa de saúde, bem-estar e qualidade de vidaUnibrad: Universidade Corporativa BradescoIsenção de Tarifas: condições especiais em diversos produtos e serviçosAuxílio Creche ou BabáLicença Paternidade estendida de 20 diasLicença Maternidade de 180 dias, acompanhamento assistencial da gestação até o pós-partoShow moreShow less",Não especificado,Não especificado,Não especificado,2
Cientista de Dados Jr,Grupo Pernambucanas,"São Paulo, São Paulo, Brazil",1 week ago,"Estamos em busca de uma mente analítica e curiosa para integrar nosso time de Inteligência. Você será peça-chave na manutenção dos nossos modelos de elasticidade de preço e previsão de vendas, garantindo que os dados fluam com qualidade e que as áreas de negócio (Compras e Abastecimento) tomem as melhores decisões baseadas em números.Desafios e AtividadesMonitoramento de Modelos: Apoiar a execução rotineira e acompanhar a performance de modelos de elasticidade de preço e forecast de vendas.Análise de Diagnóstico: Mergulhar nos dados para entender o ""porquê"". Realizar análises exploratórias para identificar causas de variações atípicas (ex: por que o modelo divergiu do realizado em uma loja específica?).Higiene e Qualidade de Dados: Atuar no processo de ETL básico (limpeza, tratamento e validação), garantindo que nossos algoritmos operem sobre bases confiáveis.Documentação Técnica: Organizar e documentar processos e históricos técnicos (especialmente os herdados de consultorias), preservando o conhecimento da área.Interface com o Negócio: Atuar como ponte técnica para as áreas de Compras e Abastecimento, realizando extrações via SQL e traduzindo dados complexos em visualizações simples e intuitivas.RequisitosProgramação: Conhecimento intermediário em Python (domínio de bibliotecas pandas e numpy) e SQL (habilidade com Selects, Joins e Agregações).Estatística: Solidez em estatística descritiva (média, mediana, desvio padrão, correlação) e compreensão de distribuições de probabilidade.Visualização de Dados: Experiência (mesmo que acadêmica ou em estágios) com Power BI ou Tableau.Machine Learning: Entendimento teórico de algoritmos de Regressão (Linear/Logística) e Árvores de Decisão.DiferenciaisPerfil investigativo e atenção aos detalhes.Boa capacidade de comunicação para explicar termos técnicos para áreas não-técnicas.Vontade de aprender e documentar processos.Benefícios🩺 Assistência Médica Bradesco Saúde (cooparticipação)🦷 Assistência Odontológica Odontoseg (por adesão)🏥 Parceria com Consultório Odontológico🍽️ Vale Refeição ou Vale Alimentação🛡️ Seguro de Vida💰 PPR (Participação nos Lucros e Resultados)🚌 Vale Transporte🚴 Bicicletário com vestiário🛍️ Desconto de 10% nos produtos Pernambucanas💪🏽 TotalPass🤰 Programa Mãe Pernambucanas com acompanhamento gestacional🎓 Parcerias com SESC e instituições de ensino para cursos de graduação e pós-graduaçãoShow moreShow less",,On-site/Hybrid,https://www.linkedin.com/jobs-guest/jobs/api/jobPosting/4394729689,2026-04-17,"Cientista de Dados Jr Estamos em busca de uma mente analítica e curiosa para integrar nosso time de Inteligência. Você será peça-chave na manutenção dos nossos modelos de elasticidade de preço e previsão de vendas, garantindo que os dados fluam com qualidade e que as áreas de negócio (Compras e Abastecimento) tomem as melhores decisões baseadas em números.Desafios e AtividadesMonitoramento de Modelos: Apoiar a execução rotineira e acompanhar a performance de modelos de elasticidade de preço e forecast de vendas.Análise de Diagnóstico: Mergulhar nos dados para entender o ""porquê"". Realizar análises exploratórias para identificar causas de variações atípicas (ex: por que o modelo divergiu do realizado em uma loja específica?).Higiene e Qualidade de Dados: Atuar no processo de ETL básico (limpeza, tratamento e validação), garantindo que nossos algoritmos operem sobre bases confiáveis.Documentação Técnica: Organizar e documentar processos e históricos técnicos (especialmente os herdados de consultorias), preservando o conhecimento da área.Interface com o Negócio: Atuar como ponte técnica para as áreas de Compras e Abastecimento, realizando extrações via SQL e traduzindo dados complexos em visualizações simples e intuitivas.RequisitosProgramação: Conhecimento intermediário em Python (domínio de bibliotecas pandas e numpy) e SQL (habilidade com Selects, Joins e Agregações).Estatística: Solidez em estatística descritiva (média, mediana, desvio padrão, correlação) e compreensão de distribuições de probabilidade.Visualização de Dados: Experiência (mesmo que acadêmica ou em estágios) com Power BI ou Tableau.Machine Learning: Entendimento teórico de algoritmos de Regressão (Linear/Logística) e Árvores de Decisão.DiferenciaisPerfil investigativo e atenção aos detalhes.Boa capacidade de comunicação para explicar termos técnicos para áreas não-técnicas.Vontade de aprender e documentar processos.Benefícios🩺 Assistência Médica Bradesco Saúde (cooparticipação)🦷 Assistência Odontológica Odontoseg (por adesão)🏥 Parceria com Consultório Odontológico🍽️ Vale Refeição ou Vale Alimentação🛡️ Seguro de Vida💰 PPR (Participação nos Lucros e Resultados)🚌 Vale Transporte🚴 Bicicletário com vestiário🛍️ Desconto de 10% nos produtos Pernambucanas💪🏽 TotalPass🤰 Programa Mãe Pernambucanas com acompanhamento gestacional🎓 Parcerias com SESC e instituições de ensino para cursos de graduação e pós-graduaçãoShow moreShow less",Não especificado,Não especificado,Não especificado,3
Data Science Manager,Banco Bradesco,"Osasco, São Paulo, Brazil",3 days ago,"Sobre o BradescoO Bradesco é um dos maiores grupos financeiros do Brasil, com uma história marcada pelo pioneirismo e inovação. Por meio da nossa carteira amplamente diversificada de produtos financeiros, serviços bancários e de seguros contribuímos com a realização das pessoas e o crescimento sustentável de empresas e sociedade. Venha fazer parte do nosso ecossistema financeiro e impactar a experiência de milhões de pessoas!No Bradesco valorizamos a diversidade em todas as suas formas. Por isso, as nossas vagas são abertas a todas as pessoas, independentemente de gênero, raça, orientação sexual, deficiência, idade ou qualquer outra característica.Saiba mais em https://banco.bradesco/html/classic/sobre/index.shtmResponsabilidades e atribuiçõesO que é o nosso time de CRM?Temos como objetivo centralizar e liderar o relacionamento com o cliente na Organização Bradesco, no que toca a prática de abordagens ativas através da execução de ações comerciais para oferta de produtos e de relacionamento com foco em fidelização e engajamento, buscando de forma corporativa garantir uma atuação centrada no cliente.Modelo de trabalho : Híbrido - 2x PresencialUnidade: São Paulo / OsascoComo será seu dia a dia?Sendo Data Science Manager, atuará na gerência CRM - Gestão de Projetos e suas principais atividades serão:Estruturação de base de dados de conhecimento para IA;Articulação com segmentos para entendimento de questões de negócio;Governança e qualidade de observação dos dados;Articulação com times técnicos. Gestão de projetos.Requisitos e QualificaçõesO que você precisa ter ou saber?Databricks;Tableau;Plataformas de nuvem (AWS, Azure, GCP);Python;SQL.Será um diferencial se você tiver:TI/Dados e Mercado Financeiro.O que nós oferecemosNo Bradesco valorizamos a saúde e bem-estar, oferecendo um extenso portfólio de benefícios a todas nossas pessoas funcionárias:PLR ou Bônus: Conforme a elegibilidade de cargo*Convênio MédicoConvênio OdontológicoSeguro de VidaVale AlimentaçãoVale Refeição13º Cesta AlimentaçãoTotal PassVale Transporte (adesão opcional)Descontos em produtos e serviços em empresas parceirasPrevidência Privada (adesão opcional, com participação financeira da Organização Bradesco)Viva Bem Bradesco: programa de saúde, bem-estar e qualidade de vidaUnibrad: Universidade Corporativa BradescoIsenção de Tarifas: condições especiais em diversos produtos e serviçosAuxílio Creche ou BabáLicença Paternidade estendida de 20 diasLicença Maternidade de 180 dias, acompanhamento assistencial da gestação até o pós-partoShow moreShow less",,On-site/Hybrid,https://www.linkedin.com/jobs-guest/jobs/api/jobPosting/4386974906,2026-04-17,"Data Science Manager Sobre o BradescoO Bradesco é um dos maiores grupos financeiros do Brasil, com uma história marcada pelo pioneirismo e inovação. Por meio da nossa carteira amplamente diversificada de produtos financeiros, serviços bancários e de seguros contribuímos com a realização das pessoas e o crescimento sustentável de empresas e sociedade. Venha fazer parte do nosso ecossistema financeiro e impactar a experiência de milhões de pessoas!No Bradesco valorizamos a diversidade em todas as suas formas. Por isso, as nossas vagas são abertas a todas as pessoas, independentemente de gênero, raça, orientação sexual, deficiência, idade ou qualquer outra característica.Saiba mais em https://banco.bradesco/html/classic/sobre/index.shtmResponsabilidades e atribuiçõesO que é o nosso time de CRM?Temos como objetivo centralizar e liderar o relacionamento com o cliente na Organização Bradesco, no que toca a prática de abordagens ativas através da execução de ações comerciais para oferta de produtos e de relacionamento com foco em fidelização e engajamento, buscando de forma corporativa garantir uma atuação centrada no cliente.Modelo de trabalho : Híbrido - 2x PresencialUnidade: São Paulo / OsascoComo será seu dia a dia?Sendo Data Science Manager, atuará na gerência CRM - Gestão de Projetos e suas principais atividades serão:Estruturação de base de dados de conhecimento para IA;Articulação com segmentos para entendimento de questões de negócio;Governança e qualidade de observação dos dados;Articulação com times técnicos. Gestão de projetos.Requisitos e QualificaçõesO que você precisa ter ou saber?Databricks;Tableau;Plataformas de nuvem (AWS, Azure, GCP);Python;SQL.Será um diferencial se você tiver:TI/Dados e Mercado Financeiro.O que nós oferecemosNo Bradesco valorizamos a saúde e bem-estar, oferecendo um extenso portfólio de benefícios a todas nossas pessoas funcionárias:PLR ou Bônus: Conforme a elegibilidade de cargo*Convênio MédicoConvênio OdontológicoSeguro de VidaVale AlimentaçãoVale Refeição13º Cesta AlimentaçãoTotal PassVale Transporte (adesão opcional)Descontos em produtos e serviços em empresas parceirasPrevidência Privada (adesão opcional, com participação financeira da Organização Bradesco)Viva Bem Bradesco: programa de saúde, bem-estar e qualidade de vidaUnibrad: Universidade Corporativa BradescoIsenção de Tarifas: condições especiais em diversos produtos e serviçosAuxílio Creche ou BabáLicença Paternidade estendida de 20 diasLicença Maternidade de 180 dias, acompanhamento assistencial da gestação até o pós-partoShow moreShow less",Não especificado,Não especificado,Microsoft Azure,2
Data Scientist,IBM,Greater São Paulo Area,2 weeks ago,"Desenvolver e implementar modelos de IA Generativa para criação de agentes autônomos e outras aplicações inovadoras, integrando soluções em pipelines de dados e ambientes de nuvem. Colaborar na experimentação, validação e otimização contínua de modelos, alinhando resultados às necessidades estratégicas do negócio.Linguagens como Python, R, e SQL.Experiência com algoritmos de aprendizado de máquina e frameworks como TensorFlow, Scikit-Learn e PyTorch.Habilidade em criar visualizações de dados usando ferramentas como Tableau, Matplotlib e Seaborn.Boa experiencia com estas tecnologiasShow moreShow less",,On-site/Hybrid,https://www.linkedin.com/jobs-guest/jobs/api/jobPosting/4392113538,2026-04-17,"Data Scientist Desenvolver e implementar modelos de IA Generativa para criação de agentes autônomos e outras aplicações inovadoras, integrando soluções em pipelines de dados e ambientes de nuvem. Colaborar na experimentação, validação e otimização contínua de modelos, alinhando resultados às necessidades estratégicas do negócio.Linguagens como Python, R, e SQL.Experiência com algoritmos de aprendizado de máquina e frameworks como TensorFlow, Scikit-Learn e PyTorch.Habilidade em criar visualizações de dados usando ferramentas como Tableau, Matplotlib e Seaborn.Boa experiencia com estas tecnologiasShow moreShow less",Não especificado,Não especificado,Não especificado,3
