title,company,location,posted,description,applicants,work_mode,link,data_coleta,titulo_descr,senioridade,idioma,certificado,cluster
"Cientista de Dados (Brasil, Remoto)",Dell Technologies,"São Paulo, São Paulo, Brazil",1 week ago,"A área de Engenharia Centrada em IA é dinâmica e empolgante, fazendo parte do Escritório do CTO (OCTO) da Dell. Conduzimos pesquisas e engenharia voltadas para o futuro da Dell Technologies em um ambiente de alta visibilidade e colaboração intensa. Nossa equipe é especializada no desenvolvimento de soluções avançadas de IA que capacitam empresas a inovar, se comunicar e otimizar operações de maneiras nunca antes possíveis. Somos compostos por pessoas apaixonadas e dedicadas a ultrapassar os limites da tecnologia de IA.Junte-se a nós para realizar o melhor trabalho da sua carreira e causar um impacto social profundo comoCientista de Dadosem nossa equipe no Brasil (remoto).O que você conquistaráComoCientista de Dadosvocê será responsável por contribuir com a estratégia de negócios e influenciar a tomada de decisões com base em informações obtidas por meio de análises aprofundadas. Você produzirá recomendações acionáveis e envolventes ao interpretar insights de conjuntos de dados complexos. Também irá projetar processos para consolidar e examinar dados não estruturados, gerando insights relevantes. Além disso, colaborará com líderes de negócios, engenheiros e especialistas da indústria para construir modelos preditivos, algoritmos e motores de probabilidade.Você IráColaborar com equipes internas e externas para entender os requisitos dos clientes e desenvolver soluções personalizadas utilizando modelos de IA generativa;Desenvolver aplicações de IA utilizadas em diferentes áreas da Dell, com o objetivo de transformar e modernizar a empresa;Desenvolver e conduzir testes para avaliar a eficácia de algoritmos em diferentes casos analíticos;Manter-se atualizado com os avanços mais recentes em pesquisa de IA e aplicar técnicas de ponta para aprimorar o desempenho dos modelos;Realizar testes rigorosos, validação e avaliação de desempenho das soluções de IA.Dê o primeiro passo em direção à carreira dos seus sonhosCada Membro Da Equipe Da Dell Technologies Traz Algo Único Para a Mesa. Aqui Está o Que Estamos Procurando, Com Esta FunçãoRequisitos EssenciaisFormação acadêmica: Graduação completa em Ciência da Computação, Engenharia (Computação, Software, Elétrica, Controle e Automação), Estatística, Matemática, Física ou áreas correlatas. Pós-graduação stricto sensu (Mestrado ou Doutorado) em áreas relacionadas à Inteligência Artificial, Aprendizado de Máquina ou Ciência de Dados;Domínio avançado do inglês, necessário para interação constante com times internacionais;Sólidas habilidades de programação em Python;Compreensão dos conceitos de Aprendizado de Máquina (Machine Learning);Conhecimento e familiaridade com os conceitos fundamentais de design e análise de algoritmos, além de forte conhecimento em matemática e estatística.Requisitos DesejáveisCompreensão sólida de arquiteturas de Deep Learning, com experiência em ajuste fino e personalização de modelos pré-treinados para aplicações específicas. Proficiência em Python e nas bibliotecas/frameworks relevantes (ex.: TensorFlow, PyTorch);Experiência com modelos de linguagem de grande escala e familiaridade com técnicas e aplicações de processamento de linguagem natural (PLN).Quem somosAcreditamos que cada pessoa tem o poder de gerar impacto. É por isso que colocamos as pessoas da nossa equipe no centro de tudo o que fazemos. Se você está procurando uma oportunidade de desenvolver a sua carreira em um ambiente de trabalho inclusivo e diverso, com a tecnologia mais avançada do setor, estamos procurando por você.A Dell Technologies é uma família única de empresas que ajuda pessoas e organizações a transformar a forma como trabalham, vivem e se divertem. Junte-se a nós para construir um futuro que funcione para todas as pessoas, porque o progresso precisa de nós.A Dell Technologies está comprometida com o princípio de oportunidades iguais de emprego para todas as pessoas, e em fornecer às pessoas da equipe um ambiente de trabalho livre de discriminação e assédio. Leia a nossa Política de Oportunidades de Emprego aqui.Job ID:R283866Show moreShow less",,On-site/Hybrid,https://www.linkedin.com/jobs-guest/jobs/api/jobPosting/4344395115,2026-02-08,"Cientista de Dados (Brasil, Remoto) A área de Engenharia Centrada em IA é dinâmica e empolgante, fazendo parte do Escritório do CTO (OCTO) da Dell. Conduzimos pesquisas e engenharia voltadas para o futuro da Dell Technologies em um ambiente de alta visibilidade e colaboração intensa. Nossa equipe é especializada no desenvolvimento de soluções avançadas de IA que capacitam empresas a inovar, se comunicar e otimizar operações de maneiras nunca antes possíveis. Somos compostos por pessoas apaixonadas e dedicadas a ultrapassar os limites da tecnologia de IA.Junte-se a nós para realizar o melhor trabalho da sua carreira e causar um impacto social profundo comoCientista de Dadosem nossa equipe no Brasil (remoto).O que você conquistaráComoCientista de Dadosvocê será responsável por contribuir com a estratégia de negócios e influenciar a tomada de decisões com base em informações obtidas por meio de análises aprofundadas. Você produzirá recomendações acionáveis e envolventes ao interpretar insights de conjuntos de dados complexos. Também irá projetar processos para consolidar e examinar dados não estruturados, gerando insights relevantes. Além disso, colaborará com líderes de negócios, engenheiros e especialistas da indústria para construir modelos preditivos, algoritmos e motores de probabilidade.Você IráColaborar com equipes internas e externas para entender os requisitos dos clientes e desenvolver soluções personalizadas utilizando modelos de IA generativa;Desenvolver aplicações de IA utilizadas em diferentes áreas da Dell, com o objetivo de transformar e modernizar a empresa;Desenvolver e conduzir testes para avaliar a eficácia de algoritmos em diferentes casos analíticos;Manter-se atualizado com os avanços mais recentes em pesquisa de IA e aplicar técnicas de ponta para aprimorar o desempenho dos modelos;Realizar testes rigorosos, validação e avaliação de desempenho das soluções de IA.Dê o primeiro passo em direção à carreira dos seus sonhosCada Membro Da Equipe Da Dell Technologies Traz Algo Único Para a Mesa. Aqui Está o Que Estamos Procurando, Com Esta FunçãoRequisitos EssenciaisFormação acadêmica: Graduação completa em Ciência da Computação, Engenharia (Computação, Software, Elétrica, Controle e Automação), Estatística, Matemática, Física ou áreas correlatas. Pós-graduação stricto sensu (Mestrado ou Doutorado) em áreas relacionadas à Inteligência Artificial, Aprendizado de Máquina ou Ciência de Dados;Domínio avançado do inglês, necessário para interação constante com times internacionais;Sólidas habilidades de programação em Python;Compreensão dos conceitos de Aprendizado de Máquina (Machine Learning);Conhecimento e familiaridade com os conceitos fundamentais de design e análise de algoritmos, além de forte conhecimento em matemática e estatística.Requisitos DesejáveisCompreensão sólida de arquiteturas de Deep Learning, com experiência em ajuste fino e personalização de modelos pré-treinados para aplicações específicas. Proficiência em Python e nas bibliotecas/frameworks relevantes (ex.: TensorFlow, PyTorch);Experiência com modelos de linguagem de grande escala e familiaridade com técnicas e aplicações de processamento de linguagem natural (PLN).Quem somosAcreditamos que cada pessoa tem o poder de gerar impacto. É por isso que colocamos as pessoas da nossa equipe no centro de tudo o que fazemos. Se você está procurando uma oportunidade de desenvolver a sua carreira em um ambiente de trabalho inclusivo e diverso, com a tecnologia mais avançada do setor, estamos procurando por você.A Dell Technologies é uma família única de empresas que ajuda pessoas e organizações a transformar a forma como trabalham, vivem e se divertem. Junte-se a nós para construir um futuro que funcione para todas as pessoas, porque o progresso precisa de nós.A Dell Technologies está comprometida com o princípio de oportunidades iguais de emprego para todas as pessoas, e em fornecer às pessoas da equipe um ambiente de trabalho livre de discriminação e assédio. Leia a nossa Política de Oportunidades de Emprego aqui.Job ID:R283866Show moreShow less",Não especificado,Inglês,Não especificado,1
Criador de Agentes de IA,KPMG Brazil,"São Paulo, São Paulo, Brazil",1 month ago,"Inclusão e respeito à diversidade e equidade fazem parte do DNA da KPMG.Aqui valorizamos todas as pessoas, encorajando e empoderando os nossos profissionais para que se sintam parte das nossas conquistas.Independente da sua idade, gênero, raça, cor, credo, orientação, sexual, etnia, origem nacional ou deficiência, te convidamos a fazer a diferença. Venha fazer parte do time KPMG!️‍ ️‍⚧️ ♿ ✊✝️Inspire Confidence. Empower Change.Aqui na KPMG:Fazemos o que é certo #IntegrityAprendemos e nos aprimoramos #ExcellencePensamos e agimos de maneira arrojada #CourageRespeitamos uns aos outros e nos e nos fortalecemos com nossas diferenças #TogetherFazemos o que realmente importa #For BetterResponsabilidades e atribuições:Caso seja aprovado(a), você terá a oportunidade de:Desenvolver agentes inteligentes com Copilot Studio.Integrar soluções utilizando Power Apps e Power Automate.Estudar e acompanhar atualizações das ferramentas de IA.Colaborar em projetos voltados para automação e inovação.Trabalhar em equipe para entrega de soluções eficientes.Requisitos e qualificações:O que procuramos em você?Cursando graduação na área de Tecnologia da Informação ou correlatas.Dedicação em ferramentas de IA e desenvolvimento de agentes.Experiência: Projetos pessoais ou cursos voltados para IA (diferencial).Competências: Comunicação, trabalho em grupo, proatividade e busca contínua por conhecimento.Ferramentas e TecnologiasCopilot Studio Microsoft Power Platform (Power Apps, Power Automate)Certificações Microsoft (diferencial)Quais as vantagens de ser KPMG?Aqui atuamos com as mais novas tecnologias;Nossos profissionais são referência no mercado;Somos uma das maiores empresas de prestação de serviço do mundo;Quais benefícios oferecemos?Vale RefeiçãoVale AlimentaçãoAssistência MédicaAssistência OdontológicaVale TransporteBenefício Bem-estar (Academia)Convênio FarmáciaSeguro de VidaKPMG PrevAuxílio CrecheIncentivo a GraduaçãoIncentivo à IdiomasSubsídio de Órgão de ClasseBrinde CasamentoBrinde NascimentoLicença Maternidade estendidaJornada de Trabalho FlexívelMeu Tempo: até 6 dias inteiros por ano — ou 12 meios períodos — para você fazer uma pausa, cuidar de si e usar como quiser, quando precisar.PPLShow moreShow less",,On-site/Hybrid,https://www.linkedin.com/jobs-guest/jobs/api/jobPosting/4362154583,2026-02-08,"Criador de Agentes de IA Inclusão e respeito à diversidade e equidade fazem parte do DNA da KPMG.Aqui valorizamos todas as pessoas, encorajando e empoderando os nossos profissionais para que se sintam parte das nossas conquistas.Independente da sua idade, gênero, raça, cor, credo, orientação, sexual, etnia, origem nacional ou deficiência, te convidamos a fazer a diferença. Venha fazer parte do time KPMG!️‍ ️‍⚧️ ♿ ✊✝️Inspire Confidence. Empower Change.Aqui na KPMG:Fazemos o que é certo #IntegrityAprendemos e nos aprimoramos #ExcellencePensamos e agimos de maneira arrojada #CourageRespeitamos uns aos outros e nos e nos fortalecemos com nossas diferenças #TogetherFazemos o que realmente importa #For BetterResponsabilidades e atribuições:Caso seja aprovado(a), você terá a oportunidade de:Desenvolver agentes inteligentes com Copilot Studio.Integrar soluções utilizando Power Apps e Power Automate.Estudar e acompanhar atualizações das ferramentas de IA.Colaborar em projetos voltados para automação e inovação.Trabalhar em equipe para entrega de soluções eficientes.Requisitos e qualificações:O que procuramos em você?Cursando graduação na área de Tecnologia da Informação ou correlatas.Dedicação em ferramentas de IA e desenvolvimento de agentes.Experiência: Projetos pessoais ou cursos voltados para IA (diferencial).Competências: Comunicação, trabalho em grupo, proatividade e busca contínua por conhecimento.Ferramentas e TecnologiasCopilot Studio Microsoft Power Platform (Power Apps, Power Automate)Certificações Microsoft (diferencial)Quais as vantagens de ser KPMG?Aqui atuamos com as mais novas tecnologias;Nossos profissionais são referência no mercado;Somos uma das maiores empresas de prestação de serviço do mundo;Quais benefícios oferecemos?Vale RefeiçãoVale AlimentaçãoAssistência MédicaAssistência OdontológicaVale TransporteBenefício Bem-estar (Academia)Convênio FarmáciaSeguro de VidaKPMG PrevAuxílio CrecheIncentivo a GraduaçãoIncentivo à IdiomasSubsídio de Órgão de ClasseBrinde CasamentoBrinde NascimentoLicença Maternidade estendidaJornada de Trabalho FlexívelMeu Tempo: até 6 dias inteiros por ano — ou 12 meios períodos — para você fazer uma pausa, cuidar de si e usar como quiser, quando precisar.PPLShow moreShow less",Não especificado,Não especificado,Não especificado,1
Cientista de Dados,XP Inc.,"São Paulo, São Paulo, Brazil",1 hour ago,"Sobre nósA XP Inc. é uma das maiores instituições financeiras independente do Brasil, dona das marcas XP, Rico, Clear, XP Educação, InfoMoney, entre outras. Com mais de 4,6 milhões de clientes ativos e um valor superior a R$ 1,1 trilhão de ativos sob custódia, há 24 anos vem transformando o mercado financeiro para melhorar a vida das pessoas.Com uma cultura marcante guiada por quatro valores -Sonho Grande, Espírito Empreendedor, Foco no Cliente e Mente Aberta- a XP Inc. está sempre em busca dos melhores talentos que tem ambição de fazer o impossível.>> Sobre a vaga:Esta vaga é direcionada a profissionais detodos os níveis de experiência dentro da trilha de analistasque desejam atuar comocientistas de dadosna XP Inc., desde onível assistente até o sênior.Somos um lugar formado por pessoas que sonham grande, focamos em aprendizado constante em um ambiente com muita liberdade para que você possa criar e deixar a sua marca. Além disso, você trabalhará ao lado de pessoas diversas e talentosas que irão te ajudar a usar todo o seu potencial e gerar o maior impacto possível.Desafios Que Você Vai Encontrar Por AquiAmbiente dinâmico e aberto para novas ideias;Liberdade para trilhar uma carreira protagonista;Espaço para desenvolvimento e aprendizado constantes.O que buscamos e principais responsabilidadesComo cientista de dados, com apoio do centro de excelência de Data Science & Machine Learning, essa pessoa será responsável por construir produtos de dados para otimizar tomada de decisão na companhia, como modelos de classificação/regressão, otimização de heurísticas e análises estatísticas.Principais ResponsabilidadesRealizar estudos e análises com grande volume de dados para embasar decisões estratégicas;Desenvolver uma variedade de modelos de aprendizagem de máquina para resolver problemas específicos e otimizar processos;Participar e conduzir reuniões com stakeholders para alinhar expectativas e comunicar resultados;Trabalhar em conjunto com equipes de diferentes áreas (como engenharia, marketing e produto) para entender as necessidades do negócio e traduzir essas necessidades em soluções baseadas em dados.Realizar testes e validações rigorosas dos modelos e soluções implementadas, assegurando a qualidade e a confiabilidade dos resultados.Pré-requisitos Para CandidaturaTer a nossa culturaConhecimento prático em Python, com experiência na construção, treinamento e avaliação de modelos de machine learning.;Conhecimentos em estatística, probabilidade, técnicas de modelagem estatística, aprendizado de máquina, otimização e sistemas de recomendação;Capacidade de analisar problemas complexos e desenvolver soluções baseadas em dados, abordando questões de negócios com uma mentalidade analítica;Paixão por tecnologia e inovação, com interesse ativo em acompanhar tendências e as melhores práticas da área de ML;Habilidade de comunicação para interagir com diferentes áreas, stakeholders e cientistas de dados;Residir em São Paulo e possuir disponibilidade para atuar no modelo híbrido (3x na semana);DiferencialExperiência prática em DatabricksConhecimento e vivência na manipulação e análise de dados financeiros, com a capacidade de extrair insights relevantes para o setor;Conhecimento prático do framework Kedro, com experiência em sua aplicação para estruturar e gerenciar projetos de ciência de dados de forma eficiente;Experiência com modelos de otimização linearSe identificou com a XP Inc. e com a oportunidade?Inscreva-se e venha conquistar o impossível com a gente!Benefícios:Saúde e Bem-estarPlano de saúde sem coparticipação (inclusive, para dependentes)Plano odontológicoWellhub (Gympass)ZenklubSeguro de VidaiFood Benefícios (VA e VR flexível)Vale TransporteNew Value (clube de benefícios)Licença parental: maternidade de 6 meses e paternidade de 20 dias.Auxílio CrecheVida FinanceiraFundos de Investimentos ExclusivosAssessoria de InvestimentosCartão XP Visa Infinite sem anuidadeCrédito (consignado, home equity, CCB Imobiliário, etc.)Modelo de Trabalho Presencial FlexívelO nosso modelo de trabalho varia de acordo com a função, podendo ser totalmente presencial para frentes de negócio e mais flexível para outras equipes.Seguimos um modelo com mais frequência presencial, mas sempre guiado por flexibilidade e autonomia com a responsabilidade da nossa cultura empreendedora.Aqui na XP Inc., valorizamos as interações pessoais e acreditamos no uso do escritório como uma ferramenta para potencializar nossas relações no trabalho.Ao seguir com a inscrição, você declara que leu, compreendeu e concorda com a Política de Privacidade do Grupo XP Inc. e de seus fornecedores e parceiros que apoiam com a realização do processo seletivo. O Grupo XP Inc. poderá utilizar de soluções de inteligência artificial para apoiar a equipe de recrutamento no decorrer do processo, o que poderá envolver o tratamento de seus dados pessoais para tal finalidade, conforme princípios da Lei Geral de Proteção de Dados e da Política de Privacidade do Grupo XP Inc.Show moreShow less",,On-site/Hybrid,https://www.linkedin.com/jobs-guest/jobs/api/jobPosting/4198283063,2026-02-08,"Cientista de Dados Sobre nósA XP Inc. é uma das maiores instituições financeiras independente do Brasil, dona das marcas XP, Rico, Clear, XP Educação, InfoMoney, entre outras. Com mais de 4,6 milhões de clientes ativos e um valor superior a R$ 1,1 trilhão de ativos sob custódia, há 24 anos vem transformando o mercado financeiro para melhorar a vida das pessoas.Com uma cultura marcante guiada por quatro valores -Sonho Grande, Espírito Empreendedor, Foco no Cliente e Mente Aberta- a XP Inc. está sempre em busca dos melhores talentos que tem ambição de fazer o impossível.>> Sobre a vaga:Esta vaga é direcionada a profissionais detodos os níveis de experiência dentro da trilha de analistasque desejam atuar comocientistas de dadosna XP Inc., desde onível assistente até o sênior.Somos um lugar formado por pessoas que sonham grande, focamos em aprendizado constante em um ambiente com muita liberdade para que você possa criar e deixar a sua marca. Além disso, você trabalhará ao lado de pessoas diversas e talentosas que irão te ajudar a usar todo o seu potencial e gerar o maior impacto possível.Desafios Que Você Vai Encontrar Por AquiAmbiente dinâmico e aberto para novas ideias;Liberdade para trilhar uma carreira protagonista;Espaço para desenvolvimento e aprendizado constantes.O que buscamos e principais responsabilidadesComo cientista de dados, com apoio do centro de excelência de Data Science & Machine Learning, essa pessoa será responsável por construir produtos de dados para otimizar tomada de decisão na companhia, como modelos de classificação/regressão, otimização de heurísticas e análises estatísticas.Principais ResponsabilidadesRealizar estudos e análises com grande volume de dados para embasar decisões estratégicas;Desenvolver uma variedade de modelos de aprendizagem de máquina para resolver problemas específicos e otimizar processos;Participar e conduzir reuniões com stakeholders para alinhar expectativas e comunicar resultados;Trabalhar em conjunto com equipes de diferentes áreas (como engenharia, marketing e produto) para entender as necessidades do negócio e traduzir essas necessidades em soluções baseadas em dados.Realizar testes e validações rigorosas dos modelos e soluções implementadas, assegurando a qualidade e a confiabilidade dos resultados.Pré-requisitos Para CandidaturaTer a nossa culturaConhecimento prático em Python, com experiência na construção, treinamento e avaliação de modelos de machine learning.;Conhecimentos em estatística, probabilidade, técnicas de modelagem estatística, aprendizado de máquina, otimização e sistemas de recomendação;Capacidade de analisar problemas complexos e desenvolver soluções baseadas em dados, abordando questões de negócios com uma mentalidade analítica;Paixão por tecnologia e inovação, com interesse ativo em acompanhar tendências e as melhores práticas da área de ML;Habilidade de comunicação para interagir com diferentes áreas, stakeholders e cientistas de dados;Residir em São Paulo e possuir disponibilidade para atuar no modelo híbrido (3x na semana);DiferencialExperiência prática em DatabricksConhecimento e vivência na manipulação e análise de dados financeiros, com a capacidade de extrair insights relevantes para o setor;Conhecimento prático do framework Kedro, com experiência em sua aplicação para estruturar e gerenciar projetos de ciência de dados de forma eficiente;Experiência com modelos de otimização linearSe identificou com a XP Inc. e com a oportunidade?Inscreva-se e venha conquistar o impossível com a gente!Benefícios:Saúde e Bem-estarPlano de saúde sem coparticipação (inclusive, para dependentes)Plano odontológicoWellhub (Gympass)ZenklubSeguro de VidaiFood Benefícios (VA e VR flexível)Vale TransporteNew Value (clube de benefícios)Licença parental: maternidade de 6 meses e paternidade de 20 dias.Auxílio CrecheVida FinanceiraFundos de Investimentos ExclusivosAssessoria de InvestimentosCartão XP Visa Infinite sem anuidadeCrédito (consignado, home equity, CCB Imobiliário, etc.)Modelo de Trabalho Presencial FlexívelO nosso modelo de trabalho varia de acordo com a função, podendo ser totalmente presencial para frentes de negócio e mais flexível para outras equipes.Seguimos um modelo com mais frequência presencial, mas sempre guiado por flexibilidade e autonomia com a responsabilidade da nossa cultura empreendedora.Aqui na XP Inc., valorizamos as interações pessoais e acreditamos no uso do escritório como uma ferramenta para potencializar nossas relações no trabalho.Ao seguir com a inscrição, você declara que leu, compreendeu e concorda com a Política de Privacidade do Grupo XP Inc. e de seus fornecedores e parceiros que apoiam com a realização do processo seletivo. O Grupo XP Inc. poderá utilizar de soluções de inteligência artificial para apoiar a equipe de recrutamento no decorrer do processo, o que poderá envolver o tratamento de seus dados pessoais para tal finalidade, conforme princípios da Lei Geral de Proteção de Dados e da Política de Privacidade do Grupo XP Inc.Show moreShow less",Sênior,Não especificado,Não especificado,2
