title,company,location,posted,description,applicants,work_mode,link,data_coleta,titulo_descr,senioridade,idioma,certificado,cluster
Cientista de Dados Jr,Banco Bmg,"São Paulo, São Paulo, Brazil",4 days ago,"Há mais de 90 anos, o Banco Bmg atua com foco em democratizar o acesso a soluções financeiras, colocando sempre o cliente no centro de tudo o que fazemos. Somos referência em crédito consignado e estamos presentes em todo o Brasil, com agências, franquias, correspondentes bancários e um app completo que conecta milhões de pessoas a serviços financeiros de forma simples, acessível e inovadora.Crescer e gerar resultados sustentáveis que tragam valor para nossos clientes, acionistas, colaboradores e para a sociedade em geral é uma prioridade para nós. Nossos resultados evidenciam esse comprometimento.Guiados por princípios, construímos uma cultura organizacional que valoriza pessoas, impulsiona o protagonismo e transforma impacto social em legado. Atuamos com times que prezam pela autonomia, pelo comprometimento e pela excelência. Investimos continuamente em conhecimento e inovação para transformar a jornada dos colaboradores e clientes.Esse cuidado com as pessoas nos levou a conquistar, em 2025, o reconhecimento como top 3 melhores instituições financeiras para se trabalhar no Brasil, ocupando a 3ª posição no ranking Great Place To Work®. Um orgulho que reforça nosso compromisso de colocar o Jeito Bmg de Ser em prática todos os dias.Esses pilares impulsionam uma transformação contínua, promovendo revisões diárias de processos, da jornada do cliente, da tomada de decisão e da forma como os times se conectam para gerar valor. No Bmg, somos movidos por fazer diferente e melhor, com integridade, simplicidade e um jeito único de ser: o Jeito Bmg.Responsabilidades e atribuiçõesResponsabilidades e atribuições:Construir, treinar e otimizar modelos utilizando técnicas de aprendizado de máquina;Fazer gestão, acompanhamento e recalibragem dos modelos já implantados;Gerar insights, ad hoc's e estudos analíticos diversos;Construir segmentações baseadas em algoritmos de clusterização;Busca por novas fontes de dados, além das tradicionais disponíveis e estruturadas;Apresentar resultados de projetos de forma compreensível, sem perda de rigor científico;Auxiliar na expansão da cultura do uso da ciência de dados em outras frentes de negócio.Requisitos e qualificaçõesRequisitos e qualificações:Domínio em linguagem de programação Python e modelagem estatística;Habilidade com banco de dados (SQL, ORACLE, etc), visando a extração, limpeza, tratamento e organização dos dados;Entendimento de técnicas de Modelagem Estatística e Machine Learning;Vivência no desenvolvimento e acompanhamento de modelos preditivos e/ou prescritivos.Ter boa comunicação, proatividade, flexibilidade e foco em resultado também são essenciais para você fazer parte do time de Ciência de Dados.Formação superior completa preferencialmente em áreas de exatas.Disponibilidade para atuação híbrida em São Paulo.Informações adicionaisBenefícios, saúde e bem-estarPlano de saúde sem mensalidade e Telemedicina;Plano odontológico;Vale Refeição e Alimentação;Seguro de vida;Previdência privada;Remuneração variável anual (bônus) competitiva;PPR - Programa de Participação nos Resultados;Único Skill (Benefício Educação gratuito);Bicicletário e vestiário;Auxílio creche;Auxílio internet;Programas de qualidade de vida;Ambulatório;Programa da Gestante;Licença Maternidade e Paternidade estendidasPsicologia Viva - Sessões de terapia online gratuita;PAP - Programa de assessoria financeira, jurídica e psicológica;Gympass - Desconto em academias;Frutas todos os dias;Day Off de Aniversário;Dress Code Flexível;Modelo híbrido de trabalho.E aí? Quer vestir a camisa e brilhar em campo com um banco presente na vida de milhões de brasileiros e reconhecido como um dos melhores lugares para se trabalhar?#VamosPraCimaShow moreShow less",,On-site/Hybrid,https://www.linkedin.com/jobs-guest/jobs/api/jobPosting/4278850277,2025-09-23,"Cientista de Dados Jr Há mais de 90 anos, o Banco Bmg atua com foco em democratizar o acesso a soluções financeiras, colocando sempre o cliente no centro de tudo o que fazemos. Somos referência em crédito consignado e estamos presentes em todo o Brasil, com agências, franquias, correspondentes bancários e um app completo que conecta milhões de pessoas a serviços financeiros de forma simples, acessível e inovadora.Crescer e gerar resultados sustentáveis que tragam valor para nossos clientes, acionistas, colaboradores e para a sociedade em geral é uma prioridade para nós. Nossos resultados evidenciam esse comprometimento.Guiados por princípios, construímos uma cultura organizacional que valoriza pessoas, impulsiona o protagonismo e transforma impacto social em legado. Atuamos com times que prezam pela autonomia, pelo comprometimento e pela excelência. Investimos continuamente em conhecimento e inovação para transformar a jornada dos colaboradores e clientes.Esse cuidado com as pessoas nos levou a conquistar, em 2025, o reconhecimento como top 3 melhores instituições financeiras para se trabalhar no Brasil, ocupando a 3ª posição no ranking Great Place To Work®. Um orgulho que reforça nosso compromisso de colocar o Jeito Bmg de Ser em prática todos os dias.Esses pilares impulsionam uma transformação contínua, promovendo revisões diárias de processos, da jornada do cliente, da tomada de decisão e da forma como os times se conectam para gerar valor. No Bmg, somos movidos por fazer diferente e melhor, com integridade, simplicidade e um jeito único de ser: o Jeito Bmg.Responsabilidades e atribuiçõesResponsabilidades e atribuições:Construir, treinar e otimizar modelos utilizando técnicas de aprendizado de máquina;Fazer gestão, acompanhamento e recalibragem dos modelos já implantados;Gerar insights, ad hoc's e estudos analíticos diversos;Construir segmentações baseadas em algoritmos de clusterização;Busca por novas fontes de dados, além das tradicionais disponíveis e estruturadas;Apresentar resultados de projetos de forma compreensível, sem perda de rigor científico;Auxiliar na expansão da cultura do uso da ciência de dados em outras frentes de negócio.Requisitos e qualificaçõesRequisitos e qualificações:Domínio em linguagem de programação Python e modelagem estatística;Habilidade com banco de dados (SQL, ORACLE, etc), visando a extração, limpeza, tratamento e organização dos dados;Entendimento de técnicas de Modelagem Estatística e Machine Learning;Vivência no desenvolvimento e acompanhamento de modelos preditivos e/ou prescritivos.Ter boa comunicação, proatividade, flexibilidade e foco em resultado também são essenciais para você fazer parte do time de Ciência de Dados.Formação superior completa preferencialmente em áreas de exatas.Disponibilidade para atuação híbrida em São Paulo.Informações adicionaisBenefícios, saúde e bem-estarPlano de saúde sem mensalidade e Telemedicina;Plano odontológico;Vale Refeição e Alimentação;Seguro de vida;Previdência privada;Remuneração variável anual (bônus) competitiva;PPR - Programa de Participação nos Resultados;Único Skill (Benefício Educação gratuito);Bicicletário e vestiário;Auxílio creche;Auxílio internet;Programas de qualidade de vida;Ambulatório;Programa da Gestante;Licença Maternidade e Paternidade estendidasPsicologia Viva - Sessões de terapia online gratuita;PAP - Programa de assessoria financeira, jurídica e psicológica;Gympass - Desconto em academias;Frutas todos os dias;Day Off de Aniversário;Dress Code Flexível;Modelo híbrido de trabalho.E aí? Quer vestir a camisa e brilhar em campo com um banco presente na vida de milhões de brasileiros e reconhecido como um dos melhores lugares para se trabalhar?#VamosPraCimaShow moreShow less",Não especificado,Não especificado,Não especificado,2
Cientista de Dados Junior | Vaga Afirmativa para Pessoas Negras,Cielo,"Barueri, São Paulo, Brazil",1 week ago,"Somos mais que uma máquina, somos pessoas que transformam ecriam infinitas possibilidades.Trabalhamos parasimplificar e impulsionar negócios para todas as pessoas, oferecendo soluções financeiras inteligentes. Aqui, investimos emtecnologia, promovemosdesenvolvimentoe fomentamos ainovaçãopara criar novos caminhos possíveis e gerar impacto positivo no mundo.Na Cielo, a gente trabalha comautonomiapara escrever nossa própria jornada,liberdadepara ser quem a gente é, e a oportunidade defazer acontecer. Somos um time quesonha no plural, oferecendo uma experiência completa e focando no bem-estar físico e mental de nossos mais de 7.000 colaboradores e suas famílias.Acreditamos nainclusão e acolhimentode todas as pessoas, com suas singularidades e diversidade de vivências.Bora realizar seus sonhos com a gente!Responsabilidades e atribuiçõesTem lugar para você nesse propósito:Atuar em projetos de análise de dados complexos, identificando oportunidades de negócios e fornecendo insights acionáveis;Projetar e implementar modelos de Machine Learning para resolver problemas desafiadores e otimizar processos;Coletar, limpar, transformar e organizar grandes conjuntos de dados de várias fontes, garantindo a qualidade e a integridade dos mesmos;Realizar análises estatísticas para extrair informações relevantes e criar visualizações e relatórios detalhados;Colaborar com equipes multidisciplinares para entender os requisitos de análise de dados e fornecer soluções de alto nível;Acompanhar as últimas tendências e avanços em análise de dados e modelos de Machine Learning, e avaliar sua aplicabilidade nos projetos da empresa.Requisitos e qualificaçõesO que o #TimeCielo espera de você?Formação acadêmica cursando ou completa em Engenharia, Estatística, Ciência da Computação ou áreas relacionadas;Conhecimento em análise de dados, incluindo a capacidade de lidar com conjuntos de dados e extrair insights;Entendimento em modelagem estatística;Conhecimento em linguagens de programação usadas em análise de dados, como Python, R, SQL, entre outras;Entendimento em técnicas de visualização de dados e ferramentas relacionadas;Forte ética de trabalho e automotivação para atuar em tarefas e projetos simultaneamente.Informações adicionaisPor que viver infinitas possibilidades ao nosso lado?Assistência Médica e Odontológica;Remuneração Variável Anual (PPR);Auxílio Refeição e Alimentação;Fretado/vale-transporte ou estacionamento;Modelo Híbrido;Auxílio Trabalho Remoto;Seguro de Vida;Seguro residencial e automóvel;Assistência funeral familiar;Previdência Privada;Canal de apoio à especialistas (nutrição, psicologia, ginecologia, etc);Campanha de Vacinação;Acesso à diversos cursos em nossa plataforma Educa;Wellhub;Programa de Gestação Saudável;Licença Maternidade e Paternidade estendida;Auxílio Creche;Day Off de Aniversário;Dress Code Flexível;Horário Flexível;Sexta curta;Almoço estendido (1h30).Show moreShow less",,On-site/Hybrid,https://www.linkedin.com/jobs-guest/jobs/api/jobPosting/4297714361,2025-09-23,"Cientista de Dados Junior | Vaga Afirmativa para Pessoas Negras Somos mais que uma máquina, somos pessoas que transformam ecriam infinitas possibilidades.Trabalhamos parasimplificar e impulsionar negócios para todas as pessoas, oferecendo soluções financeiras inteligentes. Aqui, investimos emtecnologia, promovemosdesenvolvimentoe fomentamos ainovaçãopara criar novos caminhos possíveis e gerar impacto positivo no mundo.Na Cielo, a gente trabalha comautonomiapara escrever nossa própria jornada,liberdadepara ser quem a gente é, e a oportunidade defazer acontecer. Somos um time quesonha no plural, oferecendo uma experiência completa e focando no bem-estar físico e mental de nossos mais de 7.000 colaboradores e suas famílias.Acreditamos nainclusão e acolhimentode todas as pessoas, com suas singularidades e diversidade de vivências.Bora realizar seus sonhos com a gente!Responsabilidades e atribuiçõesTem lugar para você nesse propósito:Atuar em projetos de análise de dados complexos, identificando oportunidades de negócios e fornecendo insights acionáveis;Projetar e implementar modelos de Machine Learning para resolver problemas desafiadores e otimizar processos;Coletar, limpar, transformar e organizar grandes conjuntos de dados de várias fontes, garantindo a qualidade e a integridade dos mesmos;Realizar análises estatísticas para extrair informações relevantes e criar visualizações e relatórios detalhados;Colaborar com equipes multidisciplinares para entender os requisitos de análise de dados e fornecer soluções de alto nível;Acompanhar as últimas tendências e avanços em análise de dados e modelos de Machine Learning, e avaliar sua aplicabilidade nos projetos da empresa.Requisitos e qualificaçõesO que o #TimeCielo espera de você?Formação acadêmica cursando ou completa em Engenharia, Estatística, Ciência da Computação ou áreas relacionadas;Conhecimento em análise de dados, incluindo a capacidade de lidar com conjuntos de dados e extrair insights;Entendimento em modelagem estatística;Conhecimento em linguagens de programação usadas em análise de dados, como Python, R, SQL, entre outras;Entendimento em técnicas de visualização de dados e ferramentas relacionadas;Forte ética de trabalho e automotivação para atuar em tarefas e projetos simultaneamente.Informações adicionaisPor que viver infinitas possibilidades ao nosso lado?Assistência Médica e Odontológica;Remuneração Variável Anual (PPR);Auxílio Refeição e Alimentação;Fretado/vale-transporte ou estacionamento;Modelo Híbrido;Auxílio Trabalho Remoto;Seguro de Vida;Seguro residencial e automóvel;Assistência funeral familiar;Previdência Privada;Canal de apoio à especialistas (nutrição, psicologia, ginecologia, etc);Campanha de Vacinação;Acesso à diversos cursos em nossa plataforma Educa;Wellhub;Programa de Gestação Saudável;Licença Maternidade e Paternidade estendida;Auxílio Creche;Day Off de Aniversário;Dress Code Flexível;Horário Flexível;Sexta curta;Almoço estendido (1h30).Show moreShow less",Júnior,Não especificado,Não especificado,2
Cientista de Dados (área Business Development) - São Paulo/SP,Shopee,"São Paulo, São Paulo, Brazil",2 weeks ago,"About The TeamSobre a ShôAqui na Shô, acreditamos que cada membro de nossa equipe é fundamental para o nosso sucesso, e que diversidade de perspectivas e vivências são essenciais para movimentar nosso negócio e impulsionar o nosso propósito de mudar o mundo para melhor.Fazer parte do nosso time é a oportunidade de se desenvolver dentro de uma cultura de muita agilidade. Se você ama assumir grandes responsabilidades e fazer o que nunca foi feito, a Shô é seu lugar. Aqui você terá grandes desafios, trabalhará em colaboração com um time diverso e contribuirá para o futuro do e-commerce no Brasil, criamos impacto positivo na vida de milhões de pessoas.Modelo de TrabalhoAdotamos um modelo de trabalho híbrido, esse modelo permite que as pessoas ajustem seu ambiente de trabalho de acordo com suas necessidades pessoais, ao mesmo tempo em que promove a colaboração e interação no escritório.Qual será a sua missãoVocê atuará no time de Business Development e será responsável por estruturar e automatizar processos de coleta, classificação, organização e análise de dados que apoiem decisões estratégicas em um ambiente de negócio altamente dinâmico e competitivo.Buscamos alguém com perfil técnico e aplicado, que saiba construir soluções escaláveis, com forte raciocínio analítico e autonomia.Job DescriptionComo será o seu dia a diaProjetar e implementar pipelines robustos para processamento de dados em larga escala;Participar ativamente da evolução da esteira de dados e modelos, com foco em escalabilidade, confiabilidade e impacto;Colaborar com desenvolvedores, analistas de negócio e stakeholders de outras áreas, mantendo uma comunicação clara e objetiva;Desenvolver dashboards e relatórios com dados processados, apoiando a geração de insights para o negócio;Construir soluções com mentalidade DevOps e MLOps, utilizando automações, versionamento, CI/CD e monitoramento.RequirementsO que você precisa para assumir o desafioExperiência sólida com Python e bibliotecas de dados e machine learning (Pandas, Scikit-learn, etc.);Vivência com PySpark ou ferramentas de processamento distribuído;Experiência no tratamento e classificação de dados textuais não estruturados (ex: nomes e descrições de produtos, marcas, categorias), usando regex, Fuzzy Matching, embeddings ou LLMs;Experiência com machine learning aplicado a problemas como classificação e segmentação;Domínio de SQL, com experiência em modelagem de dados, otimização de consultas e organização de bases relacionais para consumo analítico;Habilidade de colaborar em equipes multidisciplinares, com boa comunicação e visão de negócio;Diferencial: domínio de frameworks como TensorFlow ou PyTorch;Diferencial: experiência com sistemas de recomendação, otimização ou personalização em larga escala;Diferencial: experiência com ingestão de dados externos e integração com fontes diversas (APIs, arquivos, dados públicos em escala);Diferencial: familiaridade com ferramentas de orquestração como Airflow ou Kubeflow;Diferencial: vivência em ambientes de e-commerce ou mercados com alta complexidade competitiva.BenefíciosAssistência médica e odontológica, estendendo-se aos dependentes;Parceira com Gympass e TotalPass;Vale Refeição/Alimentação flexível;Vale Transporte, Vale Mobilidade ou Estacionamento no local;Benefício flexível;Zenklub;Bônus anual discricionário, atrelado à performance.VEM FAZER HISTÓRIA COM A GENTE.O QUE TE FAZ ÚNICO, NOS FAZ MELHORES! 🧡Show moreShow less",,On-site/Hybrid,https://www.linkedin.com/jobs-guest/jobs/api/jobPosting/4260617702,2025-09-23,"Cientista de Dados (área Business Development) - São Paulo/SP About The TeamSobre a ShôAqui na Shô, acreditamos que cada membro de nossa equipe é fundamental para o nosso sucesso, e que diversidade de perspectivas e vivências são essenciais para movimentar nosso negócio e impulsionar o nosso propósito de mudar o mundo para melhor.Fazer parte do nosso time é a oportunidade de se desenvolver dentro de uma cultura de muita agilidade. Se você ama assumir grandes responsabilidades e fazer o que nunca foi feito, a Shô é seu lugar. Aqui você terá grandes desafios, trabalhará em colaboração com um time diverso e contribuirá para o futuro do e-commerce no Brasil, criamos impacto positivo na vida de milhões de pessoas.Modelo de TrabalhoAdotamos um modelo de trabalho híbrido, esse modelo permite que as pessoas ajustem seu ambiente de trabalho de acordo com suas necessidades pessoais, ao mesmo tempo em que promove a colaboração e interação no escritório.Qual será a sua missãoVocê atuará no time de Business Development e será responsável por estruturar e automatizar processos de coleta, classificação, organização e análise de dados que apoiem decisões estratégicas em um ambiente de negócio altamente dinâmico e competitivo.Buscamos alguém com perfil técnico e aplicado, que saiba construir soluções escaláveis, com forte raciocínio analítico e autonomia.Job DescriptionComo será o seu dia a diaProjetar e implementar pipelines robustos para processamento de dados em larga escala;Participar ativamente da evolução da esteira de dados e modelos, com foco em escalabilidade, confiabilidade e impacto;Colaborar com desenvolvedores, analistas de negócio e stakeholders de outras áreas, mantendo uma comunicação clara e objetiva;Desenvolver dashboards e relatórios com dados processados, apoiando a geração de insights para o negócio;Construir soluções com mentalidade DevOps e MLOps, utilizando automações, versionamento, CI/CD e monitoramento.RequirementsO que você precisa para assumir o desafioExperiência sólida com Python e bibliotecas de dados e machine learning (Pandas, Scikit-learn, etc.);Vivência com PySpark ou ferramentas de processamento distribuído;Experiência no tratamento e classificação de dados textuais não estruturados (ex: nomes e descrições de produtos, marcas, categorias), usando regex, Fuzzy Matching, embeddings ou LLMs;Experiência com machine learning aplicado a problemas como classificação e segmentação;Domínio de SQL, com experiência em modelagem de dados, otimização de consultas e organização de bases relacionais para consumo analítico;Habilidade de colaborar em equipes multidisciplinares, com boa comunicação e visão de negócio;Diferencial: domínio de frameworks como TensorFlow ou PyTorch;Diferencial: experiência com sistemas de recomendação, otimização ou personalização em larga escala;Diferencial: experiência com ingestão de dados externos e integração com fontes diversas (APIs, arquivos, dados públicos em escala);Diferencial: familiaridade com ferramentas de orquestração como Airflow ou Kubeflow;Diferencial: vivência em ambientes de e-commerce ou mercados com alta complexidade competitiva.BenefíciosAssistência médica e odontológica, estendendo-se aos dependentes;Parceira com Gympass e TotalPass;Vale Refeição/Alimentação flexível;Vale Transporte, Vale Mobilidade ou Estacionamento no local;Benefício flexível;Zenklub;Bônus anual discricionário, atrelado à performance.VEM FAZER HISTÓRIA COM A GENTE.O QUE TE FAZ ÚNICO, NOS FAZ MELHORES! 🧡Show moreShow less",Não especificado,Não especificado,Não especificado,1
