title,company,location,posted,description,applicants,work_mode,link,data_coleta,titulo_descr,senioridade,idioma,certificado,cluster
Data Scientist (Risk),"CloudWalk, Inc.","São Paulo, São Paulo, Brazil",4 days ago,"About CloudWalk:We are not just another fintech unicorn. We are a pack of dreamers, makers, and tech enthusiasts building the future of payments. With millions of happy customers and a hunger for innovation, we're now expanding our neural network - literally and metaphorically.About The Team:The Risk Team is responsible for building the defense layer that keeps CloudWalk, its merchants, and users safe. We keep our ecosystem healthy by tracking down malicious activity and maintaining regulatory compliance while providing the best user experience. You will be part of a multidisciplinary team comprising risk analysts, data scientists, and software engineers, working collaboratively to enhance our risk management strategies.About The Job:As a Data Scientist on our Risk Team, your role is crucial in developing and optimizing machine learning models to detect and prevent fraud. You will be a key player in analyzing data, building predictive models, and implementing robust data-driven strategies to enhance our risk management processes.You will bridge the gap between theoretical data science and practical, scalable solutions in the fintech sector, with a specific focus on risk assessment and mitigation. Your work will involve handling large-scale datasets, extracting meaningful insights, and developing sophisticated algorithms to protect our ecosystem.What You'll Need to Succeed:Fluency in Python and SQL.Proficient in ML libraries like Scikit, PyTorch, TensorFlow, etc.Experience with cloud-based services like the Google Cloud platform.Solid Data Visualization skills to create charts and dashboards.Strong analytical skills, ability to collect, organize, analyze, and disseminate significant amounts of information with attention to detail and accuracy.Detail-oriented with a strong research mindset.As a member of a fully remote and distributed team, you are expected to complete tasks autonomously, being highly collaborative and self-driven. We expect you to have the curiosity of a child with the responsibility of a grown-up.Communication skills. You should be able to communicate effectively with multiple teams.Ability to communicate and debate in English and Portuguese.Nice-to-have skills:Experience with financial or payment industry.Knowledge of distributed systems and parallel computing.DevOps practices: Understanding DevOps practices, including continuous integration, continuous deployment, and containerization.The Future We See:At CloudWalk, we envision a future where AI empowers every field to reach new heights:People teams leveraging AI to transform talent acquisition and employee development.Marketing professionals creating data-driven, AI-powered campaign strategies.Customer Success teams enhancing client experiences with intelligent solutions.Risk analysts combining human expertise with AI to navigate complexities.Designers collaborating with AI to push creative boundaries.Join us at CloudWalk, where we’re not just engineering solutions; we’re building a smarter, AI-driven future for payments—together.By applying for this position, your data will be processed as per CloudWalk's Privacy Policy that you can read here in Portuguese and here in English.We may use artificial intelligence (AI) tools to support parts of the hiring process, such as reviewing applications, analyzing resumes, or assessing responses. These tools assist our recruitment team but do not replace human judgment. Final hiring decisions are ultimately made by humans. If you would like more information about how your data is processed, please contact us.Show moreShow less",,Remote,https://www.linkedin.com/jobs-guest/jobs/api/jobPosting/4301413296,2025-11-27,"Data Scientist (Risk) About CloudWalk:We are not just another fintech unicorn. We are a pack of dreamers, makers, and tech enthusiasts building the future of payments. With millions of happy customers and a hunger for innovation, we're now expanding our neural network - literally and metaphorically.About The Team:The Risk Team is responsible for building the defense layer that keeps CloudWalk, its merchants, and users safe. We keep our ecosystem healthy by tracking down malicious activity and maintaining regulatory compliance while providing the best user experience. You will be part of a multidisciplinary team comprising risk analysts, data scientists, and software engineers, working collaboratively to enhance our risk management strategies.About The Job:As a Data Scientist on our Risk Team, your role is crucial in developing and optimizing machine learning models to detect and prevent fraud. You will be a key player in analyzing data, building predictive models, and implementing robust data-driven strategies to enhance our risk management processes.You will bridge the gap between theoretical data science and practical, scalable solutions in the fintech sector, with a specific focus on risk assessment and mitigation. Your work will involve handling large-scale datasets, extracting meaningful insights, and developing sophisticated algorithms to protect our ecosystem.What You'll Need to Succeed:Fluency in Python and SQL.Proficient in ML libraries like Scikit, PyTorch, TensorFlow, etc.Experience with cloud-based services like the Google Cloud platform.Solid Data Visualization skills to create charts and dashboards.Strong analytical skills, ability to collect, organize, analyze, and disseminate significant amounts of information with attention to detail and accuracy.Detail-oriented with a strong research mindset.As a member of a fully remote and distributed team, you are expected to complete tasks autonomously, being highly collaborative and self-driven. We expect you to have the curiosity of a child with the responsibility of a grown-up.Communication skills. You should be able to communicate effectively with multiple teams.Ability to communicate and debate in English and Portuguese.Nice-to-have skills:Experience with financial or payment industry.Knowledge of distributed systems and parallel computing.DevOps practices: Understanding DevOps practices, including continuous integration, continuous deployment, and containerization.The Future We See:At CloudWalk, we envision a future where AI empowers every field to reach new heights:People teams leveraging AI to transform talent acquisition and employee development.Marketing professionals creating data-driven, AI-powered campaign strategies.Customer Success teams enhancing client experiences with intelligent solutions.Risk analysts combining human expertise with AI to navigate complexities.Designers collaborating with AI to push creative boundaries.Join us at CloudWalk, where we’re not just engineering solutions; we’re building a smarter, AI-driven future for payments—together.By applying for this position, your data will be processed as per CloudWalk's Privacy Policy that you can read here in Portuguese and here in English.We may use artificial intelligence (AI) tools to support parts of the hiring process, such as reviewing applications, analyzing resumes, or assessing responses. These tools assist our recruitment team but do not replace human judgment. Final hiring decisions are ultimately made by humans. If you would like more information about how your data is processed, please contact us.Show moreShow less",Não especificado,Não especificado,Google Cloud,1
Programa Philips Desenvolve 2026 - Estágio em Ciência de Dados,Philips,"Barueri, São Paulo, Brazil",1 day ago,"Job TitlePrograma Philips Desenvolve 2026 - Estágio em Ciência de DadosJob DescriptionEstágio em Suporte a VendasFaça parte do Programa de Estágio Philips Desenvolve 2026! Desenvolva-se em um ambiente global e inovador atuando em projetos que melhoram a saúde e bem-estar das pessoas.Oportunidade para atuar no com comissões apoiando o time de Excelência de Vendas.Sua funçãoSuportar na confecção de relatórios;Alinharmentos/interações com outros times (finanças, vendas...);Participação em reuniões;Auxiliar na gestão dos pagamentos;Auxiliar abertura de PR/PO no SAP.Apoiar no desenvolvimento de KPIs estratégicos, acompanhando metas e apoiando representantes comerciais com análises de treinamento e performance.Você é a Pessoa Certa SeEstiver cursando ensino superior em Ciência de Dados, Egenharia de dados, Administração, Ciências Contábeis, Econômia ou áreas afins;Possuir previsão de conclusão do curso a partir de Junho/2027;Possuir conhecimento em Inglês;Possuir conhecimento Avançado em Excel;Possui conhecimento em Power BI e/ou Looker Studio e/ou SQL e/oude conVBA e/ou Python será um diferencial;For uma pessoa proativa, dinâmica, comunicativa, organizada, que goste de interação com outras pessoas, que possua senso de urgência e interesse em aprender e se desenvolver.Como trabalhamos juntosAcreditamos que geramos um impacto maior quando estamos juntos do que separados. Para nossos membros da equipe do escritório, isso significa trabalhar de modo presencial ao menos três dias da semana, para colaborar e estabelecer ligações com os outros. Os cargos presenciais requerem a presença do colaborador o tempo inteiro nas instalações da empresa. Para os colaboradores que ocupam um cargo na área de campo, suas funções são desempenhadas de maneira mais eficaz fora das instalações da empresa, geralmente em instalações de clientes ou fornecedores.Esta função se trata de uma posição no escritório.Sobre a PhilipsSomos uma empresa de tecnologia em saúde. Nós criamos toda a nossa empresa com base na crença de que todos os seres humanos são importantes e não vamos parar até que todos, em todos os lugares, tenham acesso aos cuidados de saúde de qualidade que todos nós merecemos. Realize o trabalho da sua vida para ajudar a melhorar a vida dos outros.Saiba mais sobre nossos negócios.Descubra nossa história rica e emocionante.Saiba mais sobre o nosso objetivo.Se você estiver interessado nesta função e tiver muitas, mas não todas, as experiências necessárias, nós o encorajamos a se candidatar. Você ainda pode ser o candidato certo para esta ou outras oportunidades na Philips. Saiba mais sobre nosso compromisso com a diversidade e inclusãoaqui.Show moreShow less",,On-site/Hybrid,https://www.linkedin.com/jobs-guest/jobs/api/jobPosting/4305749272,2025-11-27,"Programa Philips Desenvolve 2026 - Estágio em Ciência de Dados Job TitlePrograma Philips Desenvolve 2026 - Estágio em Ciência de DadosJob DescriptionEstágio em Suporte a VendasFaça parte do Programa de Estágio Philips Desenvolve 2026! Desenvolva-se em um ambiente global e inovador atuando em projetos que melhoram a saúde e bem-estar das pessoas.Oportunidade para atuar no com comissões apoiando o time de Excelência de Vendas.Sua funçãoSuportar na confecção de relatórios;Alinharmentos/interações com outros times (finanças, vendas...);Participação em reuniões;Auxiliar na gestão dos pagamentos;Auxiliar abertura de PR/PO no SAP.Apoiar no desenvolvimento de KPIs estratégicos, acompanhando metas e apoiando representantes comerciais com análises de treinamento e performance.Você é a Pessoa Certa SeEstiver cursando ensino superior em Ciência de Dados, Egenharia de dados, Administração, Ciências Contábeis, Econômia ou áreas afins;Possuir previsão de conclusão do curso a partir de Junho/2027;Possuir conhecimento em Inglês;Possuir conhecimento Avançado em Excel;Possui conhecimento em Power BI e/ou Looker Studio e/ou SQL e/oude conVBA e/ou Python será um diferencial;For uma pessoa proativa, dinâmica, comunicativa, organizada, que goste de interação com outras pessoas, que possua senso de urgência e interesse em aprender e se desenvolver.Como trabalhamos juntosAcreditamos que geramos um impacto maior quando estamos juntos do que separados. Para nossos membros da equipe do escritório, isso significa trabalhar de modo presencial ao menos três dias da semana, para colaborar e estabelecer ligações com os outros. Os cargos presenciais requerem a presença do colaborador o tempo inteiro nas instalações da empresa. Para os colaboradores que ocupam um cargo na área de campo, suas funções são desempenhadas de maneira mais eficaz fora das instalações da empresa, geralmente em instalações de clientes ou fornecedores.Esta função se trata de uma posição no escritório.Sobre a PhilipsSomos uma empresa de tecnologia em saúde. Nós criamos toda a nossa empresa com base na crença de que todos os seres humanos são importantes e não vamos parar até que todos, em todos os lugares, tenham acesso aos cuidados de saúde de qualidade que todos nós merecemos. Realize o trabalho da sua vida para ajudar a melhorar a vida dos outros.Saiba mais sobre nossos negócios.Descubra nossa história rica e emocionante.Saiba mais sobre o nosso objetivo.Se você estiver interessado nesta função e tiver muitas, mas não todas, as experiências necessárias, nós o encorajamos a se candidatar. Você ainda pode ser o candidato certo para esta ou outras oportunidades na Philips. Saiba mais sobre nosso compromisso com a diversidade e inclusãoaqui.Show moreShow less",Não especificado,Inglês,Não especificado,2
Cientista de Dados PL,Danone,"São Paulo, São Paulo, Brazil",2 weeks ago,"About The JobNosso time de Data está em busca de um(a) Cientista de Dados para atuar em São Paulo, de forma híbrida, e suas principais atividades estarão relacionadas a Gestão de Dados e a Obtenção de Insights para os times de negócioDesenvolvimento e Implementação de modelos estatísticos e de Machine Learning;Construção e manutenção de pipeline de dados;Criação das visualizações e dashboards para comunicação de resultados as áreas de negócio;Facilitar as tomadas de decisão da companhia a partir da Governança e Visibilidade de Dados Estratégicos;Trabalhar em colaboração com stakeholders para identificação de oportunidades e o desenvolvimento conjunto de soluções de dados.About youFormação em Ciência de Dados, Engenharia, Estatística, Física, Matemática, Ciências da Computação ou áreas correlatas;Experiência e Proficiência com a programação em Python ou R, preferencialmente Python;Experiência com bibliotecas e frameworks de Machine Learning (Scikit-Learn, TensorFlow, entre outras);Conhecimento em Databricks ou Plataformas Similares;Conhecimento sólido em Banco de Dados SQL;Inglês Intermediário;Familiaridade com o uso de Power BI, para interfaces pontuais na rotina de gestão de dados;O conhecimento em Bibliotecas de reconhecimento de imagens, será considerado um diferencial.About usNa Danone, nos dedicamos para levar saúde e nutrição para o maior número de pessoas. E não só isso; queremos que nossa missão beneficie pessoas de todas as idades, em todos os ambientes sociais e culturais e em todas as partes do mundo.Hoje a companhia está presente em mais de 120 países, onde opera de forma ágil e simplificada. No Brasil, recentemente unificamos nossas três unidades de negócio para atuarmos com sinergia, oferecendo um portfólio para todas as fases da vida produtos lácteos e à base vegetal, águas e nutrição especializada.Se você se identifica com uma personalidade ativista, otimista, pioneira e genuína, junte-se a nós e faça parte de uma companhia diversa e orientada para o propósito.A Danone valoriza e promove a diversidade e consideramos Pessoas com Deficiência em todas as nossas oportunidades!!!Venha fazer acontecer com nossa equipe!!!Descubra mais emPágina de carreiras oficial Carreiras na Danone | DanoneInstagram @danone_brasilShow moreShow less",,On-site/Hybrid,https://www.linkedin.com/jobs-guest/jobs/api/jobPosting/4334690836,2025-11-27,"Cientista de Dados PL About The JobNosso time de Data está em busca de um(a) Cientista de Dados para atuar em São Paulo, de forma híbrida, e suas principais atividades estarão relacionadas a Gestão de Dados e a Obtenção de Insights para os times de negócioDesenvolvimento e Implementação de modelos estatísticos e de Machine Learning;Construção e manutenção de pipeline de dados;Criação das visualizações e dashboards para comunicação de resultados as áreas de negócio;Facilitar as tomadas de decisão da companhia a partir da Governança e Visibilidade de Dados Estratégicos;Trabalhar em colaboração com stakeholders para identificação de oportunidades e o desenvolvimento conjunto de soluções de dados.About youFormação em Ciência de Dados, Engenharia, Estatística, Física, Matemática, Ciências da Computação ou áreas correlatas;Experiência e Proficiência com a programação em Python ou R, preferencialmente Python;Experiência com bibliotecas e frameworks de Machine Learning (Scikit-Learn, TensorFlow, entre outras);Conhecimento em Databricks ou Plataformas Similares;Conhecimento sólido em Banco de Dados SQL;Inglês Intermediário;Familiaridade com o uso de Power BI, para interfaces pontuais na rotina de gestão de dados;O conhecimento em Bibliotecas de reconhecimento de imagens, será considerado um diferencial.About usNa Danone, nos dedicamos para levar saúde e nutrição para o maior número de pessoas. E não só isso; queremos que nossa missão beneficie pessoas de todas as idades, em todos os ambientes sociais e culturais e em todas as partes do mundo.Hoje a companhia está presente em mais de 120 países, onde opera de forma ágil e simplificada. No Brasil, recentemente unificamos nossas três unidades de negócio para atuarmos com sinergia, oferecendo um portfólio para todas as fases da vida produtos lácteos e à base vegetal, águas e nutrição especializada.Se você se identifica com uma personalidade ativista, otimista, pioneira e genuína, junte-se a nós e faça parte de uma companhia diversa e orientada para o propósito.A Danone valoriza e promove a diversidade e consideramos Pessoas com Deficiência em todas as nossas oportunidades!!!Venha fazer acontecer com nossa equipe!!!Descubra mais emPágina de carreiras oficial Carreiras na Danone | DanoneInstagram @danone_brasilShow moreShow less",Não especificado,Inglês,Não especificado,3
Engenheiro QA,Tata Consultancy Services,"São Paulo, São Paulo, Brazil",1 day ago,"A Tata Consultancy Services (TCS) é líder global em serviços de TI, consultoria & soluções de negócios com uma grande rede de centros de inovação & entrega.Fomos reconhecidos como um Global Top Employer e nossa capacidade de fornecer carreiras holísticas de longo prazo baseadas em aprendizado contínuo impulsionado por nosso ecossistema de aprendizagem digital nos ajuda a desenvolver os melhores talentos!E convidamos você a fazer parte da nossa equipe!Sobre a vaga:Estamos em busca de umEngenheiro de QApara atuar na garantia da qualidade das entregas de software, assegurando padrões elevados em todas as fases do ciclo de vida. Procuramos alguém com experiência sólida em testes, atenção aos detalhes e capacidade de colaborar com times ágeis e áreas de negócio.ResponsabilidadesGarantir a qualidade das entregas de software em todas as etapas do desenvolvimento.Planejar, executar e monitorarestratégias de testes(funcionais e não funcionais).Atuar com ferramentas comoOctane, PBI, Jira e SonarQube.Participar de cerimônias ágeis e alinhamentos com áreas de negócio e tecnologia.Mapear riscos, definir cenários e elaborar planos de testes.Monitorar indicadores de qualidade e propor melhorias contínuas.Apoiar na padronização de processos e requisitos de qualidade nas sprints.Escrever e executar testesend-to-ende regressivos.Contribuir para evolução das práticas de QA e automação.RequisitosExperiência sólida em QAConhecimento emOctane, PBI, Jira e SonarQube.Noções básicas deautomação de testes.Boa comunicação e capacidade de trabalho em equipe.Visão analítica e atenção aos detalhes.DiferenciaisExperiência comestratégias de testes complexas.Conhecimento emmétricas de qualidade e indicadores de performance.Familiaridade com práticas ágeis e integração contínua.Modelo de contratação:CLT Full + BenefíciosBenefícios TCS – Brasil:Plano de SaúdePlanos OdontológicoSeguro de VidaVale TransporteVale Refeição/AlimentaçãoAuxílio CrecheGympassTCS Cares – 0800 gratuito que fornece assistência psicológica (24 hrs/dia), jurídica, social e financeira aos associadosParceria com SESCReembolso de CertificaçõesPortal de aprendizagem gratuito da TCS – cursos online e treinamentos ao vivoOportunidade de experiência internacionalParceria de descontos com Universidades e escolas de idiomasBring Your Buddy – Ao indicar pessoas você se torna elegível a receber um bônus para cada contrataçãoTCS Gems – Reconhecimento por performanceXcelerate – Plataforma de carreira com mentoria gratuitaOperamos em escala global, com diversas bases de talentos representando 156 nacionalidades, em 55 países. Na Tata Consultancy Services promovemos uma cultura inclusiva, sempre trabalhamos pela equidade. Isso se traduz em Gênero, Pessoas com Deficiência, LGBTQIA+, Religião, Raça, Diversidade de experiências e Etnia, ou seja, todas as nossas vagas são trabalhadas com esses princípios.Show moreShow less",,On-site/Hybrid,https://www.linkedin.com/jobs-guest/jobs/api/jobPosting/4338929134,2025-11-27,"Engenheiro QA A Tata Consultancy Services (TCS) é líder global em serviços de TI, consultoria & soluções de negócios com uma grande rede de centros de inovação & entrega.Fomos reconhecidos como um Global Top Employer e nossa capacidade de fornecer carreiras holísticas de longo prazo baseadas em aprendizado contínuo impulsionado por nosso ecossistema de aprendizagem digital nos ajuda a desenvolver os melhores talentos!E convidamos você a fazer parte da nossa equipe!Sobre a vaga:Estamos em busca de umEngenheiro de QApara atuar na garantia da qualidade das entregas de software, assegurando padrões elevados em todas as fases do ciclo de vida. Procuramos alguém com experiência sólida em testes, atenção aos detalhes e capacidade de colaborar com times ágeis e áreas de negócio.ResponsabilidadesGarantir a qualidade das entregas de software em todas as etapas do desenvolvimento.Planejar, executar e monitorarestratégias de testes(funcionais e não funcionais).Atuar com ferramentas comoOctane, PBI, Jira e SonarQube.Participar de cerimônias ágeis e alinhamentos com áreas de negócio e tecnologia.Mapear riscos, definir cenários e elaborar planos de testes.Monitorar indicadores de qualidade e propor melhorias contínuas.Apoiar na padronização de processos e requisitos de qualidade nas sprints.Escrever e executar testesend-to-ende regressivos.Contribuir para evolução das práticas de QA e automação.RequisitosExperiência sólida em QAConhecimento emOctane, PBI, Jira e SonarQube.Noções básicas deautomação de testes.Boa comunicação e capacidade de trabalho em equipe.Visão analítica e atenção aos detalhes.DiferenciaisExperiência comestratégias de testes complexas.Conhecimento emmétricas de qualidade e indicadores de performance.Familiaridade com práticas ágeis e integração contínua.Modelo de contratação:CLT Full + BenefíciosBenefícios TCS – Brasil:Plano de SaúdePlanos OdontológicoSeguro de VidaVale TransporteVale Refeição/AlimentaçãoAuxílio CrecheGympassTCS Cares – 0800 gratuito que fornece assistência psicológica (24 hrs/dia), jurídica, social e financeira aos associadosParceria com SESCReembolso de CertificaçõesPortal de aprendizagem gratuito da TCS – cursos online e treinamentos ao vivoOportunidade de experiência internacionalParceria de descontos com Universidades e escolas de idiomasBring Your Buddy – Ao indicar pessoas você se torna elegível a receber um bônus para cada contrataçãoTCS Gems – Reconhecimento por performanceXcelerate – Plataforma de carreira com mentoria gratuitaOperamos em escala global, com diversas bases de talentos representando 156 nacionalidades, em 55 países. Na Tata Consultancy Services promovemos uma cultura inclusiva, sempre trabalhamos pela equidade. Isso se traduz em Gênero, Pessoas com Deficiência, LGBTQIA+, Religião, Raça, Diversidade de experiências e Etnia, ou seja, todas as nossas vagas são trabalhadas com esses princípios.Show moreShow less",Não especificado,Não especificado,Não especificado,0
