title,company,location,posted,description,applicants,work_mode,link,data_coleta,titulo_descr,senioridade,idioma,certificado,cluster
AI Scientist,Loft,"São Paulo, São Paulo, Brazil",4 months ago,"Como o timede DADOSconstrói a Loft:As principais missões do nosso time são garantir que a Loft tome as melhoresdecisões baseadas em dadose extrair o máximo valor deMachine Learning e IApara gerar soluções de negócio. Além disso, somos responsáveis por criar ferramentas e tecnologias que democratizem o acesso à informação, permitindo que todos na companhia utilizem dados de forma eficiente. Nosso dia a dia envolve a construção de produtos de dados, monitoramento de experimentos, projeções e estudos analíticos, sempre focados em otimizar os resultados de negócio. Buscamos pessoas que sejam movidas por desafios, gostem de trabalhar em equipe e queiram se desenvolver em um ambiente dinâmico. Acreditamos em um time diverso, alinhado ao nosso propósito e com mentalidade de alta performance para construir, juntos, o maior ecossistema imobiliário da América Latina.Os desafios que você vai encontrar:Desenvolver produtos inovadores fundamentados em modelos de fundação e machine learningMonitorar o impacto das soluções de dados, transformando métricas técnicas em insights estratégicos para a alta liderança.Atuar consultivamente junto a stakeholders para identificar oportunidades, desenhar novas soluções ou otimizar produtos legados.Colaborar em squads multidisciplinares, integrando visões de Produto, Design e Engenharia para viabilizar a implementação dessas soluções.Garantir a evolução contínua e a manutenção proativa do ecossistema de produtos existentes.O que você precisa para virar a chave?Domínio Técnico: Sólidos conhecimentos em Estatística e Machine Learning (obrigatório)Ferramental e Engenharia: Proficiência em Python e SQL, experiência prática em versionamento de código (Git) e Experiência prática com APIs de foundation modelsCultura e Colaboração: Experiência em squads multidisciplinares e ter um perfil colaborativo, com foco no compartilhamento de conhecimento e autonomia.Comunicação e Interface: Capacidade de traduzir conceitos técnicos complexos para lideranças e stakeholders de negócio.Soft Skills: Postura proativa, perfil analítico e foco em execução (mão na massa).Diferencial: Experiência com o ciclo completo de deploy e monitoramento de modelos em produção; Experiência com RAG e frameworks de desenvolvimento de LLMs; Experiência com monitoramento de performance e custo de modelos de fundação.Informações adicionais💳Caju - Mais liberdade para usar seus benefícios (Refeição, Alimentação, Mobilidade, Saúde, Home Office, Cultura e Educação);🏥Assistência Médica - Sulamerica🪥Assistência Odontológica - Sulamerica🦺Seguro de Vida - Prudential🏋️WellHub - Acesso a academias no Brasil inteiro🧘Wellz- Plataforma de Saúde Mental🏝️Férias Flexíveis - Tire suas férias a qualquer momento😴Day Off👪Licença Parental - para pais e mães🐕Guapeco - Plano de Saúde Pet com desconto🖥️Trabalho - RemotoShow moreShow less",,On-site/Hybrid,https://www.linkedin.com/jobs-guest/jobs/api/jobPosting/4330717054,2026-06-03,"AI Scientist Como o timede DADOSconstrói a Loft:As principais missões do nosso time são garantir que a Loft tome as melhoresdecisões baseadas em dadose extrair o máximo valor deMachine Learning e IApara gerar soluções de negócio. Além disso, somos responsáveis por criar ferramentas e tecnologias que democratizem o acesso à informação, permitindo que todos na companhia utilizem dados de forma eficiente. Nosso dia a dia envolve a construção de produtos de dados, monitoramento de experimentos, projeções e estudos analíticos, sempre focados em otimizar os resultados de negócio. Buscamos pessoas que sejam movidas por desafios, gostem de trabalhar em equipe e queiram se desenvolver em um ambiente dinâmico. Acreditamos em um time diverso, alinhado ao nosso propósito e com mentalidade de alta performance para construir, juntos, o maior ecossistema imobiliário da América Latina.Os desafios que você vai encontrar:Desenvolver produtos inovadores fundamentados em modelos de fundação e machine learningMonitorar o impacto das soluções de dados, transformando métricas técnicas em insights estratégicos para a alta liderança.Atuar consultivamente junto a stakeholders para identificar oportunidades, desenhar novas soluções ou otimizar produtos legados.Colaborar em squads multidisciplinares, integrando visões de Produto, Design e Engenharia para viabilizar a implementação dessas soluções.Garantir a evolução contínua e a manutenção proativa do ecossistema de produtos existentes.O que você precisa para virar a chave?Domínio Técnico: Sólidos conhecimentos em Estatística e Machine Learning (obrigatório)Ferramental e Engenharia: Proficiência em Python e SQL, experiência prática em versionamento de código (Git) e Experiência prática com APIs de foundation modelsCultura e Colaboração: Experiência em squads multidisciplinares e ter um perfil colaborativo, com foco no compartilhamento de conhecimento e autonomia.Comunicação e Interface: Capacidade de traduzir conceitos técnicos complexos para lideranças e stakeholders de negócio.Soft Skills: Postura proativa, perfil analítico e foco em execução (mão na massa).Diferencial: Experiência com o ciclo completo de deploy e monitoramento de modelos em produção; Experiência com RAG e frameworks de desenvolvimento de LLMs; Experiência com monitoramento de performance e custo de modelos de fundação.Informações adicionais💳Caju - Mais liberdade para usar seus benefícios (Refeição, Alimentação, Mobilidade, Saúde, Home Office, Cultura e Educação);🏥Assistência Médica - Sulamerica🪥Assistência Odontológica - Sulamerica🦺Seguro de Vida - Prudential🏋️WellHub - Acesso a academias no Brasil inteiro🧘Wellz- Plataforma de Saúde Mental🏝️Férias Flexíveis - Tire suas férias a qualquer momento😴Day Off👪Licença Parental - para pais e mães🐕Guapeco - Plano de Saúde Pet com desconto🖥️Trabalho - RemotoShow moreShow less",Não especificado,Não especificado,Não especificado,0
Pesquisador de Campo - Guarulhos/SP,Zukkin - Inteligência de Preços,"Guarulhos, São Paulo, Brazil",7 months ago,"A vaga é para atuar como Pesquisador de Campo em Guarulhos/SPOferecemos uma remuneração de R$75,00 por diária para a realização das pesquisas. Esse valor contempla 8 horas de trabalho diário, permitindo flexibilidade para conciliar com outras atividades. Nosso formato de contratação é no regime MEI com pagamento efetuado todo dia 10.Segue a rota:SEGUNDA-FEIRASão JoãoQnt itens: 400 itensPrazo: 16:00Parque Santo AgostinhoQnt itens: 475 itensPrazo: 16:00AV BRIGADEIRO FARIA LIMAQnt itens: 400 itensPrazo: 16:00Responsabilidades:Realizar pesquisas de campo para coletar informações sobre preços de produtos e serviços;Registrar e analisar os dados obtidos durante as pesquisas;Identificar tendências de mercado relacionadas aos preços pesquisados;Reportar os resultados das pesquisas à equipe responsável;Manter-se atualizado sobre as práticas de precificação do setor.Requisitos:Experiência prévia em pesquisas de campo ou áreas relacionadas.Conhecimento em técnicas de coleta e análise de dados.Habilidade para trabalhar de forma independente e em equipe.Boa comunicação e capacidade de reportar informações de forma clara.Atenção aos detalhes e capacidade de observação.Ensino médio completo.Interessado(a) em participar do nosso processo seletivo?Show moreShow less",,On-site/Hybrid,https://www.linkedin.com/jobs-guest/jobs/api/jobPosting/4311524203,2026-06-03,"Pesquisador de Campo - Guarulhos/SP A vaga é para atuar como Pesquisador de Campo em Guarulhos/SPOferecemos uma remuneração de R$75,00 por diária para a realização das pesquisas. Esse valor contempla 8 horas de trabalho diário, permitindo flexibilidade para conciliar com outras atividades. Nosso formato de contratação é no regime MEI com pagamento efetuado todo dia 10.Segue a rota:SEGUNDA-FEIRASão JoãoQnt itens: 400 itensPrazo: 16:00Parque Santo AgostinhoQnt itens: 475 itensPrazo: 16:00AV BRIGADEIRO FARIA LIMAQnt itens: 400 itensPrazo: 16:00Responsabilidades:Realizar pesquisas de campo para coletar informações sobre preços de produtos e serviços;Registrar e analisar os dados obtidos durante as pesquisas;Identificar tendências de mercado relacionadas aos preços pesquisados;Reportar os resultados das pesquisas à equipe responsável;Manter-se atualizado sobre as práticas de precificação do setor.Requisitos:Experiência prévia em pesquisas de campo ou áreas relacionadas.Conhecimento em técnicas de coleta e análise de dados.Habilidade para trabalhar de forma independente e em equipe.Boa comunicação e capacidade de reportar informações de forma clara.Atenção aos detalhes e capacidade de observação.Ensino médio completo.Interessado(a) em participar do nosso processo seletivo?Show moreShow less",Não especificado,Não especificado,Não especificado,1
Cientista de Dados,OXXO Brasil,"São Paulo, São Paulo, Brazil",2 weeks ago,"Estamos construindo um dos maiores ecossistemas de varejo de proximidade do Brasil. Desde 2020, quando abrimos nossa primeira loja, aOXXO Brasilcresce de forma acelerada no varejo de proximidade, sempre acreditando que cada nova esquina é uma oportunidade de estar mais próximo, salvar o dia e fazer parte da rotina das pessoas.Fazemos parte da divisão FEMSA Proximidade, Américas e Mobilidade e nossa cultura marcada pelo“Sempre Próximo”se reflete em comportamentos como disciplina, foco nas pessoas e desenvolvimento de talentos.Se você valoriza melhoria contínua, tem foco no cliente e quer crescer em um negócio em constante evolução, aqui é o seu lugar.Venha fazer parte da OXXO Brasil e construa com a gente um futuro mais próximo, simples e humano.Buscamos uma pessoa Cientista de Dados para atuar na construção de modelos analíticos e preditivos, apoiando decisões estratégicas do negócio. Essa pessoa será responsável por explorar dados, identificar padrões, desenvolver modelos estatísticos e de machine learning, além de traduzir resultados em insights acionáveis para diferentes áreas.Responsabilidades e atribuiçõesDesenvolver e implementar modelos de Machine Learning aplicados a problemas reais de negócio;Explorar grandes volumes de dados para identificar padrões, tendências e oportunidades;Monitorar continuamente a performance dos modelos (drift, estabilidade e métricas técnicas e de negócio);Conduzir análises avançadas para direcionar decisões estratégicas;Realizar o deploy de modelos de Machine Learning em ambientes produtivos;Comunicar resultados e insights por meio de visualizações claras e objetivas;Atuar em parceria com áreas de negócio, traduzindo problemas em soluções analíticas de impacto.Requisitos e qualificaçõesEnsino superior completo;Experiência sólida em modelagem estatística e técnicas de Machine Learning,Manipulação de grandes volumes de dados estruturados e não estruturados;Vivência com Python, SQL, Spark e ferramentas de processamento e análise de dados;Experiência com deploy de modelos e acompanhamento em produção;Experiência com modelos de classificação, regressão e séries temporais;Vivência com frameworks de IA generativa como LangChain e LangGraph, serão considerados diferenciais.Informações adicionaisBenefícios:Vale transporte ou estacionamento no local;Vale Refeição;Assistência Médica;Assistência Odontológica;Seguro de Vida;Auxílio creche ou acompanhante;Cooperativa de crédito – Barracred;Clube de descontos – Allya;Previdência Privada;Convênio academia – Gympass;Sistema de trabalho híbrido - presencial e à distância.Show moreShow less",,On-site/Hybrid,https://www.linkedin.com/jobs-guest/jobs/api/jobPosting/4412929921,2026-06-03,"Cientista de Dados Estamos construindo um dos maiores ecossistemas de varejo de proximidade do Brasil. Desde 2020, quando abrimos nossa primeira loja, aOXXO Brasilcresce de forma acelerada no varejo de proximidade, sempre acreditando que cada nova esquina é uma oportunidade de estar mais próximo, salvar o dia e fazer parte da rotina das pessoas.Fazemos parte da divisão FEMSA Proximidade, Américas e Mobilidade e nossa cultura marcada pelo“Sempre Próximo”se reflete em comportamentos como disciplina, foco nas pessoas e desenvolvimento de talentos.Se você valoriza melhoria contínua, tem foco no cliente e quer crescer em um negócio em constante evolução, aqui é o seu lugar.Venha fazer parte da OXXO Brasil e construa com a gente um futuro mais próximo, simples e humano.Buscamos uma pessoa Cientista de Dados para atuar na construção de modelos analíticos e preditivos, apoiando decisões estratégicas do negócio. Essa pessoa será responsável por explorar dados, identificar padrões, desenvolver modelos estatísticos e de machine learning, além de traduzir resultados em insights acionáveis para diferentes áreas.Responsabilidades e atribuiçõesDesenvolver e implementar modelos de Machine Learning aplicados a problemas reais de negócio;Explorar grandes volumes de dados para identificar padrões, tendências e oportunidades;Monitorar continuamente a performance dos modelos (drift, estabilidade e métricas técnicas e de negócio);Conduzir análises avançadas para direcionar decisões estratégicas;Realizar o deploy de modelos de Machine Learning em ambientes produtivos;Comunicar resultados e insights por meio de visualizações claras e objetivas;Atuar em parceria com áreas de negócio, traduzindo problemas em soluções analíticas de impacto.Requisitos e qualificaçõesEnsino superior completo;Experiência sólida em modelagem estatística e técnicas de Machine Learning,Manipulação de grandes volumes de dados estruturados e não estruturados;Vivência com Python, SQL, Spark e ferramentas de processamento e análise de dados;Experiência com deploy de modelos e acompanhamento em produção;Experiência com modelos de classificação, regressão e séries temporais;Vivência com frameworks de IA generativa como LangChain e LangGraph, serão considerados diferenciais.Informações adicionaisBenefícios:Vale transporte ou estacionamento no local;Vale Refeição;Assistência Médica;Assistência Odontológica;Seguro de Vida;Auxílio creche ou acompanhante;Cooperativa de crédito – Barracred;Clube de descontos – Allya;Previdência Privada;Convênio academia – Gympass;Sistema de trabalho híbrido - presencial e à distância.Show moreShow less",Não especificado,Não especificado,Não especificado,3
Data Scientist III - Modelagem de Investimentos,Banco Bradesco,"Osasco, São Paulo, Brazil",1 week ago,"Sobre o BradescoO Bradesco é um dos maiores grupos financeiros do Brasil, com uma história marcada pelo pioneirismo e inovação. Por meio da nossa carteira amplamente diversificada de produtos financeiros, serviços bancários e de seguros contribuímos com a realização das pessoas e o crescimento sustentável de empresas e sociedade. Venha fazer parte do nosso ecossistema financeiro e impactar a experiência de milhões de pessoas!No Bradesco valorizamos a diversidade em todas as suas formas. Por isso, as nossas vagas são abertas a todas as pessoas, independentemente de gênero, raça, orientação sexual, deficiência, idade ou qualquer outra característica.Saiba mais em https://banco.bradesco/html/classic/sobre/index.shtmResponsabilidades e atribuiçõesO que é o nosso time de Pricing?Somos responsáveis pela definição e gestão estratégica de preços e condições financeiras dos produtos do banco, equilibrando rentabilidade, competitividade e risco. Atuando com dados, modelagens e inteligência de mercado para apoiar decisões comerciais e impulsionar resultados sustentáveis em diversas linhas de negócio.Modelo de trabalho : Híbrido - 3x PresencialUnidade: Osasco/SPComo será seu dia a dia?Sendo Data Scientist III - Modelagem de Investimentos, atuará na gerência Modelagem Pricing e suas principais atividades serão:Elaborar, desenvolver e validar modelos de precificação de produtos de investimentos, utilizando dados internos, de mercado e de comportamento do clienteMonitorar continuamente a performance dos modelos existentes, realizando recalibrações e ajustes para garantir acurácia e relevânciaExplorar grandes volumes de dados para identificar padrões, variáveis relevantes e construir curvas de demandaConduzir análises de sensibilidade, avaliando o impacto de mudanças em variáveis de precificação e condições de mercado sobre a demandaTraduzir resultados dos modelos em insights acionáveis que suportem estratégias de investimento, maximizando rentabilidade e volume, considerando elasticidade de demandaComunicar resultados e insights de forma clara e estruturada para stakeholders técnicos e não técnicosRequisitos e QualificaçõesO que você precisa ter ou saber?Ensino superior completo em Economia, Engenharia, Estatística, Ciência da Computação ou áreas correlatasPós-graduação em áreas quantitativas (ex.: Ciência de Dados) será considerada um diferencialSólida experiência com modelagem de preços e análise de elasticidadeExperiência com modelagem aplicada a produtos de investimentos será considerada um diferencialConhecimento do mercado de investimentos e da regulamentação do setorSólido domínio em modelos de precificação e análise de rentabilidade, com proficiência em ferramentas de dados como Python (mandatório), SQL, PySpark, Databricks e Excel avançado, além de conhecimento em Power BI como diferencial.O que nós oferecemosNo Bradesco valorizamos a saúde e bem-estar, oferecendo um extenso portfólio de benefícios a todas nossas pessoas funcionárias:PLR ou Bônus: Conforme a elegibilidade de cargo*Convênio MédicoConvênio OdontológicoSeguro de VidaVale AlimentaçãoVale Refeição13º Cesta AlimentaçãoTotal PassVale Transporte (adesão opcional)Descontos em produtos e serviços em empresas parceirasPrevidência Privada (adesão opcional, com participação financeira da Organização Bradesco)Viva Bem Bradesco: programa de saúde, bem-estar e qualidade de vidaUnibrad: Universidade Corporativa BradescoIsenção de Tarifas: condições especiais em diversos produtos e serviçosAuxílio Creche ou BabáLicença Paternidade estendida de 20 diasLicença Maternidade de 180 dias, acompanhamento assistencial da gestação até o pós-partoShow moreShow less",,On-site/Hybrid,https://www.linkedin.com/jobs-guest/jobs/api/jobPosting/4417423027,2026-06-03,"Data Scientist III - Modelagem de Investimentos Sobre o BradescoO Bradesco é um dos maiores grupos financeiros do Brasil, com uma história marcada pelo pioneirismo e inovação. Por meio da nossa carteira amplamente diversificada de produtos financeiros, serviços bancários e de seguros contribuímos com a realização das pessoas e o crescimento sustentável de empresas e sociedade. Venha fazer parte do nosso ecossistema financeiro e impactar a experiência de milhões de pessoas!No Bradesco valorizamos a diversidade em todas as suas formas. Por isso, as nossas vagas são abertas a todas as pessoas, independentemente de gênero, raça, orientação sexual, deficiência, idade ou qualquer outra característica.Saiba mais em https://banco.bradesco/html/classic/sobre/index.shtmResponsabilidades e atribuiçõesO que é o nosso time de Pricing?Somos responsáveis pela definição e gestão estratégica de preços e condições financeiras dos produtos do banco, equilibrando rentabilidade, competitividade e risco. Atuando com dados, modelagens e inteligência de mercado para apoiar decisões comerciais e impulsionar resultados sustentáveis em diversas linhas de negócio.Modelo de trabalho : Híbrido - 3x PresencialUnidade: Osasco/SPComo será seu dia a dia?Sendo Data Scientist III - Modelagem de Investimentos, atuará na gerência Modelagem Pricing e suas principais atividades serão:Elaborar, desenvolver e validar modelos de precificação de produtos de investimentos, utilizando dados internos, de mercado e de comportamento do clienteMonitorar continuamente a performance dos modelos existentes, realizando recalibrações e ajustes para garantir acurácia e relevânciaExplorar grandes volumes de dados para identificar padrões, variáveis relevantes e construir curvas de demandaConduzir análises de sensibilidade, avaliando o impacto de mudanças em variáveis de precificação e condições de mercado sobre a demandaTraduzir resultados dos modelos em insights acionáveis que suportem estratégias de investimento, maximizando rentabilidade e volume, considerando elasticidade de demandaComunicar resultados e insights de forma clara e estruturada para stakeholders técnicos e não técnicosRequisitos e QualificaçõesO que você precisa ter ou saber?Ensino superior completo em Economia, Engenharia, Estatística, Ciência da Computação ou áreas correlatasPós-graduação em áreas quantitativas (ex.: Ciência de Dados) será considerada um diferencialSólida experiência com modelagem de preços e análise de elasticidadeExperiência com modelagem aplicada a produtos de investimentos será considerada um diferencialConhecimento do mercado de investimentos e da regulamentação do setorSólido domínio em modelos de precificação e análise de rentabilidade, com proficiência em ferramentas de dados como Python (mandatório), SQL, PySpark, Databricks e Excel avançado, além de conhecimento em Power BI como diferencial.O que nós oferecemosNo Bradesco valorizamos a saúde e bem-estar, oferecendo um extenso portfólio de benefícios a todas nossas pessoas funcionárias:PLR ou Bônus: Conforme a elegibilidade de cargo*Convênio MédicoConvênio OdontológicoSeguro de VidaVale AlimentaçãoVale Refeição13º Cesta AlimentaçãoTotal PassVale Transporte (adesão opcional)Descontos em produtos e serviços em empresas parceirasPrevidência Privada (adesão opcional, com participação financeira da Organização Bradesco)Viva Bem Bradesco: programa de saúde, bem-estar e qualidade de vidaUnibrad: Universidade Corporativa BradescoIsenção de Tarifas: condições especiais em diversos produtos e serviçosAuxílio Creche ou BabáLicença Paternidade estendida de 20 diasLicença Maternidade de 180 dias, acompanhamento assistencial da gestação até o pós-partoShow moreShow less",Não especificado,Não especificado,Não especificado,2
