title,company,location,posted,description,applicants,work_mode,link,data_coleta,titulo_descr,senioridade,idioma,certificado,cluster
Cientista de Dados - Sênior (Foco em PLD-FTP),Banco Daycoval,"São Paulo, São Paulo, Brazil",3 weeks ago,"Descrição da vagaBuscamos umAnalista Sênior de Ciência de Dadospara transformar dados em estratégias de mitigação de riscos, com foco emPrevenção à Lavagem de Dinheiro eFinanciamento ao Terrorismo (PLD-FTP). Você será responsável por desenvolver estudos, cenários e modelos de machine Learning, fornecer insights estratégicos e apoiar a melhoria contínua das estratégias dePLD-FTP.Responsabilidades e atribuições:Manipular grandes volumes de dados, construir cenários e modelos de machine Learning paraPLD-FTP;Criardashboards automatizados e relatóriospara otimizar processos;Identificar padrões, tendências e gerar insights para a melhoria contínua das estratégias de mitigação de riscos;Pensamento analíticoe capacidade deresolver problemas complexoscom dados;Proatividadeeautonomiapara implementar soluções inovadoras;Habilidade de comunicaçãopara interagir com diversas áreas da empresa;Capacidade depropor soluçõesmatemáticas para problemas concretos da realidade;Capacidade de trabalhar sob pressão e gerenciar múltiplos projetos simultaneamente.Requisitos e qualificações:Solida experiênciaem estatística descritiva, inferencial e análise de dados;Domíniode linguagens como:SQL, RouPySpark;Experiência em áreas de:PLD-FTP, Regulatórias, Risco, Compliance ou Antifraude;Formação em:Ciência de Dados, Matemática, Estatística, Economia, Tecnologiaou áreas afins;Diferencial:MBA ou Pós-graduação emAnalyticsouCiência de Dados,conhecimento emprodutos financeirosePLD-FTP.Informações adicionais:No Daycoval, entendemos que cuidar de nossos colaboradores é essencial para promover um ambiente de trabalho saudável e produtivo. Por isso, oferecemos um pacote abrangente de benefícios, proporcionando não apenas estabilidade, mas também qualidade de vida. Nosso compromisso com o seu bem-estar vai além do profissionalismo, é uma extensão do respeito que temos por cada membro de nossa equipe.Benefícios que Valorizam Você:Participação nos Lucros e Resultados: Mediante resultados do banco, conforme convenção coletiva.Assistência Médica e Odontológica: Cobertura completa para cuidados médicos e odontológicos de qualidade.Vale-Refeição/AlimentaçãoSeguro de VidaAuxílio Creche: Apoio financeiro para conciliar trabalho e responsabilidades familiares.Apoio à Educação: Suporte para desenvolvimento acadêmico e profissional, investindo no seu desenvolvimento.Parcerias com Desconto: Vantagens exclusivas em uma variedade de produtos e serviços por meio de parcerias estratégicas.Folga assiduidade: Um dia livre para recarregar energias e equilibrar responsabilidadesTotalpass - Incentivo à Saúde: Acesso a uma ampla rede de atividades físicas, promovendo um estilo de vida ativo e saudável.Estamos cheios de desafios, e convidamos você a fazer parte dessa jornada de sucesso, onde#vemserDaycovalé mais do que um convite, é um chamado para fazer história.Show moreShow less",,On-site/Hybrid,https://www.linkedin.com/jobs-guest/jobs/api/jobPosting/4342179375,2025-12-27,"Cientista de Dados - Sênior (Foco em PLD-FTP) Descrição da vagaBuscamos umAnalista Sênior de Ciência de Dadospara transformar dados em estratégias de mitigação de riscos, com foco emPrevenção à Lavagem de Dinheiro eFinanciamento ao Terrorismo (PLD-FTP). Você será responsável por desenvolver estudos, cenários e modelos de machine Learning, fornecer insights estratégicos e apoiar a melhoria contínua das estratégias dePLD-FTP.Responsabilidades e atribuições:Manipular grandes volumes de dados, construir cenários e modelos de machine Learning paraPLD-FTP;Criardashboards automatizados e relatóriospara otimizar processos;Identificar padrões, tendências e gerar insights para a melhoria contínua das estratégias de mitigação de riscos;Pensamento analíticoe capacidade deresolver problemas complexoscom dados;Proatividadeeautonomiapara implementar soluções inovadoras;Habilidade de comunicaçãopara interagir com diversas áreas da empresa;Capacidade depropor soluçõesmatemáticas para problemas concretos da realidade;Capacidade de trabalhar sob pressão e gerenciar múltiplos projetos simultaneamente.Requisitos e qualificações:Solida experiênciaem estatística descritiva, inferencial e análise de dados;Domíniode linguagens como:SQL, RouPySpark;Experiência em áreas de:PLD-FTP, Regulatórias, Risco, Compliance ou Antifraude;Formação em:Ciência de Dados, Matemática, Estatística, Economia, Tecnologiaou áreas afins;Diferencial:MBA ou Pós-graduação emAnalyticsouCiência de Dados,conhecimento emprodutos financeirosePLD-FTP.Informações adicionais:No Daycoval, entendemos que cuidar de nossos colaboradores é essencial para promover um ambiente de trabalho saudável e produtivo. Por isso, oferecemos um pacote abrangente de benefícios, proporcionando não apenas estabilidade, mas também qualidade de vida. Nosso compromisso com o seu bem-estar vai além do profissionalismo, é uma extensão do respeito que temos por cada membro de nossa equipe.Benefícios que Valorizam Você:Participação nos Lucros e Resultados: Mediante resultados do banco, conforme convenção coletiva.Assistência Médica e Odontológica: Cobertura completa para cuidados médicos e odontológicos de qualidade.Vale-Refeição/AlimentaçãoSeguro de VidaAuxílio Creche: Apoio financeiro para conciliar trabalho e responsabilidades familiares.Apoio à Educação: Suporte para desenvolvimento acadêmico e profissional, investindo no seu desenvolvimento.Parcerias com Desconto: Vantagens exclusivas em uma variedade de produtos e serviços por meio de parcerias estratégicas.Folga assiduidade: Um dia livre para recarregar energias e equilibrar responsabilidadesTotalpass - Incentivo à Saúde: Acesso a uma ampla rede de atividades físicas, promovendo um estilo de vida ativo e saudável.Estamos cheios de desafios, e convidamos você a fazer parte dessa jornada de sucesso, onde#vemserDaycovalé mais do que um convite, é um chamado para fazer história.Show moreShow less",Sênior,Não especificado,Não especificado,0
"Cientista de Dados Júnior, Crédito, Exclusiva para Pessoa com Deficiência [Remoto]",PicPay,"São Paulo, São Paulo, Brazil",1 day ago,"Sobre o PicPayCom mais de dez anos de história, o PicPay é um ecossistema completo de serviços financeiros e não-financeiros que tem como objetivo atender as necessidades diárias de milhares de pessoas e negócios, tornando-se a sua principal conta do dia a dia.Fundada em Vitória (ES), a empresa já conta com mais de 35 milhões de clientes ativos e faz parte do grupo J&F, um dos maiores conglomerados empresariais do Brasil. A companhia atua em diversas frentes, como Serviços Financeiros para Pessoa Física, Serviços Financeiros para Pessoa Jurídica, Investimentos e PicPay Shop.Pautados pela nossa cultura, seguimos no propósito de dar muito mais pique para a vida de milhões de brasileiros. Conheça nossos valores: Atitude de Dono(a), Disciplina, Determinação, Disponibilidade, Simplicidade, Humildade e Franqueza.O respeito, a ética, a busca pela equidade e a valorização da pluralidade são elementos inegociáveis e fazem parte da prática no nosso dia a dia aqui no PicPay. Por isso, esta vaga está aberta para todas as pessoas, independente de gênero, religião, etnia, deficiência, idade, orientação sexual ou qualquer outro fator.Conheça melhor a unidade de negócio que essa vaga pertence:Estamos em busca de umCientista de Dados Júniorpara integrar nosso time deCrédito. Esse profissional será responsável pelo desenvolvimento de modelos estatísticos massificados que serão utilizados pelas políticas de crédito e na condução de estudos analíticos gerais. O profissional atuará de forma autônoma e colaborativa, focando prover soluções baseadas em dados/AI na tomada de decisões garantindo modelos de qualidade e consistentes. O ambiente é dinâmico e o profissional terá que se relacionar com áreas de engenharia e negócios no decorrer dos projetos.Responsabilidade e atribuições:Trabalhar com dados brutos, para desenvolver novas features e book de dados para uso em modelos e estudos;Desenvolver novos modelos de avaliação de risco e renda presumida;Participar da entrega de ponta a ponta: desde o entendimento das informações/necessidades junto ao time de políticas/negócios até os testes/aplicação dos modelos em estratégias de crédito em produção;Realizar homologações prévias de suas construções, assegurando os resultados esperados e alcançando a máxima velocidade na execução dos desenvolvimentos;Realizar estudos analíticos de comportamento de público, inadimplência, contratação;Identificar e atuar proativamente em melhorias de processos/desenvolvimentos e em novas metodologias analíticas.Requisitos e qualificações:Conhecimentos em modelagem geral: bancos, seguradoras, telecomms, varejo em geral etc;Experiência em Crédito (conhecimentos em Modelagem, Indicadores, Estratégias, Estudos Ad-hocs, etc.);Experiência com algoritmos de machine learning (árvores, ensemble models, redes neurais, etc)Experiência em programação com linguagens e experiência em manipulação de grandes volumes de dados (preferencialmente: python, pyspark, pandas e sql);Capacidade de traduzir dados em storytelling, um problema de negócios em análises e soluções técnicas/processuais;Ter boa base de estatística e matemática;Comunicação efetiva e gerenciamento eficaz do tempo;Colaboração e trabalho em equipe;Foco na melhoria contínua, com orientação para resultados.O que oferecemos:Saúde e Bem-estarAssistência Médica e Odontológica;Seguro de Vida;Programa Lado a Lado, com apoio jurídico, social, psicológico e financeiro;Wellhub.Alimentação/ Mobilidade ou Teletrabalho:Cartão de crédito PicPay Benefícios, com ampla aceitação, onde você recebe seu saldo de Alimentação/Refeição e Mobilidade ou Teletrabalho (de acordo com o seu contrato de trabalho).Licença Paternidade e Maternidade:Licença Maternidade estendida de 6 meses, e de Paternidade também estendida de 20 dias.Programa ""Novo Ser"", que acompanha nossas mamães durante toda a gestação e no retorno da licença. Falando nisso, ao retornar da licença maternidade, as mamães ainda contam com a ajuda do Auxílio Creche e também os papais que possuem guarda unilateral ou compartilhada.Reconhecemos resultados: PPR-Participação nos Resultados do PicPay.#VemserPicpayLover #PicpayShow moreShow less",,On-site/Hybrid,https://www.linkedin.com/jobs-guest/jobs/api/jobPosting/4342201647,2025-12-27,"Cientista de Dados Júnior, Crédito, Exclusiva para Pessoa com Deficiência [Remoto] Sobre o PicPayCom mais de dez anos de história, o PicPay é um ecossistema completo de serviços financeiros e não-financeiros que tem como objetivo atender as necessidades diárias de milhares de pessoas e negócios, tornando-se a sua principal conta do dia a dia.Fundada em Vitória (ES), a empresa já conta com mais de 35 milhões de clientes ativos e faz parte do grupo J&F, um dos maiores conglomerados empresariais do Brasil. A companhia atua em diversas frentes, como Serviços Financeiros para Pessoa Física, Serviços Financeiros para Pessoa Jurídica, Investimentos e PicPay Shop.Pautados pela nossa cultura, seguimos no propósito de dar muito mais pique para a vida de milhões de brasileiros. Conheça nossos valores: Atitude de Dono(a), Disciplina, Determinação, Disponibilidade, Simplicidade, Humildade e Franqueza.O respeito, a ética, a busca pela equidade e a valorização da pluralidade são elementos inegociáveis e fazem parte da prática no nosso dia a dia aqui no PicPay. Por isso, esta vaga está aberta para todas as pessoas, independente de gênero, religião, etnia, deficiência, idade, orientação sexual ou qualquer outro fator.Conheça melhor a unidade de negócio que essa vaga pertence:Estamos em busca de umCientista de Dados Júniorpara integrar nosso time deCrédito. Esse profissional será responsável pelo desenvolvimento de modelos estatísticos massificados que serão utilizados pelas políticas de crédito e na condução de estudos analíticos gerais. O profissional atuará de forma autônoma e colaborativa, focando prover soluções baseadas em dados/AI na tomada de decisões garantindo modelos de qualidade e consistentes. O ambiente é dinâmico e o profissional terá que se relacionar com áreas de engenharia e negócios no decorrer dos projetos.Responsabilidade e atribuições:Trabalhar com dados brutos, para desenvolver novas features e book de dados para uso em modelos e estudos;Desenvolver novos modelos de avaliação de risco e renda presumida;Participar da entrega de ponta a ponta: desde o entendimento das informações/necessidades junto ao time de políticas/negócios até os testes/aplicação dos modelos em estratégias de crédito em produção;Realizar homologações prévias de suas construções, assegurando os resultados esperados e alcançando a máxima velocidade na execução dos desenvolvimentos;Realizar estudos analíticos de comportamento de público, inadimplência, contratação;Identificar e atuar proativamente em melhorias de processos/desenvolvimentos e em novas metodologias analíticas.Requisitos e qualificações:Conhecimentos em modelagem geral: bancos, seguradoras, telecomms, varejo em geral etc;Experiência em Crédito (conhecimentos em Modelagem, Indicadores, Estratégias, Estudos Ad-hocs, etc.);Experiência com algoritmos de machine learning (árvores, ensemble models, redes neurais, etc)Experiência em programação com linguagens e experiência em manipulação de grandes volumes de dados (preferencialmente: python, pyspark, pandas e sql);Capacidade de traduzir dados em storytelling, um problema de negócios em análises e soluções técnicas/processuais;Ter boa base de estatística e matemática;Comunicação efetiva e gerenciamento eficaz do tempo;Colaboração e trabalho em equipe;Foco na melhoria contínua, com orientação para resultados.O que oferecemos:Saúde e Bem-estarAssistência Médica e Odontológica;Seguro de Vida;Programa Lado a Lado, com apoio jurídico, social, psicológico e financeiro;Wellhub.Alimentação/ Mobilidade ou Teletrabalho:Cartão de crédito PicPay Benefícios, com ampla aceitação, onde você recebe seu saldo de Alimentação/Refeição e Mobilidade ou Teletrabalho (de acordo com o seu contrato de trabalho).Licença Paternidade e Maternidade:Licença Maternidade estendida de 6 meses, e de Paternidade também estendida de 20 dias.Programa ""Novo Ser"", que acompanha nossas mamães durante toda a gestação e no retorno da licença. Falando nisso, ao retornar da licença maternidade, as mamães ainda contam com a ajuda do Auxílio Creche e também os papais que possuem guarda unilateral ou compartilhada.Reconhecemos resultados: PPR-Participação nos Resultados do PicPay.#VemserPicpayLover #PicpayShow moreShow less",Júnior,Não especificado,Não especificado,2
Estágio em Cientista de Dados - Vaga afirmativa para pessoas negras,Artefact,"São Paulo, São Paulo, Brazil",1 day ago,"A abertura atual é para a Artefact do Brasil, estamos em modelo Free Office.Quem nós somosNós da Artefact LatAm acreditamos e vivemos uma cultura com base na empatia!Um ambiente de trabalho saudável é um lugar onde todas as vozes são ouvidas, respeitadas e valorizadas.Temos como nosso compromisso a construção de um ambiente mais diverso e inclusivo, porque a empatia é para todas as pessoas, independentemente de etnia, cor, gênero, orientação sexual, identidade de gênero, deficiência ou crença religiosa.Queremos conosco mentes e corações incríveis! Venha ser Artefact!O Que Você Estará FazendoVocê se juntará à nossa equipe de Dados e Consultoria, que ajuda os clientes a transformar e melhorar sua estratégia de dados aplicando análises avançadas para gerar insights que criam valor de negócio a partir de big data e inteligência artificial.Inovar. Você trabalhará com sua equipe, composta por consultores, cientistas de dados, e engenheiros, para identificar as necessidades dos clientes e definir soluções inovadoras.Aprender e Compartilhar. Você trabalhará em uma equipe colaborativa que promove o compartilhamento de conhecimento. Você aprenderá com outras pessoas, compartilhará conhecimento e ficará a par das novidades/atualizações do setor.Desenvolver. Você participará da solução do início ao fim. Com o auxílio de cientistas seniores você gerenciará a concepção e a implementação, além de otimizar o desempenho e a escalabilidade.Atuar em toda a cadeia de valor dos projetos (coleta e tratamento de dados, análise exploratória de dados, aplicação de modelos de aprendizado de máquina, produtização de modelos)Popularizar termos técnicos ou soluções para perfis mais orientados a negócios, pode trabalhar em uma equipe com perfis muito diversificadosPriorizar suas tarefas, respeitar prazos e se levantar a mão em caso de riscos ou problemasO Que Nós Estamos ProcurandoEstar cursando um curso de graduação em ciência de dados, aprendizado de máquina, matemática, ciência da computação, estatística, engenharia, economia ou uma área relacionada.Desejável um primeiro conhecimento em estatística e programação (Python/R).Curiosidade: você está sempre buscando soluções inovadoras para seus clientes, você está envolvido em toda a cadeia de valorColaboração: o compartilhamento de conhecimento é essencial para você e você participa ativamente da difusão de informações dentro da ArtefactEmpreendedorismo: você traz soluções, novas ideias, inovaçõesO que oferecemosVR/VTFree office (trabalhe de casa ou de onde quiser!)GympassSeguros: Vida, saúde e odontológicoEncontros Bimestrais (Famoso “Get Together” onde nos encontramos para estarmos juntos, com oficinas, palestras, treinamentos e aquele happy hour!)Woba (pode marcar para trabalhar em coworking onde quiser!)Avaliações semestrais (com oportunidade de promoção)Por que você deveria se juntar a nósArtefact é o lugar para estar: venha e construa o futuro da área de dadosProgresso: cada dia oferece novos desafios e novas oportunidades de aprenderCultura: Empatia e Colaboração está no nosso DNAEmpreendedorismo: você se juntará a uma equipe de empreendedores motivados. Não desistiremos até que façamos uma grande diferença nesta indústria!Junte-se a nós!Show moreShow less",,On-site/Hybrid,https://www.linkedin.com/jobs-guest/jobs/api/jobPosting/4308602055,2025-12-27,"Estágio em Cientista de Dados - Vaga afirmativa para pessoas negras A abertura atual é para a Artefact do Brasil, estamos em modelo Free Office.Quem nós somosNós da Artefact LatAm acreditamos e vivemos uma cultura com base na empatia!Um ambiente de trabalho saudável é um lugar onde todas as vozes são ouvidas, respeitadas e valorizadas.Temos como nosso compromisso a construção de um ambiente mais diverso e inclusivo, porque a empatia é para todas as pessoas, independentemente de etnia, cor, gênero, orientação sexual, identidade de gênero, deficiência ou crença religiosa.Queremos conosco mentes e corações incríveis! Venha ser Artefact!O Que Você Estará FazendoVocê se juntará à nossa equipe de Dados e Consultoria, que ajuda os clientes a transformar e melhorar sua estratégia de dados aplicando análises avançadas para gerar insights que criam valor de negócio a partir de big data e inteligência artificial.Inovar. Você trabalhará com sua equipe, composta por consultores, cientistas de dados, e engenheiros, para identificar as necessidades dos clientes e definir soluções inovadoras.Aprender e Compartilhar. Você trabalhará em uma equipe colaborativa que promove o compartilhamento de conhecimento. Você aprenderá com outras pessoas, compartilhará conhecimento e ficará a par das novidades/atualizações do setor.Desenvolver. Você participará da solução do início ao fim. Com o auxílio de cientistas seniores você gerenciará a concepção e a implementação, além de otimizar o desempenho e a escalabilidade.Atuar em toda a cadeia de valor dos projetos (coleta e tratamento de dados, análise exploratória de dados, aplicação de modelos de aprendizado de máquina, produtização de modelos)Popularizar termos técnicos ou soluções para perfis mais orientados a negócios, pode trabalhar em uma equipe com perfis muito diversificadosPriorizar suas tarefas, respeitar prazos e se levantar a mão em caso de riscos ou problemasO Que Nós Estamos ProcurandoEstar cursando um curso de graduação em ciência de dados, aprendizado de máquina, matemática, ciência da computação, estatística, engenharia, economia ou uma área relacionada.Desejável um primeiro conhecimento em estatística e programação (Python/R).Curiosidade: você está sempre buscando soluções inovadoras para seus clientes, você está envolvido em toda a cadeia de valorColaboração: o compartilhamento de conhecimento é essencial para você e você participa ativamente da difusão de informações dentro da ArtefactEmpreendedorismo: você traz soluções, novas ideias, inovaçõesO que oferecemosVR/VTFree office (trabalhe de casa ou de onde quiser!)GympassSeguros: Vida, saúde e odontológicoEncontros Bimestrais (Famoso “Get Together” onde nos encontramos para estarmos juntos, com oficinas, palestras, treinamentos e aquele happy hour!)Woba (pode marcar para trabalhar em coworking onde quiser!)Avaliações semestrais (com oportunidade de promoção)Por que você deveria se juntar a nósArtefact é o lugar para estar: venha e construa o futuro da área de dadosProgresso: cada dia oferece novos desafios e novas oportunidades de aprenderCultura: Empatia e Colaboração está no nosso DNAEmpreendedorismo: você se juntará a uma equipe de empreendedores motivados. Não desistiremos até que façamos uma grande diferença nesta indústria!Junte-se a nós!Show moreShow less",Sênior,Não especificado,Não especificado,4
