title,company,location,posted,description,applicants,work_mode,link,data_coleta
Pessoa Cientista de Dados - Vaga afirmativa para pessoas LGBTQIAPN+,Artefact,"São Paulo, São Paulo, Brazil",2 weeks ago,"A abertura atual é para a Artefact do Brasil, estamos em modelo Free Office.Quem nós somosNós da Artefact LatAm acreditamos e vivemos uma cultura com base na empatia!Um ambiente de trabalho saudável é um lugar onde todas as vozes são ouvidas, respeitadas e valorizadas.Temos como nosso compromisso a construção de um ambiente mais diverso e inclusivo, porque a empatia é para todas as pessoas, independentemente de etnia, cor, gênero, orientação sexual, identidade de gênero, deficiência ou crença religiosa.Queremos conosco mentes e corações incríveis! Venha ser Artefact!O Que Você Estará FazendoVocê se juntará à nossa equipe de Dados e Consultoria, que ajuda os clientes a transformar e melhorar sua estratégia de dados aplicando análises avançadas para gerar insights que criam valor de negócio a partir de big data e inteligência artificial.Inovar. Você trabalhará com sua equipe, composta por consultores, cientistas de dados, e engenheiros, para identificar as necessidades dos clientes e definir soluções inovadoras.Aprender e Compartilhar. Você trabalhará em uma equipe colaborativa que promove o compartilhamento de conhecimento. Você aprenderá com outras pessoas, compartilhará conhecimento e ficará a par das novidades/atualizações do setor.Desenvolver. Você participará da solução do início ao fim. Com o auxílio de cientistas seniores você gerenciará a concepção e a implementação, além de otimizar o desempenho e a escalabilidade.Atuar em toda a cadeia de valor dos projetos (coleta e tratamento de dados, análise exploratória de dados, aplicação de modelos de aprendizado de máquina, produtização de modelos)Popularizar termos técnicos ou soluções para perfis mais orientados a negócios, pode trabalhar em uma equipe com perfis muito diversificadosPriorizar suas tarefas, respeitar prazos e se levantar a mão em caso de riscos ou problemasO Que Nós Estamos ProcurandoTer cursado um curso de graduação em ciência de dados, aprendizado de máquina, matemática, ciência da computação, estatística, engenharia, economia ou uma área relacionada.Desejável um primeiro conhecimento em estatística e programação (Python/R).Curiosidade: você está sempre buscando soluções inovadoras para seus clientes, você está envolvido em toda a cadeia de valorColaboração: o compartilhamento de conhecimento é essencial para você e você participa ativamente da difusão de informações dentro da ArtefactEmpreendedorismo: você traz soluções, novas ideias, inovaçõesO que oferecemosVR/VTFree office (trabalhe de casa ou de onde quiser!)GympassSeguros: Vida, saúde e odontológicoEncontros Bimestrais (Famoso “Get Together” onde nos encontramos para estarmos juntos, com oficinas, palestras, treinamentos e aquele happy hour!)Woba (pode marcar para trabalhar em coworking onde quiser!)Avaliações semestrais (com oportunidade de promoção)Por que você deveria se juntar a nósArtefact é o lugar para estar: venha e construa o futuro da área de dadosProgresso: cada dia oferece novos desafios e novas oportunidades de aprenderCultura: Empatia e Colaboração está no nosso DNAEmpreendedorismo: você se juntará a uma equipe de empreendedores motivados. Não desistiremos até que façamos uma grande diferença nesta indústria!Junte-se a nós!Show moreShow less",N/A,On-site/Hybrid,https://www.linkedin.com/jobs-guest/jobs/api/jobPosting/4283431002,2025-10-13
Deep Learning Engineer - 1 Vaga,Board Academy Ceará,"São Paulo, São Paulo, Brazil",3 weeks ago,"A Board Academy é um time apaixonado por inovação e transformação.Somos uma empresa especializada na Formação, Desenvolvimento e Certificação de Conselheiros, criada para revolucionar o modelo tradicional de desenvolvimento de conselheiros. Nossa proposta é disruptiva e, ao mesmo tempo, busca democratizar o acesso às posições nos Conselhos de Empresas.Acreditamos que a formação profissional é essencial para a disseminação das boas práticas de governança corporativa e pode ser um grande diferencial na geração de valor e no sucesso dos negócios.Missão do CargoBuscamos um Deep Learning Engineer para atuar no desenvolvimento de soluções baseadas em inteligência artificial com foco em redes neurais profundas. Essa pessoa será responsável por estruturar, treinar e otimizar modelos de deep learning aplicados às nossas soluções educacionais, operacionais e estratégicas.Se você tem paixão por IA, gosta de construir soluções escaláveis e quer gerar impacto real com tecnologia de ponta, essa vaga é para você!Responsabilidades e AtribuiçõesDesenvolver, treinar e implementar modelos de deep learning aplicados a problemas reais de negócio;Trabalhar com dados estruturados e não estruturados (texto, imagem, voz);Colaborar com times de produto, dados e negócios para identificar oportunidades de aplicação de IA;Monitorar e melhorar a performance de modelos em produção;Documentar processos e garantir reprodutibilidade e boas práticas de engenharia de IA;Acompanhar avanços da área e propor inovações tecnológicas para o Board AI.RequirementsSólida experiência com desenvolvimento de modelos de deep learning (CNN, RNN, Transformers etc.);Domínio de bibliotecas como TensorFlow, PyTorch ou similares;Experiência prática com tratamento de dados, pré-processamento e pipelines de machine learning;Conhecimentos em MLOps, versionamento de modelos e deploy em ambientes de produção;Familiaridade com nuvens públicas (AWS, GCP ou Azure) e ferramentas de CI/CD;Diferencial: experiência com LLMs (Large Language Models) e NLP.Show moreShow less",N/A,On-site/Hybrid,https://www.linkedin.com/jobs-guest/jobs/api/jobPosting/4303951648,2025-10-13
Analista de Dados Saúde e Odonto Jr,SulAmérica,"São Paulo, São Paulo, Brazil",5 days ago,"DescriçãoPara o match perfeito acontecer precisa de PESSOAS, com as mais diversas experiências e pontos de vista, para que possamos continuar evoluindo enquanto empresa.Por isso, aqui na SulAmérica, incentivamos a candidatura de pessoas de todas as raças/etnias, orientações sexuais, identidades de gênero, gerações, com ou sem deficiência, para todas as nossas vagas. Afinal, as nossas diferenças é o que nos complementam!#LGBTQI+ #PessoasNegras #PcD #50+ #Gerações #PessoasComDeficiênciaComo Será o Seu Dia a Dia Nessa ÁreaDesenvolver estudos e indicadores sob supervisão para auxílio na tomada de decisãoDesenvolver dashboards interativos que facilitem a análise visual e acompanhamento de indicadoresRealizar manipulação de dados, tratamento, modelagem e validação de basesRealizar as rotinas de dados da área (atualizar bases de dados, relatórios, dashboards)Automatizar/Otimizar processos da área através de algoritmosAtuar em projetos da gerênciaDesenvolver simuladores que permitam calcular de forma prática, responsiva, dinâmica e confiávelDocumentar os processosAtuar em demandas oriundas do e-mail corporativoRequisitos necessários para atuar como Analista de Dados Saúde e Odonto Jr na #SulA:Conhecimento em banco de dados, SQL, modelagem de dados, conceitos (fato x dimensão), Google Cloud, Excel Avançado, Python,data viz (Looker Studio, Power BI, Tableau, etc).Ensino superior cursando ou completo.Disponibilidade para trabalhar 3x por semana presencial na Paulista.Show moreShow less",N/A,On-site/Hybrid,https://www.linkedin.com/jobs-guest/jobs/api/jobPosting/4310970842,2025-10-13
Data Scientist - Fluent English,Artefact,"São Paulo, São Paulo, Brazil",2 weeks ago,"A abertura atual é para a Artefact do Brasil, estamos em modelo Free Office.Who We AreAt Artefact Brasil, we believe in and live a culture based on empathy!A healthy work environment is a place where all voices are heard, respected, and valued.We are committed to building a more diverse and inclusive environment, because empathy is for everyone, regardless of ethnicity, color, gender, sexual orientation, gender identity, disability, or religious belief.We want incredible minds and hearts with us!Come and be Artefact!What You Will Be DoingYou will join our Data and Consulting team, which helps clients transform and improve their data strategy by applying advanced analytics to generate insights that create business value from big data and artificial intelligence.Innovate. You will work with your team, consisting of consultants, data scientists, and engineers, to identify client needs and define innovative solutions.Learn and Share. You will work in a collaborative team that promotes knowledge sharing. You will learn from others, share knowledge, and stay up to date with industry news/updatesDevelop. You will be involved in the solution from start to finish. With the help of senior scientists, you will manage the design and implementation, as well as optimize performance and scalability.Work across the entire project value chain (data collection and processing, exploratory data analysis, application of machine learning models, model production)Demystify technical terms or solutions for more business-oriented profiles, can work in a team with very diverse profilesPrioritize your tasks, respect deadlines, and raise your hand in case of risks or problemsWhat We Are Looking ForHaving completed an undergraduate course in data science, machine learning, mathematics, computer science, statistics, engineering, economics, or a related field.Desirable a first knowledge in statistics and programming (Python/R).Curiosity: you are always looking for innovative solutions for your clients. You are involved in the entire value chain.Collaboration: knowledge sharing is essential for you and you actively participate in the dissemination of information within Artefact.Entrepreneurship: you bring solutions, new ideas, innovations.Fluent English: You are comfortable communicating in English, as it is essential for working in our international environmentWhat We OfferVR/VTFree office (work from home or wherever you want!)GympassInsurances: Life, health, and dentalBi-monthly Meetings (The famous “Get Together” where we meet to be together, with workshops, lectures, training, and that happy hour!)Woba (you can choose to work in coworking wherever you want!)Semi-annual evaluations (with promotion opportunity)Why You Should Join UsA Master’s degree in machine learning, mathematics, computer science, or related fieldsHands-on experience developing and applying data-driven solutions in a corporate or consulting setting, preferably in a consumer marketing context (experience in the web industry is a plus)Strong knowledge of data processing, data modeling, algorithms, and data architectureIntellectual curiosity and excellent problem-solving skills, including the ability to structure and prioritise an approach for maximum impactWhy you should join usArtefact is the place to be: come and build the future of the data fielProgress: every day offers new challenges and new learning opportunitiesCulture: Empathy and Collaboration are in our DNAEntrepreneurship: you will join a team of motivated entrepreneurs. We won't give up until we make a big difference in this industry!Join us!Show moreShow less",N/A,On-site/Hybrid,https://www.linkedin.com/jobs-guest/jobs/api/jobPosting/4283430082,2025-10-13
Cientista de Dados SR,Mitsui Sumitomo Seguros,"São Paulo, São Paulo, Brazil",6 days ago,"DESCRIÇÃOPrincipais ResponsabilidadesLiderar análises exploratórias e estudos estatísticos para identificar padrões, tendências e oportunidades de negócioProjetar, desenvolver e validar modelos estatísticos e algoritmos de machine learning, com foco em soluções preditivas aplicadas a segurosAtuar na integração, transformação e enriquecimento de dados oriundos de diferentes fontes (estruturadas e não estruturadas) utilizando ferramentas modernas (ex: Spark, SQL, Python, R)Colaborar na definição e implementação da arquitetura analítica da companhia, incluindo boas práticas em Databricks, Delta LakeConstruir dashboards e relatórios analíticos interativos com foco em indicadores estratégicos e monitoramento de modelos, utilizando Power BITrabalhar em parceria com equipes de negócio, conectando desafios corporativos a soluções orientadas por dadosApoiar a disseminação da cultura data-driven e contribuir para a evolução técnica do time, mentorando profissionais menos experientesParticipar ativamente em projetos de inovação que envolvam Inteligência Artificial, automação analítica e melhoria contínuaManter-se atualizado sobre tendências, ferramentas e frameworks modernos em ciência de dados, IA e big data.Pré-RequisitosGraduação completa em Ciência de Dados, Estatística, Engenharia, Matemática, Computação ou áreas correlatasPós-graduação ou MBA na área será considerado diferencial.BenefíciosModelo de Trabalho Híbrido (3 vezes presencial)VR e VAPrevidênciaAssistência MédicaAssistência OdontológicaSeguro de vidaAuxílio creche/ babáAuxílio aos filhos deficientes ou com necessidades especiais – PCD - comprovados -creche/ babáSexta FlexDay Off de aniversárioHorário flexívelCONEXA - (telepsicologia e telenutrição)Cursos na nossa plataforma MSS DesenvolveTotal PassIsenção de tarifa bancária e anuidade de cartão ItaúLocal de trabalho: São Paulo, SPRegime de contratação de tipo: Efetivo – CLTJornada: Período IntegralNível hierárquico: AnalistaREQUISITOSEscolaridade Mínima: Ensino SuperiorShow moreShow less",N/A,On-site/Hybrid,https://www.linkedin.com/jobs-guest/jobs/api/jobPosting/4311354133,2025-10-13
Front End - AI,Safra,"São Paulo, São Paulo, Brazil",1 month ago,"Estamos desenvolvendo a Plataforma de Inteligência Artificial do Banco Safra, criando produtos e serviços que viabilizam o uso de IA em escala. Nosso foco é acelerar a adoção da tecnologia por times de engenharia e áreas de negócio, promovendo eficiência, inovação e melhor experiência para colaboradores e clientes.Responsabilidades e atribuiçõesResponsável pelo desenvolvimento de soluções de Inteligência Artificial que habilitam o uso da tecnologia em escala. As principais atividades incluem o design e implementação Interfaces Web e componentes da Plataforma de IA, garantindo escalabilidade, segurança e usabilidade. O profissional atuará em colaboração com times de engenharia e áreas de negócio, contribuindo para a evolução da arquitetura e das práticas de desenvolvimento da área.Profissionais com sólida experiência em desenvolvimento front-end, incluindo design e implementação de interfaces web responsivas, UX, código limpo e integração com APIs. É desejável conhecimento em desenvolvimento de APIs, boas práticas de engenharia de software. Experiência prática com integração de modelos de IA Generativa em produtos ou serviços será considerada um diferencial. Buscamos perfis analíticos, com visão estratégica e capacidade de colaborar em ambientes multidisciplinares e de alta complexidade técnica.Requisitos e qualificaçõesIndispensável:Experiência com Angular para desenvolvimento Front-end.Conhecimento em UX / UI.Práticas consolidadas de versionamento de código, testes automatizados e CI/CDExperiência com ambientes de cloud computing (ex: AWS, GCP, Azure)Familiaridade com documentação e APIs Rest.Desejável:Experiência com IA Generativa e integração com modelos via APIConhecimento em Vector Stores e técnicas de recuperação de contextoDesenvolvimento de Agentes baseados em IAFamiliaridade com protocolos abertos de comunicação (ex: MCP, A2A)Informações adicionaisTrilhas de capacitação acadêmica e técnica;Oportunidade de encarreiramento;Vale Refeição e Vale Alimentação;Vale Transporte;Convênio médico e odontológico;Seguro de Vida;Condições especiais em nossos produtos financeiros;Auxílio Creche / Babá;Incentivo educacional;Totalpass;J. Safra Clube (descontos em farmácias, lazer, bem estar e saúde, educação, colônia de férias no litoral Sul de São Paulo).Show moreShow less",N/A,On-site/Hybrid,https://www.linkedin.com/jobs-guest/jobs/api/jobPosting/4286171969,2025-10-13
Cientista de Dados Pleno,Porto,"São Paulo, São Paulo, Brazil",5 days ago,"Descrição da vagaNossa área é responsável por desenvolver modelos estatísticos, segmentações esoluções com modelos de GenAI. Trabalhamos diretamente com as diretorias de Produtos, Riscos, Comercial e Atendimento, traduzindo dados em estratégias de negócio que geram valor. Você terá a oportunidade de atuar em projetos de ponta a ponta, levando evolução e inteligência para o negócio.Responsabilidades e atribuiçõesDesenvolver modelos estatísticos, segmentações e soluções de alta complexidade e impacto para as mais diversas áreas de negócios da Porto Bank (Produtos, Riscos, Comercial, Cobrança e Atendimento)Entendimento dos problemas das áreas do BankMapeamento dos riscos e planejamento de projetos em etapas claras;Garantir a implementação dos modelos desenvolvidos junto com os times de MLOps;Construir storytelling do projeto para apresentar e garantir a usabilidade do modelo criado para as áreas do Bank;Desenvolvimento de estudos analiticos, com técnicas tradicionais, Machine Learning e GEN AI.Desenvolvimento e acompanhamento de implantação da feature store.Desenvolvimento e automatização de processos da área garantindo o aumento da produtividade.Requisitos e qualificaçõesEnsino Superior Completo em Estatística, Ciência de Dados, Matemática ou afinsExperiência sólida como Cientista de Dados, com atuação em projetos de modelagem estatística, machine learning e desenvolvimento de clusters/segmentações.Domínio em PySpark, Python e SQL para manipulação e análise de grandes volumes de dados.Experiência comprovada em ambiente Databricks ou plataformas de big data similares.Conhecimento em ferramentas de visualização e reporting, preferencialmente Power BI.Habilidade de comunicação fluida e de liderança em discussões técnicas e de negócio.Capacidade de planejar e gerenciar o próprio tempo e projetos com autonomia.Forte entendimento de negócio para conectar modelos a desafios reais e geração de valor.Informações adicionaisBENEFÍCIOSVale Alimentação e Refeição Flexíveis;Plano de Saúde;Plano Odontológico;Wellhub e TotalPass;Academia Bio Ritmo exclusiva para Colaboradores:no Complexo Matriz;Participação nos Lucros - PLR;Programa de Ações: Porto em Ação:complementar à PLR até 2025;Quadras de Areia e Poliesportiva:no Complexo Matriz;Vale-Transporte;Serviços de Transporte de Vans;disponibilizadas nas principais estações de acesso à Porto (Luz, Barra Funda, Santa Cecília e Júlio Prestes);Licença Parental Estendida:até 40 dias para todas as configurações familiares;Licença Maternidade Estendidade 6 meses.;Ambulatório Médico com Especialidades:no Complexo Matriz e Barra Funda;Auxílio creche ou babá;Seguro de Vida;Previdência Privada - PortoPrev;Desconto em Produtos e Serviços;Bolsa de estudos: Reembolso para graduação, pós ou MBA;Corridas mensais:subsídio para as principais corridas de ruas de São PauloReembolso para idiomas (inglês ou espanhol);Teatro Porto:sessões exclusivas para Colaboradores;Biblioteca;Sala de descanso:no completo MatrizSalão de jogos:no complexo MatrizServiços de massagem e podologia:no completo MatrizLocal de trabalho:Local (Atuamos com modelos híbridos, que serão explorados no processo seletivo);Na Porto, Você Importa!A Porto é muito mais que uma seguradora: é um ecossistema gigante que utiliza tecnologia para criar soluções, através de quatro verticais de negócio:Porto Bank, Porto Saúde, Porto Seguro e Porto Serviço.A reputação e o reconhecimento conquistados ao longo de mais de 7 décadas reforçam o tamanho da Porto, uma empresa referência em negócios, feita para e por pessoas.Aqui, bate no peito de 13 mil colaboradores oorgulho de fazer parte de uma organização sólida e ética,que transforma sonhos em realidades fantásticaspara os nossos mais de 15,8 milhões de clientes. São mais de 101 sucursais e escritórios regionais em todo o Brasil.O aprendizado faz parte do nosso DNA, e aqui, você teráincentivos, ferramentas e gente boa para você aprender e crescer, a cada dia,um ambiente de acolhimento e segurança, onde cada um possa ser e se orgulhar de quem se é, promovendo um espaço de respeito evivendo de forma integral e com bem-estar, em uma empresa genuinamente humana.DIVERSIDADE & INCLUSÃO NA PORTOAqui na Porto, valorizamos a diversidade e acreditamos que um time plural é imprescindível para o desenvolvimento de todo o nosso negócio, da sociedade, e de cada pessoa, pois entendemos que cada indivíduo é único na construção de um ambiente mais inovador e inclusivo. Juntos, trabalhamos diariamente para construirmos um espaço seguro, livre e acolhedor, com mais pluralidade e respeito. Por isso,incentivamos fortemente a inscrição de mulheres, de pessoas negras e indígenas, de pessoas com deficiência e de pessoas LGBTQIA+em todas as nossas vagas.Show moreShow less",N/A,On-site/Hybrid,https://www.linkedin.com/jobs-guest/jobs/api/jobPosting/4311739496,2025-10-13
Cientista de Dados Sênior - Prevenção a Fraudes,TotalPass Brasil,"São Paulo, São Paulo, Brazil",3 weeks ago,"DESCRIÇÃONosso time de Dados em Prevenção a Fraude atua de maneira analítica observando padrões e comportamentos para manter nosso aplicativo cada vez mais seguro. Hoje tem participação expressiva nos resultados da área de tecnologia. Trabalhamos em um ambiente que valoriza a comunicação aberta, a inovação e o desenvolvimento contínuo.Como Será o Seu Dia a DiaPlenejar, desenvolver e implementar modelos estatísticos e algoritmos de machine learning para detectar fraudes de forma escalável e com alta precisão.Fomentar a criação de segmentações comportamentais e análises preditivas, utilizando técnicas avançadas de modelagem.Analisar grandes volumes de dados, propondo estratégias e soluções para otimizar a prevenção a fraudes.Fornecer insights estratégicos para a liderança sobre tendências de fraude, comportamentos suspeitos e melhorias em processos.Mentorizar e treinar membros da equipe júnior e pleno, promovendo o compartilhamento de conhecimentos e melhores práticas.Trabalhar em colaboração com outras áreas para garantir que as soluções sejam alinhadas às necessidades de negócio e que os modelos se integrem eficientemente às plataformas e sistemas.Manter-se atualizado sobre as tendências e inovações no campo da prevenção a fraudes e implementar soluções de ponta.O Que Esperamos Que Você TenhaREQUISITOSExperiência avançada em linguagens de programação como Python, SQL, R, e frameworks de Machine Learning.Sólido conhecimento em manipulação de grandes volumes de dados e ambientes de nuvem, com foco em AWS.Capacidade de desenvolver e implementar modelos preditivos e de análise de dados de forma escalável e eficiente.Conhecimento em metodologias ágeis e experiência em ambientes de trabalho colaborativos.Formação acadêmica avançada em Estatística, Matemática, Ciência da Computação ou áreas relacionadas.Capacidade de tomar decisões baseadas em dados e resultados.Comunicação clara com stakeholders e capacidade de apresentar soluções estratégicas.Excelente capacidade de comunicação tanto técnica, quanto para públicos não técnicos.Visão crítica e de inovação para aprimorar processos e implementar novas abordagens.Regime de contratação de tipo: Efetivo – CLTJornada: Período IntegralNível hierárquico: AnalistaEscolaridade Mínima: Ensino SuperiorShow moreShow less",N/A,On-site/Hybrid,https://www.linkedin.com/jobs-guest/jobs/api/jobPosting/4301726573,2025-10-13
