title,company,location,posted,description,applicants,work_mode,link,data_coleta
CONSULTOR DE DATA SCIENCE SAO PAULO,Management Solutions,Greater São Paulo Area,3 weeks ago,"Management Solutions é uma firma internacional de consultoria focada em negócios, finanças, risco, organização, tecnologia e processos, tanto em seus componentes funcionais quanto na implementação de tecnologias relacionadas. Atualmente contamos com uma equipe multidisciplinar (funcional, matemática, técnica e integração de sistemas) de mais de 4.000 profissionais, que opera através de 50 escritórios (22 na Europa, 23 na América, 3 na Ásia, 1 na África e 1 na Oceania), de onde prestamos serviços recorrentes a clientes que operam em mais de 50 países nos cinco continentes (Europa, América, Ásia, África e Oceania)Para mais informações sobre a firma visite: www.managementsolutions.comFunções:Tratamento estatístico de dados (data mining)Modelagem preditiva através de técnicas de machine learning e de data scienceModelagem de eventos temporais (séries temporais, modelos ARIMA)Desenvolvimento de modelos de simulação (Monte Carlo)Revisão e validação de modelos de rating e scoring, RAROC e parâmetros de riscoApoio matemático ao negócio: desenvolvimento de algoritmos, estatística e probabilidadeProjetos de P&DBuscamos profissionais:Recém formados ou estudantesde último semestrede Matemática, Estatística, Física, Econometria, Ciências Atuariais ou Engenharia.Conhecimento de técnicas de modelagem(logit, GLM, séries temporais, árvores de decisão, random forests, clustering), linguagens de programação estatísticas (SAS, R, Python, Matlab) e ferramentas e plataformas de Big Data (Hadoop, Hive, etc.).Sólida trajetória acadêmica.Dinamismo, maturidade, responsabilidade e capacidade de trabalho.Nível de inglês intermediario.Valorizamos o conhecimento de outros idiomas, pós-graduação e cursos de especialização.Uso avançado de ferramentas de informática.Alta capacidade de aprendizagem.Facilidade deintegração em equipesmultidisciplinares.O que oferecemos:Oferecemos a possibilidade de te incorporares numa empresa que proporciona tudo o que é necessário para o máximo desenvolvimento profissional:Trabalhar nos projetos de consultoria mais relevantes do setor,para as maiores companhias, líderes nos seus respetivos mercados,junto do top management empresarial, perante os seus desafios nacionais e internacionais,com uma extraordinária equipa de profissionais, cujos valores e cultura corporativa são uma referência no setor.TreinamentoCursos de conhecimentos, cursos externos especializados, de habilidades e de idiomas.Durante o ano passado nossos profissionais investiram mais de 375.000 horas em treinamento a nível global, distribuídos em mais de 150 cursos.Todos os Seniores da Firma, cursam um Programa de Formação em Negócios, ministrado pelo INSPER.Plano de carreiraPromoção interna baseada no desempenho e potencial.Gestão baseada em partnership, oferecendo a cada profissional a meta de fazer parte do coletivo de sócios.Atividades complementaresUniversidade: mantemos uma estreita relação com as mais prestigiosas universidades a nível mundial.Ação Social: organizamos mais de 30 atividades solidárias a cada ano.Club Esportivo: organizamos campeonatos internos e participamos de competições externas.Na Management Solutions acreditamos na igualdade de oportunidades. Em nosso processo de seleção, todos os candidatos qualificados são igualmente considerados para emprego, independentemente de raça, cor, religião, origem nacional, sexo, identidade de gênero, orientação sexual, idade, estado civil, deficiência e qualquer outra característica protegida por lei.Complete nosso formulário de candidatura em: www.managementsolutions.comShow moreShow less",N/A,On-site/Hybrid,https://www.linkedin.com/jobs-guest/jobs/api/jobPosting/4212070973,2025-08-07
Data Scientist,H2O.ai,"Osasco, São Paulo, Brazil",3 weeks ago,"Founded in 2012, H2O.ai is on a mission to democratize AI. As the world’s leading agentic AI company, H2O.ai converges Generative and Predictive AI to help enterprises and public sector agencies develop purpose-built GenAI applications on their private data. Its open-source technology is trusted by over 20,000 organizations worldwide - including more than half of the Fortune 500 - H2O.ai powers AI transformation for companies like AT&T, Commonwealth Bank of Australia, Singtel, Chipotle, Workday, Progressive Insurance, and NIH.H2O.ai partners include Dell Technologies, Deloitte, Ernst & Young (EY), NVIDIA, Snowflake, AWS, Google Cloud Platform (GCP) and VAST. H2O.ai’s AI for Good program supports nonprofit groups, foundations, and communities in advancing education, healthcare, and environmental conservation. With a vibrant community of 2 million data scientists worldwide,H2O.aiaims to co-create valuable AI applications for all users.H2O.ai has raised $256 million from investors, including Commonwealth Bank, NVIDIA, Goldman Sachs, Wells Fargo, Capital One, Nexus Ventures and New York Life.About This OpportunityH2O.ai is at the forefront of the rapidly evolving MLOps landscape. We're leveraging MLOps to transform machine learning models from isolated, engineer-specific tools into robust, cloud-native services that are scalable and consistently available. Our approach is firmly rooted in Kubernetes, positioning our team at the cutting edge of cloud solutions.As a Customer Data Scientist in H2O.ai Professional Services team you will work closely with Data Science teams on the Customer side and Customer Success, Enterprise Support, Product Engineering and Sales teams on the H2O side.This position is based in Osasco, São Paulo with 3 to 4 weekly onsite visits to customer offices.What You Will DoDeliver data science and/or machine learning professional services to the customers. This will entail working closely with cross-functional teams to gather requirements, preprocess, and analyze data to develop data-driven solutions.Support customers by helping to build custom data models, transformation, scorers/optimization loss functions/metrics that can be leveraged with H2O Driverless AI and help improve training performance for the customer use cases/domains.Ability to design and run training sessions for our customers in data science concepts as well as using H2O products. Training will need to be able to be delivered to audiences with varying data science skills and abilities.Help customers understand the nuances of data science, expert settings of H2O Driverless AI and H2O open source, and the strategies of experiment tuning that you would use to incrementally improve model performance. This also includes explaining model performance, model interpretability, and post deployment model monitoring concepts so as to ensure the business is making the right decisions on the model predictions.Participate in the development of ML solutions and AI applications for internal use, contributing to the advancement of our technology stack.What We Are Looking ForProven experience in data science, machine learning, and AI with a minimum of 3-4 years of hands-on experience.Experience with solving machine learning problems using H2O products (plus), Python, RKnowledge and experience of using a variety of machine learning techniques (supervised/unsupervised, clustering, decision tree learning, neural networks, etc.) and their real-world advantages/drawbacks/tuning techniques.Knowledge and experience of using advanced statistical techniques and concepts (regression, properties of distributions, statistical tests and proper usage, etc.) for practical applications.Knowledge and experience in statistical and data mining techniques: GLM/Regression, Random Forest, Boosting, Trees, text mining, social network analysis, etc.Experience of visualizing and presenting (EDA) to stakeholders using H2O Wave (plus), or other standard data visualization libraries in the Python and R stacks or using Tableau/PowerBi.Understanding and experience with post production model monitoring concepts and tools like H2O ML Ops (plus) MLFlow etc.In depth understanding of machine learning algorithms and experience applying Gen AI/ML to solve real work problems, including deployment of end to end ML pipelinesInterest in Generative AI and Large Language Models (Prompt Engineering, Retrieval Augmented Generation, LLMOps, Making custom LLM models, fine tuning etc, Guardrails)Strong problem-solving skills and the ability to work independently and as part of a team.Excellent communication and presentation skills, with the ability to convey complex technical concepts to non-technical stakeholders.Why H2O.ai?Market Leader in Total RewardsRemote-Friendly CultureFlexible working environmentBe part of a world-class teamCareer GrowthH2O.ai is committed to creating a diverse and inclusive culture. All qualified applicants will receive consideration for employment without regard to their race, ethnicity, religion, gender, sexual orientation, age, disability status or any other legally protected basis.H2O.ai is an innovative AI cloud platform company, leading the mission to democratize AI for everyone. Thousands of organizations from all over the world have used our cutting-edge technology across a variety of industries. We’ve made it easy for people at all levels to generate breakthrough solutions to complex business problems and advance the discovery of new ideas and revenue streams. We push the boundaries of what is possible with artificial intelligence.H2O.ai employs the world’s top Kaggle Grandmasters, the community of best-in-the-world machine learning practitioners and data scientists. A strong AI for Good ethos and responsible AI drive the company’s purpose.Please visitwww.H2O.aito learn more.Show moreShow less",N/A,Remote,https://www.linkedin.com/jobs-guest/jobs/api/jobPosting/4264673661,2025-08-07
Data Scientist,Insider Store,"São Paulo, São Paulo, Brazil",4 months ago,"Sobre a Insider Store#WE ARE INSIDERVocê terá a chance de trabalhar lado a lado com profissionais obcecados pelo cliente, participando ativamente de projetos e iniciativas que impactam diretamente o negócio e transformam a realidade do mercado.#ALWAYS EVOLVINGOportunidade para quem deseja desenvolver sua carreira em um ambiente inovador, onde constantemente subimos a barra.#MADE FOR THE FUTUREA Insider oferece um espaço para aprendizado e desenvolvimento, proporcionando experiências significativas que irão enriquecer seu conhecimento e habilidades na área. Nós somos o futuro e nos preparamos para ele.#INTENTIONALITYSe você é uma pessoa proativa, curiosa e está sempre em busca de novos desafios, essa posição é perfeita para você.Sobre a VagaDescrição:Estamos em busca de um(a) profissional orientado(a) Data Scientist. O objetivo é transformar dados em insights acionáveis, guiar decisões operacionais e suportar a previsão de demanda e capacidade. Este(a) profissional será fundamental para integrar informações de diferentes áreas, criar modelos preditivos e propor soluções baseadas em dados confiáveis. Esperamos que tenha autonomia para identificar oportunidades e otimizar processos que impactem diretamente os resultados do negócio.Responsabilidades:Ser referencia técnica para a squad. Aplicando técnicas avançadas de análise de dados, como modelagem preditiva e ML, para prever demanda, alinhar capacidades produtivas e estimar risco de operações de produção.Identificar padrões operacionais e recomendar soluções antecipadas para garantir a disponibilidade de produtos e insumos.Trabalhar diretamente com equipes de dados, PCP, compras e produção, promovendo integrações eficientes entre sistemas e plataformas.Monitorar KPIs operacionais, como forecast accuracy, OTIF (On Time In Full) e conformidade de prazos, garantindo maior previsibilidade e conformidade.Propor soluções escaláveis para otimização de processos e melhoria contínua, com foco na integração entre demandas comerciais e capacidades operacionais.Requisitos:Experiência sólida em análise de dados aplicados a processos operacionais e de supply chain.Proficiente em ferramentas como SQL, Python e Looker Studio para criação de relatórios e dashboards.Capacidade de interpretar KPIs e transformar dados em insights práticos para o negócio.Experiência com processos de Strategy Planning, previsão de demanda e planejamento de capacidade.Excelente comunicação para traduzir informações complexas em recomendações claras.Diferencial:Experiência com ferramentas de BI e integração de dados.Conhecimento em planejamento de produção, rastreabilidade e compliance operacional.Familiaridade com metodologias ágeis para projetos de dados e operações.Mais detalhes:Modelo de contrato: PJ;Modelo de trabalho: Hibrido;Descanso sem ser descontado; 22 dias úteis anuais, disponível após os três primeiros meses;Cartão Flexível;Plano de Saúde;Plano Odonto;Totalpass;Udemy;Insider Perks;Oportunidade de crescimento e aprendizado em uma startup em rápida expansãoAmbiente de trabalho colaborativo e inovador, com exposição a novas tecnologias e processosNossa HistóriaAInsidernasceu para desafiar o status-quo da indústria da moda. Aprendemos, inovamos e melhoramos constantemente,para criar um mundo onde todos são encorajados a subir a barra e buscar excelência desde 2017.Hoje,temos mais de 1 milhão de clientes e um portfólio de produtos que tecem tecnologia, inovação e sustentabilidade.Esse é só o início de uma jornada que busca mudanças estruturais em uma das mais tradicionais e poluentes indústrias do mundo: a indústria da moda.Principais destaquesParticipação no programa Startup School da aceleradora Y Combinator.Acelerada 2 vezes nos programas Endeavor Scale Up varejo e consumer goods.Acelerada pelo programa Endeavor Outliers pelo crescimento fora da curva dentro do peer group, ganhando o título de Empreendedores Endeavor.Eleita pela revista Forbes como uma das 25 startups mais promissoras do Brasil.Show moreShow less",N/A,On-site/Hybrid,https://www.linkedin.com/jobs-guest/jobs/api/jobPosting/4221468755,2025-08-07
"Data Scientist, Marketing",Brex,"São Paulo, São Paulo, Brazil",1 week ago,"Why join usBrex is the AI-powered spend platform. We help companies spend with confidence with integrated corporate cards, banking, and global payments, plus intuitive software for travel and expenses. Tens of thousands of companies from startups to enterprises — including DoorDash, Flexport, and Compass — use Brex to proactively control spend, reduce costs, and increase efficiency on a global scale.Working at Brex allows you to push your limits, challenge the status quo, and collaborate with some of the brightest minds in the industry. We’re committed to building a diverse team and inclusive culture and believe your potential should only be limited by how big you can dream. We make this a reality by empowering you with the tools, resources, and support you need to grow your career.Data at BrexOur Scientists and Engineers work together to make data—and the insights derived from marketing data—a core asset across Brex. But it's more than just crunching numbers. The Data team at Brex develops infrastructure, statistical models, and marketing analytics products using data. Our work is foundational to Brex's marketing strategy, campaign measurement, customer engagement programs, and the overall experience we deliver to our customers.What You’ll DoAs a Data Scientist, Marketing, you will partner closely with our Marketing, Sales, and Data Science teams to develop analytical frameworks that inform and optimize our marketing strategy across the customer lifecycle. You’ll focus on designing and deploying models for account-based marketing, mixed media modeling (MMM), and multi-touch attribution. Your work will help Brex maximize ROI from marketing investments, improve targeting and personalization, and deliver measurable growth across acquisition, engagement, and retention. You will apply advanced analytics to complex data sets spanning paid, owned, and earned channels, contributing directly to lifecycle marketing programs and experimentation.The ideal candidate has experience in marketing analytics, especially in account-based marketing, MMM, and attribution modeling. They should have strong business acumen, a deep understanding of modern marketing tech stacks and channels, and the ability to translate technical findings into business actions.Where you’ll workThis role will be based in our Sao Paulo office. You must be willing to work in office at least 2 days per week on Wednesday and Thursday, starting the week of September 1st, 2025. when we open our Sao Paulo office. Employees will be able to work remotely for up to 4 weeks per year.ResponsibilitiesDevelop analytical frameworks and statistical models for account-based marketing, mixed media modeling, and multi-touch attribution across marketing channels.Analyze campaign performance, channel effectiveness, and customer lifecycle touchpoints to drive strategy adjustments to maximize marketing ROI.Collaborate with Marketing, Sales, and Data Science teams to design, implement, and evaluate experiments (A/B tests, incrementality studies) that inform marketing investment and customer journey optimization.Partner with lifecycle marketing teams to identify key segments, personalize outreach, and optimize engagement and retention strategies.Synthesize large, complex data sets into clear business recommendations; communicate actionable insights to both technical and non-technical stakeholders.Build and maintain scalable data pipelines and reporting to support ongoing measurement, attribution, and experimentation.RequirementsMaster’s degree or Ph.D. in Statistics, Economics, Marketing Analytics, Computer Science, or a related quantitative field.3+ years of experience in marketing analytics, marketing data science, or related roles supporting B2B or SaaS marketing organizations.Strong experience with SQL and Python (or R) for data analysis and modeling.Proficiency in advanced marketing measurement techniques, including MMM, multi-touch attribution, and customer segmentation.Familiarity with digital marketing data, modern marketing platforms (e.g., Salesforce, Marketo, HubSpot), and common paid, owned, and earned channels.Ability to synthesize complex analyses into actionable business insights and communicate findings to stakeholders.Experience with experimentation, A/B testing, and causal inference methodologies.English proficiency/fluency, both written and spoken (note: interviews will be conducted in English).Bonus PointsExperience working in B2B SaaS or fintech, especially supporting demand generation and account-based marketing programs.Familiarity with customer journey analytics, advanced personalization, or recommendation systems.Experience working with marketing automation, CRM, and data integration tools.Knowledge of adtech, martech, and data privacy best practices.This role offers a unique opportunity to shape the future of marketing analytics at Brex while working with a world-class data and marketing team. If you are passionate about using data science to drive smarter marketing decisions, we’d love to hear from you!LocationMust be working in Brazil at the start of rolePlease be aware, job-seekers may be at risk of targeting by malicious actors looking for personal data. Brex recruiters will only reach out via LinkedIn or email with a brex.com domain. Any outreach claiming to be from Brex via other sources should be ignored.Show moreShow less",N/A,Remote,https://www.linkedin.com/jobs-guest/jobs/api/jobPosting/4250677407,2025-08-07
Cientista de Dados Pleno | CRM,C6 Bank,"São Paulo, São Paulo, Brazil",1 week ago,"Nossa área de Ciência de DadosA nossa equipe é dedicada a aplicar habilidades em Programação, Estatística e Machine Learning para criar soluções que impulsionam as decisões estratégicas dos nossos parceiros de negócio, desde a concepção até a implementação. O nosso ambiente de trabalho é caracterizado pela colaboração, leveza e promoção da autonomia, estando sempre próximos dos times de negócios e com um firme compromisso na entrega final. Nossa cultura é robusta, centrada na inovação e na construção de relacionamentos autênticos com clientes e colaboradores.Suas atividades como CSixerTrabalhar com parceiros de negócios, engenheiros de dados e times de tecnologia para desenvolvimento e deploy de soluções de machine learning como parte dos produtos;Analisar dados para validar hipóteses e gerar insights de negócio;Manipular dados para tratamento, limpeza e exploração;Implementar, testar, fazer deploy, documentar e depurar processos de dados e de machine learning;Contribuir com os repositórios de código e documentação da equipe e qualificar a discussão técnica com referências científicas e metodológicas.Requisitos e experiênciaInglês avançado para leitura (artigos técnicos) e escrita (documentação de modelos e APIs);Experiência com técnicas de modelagem descritiva e preditiva;Experiência na construção de ETL usando SQL;Experiência com Python e/ou R para construção de modelo.Nossos benefíciosVale-Refeição;Vale-Alimentação;Plano de saúde e odontológico;Auxílio-Creche;Seguro de Vida;Wellhub;Psicologia Viva;Cartão de Crédito C6 Bank Carbon;Carbon Spa;Sala de amamentação;Bicicletário;Vestiário;Espaço de convivência;Empresa Cidadã - Prorrogação do prazo da licença-maternidade e licença-paternidade.C6 BANKO BANCO DA SUA VIDAAtendemos pessoas físicas, MEIs e PMEs em todos os estados do Brasil. Sem agências físicas, oferecemos mais de 90 produtos e serviços financeiros feitos para todos os perfis de clientes.Estamos localizados em São Paulo-SP e contamos com mais de 3.000 CSixers que estão sempre a mil por hora. Em pouco mais de cinco anos, conquistamos muitos prêmios e reconhecimentos.No C6 Bank, acreditamos que a diversidade impulsiona a inovação e fortalece nosso ambiente de trabalho. Por isso, promovemos uma cultura inclusiva, que valoriza a equidade e garante oportunidades para todas as pessoas, independentemente de raça, cor, idade, credo, deficiência, nacionalidade, estado civil, orientação sexual, identidade ou expressão de gênero. Aqui, todo mundo é bem-vindo para ser quem é.Confira mais informações no vídeo abaixo:Show moreShow less",N/A,On-site/Hybrid,https://www.linkedin.com/jobs-guest/jobs/api/jobPosting/4035671121,2025-08-07
Data Scientist - Machine Learning,Atvos,"São Paulo, São Paulo, Brazil",1 week ago,"Somos Atvos!Na Atvos, produzimos e comercializamos etanol, açúcar VHP e energia elétrica a partir da cana-de-açúcar e da biomassa. Nossa energia vai além do negócio: está nas pessoas e no nosso jeito de ser. Com capacidade para abastecer mais de 60 milhões de carros com etanol, adoçar milhões de festas com nosso açúcar e levar energia para o bem-estar de mais de 20 milhões de pessoas, também somos destaque na emissão de CBIOs. Atuamos com responsabilidade, desenvolvendo comunidades, cuidando do meio ambiente e transformando vidas. Aqui na Atvos lideramos a transição energética para mover o mundo e transformar vidas.Confira mais da nossa empresa pelo site: www.atvos.com#VemPraAtvosPrincipais ResponsabilidadesCientista de Dados Esp, será responsável por projetar, desenvolver e operacionalizar soluções avançadas de machine learning e deep learning (incluindo visão computacional e modelos LLM). Atuará em todo ciclo de vida do modelo, com foco em qualidade de código, integração contínua (MLOps) e arquitetura escalável em nuvem (Azure).Desenvolver pipelines de ML com boas práticas de versionamento e testes.Implementar e gerenciar fluxos de MLOps, incluindo deployment, monitoramento e re-treino de modelos.Construir modelos de deep learning para visão computacional (classificação, detecção, segmentação).Desenvolver e integrar aplicações com LLMs (chatbots, RAG, assistentes).Realizar ingestão e transformação de dados em ambientes distribuídos (Data Lake, Azure Databricks).Garantir qualidade, performance e legibilidade do código (Python, R ou Julia).Colaborar com equipes de engenharia de dados e produto para entrega de soluções em produçãoPré-requisitosCurso Superior completo em Ciência de Dados, Engenharia, Computação ou áreas correlatas;Conhecimento avançado em linguagens computacionais (Python, R ou Julia);Experiência com CI/CD, versionamento de dados/modelos;Experiência com Azure AI/ML Services;Capacidade de projetar soluções modulares, escaláveis e seguras;Atuar formato híbrido 3x da semana presencial no escritório de SP;Inglês Intermediário - Avançado.Aqui,diversidade é essencial!Nossas vagas são destinadas a todos, com incentivo á participação demulheres e PCDs.Show moreShow less",N/A,On-site/Hybrid,https://www.linkedin.com/jobs-guest/jobs/api/jobPosting/4277268380,2025-08-07
