title,company,location,posted,description,applicants,work_mode,link,data_coleta
ANL PRODUTOS CAMB JR - CAMBIO E DERIVATIVOS (EXCLUSIVA PCD),Itaú Unibanco,"São Paulo, São Paulo, Brazil",4 days ago,"Iniciamos o processo seletivo para uma vaga de Analista de Produtos de Câmbio PF Júnior (PCD), na Superintendência de Mesas e Produtos de Câmbio (DMPM). A atuação será como Team Member na Squad Turismo, dentro da RT Câmbio PF Dados e Analytics. Buscamos um(a) profissional com perfil voltado para produtos digitais, com forte capacidade analítica e habilidade em manipulação de dados. O colaborador atuará em conjunto com outras squads da RT que compõem a jornada do produto, contribuindo com a construção de soluções baseadas em dados e com foco na experiência do cliente. Espera-se um perfil protagonista, proativo e orientado a resultados.Responsável pela criação e manutenção das políticas internas do produtoAnalisar dados para gerar insights e apoiar decisões estratégicasConstruir dashboards e relatórios para monitorar o desempenhoPropor melhorias na jornada digital do cliente de TurismoParticipar dos processos de Discovery, Inception, Desenvolvimento e Pos Implantação dos projetosInteragir com as squads da comunidade, além de outras áreas que fazem parte da jornada do produto.Participar das cerimônias da Comunidade de Câmbio e DerivativosAcompanhamento dos indicadores (KPIs e OKRs) dos projetos e da comunidadeDesenvolver comunicação de acompanhamento dos projetos sob nossa gestãoCompetências: Atitude de dono , Capacidade analítica , Constante atualização no mundo digital , Foco em resultados , Foco no cliente , Proatividade , Senso Crítico , Construção de parcerias e trabalho em equipe , Organização e priorização de demandas junto ao time , Flexibilidade e organização para coordenar diversos projetos e assuntos simultaneamenteFormação: Superior Completo - Engenharia , Superior Completo - Comércio ExteriorIdioma: Inglês - IntermediárioTecnologia: Access , Excel , SAS , SQL , SharepointCertificação:Competências Técnicas: Desejável experiência com metodologia ágil (modelo Comunidade) , Desejável conhecimento do mercado financeiro e de câmbioSobre GM&TA área de Global Markets & Treasury é responsável pela conexão dos nossos clientes com o mercado, viabilizando o acesso deles aos produtos financeiros.Temos a missão de garantir uma oferta competitiva, inovadora e focada nas necessidades das empresas, cultivando o foco na excelência de atendimento e encantamento dos nossos clientes para gerar resultados.Diversidade, agilidade, cooperação e empreendedorismo fazem parte do nosso desafio diário.Venha fazer parte de uma equipe integrada, 100% antenada no cenário macroeconômico e com a ambição de apoiar a transformação e inovação do maior banco da América Latina.Sobre QuantA área Quant, que faz parte da estrutura do Atacado do Itaú Unibanco, tem como objetivo transformar a maneira como fazemos negócios e atendemos nossos clientes!Somos responsáveis por projetos de precificação e distribuição de produtos nos canais digitais, negociação eletrônica de ativos e gestão de portifólios em tempo real na Tesouraria.Respiramos tecnologia, matemática financeira e análise de dados! Criamos soluções, otimizamos processos e desenvolvemos ferramentas, buscando sempre máxima eficiência em todos os nossos projetos, visando garantir uma experiência única a nossos clientes.Curtiu? Então, vamos de turma?Com quais benefícios vou poder contar?Vale TransporteVale Refeição (Restaurantes) / Vale Alimentação (Supermercados)Convênio médico e odontológicoSeguro de VidaPLR (Mediante resultados do banco)Previdência privadaDescontos exclusivos em nossos produtos financeirosLicença maternidade estendidaAuxílio Creche / Babá (para papais e mamães)Incentivo a estudosGym Pass (Mas se preferir temos Bio Ritmo em alguns polos)Acesso aos Clubes Itaú (Guarapiranga / Itanhaém e São Sebastião)+ Algumas vantagens que você pode conhecer durante o processo 😊O Itaú estimula candidaturas de pessoas com deficiência em todas as nossas posições, sendo assim, sinta-se à vontade para se candidatar em vagas sinalizadas como exclusivas ou não para pessoas com deficiência. Somos comprometidos com a inclusão e valorizamos a diversidade.O Itaú irá utilizar os dados fornecidos para fins de processos seletivos, inclusive em bancos de vagas alocados em plataformas terceiras. Caso deseje solicitar oposição a este uso, ou exercer quaisquer um dos seus direitos, entre em contato através de nossos canais, disponíveis na Política de Privacidade de candidatos do Itaú Unibanco (https://www.itau.com.br/privacidade/candidatos/). Não há necessidade de aceitar, trata-se apenas de uma ciência.Show moreShow less",N/A,On-site/Hybrid,https://www.linkedin.com/jobs-guest/jobs/api/jobPosting/4294624413,2025-09-29
Cientista de Dados Pleno | Remoto | CLT,Tecla T,"São Paulo, São Paulo, Brazil",1 week ago,"Atuar no desenvolvimento e evolução de modelos baseados em LLMs, desde o design de prompts até a implantação em produção, construindo soluções de ciência de dados escaláveis e confiáveis. Contribuir para a automação de processos, integração de sistemas e otimização de pipelines de dados, garantindo qualidade, versionamento e testabilidade, em colaboração com equipes multidisciplinares.Principais ResponsabilidadesComo Cientista de Dados você atuará na evolução de modelos baseados em LLMs, desde o prompt engineering até a implantação em produção;Será responsável por criar, manter e otimizar pipelines de dados utilizando ferramentas de mercado (NiFi, Kafka);Irá automatizar processos de ETL e integração entre sistemas;Irá garantir a qualidade, versionamento e testabilidade das soluções desenvolvidas e atuar de forma colaborativa com equipes multidisciplinares.RequisitosFormação completa ou cursando nas áreas de Tecnologia, Matemática, Estatística, Economia, Administração, Engenharias e ou correlatas;Ampla experiência em Python, especialmente para aplicações de IA. Domínio de frameworks de LLMs (ex: Transformers, HuggingFace, LangChain, OpenAI API);Proficiência com pipelines de dados, ETL, Apache NiFi, Apache Kafka. Prática com versionamento de código (ex: Git), testes automatizados e programação orientada a objetos;Vivência com integração entre sistemas via APIs ou mensagens. Prompt engineering e fine-tuning de modelos;Inglês intermediário/avançado para leitura técnica e ferramentas.DiferenciaisExperiência prática em projetos de IA ou Data Science, preferencialmente em empresas do setor financeiro, como bancos e seguradoras, tecnologia, consultorias ou startups;Atuação em ambientes cloud (AWS, Azure, GCP) e participação em comunidades ou projetos open source de IA.Familiaridade com publicações, artigos, ou apresentações em eventos de tecnologia.Experiência prévia com validação humana de modelos (human-in-the-loop).Certificações em Data Science (ex: IBM Data Science, AWS Certified Machine Learning, Google Professional Data Engineer), ou cursos reconhecidos em Machine Learning, IA ou Big Data.BenefíciosBenefícios CLTVale Flexível: Alelo Refeição (todos), Alelo Alimentação* e Alelo Multibenefícios*.Plano de Saúde: Amil ou SulAmérica/Unimed, cobertura nacional, com coparticipação.Plano Odontológico: Amil, cobertura nacional, com coparticipação.Previdência Privada: com faixas de contribuição progressivas.Vale Transporte: desconto de 6% do salário ou valor concedido (se inferior).Reembolso Fretado: até R$ 327/mês, desconto de 6% do salário (contratos hibrídos ou presencial)Estacionamento*: conforme política interna(contratos hibrídos ou presencial)Empréstimo Consignado*Cartão Corporativo*: AMEX, para determinadas funções.Apoio à Vida e Bem-estarGYMPASS e Sesc + sessões de atividade física e mindfulness.Orientação psicológica, jurídica, financeira e social (inclui emergência 24/7 para psicologia).Auxílio Creche/Pajem/Babá: até 24 meses (ou até 14 anos em Fortaleza, para deficiência; até 6 anosem Blumenau/POA).Gestantes e Adotantes: isenção de coparticipação em consultas e exames, Kit Bebê, Mãe Mentora.Kit Home Office: reembolso para cadeira e kit ergonômico (CLT > 6 meses ou contratos Mobility).Vantagens: plataforma de descontos e cashback em +3.000 marcas.Desenvolvimento ProfissionalReembolso de Graduação e Cursos de Aperfeiçoamento*Mestrado gratuito em parceria com Hult International Business School*Mobility4U: experiências internacionais.Buddy & Conselheiro: apoio ao desenvolvimento de carreira.Diversidade & InclusãoAbilities+: inclusão de pessoas com deficiência.LGBTQIA+: grupo interno de apoio.Professional Women Network e Women in Tech: apoio ao desenvolvimento feminino.Black Professional Network: equidade social e racial.Cultura & Voluntariado;Demais vantagensModelo híbrido flexível.Voluntariado com impacto social e ambiental.Benefícios sujeitos a elegibilidade conforme política interna.Show moreShow less",N/A,On-site/Hybrid,https://www.linkedin.com/jobs-guest/jobs/api/jobPosting/4300786768,2025-09-29
Cientista de Dados Sênior -Fortaleza/CE,Source2IT,"Barueri, São Paulo, Brazil",1 day ago,"Cientista de Dados Sênior-Fortaleza/CEProcuramos um Cientista de Dados Sênior para aplicar métodos avançados de machine learning e estatística no setor de saúde. Você trabalhará com dados clínicos, operacionais e estratégicos para identificar padrões, prever eventos e influenciar decisões com modelos preditivos robustos.Responsabilidades principaisEntendimento do problema de negócio e definição de hipóteses.Exploração e tratamento de dados (limpeza, feature engineering, imputação, normalização).Construção e manutenção de modelos estatísticos e de machine learning (classificação, regressão, séries temporais, clustering, redes neurais etc.).Avaliação, validação e tuning de modelos (cross-validation, hyperparameter tuning).Deploy de modelos para ambiente de produção, monitoramento e ajuste (monitorar drift, recalibrar).Documentar metodologia, explicar resultados e gerar apresentações com insights interpretáveis.Colaborar com engenharia de dados para viabilizar pipelines escaláveis.Garantir que os modelos estejam em conformidade com requisitos de privacidade e segurança de dados médicos.Requisitos obrigatóriosMínimo de 5 a 8 anos de experiência em ciência de dados.Competência em Python / R e bibliotecas de ML/Deep Learning (scikit-learn, TensorFlow, PyTorch etc.).Experiência com pipelines de ML (MLflow, Kubeflow etc.).Forte capacidade analítica, estatística, interpretação de dados e comunicação de resultados.Inglês fluente.Habilidades para trabalhar com times multidisciplinares (produto, TI, estratégia).Diferenciais valorizadosExperiência no setor de saúde (análise de risco, modelos preditivos hospitalares, gestão clínica).Familiaridade com técnicas de interpretabilidade (SHAP, LIME etc.).Experiência com aprendizado por reforço, grafos ou modelos generativos aplicados ao setor saúde.Publicações ou contribuições acadêmicas relevantes.Noções de ética em IA, fairness, explicabilidade e privacidade de dados de saúde.Previsão de início:Início ImediatoNível de Experiência:Sênior/ EspecialistaRegime de Contratação:Pessoa JurídicaModelo de Trabalho:Híbrido, presencialmente 1 dia por semana- Fortaleza/CEDuração do Contrato:IndeterminadoFormação:Formação superior em Estatística, Engenharia, Economia, Ciência de Dados, Sistemas ou áreas similares.Gostou da vaga?Candidate-se!Não esqueça de informar sua pretensão salarial e disponibilidade para início.Show moreShow less",N/A,On-site/Hybrid,https://www.linkedin.com/jobs-guest/jobs/api/jobPosting/4307140229,2025-09-29
Cientista de Dados,WelHome Brazil,"São Paulo, São Paulo, Brazil",5 days ago,"Descrição da vagaA welhome é uma startup que gerencia imóveis em plataformas como Airbnb e Booking usando tecnologia para simplificar a vida de quem deseja rentabilizar seus imóveis. Nosso objetivo é ajudar investidores ou proprietários que querem ganhar mais do que o aluguel tradicional, entregando uma operação confiável, conectada e eficiente.ResponsabilidadesDesenvolver modelos de machine learning clássicos (precificação, previsão de demanda, lead scoring, churn).Desenvolver modelos de séries temporais.Aplicar LLMs e agentes de IA em casos de automação, análise de texto e geração de conteúdo.Projetar e manter pipelines de dados em ambiente cloud, garantindo qualidade e governança.Estruturar arquitetura de dados e implementar práticas de MLOps/LLMOps.Criar dashboards e relatórios para apoiar decisões estratégicas.Visão computacional:Avaliar qualidade de fotos enviadas por anfitriões (iluminação, nitidez, enquadramento).Detectar objetos/atributos importantes (quartos, piscina, varanda, etc.).Sugerir melhorias automáticas (ex.: filtros, ajustes de cor, seleção da melhor imagem de capa).RequisitosExperiência em Ciência de Dados/Engenharia de Dados.Forte domínio em Python, bibliotecas de ML (Scikit-learn, XGBoost, TensorFlow/PyTorch).Experiência em pipelines de dados (Airflow, Prefect, dbt).Conhecimento em SQL e bancos de dados (relacionais e não-relacionais).Experiência com LLMs e frameworks de orquestração (LangChain, LangGraph, LlamaIndex, CrewAI).Familiaridade com cloud computing (AWS, GCP, Azure).Vivência em MLOps/LLMOps.DiferenciaisExperiência em PropTech, TravelTech ou marketplaces.Modelagem de séries temporais e revenue management.Projetos de qualidade de imagem ou classificação de fotosConhecimento em privacidade e LGPD aplicado a dados visuais.Experiência em visão computacional (OpenCV, Detectron2, YOLO, CLIP, Segment Anything ou similares).O que oferecemosCartão Flash (VR)Ambiente dinâmico, colaborativo e com muita autonomiaParticipação ativa na construção de uma startup em crescimento aceleradoAmbiente colaborativo, com autonomia para propor e experimentarShow moreShow less",N/A,On-site/Hybrid,https://www.linkedin.com/jobs-guest/jobs/api/jobPosting/4302374402,2025-09-29
Data Scientist - LATAM,WITHIN,"São Paulo, São Paulo, Brazil",1 month ago,"About the Role: We are looking for a versatile Data Scientist with a strong marketing background to join our dynamic team. As part of WITHIN, you will work on innovative end-to-end data solutions that drive growth for some of the most iconic brands in the world. This role is perfect for someone who enjoys thinking critically about complex data problems, building and testing models with a strong emphasis on interpretability,turning innovative ideas into actionable solutions. You will be responsible for solving complex business challenges, designing and refining data pipelines, and applying statistical methods to real-world problems.Responsibilities include but are not limited to;Develop and test new data science models, including Marketing Mix Modeling, time series forecasting and advanced regression models, to solve business problems and improve marketing strategies while ensuring model interpretabilityRun statistical experiments to measure and optimize performance for clients to uncover key insights from large datasets.Implement and refine data models, ensuring they align with dynamic client business objectives and data engineering workflows, offering scalable solutionsCollaborate with cross-functional teams, including media, creative, and lifecycle marketing, to integrate data-driven insights into performance branding strategiesCommunicate complex data findings effectively, both in written and spoken formats, to clients and internal stakeholdersRequirements:3-5 years of experience as a Data Scientist, preferably with a focus on marketing applicationsStrong Bayesian statistics and mathematics background with the ability to understand complex algorithms and how they can be applied to solve real-world business challengesProficiency in Python, SQL, and RExperience with optimization methodsExperience working with Google Cloud Platform (GCP) or another cloud platform (AWS, Azure)Deep understanding of standard data science algorithms(optional) - Experience with Terraform, microservices and cloud infrastructure automationExcellent written and verbal communication skillsA problem-solving mindset with the ability to adapt in a fast-paced environmentOur interview process includes, but is not limited to the following:Excel and Typing TestWe offer a competitive salary and benefits based on ability level, including:Base salary DOEUnlimited vacation policyMonthly phone/internet and food stipendHealth insurance coverageProfessional Development ProgramRemote work opportunity - must be based in a Latin America countryNote. Please submit your resume in EnglishAbout WITHIN & Brkfst.ioWITHINis the world's first Performance Branding company, partnering with some of the biggest brands in the world to drive business growth through innovative marketing strategies. Our integrated operating model collapses the traditional marketing silos between creative and media, performance and brand, and across media channels. With a full suite of offerings including media, creative, SEO, Lifecycle, Retail Media, Affiliate and Influencer, we're able to work with our brand partners in an integrated fashion, allowing us to align marketing strategies back to core business objectives. Client teams at WITHIN are trained on how to always act as a trusted business partner, acting as a fiduciary to client needs above our own.Teams at WITHIN have the ability to work with iconic brands such as The North Face, Timberland, Ben and Jerry's and Jose Cuervo. Everyone at WITHIN wants to grow and be challenged. It's a collaborative place made up of small, closely knit and versatile teams that are fast and adaptive to solve problems and build systems.Check out some of ourwork!Brkfst.iois an incubated venture within WITHIN, focused on connecting creators with major brands to produce impactful ads at scale.We are, and we connect creators with big brands to make impactful ads at scale. We have a network of thousands of content creators with a variety of different skill-sets, and we're looking to build a program that empowers them to create great ads for brands like Corkcicle, Perfume.com, Casper Mattresses, & more!This is a very ambitious project and our roadmap is full of exciting features, so we're looking for people who love innovation and want to be challenged. We're a small team of scrappy individuals who are growing fast, and we're looking for someone to grow with us.Weweave AI into everything we do, using the latest tech across all teams to innovate, work smarter, and make better decisions. Whether it's in creative, operations, or anything else, AI helps us level up and do things at a whole new scale. We expect our people to use AI in their daily work, fully embracing it as a critical tool to help us succeed.Join Our Network!Stay connected with us and be the first to know about new opportunities, industry insights, and updates.Follow us on:LinkedInWhatsApp CommunityInstagramTik TokLocationsNew York City:43-01 22nd St, Suite 602, Queens, New York, 11101Bogotá:WeWork Av. Cra 19 #100-45, 10th Floor, Bogotá, ColombiaMexico City:Av Paseo de la Reforma 296, Floor 25, Office 111, Mexico City, MexicoShow moreShow less",N/A,Remote,https://www.linkedin.com/jobs-guest/jobs/api/jobPosting/4291509130,2025-09-29
Machine learning,Netvagas,"São Paulo, São Paulo, Brazil",2 weeks ago,"Estamos em busca de uma pessoa Engenheira de Machine Learning para integrar nossa equipe de Soluções IA e ser responsável por aplicar técnicas de aprendizado de máquina em projetos inovadores, ajudando a construir soluções inteligentes para nossos produtos e clientes.Se você possui paixão por tecnologia, tem conhecimentos em dados e está em busca de oportunidades para crescer na área, esta é a vaga ideal.ResponsabilidadesProjetar, desenvolver e implementar modelos de machine learning para resolver problemas de negócio diversos.Automatizar e otimizar processos relacionados ao ciclo de vida de modelos: desde a experimentação, treinamento, deploy até o monitoramento em produção.Trabalhar em colaboração com equipes de Ciência de Dados, Engenharia de Dados e Produto, garantindo que os modelos sejam integrados de forma eficiente aos sistemas.Garantir a escalabilidade, eficiência e confiabilidade das soluções de machine learning em ambientes de produção.Participar da definição de arquiteturas e pipelines de MLOps para automação e governança de modelos.Monitorar o desempenho dos modelos e ajustar parâmetros conforme mudanças nos dados e nos objetivos de negócio.Documentar soluções, boas práticas e contribuir para a evolução contínua dos processos e padrões técnicos.Pesquisar e implementar novas técnicas e ferramentas que impulsionem a inovação em machine learning.RequisitosGraduação completa ou em andamento em Ciência da Computação, Engenharia, estatística, matemática, ou áreas correlatas.Programação em Python ou outras linguagens adequadas para machine learning.com bibliotecas e frameworks de machine learning e deep learning (ex.: Scikit-learn, TensorFlow, PyTorch).Conhecimento de fundamentos de estatística, aprendizado supervisionado e não supervisionado.Experiência com versionamento de código (ex.: Git) e práticas de desenvolvimento de software.Noções de deployment e monitoramento de modelos.DiferenciaisExperiência prática com MLOps e ferramentas de automação de pipelines (ex.: MLflow, Kubeflow, Airflow).Conhecimento em computação em nuvem (AWS, Azure ou GCP), especialmente serviços de IA/ML.Experiência com containers e orquestração (ex.: Docker, Kubernetes).Implementação de soluções de machine learning em ambientes de produção com requisitos de escalabilidade e segurança.Participação em projetos que envolvam modelos de NLP, visão computacional ou sistemas de recomendação.Perfil ProfissionalMentalidade analítica e orientação para a resolução de problemas complexos com pragmatismo.Proatividade na busca de soluções e na melhoria contínua de processos e modelos.Colaboração ativa com diferentes áreas e habilidades de comunicação clara, tanto para públicos técnicos quanto não técnicos.Organização, responsabilidade e atenção aos detalhes na entrega de soluções robustas e seguras.Interesse por aprendizado contínuo e atualização em relação às tendências e inovações em machine learning.Se você se identifica com essa oportunidade, inscreva-se! Nosso processo valoriza competências, potencial e diversidade de experiências.Show moreShow less",N/A,On-site/Hybrid,https://www.linkedin.com/jobs-guest/jobs/api/jobPosting/4300563816,2025-09-29
Senior Data Scientist - Experimentation,Uber,Greater São Paulo Area,1 hour ago,"About The TeamWe are looking for a Data Scientist to join the Sao Paulo team, specifically in Core Services Analytics.You will work with product managers, engineers, and fellow data scientists to shape the direction of one or more products within Core Services. You will work on fast-moving, high-stakes problems reaching a global audience. A deep analytical passion and the ability to execute key business priorities are a must for this role.Notes About The ProfileIf you are interested in advanced modeling and production modeling,this role is not it! We have a separate Applied Science team that works on these types of projects.About The RoleDevelop and monitor strategic metrics and understand all underlying factors;Design and run experiments to analyze the impact of product changes;Deep dive into data to evaluate proposed product changes and identify opportunities for improving the user experience;Collaborate with product managers and other business leaders to make decisions based on data insights and experiment results;Communicate your findings to cross-functional peers and management.Technical SkillsRequiredAdvanced English skills;Senior and/or Staff seniority in a Business/Data/Science role;Previous experience improving products, understanding the user journey, and extracting insights from data;Advanced SQL expertise;Experience using Python or R;Experience launching multiple experiments (such as A/B experiments) and an understanding of experimental design and usingstatistical methods in exploratory analysis;Casual Inference, Linear regression, and credibility-weighted estimates experience are a huge plus;Bachelors or M.S. in Statistics, Economics, Computer Science, or other quantitative fields.Please note:this hybrid position is based in São Paulo, Brazil - welcoming both local professionals and those open to relocating to São Paulo.Show moreShow less",N/A,On-site/Hybrid,https://www.linkedin.com/jobs-guest/jobs/api/jobPosting/4287740609,2025-09-29
