title,company,location,posted,description,applicants,work_mode,link,data_coleta
Cientista de Dados Jr. - (Crédito),Banco PAN,"São Paulo, São Paulo, Brazil",3 days ago,"Somos oPANÁgeis, flexíveis e criativos, exploramos possibilidades com disposição e desejo de fazer acontecer. Sempre prontos para encarar novos desafios, nutrimos líderes que, além de ter garra, são abertos e empáticos, veem na proximidade das relações, o elo entre cada um.Nossa missão, se faz cumprida quando transformamos a vida dos outros através dos nossos conhecimentos. Nossos pilares de cultura, reforçam nossa postura idealizadora e com desejo de fazer acontecer:Trabalho em equipe, Transparência , Excelência e Eficiência com profundidade.Dominamos nossos processos e trazemos melhorias para quem deseja ter umavida financeira mais inteligente.Principais desafios:O Analista de Ciência de Dados será corresponsável pelo desenvolvimento de soluções de inteligência preditiva, tendo como principais atividades:Auxiliar e desenvolver modelos preditivos, para apoiar a tomada de decisão da área de crédito;Atuar com Machine Learning e Gen-IA, para soluções de clusterização, regressão, classificação e criação de features;Atuar no processo de deploy de modelos (MLOp) de acordo com a melhores práticas;Lidar com drivers da concessão e manutenção de crédito, como credit score, endividamento, capacidade de pagamento e rentabilidade;Analisar impactos e variações dos negócios/produtos, buscando propostas de soluções data-driven;Explorar as informações disponíveis para entendimento do portfólio, tendências e oportunidades de negócio;Acompanhar e propor métodos de monitoramento da qualidade dos modelos, visando melhorias.Quais as principais competências para a posição?Formação acadêmica dentre os cursos de Matemática Aplicada, Estatística, Computação Científica, Engenharias ou similares;Conhecimento de programação em SQL e PythonCapacidade de trabalhar com fontes distintas de dados, incluindo dados não estruturados;Conhecimento sobre as principais técnicas estatísticas de modelagem, de avaliação de performance dos modelos, testes de hipóteses e seus usos;Noção das principais implementações dos algoritmos de Machine Learning e Gen-IA;Perfil analítico e foco na solução de problemas complexos, considerando as modelagens em múltiplos cenários e relações de risco de crédito versus retorno;Comunicação clara e objetiva para expor suas análises, modelos e descobertas para as áreas de negócios;Trabalhar em equipe, ter comprometimento e vontade de aprender e ensinar.Modelo de atuação: Híbrido (4 dias presenciais no escritório e 1 dia de home office) - Avenida Paulista.Benefícios do PAN:Bônus / PLR 🤑Vale Refeição 🍔Vale Alimentação 🍝13º de Vale Alimentação 🤌Convênio Médico (internação em apartamento para titular e dependentes) 🏥Convênio Odonto/Ortodôntico 😁Ambulatório Médico no escritório 🚑Telemedicina Dr. Alper (Einstein Conecta) ilimitado. 🩺Seguro de Vida ❤Descontos em mais de 10 mil farmácias 💊4 Sessões de psicoterapia por mês 🤝Licença familiar estendida (Responsável 6 meses e corresponsável 30 dias) 👨‍🍼🤱Auxílio Creche / Babá 🎒AcomPANha (programa de acompanhamento para gestantes) 🫃🤰Wellhub/Totalpass 💪Auxílio tecnologia assistivas (reembolso de 85% para colaboradores com deficiência) 🦻🦽Programas de desenvolvimento 📚Massagem e Auriculoterapia 💆‍♀️💆‍♂️Salão de beleza no escritório 💇‍♂️💅PAE (Orientação Jurídica, Financeira, Psicológica e Social) 🧑‍🎓Portal de descontos em diversos segmentos (Allya) 🤑Campanha de vacinação (colaborador e dependente) 💉Facilitação no financiamento de veículos (Mediante análise) 🚗Cartão de crédito PAN com limite diferenciado (Mediante análise) 💳Vale Transporte (desconto de apenas 4%) 🚆Assistência Funeral 🤍Assim como todas as nossas vagas, essa também é destinada à diversidade e inclusão. Independentemente de qualquer fator, perfil ou característica,Expanda sua carreira no PAN!Para conhecer mais sobre nossos benefícios e cultura, acesse o Trabalhe Conosco:https://www.bancopan.com.br/trabalhe-conosco/Show moreShow less",N/A,On-site/Hybrid,https://www.linkedin.com/jobs-guest/jobs/api/jobPosting/4312787717,2025-10-13
Cientista de Dados – Digital & Business Analytics,Unilever,"São Paulo, São Paulo, Brazil",1 week ago,"Procurando pelo Trabalho dos Sonhos?Entre para nosso time de Ice Cream!Descrição de CargoTítulo:Cientista de Dados – Digital & Business AnalyticsSe você está no negócio de Ice Cream da Unilever ou está pensando em trabalhar para o negócio de sorvetes da Unilever, você trabalhará para o líder global de sorvetes com faturamento de € 8 bilhões em 2023. O negócio de Ice Cream está operando em uma categoria altamente atraente, pois fazemos parte da indústria de lanches e bebidas de 1 trilhão, crescendo consistentemente em ritmo acelerado. Temos ações de marcas fortes: 5 das 10 marcas mais vendidas, incluindo Wall's, Magnum, Ben &Jerry's. Estamos investindo para liberar todo o potencial de crescimento da Ice Cream como uma entidade independente, assim que nos separarmos da Unilever, o que está planejado para acontecer até novembro de 2025. O sorvete tem características distintas dos outros negócios operacionais da Unilever e o potencial de crescimento de Ice Cream será melhor entregue sob uma estrutura de propriedade diferente.Após o período de estabelecimento de cerca de 12 a 15 meses, você terá opções de exploração e crescimento na carreira, permitindo explorar funções e oportunidades por meio de oportunidadesEsperamos que você queira construir o novo capítulo da nossa história do sorvete junto conosco.PROPÓSITO DA FUNÇÃOA Unilever Ice Cream é o lugar onde você pode dar vida ao seu propósito com o trabalho que você faz – criando um negócio melhor e um mundo melhor.Buscamos um(a) Cientista de Dados para fortalecer nossa capacidade analítica e apoiar decisões estratégicas de negócio e marketing digital. O(a) profissional será responsável por estruturar, analisar e transformar grandes volumes de dados em insights acionáveis, criando modelos estatísticos e preditivos que orientem iniciativas digitais, de e-commerce e CRM.PRINCIPAIS RESPONSABILIDADESEstruturar e analisar dados de diferentes fontes (internas e externas, digitais e transacionais).Criar dashboards, modelos e relatórios que suportem decisões de negócio e iniciativas digitais.Desenvolver modelos de previsão, segmentação de clientes e análise de churn/propensão à compra.Trabalhar em conjunto com times de Marketing Digital, CRM, E-commerce, Vendas e D&A para traduzir problemas de negócio em soluções analíticas.Garantir qualidade e governança dos dados utilizados nas análises.Comunicar resultados complexos de forma simples e visual para públicos técnicos e não técnicos.ISSO SE PARECE COM VOCÊ?Experiências & QualificaçõesFormação AcadêmicaGraduação em Engenharia, Estatística, Matemática, Ciência da Computação, Administração, Economia ou áreas correlatas.Desejável: Pós-graduação/MBA/Mestrado em Ciência de Dados, Analytics, Business Intelligence ou áreas relacionadas.Requisitos Técnicos (Hard Skills)Forte conhecimento em estatística, modelagem preditiva e machine learning.Domínio em linguagens de programação e análise: Python (pandas, scikit-learn, PySpark), R ou SQL.Experiência com plataformas de visualização (Power BI, Tableau ou Looker).Familiaridade com dados digitais (Google Analytics, Meta Ads, CRM, plataformas de e-commerce).Experiência em manipulação de grandes bases de dados (Data Lakes, Cloud – Azure, GCP ou AWS).Conhecimento de ETL, modelagem de dados e boas práticas de governança.DiferenciaisExperiência prévia em projetos digitais e de e-commerce.Conhecimento de ferramentas de automação de marketing e CRM (Salesforce, HubSpot, Dynamics, etc.).Vivência em testes A/B, modelos de atribuição digital e análise de campanhas de mídia.Experiência com LLMs/IA generativa aplicada a dados.HabilidadesCapacidade de traduzir dados complexos em insights de negócio claros.Perfil colaborativo, acostumado a trabalhar com times multidisciplinares.Pensamento crítico e orientado a solução.Boa comunicação e storytelling de dados.Curiosidade e mentalidade de aprendizado contínuo.VOCÊ ESTÁ ANIMADO PARA CRIAR O FUTURO DO SORVETE?A Unilever abraça a diversidade e incentiva candidatos de todas as esferas da vida. Isso significa dar consideração completa e justa a todos os candidatos e desenvolvimento contínuo de todos os funcionários, independentemente de idade, deficiência, mudança de sexo, raça, religião ou crença, sexo, orientação sexual, casamento e parceria civil e gravidez e maternidade.Unilever is an organisation committed to equity, inclusion and diversity to drive our business results and create a better future, every day, for our diverse employees, global consumers, partners, and communities. We believe a diverse workforce allows us to match our growth ambitions and drive inclusion across the business. At Unilever we are interested in every individual bringing their ‘Whole Self’ to work and this includes you! Thus if you require any support or access requirements, we encourage you to advise us at the time of your application so that we can support you through your recruitment journey.Show moreShow less",N/A,On-site/Hybrid,https://www.linkedin.com/jobs-guest/jobs/api/jobPosting/4309148141,2025-10-13
Cientista de Dados Junior | Vaga Afirmativa para Pessoas Negras,Cielo,"Barueri, São Paulo, Brazil",1 week ago,"Somos mais que uma máquina, somos pessoas que transformam ecriam infinitas possibilidades.Trabalhamos parasimplificar e impulsionar negócios para todas as pessoas, oferecendo soluções financeiras inteligentes. Aqui, investimos emtecnologia, promovemosdesenvolvimentoe fomentamos ainovaçãopara criar novos caminhos possíveis e gerar impacto positivo no mundo.Na Cielo, a gente trabalha comautonomiapara escrever nossa própria jornada,liberdadepara ser quem a gente é, e a oportunidade defazer acontecer. Somos um time quesonha no plural, oferecendo uma experiência completa e focando no bem-estar físico e mental de nossos mais de 7.000 colaboradores e suas famílias.Acreditamos nainclusão e acolhimentode todas as pessoas, com suas singularidades e diversidade de vivências.Bora realizar seus sonhos com a gente!Responsabilidades e atribuiçõesTem lugar para você nesse propósito:Atuar em projetos de análise de dados complexos, identificando oportunidades de negócios e fornecendo insights acionáveis;Projetar e implementar modelos de Machine Learning para resolver problemas desafiadores e otimizar processos;Coletar, limpar, transformar e organizar grandes conjuntos de dados de várias fontes, garantindo a qualidade e a integridade dos mesmos;Realizar análises estatísticas para extrair informações relevantes e criar visualizações e relatórios detalhados;Colaborar com equipes multidisciplinares para entender os requisitos de análise de dados e fornecer soluções de alto nível;Acompanhar as últimas tendências e avanços em análise de dados e modelos de Machine Learning, e avaliar sua aplicabilidade nos projetos da empresa.Requisitos e qualificaçõesO que o #TimeCielo espera de você?Formação acadêmica cursando ou completa em Engenharia, Estatística, Ciência da Computação ou áreas relacionadas;Conhecimento em análise de dados, incluindo a capacidade de lidar com conjuntos de dados e extrair insights;Entendimento em modelagem estatística;Conhecimento em linguagens de programação usadas em análise de dados, como Python, R, SQL, entre outras;Entendimento em técnicas de visualização de dados e ferramentas relacionadas;Forte ética de trabalho e automotivação para atuar em tarefas e projetos simultaneamente.Informações adicionaisPor que viver infinitas possibilidades ao nosso lado?Assistência Médica e Odontológica;Remuneração Variável Anual (PPR);Auxílio Refeição e Alimentação;Fretado/vale-transporte ou estacionamento;Modelo Híbrido;Auxílio Trabalho Remoto;Seguro de Vida;Seguro residencial e automóvel;Assistência funeral familiar;Previdência Privada;Canal de apoio à especialistas (nutrição, psicologia, ginecologia, etc);Campanha de Vacinação;Acesso à diversos cursos em nossa plataforma Educa;Wellhub;Programa de Gestação Saudável;Licença Maternidade e Paternidade estendida;Auxílio Creche;Day Off de Aniversário;Dress Code Flexível;Horário Flexível;Sexta curta;Almoço estendido (1h30).Show moreShow less",N/A,On-site/Hybrid,https://www.linkedin.com/jobs-guest/jobs/api/jobPosting/4297714361,2025-10-13
Cientista de Dados Especialista I,Porto,"São Paulo, São Paulo, Brazil",4 days ago,"Descrição da vagaO que faz a área Ciência de Dados na Porto?A área de Ciência de Dados, IA e P&D tem como foco entender o comportamento dos clientes da Porto e, a partir disso, potencializar a geração de valor para a empresa através de modelos, análises, estudos e Inteligências Artificiais.Principais desafios da função:A função exige um conhecimento teórico bastante sólido e uma facilidade de aplicação dos mesmos em problemas práticos. O dia a dia da área exigirá rotinas de testes e experimentações, onde será necessário validar hipóteses com celeridade. Além disso, é importante ter uma boa capacidade de interlocução com gestores e saber transcrever os pontos de pesquisa na linguagem do negócio.Responsabilidades e atribuiçõesResponsável por estudos, análises e modelos em ciência de dados aplicada a negócios.Encontrar caminhos e soluções para problemas de negócios apresentados pela gestão e por áreas clientes, tendo o equilíbrio de contribuir de forma autônoma, mas sendo colaborativo com colegas e pares.Requisitos e qualificaçõesFormação superior completa Matemática, Estatística, Engenharias, Ciência da Computação e/ou áreas correlatas;Experiência mínima de 4 anos em times de Ciência de Dados;Sólida bagagem teórica, com a capacidade de aplicá-la em problemas de negócio;Storytelling sólido para conseguir explicar e transcrever como as aplicações impactam nos resultados;Conhecimento profundo em matemática e estatística;Conhecimento de diferentes tipos de algoritmos de machine learning: classificação, regressão, clusterização, entre outros;Conhecimento avançado em Python, SQL, Spark (ou PySpark).Desejável:Mestrado e/ou doutorado;Conhecimento sólido em IA generativa;Conhecimento em modelos dinâmicos.Informações adicionaisBENEFÍCIOSVale Alimentação e Refeição Flexíveis;Plano de Saúde;Plano Odontológico;Wellhub e TotalPass;Academia Bio Ritmo exclusiva para Colaboradores:no Complexo Matriz;Participação nos Lucros - PLR;Programa de Ações: Porto em Ação:complementar à PLR até 2025;Quadras de Areia e Poliesportiva:no Complexo Matriz;Vale-Transporte;Serviços de Transporte de Vans;disponibilizadas nas principais estações de acesso à Porto (Luz, Barra Funda, Santa Cecília e Júlio Prestes);Licença Parental Estendida:até 40 dias para todas as configurações familiares;Licença Maternidade Estendidade 6 meses.;Ambulatório Médico com Especialidades:no Complexo Matriz e Barra Funda;Auxílio creche ou babá;Seguro de Vida;Previdência Privada - PortoPrev;Desconto em Produtos e Serviços;Bolsa de estudos: Reembolso para graduação, pós ou MBA;Corridas mensais:subsídio para as principais corridas de ruas de São PauloReembolso para idiomas (inglês ou espanhol);Teatro Porto:sessões exclusivas para Colaboradores;Biblioteca;Sala de descanso:no completo MatrizSalão de jogos:no complexo MatrizServiços de massagem e podologia:no completo MatrizLocal de trabalho:Campos Elísios(4x presencial 1x home);Na Porto, Você Importa!A Porto é muito mais que uma seguradora: é um ecossistema gigante que utiliza tecnologia para criar soluções, através de quatro verticais de negócio:Porto Bank, Porto Saúde, Porto Seguro e Porto Serviço.A reputação e o reconhecimento conquistados ao longo de mais de 7 décadas reforçam o tamanho da Porto, uma empresa referência em negócios, feita para e por pessoas.Aqui, bate no peito de 13 mil colaboradores oorgulho de fazer parte de uma organização sólida e ética,que transforma sonhos em realidades fantásticaspara os nossos mais de 15,8 milhões de clientes. São mais de 101 sucursais e escritórios regionais em todo o Brasil.O aprendizado faz parte do nosso DNA, e aqui, você teráincentivos, ferramentas e gente boa para você aprender e crescer, a cada dia,um ambiente de acolhimento e segurança, onde cada um possa ser e se orgulhar de quem se é, promovendo um espaço de respeito evivendo de forma integral e com bem-estar, em uma empresa genuinamente humana.DIVERSIDADE & INCLUSÃO NA PORTOAqui na Porto, valorizamos a diversidade e acreditamos que um time plural é imprescindível para o desenvolvimento de todo o nosso negócio, da sociedade, e de cada pessoa, pois entendemos que cada indivíduo é único na construção de um ambiente mais inovador e inclusivo. Juntos, trabalhamos diariamente para construirmos um espaço seguro, livre e acolhedor, com mais pluralidade e respeito. Por isso,incentivamos fortemente a inscrição de mulheres, de pessoas negras e indígenas, de pessoas com deficiência e de pessoas LGBTQIA+em todas as nossas vagas.Show moreShow less",N/A,On-site/Hybrid,https://www.linkedin.com/jobs-guest/jobs/api/jobPosting/4298118410,2025-10-13
Cientista de Dados Sr. - (Atuação na Mobiauto),Banco PAN,"São Paulo, São Paulo, Brazil",2 days ago,"Somos oPANÁgeis, flexíveis e criativos, exploramos possibilidades com disposição e desejo de fazer acontecer. Sempre prontos para encarar novos desafios, nutrimos líderes que, além de ter garra, são abertos e empáticos, veem na proximidade das relações, o elo entre cada um.Nossa missão, se faz cumprida quando transformamos a vida dos outros através dos nossos conhecimentos. Nossos pilares de cultura, reforçam nossa postura idealizadora e com desejo de fazer acontecer:Trabalho em equipe, Transparência , Excelência e Eficiência com profundidade.Dominamos nossos processos e trazemos melhorias para quem deseja ter umavida financeira mais inteligente.Essa oportunidade é para atuar na equipe da Mobiauto uma empresa do Grupo PAN.Aárea de Dadosé responsável por prover acesso aos dados através de uma plataforma confiável, acessível e escalável para as áreas de negócio e produto. Somos também responsáveis por desenvolver e criar novos produtos de dados para atender o cliente final com novas tecnologias e inteligências artificiais generativas. Nosso objetivo é ajudar a empresa a usar os dados com inteligência e agilidade.Principais desafios:Desenvolvimento de produtos de dados com uso de IA generativa (modelos LLMs), desde definição e refinamento do problema até a implementação final do projeto;Analises de dados mais complexas ajudando a empresa com insights relevantes para tomada de decisão;Modelagem de dados refinando dados, regras de negócio e definindo métodos de uso eficientes.Quais as principais competências para a posição?Ensino Superior Completo exatas e preferencialmente em TI, como: Sistema da Informação, Ciência da Computação, Engenheira da Computação e Estatística.Ter experiência consolidada em ciência de dados com projetos tradicionais de ciência de dados (Machine Learning e modelos estatísticos) e/ou uso de IA generativa (modelos LLMs);Desejável conhecimento em ferramentas do GCP (Google Cloud Platform), como: VertexAI, Gemini, BigQuery, Cloud SQL (PostgreSQL e/ou MySQL), Cloud Storage, Cloud Function, Cloud Data Fusion, Cloud Dataflow, Cloud Dataproc, Looker/Looker Studio e outras;Desejável conhecimento em ferramentas open source, como: MLFlow, AirFlow, DBT, Delta/Iceberg, Apache Superset, Metabase e outras;Solido conhecimento nas linguagens Python, Spark (PySpark) e SQL;Solida experiencia com programação e lógica de programação;Solida experiencia em modelagem de dados para produtos de dados, analises e dados refinados;Desejável conhecimento e vivência em ferramentas de versionamento como GitHub, GitLab e/ou outras;Desejável conhecimento de arquitetura de dados e plataforma de dados com conceitos e métodos de DataLake, Data Mesh e arquitetura Data Lakehouse;Vivência em projetos ágeis e desenvolvimento produtos de dados.Modelo de atuação: Home-Office.Benefícios do Mobiauto:🍽️ Vale Refeição e Vale Alimentação🚍 Vale Transporte;💸 Participação nos Lucros e Resultados (PPR) com base em avaliação de desempenho;🏥 Convênio médico com plano apartamento (sem desconto mensal + coparticipação);👨‍👩‍👧 Inclusão de dependentes no convênio médico, sem custo adicional;😁 Plano odontológico sem desconto mensal;Desconto de 35% em escola de idiomas;💳 Empréstimo consignado;🏋️‍♂️ Acesso ao GymPass para benefícios em academias e atividades físicas;🎉 Day Off no aniversário para celebrar seu dia com liberdade;🎭 Parceria exclusiva com o SESC para programas culturais e de lazer;🚗 Desconto especial na locação de veículos com a Movida;🛡️ Seguro de Vida para maior segurança e tranquilidade.Assim como todas as nossas vagas, essa também é destinada à diversidade e inclusão. Independentemente de qualquer fator, perfil ou característica,Expanda sua carreira no PAN!Para conhecer mais sobre nossos benefícios e cultura, acesse o Trabalhe Conosco:https://www.bancopan.com.br/trabalhe-conosco/Show moreShow less",N/A,On-site/Hybrid,https://www.linkedin.com/jobs-guest/jobs/api/jobPosting/4292801863,2025-10-13
"Cientista de Dados e Analista de Dados Jr, PL e Sr - Exclusivo para PcD",QiBit,"São Paulo, São Paulo, Brazil",5 days ago,"Objetivo da posição: Profissional com experiência em bancos e fintechs, com foco em políticas de crédito, modelagem de risco e análise de dados.Domínio técnico em linguagens de programação e ferramentas analíticas.Vaga Exclusiva para PcDRequisitos técnicos:Linguagens: SQL, Python, SAS, VBA.Analise de Dados.Experiência com modelagem de inadimplência (PD, behavior score).Desenvolvimento de políticas de crédito e backtesting.Elaboração de dashboards e estudos ad-hoc.Certificação CPA-20.Competências comportamentais:Perfil analítico e estruturado.Boa comunicação com stakeholders e comitês executivos.Capacidade de traduzir dados em decisões estratégicas.Informações adicionais:Modelo de contratação CLT;Atuação Hibrida.(3x por semana presencial e 2x remoto)Local:Vila Olimpia - SPBenefícios:✓ Remuneração variável (PLR + RV)✓ Assistência médica e odontológica✓ Auxílio alimentação – R$ 874,78✓ Refeição – R$ 1.110,12✓ Previdência complementar✓ Seguro de vida✓ Auxílio creche/babá✓ Gympass ou Totalpass✓ Vale-transporte✓ Programa Nascer (apoio à maternidade/paternidade)✓ Be Healthy – incentivo a hábitos mais saudáveis✓ PAPE – Programa de Apoio Pessoal EspecializadoAs etapas citadas acima poderão sofrer alterações de acordo com o andamento do processo seletivo. Mas não se preocupe, estaremos sempre te atualizando :)Acredita que este desafio é pra você? Clique em “Candidatar-se para vaga”, já estamos te esperando! 🤩🚀💙#Changelives 🚀💙Show moreShow less",N/A,On-site/Hybrid,https://www.linkedin.com/jobs-guest/jobs/api/jobPosting/4311702507,2025-10-13
Espec II -  Ciência de Dados,Safra,"São Paulo, São Paulo, Brazil",2 weeks ago,"No Banco Safra, a Inteligência Artificial é um motor da transformação digital, promovendo eficiência, inovação e geração de valor. Integrada aos processos críticos, a IA apoia decisões estratégicas com base em dados e tecnologia de ponta.Dentro dessa estrutura, a Ciência de Dados tem papel central, atuando de forma transversal para organizar, interpretar e transformar dados em insights relevantes. A equipe é formada por especialistas em ciência de dados, engenharia de dados e ML Ops, que unem profundidade técnica à visão de negócio.Estamos formando uma nova Squad de Dados e buscamos profissionais sêniores para atuar com modelos descritivos e diagnósticos em diversas áreas do banco. A atuação será em ambiente de Data Lake Cloudera, com forte integração entre negócio e tecnologia.Vagas abertas:Especialista – Foco Descritivo e DiagnósticoEspecialista – Foco PreditivoEngenheiro(a) de DadosRequisitos:Experiência em bancos, fintechs, seguradoras ou consultorias de dadosDomínio em modelagem estatística, ML, análise preditiva e dashboardsVivência com grandes volumes de dados e arquiteturas modernasComunicação clara com áreas de negócioPerfil analítico e estratégico.Conhecimentos obrigatórios:Python (pandas, numpy, scikit-learn, matplotlib)SQL avançadoCloudera e Data LakePower BIModelagem estatística e machine learningETL em camada de negóciosVisualização de dados e storytelling analítico.Desejáveis:NoSQL (MongoDB, Cassandra)ML Ops, TensorFlow, KerasGit.IA GenerativaShow moreShow less",N/A,On-site/Hybrid,https://www.linkedin.com/jobs-guest/jobs/api/jobPosting/4302670317,2025-10-13
