title,company,location,posted,description,applicants,work_mode,link,data_coleta
Analista de Melhoria Contínua (Genesis Genomics),Grupo Fleury,"São Paulo, São Paulo, Brazil",1 week ago,"Detalhes da vagaGenesis Análise Genômicasum laboratório referência do país em sequenciamento genético e diagnóstico aplicado para mais diversas áreas da medicina. O laboratório possui soluções desenvolvidas para armazenamento, processamento e análise de dados genéticos em larga escala na nuvem.Quais são os desafios da área e do cargo:Pessoa com perfil hands on, que tenha paixão por desafios e atue ativamente na proposição e implementação de melhorias em processos organizacionais. Essa pessoa será responsável por liderar iniciativas de otimização com foco em eficiência operacional, redução de custos e elevação da qualidade dos serviços.Se você tem interesse em fazer parte desse propósito e deseja estar sempre um passo a frente do mercado, vem com a gente!Principais AtividadesMapear, analisar e redesenhar processos (AS IS / TO BE), identificando pontos críticos e propondo melhorias sustentáveis com base em dados quantitativos e qualitativos;Atuar de forma prática e colaborativa com as áreas envolvidas, desde o diagnóstico até a execução das iniciativas de melhoria;Priorizar oportunidades com base em impacto e viabilidade, estruturando planos de ação e garantindo sua implementação;Acompanhar e monitorar os indicadores de performance (KPIs) dos processos, assegurando a sustentação das mudanças realizadas;Apoiar os times de negócio com análise de impacto, desenvolvimento de indicadores e relatórios de pré e pós-implantação;Promover e conduzir a gestão da mudança, garantindo o engajamento das partes interessadas e a aderência às novas práticas;Apresentar reportes estruturados ao comitê ou à governança do projeto, comunicando avanços, resultados e próximos passos.Buscamos Alguém Que ApresenteSuperior completo;Experiência sólida com mapeamento e redesenho de processos, análise de dados e projetos de melhoria contínua;Conhecimento em metodologias ágeis.Antes da inscrição na vaga, é importante verificar se você atende aos requisitos e se conecta com nosso propósito.Nossa essência inspira o dia a dia, por isso, buscamos pessoas apaixonadas pelo que fazem, e que:Estimulem um ambiente de troca de conhecimentos, compartilhando experiências, possibilitando a interdependência entre os times;Estejam em constante movimento, investindo em autodesenvolvimento e atuando como facilitadora no desenvolvimento das outras pessoas;Busquem consciência social de diversidade e inclusão, cooperando com a construção de um ambiente colaborativo;Identifiquem e antecipem as necessidades dos clientes, agindo prontamente para encontrar soluções adequadas e personalizadas;Planejem e executem o trabalho com excelência a fim de atingir os resultados esperados, com a visão de inovação e agilidade;Gerem e implementem novas ideias, buscando constantemente por melhorias para a experimentação de novas abordagens e a adaptação às mudanças do mercado.Informações Da VagaModelo de Trabalho: HíbridoCarga Horária: 220hEscala: Segunda a sexta-feiraHorário de Trabalho: 08h às 17h48Cuidamos de você em cada etapa da sua jornada!Saúde e Bem-estarAssistência médica e odontológica para você e sua família;Ambulatório com clínica médica ou atendimento por telemedicina;Linhas de cuidado especializadas: gestantes, adoção, obesidade, oncologia, entre outras;Acesso à plataforma OrienteMe para sessões de terapia e orientação nutricional;Licença maternidade e paternidade estendidas;Acesso ao Wellhub para práticas esportivas e qualidade de vida.Proteção e EstabilidadeParticipação nos lucros;Seguro de vida.Facilidades Para o Dia a DiaVale-Alimentação;Vale-Refeição;Auxílio-Creche;Clube de Descontos com lojas, farmácias, viagem, beleza, cultura, lazer, entre outros serviços.Desenvolvimento e EducaçãoPlataforma de ensino;Parcerias educacionais com descontos em cursos e instituições.Aqui, o cuidado vai além dos benefícios — ele está presente em cada momento da sua trajetória.Promovemos uma cultura inclusiva, focada na equidade e na valorização das diferenças. Nossas vagas são abertas para todos os públicos e, simbolizando a nossa intencionalidade, oferecemos oportunidades afirmativas.Nosso compromisso vai além do cumprimento das legislações que incentivam a diversidade e inclusão. Trabalhamos ativamente para ampliar a representatividade de nossas pessoas, pensando em raça, etnia, gênero, gerações, pessoas com deficiência e LGBTQIAPN+ em nosso time, além de fortalecer a representatividade de mulheres negras, indígenas, chefes de família.Para conhecer mais sobre o Grupo Fleury, acesse o site: https://carreiras.grupofleury.com.br/Show moreShow less",N/A,On-site/Hybrid,https://www.linkedin.com/jobs-guest/jobs/api/jobPosting/4261744257,2025-07-12
AI/ML Engineer,OneSeven Tech (OST),Greater São Paulo Area,1 month ago,"DetailsAs an AI-First AI/ML Engineer, you'll be architecting and deploying intelligent systems that leverage cutting-edge AI technologies including LangChain orchestration, autonomous AI agents, and robust AWS cloud infrastructure. We are seeking expertise in modern AI/ML frameworks, agentic systems, and scalable backend development using Node.js and Python. Your AI-powered engineering approach will create sophisticated machine learning solutions that drive autonomous decision-making and solve complex business challenges at enterprise scale.About YouYou are an AI/ML specialist who has fully embraced AI-first development methodologies, using advanced AI tools (e.g., Copilot, ChatGPT, Claude, CodeLlama) to accelerate your machine learning workflows. You're equally comfortable building LangChain orchestration pipelines, deploying Hugging Face models, developing autonomous AI agents, and architecting scalable AWS backend systems using Node.js and Python.You move FAST - capable of shipping complete, production-ready features within 1 week cycles.You are a proactive person and a go-getter, willing to go the extra mile.You understand that modern AI engineering means creating intelligent systems that can reason, learn, and act autonomously while maintaining reliability and performance. You thrive using TDD methods, MLOps practices, and Agile methodologies while focusing on finding elegant solutions to complex AI challenges.This is a hybrid role where you'll be spending your time across 4 core functions:Internal Projects (25%) - Building and maintaining OneSeven's internal AI tools and platformsSales Engineering (25%) - Supporting sales team with technical demos, proof-of-concepts, and client presentationsAI-First Engineering and Innovation Sprints (25%) - Rapid prototyping and innovation on cutting-edge AI technologiesForward Deployed Engineering (25%) - Working directly with clients on-site or embedded in their teams to deliver solutionsQualificationsTechnical RequirementsCore AI/ML Skills4+ years AI/ML development experience with production deploymentsFluent English required - strong written and verbal communication skills for direct client interaction9am-5pm EST availability with reliable workspace/internet - willing to work extra hoursFAST execution mindset - must be able to ship complete features within 1 weekStrong system architecture experience - designing scalable, distributed AI/ML systemsExpert-level LangChain experience for AI orchestration and workflow managementHugging Face experience - transformers, model integration, and deploymentExtensive AI Agent development with LangChain or Google Vertex AIHeavy AWS cloud experience, particularly with Bedrock, SageMaker, and AI/ML servicesBackend generalist comfortable with Node.js and Python for AI service developmentAgile methodologies experience, startup environment passionIndependent problem-solver, team player willing to work extra hoursAI Agent & LangChain Expertise (Required)LangChain framework mastery for complex AI workflow orchestrationHugging Face integration - transformers, model deployment, and API integrationAI Agent architecture design with LangChain or Google Vertex AIPrompt engineering and chain-of-thought optimizationVector databases and embedding systems (Pinecone, Pgvector, Chroma)RAG pipeline development and optimizationLLM integration across multiple providers (OpenAI, Anthropic, AWS Bedrock, Hugging Face)Agentic system design with memory, planning, and execution capabilitiesBackend & Cloud InfrastructureHeavy AWS Cloud services experience (Lambda, API Gateway, S3, RDS, SageMaker, Bedrock)System architecture design for high-scale, distributed AI/ML applicationsMicroservices architecture and design patterns for AI systems at scaleNode.js and Python backend development for AI service APIsRESTful API design and GraphQL for AI service integrationDatabase design and management for AI data workflowsModern JavaScript/TypeScript and Python async programmingMLOps & IntegrationCI/CD pipelines and GitHub Actions for ML model deploymentModel versioning, monitoring, and automated retraining workflowsContainer orchestration (Docker, Kubernetes) for AI servicesPerformance optimization for high-throughput AI systemsModern authentication and secure API design for AI endpointsAPI security implementation (XSS, CSRF protection)Bonus QualificationsAdvanced Hugging Face experience (fine-tuning, custom models, optimization)Multi-modal AI experience (vision, audio, text processing)Advanced prompt engineering and fine-tuning experienceDevOps and infrastructure as code (Terraform, CloudFormation)Database optimization for vector search and AI workloadsAdditional cloud platforms (Azure AI, Google Vertex AI)Knowledge graph integration and semantic reasoningProject DeliverablesYou'll be working on building a comprehensive AI-powered business intelligence system with autonomous agent capabilities. Key deliverables include:Core AI Agent PlatformMulti-agent orchestration system with LangChain workflow managementAutonomous reasoning agents with tool integration and decision-making capabilitiesIntelligent document processing pipeline with advanced OCR and classificationReal-time AI analysis dashboard with predictive insights and recommendationsAdvanced AI WorkflowsRAG-powered knowledge synthesis with multi-source data integrationAutomated business process agents with approval workflows and notificationsAI-driven anomaly detection with proactive alerting and response systemsIntelligent API orchestration with dynamic routing and load balancingComprehensive agent performance monitoring with usage analytics and optimization insightsIntegration & Deployment SystemsScalable AWS backend infrastructure with auto-scaling AI servicesProduction MLOps pipeline with automated model deployment and monitoringMulti-tenant AI service architecture with usage tracking and billing integrationReal-time AI API gateway with rate limiting and authenticationBenefits/CompensationFully Remote, Contract-based with U.S. company$4,000/mo - $8,000/mo depending on experience and project durationCompany-paid PTO plan, 9am-5pm EST, international team of 15+To ApplySEND YOUR RESUME IN ENGLISH, please.Include the URL of your LinkedIn profile.Include Website references, GitHub repositories, and any other online references that would highlight your prior work for the qualifications described in this role.⚠️ AUTOMATIC DISQUALIFICATION: You will be automatically disqualified if your resume is not in English or you don't include your LinkedIn profile URL.About OneSeven TechOneSeven Tech is a premier digital product studio serving both high-growth startups and established enterprises. We've partnered with startup clients who have collectively raised over $100M in Venture Capital, while our enterprise portfolio includes 2000+ person hospitality groups and publicly traded NASDAQ companies.Our passion lies in crafting exceptional AI-powered digital products that drive real business success. Joining OneSeven means working alongside a skillful team of consultants where you'll sharpen your AI/ML expertise, expand your capabilities, and contribute to cutting-edge solutions for industry-leading clients.OST's headquarters is in Miami, Florida, but our employees work remotely worldwide. Our 3 main locations are Miami, Mexico City, Mexico, and Buenos Aires, Argentina.Show moreShow less",N/A,Remote,https://www.linkedin.com/jobs-guest/jobs/api/jobPosting/4241286395,2025-07-12
Engenheiro AI,Distrito,"São Paulo, São Paulo, Brazil",1 month ago,"A posição de AI Software Architect exige uma combinação de visão estratégica e expertise técnica em inteligência artificial, habilidades interpessoais e interesse em atuar próximo ao universo comercial. O foco está na construção de propostas assertivas durante a prospecção e no fortalecimento do relacionamento com clientes, garantindo soluções alinhadas às necessidades de negócio e escaláveis para o futuro.Principais atividades:Engenharia de inteligência artificial e machine learningResponsabilidades:Colaborar com o Arquiteto de Soluções AI para transformar demandas de negócios em modelos e pipelines de ML/IA escaláveis e eficientes.Implementar modelos de IA, validando performance e garantindo integração nas arquiteturas existentes.Desenvolver pipelines robustos de dados: coleta, processamento, treinamento e deploy de modelos.Integrar soluções de IA em ambientes de produção, alinhando-se às melhores práticas de MLOps (monitoramento, automação e escalabilidade, conhecimento sobre MlFlow ou plataformas como AzureML ou Google VertexAI).Trabalhar próximo ao time comercial e de produto para prototipar e validar propostas, com entregas iterativas e soluções centradas no cliente.Participar ativamente na avaliação de riscos técnicos (performance, escalabilidade, segurança) e colaborar na aplicação de soluções preventivas.Garantir o uso eficiente de ferramentas cloud (AWS, Azure, GCP) no desenvolvimento e deploy de soluções.Colaborar na criação de documentação técnica e melhores práticas em alinhamento com o arquiteto e outros stakeholders.Requisitos:Experiência em desenvolvimento e deploy de modelos de Machine Learning e Deep Learning.Domínio de linguagens de programação como Python (TensorFlow, PyTorch, Scikit-learn, Pandas).Experiência com ferramentas de MLOps e CI/CD (MLflow, Kubeflow, Jenkins, GitLab CI).Sólida experiência com bancos de dados SQL e NoSQL e práticas de otimização de consultas.Experiência com serviços cloud computing (AWS, Azure ou GCP) e containers (Docker, Kubernetes).Familiaridade com arquiteturas de sistemas, pipelines de dados e boas práticas de integração de APIs (REST, GraphQL).Diferenciais:Experiência com AI Generativa e modelos LLMs (ex.: GPT, BERT).Experiência com orquestração em nuvem com ferramentas como airflow, data factory, Databricks pipelines.Experiência em com Docker, Docker Compose, Kubernetes ou ferramentas como Azure Container Apps (ou relativas).Vivência em ambientes com metodologias ágeis (Scrum, Kanban).Experiência colaborando em projetos com arquitetos de soluções ou times comerciais.Etapas do processo seletivo:✍ Candidatura: Esse é o primeiro passo para iniciar sua jornada com a gente. Nesta etapa, você faz o cadastro e responde a algumas perguntas. Nosso time vai analisar suas informações com atenção e, em caso de alinhamento com a vaga, entraremos em contato.💻 Entrevista com o time de Gente e Gestão: Esse é o momento de bater um papo com nosso time para conhecer melhor nossa cultura, como nos organizamos e o desafio que temos para você. Vamos te contar tudo sobre o nosso jeito de trabalhar e ouvir suas expectativas!🎯 Entrevista com a liderança: Nesse momento, vamos explorar suas competências técnicas para a vaga. Além disso, você vai conhecer a pessoa que lidera o time e poderá tirar todas as suas dúvidas sobre a área e as atividades do dia a dia.📝 Desenvolvimento e apresentação de case: Nesta etapa, você vai receber um case técnico para demonstrar suas habilidades e conhecimentos específicos.🚀 Bate-papo com a Diretoria: Nesta etapa, você vai conhecer mais sobre nossa visão e compartilhar suas impressões.🏁 Feedback: A transparência é uma parte essencial da nossa cultura. Por isso, independentemente do resultado, vamos compartilhar o feedback com você e alinhar os próximos passos.Nossos benefícios:🍝 Vale-refeição e/ou vale-alimentação de R$35,10/por dia útil no cartão Ifood;🏥 Convênio Médico SulAmérica (100% custeado pela empresa);🦷 Plano Odontológico MetLife;🐶 Plano de saúde Pet;🏥 Seguro de vida;🤸🏼‍♂️ Totalpass e Wellhub para manter as atividades físicas a qualquer hora e lugar;🎂 Birthday Day Off para curtir no seu aniversário como quiser;🥳 Parceria com o Sesc;✈️ Parceria com a OnHappy (descontos em hotéis e passagens);📖 Parceria com instituições de ensino;👶🏼 Reembolso creche;💻 Equipamentos de trabalho (Pode parecer óbvio, mas achamos importante reforçar);📚 Cultura de feedback e desenvolvimento;🤩 Ambiente dinâmico e com grandes oportunidades de crescimento;💰 Remuneração variável em reconhecimento de desempenho, performance e alinhamento de cultura.Sobre nós:Somos a transformação em negócios. Ajudamos nossos clientes com inovação e novas tecnologias de ponta a ponta, da estratégia a execução.Nossa Cultura se desenvolve e evolui com o tempo, ou seja, nada é escrito em pedra. Buscamos sempre nos atualizar, afinal, não existe certo ou errado quando falamos de cultura, mas escolhemos seguir atitudes que são reflexo dos nossos valores:#Somos pessoas provocativas e fazemos acontecer.#Somos parceiros, fazemos parte de equipes plurais, inclusivas e diversas, e estamos aqui para somar.#Somos vibrantes e entendemos que resultado também é o nosso propósito.Criamos um espaço seguro para discussões sobre DE&I e promovemos iniciativas que tornam o nosso ambiente cada vez mais diverso, com equidade e inclusão, visando reduzir a violência, a discriminação, desigualdade, preconceitos sociais, sexuais, étnico-raciais e de identidade de gênero.Nosso site: https://distrito.me/Show moreShow less",N/A,On-site/Hybrid,https://www.linkedin.com/jobs-guest/jobs/api/jobPosting/4245964312,2025-07-12
Applied Scientist II (Payments),Uber,Greater São Paulo Area,4 days ago,"About The TeamWe are looking for anApplied Scientist(Machine Learning Scientist) to join our Payments team and make meaningful contributions to our mission to streamline and optimize Uber's global payment experiences.In this role, you will be able to use your strong quantitative skills in the fields of machine learning, statistics, economics, operations research, as well as underwriting principles and practices, to improve the Uber Payments experience.We are looking for candidates with a passion for solving new and difficult problems with data and we specifically seek candidates with experience in underwriting and developing models to evaluate financial exposure, as these skills are crucial for effectively managing and optimizing payment processes.About The RoleDesign, build, deploy machine learning, statistical, optimization models into Uber production systems for a wide range of applications.Design, build, and deploy data pipelines into Uber production.Collaborate with multi-functional teams across areas such as product, engineering, operations, and design to drive system development end-to-end from conceptualisation to productionization.Understanding product performance and to find opportunities within data.Present findings to senior management to influence business decisions.Technical SkillsRequiredHigh-intermediate to fluent EN skills.Senior and/or Staff seniority as a Data Scientist, Applied Scientist and/or Machine Learning Engineer/Scientist.Experience working with credit modellingIndustry experience in ML frameworks (e.g. Tensorflow, Pytorch, or XGBoost) and complex data pipelines; programming languages such as Python, PySpark, Spark SQL.Thought leadership to drive multi-functional projects from conceptualisation to productionization.Strong communication skills and can work effectively with cross-functional partners.Experience developing complex software systems, scaling them with production quality deployment, monitoring, and reliability.Please note:this hybrid position is based in São Paulo, Brazil - welcoming both local professionals and those open to relocating to São Paulo.Show moreShow less",N/A,On-site/Hybrid,https://www.linkedin.com/jobs-guest/jobs/api/jobPosting/4263447307,2025-07-12
Machine learning,Netvagas,"São Paulo, São Paulo, Brazil",57 minutes ago,"Estamos em busca de uma pessoa Engenheira de Machine Learning para integrar nossa equipe de Soluções IA e ser responsável por aplicar técnicas de aprendizado de máquina em projetos inovadores, ajudando a construir soluções inteligentes para nossos produtos e clientes.Se você possui paixão por tecnologia, tem conhecimentos em dados e está em busca de oportunidades para crescer na área, esta é a vaga ideal.ResponsabilidadesProjetar, desenvolver e implementar modelos de machine learning para resolver problemas de negócio diversos.Automatizar e otimizar processos relacionados ao ciclo de vida de modelos: desde a experimentação, treinamento, deploy até o monitoramento em produção.Trabalhar em colaboração com equipes de Ciência de Dados, Engenharia de Dados e Produto, garantindo que os modelos sejam integrados de forma eficiente aos sistemas.Garantir a escalabilidade, eficiência e confiabilidade das soluções de machine learning em ambientes de produção.Participar da definição de arquiteturas e pipelines de MLOps para automação e governança de modelos.Monitorar o desempenho dos modelos e ajustar parâmetros conforme mudanças nos dados e nos objetivos de negócio.Documentar soluções, boas práticas e contribuir para a evolução contínua dos processos e padrões técnicos.Pesquisar e implementar novas técnicas e ferramentas que impulsionem a inovação em machine learning.RequisitosGraduação completa ou em andamento em Ciência da Computação, Engenharia, estatística, matemática, ou áreas correlatas.Programação em Python ou outras linguagens adequadas para machine learning.com bibliotecas e frameworks de machine learning e deep learning (ex.: Scikit-learn, TensorFlow, PyTorch).Conhecimento de fundamentos de estatística, aprendizado supervisionado e não supervisionado.Experiência com versionamento de código (ex.: Git) e práticas de desenvolvimento de software.Noções de deployment e monitoramento de modelos.DiferenciaisExperiência prática com MLOps e ferramentas de automação de pipelines (ex.: MLflow, Kubeflow, Airflow).Conhecimento em computação em nuvem (AWS, Azure ou GCP), especialmente serviços de IA/ML.Experiência com containers e orquestração (ex.: Docker, Kubernetes).Implementação de soluções de machine learning em ambientes de produção com requisitos de escalabilidade e segurança.Participação em projetos que envolvam modelos de NLP, visão computacional ou sistemas de recomendação.Perfil ProfissionalMentalidade analítica e orientação para a resolução de problemas complexos com pragmatismo.Proatividade na busca de soluções e na melhoria contínua de processos e modelos.Colaboração ativa com diferentes áreas e habilidades de comunicação clara, tanto para públicos técnicos quanto não técnicos.Organização, responsabilidade e atenção aos detalhes na entrega de soluções robustas e seguras.Interesse por aprendizado contínuo e atualização em relação às tendências e inovações em machine learning.Se você se identifica com essa oportunidade, inscreva-se! Nosso processo valoriza competências, potencial e diversidade de experiências.Show moreShow less",N/A,On-site/Hybrid,https://www.linkedin.com/jobs-guest/jobs/api/jobPosting/4265703560,2025-07-12
