title,company,location,posted,description,applicants,work_mode,link,data_coleta
Data Scientist Specialist,Banco Bradesco,"Osasco, São Paulo, Brazil",2 weeks ago,"Sobre o BradescoO Bradesco é um dos maiores grupos financeiros do Brasil, com uma história marcada pelo pioneirismo e inovação. Por meio da nossa carteira amplamente diversificada de produtos financeiros, serviços bancários e de seguros contribuímos com a realização das pessoas e o crescimento sustentável de empresas e sociedade. Venha fazer parte do nosso ecossistema financeiro e impactar a experiência de milhões de pessoas!Saiba mais em https://banco.bradesco/html/classic/sobre/index.shtmResponsabilidades e atribuiçõesO que é o nosso time de Pricing ?A área de Pricing é responsável pela definição e gestão estratégica de preços e condições financeiras dos produtos do banco, equilibrando rentabilidade, competitividade e risco. Atua com dados, modelagens e inteligência de mercado para apoiar decisões comerciais e impulsionar resultados sustentáveis em diversas linhas de negócio.Modelo de trabalho: Híbrido (3 dias presenciais e 2 dias remotos)Unidade: Osasco/SP (Matriz)Como será seu dia a dia?Sendo Data Scientist Specialist, atuará na gerência do Pricing e suas principais atividades serão:Elaborar curvas de demanda de produtos de crédito considerando atualizações nas características do cliente (e.g. produtos contratados, etapa do ciclo de vida), apoiando na definição da estratégia de precificação de produtos de crédito;Elaboração das curvas de demanda para todos os produtos de crédito, alavancando a visão cliente e alterações nas dinâmicas de mercado. Monitorando continuamente a performance dos modelos existentes, realizando recalibrações e ajustes conforme necessário para garantir sua acurácia e relevância;Conduzir análises de sensibilidade para entender como mudanças nas variáveis de precificação e nas condições de mercado afetam a demanda por empréstimos;Traduzir os resultados dos modelos em insights acionáveis, ajudando a definir estratégias de taxas de juros, termos e condições de empréstimos que maximizem a rentabilidade e o volume, considerando a elasticidade da demanda.Requisitos e QualificaçõesO que você precisa ter ou saber?Superior completo em áreas como Economia, Engenharia, Estatística, Ciência da Computação ou áreas correlatas.Sólida experiência com modelagem de demanda (elasticidade), preferencialmente com produtos de crédito.Será um diferencial se você tiver:Experiência com modelagem financeiraO que nós oferecemosNo Bradesco valorizamos a saúde e bem-estar, oferecendo um extenso portfólio de benefícios a todas nossas pessoas funcionárias.PLR ou Bônus: Conforme a elegibilidade de cargo*Convênio MédicoConvênio OdontológicoSeguro de VidaVale AlimentaçãoVale Refeição13º Cesta AlimentaçãoTotal PassVale Transporte (adesão opcional)Descontos em produtos e serviços em empresas parceirasPrevidência Privada (adesão opcional, com participação financeira da Organização Bradesco)Viva Bem Bradesco: programa de saúde, bem-estar e qualidade de vidaUnibrad: Universidade Corporativa BradescoIsenção de Tarifas: condições especiais em diversos produtos e serviçosAuxílio Creche ou BabáLicença Paternidade estendida de 20 diasLicença Maternidade de 180 dias, acompanhamento assistencial da gestação até o pós-partoShow moreShow less",N/A,On-site/Hybrid,https://www.linkedin.com/jobs-guest/jobs/api/jobPosting/4275216912,2025-08-07
Cientista de Dados Jr,Banco Bmg,"São Paulo, São Paulo, Brazil",17 hours ago,"Há mais de 90 anos, o Banco Bmg vem construindo uma trajetória de conquistas, onde o cliente é o protagonista.Somos campeões na oferta de consignado, proporcionando acesso ao crédito com juros mais baixos a milhões de brasileiros. Contamos com agências, franquias e um aplicativo, onde milhões de clientes acessam um mundo de soluções financeiras, na palma da mão. Além disso, possuímos a maior rede de correspondentes bancários do país, contribuindo para o placar de crescimento econômico local e espalhando oportunidades por todo o território nacional.Aqui no Bmg, nós vestimos a camisa e nos dedicamos para executar cada jogada com excelência, com um jeito todo nosso de ser e de fazer negócios, o Jeito Bmg.Trabalhamos para promover uma cultura diversa, que busca a equidade, valorizando as diferentes perspectivas. Isso se traduz em Gênero, Religião, Pessoas com Deficiência, LGBTQIAP+, acima dos 50 anos, Etnia e diversidade de experiências, tornando o nosso ambiente mais inclusivo e respeitoso, buscando cada vez mais aumentar a pluralidade dos times.Responsabilidades e atribuiçõesResponsabilidades e atribuições:Construir, treinar e otimizar modelos utilizando técnicas de aprendizado de máquina;Fazer gestão, acompanhamento e recalibragem dos modelos já implantados;Gerar insights, ad hoc's e estudos analíticos diversos;Construir segmentações baseadas em algoritmos de clusterização;Busca por novas fontes de dados, além das tradicionais disponíveis e estruturadas;Apresentar resultados de projetos de forma compreensível, sem perda de rigor científico;Auxiliar na expansão da cultura do uso da ciência de dados em outras frentes de negócio.Requisitos e qualificaçõesRequisitos e qualificações:Domínio em linguagem de programação Python e modelagem estatística;Habilidade com banco de dados (SQL, ORACLE, etc), visando a extração, limpeza, tratamento e organização dos dados;Entendimento de técnicas de Modelagem Estatística e Machine Learning;Vivência no desenvolvimento e acompanhamento de modelos preditivos e/ou prescritivos.Ter boa comunicação, proatividade, flexibilidade e foco em resultado também são essenciais para você fazer parte do time de Ciência de Dados.Formação superior completa preferencialmente em áreas de exatas.Disponibilidade para atuação híbrida em São Paulo.Informações adicionaisBenefícios, saúde e bem-estarPlano de saúde sem mensalidade e Telemedicina;Plano odontológico;Vale Refeição e Alimentação;Seguro de vida;Previdência privada;Remuneração variável anual (bônus) competitiva;PPR - Programa de Participação nos Resultados;Único Skill (Benefício Educação gratuito);Bicicletário e vestiário;Auxílio creche;Auxílio internet;Programas de qualidade de vida;Ambulatório;Programa da Gestante;Licença Maternidade e Paternidade estendidasPsicologia Viva - Sessões de terapia online gratuita;PAP - Programa de assessoria financeira, jurídica e psicológica;Gympass - Desconto em academias;Frutas todos os dias;Day Off de Aniversário;Dress Code Flexível;Modelo híbrido de trabalho.E aí? Quer vestir a camisa e brilhar em campo com um banco presente na vida de milhões de brasileiros e reconhecido como um dos melhores lugares para se trabalhar?#VamosPraCimaShow moreShow less",N/A,On-site/Hybrid,https://www.linkedin.com/jobs-guest/jobs/api/jobPosting/4278850277,2025-08-07
Data Scientist Specialist,Banco Bradesco,"Osasco, São Paulo, Brazil",2 weeks ago,"Sobre o BradescoO Bradesco é um dos maiores grupos financeiros do Brasil, com uma história marcada pelo pioneirismo e inovação. Por meio da nossa carteira amplamente diversificada de produtos financeiros, serviços bancários e de seguros contribuímos com a realização das pessoas e o crescimento sustentável de empresas e sociedade. Venha fazer parte do nosso ecossistema financeiro e impactar a experiência de milhões de pessoas!Saiba mais em https://banco.bradesco/html/classic/sobre/index.shtmResponsabilidades e atribuiçõesO que é o nosso time de Controladoria?A área de Controladoria tem a missão de garantir ao Grupo Bradesco informações gerenciais, resultados, análises e projeções com governança, bem como ser referência em análises, estudos e projeções de finanças para aumentar a qualidade e precisão das decisões tomadas pela Organização.Modelo de trabalho :Híbrido - 3x presencialUnidade: Osasco - SPComo será seu dia a dia?Sendo Data Scientist Specialist, atuará na gerência FP&A Indicadores e suas principais atividades serão:Desenvolver estudos para responder demandas de negócios, realizar diagnósticos de problemas e de performance de carteiras e identificar insights acionáveis e oportunidades de rentabilidade sustentável;Aplicar ferramentas analíticas que que suportem a área de FP&A a alavancar a rentabilidade sustentável do banco nos diversos segmentos de negócio empregando: Desenvolvimento de modelos estatísticos supervisionados e não supervisionados, elaboração de ferramentas para projeções de indicadores, condução de testes e experimentos, construção e gestão de simuladores de cenários, construção e gestão de dashboards e estudos para a geração contínua de insights acionáveis;Identificação e busca de novas fontes de dados e variáveis que adicionem valor ao negócio;Suporte no planejamento/organização/melhoria do pipeline de dados da área;Suportar as demais áreas de FP&A com estudos, insights e modelos estatísticos.Requisitos e QualificaçõesO que você precisa ter ou saber?Graduação superior completa em Engenharia, Estatística, Matemática, Ciências da Computação, Economia, Administração, Física ou áreas correlatas;Conhecimento em desenvolvimento de modelos estatísticos;Conhecimento em machine learning;Vivência com SQL;Vivência com Python;Vivência com ferramentas de visualização de dados;Vivência com Pacote Office.Será um diferencial se você tiver:Inglês nível avançado;Conhecimento em Databricks;Conhecimento em análise financeira;Conhecimento em IA generativa;Conhecimento em otimização matemática.O que nós oferecemosNo Bradesco valorizamos a saúde e bem-estar, oferecendo um extenso portfólio de benefícios a todas nossas pessoas funcionárias:PLR ou Bônus: Conforme a elegibilidade de cargo*Convênio MédicoConvênio OdontológicoSeguro de VidaVale AlimentaçãoVale Refeição13º Cesta AlimentaçãoTotal PassVale Transporte (adesão opcional)Descontos em produtos e serviços em empresas parceirasPrevidência Privada (adesão opcional, com participação financeira da Organização Bradesco)Viva Bem Bradesco: programa de saúde, bem-estar e qualidade de vidaUnibrad: Universidade Corporativa BradescoIsenção de Tarifas: condições especiais em diversos produtos e serviçosAuxílio Creche ou BabáLicença Paternidade estendida de 20 diasLicença Maternidade de 180 dias, acompanhamento assistencial da gestação até o pós-partoShow moreShow less",N/A,On-site/Hybrid,https://www.linkedin.com/jobs-guest/jobs/api/jobPosting/4269563969,2025-08-07
Data Scientist Specialist,Banco Bradesco,"Osasco, São Paulo, Brazil",1 day ago,"Sobre o BradescoO Bradesco é um dos maiores grupos financeiros do Brasil, com uma história marcada pelo pioneirismo e inovação. Por meio da nossa carteira amplamente diversificada de produtos financeiros, serviços bancários e de seguros contribuímos com a realização das pessoas e o crescimento sustentável de empresas e sociedade. Venha fazer parte do nosso ecossistema financeiro e impactar a experiência de milhões de pessoas!Saiba mais em https://banco.bradesco/html/classic/sobre/index.shtmResponsabilidades e atribuiçõesO que é o nosso time de Portifólio Varejo PF e PJ?A área de Gestão de Portfólio: Atua na análise estratégica e no monitoramento contínuo dos riscos e oportunidades da carteira de crédito. Nosso foco está na otimização da rentabilidade ajustada ao risco, na governança sobre concentração de crédito e na aplicação de soluções analíticas avançadas.Modelo de trabalho: Híbrido - 2x presencialUnidade: Osasco / CuritibaComo será seu dia a dia?Sendo Data Scientist Specialist , atuará na gerência Crédito e suas principais atividades serão:Realizar diagnósticos aprofundados sobre a composição, performance e concentração da carteira, com foco em rentabilidade ajustada ao risco;Desenvolver simulações e análises preditivas para antecipar riscos e oportunidades, apoiando decisões de negócio com base em dados;Construir e evoluir frameworks analíticos para gestão de risco, incluindo métricas de concentração, stress testing e indicadores de performance;Estruturar e aprimorar mecanismos de detecção precoce de deterioração de crédito, com base em sinais financeiros e comportamentais;Atuar de forma colaborativa com Risco, Estratégia, Analytics e Negócios, garantindo alinhamento entre análises técnicas e direcionamentos estratégicos;Traduzir análises complexas em insights claros e objetivos para fóruns de decisão, com forte capacidade de storytelling com dados.Requisitos e QualificaçõesO que você precisa ter ou saber?Graduação em Estatística, Matemática, Engenharia, Economia ou áreas correlatas;Vivência em gestão de portfólio de crédito e risco: Modelagem quantitativa e análise de grandes volumes de dados;Estratégias de crédito para empresas de grande porte ou atacado;Domínio em Python, SQL, SAS, Power BI, Databricks;Conhecimento sólido em técnicas preditivas e estatísticas.Será um diferencial se você tiver:Experiência de crédito para empresas de grande porte e atacado;Experiência com estratégia de early warning.O que nós oferecemosNo Bradesco valorizamos a saúde e bem-estar, oferecendo um extenso portfólio de benefícios a todas nossas pessoas funcionárias:PLR ou Bônus: Conforme a elegibilidade de cargo*Convênio MédicoConvênio OdontológicoSeguro de VidaVale AlimentaçãoVale Refeição13º Cesta AlimentaçãoTotal PassVale Transporte (adesão opcional)Descontos em produtos e serviços em empresas parceirasPrevidência Privada (adesão opcional, com participação financeira da Organização Bradesco)Viva Bem Bradesco: programa de saúde, bem-estar e qualidade de vidaUnibrad: Universidade Corporativa BradescoIsenção de Tarifas: condições especiais em diversos produtos e serviçosAuxílio Creche ou BabáLicença Paternidade estendida de 20 diasLicença Maternidade de 180 dias, acompanhamento assistencial da gestação até o pós-partoShow moreShow less",N/A,On-site/Hybrid,https://www.linkedin.com/jobs-guest/jobs/api/jobPosting/4280178363,2025-08-07
Cientista de Dados (área Business Development) - São Paulo/SP,Shopee,"São Paulo, São Paulo, Brazil",1 week ago,"About The TeamSobre a ShôAqui na Shô, acreditamos que cada membro de nossa equipe é fundamental para o nosso sucesso, e que diversidade de perspectivas e vivências são essenciais para movimentar nosso negócio e impulsionar o nosso propósito de mudar o mundo para melhor.Fazer parte do nosso time é a oportunidade de se desenvolver dentro de uma cultura de muita agilidade. Se você ama assumir grandes responsabilidades e fazer o que nunca foi feito, a Shô é seu lugar. Aqui você terá grandes desafios, trabalhará em colaboração com um time diverso e contribuirá para o futuro do e-commerce no Brasil, criamos impacto positivo na vida de milhões de pessoas.Modelo de TrabalhoAdotamos um modelo de trabalho híbrido, esse modelo permite que as pessoas ajustem seu ambiente de trabalho de acordo com suas necessidades pessoais, ao mesmo tempo em que promove a colaboração e interação no escritório.Qual será a sua missãoVocê atuará no time de Business Development e será responsável por estruturar e automatizar processos de coleta, classificação, organização e análise de dados que apoiem decisões estratégicas em um ambiente de negócio altamente dinâmico e competitivo.Buscamos alguém com perfil técnico e aplicado, que saiba construir soluções escaláveis, com forte raciocínio analítico e autonomia.Job DescriptionComo será o seu dia a diaProjetar e implementar pipelines robustos para processamento de dados em larga escala;Participar ativamente da evolução da esteira de dados e modelos, com foco em escalabilidade, confiabilidade e impacto;Colaborar com desenvolvedores, analistas de negócio e stakeholders de outras áreas, mantendo uma comunicação clara e objetiva;Desenvolver dashboards e relatórios com dados processados, apoiando a geração de insights para o negócio;Construir soluções com mentalidade DevOps e MLOps, utilizando automações, versionamento, CI/CD e monitoramento.RequirementsO que você precisa para assumir o desafioExperiência sólida com Python e bibliotecas de dados e machine learning (Pandas, Scikit-learn, etc.);Vivência com PySpark ou ferramentas de processamento distribuído;Experiência no tratamento e classificação de dados textuais não estruturados (ex: nomes e descrições de produtos, marcas, categorias), usando regex, Fuzzy Matching, embeddings ou LLMs;Experiência com machine learning aplicado a problemas como classificação e segmentação;Domínio de SQL, com experiência em modelagem de dados, otimização de consultas e organização de bases relacionais para consumo analítico;Habilidade de colaborar em equipes multidisciplinares, com boa comunicação e visão de negócio;Diferencial: domínio de frameworks como TensorFlow ou PyTorch;Diferencial: experiência com sistemas de recomendação, otimização ou personalização em larga escala;Diferencial: experiência com ingestão de dados externos e integração com fontes diversas (APIs, arquivos, dados públicos em escala);Diferencial: familiaridade com ferramentas de orquestração como Airflow ou Kubeflow;Diferencial: vivência em ambientes de e-commerce ou mercados com alta complexidade competitiva.BenefíciosAssistência médica e odontológica, estendendo-se aos dependentes;Parceira com Gympass e TotalPass;Vale Refeição/Alimentação flexível;Vale Transporte, Vale Mobilidade ou Estacionamento no local;Benefício flexível;Zenklub;Bônus anual discricionário, atrelado à performance.VEM FAZER HISTÓRIA COM A GENTE.O QUE TE FAZ ÚNICO, NOS FAZ MELHORES! 🧡Show moreShow less",N/A,On-site/Hybrid,https://www.linkedin.com/jobs-guest/jobs/api/jobPosting/4260617702,2025-08-07
Data Scientist II,Banco Bradesco,"Osasco, São Paulo, Brazil",5 days ago,"Sobre o BradescoO Bradesco é um dos maiores grupos financeiros do Brasil, com uma história marcada pelo pioneirismo e inovação. Por meio da nossa carteira amplamente diversificada de produtos financeiros, serviços bancários e de seguros contribuímos com a realização das pessoas e o crescimento sustentável de empresas e sociedade. Venha fazer parte do nosso ecossistema financeiro e impactar a experiência de milhões de pessoas!Saiba mais em https://banco.bradesco/html/classic/sobre/index.shtmResponsabilidades e atribuiçõesO que é o nosso time de Segurança Corporativa?A área de Modelagem, somos protagonistas na jornada de dados à decisão. Atuamos em parceria com as áreas de negócio para identificar desafios e oportunidades, utilizar técnicas avançadas de ciência de dados e ferramentas best-in-class para entregar algoritmos de ML, regras inteligentes e estudos analíticos, com foco em experiência do cliente, mitigação de riscos e eficiência operacional. Planejamos, desenvolvemos, implantamos, sustentamos, monitoramos e governamos soluções de IA aplicadas a Prevenção a Fraudes, PLDFT e Segurança Física. Aqui, dados se transformam em inteligência — e inteligência em ação.Modelo de trabalho: Híbrido - 2x presencialUnidade: Osasco e CuritibaComo será seu dia a dia?Sendo Data Scientist II, atuará na gerência Segurança Corporativa e suas principais atividades serão:Atuar em conjunto com as áreas de negócios identificando problemas e propondo soluções de IA envolvendo modelos preditivos, modelos decisórios, regras e estudos;Utilizar plataformas de Big Data, metodologias estatísticas e de Machine Learning e linguagens de programação como Python, SQL e SAS para desenvolver algoritmos, testar soluções externas, ou realizar estudos pontuais para apoio à tomada de decisão;Monitorar indicadores de desempenho dos modelos em produção, identificando e diagnosticando desvios, e elaborando planos de ação para eventuais correções;Atuar em conjunto com clientes internos, parcerias estratégicas e fornecedores para estabelecer relações eficazes, refinar demandas de desenvolvimento e garantir condução adequada dos planos de ação.Requisitos e QualificaçõesO que você precisa ter ou saber?Superior completo em Estatística, Matemática, Física, Engenharia ou áreas relacionadasExperiência anterior com monitoramento de modelos;Conhecimento de Estatística e Machine Learning;Conhecimento de ferramentas de visualização;Conhecimento de SQL e Python;Desejável conhecimento de Databricks, PySpark e SAS.Será um diferencial se você tiver:Inglês Intermediário para conversação;Conhecimento em Databricks e python;O que nós oferecemosNo Bradesco valorizamos a saúde e bem-estar, oferecendo um extenso portfólio de benefícios a todas nossas pessoas funcionárias:PLR ou Bônus: Conforme a elegibilidade de cargo*Convênio MédicoConvênio OdontológicoSeguro de VidaVale AlimentaçãoVale Refeição13º Cesta AlimentaçãoTotal PassVale Transporte (adesão opcional)Descontos em produtos e serviços em empresas parceirasPrevidência Privada (adesão opcional, com participação financeira da Organização Bradesco)Viva Bem Bradesco: programa de saúde, bem-estar e qualidade de vidaUnibrad: Universidade Corporativa BradescoIsenção de Tarifas: condições especiais em diversos produtos e serviçosAuxílio Creche ou BabáLicença Paternidade estendida de 20 diasLicença Maternidade de 180 dias, acompanhamento assistencial da gestação até o pós-partoShow moreShow less",N/A,On-site/Hybrid,https://www.linkedin.com/jobs-guest/jobs/api/jobPosting/4278984641,2025-08-07
Data Scientist,Enter,"São Paulo, São Paulo, Brazil",1 month ago,"EnterAEnter(anteriormente Talisman AI) foi fundada em 2023 com a missão de tornar o Brasil um protagonista em Inteligência Artificial. Unimos a expertise humana à eficiência da IA para ajudar grandes empresas da América Latina a otimizar processos críticos de alto volume e que exigem intenso trabalho manual. Iniciamos nossa jornada aplicando IA para criar defesas jurídicas personalizadas em larga escala, permitindo que grandes empresas reduzam custos advocatícios e aumentem suas taxas de êxito. Atendemos clientes como Nubank, Banco BMG, iFood, SulAmérica, Light, Banco Inter, Banco C6, entre outros.VagaComoData Scientistna Enter, você fará parte de um time técnico e estratégico, contribuindo para transformar dados em modelos de machine learning aplicáveis em produção. Buscamos pessoas curiosas, colaborativas e motivadas a aplicar ciência de dados para resolver problemas reais e complexos.ResponsabilidadesDesenvolver modelos preditivos e de classificação aplicados a documentos e dados empresariais (como predição de risco, classificação de documentos, detecção de fraudes, segmentação de entidades, classificação de imagens, entre outros), mantendo um raciocínio crítico e rigor estatístico.Trabalhar com NLP (Processamento de Linguagem Natural) e LLMs para extrair informações relevantes de documentosConstruir e validar pipelines de machine learning para implantação, operação e manutenção de modelos em produção.Colaborar com engenheiros, PMs e designers na criação de produtos baseados em IA e ML, participando desde as explorações iniciais até o desenho das soluções.Contribuir para o desenvolvimento do nosso sistema de Q&A, garantindo explicabilidade por meio de referências, fontes e raciocínio lógico.Apoiar a definição dos métodos que serão utilizados para medir os resultados dos produtos.Colaborar com o time de tecnologia no desenho de experimentos e na análise de resultados.Promover boas práticas em ciência de dados, incluindo versionamento, documentação e reprodutibilidade de análisesO que valorizamosProfissionais que não se contentam com respostas superficiais e mergulham nos detalhesBaixa necessidade de reconhecimento individual, priorizando o resultado acima do crédito pessoalCapacidade excepcional de enfrentar problemas abertos em ambientes não estruturadosDisposição para aprender, orientar, liderar e seguir conforme necessárioSenso de urgência desproporcional, mantendo em mente a escalabilidade e a criação de processos replicáveis para garantir o sucesso a longo prazoPessoas curiosas e que conseguem aprender coisas difíceis rapidamenteRequirementsIdealmente, você tem:Sólidos conhecimentos em estatística.Experiência prática em ciência de dados e machine learning, com domínio de ferramentas como Python ou R.Familiaridade com o desenho de experimentos A/B e interpretação de seus resultados.Capacidade de compreender o contexto do negócio, formular problemas de forma estruturada, entender os limites dos dados, identificar possíveis vieses e comunicar conclusões de forma clara.Conhecimento em Python e bibliotecas como Pandas, Scikit-learn, NumPy, PyTorch ou TensorFlow.Experiência com experimentação, avaliação de modelos (precision, recall, F1, AUC etc.) e construção de pipelines de MLShow moreShow less",N/A,On-site/Hybrid,https://www.linkedin.com/jobs-guest/jobs/api/jobPosting/4266023098,2025-08-07
