title,company,location,posted,description,applicants,work_mode,link,data_coleta
Data Science Specialist,Getnet,"São Paulo, São Paulo, Brazil",3 months ago,"Somos uma empresa global de tecnologia que fornece soluções de pagamento, fazemos parte da PagoNxt, o hub de pagamentos do Grupo Santander. Operando em mais de 10 países, nossa missão é imaginar, cuidar e simplificar, usando tecnologia e inovação para atender nossos clientes, desde pequenos empreendedores até grandes corporações, com soluções físicas e digitais para todos os tipos de negócios.Vamos construir o futuro, juntos?Estamos moldando o futuro dos métodos de pagamento, conectando comunidades e empresas de forma simples e eficaz. Essa jornada é conduzida por pessoas dedicadas a aprimorar constantemente nossas soluções. Aqui, imaginamos o amanhã, cuidamos do hoje e simplificamos o agora, construindo um futuro Wow!O QUE TERÁ COMO PRINCIPAIS DESAFIOS?Ser referência e guiar o time na produtização de modelos, disseminação de boas práticas de análise e experimentação/teste de impacto;Proficiência em todo o processo de criação/evolução de modelos de ML: da escolha de dados e engenharia de features, passando pelo de design de algoritmos e experimentos e concluindo na análise/visualização do output e comunicação de resultados;Interpretação, visualização e comunicação de dados complexos: desenvolvimento de protótipos, modelos matemáticos, algoritmos, análises robustas e Insights acionáveis;Liderar projetos e iniciativas complexas, tomando a responsabilidade de desenhar e detalhar o escopo de dados, criar propostas, compartilhar conhecimento, adaptar planejamento interno e externo, ajustar expectativas e representar o time frente a outras áreas;Liderar iniciativas de pesquisa e desenvolvimento de novas plataformas, metodologias e soluções de Data Science.🎓 O que é necessário pra se inscrever:Machine Learning| Regressão, Classificação, Clusterização, Redes Neurais, Seleção de Features, Cross-Validation, ""Curse of Dimensionality"", Viés-Variânica, Explicabilidade de Modelos, etc;Estatística Avançada| Análise Descritiva, probabilidade, inferência, bootstrapping, desing experimental, modelagem preditiva, otimização, testes de hipótese, regressão, modelagem e métodos;Lógica de Programação| Escrever e revisar scrips e queries em banco de dados, usar parâmetros, criar variáveis;Data Modeling| Landing, Cleaning, Processing, Curation, Estruturas de Fato/Dimensão, encadeamento de ETLs, Data Marts;Big Data| Tecnologias, Soluções e Conceitos como Spark, Hadoop, Hive, MapReduce, Kafka;Modelagem Estatística & Advanced Analytics| NLP, Séries Temporais, Random Forests, Linear Regression, Logistic Regression, Clustering methods (e.g. K-means), Classification methods (Decision Trees/Random Forest), among others;MLOps básico| para entender os desafios de se colocar um modelo em produção;Experimentação| Testes A|B, Hipóteses, Modelos de Atribuição;Grandes Volumes| Extrair e manipular grandes bases de dados, utilizando a stack de dados disponível;Espanhol avançado.FERRAMENTASSQL| Porque dado em planilha é coisa do passado;Python ou R| Pra quando a coisa fica bem séria;Scala, Java & Spark| Trabalhar com grande volume de dados sempre pode ser mais rápido;Teste de Hipóteses| Para suportar o processo de tomada de decisão e criar informação de suporte;Databricks| Uso de clusters e workspaces para BigData.🚀 Será bacana se você tivesse experiência:Tableau, PowerBiou outras ferramentas de Data Visualization | Ninguém aguenta mais tabelão e flat file;Cloud Computing| Azure, AWS, GCPDesenvolvimento de Software| Para entender melhor a dinâmica da empresa e o impacto no negócio;Gestão de Projeto| Garantindo planejamento e comunicação com as diversas dependências;Credit Risk ou Fraud Prevention| experiência anterior desenvolvendo guias, boas práticas, políticas, simulações, análises ad-hoc, modelos preditivos e data assets.CONFIRA NOSSOS BENEFÍCIOS🩺Assistência Médica;🦷Assistência Odontológica;🏋️🧘🏻‍♀️Gympass;🎂Day off de aniversário;🔐Seguro de Vida;🍕VR/VA;🤑PPR;👶👧Auxílio creche;🤰Extensão dos períodos de licença maternidade e paternidade;🧠SelfCare - Programa de Saúde Mental e Bem-estar;📚Incentivo Idiomas (Inglês ou Espanhol);🎓Acesso a uma plataforma de learning conectada a todos os conteúdos do LinkedIn Learning e o'Reilly;📈Possibilidade de contratação de empréstimos pessoais com juros menores que os de mercado.Show moreShow less",N/A,On-site/Hybrid,https://www.linkedin.com/jobs-guest/jobs/api/jobPosting/4212371584,2025-08-07
Machine Learning Engineer (LATAM),Lateral Group,"São Paulo, São Paulo, Brazil",2 weeks ago,"About The CompanyLateral stands for technology excellence.We’re a profitable, award-winning design and technology company with over 20 years of experience launching bold ventures and transforming businesses. A globally distributed team of 200+ experts united by a shared purpose: the continuous pursuit of quality.Our clients come to us for results, quality and craft - and stay because we keep raising the bar.We do things differently at LateralOur mission is simple:design and build great products.What sets us apart isn’t just the talent of our team - it’sthe way we work:We Have A Bias For Action & Results.We are doers - we spot the gaps, connect the dots, anticipate what’s around the corner and take action. We move fast, stay focused, and let the results - not the effort - speak for themselves.We Work On Time, On Budget, On QualityDiscipline is our edge - a commitment we make to each other, to our clients, and to the standards we hold ourselves to.We Care Deeply.We care about our work and about each other. Care Is A Competitive Advantage.Every detail matters. Every design, every line of code, every decision. Thoughtful by default.We Do Things Right - Because It’s the Right Thing to DoRight over easy. Integrity isn’t up for negotiation. We hold the bar high even when no one’s watching. We take pride in doing great work the right way - not the easy way.We Keep ImprovingThe best teams keep improving and we’re never done learning.We iterate. We reflect on what’s working and what’s not. Feedback fuels us, we receive it openly, and adapt quickly. Progress over perfection.We’re Obsessed With Agility, Not The Agile ManifestoWe don’t chase dogma or rituals - we chase momentum. We adapt processes to fit problems, not the other way around.We Take OwnershipEveryone leads something here. You will have room to run with ideas, and the trust to execute. That trust is built on how you show up: thinking things through, sweating the details, and following through.What You’ll DoWe leverage cutting-edge machine learning to deliver innovative solutions in medical imaging. As aMachine Learning Engineerat Lateral, you will be instrumental in realizing our AI vision through a variety of critical tasks:Experimentation and Optimization: You will help parallelize and distribute work amongst different experiment tracks, optimize model performance via hyperparameter tuning, model ensembling, or advanced training strategies, and design and conduct systematic experiments to validate hypotheses and model improvements.Research and Development: Your responsibilities will include conducting literature reviews on state-of-the-art methods in medical imaging, designing and prototyping novel machine learning models, implementing model architecture and training strategies in code, and generating ideas and exploring methods for improvements to existing models or tasks.Analysis and Validation: You will perform statistical analysis to assess model robustness and reproducibility, and compare proposed methods against baselines and benchmarks from existing literature.Interdisciplinary Collaboration: You will collaborate with domain experts to define problem statements and interpret model outputs, ensuring our AI solutions are both technically sound and clinically impactful.What We’re Looking ForWe’re seeking research-minded engineers who are excited to build real, meaningful ML systems, not just prototypes. You’ll thrive in this role if you bring:2+ years of hands-on experience in machine learning, including model design, training, and evaluation.Demonstrated experience applying machine learning to real-world computer vision problems, including developing, deploying, and optimizing models.Familiarity with deep learning frameworks such as PyTorch or TensorFlow and comfort writing clean, modular experimentation code.Practical experience running experiments, tuning models, and comparing approaches via systematic validation.Excellent grasp of modern ML concepts: regularization, loss functions, optimization strategies, generalization, overfitting, etc.Basic data analysis skills using tools like Polars or Pandas for efficient data manipulation and exploratory data analysis.An understanding of statistical testing and experimental design to assess performance, robustness, and reproducibility.Curiosity about new techniques — you enjoy staying current with ML literature and applying ideas in production-minded ways.Strong communication skills — able to collaborate with other engineers, researchers, and domain experts to translate needs into solutions.Bonus points for:Experience with medical imaging, scientific ML, or regulated environments.Contributions to papers, open-source projects, or research infrastructure.Familiarity with explainability techniques (e.g., SHAP, saliency maps) and fairness/audit frameworks.A track record of generating novel ideas, exploring them rigorously, and translating them into working systems.Experience building ML pipelines (training, evaluation, deployment) in production, especially in cloud environments like AWS.Why You’ll Love Working HereReal Impact: You’ll work on meaningful products that make a measurable difference - from healthcare and commerce to sustainability and next-gen tech.Remote-First, Office Friendly: Work from wherever you’re most productive - whether that’s your home, a co-working space, or one of our offices. We’re a remote-first company, but if you’re near an office, you’re welcome to drop in, collaborate in person, or work onsite regularly.We prioritize async collaboration, respect your time zone, and focus on outcomes over hours.An Outstanding Team: Talented, kind, and hard-working people who care deeply about their craft - and about each other. No egos. No politics. Just professionals doing their best work.Growth: You’ll be supported in growing your craft, exploring new paths, and stepping into greater responsibility - at your own paceA Culture of Excellence: We care deeply about doing the right thing - for our clients, our team, and ourselves. No burnout. No crunch. Just high-quality work, delivered sustainably.Variety & Stability: We’re profitable, independent, and over a decade strong. Yet every project brings a fresh challenge. You’ll never be bored here.This Role Might Not Be for YouWe want to respect your time by being clear about what this role isn’t. You should skip this opportunity if:You prefer well defined structure. If you gravitate towards a clear hierarchy, well defined roles and swim lanes, you may find our self-managed style challenging.Distributed work isn’t your thing. If you find async communication, design documentation and being proactive without a manager nearby difficult, our setup won’t suit you.Feedback doesn't excite you. We’re obsessed with quality and believe in continuous improvement. That means we give feedback that’s sometimes nitpicky. If refining the work until it’s excellent feels over the top, you are likely going to find working here frustrating.Change makes you uncomfortable. We’re scaling and maturing. That means not everything is perfect yet. Priorities shift. Processes evolve. If ambiguity is uncomfortable, this may feel bumpy.However, If this sounds like fuel, we’d love to talk!How to apply and what to expect in the interview processOur hiring process is structured as a sequence of steps. Moving forward is based on how well the previous step goes. This helps us stay focused, fair, and respectful of everyone’s time.We will always:Let you know clearly what the next step isShare updates and feedback wherever possibleInvite questions if anything feels unclearNot everyone progresses through every stage. That doesn’t mean you’re not great at what you do. Sometimes it’s about timing, team fit, or simply what we’re looking for at the moment.Step 1: Express Your InterestIf this sounds like your kind of team and you’re ready to bring your craft to Lateral, we want to hear from you.Please send us:Your resumeA short note about what excites you about this roleLinks to your work: GitHub/ Code snippets, portfolio, architecture /design docs, blog posts, or anything that shows us how you think and buildPlease don’t include anything sensitive or proprietary.If you’re sharing team projects, let us know what your specific contributions were.We review every application with care. If there’s a fit, we’ll reach out to schedule next steps.Step 2: Talent Partner ConversationPurpose:A structured discussion with our People Experience team to delve into your career trajectory, motivations, and alignment with Lateral's values.What to Expect:In-depth questions about your past experiences and decision-making processes.Exploration of your career goals and how they align with the role.Discussion about our company culture, availability, compensation and other logisticsMotivators and demotivators.Your life outside coding.Preparation Tips:Reflect on your career journey and pivotal moments.Be ready to discuss challenges you've overcome and lessons learned.Familiarize yourself with the Job Description, Lateral's mission and values.Step 3: Technical interviewPurpose:Assess your technical proficiency and problem-solving abilities.Format:A collaborative session with our engineering team, focusing on real-world scenarios relevant to the role.What to Expect:Problem-solving exercises/questions that mirror tasks you'd encounter in the position.Discussions around your approach, reasoning, and solutions.Preparation Tips:Practice articulating your thought process clearly and concisely.Be prepared to discuss in depth past projects and the technologies used.Step 4: Client interviewPurpose:Evaluate how well you collaborate, communicate, and consult with external stakeholders.Format:A live conversation with one of our client-side collaboratorsWhat to Expect:Discussion around business and technical challenges from the client’s perspective.Opportunity to explain your approach, gather requirements, ask clarifying questions, and articulate tradeoffs.Evaluation of how clearly you communicate solutions to both technical and non-technical stakeholders.Preparation Tips:Once client details are shared, educate yourself with their business and potential challengesReview past experiences where you’ve had to communicate complex ideas clearly.Reflect on your ability to lead conversations, guide decision-making, and build trust across different audiences.Step 5: Operational interviewPurpose:Understand your approach to prioritizing, collaborating, shipping, and iterating.What to expect:How you prioritize and break down work.How you collaborate across disciplines.How you handle blockers, feedback, and iteration.Preparation Tips:Pick 1-2 meaningful projects you led or heavily contributed to.Walk through your process: what worked, what didn’t, what you’d do differently.Think about how you manage time, scope, and changing requirements.Step 6: Reference ChecksPurpose:We believe references are about understanding, not just validation. We do not look for perfection, but to understand patterns, strengths, and context. We use them to learn how to support you best.What to Expect:we’ll ask you for 2–3 people who’ve worked closely with you. These are often: former managers, senior peers or collaborators, mentors or people you've mentored.What we ask:We focus on how you’ve grown, where you shine, how you like to be led, and what support sets you up for success. We want practical advice for making this a great fit for you.Yes, we do backchannels too:We do thiswhen we feel we need more context. We will check with you if there are folks we should avoid reaching out due to confidentiality or other reasons. Andhere’s our commitment:if anything surprising or unclear comes up in a backchannel, we’ll bring it directly to you. We believe in “no stories without you in the room.” You’ll always get the chance to share your side, context, or clarification.Step 7: OfferWhat Happens:If selected, you'll receive a comprehensive offer detailing compensation, and other pertinent information.Our hiring process is designed to be thorough yet respectful, ensuring a mutual fit. We encourage candidates to engage actively, ask questions, and view this as a two-way exploration.Join us and let’s build something extraordinary.Show moreShow less",N/A,Remote,https://www.linkedin.com/jobs-guest/jobs/api/jobPosting/4271347050,2025-08-07
Data Scientist,Wildlife Studios,"São Paulo, São Paulo, Brazil",5 days ago,"We're looking for a talented and passionate Data Scientist, to join Wildlife's Insights team.As a Data Scientist, you will expand game potential by providing non-trivial solutions to business questions, such as how to analyze game performance, engage players, customize content, run successful experiments, and optimize game economy.We know that the work we do has a high impact on our company's success and culture. The right person for this position is curious by nature, and comfortable in a ""take the initiative"" environment, loves solving problems, and can thrive in a fast and growing business.What You'll DoEnable game teams to make data-informed decisions by providing access to data, fostering best analytical practices and rigor, and creating analyses, tools, and models to solve specific game problems.Accelerate game development by answering business questions quickly levering existing tools or building new ones.Expand game potential by providing non-trivial solutions to business questions such as how to analyse game performance, engage players, customize content, run successful experiments, and optimize game economy.Use experimentation and the scientific method to continuously iterate on your product — the game.What You'll NeedKnowledge of statistics and machine learning that is both deep and broad.Experience in working as a data scientist or machine learning engineer on technically challenging problems.Experience with product analytics.Nice to haveKnowledge of Looker Studio.More About YouYou can frame open-ended business problems and find creative solutions using data.You communicate in a structured way both speaking and writing, especially in English.You are autonomous in leading the execution of solutions proactively giving visibility to stakeholders and asking for help whenever needed.You promote rigorous but pragmatic analytical practices among other data scientists and business partners.You are driven by generating value and leverages a wide range of data science tools to do it — not just ML models.About WildlifeWildlife is one of the leading mobile game developers and publishers in the world. We have released more than 60 titles, reaching billions of people around the globe. Today, we have offices in Brazil, Finland and the United States. Here, we create games that will excite, intrigue, and engage our players for years to come!Equal OpportunityWildlife is proud to be an Equal Opportunity and Affirmative Action employer. We do not discriminate based upon race, colour, national origin, gender, gender identity, sexual orientation, protected veteran status, disability, age, or other applicable legally protected characteristics. We also consider qualified applicants with criminal histories, consistent with applicable federal, state, and local law.We're committed to providing accommodations for candidates with disabilities in our recruiting process.Show moreShow less",N/A,On-site/Hybrid,https://www.linkedin.com/jobs-guest/jobs/api/jobPosting/4277968161,2025-08-07
Data Scientist,"CloudWalk, Inc.","São Paulo, São Paulo, Brazil",17 hours ago,"About CloudWalk:We are not just another fintech unicorn. We are a pack of dreamers, makers, and tech enthusiasts building the future of payments. With millions of happy customers and a hunger for innovation, we're now expanding our neural network - literally and metaphorically.What You Need To SucceedMachine LearningAWS CertificationsGCP CertificationsPython/TypeScriptBonus Points IfYou have a love for or studying physicsJoin us at CloudWalk, where we’re not just engineering solutions; we’re building a smarter, AI-driven future for payments—together.By applying for this position, your data will be processed as per CloudWalk's Privacy Policy that you can read here in Portuguese and here in English.Show moreShow less",N/A,On-site/Hybrid,https://www.linkedin.com/jobs-guest/jobs/api/jobPosting/4278848183,2025-08-07
Machine learning,Netvagas,"São Paulo, São Paulo, Brazil",1 day ago,"Estamos em busca de uma pessoa Engenheira de Machine Learning para integrar nossa equipe de Soluções IA e ser responsável por aplicar técnicas de aprendizado de máquina em projetos inovadores, ajudando a construir soluções inteligentes para nossos produtos e clientes.Se você possui paixão por tecnologia, tem conhecimentos em dados e está em busca de oportunidades para crescer na área, esta é a vaga ideal.ResponsabilidadesProjetar, desenvolver e implementar modelos de machine learning para resolver problemas de negócio diversos.Automatizar e otimizar processos relacionados ao ciclo de vida de modelos: desde a experimentação, treinamento, deploy até o monitoramento em produção.Trabalhar em colaboração com equipes de Ciência de Dados, Engenharia de Dados e Produto, garantindo que os modelos sejam integrados de forma eficiente aos sistemas.Garantir a escalabilidade, eficiência e confiabilidade das soluções de machine learning em ambientes de produção.Participar da definição de arquiteturas e pipelines de MLOps para automação e governança de modelos.Monitorar o desempenho dos modelos e ajustar parâmetros conforme mudanças nos dados e nos objetivos de negócio.Documentar soluções, boas práticas e contribuir para a evolução contínua dos processos e padrões técnicos.Pesquisar e implementar novas técnicas e ferramentas que impulsionem a inovação em machine learning.RequisitosGraduação completa ou em andamento em Ciência da Computação, Engenharia, estatística, matemática, ou áreas correlatas.Programação em Python ou outras linguagens adequadas para machine learning.com bibliotecas e frameworks de machine learning e deep learning (ex.: Scikit-learn, TensorFlow, PyTorch).Conhecimento de fundamentos de estatística, aprendizado supervisionado e não supervisionado.Experiência com versionamento de código (ex.: Git) e práticas de desenvolvimento de software.Noções de deployment e monitoramento de modelos.DiferenciaisExperiência prática com MLOps e ferramentas de automação de pipelines (ex.: MLflow, Kubeflow, Airflow).Conhecimento em computação em nuvem (AWS, Azure ou GCP), especialmente serviços de IA/ML.Experiência com containers e orquestração (ex.: Docker, Kubernetes).Implementação de soluções de machine learning em ambientes de produção com requisitos de escalabilidade e segurança.Participação em projetos que envolvam modelos de NLP, visão computacional ou sistemas de recomendação.Perfil ProfissionalMentalidade analítica e orientação para a resolução de problemas complexos com pragmatismo.Proatividade na busca de soluções e na melhoria contínua de processos e modelos.Colaboração ativa com diferentes áreas e habilidades de comunicação clara, tanto para públicos técnicos quanto não técnicos.Organização, responsabilidade e atenção aos detalhes na entrega de soluções robustas e seguras.Interesse por aprendizado contínuo e atualização em relação às tendências e inovações em machine learning.Se você se identifica com essa oportunidade, inscreva-se! Nosso processo valoriza competências, potencial e diversidade de experiências.Show moreShow less",N/A,On-site/Hybrid,https://www.linkedin.com/jobs-guest/jobs/api/jobPosting/4280792883,2025-08-07
