title,company,location,posted,description,applicants,work_mode,link,data_coleta
Machine Learning Engineer,Insider Store,"São Paulo, São Paulo, Brazil",7 months ago,"Sobre a Insider Store#WE ARE INSIDERVocê terá a chance de trabalhar lado a lado com profissionais obcecados pelo cliente, participando ativamente de projetos e iniciativas que impactam diretamente o negócio e transformam a realidade do mercado.#ALWAYS EVOLVINGOportunidade para quem deseja desenvolver sua carreira em um ambiente inovador, onde constantemente subimos a barra.#MADE FOR THE FUTUREA Insider oferece um espaço para aprendizado e desenvolvimento, proporcionando experiências significativas que irão enriquecer seu conhecimento e habilidades na área. Nós somos o futuro e nos preparamos para ele.#INTENTIONALITYSe você é uma pessoa proativa, curiosa e está sempre em busca de novos desafios, essa posição é perfeita para você.Sobre a VagaDescrição:Estamos em busca de um(a)Engenheiro(a) de Machine Learningpara desenvolver e manter infraestruturas que suportem a personalização do nosso site, garantindo uma experiência única para cada usuário. Essa pessoa será responsável pela implementação de novas funcionalidades, desenvolvimento de apps personalizados para Shopify e suporte à equipe de Data Science na operacionalização de modelos.Responsabilidades:Desenvolver e manter sistemas de personalização do site, incluindo aplicativos Shopify, temas e integrações com APIs;Criar ferramentas que facilitem a implementação de personalizações baseadas em dados;Trabalhar em conjunto com cientistas de dados, engenheiros e gerentes de produto para transformar necessidades do negócio em soluções escaláveis;Garantir a integração fluida das funcionalidades de personalização, melhorando o engajamento e conversão dos usuários.Requisitos:Proficiência em Python e SQL;Familiaridade com APIs e tecnologias de front-end;Capacidade de solucionar problemas de forma eficiente e escalável;Boa comunicação e colaboração com times multidisciplinares.Diferencial:Experiência com desenvolvimento para Shopify (apps, temas, Liquid templating);Experiência com otimização de performance de sites e personalização em larga escala;Conhecimento em MLOps e ferramentas de monitoramento de modelos em produção;Histórico de atuação em startups ou e-commerce.Mais detalhes:Modelo de contrato: PJ;Modelo de trabalho: Híbrido;Descanso sem ser descontado; 22 dias úteis anuais, disponível após os três primeiros meses;Cartão Flexível;Plano de Saúde;Plano Odonto;Totalpass;Udemy;Insider Perks;Oportunidade de crescimento e aprendizado em uma startup em rápida expansãoAmbiente de trabalho colaborativo e inovador, com exposição a novas tecnologias e processosNossa HistóriaAInsidernasceu para desafiar o status-quo da indústria da moda. Aprendemos, inovamos e melhoramos constantemente,para criar um mundo onde todos são encorajados a subir a barra e buscar excelência desde 2017.Hoje,temos mais de 1 milhão de clientes e um portfólio de produtos que tecem tecnologia, inovação e sustentabilidade.Esse é só o início de uma jornada que busca mudanças estruturais em uma das mais tradicionais e poluentes indústrias do mundo: a indústria da moda.Principais destaquesParticipação no programa Startup School da aceleradora Y Combinator.Acelerada 2 vezes nos programas Endeavor Scale Up varejo e consumer goods.Acelerada pelo programa Endeavor Outliers pelo crescimento fora da curva dentro do peer group, ganhando o título de Empreendedores Endeavor.Eleita pela revista Forbes como uma das 25 startups mais promissoras do Brasil.Show moreShow less",N/A,On-site/Hybrid,https://www.linkedin.com/jobs-guest/jobs/api/jobPosting/4150881960,2025-09-29
CONSULTOR DE DATA SCIENCE SAO PAULO,Management Solutions,Greater São Paulo Area,6 days ago,"Management Solutions é uma firma internacional de consultoria focada em negócios, finanças, risco, organização, tecnologia e processos, tanto em seus componentes funcionais quanto na implementação de tecnologias relacionadas. Atualmente contamos com uma equipe multidisciplinar (funcional, matemática, técnica e integração de sistemas) de mais de 4.000 profissionais, que opera através de 50 escritórios (22 na Europa, 23 na América, 3 na Ásia, 1 na África e 1 na Oceania), de onde prestamos serviços recorrentes a clientes que operam em mais de 50 países nos cinco continentes (Europa, América, Ásia, África e Oceania)Para mais informações sobre a firma visite: www.managementsolutions.comFunções:Tratamento estatístico de dados (data mining)Modelagem preditiva através de técnicas de machine learning e de data scienceModelagem de eventos temporais (séries temporais, modelos ARIMA)Desenvolvimento de modelos de simulação (Monte Carlo)Revisão e validação de modelos de rating e scoring, RAROC e parâmetros de riscoApoio matemático ao negócio: desenvolvimento de algoritmos, estatística e probabilidadeProjetos de P&DBuscamos profissionais:Recém formados ou estudantesde último semestrede Matemática, Estatística, Física, Econometria, Ciências Atuariais ou Engenharia.Conhecimento de técnicas de modelagem(logit, GLM, séries temporais, árvores de decisão, random forests, clustering), linguagens de programação estatísticas (SAS, R, Python, Matlab) e ferramentas e plataformas de Big Data (Hadoop, Hive, etc.).Sólida trajetória acadêmica.Dinamismo, maturidade, responsabilidade e capacidade de trabalho.Nível de inglês intermediario.Valorizamos o conhecimento de outros idiomas, pós-graduação e cursos de especialização.Uso avançado de ferramentas de informática.Alta capacidade de aprendizagem.Facilidade deintegração em equipesmultidisciplinares.O que oferecemos:Oferecemos a possibilidade de te incorporares numa empresa que proporciona tudo o que é necessário para o máximo desenvolvimento profissional:Trabalhar nos projetos de consultoria mais relevantes do setor,para as maiores companhias, líderes nos seus respetivos mercados,junto do top management empresarial, perante os seus desafios nacionais e internacionais,com uma extraordinária equipa de profissionais, cujos valores e cultura corporativa são uma referência no setor.TreinamentoCursos de conhecimentos, cursos externos especializados, de habilidades e de idiomas.Durante o ano passado nossos profissionais investiram mais de 375.000 horas em treinamento a nível global, distribuídos em mais de 150 cursos.Todos os Seniores da Firma, cursam um Programa de Formação em Negócios, ministrado pelo INSPER.Plano de carreiraPromoção interna baseada no desempenho e potencial.Gestão baseada em partnership, oferecendo a cada profissional a meta de fazer parte do coletivo de sócios.Atividades complementaresUniversidade: mantemos uma estreita relação com as mais prestigiosas universidades a nível mundial.Ação Social: organizamos mais de 30 atividades solidárias a cada ano.Club Esportivo: organizamos campeonatos internos e participamos de competições externas.Na Management Solutions acreditamos na igualdade de oportunidades. Em nosso processo de seleção, todos os candidatos qualificados são igualmente considerados para emprego, independentemente de raça, cor, religião, origem nacional, sexo, identidade de gênero, orientação sexual, idade, estado civil, deficiência e qualquer outra característica protegida por lei.Complete nosso formulário de candidatura em: www.managementsolutions.comShow moreShow less",N/A,On-site/Hybrid,https://www.linkedin.com/jobs-guest/jobs/api/jobPosting/4302370636,2025-09-29
Data Science Specialist,Cadastra,"São Paulo, São Paulo, Brazil",5 days ago,"Quer fazer a diferença na nova economia e transformar pessoas e negócios para prosperarem? Vem pra Cadastra!ComoData Sciencevocê irá atuar em projetos de alto impacto, desenvolvendo modelos avançados de machine learning, análises preditivas e soluções de IA que apoiem decisões estratégicas. Esse papel exige sólido domínio técnico, capacidade analítica e visão prática de como transformar dados em valor de negócio.Essa posição é para atuar de formahibrido 3x presencial e 2x remoto, na nossa sede de São Paulo.Responsabilidades e atribuiçõesNo nosso Data Hub você terá o desafio de:Desenvolver e implementar modelos de machine learning e estatísticos em escala;Conduzir análises exploratórias e preditivas, traduzindo insights em recomendações acionáveis;Trabalhar com pipelines de dados em GCP em conjunto com engenheiros de dados para garantir qualidade e disponibilidade das bases;Utilizar BigQuery para consultas complexas, modelagem de dados e criação de datasets otimizados;Garantir a reprodutibilidade e governança de modelos com boas práticas de versionamento, experiment tracking e CI/CD para ML (MLOps);Colaborar com áreas de negócio, produto e engenharia para transformar hipóteses em soluções baseadas em dados;Explorar e aplicar técnicas de IA, NLP e aprendizado profundo quando relevante para os projetos.Requisitos e qualificaçõesO que a Cadastra espera de você:Requisitos:Experiência sólida como Data Scientist;Domínio de Google Cloud Platform;Forte conhecimento em Python (pandas, scikit-learn, TensorFlow ou PyTorch);SQL avançado para exploração e manipulação de grandes volumes de dados;Experiência em estatística, modelagem preditiva e aprendizado de máquina supervisionado/não supervisionado;Vivência em MLOps em GCP (pipelines, versionamento de modelos, monitoramento e retraining).Diferenciais:Certificação Google Cloud Professional Machine Learning Engineer;Experiência com outras clouds (AWS, Azure) para cenários multicloud;Vivência em projetos de IA generativa e LLMs aplicados a negócios;Conhecimento em visualização de dados.Informações adicionaisO que oferecemos:13° NF + 30 dias de descanso remunerado por ano 🏖️Participação nos lucros (PLR) 💰Plano de saúde de acordo com a sua localidade (a partir da 3ª NF emitida) 🩺Plano odontológico de acordo com a sua localidade (a partir da 3ª NF emitida) 🦷Total Pass 🏋🏽‍♀️Clude | Plataforma de Saúde 🩺Day off de aniversário 🎉Bônus por indicação 💰Licença-maternidade e paternidade estendida 🍼Show moreShow less",N/A,On-site/Hybrid,https://www.linkedin.com/jobs-guest/jobs/api/jobPosting/4305555246,2025-09-29
"Banco de Talentos (Data Scientist Internship, Brazil - BCG X)",BCG X,"São Paulo, São Paulo, Brazil",1 week ago,"Who We AreBoston Consulting Group partners with leaders in business and society to tackle their most important challenges and capture their greatest opportunities. BCG was the pioneer in business strategy when it was founded in 1963. Today, we help clients with total transformation-inspiring complex change, enabling organizations to grow, building competitive advantage, and driving bottom-line impact.To succeed, organizations must blend digital and human capabilities. Our diverse, global teams bring deep industry and functional expertise and a range of perspectives to spark change. BCG delivers solutions through leading-edge management consulting along with technology and design, corporate and digital ventures—and business purpose. We work in a uniquely collaborative model across the firm and throughout all levels of the client organization, generating results that allow our clients to thrive.We Are BCG XWe’re a diverse team of more than 3,000 tech experts united by a drive to make a difference. Working across industries and disciplines, we combine our experience and expertise to tackle the biggest challenges faced by society today. We go beyond what was once thought possible, creating new and innovative solutions to the world’s most complex problems. Leveraging BCG’s global network and partnerships with leading organizations, BCG X provides a stable ecosystem for talent to build game-changing businesses, products, and services from the ground up, all while growing their career. Together, we strive to create solutions that will positively impact the lives of millions.What You'll DoWe are seeking strong candidates with advanced analytics experience to start an exciting consultant career within BCG X. We are looking for profiles with a background in any area related to predictive analytics, machine learning, optimization/operations as well as risk. BCG X offers a unique opportunity to join a vibrant team of data scientists applying the most advanced analytics techniques in a rewarding environment.What You'll BringEducation & ExperienceBachelor’s degree with excellent academic achievements in a field linked to computer science, applied mathematics, statistics, machine learning, or related data centric areas - Expected graduation between 2026 and 2027.Relevant internships or industry/consulting previous experienceExperience in core analytics methods (e.g. Machine Learning, Optimization, Deep Learning, etc.)Fluency in at least one scripting language (e.g. Python, R)Deep technical and data science expertise, strong passion for data science topicsExcellent analytical skills and strategic thinking, creative problem solverStrong interpersonal credibility, reliability, and service mentality, high ethical standardsExcellent written and verbal communication skills in Portuguese and EnglishTechnical competenciesExperience in core analytics methods (e.g. Machine Learning/Deep Learning, Optimization/Operational Research, Geoanalytics, Predictive Modeling, Autonomous Agents, Network Analysis, etc…)Familiarity with a broad base of analytics tools (Data management; Analytics platforms / Programming – e.g. Python, R ; Data Visualization, etc…)Experience in applied analytics for business problem solving/experience building analytical solutionsAdditional info#BCGXjobBoston Consulting Group is an Equal Opportunity Employer. All qualified applicants will receive consideration for employment without regard to race, color, age, religion, sex, sexual orientation, gender identity / expression, national origin, disability, protected veteran status, or any other characteristic protected under national, provincial, or local law, where applicable, and those with criminal histories will be considered in a manner consistent with applicable state and local laws.BCG is an E - Verify Employer. Click here  for more information on E-Verify.Show moreShow less",N/A,On-site/Hybrid,https://www.linkedin.com/jobs-guest/jobs/api/jobPosting/4302461294,2025-09-29
Data Scientist,Insider Store,"São Paulo, São Paulo, Brazil",5 months ago,"Sobre a Insider Store#WE ARE INSIDERVocê terá a chance de trabalhar lado a lado com profissionais obcecados pelo cliente, participando ativamente de projetos e iniciativas que impactam diretamente o negócio e transformam a realidade do mercado.#ALWAYS EVOLVINGOportunidade para quem deseja desenvolver sua carreira em um ambiente inovador, onde constantemente subimos a barra.#MADE FOR THE FUTUREA Insider oferece um espaço para aprendizado e desenvolvimento, proporcionando experiências significativas que irão enriquecer seu conhecimento e habilidades na área. Nós somos o futuro e nos preparamos para ele.#INTENTIONALITYSe você é uma pessoa proativa, curiosa e está sempre em busca de novos desafios, essa posição é perfeita para você.Sobre a VagaDescrição:Estamos em busca de um(a) profissional orientado(a) Data Scientist. O objetivo é transformar dados em insights acionáveis, guiar decisões operacionais e suportar a previsão de demanda e capacidade. Este(a) profissional será fundamental para integrar informações de diferentes áreas, criar modelos preditivos e propor soluções baseadas em dados confiáveis. Esperamos que tenha autonomia para identificar oportunidades e otimizar processos que impactem diretamente os resultados do negócio.Responsabilidades:Ser referencia técnica para a squad. Aplicando técnicas avançadas de análise de dados, como modelagem preditiva e ML, para prever demanda, alinhar capacidades produtivas e estimar risco de operações de produção.Identificar padrões operacionais e recomendar soluções antecipadas para garantir a disponibilidade de produtos e insumos.Trabalhar diretamente com equipes de dados, PCP, compras e produção, promovendo integrações eficientes entre sistemas e plataformas.Monitorar KPIs operacionais, como forecast accuracy, OTIF (On Time In Full) e conformidade de prazos, garantindo maior previsibilidade e conformidade.Propor soluções escaláveis para otimização de processos e melhoria contínua, com foco na integração entre demandas comerciais e capacidades operacionais.Requisitos:Experiência sólida em análise de dados aplicados a processos operacionais e de supply chain.Proficiente em ferramentas como SQL, Python e Looker Studio para criação de relatórios e dashboards.Capacidade de interpretar KPIs e transformar dados em insights práticos para o negócio.Experiência com processos de Strategy Planning, previsão de demanda e planejamento de capacidade.Excelente comunicação para traduzir informações complexas em recomendações claras.Diferencial:Experiência com ferramentas de BI e integração de dados.Conhecimento em planejamento de produção, rastreabilidade e compliance operacional.Familiaridade com metodologias ágeis para projetos de dados e operações.Mais detalhes:Modelo de contrato: PJ;Modelo de trabalho: Hibrido;Descanso sem ser descontado; 22 dias úteis anuais, disponível após os três primeiros meses;Cartão Flexível;Plano de Saúde;Plano Odonto;Totalpass;Udemy;Insider Perks;Oportunidade de crescimento e aprendizado em uma startup em rápida expansãoAmbiente de trabalho colaborativo e inovador, com exposição a novas tecnologias e processosNossa HistóriaAInsidernasceu para desafiar o status-quo da indústria da moda. Aprendemos, inovamos e melhoramos constantemente,para criar um mundo onde todos são encorajados a subir a barra e buscar excelência desde 2017.Hoje,temos mais de 1 milhão de clientes e um portfólio de produtos que tecem tecnologia, inovação e sustentabilidade.Esse é só o início de uma jornada que busca mudanças estruturais em uma das mais tradicionais e poluentes indústrias do mundo: a indústria da moda.Principais destaquesParticipação no programa Startup School da aceleradora Y Combinator.Acelerada 2 vezes nos programas Endeavor Scale Up varejo e consumer goods.Acelerada pelo programa Endeavor Outliers pelo crescimento fora da curva dentro do peer group, ganhando o título de Empreendedores Endeavor.Eleita pela revista Forbes como uma das 25 startups mais promissoras do Brasil.Show moreShow less",N/A,On-site/Hybrid,https://www.linkedin.com/jobs-guest/jobs/api/jobPosting/4221468755,2025-09-29
Staff Data Scientist (Stats/Experimentation),Uber,"São Paulo, São Paulo, Brazil",5 days ago,"About the TeamWe are looking for experienced Data Scientists to join the São Paulo team.You will work with product managers, engineers, and fellow data scientists to shape the direction of our products. You will work on fast-moving, high-stakes problems reaching a global audience. A deep analytical passion and the ability to execute key business priorities are a must for this role.Notes about the profile: If you are interested in advanced modeling and production modeling,this role is not it!We have a separate Applied Science team that works on these types of projects.About the RoleDevelop and monitor strategic metrics and understand all underlying factors;Design and run experiments to analyze the impact of product and/or model changes;Deep dive into data to evaluate proposed product changes and identify opportunities for improving the user experience;Collaborate with product managers and other business leaders to make decisions based on data insights and experiment results;Communicate your findings to cross-functional peers and management.Technical SkillsRequired:Advanced English skills;Senior and/or Staff seniority in a Business/Data/Science role;Previous experience improving products, understanding the user journey, and extracting insights from data;Advanced SQL expertise;Solid experience using Python or R;Experience launching multiple experiments (such as A/B experiments) and an understanding of experimental design and using statistical methods in exploratory analysis;Casual Inference experience is a huge plus;Bachelors or M.S. in Statistics, Economics, Computer Science, or other quantitative fields.Please note: thishybrid positionis based in São Paulo, Brazil - welcoming both local professionals and those open to relocating to São Paulo.Show moreShow less",N/A,On-site/Hybrid,https://www.linkedin.com/jobs-guest/jobs/api/jobPosting/4304079937,2025-09-29
Cientista de Dados SR | IA,Banco Pine,"São Paulo, São Paulo, Brazil",3 weeks ago,"Descrição da vaga:O Profissional que irá desenvolver, implementar e evoluir soluções de Inteligência Artificial. Incumbência de utilizar algoritmos de Machine Learning, Deep Learning e IA Generativa para criar sistemas que gerem impacto e vantagem competitiva e na automação e otimização de processos, visando o aumento da produtividade.Responsabilidades:Desenvolver algoritmos estatísticos e modelos preditivos;Atuar no ciclo de vida de produto de dados como cientista de dados para levar modelos à produção;Automatizar pipelines de ML para treinamento de modelos;Deployment e monitoramento de modelos em produção.Requisitos e qualificações:Ensino Superior completo, em áreas como: Ciência da Computação, Engenharia, Matemática ou áreas correlatas;Desejável Pós-graduação em Estatística e Matemática Aplicada;Facilidade com recursos tecnológicos, sistemas de agendamento, gestão de tarefas, além de agilidade na digitação;Linguagens de Programação( Python,SQL,Rust)Frameworks e Ferramentas(Machine Learning,TensorFLow,PyTorc Keras)APIs de LLMs (Gemini, Anthropic,OpenAI)Benefícios:Salário compatível com o mercado;Participação dos lucros e resultados;Vale Alimentação - com 13ª e 14ª cestas complementares;Vale Refeição;Assistência Médica e Odontológica;Auxílio Creche;Seguro de vida;Total Pass;Licença Maternidade/Paternidade estendida;PAE - Programa de Assistência ao Empregado: apoio aos colaboradores e seus familiares, com assistência jurídica, social, psicológica e financeira;Day Off Aniversário.Show moreShow less",N/A,On-site/Hybrid,https://www.linkedin.com/jobs-guest/jobs/api/jobPosting/4296340894,2025-09-29
Data Scientist,"CloudWalk, Inc.","São Paulo, São Paulo, Brazil",1 week ago,"About CloudWalk:We are not just another fintech unicorn. We are a pack of dreamers, makers, and tech enthusiasts building the future of payments. With millions of happy customers and a hunger for innovation, we're now expanding our neural network - literally and metaphorically.What You Need To SucceedMachine LearningAWS CertificationsGCP CertificationsPython/TypeScriptBonus Points IfYou have a love for or studying physicsJoin us at CloudWalk, where we’re not just engineering solutions; we’re building a smarter, AI-driven future for payments—together.By applying for this position, your data will be processed as per CloudWalk's Privacy Policy that you can read here in Portuguese and here in English.Show moreShow less",N/A,On-site/Hybrid,https://www.linkedin.com/jobs-guest/jobs/api/jobPosting/4278848183,2025-09-29
