title,company,location,posted,description,applicants,work_mode,link,data_coleta
Data Scientist I,Banco Bradesco,"Osasco, São Paulo, Brazil",17 hours ago,"Sobre o BradescoO Bradesco é um dos maiores grupos financeiros do Brasil, com uma história marcada pelo pioneirismo e inovação. Por meio da nossa carteira amplamente diversificada de produtos financeiros, serviços bancários e de seguros contribuímos com a realização das pessoas e o crescimento sustentável de empresas e sociedade. Venha fazer parte do nosso ecossistema financeiro e impactar a experiência de milhões de pessoas!Saiba mais em https://banco.bradesco/html/classic/sobre/index.shtmResponsabilidades e atribuiçõesO que é o nosso time de Pricing?A área de Pricing é responsável pela definição e gestão estratégica de preços e condições financeiras dos produtos do banco, equilibrando rentabilidade, competitividade e risco. Atua com dados, modelagens e inteligência de mercado para apoiar decisões comerciais e impulsionar resultados sustentáveis em diversas linhas de negócio.Modelo de trabalho: Híbrido - 3x presencialUnidade: Osasco/SP; Curitiba/PR ou Recife/PEComo será seu dia a dia?Sendo Data Scientist I, atuará na gerência Pricing e suas principais atividades serão:Realização de estudos analíticos, trabalhando por grande volume de dados;Desenvolver modelos e algoritmos (regressão, Machine Learning, etc.);Suporte no gerenciamento de projetos, desde a construção das ferramentas analíticas até sua implementação e uso em produção;Apresentação dos resultados de estudos e modelos, por meio de relatório técnicos e apresentações;Interagir com diversos departamentos internos, demonstrando interesse e vontade de aprender;Aplicação de melhores práticas compartilhadas pela liderança.Requisitos e QualificaçõesO que você precisa ter ou saber?Ensino superior completo ou cursando em Estatística, Matemática, Engenharias ou áreas correlatas;Experiência no desenvolvimento de soluções analíticas avançadas, trabalhando com grandes volumes de dados;Conhecimento intermediário em estatística e Machine Learning;Conhecimento em programação em SQL e Python/Spark, com uso de bibliotecas de ciência de dados (Pandas, Scikit-learn, Matplotlib, etc.);Conhecimento intermediário em Databricks;Conhecimento avançado com pacote Office (Excel, Word e Power Point).Conhecimento do ciclo de crédito e produtos bancários;Será um diferencial se você tiver:Experiência em Crédito/Pricing;Atuação com IA generativa.O que nós oferecemosNo Bradesco valorizamos a saúde e bem-estar, oferecendo um extenso portfólio de benefícios a todas nossas pessoas funcionárias:PLR ou Bônus: Conforme a elegibilidade de cargo*Convênio MédicoConvênio OdontológicoSeguro de VidaVale AlimentaçãoVale Refeição13º Cesta AlimentaçãoTotal PassVale Transporte (adesão opcional)Descontos em produtos e serviços em empresas parceirasPrevidência Privada (adesão opcional, com participação financeira da Organização Bradesco)Viva Bem Bradesco: programa de saúde, bem-estar e qualidade de vidaUnibrad: Universidade Corporativa BradescoIsenção de Tarifas: condições especiais em diversos produtos e serviçosAuxílio Creche ou BabáLicença Paternidade estendida de 20 diasLicença Maternidade de 180 dias, acompanhamento assistencial da gestação até o pós-partoShow moreShow less",N/A,On-site/Hybrid,https://www.linkedin.com/jobs-guest/jobs/api/jobPosting/4289331103,2025-08-22
Cientista de Dados Jr,Banco Bmg,"São Paulo, São Paulo, Brazil",2 weeks ago,"Há mais de 90 anos, o Banco Bmg atua com foco em democratizar o acesso a soluções financeiras, colocando sempre o cliente no centro de tudo o que fazemos. Somos referência em crédito consignado e estamos presentes em todo o Brasil, com agências, franquias, correspondentes bancários e um app completo que conecta milhões de pessoas a serviços financeiros de forma simples, acessível e inovadora.Crescer e gerar resultados sustentáveis que tragam valor para nossos clientes, acionistas, colaboradores e para a sociedade em geral é uma prioridade para nós. Nossos resultados evidenciam esse comprometimento.Guiados por princípios, construímos uma cultura organizacional que valoriza pessoas, impulsiona o protagonismo e transforma impacto social em legado. Atuamos com times que prezam pela autonomia, pelo comprometimento e pela excelência. Investimos continuamente em conhecimento e inovação para transformar a jornada dos colaboradores e clientes.Esse cuidado com as pessoas nos levou a conquistar, em 2025, o reconhecimento como top 3 melhores instituições financeiras para se trabalhar no Brasil, ocupando a 3ª posição no ranking Great Place To Work®. Um orgulho que reforça nosso compromisso de colocar o Jeito Bmg de Ser em prática todos os dias.Esses pilares impulsionam uma transformação contínua, promovendo revisões diárias de processos, da jornada do cliente, da tomada de decisão e da forma como os times se conectam para gerar valor. No Bmg, somos movidos por fazer diferente e melhor, com integridade, simplicidade e um jeito único de ser: o Jeito Bmg.Responsabilidades e atribuiçõesResponsabilidades e atribuições:Construir, treinar e otimizar modelos utilizando técnicas de aprendizado de máquina;Fazer gestão, acompanhamento e recalibragem dos modelos já implantados;Gerar insights, ad hoc's e estudos analíticos diversos;Construir segmentações baseadas em algoritmos de clusterização;Busca por novas fontes de dados, além das tradicionais disponíveis e estruturadas;Apresentar resultados de projetos de forma compreensível, sem perda de rigor científico;Auxiliar na expansão da cultura do uso da ciência de dados em outras frentes de negócio.Requisitos e qualificaçõesRequisitos e qualificações:Domínio em linguagem de programação Python e modelagem estatística;Habilidade com banco de dados (SQL, ORACLE, etc), visando a extração, limpeza, tratamento e organização dos dados;Entendimento de técnicas de Modelagem Estatística e Machine Learning;Vivência no desenvolvimento e acompanhamento de modelos preditivos e/ou prescritivos.Ter boa comunicação, proatividade, flexibilidade e foco em resultado também são essenciais para você fazer parte do time de Ciência de Dados.Formação superior completa preferencialmente em áreas de exatas.Disponibilidade para atuação híbrida em São Paulo.Informações adicionaisBenefícios, saúde e bem-estarPlano de saúde sem mensalidade e Telemedicina;Plano odontológico;Vale Refeição e Alimentação;Seguro de vida;Previdência privada;Remuneração variável anual (bônus) competitiva;PPR - Programa de Participação nos Resultados;Único Skill (Benefício Educação gratuito);Bicicletário e vestiário;Auxílio creche;Auxílio internet;Programas de qualidade de vida;Ambulatório;Programa da Gestante;Licença Maternidade e Paternidade estendidasPsicologia Viva - Sessões de terapia online gratuita;PAP - Programa de assessoria financeira, jurídica e psicológica;Gympass - Desconto em academias;Frutas todos os dias;Day Off de Aniversário;Dress Code Flexível;Modelo híbrido de trabalho.E aí? Quer vestir a camisa e brilhar em campo com um banco presente na vida de milhões de brasileiros e reconhecido como um dos melhores lugares para se trabalhar?#VamosPraCimaShow moreShow less",N/A,On-site/Hybrid,https://www.linkedin.com/jobs-guest/jobs/api/jobPosting/4278850277,2025-08-22
Cientista de Dados Júnior | Negócios Integrados em Publicidade - Soluções de Dados | Vaga Exclusiva para pessoas Negras ✊🏾,Globo,"São Paulo, São Paulo, Brazil",2 weeks ago,"Sobre a área:Somos a área de dados responsável por apoiar as necessidades do time de negócios da Globo! Nosso time é formado por cientistas, engenheiros e analistas de dados, além de especialistas em segmentação de audiências, e nossa missão é aplicar inteligência aos dados para superar desafios de negócio.DiversidadeCriamos ambientes onde todas as pessoas são incluídas, acolhidas e valorizadas. Nos empenhamos em ser uma Globo cada vez mais diversa, em representatividade e pensamento, aprendendo uns com os outros e estimulando a criatividade e inovação.Acreditamos na intencionalidade para gerar movimentos transformadores, que reconheçam que diferentes grupos sociais partem de diferentes realidades que precisam ser levadas em consideração e acolhidas pelas pessoas e pelo negócio.Equipes representativas trazem inovação inclusiva, nos permitindo criar experiências emocionantes para diferentes tipos de pessoas.Queremos ser cada vez mais o lugar onde todas as pessoas se encontram e, por isso, essa vaga é para você,pessoa negra, que quer crescer e construir o futuro com a gente, nos bastidores de produtos e serviços que impactam a vida de milhões de brasileiros e brasileiras todos os dias.Modelo de trabalho:Híbrido - RJ ou SP.Como será seu dia a dia:Desenvolver e operar soluções baseadas em Modelagem Estatística, Machine Learning e IA, de forma a gerar valor para as áreas de negócios;Executar análises exploratórias de dados, criando visualizações estatísticas para apoiar decisões de negócios;Atuar de forma consultiva junto aos anunciantes da Globo, apresentando resultados, entendendo necessidades de negócio e propondo soluções;Colaborar com a criação de infraestrutura para ganho de escala em soluções de dados.Requisitos e qualificaçõesDo que você precisa:Graduação em Engenharia, Estatística, Matemática, Ciência da Computação, Economia e áreas correlatas;Conhecimento introdutório em inferência estatística: estimação pontual e testes de hipótese;Conhecimento introdutório em modelagem estatística e Machine Learning: modelos de regressão, classificação e clusterização;Conhecimento introdutório em ambientes de cloud (Google Cloud, AWS, Microsoft Azure);Conhecimento intermediário em Python e SQL.Conhecimentos que te destacam:Pós-Graduação (Latu Sensu ou Strictu Sensu) em Engenharia, Estatística, Matemática, Ciência da Computação, Economia e áreas correlatas;Experiência prévia com mercado publicitário;Conhecimento mais que introdutório em Machine Learning, Modelagem Estatística ou Inferência Estatística;Conhecimento de Modelagem de Séries Temporais;Conhecimento de Inferência Causal;Conhecimento de inferência Bayesiana;Capacidade de comunicação para audiências não-técnicas.Informações adicionaisPor que vir para Globo:Vem e vamos criar histórias e tecnologias juntos.Na Globo, o encontro de histórias com tecnologia move um time diverso e apaixonado por inovação.A gente tem a chance de aproximar os brasileiros, criando novas formas de se conectar com eles.Aqui, cada um faz a transformação acontecer.Nossos processos seletivos estão acontecendo de forma 100% remota. #vempragloboQuer saber mais sobre como é trabalhar na Globo? Vem acompanhar nosso dia a dia, desafios e conquistas nas nossas redes:https://www.linkedin.com/company/globohttps://www.instagram.com/vempraglobohttps://www.youtube.com/c/VemPraGlobo/Os seus dados pessoais serão utilizados para fins de seleção de candidatos para preenchimento das vagas abertas na Globo. Os dados pessoais coletados durante o processo seletivo dos candidatos que não forem admitidos neste momento poderão ser mantidos nos bancos de dados para consideração em futuros processos seletivos. Todos os dados coletados serão tratados segundo rígidos padrões de segurança da informação e em total respeito às leis de privacidade aplicáveis, incluindo a Lei 13.709/18, e nos termos de nossa política de privacidade, disponível no link: https://vempraglobo.g.globo/files/politica_de_privacidade.pdfAo prosseguir você está ciente e de acordo para realização de sua candidatura nestes termos.✨somos globo✨A Globo é feita de gente que quer fazer diferente, fazer junto, fazer o futuro. Gente espalhada por todo o país (e mundo!) trabalhando com conteúdo, notícias, negócios, tecnologia, tudo isso com brasilidade e talento de sobra.Canais na TV aberta e por assinatura, produtos digitais como Globoplay, Cartola, G1, Ge, Gshow e outros serviços estão reunidos no mesmo lugar.Na Globo, o encontro de histórias com tecnologia move um time diverso e apaixonado por inovação.A gente tem a chance de aproximar os brasileiros, criando novas formas de se conectar com eles.Aqui, cada um faz a transformação acontecer.Quer fazer parte dessa transformação também?#VemPraGlobo ;)Show moreShow less",N/A,On-site/Hybrid,https://www.linkedin.com/jobs-guest/jobs/api/jobPosting/4278284920,2025-08-22
Data Scientist Specialist,Banco Bradesco,"Osasco, São Paulo, Brazil",1 week ago,"Sobre o BradescoO Bradesco é um dos maiores grupos financeiros do Brasil, com uma história marcada pelo pioneirismo e inovação. Por meio da nossa carteira amplamente diversificada de produtos financeiros, serviços bancários e de seguros contribuímos com a realização das pessoas e o crescimento sustentável de empresas e sociedade. Venha fazer parte do nosso ecossistema financeiro e impactar a experiência de milhões de pessoas!Saiba mais em https://banco.bradesco/html/classic/sobre/index.shtmResponsabilidades e atribuiçõesO que é o nosso time de Controladoria?A área de Controladoria tem a missão de garantir ao Grupo Bradesco informações gerenciais, resultados, análises e projeções com governança, bem como ser referência em análises, estudos e projeções de finanças para aumentar a qualidade e precisão das decisões tomadas pela Organização.Modelo de trabalho :Híbrido - 3x presencialUnidade: Osasco - SPComo será seu dia a dia?Sendo Data Scientist Specialist, atuará na gerência FP&A Indicadores e suas principais atividades serão:Desenvolver estudos para responder demandas de negócios, realizar diagnósticos de problemas e de performance de carteiras e identificar insights acionáveis e oportunidades de rentabilidade sustentável;Aplicar ferramentas analíticas que que suportem a área de FP&A a alavancar a rentabilidade sustentável do banco nos diversos segmentos de negócio empregando: Desenvolvimento de modelos estatísticos supervisionados e não supervisionados, elaboração de ferramentas para projeções de indicadores, condução de testes e experimentos, construção e gestão de simuladores de cenários, construção e gestão de dashboards e estudos para a geração contínua de insights acionáveis;Identificação e busca de novas fontes de dados e variáveis que adicionem valor ao negócio;Suporte no planejamento/organização/melhoria do pipeline de dados da área;Suportar as demais áreas de FP&A com estudos, insights e modelos estatísticos.Requisitos e QualificaçõesO que você precisa ter ou saber?Graduação superior completa em Engenharia, Estatística, Matemática, Ciências da Computação, Economia, Administração, Física ou áreas correlatas;Conhecimento em desenvolvimento de modelos estatísticos;Conhecimento em machine learning;Vivência com SQL;Vivência com Python;Vivência com ferramentas de visualização de dados;Vivência com Pacote Office.Será um diferencial se você tiver:Inglês nível avançado;Conhecimento em Databricks;Conhecimento em análise financeira;Conhecimento em IA generativa;Conhecimento em otimização matemática.O que nós oferecemosNo Bradesco valorizamos a saúde e bem-estar, oferecendo um extenso portfólio de benefícios a todas nossas pessoas funcionárias:PLR ou Bônus: Conforme a elegibilidade de cargo*Convênio MédicoConvênio OdontológicoSeguro de VidaVale AlimentaçãoVale Refeição13º Cesta AlimentaçãoTotal PassVale Transporte (adesão opcional)Descontos em produtos e serviços em empresas parceirasPrevidência Privada (adesão opcional, com participação financeira da Organização Bradesco)Viva Bem Bradesco: programa de saúde, bem-estar e qualidade de vidaUnibrad: Universidade Corporativa BradescoIsenção de Tarifas: condições especiais em diversos produtos e serviçosAuxílio Creche ou BabáLicença Paternidade estendida de 20 diasLicença Maternidade de 180 dias, acompanhamento assistencial da gestação até o pós-partoShow moreShow less",N/A,On-site/Hybrid,https://www.linkedin.com/jobs-guest/jobs/api/jobPosting/4269563969,2025-08-22
Data Scientist Specialist,Banco Bradesco,"Osasco, São Paulo, Brazil",2 weeks ago,"Sobre o BradescoO Bradesco é um dos maiores grupos financeiros do Brasil, com uma história marcada pelo pioneirismo e inovação. Por meio da nossa carteira amplamente diversificada de produtos financeiros, serviços bancários e de seguros contribuímos com a realização das pessoas e o crescimento sustentável de empresas e sociedade. Venha fazer parte do nosso ecossistema financeiro e impactar a experiência de milhões de pessoas!Saiba mais em https://banco.bradesco/html/classic/sobre/index.shtmResponsabilidades e atribuiçõesO que é o nosso time de Portifólio Varejo PF e PJ?A área de Gestão de Portfólio: Atua na análise estratégica e no monitoramento contínuo dos riscos e oportunidades da carteira de crédito. Nosso foco está na otimização da rentabilidade ajustada ao risco, na governança sobre concentração de crédito e na aplicação de soluções analíticas avançadas.Modelo de trabalho: Híbrido - 2x presencialUnidade: Osasco / CuritibaComo será seu dia a dia?Sendo Data Scientist Specialist , atuará na gerência Crédito e suas principais atividades serão:Realizar diagnósticos aprofundados sobre a composição, performance e concentração da carteira, com foco em rentabilidade ajustada ao risco;Desenvolver simulações e análises preditivas para antecipar riscos e oportunidades, apoiando decisões de negócio com base em dados;Construir e evoluir frameworks analíticos para gestão de risco, incluindo métricas de concentração, stress testing e indicadores de performance;Estruturar e aprimorar mecanismos de detecção precoce de deterioração de crédito, com base em sinais financeiros e comportamentais;Atuar de forma colaborativa com Risco, Estratégia, Analytics e Negócios, garantindo alinhamento entre análises técnicas e direcionamentos estratégicos;Traduzir análises complexas em insights claros e objetivos para fóruns de decisão, com forte capacidade de storytelling com dados.Requisitos e QualificaçõesO que você precisa ter ou saber?Graduação em Estatística, Matemática, Engenharia, Economia ou áreas correlatas;Vivência em gestão de portfólio de crédito e risco: Modelagem quantitativa e análise de grandes volumes de dados;Estratégias de crédito para empresas de grande porte ou atacado;Domínio em Python, SQL, SAS, Power BI, Databricks;Conhecimento sólido em técnicas preditivas e estatísticas.Será um diferencial se você tiver:Experiência de crédito para empresas de grande porte e atacado;Experiência com estratégia de early warning.O que nós oferecemosNo Bradesco valorizamos a saúde e bem-estar, oferecendo um extenso portfólio de benefícios a todas nossas pessoas funcionárias:PLR ou Bônus: Conforme a elegibilidade de cargo*Convênio MédicoConvênio OdontológicoSeguro de VidaVale AlimentaçãoVale Refeição13º Cesta AlimentaçãoTotal PassVale Transporte (adesão opcional)Descontos em produtos e serviços em empresas parceirasPrevidência Privada (adesão opcional, com participação financeira da Organização Bradesco)Viva Bem Bradesco: programa de saúde, bem-estar e qualidade de vidaUnibrad: Universidade Corporativa BradescoIsenção de Tarifas: condições especiais em diversos produtos e serviçosAuxílio Creche ou BabáLicença Paternidade estendida de 20 diasLicença Maternidade de 180 dias, acompanhamento assistencial da gestação até o pós-partoShow moreShow less",N/A,On-site/Hybrid,https://www.linkedin.com/jobs-guest/jobs/api/jobPosting/4280178363,2025-08-22
Cientista de Dados (área Business Development) - São Paulo/SP,Shopee,"São Paulo, São Paulo, Brazil",1 week ago,"About The TeamSobre a ShôAqui na Shô, acreditamos que cada membro de nossa equipe é fundamental para o nosso sucesso, e que diversidade de perspectivas e vivências são essenciais para movimentar nosso negócio e impulsionar o nosso propósito de mudar o mundo para melhor.Fazer parte do nosso time é a oportunidade de se desenvolver dentro de uma cultura de muita agilidade. Se você ama assumir grandes responsabilidades e fazer o que nunca foi feito, a Shô é seu lugar. Aqui você terá grandes desafios, trabalhará em colaboração com um time diverso e contribuirá para o futuro do e-commerce no Brasil, criamos impacto positivo na vida de milhões de pessoas.Modelo de TrabalhoAdotamos um modelo de trabalho híbrido, esse modelo permite que as pessoas ajustem seu ambiente de trabalho de acordo com suas necessidades pessoais, ao mesmo tempo em que promove a colaboração e interação no escritório.Qual será a sua missãoVocê atuará no time de Business Development e será responsável por estruturar e automatizar processos de coleta, classificação, organização e análise de dados que apoiem decisões estratégicas em um ambiente de negócio altamente dinâmico e competitivo.Buscamos alguém com perfil técnico e aplicado, que saiba construir soluções escaláveis, com forte raciocínio analítico e autonomia.Job DescriptionComo será o seu dia a diaProjetar e implementar pipelines robustos para processamento de dados em larga escala;Participar ativamente da evolução da esteira de dados e modelos, com foco em escalabilidade, confiabilidade e impacto;Colaborar com desenvolvedores, analistas de negócio e stakeholders de outras áreas, mantendo uma comunicação clara e objetiva;Desenvolver dashboards e relatórios com dados processados, apoiando a geração de insights para o negócio;Construir soluções com mentalidade DevOps e MLOps, utilizando automações, versionamento, CI/CD e monitoramento.RequirementsO que você precisa para assumir o desafioExperiência sólida com Python e bibliotecas de dados e machine learning (Pandas, Scikit-learn, etc.);Vivência com PySpark ou ferramentas de processamento distribuído;Experiência no tratamento e classificação de dados textuais não estruturados (ex: nomes e descrições de produtos, marcas, categorias), usando regex, Fuzzy Matching, embeddings ou LLMs;Experiência com machine learning aplicado a problemas como classificação e segmentação;Domínio de SQL, com experiência em modelagem de dados, otimização de consultas e organização de bases relacionais para consumo analítico;Habilidade de colaborar em equipes multidisciplinares, com boa comunicação e visão de negócio;Diferencial: domínio de frameworks como TensorFlow ou PyTorch;Diferencial: experiência com sistemas de recomendação, otimização ou personalização em larga escala;Diferencial: experiência com ingestão de dados externos e integração com fontes diversas (APIs, arquivos, dados públicos em escala);Diferencial: familiaridade com ferramentas de orquestração como Airflow ou Kubeflow;Diferencial: vivência em ambientes de e-commerce ou mercados com alta complexidade competitiva.BenefíciosAssistência médica e odontológica, estendendo-se aos dependentes;Parceira com Gympass e TotalPass;Vale Refeição/Alimentação flexível;Vale Transporte, Vale Mobilidade ou Estacionamento no local;Benefício flexível;Zenklub;Bônus anual discricionário, atrelado à performance.VEM FAZER HISTÓRIA COM A GENTE.O QUE TE FAZ ÚNICO, NOS FAZ MELHORES! 🧡Show moreShow less",N/A,On-site/Hybrid,https://www.linkedin.com/jobs-guest/jobs/api/jobPosting/4260617702,2025-08-22
