title,company,location,posted,description,applicants,work_mode,link,data_coleta
Cientista de Dados Senior (área Business Development) - São Paulo/SP,Shopee,"São Paulo, São Paulo, Brazil",2 weeks ago,"About The TeamSobre a ShôAqui na Shô, acreditamos que cada membro de nossa equipe é fundamental para o nosso sucesso, e que diversidade de perspectivas e vivências são essenciais para movimentar nosso negócio e impulsionar o nosso propósito de mudar o mundo para melhor.Fazer parte do nosso time é a oportunidade de se desenvolver dentro de uma cultura de muita agilidade. Se você ama assumir grandes responsabilidades e fazer o que nunca foi feito, a Shô é seu lugar. Aqui você terá grandes desafios, trabalhará em colaboração com um time diverso e contribuirá para o futuro do e-commerce no Brasil, criamos impacto positivo na vida de milhões de pessoas.Modelo de TrabalhoAdotamos um modelo de trabalho híbrido, esse modelo permite que as pessoas ajustem seu ambiente de trabalho de acordo com suas necessidades pessoais, ao mesmo tempo em que promove a colaboração e interação no escritório.Qual será a sua missãoVocê atuará no time de Business Development e será responsável por estruturar e automatizar processos de coleta, classificação, organização e análise de dados que apoiem decisões estratégicas em um ambiente de negócio altamente dinâmico e competitivo.Buscamos alguém com perfil técnico e aplicado, que saiba construir soluções escaláveis, com forte raciocínio analítico e autonomia.Job DescriptionComo será o seu dia a diaProjetar e implementar pipelines robustos para processamento de dados em larga escala;Participar ativamente da evolução da esteira de dados e modelos, com foco em escalabilidade, confiabilidade e impacto;Colaborar com desenvolvedores, analistas de negócio e stakeholders de outras áreas, mantendo uma comunicação clara e objetiva;Desenvolver dashboards e relatórios com dados processados, apoiando a geração de insights para o negócio;Construir soluções com mentalidade DevOps e MLOps, utilizando automações, versionamento, CI/CD e monitoramento.RequirementsO que você precisa para assumir o desafioExperiência sólida com Python e bibliotecas de dados e machine learning (Pandas, Scikit-learn, etc.);Vivência com PySpark ou ferramentas de processamento distribuído;Experiência no tratamento e classificação de dados textuais não estruturados (ex: nomes e descrições de produtos, marcas, categorias), usando regex, Fuzzy Matching, embeddings ou LLMs;Experiência com machine learning aplicado a problemas como classificação e regressão;Domínio de SQL, com experiência em modelagem de dados, otimização de consultas e organização de bases relacionais para consumo analítico;Habilidade de colaborar em equipes multidisciplinares, com boa comunicação e visão de negócio;Diferencial: domínio de frameworks como TensorFlow ou PyTorch;Diferencial: experiência/base sólida em webscrapping;Diferencial: experiência com sistemas de recomendação, otimização ou personalização em larga escala;Diferencial: experiência com ingestão de dados externos e integração com fontes diversas (APIs, arquivos, dados públicos em escala);Diferencial: familiaridade com ferramentas de orquestração como Airflow ou Kubeflow;Diferencial: vivência em ambientes de e-commerce ou mercados com alta complexidade competitiva.BenefíciosAssistência médica e odontológica, estendendo-se aos dependentes;Parceira com Gympass e TotalPass;Vale Refeição/Alimentação flexível;Vale Transporte, Vale Mobilidade ou Estacionamento no local;Benefício flexível;Zenklub;Bônus anual discricionário, atrelado à performance.VEM FAZER HISTÓRIA COM A GENTE.O QUE TE FAZ ÚNICO, NOS FAZ MELHORES! 🧡Show moreShow less",N/A,On-site/Hybrid,https://www.linkedin.com/jobs-guest/jobs/api/jobPosting/4260617702,2025-10-13
Cientista de Dados SR,Banco Bradesco,"Osasco, São Paulo, Brazil",1 week ago,"Sobre o BradescoO Bradesco é um dos maiores grupos financeiros do Brasil, com uma história marcada pelo pioneirismo e inovação. Por meio da nossa carteira amplamente diversificada de produtos financeiros, serviços bancários e de seguros contribuímos com a realização das pessoas e o crescimento sustentável de empresas e sociedade. Venha fazer parte do nosso ecossistema financeiro e impactar a experiência de milhões de pessoas!No Bradesco valorizamos a diversidade em todas as suas formas. Por isso, as nossas vagas são abertas a todas as pessoas, independentemente de gênero, raça, orientação sexual, deficiência, idade ou qualquer outra característica.Saiba mais em https://banco.bradesco/html/classic/sobre/index.shtmResponsabilidades e atribuiçõesO que é o nosso time de Pricing?A área de Pricing é responsável pela definição e gestão estratégica de preços e condições financeiras dos produtos do banco, equilibrando rentabilidade, competitividade e risco. Atua com dados, modelagens e inteligência de mercado para apoiar decisões comerciais e impulsionar resultados sustentáveis em diversas linhas de negócio.Modelo de trabalho :Híbrido - 3x presencialUnidade: Osasco/SPComo será seu dia a dia?Sendo Cientista de Dados SR, atuará na gerência Pricing e suas principais atividades serão:Elaboração, desenvolvimento e validação de modelos de rentabilidade/preço para todos os produtos de crédito, alavancando a visão cliente e alterações nas dinâmicas de mercado.Monitorar continuamente a performance dos modelos existentes, realizando recalibrações e ajustes conforme necessário para garantir sua acurácia e relevância;Explorar grandes volumes de dados internos e externos para identificar padrões e features relevantes para a curva de demanda;Conduzir análises para entender como mudanças nas variáveis de precificação e nas condições de mercado afetam os empréstimos;Traduzir os resultados dos modelos em insights acionáveis, ajudando a definir estratégias de financiamento que maximizem a rentabilidade e o volume, considerando a elasticidade da demanda;Comunicar insights complexos e resultados de modelos de forma clara e concisa para stakeholders não técnicos;Desenvolver, implementar modelos de rentabilidade/preço para produtos de crédito, considerando atualizações nas características do cliente (e.g. produtos contratados, etapa do ciclo de vida), apoiando na definição da estratégia de precificação de produtos de crédito.Requisitos e QualificaçõesO que você precisa ter ou saber?Superior completo em áreas como Economia, Engenharia, Estatística, Ciência da Computação ou áreas correlatas;Sólida experiência com modelagem de crédito/risco;Profundo conhecimento em modelos de precificação e análise de rentabilidade;Proficiência em ferramentas de dados como: Python, SQL, Psypark, Excel Avançado e Power BI;Excelente comunicação clara e objetiva, com capacidade de apresentar dados complexos e conclusões de forma compreensível para diferentes públicos;Forte capacidade analítica e raciocínio lógico.Será um diferencial se você tiver:MBA ou pós-graduação em Finanças, Estratégia, Marketing Analítico ou Data Science;Experiência com modelagem financeira.O que nós oferecemosNo Bradesco valorizamos a saúde e bem-estar, oferecendo um extenso portfólio de benefícios a todas nossas pessoas funcionárias:PLR ou Bônus: Conforme a elegibilidade de cargo*Convênio MédicoConvênio OdontológicoSeguro de VidaVale AlimentaçãoVale Refeição13º Cesta AlimentaçãoTotal PassVale Transporte (adesão opcional)Descontos em produtos e serviços em empresas parceirasPrevidência Privada (adesão opcional, com participação financeira da Organização Bradesco)Viva Bem Bradesco: programa de saúde, bem-estar e qualidade de vidaUnibrad: Universidade Corporativa BradescoIsenção de Tarifas: condições especiais em diversos produtos e serviçosAuxílio Creche ou BabáLicença Paternidade estendida de 20 diasLicença Maternidade de 180 dias, acompanhamento assistencial da gestação até o pós-partoShow moreShow less",N/A,On-site/Hybrid,https://www.linkedin.com/jobs-guest/jobs/api/jobPosting/4308108235,2025-10-13
Cientista de Dados SR,Banco Sofisa S/A,"São Paulo, São Paulo, Brazil",3 weeks ago,"Descrição da vagaOrgulhosamente, somos um dos principais bancos do Brasil. Aqui, não nos contentamos com o status quo. Estamos sempre em busca de melhorias, aprendizado contínuo e inovação. Procuramos pessoas que sejam apaixonadas por mudanças, que tenham vontade de aprender e queiram crescer no mercado financeiro. Se você se identifica, venha fazer parte do nosso time!Responsabilidades e atribuiçõesConstrução de Modelos e estudos Estatísticos para Crédito no segmento PJConectar dados de Negócio com soluções de dados (classificação, regressão, agrupamento, métricas de avaliação)Manipulação de dados para construção de data lake, ETL, BooksConstrução das políticas de crédito em motor de regras de decisãoAtuação em todo o ciclo de vida dos dadosRequisitos e qualificaçõesRequisitos ImprescindíveisDomínio em programação para manipulação de banco de dados e de modelagem estatística (Python, R ou SAS)Experiência com SQLManipulação e tratamento de dados (ETL)Experiência em construção e implantação de modelos preditivosAlguns Diferenciais Interessantes Para a VagaExperiencia em validação e acompanhamento dos ratings e políticas de crédito (NEUROTECH) para manutenção/ajustesExperiência em modelagem para crédito PJExperiência em construção e implantação de modelos preditivosExperiência em políticas de crédito PJExperiência em construção de modelos de PropensãoExperiência em DatabricksInformações adicionaisVale-Refeição;Vale-Alimentação;Seguro Saúde;Plano Odontológico;Seguro de Vida;Auxílio Nascimento;Auxílio Casamento;Auxílio Creche/Babá;Bônus Aniversário;Apoio Pass;Convênio Academia;Vale Transporte;PLR;Bônus anual.Uma história de mais de 60 anos de solidez e inovação.Em 1961 foi fundado o Banco Sofisa, em uma jornada de transformação, adaptação e principalmente inovação.Hoje, temos orgulho em ser um dos principais bancos do Brasil. O motivo disso é incentivar e acreditar no empreendedor brasileiro, fortalecendo relacionamentos apoiados na ética e no respeito. Um dos fatores que nos destacam no mercado é o comprometimento dos nossos colaboradores, com forte espírito empreendedor e uma paixão que os fazem vestir a camisa como se fossem donos. É essa mesma motivação que nos leva a prêmios e conquistas notáveis, como o de Melhor Banco do Brasil, em um ranking realizado pela Forbes, no ano de 2023.Por aqui, não nos contentamos com o status quo. Acreditamos que sempre podemos melhorar, aprender, investir e buscar o novo. A melhora contínua é um processo diário. Em 2011, inauguramos uma nova categoria de serviços bancários no Brasil, lançando o primeiro banco digital de investimentos: o Sofisa Direto. Com isso, encontramos a oportunidade ideal para manter os nossos clientes motivados a buscar os seus objetivos. Em toda a história, os negócios do Banco Sofisa foram construídos por uma sólida estrutura financeira, assegurada por altos índices de capitalização, fazendo com que os nossos clientes sintam-se seguros, investindo em ativos de qualidade, que muitas das vezes só se encontram por aqui.Hoje, podemos dizer que vencemos o maior de todos os testes, o teste do tempo. E se esse teste foi vencido, é porque valorizamos quem realmente importa: você, nosso cliente. Cada obstáculo superado, cada desafio vencido são os fundamentos da solidez e a experiência que precisamos para seguir em frente.Somos o Banco Sofisa. Somos diferentes!Show moreShow less",N/A,On-site/Hybrid,https://www.linkedin.com/jobs-guest/jobs/api/jobPosting/4302210016,2025-10-13
CIENTISTA DE DADOS,Grupo Data Portugal,"São Paulo, São Paulo, Brazil",3 weeks ago,"Estamos em busca de um cientista de dados com habilidades para atuar na área de produtos, focando em inteligência de mercado, modelagem de dados não estruturados, análise de dados e desenvolvimento de estratégias que impulsionem o desempenho dos nossos produtos digitais.O profissional será responsável por acompanhar, interpretar e transformar métricas e KPIs em estratégias que gerem crescimento de conversão e engajamento nos produtos desenvolvidos.Buscamos alguém que seja apaixonado por dados, tenha um olhar estratégico e consiga alinhar as análises à performance dos produtos digitais.O QUE VOCÊ PRECISA PARA SE CANDIDATAR:Análise de Dados: Experiencia comprovada em análise de dados, modelagem de dados não estruturados, incluindo análise descritiva, estatística e preditiva, especialmente aplicada à área de MKT.Conhecimento de Ferramentas de Análise: Excel avançado e habilidade com criação de dashboards em ferramentas de análise de dados, como Google Analytics, Power BI, Tableau, ferramentas de CRM, plataformas de análise de mídia, etc.Habilidade de Comunicação: Capacidade de interpretar métricas e traduzir dados em estratégias práticas, comunicar os resultados das análises de forma clara e concisa, com apresentações impactante e persuasivas para comunicar insights e recomendações.Pensamento Crítico: Habilidade em transformar dados complexos em insights práticos que impulsionem a tomada de decisões estratégicas, geração de novos leads e a criação de campanhas de alto impacto.Formação Acadêmica em Tecnologia, Marketing, ou áreas que tenham afinidade com análise dados;Inglês nível B2.Necessidade da disponibilidade de ida ao escritório 01x por semana - SP.VOCÊ IRÁ SE DESTACAR COM:Conhecimento de Produtos Digitais: Compreensão dos princípios de produtos digitais, incluindo funis de conversão, estratégias de go to market, etc.Experiência com automação de relatórios e ferramentas de automação de marketing.Conhecimento em performance de campanhas digitais.Noções de programação em Python ou SQL para extração e análise de dados;Conhecimento da indústria de Telecom e/ou conteúdos digitais.Compreender a usabilidade e experiência do usuário para produtos web/mobile de consumo;Perfil analítico, orientado a resultados com excelente capacidade de identificar problemas, analisar causas e propor soluções.RESPONSABILIDADES PRINCIPAIS:O candidato ideal será responsável por fornecer recomendações estratégicas com base em sua análise de dados e pesquisa de mercado. Você também acompanhará e analisará o desempenho de nossas iniciativas de marketing. Suas análises e recomendações ajudarão a tornar nossas estratégias de marketing mais impactantes e eficazes.Análise de Dados: Coletar, analisar e interpretar dados de diversas fontes, como funil de acesso aos portais digitais, vendas, financeiro , comportamento do cliente, etc.Identificação de Tendências e Oportunidades: Detectar padrões, insights e oportunidades de melhoria nas campanhas e estratégias de marketing.Otimização de Performance: Utilizar os dados para mensurar e propor otimizações de performance nos produtos através de novas estratégias de campanha, testes A/B, revisão de segmentações, réguas de engajamento, etc, buscando melhor desempenho geral.Elaboração de Relatórios e Apresentações: Criar relatórios detalhados e apresentações com as análises e recomendações para as equipes de marketing e outros stakeholders.Pesquisa de Mercado: Realizar pesquisas de mercado e análise de concorrentes para identificar oportunidades e ameaças.Suporte à Tomada de Decisão: Fornecer dados e insights para apoiar a tomada de decisões estratégicas do marketing.Show moreShow less",N/A,On-site/Hybrid,https://www.linkedin.com/jobs-guest/jobs/api/jobPosting/4301903535,2025-10-13
"Senior Data Scientist, LATAM",Canva,"São Paulo, São Paulo, Brazil",3 days ago,"Job DescriptionJoin the team redefining how the world experiences design.Hey, hello, hiya, g'day, mabuhay, kia ora, 你好, hallo, vítejte!Thanks for stopping by. We know job hunting can be a little time consuming and you're probably keen to find out what's on offer, so we'll get straight to the point.Where And How You Can WorkOur headquarters is in sunny Sydney, Australia, but our team spans the globe. Since we don’t have a physical campus in Brazil, this role is fully remote—giving you the flexibility to do your best work from wherever you thrive.What You’d Be Doing In This RoleAs Canva scales change continues to be part of our DNA. But we like to think that's all part of the fun. So this will give you the flavour of the type of things you'll be working on when you start, but this will likely evolve.At The Moment, This Role Is Focused OnBuild the Data Foundation for LATAM Design and build dashboards from scratch that bring visibility to our most important LATAM metrics—across user growth, retention, monetization, campaign performance, and more.Own LATAM Data Strategy End-to-End Define how we track success across the region by setting clear and relevant targets. Build frameworks and KPIs that help us measure impact and make better decisions—tailored to local market nuance.Partner with Local, Regional, and Central Teams Act as the bridge between our LATAM teams (marketing, country managers, community), and global product and data functions. Ensure local insights are reflected in global priorities, and ensure a two-way flow of local and global insights.Tell the Story Behind the Numbers Craft clear, actionable narratives using data. Turn complex insights into simple stories that inspire action—whether with product teams, regional leadership, or the whole company.Identify Problems Before They’re Obvious Proactively surface growth bottlenecks, user behavior shifts, or product mismatches in the region—so we’re always one step ahead.Support Product & Experimentation Initiatives Work closely with product teams to help design and measure new feature performance, local experiments, and A/B tests in LATAM markets.You're probably a match ifYou have strong SQL and data wrangling skills; able to work independently with large, messy datasets and exposure to experimentation and A/B testing frameworksYou are familiar with Canva’s data stack (Looker, Snowflake, Mode, Netspring)You have proven experience building dashboards and tracking frameworks from the ground upYou can showcase the ability to define and track key metrics across the user journey (e.g., signups, MAU, retention, monetization)You have prior experience partnering with cross-functional teams (marketing, product, growth, ops), and using data to influence decisionsYou bring strong communication and storytelling skills—you make data land, not just show upYou have hands-on experience using AI in your work to drive greater impactYou are a strategic thinker who can zoom out and prioritize what really moves the needle and you’re comfortable in ambiguity and take ownership without waiting for a briefYou have experience working in, or analyzing LATAM markets or other global marketsYou bring an understanding of mobile analytics and behavioral funnels and are experienced in supporting product teams or market localization initiativesYou ideally have working proficiency in Spanish and/or Portuguese to help us better support our local communityAbout The TeamAt Canva, we’ve just unlocked a huge opportunity in LATAM: for the first time, we’re building a dedicated regional team to understand, grow, and serve the unique needs of our users across LATAM.As the Regional Data Lead for LATAM, you’ll be the first dedicated analytics voice for this region—shaping how we understand our users, measure what matters, and build a data-informed growth strategy that connects our local markets with our global product teams.If you’re excited about building from scratch, partnering closely with teams across marketing, product, and community, and helping one of the world’s fastest-growing platforms localize with care—this is your chance.What's in it for you?Achieving our crazy big goals motivates us to work hard - and we do - but you'll experience lots of moments of magic, connectivity and fun woven throughout life at Canva, too. We also offer a range of benefits to set you up for every success in and outside of work.Here's a Taste Of What's On OfferEquity packages - we want our success to be yours tooInclusive parental leave policyAn annual Vibe & Thrive package to support your wellbeing, social connection, office setup & moreFlexible leave options that empower you to be a force for good, take time to recharge and supports you personallyCheck out lifeatcanva.com for more info.Other Stuff To KnowWe see AI as a powerful amplifier of creativity and technology at Canva. We’re evolving how we assess AI skills in our Technology hiring experience - you’ll tackle interactive, real-time challenges that reflect the kind of work we do. In some interviews, you may also be asked to solve a problem using an AI tool to show how you approach challenges with tech by your side. Your recruitment partner will walk you through what to expectWe make hiring decisions based on your experience, skills and passion, as well as how you can enhance Canva and our culture. When you apply, please tell us the pronouns you use and any reasonable adjustments you may need during the interview process.We celebrate all types of skills and backgrounds at Canva so even if you don’t feel like your skills quite match what’s listed above - we still want to hear from you!Please note that interviews are conducted virtually.Show moreShow less",N/A,Remote,https://www.linkedin.com/jobs-guest/jobs/api/jobPosting/4312973189,2025-10-13
Pesquisador de Campo - Guarulhos FREELA,Zukkin - Inteligência de Preços,"Guarulhos, São Paulo, Brazil",5 days ago,"A vaga é para atuar como Pesquisador de Campo em Guarulhos/SPOferecemos uma remuneração de R$95,00 por diária para a realização das pesquisas. Esse valor contempla 8 horas de trabalho diário, permitindo flexibilidade para conciliar com outras atividades. Nosso formato de contratação é no regime FREELANCER com pagamento efetuado todo dia 10.Segue a rota:SEGUNDA-FEIRASão JoãoQnt itens: 400 itensPrazo: 16:00Parque Santo AgostinhoQnt itens: 475 itensPrazo: 16:00AV BRIGADEIRO FARIA LIMAQnt itens: 400 itensPrazo: 16:00Responsabilidades:Realizar pesquisas de campo para coletar informações sobre preços de produtos e serviços;Registrar e analisar os dados obtidos durante as pesquisas;Identificar tendências de mercado relacionadas aos preços pesquisados;Reportar os resultados das pesquisas à equipe responsável;Manter-se atualizado sobre as práticas de precificação do setor.Requisitos:Experiência prévia em pesquisas de campo ou áreas relacionadas.Conhecimento em técnicas de coleta e análise de dados.Habilidade para trabalhar de forma independente e em equipe.Boa comunicação e capacidade de reportar informações de forma clara.Atenção aos detalhes e capacidade de observação.Ensino médio completo.Interessado(a) em participar do nosso processo seletivo?Show moreShow less",N/A,On-site/Hybrid,https://www.linkedin.com/jobs-guest/jobs/api/jobPosting/4311524203,2025-10-13
