title,company,location,posted,description,applicants,work_mode,link,data_coleta
Data Scientist III,Banco Bradesco,"Osasco, São Paulo, Brazil",17 hours ago,"Sobre o BradescoO Bradesco é um dos maiores grupos financeiros do Brasil, com uma história marcada pelo pioneirismo e inovação. Por meio da nossa carteira amplamente diversificada de produtos financeiros, serviços bancários e de seguros contribuímos com a realização das pessoas e o crescimento sustentável de empresas e sociedade. Venha fazer parte do nosso ecossistema financeiro e impactar a experiência de milhões de pessoas!Saiba mais em https://banco.bradesco/html/classic/sobre/index.shtmResponsabilidades e atribuiçõesO que é o nosso time de Pricing ?A área de Pricing é responsável pela definição e gestão estratégica de preços e condições financeiras dos produtos do banco, equilibrando rentabilidade, competitividade e risco. Atua com dados, modelagens e inteligência de mercado para apoiar decisões comerciais e impulsionar resultados sustentáveis em diversas linhas de negócio.Modelo de trabalho: Híbrido (3 dias presenciais e 2 dias remotos)Unidade: Osasco/SP (Matriz)Como será seu dia a dia?Sendo Data Scientist III, atuará na gerência do Pricing e suas principais atividades serão:Executar estratégia de Consignado, monitorando evolução da performance dos produtos e elaborando relatórios para apoiar na captura de insights sobre a performance da estratégia de Consignado;Apoiar na precificação de Consignado, implementando estratégia da área focado em garantir geração de valor;Traduzir guidelines estratégicos em parâmetros para input na modelagem e definição do preço recomendado;Monitorar adesão à política de alçadas para descontos comerciais, garantindo tratamento adequado de desvios ;Identificar oportunidades na precificação de Consignado, elaborando plano de ação e implementação;Orquestrar e priorizar com tecnologia os desenvolvimentos necessários para a sofisticação da precificação para Consignado, desenhando plano de ação e acompanhando sua evolução;Realizar estudos de mercado, performance do produto e oportunidades em novos negócios.Requisitos e QualificaçõesO que você precisa ter ou saber?Superior completo em áreas como Economia, Engenharia, Estatística, Administração ou áreas correlatas;Sólida experiência com análise de dados, modelagem financeira e precificação.Será um diferencial se você tiver:Experiência com produtos de financiamento PF.O que nós oferecemosNo Bradesco valorizamos a saúde e bem-estar, oferecendo um extenso portfólio de benefícios a todas nossas pessoas funcionárias.PLR ou Bônus: Conforme a elegibilidade de cargo*Convênio MédicoConvênio OdontológicoSeguro de VidaVale AlimentaçãoVale Refeição13º Cesta AlimentaçãoTotal PassVale Transporte (adesão opcional)Descontos em produtos e serviços em empresas parceirasPrevidência Privada (adesão opcional, com participação financeira da Organização Bradesco)Viva Bem Bradesco: programa de saúde, bem-estar e qualidade de vidaUnibrad: Universidade Corporativa BradescoIsenção de Tarifas: condições especiais em diversos produtos e serviçosAuxílio Creche ou BabáLicença Paternidade estendida de 20 diasLicença Maternidade de 180 dias, acompanhamento assistencial da gestação até o pós-partoSobre o BradescoO Bradesco é um dos maiores grupos financeiros do Brasil, com uma história marcada pelo pioneirismo e inovação. Por meio da nossa carteira amplamente diversificada de produtos financeiros, serviços bancários e de seguros contribuímos com a realização das pessoas e o crescimento sustentável de empresas e sociedade. Venha fazer parte do nosso ecossistema financeiro e impactar a experiência de milhões de pessoas!Saiba mais em https://banco.bradesco/html/classic/sobre/index.shtmResponsabilidades e atribuiçõesO que é o nosso time de Pricing ?A área de Pricing é responsável pela definição e gestão estratégica de preços e condições financeiras dos produtos do banco, equilibrando rentabilidade, competitividade e risco. Atua com dados, modelagens e inteligência de mercado para apoiar decisões comerciais e impulsionar resultados sustentáveis em diversas linhas de negócio.Modelo de trabalho: Híbrido (3 dias presenciais e 2 dias remotos)Unidade: Osasco/SP (Matriz)Como será seu dia a dia?Sendo Data Scientist III, atuará na gerência do Pricing e suas principais atividades serão:Executar estratégia de Consignado, monitorando evolução da performance dos produtos e elaborando relatórios para apoiar na captura de insights sobre a performance da estratégia de Consignado;Apoiar na precificação de Consignado, implementando estratégia da área focado em garantir geração de valor;Traduzir guidelines estratégicos em parâmetros para input na modelagem e definição do preço recomendado;Monitorar adesão à política de alçadas para descontos comerciais, garantindo tratamento adequado de desvios ;Identificar oportunidades na precificação de Consignado, elaborando plano de ação e implementação;Orquestrar e priorizar com tecnologia os desenvolvimentos necessários para a sofisticação da precificação para Consignado, desenhando plano de ação e acompanhando sua evolução;Realizar estudos de mercado, performance do produto e oportunidades em novos negócios.Requisitos e QualificaçõesO que você precisa ter ou saber?Superior completo em áreas como Economia, Engenharia, Estatística, Administração ou áreas correlatas;Sólida experiência com análise de dados, modelagem financeira e precificação.Será um diferencial se você tiver:Experiência com produtos de financiamento PF.O que nós oferecemosNo Bradesco valorizamos a saúde e bem-estar, oferecendo um extenso portfólio de benefícios a todas nossas pessoas funcionárias.PLR ou Bônus: Conforme a elegibilidade de cargo*Convênio MédicoConvênio OdontológicoSeguro de VidaVale AlimentaçãoVale Refeição13º Cesta AlimentaçãoTotal PassVale Transporte (adesão opcional)Descontos em produtos e serviços em empresas parceirasPrevidência Privada (adesão opcional, com participação financeira da Organização Bradesco)Viva Bem Bradesco: programa de saúde, bem-estar e qualidade de vidaUnibrad: Universidade Corporativa BradescoIsenção de Tarifas: condições especiais em diversos produtos e serviçosAuxílio Creche ou BabáLicença Paternidade estendida de 20 diasLicença Maternidade de 180 dias, acompanhamento assistencial da gestação até o pós-partoShow moreShow less",N/A,On-site/Hybrid,https://www.linkedin.com/jobs-guest/jobs/api/jobPosting/4270762813,2025-07-23
"Banco de Talentos (Data Scientist Internship, Brazil - BCG X)",BCG X,"São Paulo, São Paulo, Brazil",2 days ago,"Who We AreBoston Consulting Group partners with leaders in business and society to tackle their most important challenges and capture their greatest opportunities. BCG was the pioneer in business strategy when it was founded in 1963. Today, we help clients with total transformation-inspiring complex change, enabling organizations to grow, building competitive advantage, and driving bottom-line impact.To succeed, organizations must blend digital and human capabilities. Our diverse, global teams bring deep industry and functional expertise and a range of perspectives to spark change. BCG delivers solutions through leading-edge management consulting along with technology and design, corporate and digital ventures—and business purpose. We work in a uniquely collaborative model across the firm and throughout all levels of the client organization, generating results that allow our clients to thrive.We Are BCG XWe’re a diverse team of more than 3,000 tech experts united by a drive to make a difference. Working across industries and disciplines, we combine our experience and expertise to tackle the biggest challenges faced by society today. We go beyond what was once thought possible, creating new and innovative solutions to the world’s most complex problems. Leveraging BCG’s global network and partnerships with leading organizations, BCG X provides a stable ecosystem for talent to build game-changing businesses, products, and services from the ground up, all while growing their career. Together, we strive to create solutions that will positively impact the lives of millions.What You'll DoWe are seeking strong candidates with advanced analytics experience to start an exciting consultant career within BCG X. We are looking for profiles with a background in any area related to predictive analytics, machine learning, optimization/operations as well as risk. BCG X offers a unique opportunity to join a vibrant team of data scientists applying the most advanced analytics techniques in a rewarding environment.What You'll BringEducation & ExperienceBachelor’s degree with excellent academic achievements in a field linked to computer science, applied mathematics, statistics, machine learning, or related data centric areas - Expected graduation between December 2025 and December 2026.Relevant internships or industry/consulting previous experienceExperience in core analytics methods (e.g. Machine Learning, Optimization, Deep Learning, etc.)Fluency in at least one scripting language (e.g. Python, R)Deep technical and data science expertise, strong passion for data science topicsExcellent analytical skills and strategic thinking, creative problem solverStrong interpersonal credibility, reliability, and service mentality, high ethical standardsExcellent written and verbal communication skills in Portuguese and EnglishTechnical competenciesExperience in core analytics methods (e.g. Machine Learning/Deep Learning, Optimization/Operational Research, Geoanalytics, Predictive Modeling, Autonomous Agents, Network Analysis, etc…)Familiarity with a broad base of analytics tools (Data management; Analytics platforms / Programming – e.g. Python, R ; Data Visualization, etc…)Experience in applied analytics for business problem solving/experience building analytical solutionsAdditional info#BCGXjobBoston Consulting Group is an Equal Opportunity Employer. All qualified applicants will receive consideration for employment without regard to race, color, age, religion, sex, sexual orientation, gender identity / expression, national origin, disability, protected veteran status, or any other characteristic protected under national, provincial, or local law, where applicable, and those with criminal histories will be considered in a manner consistent with applicable state and local laws.BCG is an E - Verify Employer. Click here  for more information on E-Verify.Show moreShow less",N/A,On-site/Hybrid,https://www.linkedin.com/jobs-guest/jobs/api/jobPosting/4229256047,2025-07-23
Gen AI Scientist,AVANTTi,"São Paulo, São Paulo, Brazil",5 days ago,"Estamos em busca de um(a) Cientista de IA Generativa talentoso(a) e inovador(a) para se juntar à nossa equipe.Neste cargo, você desempenhará um papel fundamental ao utilizar Modelos de Linguagem de Grande Escala (LLMs) para oferecer respostas mais precisas, sensíveis ao contexto e criativamente elaboradas, com aplicações no mundo real. Como Cientista de IA Generativa, você será responsável por desenvolver e melhorar a usabilidade e criatividade das respostas geradas por nossos LLMs.Você trabalhará em estreita colaboração com nossa equipe multidisciplinar de cientistas de dados e engenheiros, com o objetivo não apenas de avançar nos aspectos técnicos, mas também de trazer relevância prática e criatividade às soluções baseadas em modelos de linguagem.O(a) candidato(a) ideal utilizará as mais recentes inovações em NLP (Processamento de Linguagem Natural) e LLMs para propor soluções de software que melhorem a experiência do cliente. O Cientista de Dados de IA Generativa irá projetar e testar algoritmos, realizar protótipos para avaliar possíveis cenários e aplicar técnicas computacionais e estatísticas no desenvolvimento de abordagens inovadoras para dados de texto e imagem.RequisitosHabilidades exigidas:Doutorado (ou Mestrado com mais de 10 anos de experiência após o título) em Ciência da Computação, Engenharia Elétrica, Física, Matemática, Estatística ou áreas relacionadas à Análise de Dados.Mais de 7 anos de experiência profissional.Capacidade de escrever código pronto para produção em Python ou outra linguagem de programação de alto nível.Bom entendimento do funcionamento interno dos LLMs.Experiência no desenvolvimento de modelos estatísticos e de aprendizado de máquina.Experiência em análise e apresentação de dados complexos, com habilidades comprovadas em resolução de problemas.Show moreShow less",N/A,On-site/Hybrid,https://www.linkedin.com/jobs-guest/jobs/api/jobPosting/4268464881,2025-07-23
10869 - Cientista de Dados,Talent Group,"São Paulo, São Paulo, Brazil",1 week ago,"Descrição:Profissional atuará como Cientista de Dados, atuando com realização do ajuste fino (fine-tuning) de modelos pré-treinados com bases de dados internas ou públicas, aplicando técnicas como LoRA, PEFT e distilação, quando necessário.Aplicar engenharia de prompts para otimizar interações com LLMs via APIs (OpenAI, Anthropic, Google, Cohere, Hugging Face, etc.).Implementar pipelines inteligentes com ETL automatizado, utilizando boas práticas de versionamento de dados e reprodutibilidade.Integrar modelos em fluxos de negócio utilizando frameworks como LangChain e APIs REST/GraphQL.Analisar resultados, definir métricas de sucesso e realizar validações contínuas dos modelos (F1, BLEU, perplexidade).Gerar relatórios e dashboards com insights dos modelos usando SQL e Looker Studio.Atuação anterior em projetos com modelos generativos ou LLMs aplicados em produção.Vivência com ajuste fino (fine-tuning) de modelos pré-treinados com dados próprios.Experiência na integração de modelos via APIs e serviços web.Experiência com deploy de soluções baseadas em IA.Conhecimentos Específicos:- Python avançado com experiência em pandas, numpy, LangChain, asyncio.- Conhecimento prático em scikit-learn, TensorFlow, PyTorch.- Experiência com APIs de LLMs e ferramentas como Hugging Face Transformers.- Conhecimento em Git.- Construção e manutenção de pipelines de ETL de dados.- Familiaridade avançada com SQL para consultas e extração de dados.Superior completo.- Experiência com Looker Studio para visualização e monitoramento de dados/modelos.Contratação: CLT + BenefíciosAtuação 100% Home office.Show moreShow less",N/A,On-site/Hybrid,https://www.linkedin.com/jobs-guest/jobs/api/jobPosting/4263534554,2025-07-23
Analista de Processos de Inteligência Artificial,Volkswagen Group Services - South America,"São Paulo, São Paulo, Brazil",1 week ago,"Estamos em busca de um(a) Analista de Inteligência Artificial para integrar nosso time. Esse(a) profissional terá como missão aplicar soluções de IA para otimizar processos, melhorar a eficiência operacional e conectar áreas estratégicas como Finanças, RH, Jurídico, Administrativo, entre outras.Buscamos alguém com perfil analítico, colaborativo e com boa capacidade de comunicação, que saiba traduzir desafios de negócio em soluções baseadas em dados e algoritmos.Responsabilidades e atribuiçõesResponsabilidadesDesenvolver e implementar modelos de inteligência artificial e aprendizado de máquina;Identificar oportunidades de automação e otimização de processos internos;Atuar em conjunto com áreas como Finanças, Recursos Humanos, Jurídico e Administrativo, entre outras, para mapear necessidades e entregar soluções de valor;Analisar dados e construir pipelines para alimentar modelos preditivos;Monitorar a performance de modelos e realizar ajustes para garantir precisão e escalabilidade;Apoiar iniciativas de inovação e transformação digital;Produzir documentação técnica e relatórios de resultados para stakeholders.Requisitos e qualificaçõesRequisitosExperiência com ferramentas e bibliotecas de IA (ex: Python, scikit-learn, TensorFlow, PyTorch, etc.);Conhecimento em manipulação e análise de dados (Pandas, SQL, Power BI ou similares);Familiaridade com metodologias ágeis (Scrum/Kanban);Inglês intermediário (leitura e comunicação técnica);Capacidade de atuar de forma autônoma e colaborativa com diferentes áreas da empresa.DesejáveisExperiência anterior em projetos corporativos de automação ou IA aplicada;Conhecimento de ferramentas de MLOps e deploy de modelos (ex: Docker, MLflow, Airflow);Experiência com ferramentas de visualização de dados (ex: Tableau, Power BI, Streamlit).Informações adicionaisCondições:Contratação CLT, no modelo híbrido, com presença necessária em nosso escritório no bairro do Jabaquara, São Paulo/SP, 3 vezes por semana, bem como visitas/reuniões em São Bernardo do Campo/SP.Benefícios:Vale AlimentaçãoVale RefeiçãoPlano de Saúde SulamericaPlano Odontológico SulamericaPrevidência PrivadaSeguro de VidaAuxílio CrechePLRVale TransportePrograma Bem-Estar (Wellhub/Gympass, Conexa e Psicologia Viva)Show moreShow less",N/A,On-site/Hybrid,https://www.linkedin.com/jobs-guest/jobs/api/jobPosting/4263800453,2025-07-23
"Data Science Research, Search (English, Portuguese)",Google,Greater São Paulo Area,1 week ago,"Please submit your resume in English - we can only consider applications submitted in this language.Minimum qualifications:Master's degree in Statistics, Data Science, Mathematics, Physics, Economics, Operations Research, Engineering, or a related quantitative field.3 years of experience using analytics to solve product or business problems, coding (e.g., Python, R, SQL), querying databases or statistical analysis, or a PhD degree.Ability to communicate in English and Portuguese fluently to support client relationship management in this region.Preferred qualifications:5 years of experience using analytics to solve product or business problems, coding (e.g., Python, R, SQL), querying databases or statistical analysis, or a PhD degree.4 years of experience analyzing data and creating reports with statistical, quantitative modeling, and forecasting skills.3 years of experience in an applied research setting.Experience with Python, R, or other scripting languages.Experience in survey research.Knowledge of statistics, and proficiency in one or more statistical software packages (e.g., R, SPSS, Stata, SAS).About the jobAt Google, data drives all of our decision-making. Quantitative Analysts work all across the organization to help shape Google's business and technical strategies by processing, analyzing and interpreting huge data sets. Using analytical excellence and statistical methods, you mine through data to identify opportunities for Google and our clients to operate more efficiently, from enhancing advertising efficacy to network infrastructure optimization to studying user behavior. As an analyst, you do more than just crunch the numbers. You work with Engineers, Product Managers, Sales Associates and Marketing teams to adjust Google's practices according to your findings. Identifying the problem is only half the job; you also figure out the solution.Google Research addresses challenges that define the technology of today and tomorrow. From conducting fundamental research to influencing product development, our research teams have the opportunity to impact technology used by billions of people every day.Our teams aspire to make discoveries that impact everyone, and core to our approach is sharing our research and tools to fuel progress in the field -- we publish regularly in academic journals, release projects as open source, and apply research to Google products.ResponsibilitiesCollaborate with stakeholders in cross-projects and team settings to identify and clarify business or product questions to answer. Provide feedback to translate and refine business questions into tractable analysis, evaluation metrics, or mathematical models.Use custom data infrastructure or existing data models as appropriate, using specialized knowledge. Design and evaluate models to mathematically express and solve defined problems with limited precedent.Gather information, business goals, priorities, and organizational context around the questions to answer, as well as the existing and upcoming data infrastructure.Own the process of gathering, extracting, and compiling data across sources via relevant tools (e.g., SQL, R, Python). Independently format, re-structure, or validate data to ensure quality, and review the dataset to ensure it is ready for analysis.Google is proud to be an equal opportunity workplace and is an affirmative action employer. We are committed to equal employment opportunity regardless of race, color, ancestry, religion, sex, national origin, sexual orientation, age, citizenship, marital status, disability, gender identity or Veteran status. We also consider qualified applicants regardless of criminal histories, consistent with legal requirements. See also Google's EEO Policy and EEO is the Law. If you have a disability or special need that requires accommodation, please let us know by completing our Accommodations for Applicants form .Show moreShow less",N/A,On-site/Hybrid,https://www.linkedin.com/jobs-guest/jobs/api/jobPosting/4267663437,2025-07-23
