title,company,location,posted,description,applicants,work_mode,link,data_coleta
Cientista de Dados Sênior (Saúde),Porto,"São Paulo, São Paulo, Brazil",3 days ago,"Job DescriptionA Superintendência de Modelagem Estatística é responsável pelos estudos analíticos e modelos de inteligência artificial que suportam à tomada de decisão na vertical de saúde da Porto Seguro.Responsibilities and assignmentsDesenvolver, treinar e implementar modelos de Machine Learning para diversas aplicações no setor de seguros, como precificação dinâmica, detecção de fraudes, análise de risco, personalização de ofertas, otimização de processos de sinistros, entre outros;Automatizar rotinas computacionais e pipelines de dados para o treinamento, avaliação, implantação e monitoramento contínuo de modelos de Inteligência Artificial;Elaboração de estudos quantitativos para área de seguros;Colaborar com equipes multidisciplinares, incluindo engenheiros de dados, analistas de negócios, especialistas em seguros, para entender as necessidades de negócio e traduzi-las em soluções analíticas;Comunicar de forma clara e eficaz os resultados das análises e dos modelos para públicos técnicos e não técnicos;Garantir a qualidade, robustez e interpretabilidade dos modelos desenvolvidos.Requirements And QualificationsFormação em Estatística, Ciência da Computação, Engenharia, Matemática, Física ou áreas correlatas;Experiência comprovada no desenvolvimento e implementação de modelos de Machine Learning (regressão, classificação, clusterização, séries temporais, etc.);Conhecimentos em linguagens de programação como Python e/ou R;Conhecimento de bancos de dados relacionais SQL Server, Oracle e/ou PostgreSQL.Diferenciais:Conhecimento e/ou experiência na aplicação de Inteligência Artificial Generativa para resolver problemas de negócio ou otimizar processos;Experiência prévia no setor de seguros ou financeiro;Experiência com plataformas de nuvem (AWS, Azure, GCP) e seus serviços de Machine Learning e Big Data;Conhecimento em MLOps (DevOps para Machine Learning);Mestrado ou Doutorado em áreas relacionadas à Inteligência Artificial ou Ciência de Dados.Additional informationNossos Benefícios:Vale Alimentação e Refeição Flexíveis;Plano de Saúde;Plano Odontológico;Wellhub e TotalPass;Academia Bio Ritmo exclusiva para Colaboradores:no Complexo Matriz;Participação nos Lucros - PLR;Programa de Ações: Porto em Ação:complementar à PLR até 2025;Quadras de Areia e Poliesportiva:no Complexo Matriz;Vale-Transporte;Serviços de Transporte de Vans;disponibilizadas nas principais estações de acesso à Porto (Luz, Barra Funda, Santa Cecília e Júlio Prestes);Licença Parental Estendida:até 40 dias para todas as configurações familiares;Licença Maternidade Estendidade 6 meses.;Ambulatório Médico com Especialidades:no Complexo Matriz e Barra Funda;Auxílio creche ou babá;Seguro de Vida;Previdência Privada - PortoPrev;Desconto em Produtos e Serviços;Bolsa de estudos: Reembolso para graduação, pós ou MBA;Corridas mensais:subsídio para as principais corridas de ruas de São PauloReembolso para idiomas (inglês ou espanhol);Teatro Porto:sessões exclusivas para Colaboradores;Biblioteca;Sala de descanso:no completo MatrizSalão de jogos:no complexo MatrizServiços de massagem e podologia:no completo MatrizLocal de trabalho:(Prédio Guaianases)Modelo de Trabalho:Presencial (4x1)Na Porto, Você Importa!A Porto é muito mais que uma seguradora: é um ecossistema gigante que utiliza tecnologia para criar soluções, através de quatro verticais de negócio:Porto Bank, Porto Saúde, Porto Seguro e Porto Serviço.A reputação e o reconhecimento conquistados ao longo de mais de 7 décadas reforçam o tamanho da Porto, uma empresa referência em negócios, feita para e por pessoas.Aqui, bate no peito de 13 mil colaboradores oorgulho de fazer parte de uma organização sólida e ética,que transforma sonhos em realidades fantásticaspara os nossos mais de 15,8 milhões de clientes. São mais de 101 sucursais e escritórios regionais em todo o Brasil.O aprendizado faz parte do nosso DNA, e aqui, você teráincentivos, ferramentas e gente boa para você aprender e crescer, a cada dia,um ambiente de acolhimento e segurança, onde cada um possa ser e se orgulhar de quem se é, promovendo um espaço de respeito evivendo de forma integral e com bem-estar, em uma empresa genuinamente humana.DIVERSIDADE & INCLUSÃO NA PORTOAqui na Porto, valorizamos a diversidade e acreditamos que um time plural é imprescindível para o desenvolvimento de todo o nosso negócio, da sociedade, e de cada pessoa, pois entendemos que cada indivíduo é único na construção de um ambiente mais inovador e inclusivo. Juntos, trabalhamos diariamente para construirmos um espaço seguro, livre e acolhedor, com mais pluralidade e respeito. Por isso,incentivamos fortemente a inscrição de mulheres, de pessoas negras e indígenas, de pessoas com deficiência e de pessoas LGBTQIA+em todas as nossas vagas.Show moreShow less",N/A,On-site/Hybrid,https://www.linkedin.com/jobs-guest/jobs/api/jobPosting/4264226392,2025-07-12
Cientista de Dados Júnior - Exclusiva Para Pessoas Com Deficiência,Serasa Experian,"São Paulo, São Paulo, Brazil",2 weeks ago,"Company DescriptionA Serasa Experian é a primeira e a maior Datatech do Brasil. Líder em soluções de inteligência para análise de riscos e oportunidades, com foco nas jornadas de crédito, autenticação e prevenção à fraude. Com tecnologia de ponta, inovação e os melhores talentos, transforma a incerteza do risco na melhor decisão, ajudando pessoas a realizarem seus sonhos e empresas de todos os portes e segmentos a prosperarem.Temos 22.000 pessoas operando em 32 países e a cada dia estamos investindo em novas tecnologias, profissionais talentosos e inovação para ajudar todos os clientes a maximizarem cada oportunidade. Com sede corporativa em Dublin, Irlanda, a Experian está listada na Bolsa de Valores de Londres (EXPN) e compõe o índice FTSE 100.Job DescriptionRealizar estudos para buscar oportunidades de otimização e melhoria nos produtos com estudos estatísticos;Modelagem preditiva para o crescimento da performance e receita dos produtos;Auxiliar e desenvolver estudos de ganho das estratégias apresentadas em conjunto as áreas de negócio;Acompanhar o enriquecimento contínuo das estratégias desenvolvidas;Analisar através de métodos exploratórios resolução das perguntas feitas pelas áreas de negócios;Desenvolver estudos Ad Hoc e análises estatísticas de acordo com a necessidade do cliente;Interação com o cliente.Desenvolver iniciativas para aumentar as receitas através das iniciativas de crédito, de cobrança ou demais frentes de negócio.QualificationsVisão de negócio para entender a necessidade do produto e traduzir em uma solução estratégica utilizando estatística ou métodos matemáticos;Possuir conhecimento de Excel e ferramentas estatísticas;Possuir conhecimentos de programação em SQL, Python;Conhecimento em modelagem estatística;Conhecimento sobre aplicação de melhorias e eficiência nos modelos;Habilidade em mensurar e analisar os ganhos da estratégia do uso de dados.Additional InformationA Serasa Experian é muito mais do que você imagina. Com o propósito de criar um futuro melhor, ampliando oportunidades para pessoas e empresas, no Brasil somos mais de 4 mil pessoas que atuam em diversos times e especialidades. Aqui, cada conhecimento e diversidade se complementa e você pode trabalhar no que mais ama, estamos comprometidos a construir uma cultura inclusiva e um ambiente no qual pessoas possam equilibrar a carreira com seus compromissos e interesses pessoais, prezando pelo bem-estar.A gente se dedica muito em ser uma das melhores e mais inovadoras empresas para se trabalhar do país, possibilitando experiências e carreiras incríveis para nossas pessoas. Nossa forte abordagem de pessoas em primeiro lugar é reconhecida externamente por meio de diversas certificações de mercado: fomos premiados pelo Great Place To Work™ em 24 países e pela certificação internacional Top Employers, além de sermos reconhecidos como uma das melhores empresas para jovens profissionais e contarmos com uma avaliação de 4,6 no Glassdoor. Cada reconhecimento nos indica que estamos no caminho certo, proporcionando um ambiente de trabalho cada vez melhor para nossos talentos.Experian Careers - Creating a better tomorrow togetherFind out what its like to work for Experian by clicking hereShow moreShow less",N/A,On-site/Hybrid,https://www.linkedin.com/jobs-guest/jobs/api/jobPosting/4240414141,2025-07-12
"Banco de Talentos (Data Scientist Internship, Brazil - BCG X)",BCG X,"São Paulo, São Paulo, Brazil",1 week ago,"Who We AreBoston Consulting Group partners with leaders in business and society to tackle their most important challenges and capture their greatest opportunities. BCG was the pioneer in business strategy when it was founded in 1963. Today, we help clients with total transformation-inspiring complex change, enabling organizations to grow, building competitive advantage, and driving bottom-line impact.To succeed, organizations must blend digital and human capabilities. Our diverse, global teams bring deep industry and functional expertise and a range of perspectives to spark change. BCG delivers solutions through leading-edge management consulting along with technology and design, corporate and digital ventures—and business purpose. We work in a uniquely collaborative model across the firm and throughout all levels of the client organization, generating results that allow our clients to thrive.We Are BCG XWe’re a diverse team of more than 3,000 tech experts united by a drive to make a difference. Working across industries and disciplines, we combine our experience and expertise to tackle the biggest challenges faced by society today. We go beyond what was once thought possible, creating new and innovative solutions to the world’s most complex problems. Leveraging BCG’s global network and partnerships with leading organizations, BCG X provides a stable ecosystem for talent to build game-changing businesses, products, and services from the ground up, all while growing their career. Together, we strive to create solutions that will positively impact the lives of millions.What You'll DoWe are seeking strong candidates with advanced analytics experience to start an exciting consultant career within BCG X. We are looking for profiles with a background in any area related to predictive analytics, machine learning, optimization/operations as well as risk. BCG X offers a unique opportunity to join a vibrant team of data scientists applying the most advanced analytics techniques in a rewarding environment.What You'll BringEducation & ExperienceBachelor’s degree with excellent academic achievements in a field linked to computer science, applied mathematics, statistics, machine learning, or related data centric areas - Expected graduation between December 2025 and December 2026.Relevant internships or industry/consulting previous experienceExperience in core analytics methods (e.g. Machine Learning, Optimization, Deep Learning, etc.)Fluency in at least one scripting language (e.g. Python, R)Deep technical and data science expertise, strong passion for data science topicsExcellent analytical skills and strategic thinking, creative problem solverStrong interpersonal credibility, reliability, and service mentality, high ethical standardsExcellent written and verbal communication skills in Portuguese and EnglishTechnical competenciesExperience in core analytics methods (e.g. Machine Learning/Deep Learning, Optimization/Operational Research, Geoanalytics, Predictive Modeling, Autonomous Agents, Network Analysis, etc…)Familiarity with a broad base of analytics tools (Data management; Analytics platforms / Programming – e.g. Python, R ; Data Visualization, etc…)Experience in applied analytics for business problem solving/experience building analytical solutionsAdditional info#BCGXjobBoston Consulting Group is an Equal Opportunity Employer. All qualified applicants will receive consideration for employment without regard to race, color, age, religion, sex, sexual orientation, gender identity / expression, national origin, disability, protected veteran status, or any other characteristic protected under national, provincial, or local law, where applicable, and those with criminal histories will be considered in a manner consistent with applicable state and local laws.BCG is an E - Verify Employer. Click here  for more information on E-Verify.Show moreShow less",N/A,On-site/Hybrid,https://www.linkedin.com/jobs-guest/jobs/api/jobPosting/4229256047,2025-07-12
Cientista de Dados Especialista - Prevenção à Fraude,PicPay,"São Paulo, São Paulo, Brazil",1 week ago,"Sobre o PicPayCom mais de dez anos de história, o PicPay é um ecossistema completo de serviços financeiros e não-financeiros que tem como objetivo atender as necessidades diárias de milhares de pessoas e negócios, tornando-se a sua principal conta do dia a dia.Combinar tecnologias avançadas, modelos de Machine Learning e análises estatísticas para construir e aprimorar continuamente a estratégia de prevenção de fraudes transacionais no PicPayResponsabilidade e atribuições:Responsável por desenvolver e otimizar estratégias de prevenção de fraudes transacionais do PicPay, utilizando análise de dados, Machine Learning e tecnologias inovadoras. O profissional deverá analisar as causas centrais de problemas complexos, propor soluções eficazes e contribuir para o desenvolvimento técnico da equipe.Requisitos e qualificações:Experiência comprovada em prevenção de fraudes transacionais ou áreas de riscos.Domínio em análise de dados (SQL, Python ou similar) e análise estatística.Experiência prática com modelos de Machine Learning.Forte capacidade de análise crítica de dados e indicadores, identificando insights e oportunidades.Excelentes habilidades de comunicação e apresentação de dados (Storytelling).Proatividade, autonomia e atenção aos detalhes.Qualificações Desejáveis (Diferenciais):Experiência prévia em Fintech ou Meios de Pagamento;Experiência com plataformas de prevenção de fraudes;criação/gestão de regras de prevenção a fraude.O que oferecemos:Saúde e Bem-estarAssistência Médica e Odontológica;Seguro de Vida;Programa Lado a Lado, com apoio jurídico, social, psicológico e financeiro;TotalPass.Alimentação/ Mobilidade ou Teletrabalho:Cartão de crédito PicPay Benefícios, com ampla aceitação, onde você recebe seu saldo de Alimentação/Refeição e Mobilidade ou Teletrabalho (de acordo com o seu contrato de trabalho).Licença Paternidade e Maternidade:Licença Maternidade estendida de 6 meses, e de Paternidade também estendida de 20 dias.Programa ""Novo Ser"", que acompanha nossas mamães durante toda a gestação e no retorno da licença. Falando nisso, ao retornar da licença maternidade, as mamães ainda contam com a ajuda do Auxílio Creche e também os papais que possuem guarda unilateral ou compartilhada.Reconhecemos resultados: PPR-Participação nos Resultados do PicPay.#VemserPicpayLover #PicpayShow moreShow less",N/A,On-site/Hybrid,https://www.linkedin.com/jobs-guest/jobs/api/jobPosting/4216721477,2025-07-12
Data Scientist,Insider Store,"São Paulo, São Paulo, Brazil",3 months ago,"Sobre a Insider Store#WE ARE INSIDERVocê terá a chance de trabalhar lado a lado com profissionais obcecados pelo cliente, participando ativamente de projetos e iniciativas que impactam diretamente o negócio e transformam a realidade do mercado.#ALWAYS EVOLVINGOportunidade para quem deseja desenvolver sua carreira em um ambiente inovador, onde constantemente subimos a barra.#MADE FOR THE FUTUREA Insider oferece um espaço para aprendizado e desenvolvimento, proporcionando experiências significativas que irão enriquecer seu conhecimento e habilidades na área. Nós somos o futuro e nos preparamos para ele.#INTENTIONALITYSe você é uma pessoa proativa, curiosa e está sempre em busca de novos desafios, essa posição é perfeita para você.Sobre a VagaDescrição:Estamos em busca de um(a) profissional orientado(a) Data Scientist. O objetivo é transformar dados em insights acionáveis, guiar decisões operacionais e suportar a previsão de demanda e capacidade. Este(a) profissional será fundamental para integrar informações de diferentes áreas, criar modelos preditivos e propor soluções baseadas em dados confiáveis. Esperamos que tenha autonomia para identificar oportunidades e otimizar processos que impactem diretamente os resultados do negócio.Responsabilidades:Ser referencia técnica para a squad. Aplicando técnicas avançadas de análise de dados, como modelagem preditiva e ML, para prever demanda, alinhar capacidades produtivas e estimar risco de operações de produção.Identificar padrões operacionais e recomendar soluções antecipadas para garantir a disponibilidade de produtos e insumos.Trabalhar diretamente com equipes de dados, PCP, compras e produção, promovendo integrações eficientes entre sistemas e plataformas.Monitorar KPIs operacionais, como forecast accuracy, OTIF (On Time In Full) e conformidade de prazos, garantindo maior previsibilidade e conformidade.Propor soluções escaláveis para otimização de processos e melhoria contínua, com foco na integração entre demandas comerciais e capacidades operacionais.Requisitos:Experiência sólida em análise de dados aplicados a processos operacionais e de supply chain.Proficiente em ferramentas como SQL, Python e Looker Studio para criação de relatórios e dashboards.Capacidade de interpretar KPIs e transformar dados em insights práticos para o negócio.Experiência com processos de Strategy Planning, previsão de demanda e planejamento de capacidade.Excelente comunicação para traduzir informações complexas em recomendações claras.Diferencial:Experiência com ferramentas de BI e integração de dados.Conhecimento em planejamento de produção, rastreabilidade e compliance operacional.Familiaridade com metodologias ágeis para projetos de dados e operações.Mais detalhes:Modelo de contrato: PJ;Modelo de trabalho: Hibrido;Descanso sem ser descontado; 22 dias úteis anuais, disponível após os três primeiros meses;Cartão Flexível;Plano de Saúde;Plano Odonto;Totalpass;Udemy;Insider Perks;Oportunidade de crescimento e aprendizado em uma startup em rápida expansãoAmbiente de trabalho colaborativo e inovador, com exposição a novas tecnologias e processosNossa HistóriaAInsidernasceu para desafiar o status-quo da indústria da moda. Aprendemos, inovamos e melhoramos constantemente,para criar um mundo onde todos são encorajados a subir a barra e buscar excelência desde 2017.Hoje,temos mais de 1 milhão de clientes e um portfólio de produtos que tecem tecnologia, inovação e sustentabilidade.Esse é só o início de uma jornada que busca mudanças estruturais em uma das mais tradicionais e poluentes indústrias do mundo: a indústria da moda.Principais destaquesParticipação no programa Startup School da aceleradora Y Combinator.Acelerada 2 vezes nos programas Endeavor Scale Up varejo e consumer goods.Acelerada pelo programa Endeavor Outliers pelo crescimento fora da curva dentro do peer group, ganhando o título de Empreendedores Endeavor.Eleita pela revista Forbes como uma das 25 startups mais promissoras do Brasil.Show moreShow less",N/A,On-site/Hybrid,https://www.linkedin.com/jobs-guest/jobs/api/jobPosting/4221468755,2025-07-12
CIENTISTA DE DADOS PL/SR,Nexmuv Tecnologia,Greater São Paulo Area,22 hours ago,"Local de trabalho: São Paulo -SP (100% presencial nos primeiros 90 dias, e após, hibrida 3x na semana)Contratação: CLTBenefícios: VA R$ 750,00/mês, VR R$ 52,50/dia, PS Bradesco Seguros estendido aos beneficiários, PO, VT, política de bolsas de estudo de 100% para colaboradores (em graduação a pós doutorado), Fundo de Previdência Privada, parceria de saúde e bem-estar (Gympass), PLR.Perfil técnico:Experiencia como Cientista de Dados;Perfil hands-on nas etapas de codificação utilizando Python e R;Conhecimento sobre LGPD sobre proteção e segurança de dados;Experiência em gestão de código com Git Azure DevOPs e estratégias de branch/merge;Experiência em bancos de dados SQL Server e MySql;Experiência em ambientes cloud Azure.Experiencia com PowerBi;Conhecimento em estatística e matemática;Capacidade de interação com as áreas de negócio para conseguir traduzir às necessidades em modelos estáticos e insights;Bibliotecas Python como Sklearn, Pandas, Stats, Numpy, MatPlotLib, Polars e TensorFlow.Formação:Graduação Completa em áreas corretas à tecnologia da informação.Desejável Pós-Graduação em ciência de dados, analytics ou business inteligence.Idioma: Inglês intermediário ou inglês técnico avançado.Show moreShow less",N/A,On-site/Hybrid,https://www.linkedin.com/jobs-guest/jobs/api/jobPosting/4263080628,2025-07-12
