title,company,location,posted,description,applicants,work_mode,link,data_coleta
Data Scientist,Brex,"São Paulo, São Paulo, Brazil",2 weeks ago,"Why join usBrex is the AI-powered spend platform. We help companies spend with confidence with integrated corporate cards, banking, and global payments, plus intuitive software for travel and expenses. Tens of thousands of companies from startups to enterprises — including DoorDash, Flexport, and Compass — use Brex to proactively control spend, reduce costs, and increase efficiency on a global scale.Working at Brex allows you to push your limits, challenge the status quo, and collaborate with some of the brightest minds in the industry. We’re committed to building a diverse team and inclusive culture and believe your potential should only be limited by how big you can dream. We make this a reality by empowering you with the tools, resources, and support you need to grow your career.Data at BrexThe Data team turns information into advantage. We design infrastructure, develop models, and deliver insights that power smarter decisions across Brex. Our scientists and engineers are embedded across product, engineering, risk, operations, and business teams — building data products, improving customer experiences, and shaping high-impact strategies. We treat data as a product, and ownership runs deep. If you're excited by complexity and want your work to drive decisions at scale, this is your team.What You’ll DoAs a Data Scientist focused on Product Analytics, you will work closely with Product, Engineering, and Customer Success teams to understand the interactions between product engagement, customer retention, and overall customer growth. Your work will be instrumental in shaping product decisions by uncovering insights into how customers interact with Brex’s platform, identifying opportunities to refine the product experience, optimize user workflows, and introduce impactful changes that increase long-term customer value and drive sustainable revenue growth.The ideal candidate has experience leveraging product intuition and advanced analytics to understand customer behavior, measure product impact on revenue retention and growth, and derive insights through causal inference and predictive modeling. They should also have a strong ability to translate data insights into actionable recommendations for product and business teams.Where you’ll workThis role will be based in our Sao Paulo office. You must be willing to work in office at least 2 days per week on Wednesday and Thursday, starting the week of September 1st, 2025. when we open our Sao Paulo office. Employees will be able to work remotely for up to 4 weeks per year.ResponsibilitiesDevelop and apply data-driven methodologies to analyze customer behavior, retention trends, and product adoption, focusing on how product changes impact long-term customer value.Design and implement predictive models, causal inference methods, as well as experimentation strategies to measure and optimize the effect of product changes on customer growth and engagement.Partner with Product, Engineering, and Customer Success teams to identify key opportunities for improving customer engagement and long-term retention.Collaborate with Data Engineering to build scalable data pipelines that support product analytics and reporting.Clearly communicate findings and strategic recommendations to both technical and non-technical stakeholders.RequirementsMaster’s degree or Ph.D. in Statistics, Computer Science, Economics, or a related quantitative field.3+ years of experience in a data science, analytics, or related role focused on product analytics.Strong experience with SQL and Python (or R) for data analysis and modeling.Proficiency in A/B testing methodologies, causal inference, and predictive modeling.Ability to translate complex data insights into strategic business recommendations.Familiarity with BI tools (e.g., Tableau, Looker) and data visualization best practices.Strong problem-solving skills and the ability to work in a fast-paced, cross-functional environment.English proficiency/fluency, both written and spoken (note: interviews will be conducted in English).Bonus PointsExperience working in B2B SaaS or fintech.Experience in developing frameworks to measure feature adoption and identifying product opportunities that drive customer lifetime value.Familiarity with product analytics tools (e.g., Amplitude, StatSig).LocationMust be working in Brazil at the start of rolePlease be aware, job-seekers may be at risk of targeting by malicious actors looking for personal data. Brex recruiters will only reach out via LinkedIn or email with a brex.com domain. Any outreach claiming to be from Brex via other sources should be ignored.Show moreShow less",N/A,Remote,https://www.linkedin.com/jobs-guest/jobs/api/jobPosting/4193629668,2025-08-22
Senior Data Scientist (Stats/Experimentation),Uber,"São Paulo, São Paulo, Brazil",3 days ago,"About the TeamWe are looking for a Data Scientist to join the Sao Paulo team, specifically in Core Services Analytics.You will work with product managers, engineers, and fellow data scientists to shape the direction of one or more products within Core Services. You will work on fast-moving, high-stakes problems reaching a global audience. A deep analytical passion and the ability to execute key business priorities is a must for this role.Notes about the profile: If you are interested in advanced modeling and production modeling,this role is not it! We have a separate Applied Science team that works on these types of projects.About the RoleDevelop and monitor strategic metrics and understand all underlying factors;Design and run experiments to analyze the impact of product and/or model changes;Deep dive into data to evaluate proposed product changes and identify opportunities for improving the user experience;Collaborate with product managers and other business leaders to make decisions based on data insights and experiment results;Communicate your findings to cross-functional peers and management.Technical SkillsRequired:Advanced English skills;Senior and/or Staff seniority in a Business/Data/Science role;Previous experience improving products, understanding the user journey, and extracting insights from data;Advanced SQL expertise;Solid experience using Python or R;Experience launching multiple experiments (such as A/B experiments) and an understanding of experimental design and using statistical methods in exploratory analysis;Casual Inference experience is a huge plus;Bachelors or M.S. in Statistics, Economics, Computer Science, or other quantitative fields.Please note: thishybrid positionis based in São Paulo, Brazil - welcoming both local professionals and those open to relocating to São Paulo.Show moreShow less",N/A,On-site/Hybrid,https://www.linkedin.com/jobs-guest/jobs/api/jobPosting/4287500210,2025-08-22
Pessoa Coordenadora Cientista de Dados | Crédito,C6 Bank,"São Paulo, São Paulo, Brazil",5 days ago,"Nossa área de Ciência de DadosNosso ambiente de trabalho é extremamente leve e colaborativo, que estimula a autonomia e liberdade, sempre muito próximos dos times de negócios e com a entrega final em mente. Nossa Cultura é forte e foi construída para estimular a inovação e garantir relações verdadeiras com clientes e colaboradores.Suas atividades como CSixerTrabalhar com parceiros de negócios, engenheiros de dados e times de tecnologia para desenvolvimento e deploy de soluções de machine learning como parte dos produtos;Analisar dados para validar hipóteses e gerar insights de negócio;Manipular dados para tratamento, limpeza e exploração;Implementar, testar, fazer deploy, documentar e depurar processos de dados e de machine learning;Contribuir com os repositórios de código e documentação da equipe e qualificar a discussão técnica com referências científicas e metodológicas.Requisitos e experiênciaExperiência com técnicas de modelagem descritiva e preditiva;Experiência na construção de ETL usando SQL;Experiência com Python e/ou R para construção de modelos.Nossos BenefíciosVale-Refeição;Vale-Alimentação;Plano de saúde e odontológico;Auxílio-Creche;Seguro de Vida;WellHub;Conexa | Psicologia Viva - Terapia online sem custo;Cartão de Crédito C6 Bank Carbon;Carbon Spa - Salão de beleza localizado em nosso escritório;Sala de amamentação;Empresa Cidadã - Prorrogação do prazo da licença-maternidade e licença-paternidade;Bicicletário;Vestiário;Espaço de convivência - Videogame, mesa de sinuca, playball, churrasqueira, chopeira, lanchonete, diversos locais de descanso, redes, cesta de basquete e horta colaborativa e orgânica.C6 BANKO BANCO DA SUA VIDAAtendemos pessoas físicas, MEIs e PMEs em todos os estados do Brasil. Sem agências físicas, oferecemos mais de 90 produtos e serviços financeiros feitos para todos os perfis de clientes.Estamos localizados em São Paulo-SP e contamos com mais de 3.000 CSixers que estão sempre a mil por hora. Em pouco mais de cinco anos, conquistamos muitos prêmios e reconhecimentos.No C6 Bank, acreditamos que a diversidade impulsiona a inovação e fortalece nosso ambiente de trabalho. Por isso, promovemos uma cultura inclusiva, que valoriza a equidade e garante oportunidades para todas as pessoas, independentemente de raça, cor, idade, credo, deficiência, nacionalidade, estado civil, orientação sexual, identidade ou expressão de gênero. Aqui, todo mundo é bem-vindo para ser quem é.Confira mais informações no vídeo abaixo:Show moreShow less",N/A,On-site/Hybrid,https://www.linkedin.com/jobs-guest/jobs/api/jobPosting/3923094040,2025-08-22
Analista/Cientista de Dados - Sênior,Objective,"São Paulo, São Paulo, Brazil",1 week ago,"Somos ávidos por tecnologia, criatividade e desafios.Se você gosta de desafios, aprendizado constante e valoriza as conexões pessoais, junte-se a nós!# Valorizamos a diversidade e acreditamos que ela é fundamental para a inovação e entregas de valor aos nossos clientes. Todas as nossas vagas são destinadas a todas as pessoas, com ou sem deficiência, independentemente de idade, gênero, orientação sexual, etnia, religião ou qualquer outra característica. Se você se identifica com a posição, venha fazer parte do nosso time!O QUE BUSCAMOS?Buscamos um(a)Analista/Cientista de Dados, em nível de carreiraSênior, para atuar na análise, modelagem e monitoramento de riscos de crédito, com foco em desenvolver, validar e aprimorar modelos preditivos (score de crédito, inadimplência, propensão, segmentação, etc.), além de gerar insights estratégicos para apoiar a tomada de decisão.Observação:Disponibilidade para atuação híbrida no bairro Itaim Bibi em São Paulo.O QUE ESSE PROFISSIONAL IRÁ FAZER?Desenvolver, validar e manter modelos estatísticos e preditivos de risco de crédito.Analisar padrões de inadimplência e comportamento de clientes, utilizando métodos quantitativos e estatísticos.Garantir a qualidade, explicabilidade e confiabilidade dos modelos aplicados.Manipular e analisar grandes volumes de dados utilizando Python, SQL e ferramentas de visualização.Apoiar áreas de negócios na definição de estratégias de crédito, cobrança e recuperação.Documentar metodologias, processos e resultados de forma clara e estruturada.O QUE É NECESSÁRIO PARA A POSIÇÃO?Experiência com modelagem estatística (regressão logística, análise discriminante, árvores de decisão, validação cruzada, balanceamento de dados, etc.).Programação em Python (obrigatório) e conhecimento em R (desejável).Manipulação e análise de dados em SQL (Oracle).Experiência com ferramentas de visualização de dados (Power BI ou MicroStrategy).Noções de governança, qualidade e anonimização de dados (LGPD).Conhecimentos sobre o ciclo de vida do crédito e interpretação de indicadores de risco.O QUE SERIA UM DIFERENCIAL?Experiência em varejo, financeiras ou operações de cartões/crediário.Conhecimento em bases de dados de bureau de crédito (QUOD, Boa Vista, etc.).Vivência com metodologias ágeis (Scrum/Kanban).ETAPAS DO PROCESSO:InscriçãoFit culturalEntrevista técnicaEntrevista com o clienteContrataçãoShow moreShow less",N/A,On-site/Hybrid,https://www.linkedin.com/jobs-guest/jobs/api/jobPosting/4285750633,2025-08-22
Data Scientist/AI Engineer,Siemens,Greater São Paulo Area,4 days ago,"Data Scientist / AI Engineer / AI DevelopJob Description:We are looking for a highly skilled and motivated Data Scientist / AI Engineer to join our team. The ideal candidate will have deep expertise inMachine LearningandGenerative AI, with a strong foundation insoftware engineeringandcloud-native AI deployment. You will be responsible for designing, building, and scaling AI solutions that deliver real business value.Key Responsibilities:Consult non technical people on what is posible with AI, to find new a menaingfull ways to create value with AI solutions (e.g. Agents) within a business function or domain (e.g. Sales, Customer Service).Collaborate with cross-functional teams to translate business needs into scalable AI solutions.Guide non-technical stakeholders on the capabilities and limitations of AI to identify high-impact opportunities.Architect and implement robust AI solutions on Azure and other hyperscalers to solve complex business problems.Build and maintain production-grade ML pipelines and APIs in the cloud.Conduct experiments to explore and validate new applications of Generative AI that can bring business benefitsEnsure reliability, performance, and security of deployed AI solutions.Monitor and optimize models and costs in production environments.Qualifications:Master’s degree in Computer Science, AI, or a related field.+4 years of expirence in Machine Learning, Generative AI, and cloud-based AI deployment.Strong programming skills in Python and experience with CI/CDHands-on experience with Azure, AWS or GCPFamiliarity with MLOps practices and tools.Excellent problem-solving skills and a strong engineering mindset.Effective communication and collaboration skills.Hans on experience with Agent frameworksSiemens is an Equal Opportunity and Affirmative Action Employer encouraging diversity in the workplace. All qualified applicants will receive consideration for employment without regard to their race, color, creed, religion, national origin, citizenship status, ancestry, sex, age, physical or mental disability, marital status, family responsibilities, pregnancy, genetic information, sexual orientation, gender expression, gender identity, transgender, sex stereotyping, protected veteran or military status, and other categories protected by federal, state or local law.Show moreShow less",N/A,On-site/Hybrid,https://www.linkedin.com/jobs-guest/jobs/api/jobPosting/4272740974,2025-08-22
Cientista de Dados Senior I Banco Carrefour,Grupo Carrefour Brasil,"São Paulo, São Paulo, Brazil",3 weeks ago,"DESCRIÇÃOO Banco Carrefour é a maior Fintail do Brasil e braço financeiro do Grupo Carrefour Brasil, único varejista com banco próprio. Com a missão de melhorar a vida das famílias brasileiras, dando acesso ao crédito e serviços financeiros inovadores, o Banco Carrefour é um dos maiores emissores de cartão de crédito do país, atendendo a milhões de brasileiros.Se você compartilha dos mesmos valores e quer embarcar com a gente na missão de melhorar a vida das famílias brasileiras, venha fazer parte do nosso time!#bancocarrefourDO DISCURSO À PRÁTICADesafios e Responsabilidades Dessa PosiçãoAtuar na execução técnica em projetos de modelagem estatística, machine learning, MLOps e monitoramento, participando de iniciativas que transformam dados em insights acionáveis. Colaborar com áreas de negócio e squads multidisciplinares para desenvolver soluções que impactem diretamente os resultados da empresa.Desenvolver e implementar modelos preditivos e prescritivos, desde a engenharia de variáveis até a implantação e monitoramento em produção.Monitorar continuamente o desempenho de modelos e variáveis, garantindo estabilidade e eficácia em ambiente produtivo.Conduzir análises estatísticas avançadas para resolver problemas complexos de negócio.Documentar processos e modelos, assegurando reprodutibilidade e conformidade com as melhores práticas.Colaborar com engenheiros de MLOps para garantir a robustez e escalabilidade dos modelos em produção.Manter-se atualizado sobre as últimas tendências e tecnologias em ciência de dados, propondo inovações aplicáveis ao negócio.Você Precisa TerFormação superior em Estatística, Matemática, Ciência da Computação, Engenharia ou áreas correlatas.Experiência comprovada em desenvolvimento e implantação de modelos de machine learning em ambiente produtivo.Proficiência em linguagens de programação como Python e SQL.Conhecimento em bibliotecas e frameworks de machine learning (por exemplo, scikit-learn, TensorFlow, PyTorch).Experiência com ferramentas de visualização de dados (por exemplo, Tableau, Power BI, Looker).Familiaridade com práticas de MLOps e monitoramento de modelos em produção.Habilidade para comunicar insights de forma clara e eficaz para stakeholders técnicos e não técnicos.Adoraríamos Se Você TiverExperiência com modelos de crédito ou cobrança.Vivência em plataformas Google (GCP, Vertex AI, Looker).Conhecimento em IA generativa e aplicação prática em problemas de negócio.Conhecimento em processamento de linguagem natural (NLP) e séries temporais.Local de trabalho: São Paulo, SPRegime de contratação de tipo: Efetivo – CLTJornada: Período IntegralNível hierárquico: AnalistaREQUISITOSEscolaridade Mínima: Ensino SuperiorBENEFÍCIOSVale AlimentaçãoAssistência Médica e OdontológicaPrevidência privadaPLR (Bônus Anual)Vale transporte/fretadoAuxílio farmáciaSeguro de VidaPAC- Programa de Apoio ao ColaboradorBenefício ÓticaDesconto em compras usando Cartão CarrefourAuxílio CrecheLicença Maternidade / Paternidade EstendidaTotalPassAnuidade Gratuita no Cartão de Sócio Sam’s ClubVale RefeiçãoShow moreShow less",N/A,On-site/Hybrid,https://www.linkedin.com/jobs-guest/jobs/api/jobPosting/4278690685,2025-08-22
Data Scientist (Geospatial),"CloudWalk, Inc.","São Paulo, São Paulo, Brazil",2 weeks ago,"At CloudWalk, we're building the best payment network on Earth (then other planets 🚀). We're an AI-first fintech unicorn bringing justice to Brazil's broken payment system. We work in the finance sector, a very traditional niche, but we try to do things differently. Where others see coordinates, we see the spatial DNA of financial behavior.We're looking for a data scientist who thinks in geographic dimensions to uncover patterns that protect merchants, detect fraud, and unlock insights hiding in the intersection of place and payments.The Geospatial TeamWe work with geospatial data from internal and external sources to create ML features and drive business insightsWe research and experiment with new algorithms that are more computationally efficient or can leverage spatial data betterWe do extensive data visualization with maps to uncover spatial insights and patternsWe value exploration before exploitation—curiosity comes first in spatial analysisWe believe location is more than coordinates—it's behavioral context that drives better decisionsWhat The Job EntailsSpatial Intelligence: Apply data science techniques to spatial datasets and location-based problems to uncover financial behavior patternsGeospatial Model Development: Design and run experiments on different forms of aggregating spatial data and phenomena, then train and validate geospatial models for business applicationsFeature Engineering & Data Enrichment: Create valuable features for ML models by extracting spatial intelligence from geospatial data sources, perform ETL processes, and deliver enriched data to our internal feature marketData Pipeline Management: Build and maintain geospatial data pipelines and analytical workflows using modern data science toolsSpatial Data Discovery & Integration: Continuously explore and evaluate diverse spatial data sources, research new datasets, and develop creative approaches to ""spatialize"" existing databases by adding geographic dimensionsSpatial Analysis: Analyze spatial data patterns and develop spatial models and algorithms to solve business problemsMap-Based Data Visualization: Create compelling data visualizations with maps to discover insights and communicate spatial findings to stakeholdersWhat You'll NeedInitiative to learn, investigate, experiment with spatial data and geographic problemsStrong statistical and machine learning background, with experience applying these methods to spatial dataStrong experience with map-based data visualization using tools like Plotly, Kepler.gl , or similar mapping librariesExperience working with spatial data formats (shapefiles, GeoJSON, etc.), coordinate systems, and geospatial dataframes using geopandas (Python) OR spatial R packages (sf, sp, etc.)Python proficiency (CloudWalk standard) or strong R skills with willingness to adapt to Python workflowsStrong SQL experience for spatial data queries and analysisAbility to communicate and debate in English and PortugueseNice to HaveBackground in Geographic Information Systems (GIS) tools and conceptsExperience with spatial statistics/econometrics and geospatial machine learning methods (e.g. clustering methods like DBSCAN, K-means, hierarchical clustering, or regression methods like GWR, MGWR, SAR)Experience with external data sources (IBGE research, OpenStreetMap, government open datasets)Experience with Google Cloud PlatformExperience with MLOps and deploying geospatial models to production environmentsRecruiting process outline:Online assessment: An online test to evaluate your theoretical skills and logical reasoningTechnical interview and case presentationCultural interviewIf you are not willing to take an online quiz and work on a test case, do not apply.Diversity and inclusion:We believe in social inclusion, respect, and appreciation of all people. We promote a welcoming work environment, where each CloudWalker can be authentic, regardless of gender, ethnicity, race, religion, sexuality, mobility, disability, or education.Show moreShow less",N/A,On-site/Hybrid,https://www.linkedin.com/jobs-guest/jobs/api/jobPosting/4278277412,2025-08-22
