title,company,location,posted,description,applicants,work_mode,link,data_coleta
CIENTISTA DE DADOS,Grupo Data Portugal,"São Paulo, São Paulo, Brazil",1 week ago,"Estamos em busca de um cientista de dados com habilidades para atuar na área de produtos, focando em inteligência de mercado, modelagem de dados não estruturados, análise de dados e desenvolvimento de estratégias que impulsionem o desempenho dos nossos produtos digitais.O profissional será responsável por acompanhar, interpretar e transformar métricas e KPIs em estratégias que gerem crescimento de conversão e engajamento nos produtos desenvolvidos.Buscamos alguém que seja apaixonado por dados, tenha um olhar estratégico e consiga alinhar as análises à performance dos produtos digitais.O QUE VOCÊ PRECISA PARA SE CANDIDATAR:Análise de Dados: Experiencia comprovada em análise de dados, modelagem de dados não estruturados, incluindo análise descritiva, estatística e preditiva, especialmente aplicada à área de MKT.Conhecimento de Ferramentas de Análise: Excel avançado e habilidade com criação de dashboards em ferramentas de análise de dados, como Google Analytics, Power BI, Tableau, ferramentas de CRM, plataformas de análise de mídia, etc.Habilidade de Comunicação: Capacidade de interpretar métricas e traduzir dados em estratégias práticas, comunicar os resultados das análises de forma clara e concisa, com apresentações impactante e persuasivas para comunicar insights e recomendações.Pensamento Crítico: Habilidade em transformar dados complexos em insights práticos que impulsionem a tomada de decisões estratégicas, geração de novos leads e a criação de campanhas de alto impacto.Formação Acadêmica em Tecnologia, Marketing, ou áreas que tenham afinidade com análise dados;Inglês nível B2.Necessidade da disponibilidade de ida ao escritório 01x por semana - SP.VOCÊ IRÁ SE DESTACAR COM:Conhecimento de Produtos Digitais: Compreensão dos princípios de produtos digitais, incluindo funis de conversão, estratégias de go to market, etc.Experiência com automação de relatórios e ferramentas de automação de marketing.Conhecimento em performance de campanhas digitais.Noções de programação em Python ou SQL para extração e análise de dados;Conhecimento da indústria de Telecom e/ou conteúdos digitais.Compreender a usabilidade e experiência do usuário para produtos web/mobile de consumo;Perfil analítico, orientado a resultados com excelente capacidade de identificar problemas, analisar causas e propor soluções.RESPONSABILIDADES PRINCIPAIS:O candidato ideal será responsável por fornecer recomendações estratégicas com base em sua análise de dados e pesquisa de mercado. Você também acompanhará e analisará o desempenho de nossas iniciativas de marketing. Suas análises e recomendações ajudarão a tornar nossas estratégias de marketing mais impactantes e eficazes.Análise de Dados: Coletar, analisar e interpretar dados de diversas fontes, como funil de acesso aos portais digitais, vendas, financeiro , comportamento do cliente, etc.Identificação de Tendências e Oportunidades: Detectar padrões, insights e oportunidades de melhoria nas campanhas e estratégias de marketing.Otimização de Performance: Utilizar os dados para mensurar e propor otimizações de performance nos produtos através de novas estratégias de campanha, testes A/B, revisão de segmentações, réguas de engajamento, etc, buscando melhor desempenho geral.Elaboração de Relatórios e Apresentações: Criar relatórios detalhados e apresentações com as análises e recomendações para as equipes de marketing e outros stakeholders.Pesquisa de Mercado: Realizar pesquisas de mercado e análise de concorrentes para identificar oportunidades e ameaças.Suporte à Tomada de Decisão: Fornecer dados e insights para apoiar a tomada de decisões estratégicas do marketing.Show moreShow less",N/A,On-site/Hybrid,https://www.linkedin.com/jobs-guest/jobs/api/jobPosting/4301903535,2025-09-29
Data Scientist/AI Engineer,Siemens,Greater São Paulo Area,3 weeks ago,"Data Scientist / AI Engineer / AI DevelopJob Description:We are looking for a highly skilled and motivated Data Scientist / AI Engineer to join our team. The ideal candidate will have deep expertise inMachine LearningandGenerative AI, with a strong foundation insoftware engineeringandcloud-native AI deployment. You will be responsible for designing, building, and scaling AI solutions that deliver real business value.Key Responsibilities:Consult non technical people on what is posible with AI, to find new a menaingfull ways to create value with AI solutions (e.g. Agents) within a business function or domain (e.g. Sales, Customer Service).Collaborate with cross-functional teams to translate business needs into scalable AI solutions.Guide non-technical stakeholders on the capabilities and limitations of AI to identify high-impact opportunities.Architect and implement robust AI solutions on Azure and other hyperscalers to solve complex business problems.Build and maintain production-grade ML pipelines and APIs in the cloud.Conduct experiments to explore and validate new applications of Generative AI that can bring business benefitsEnsure reliability, performance, and security of deployed AI solutions.Monitor and optimize models and costs in production environments.Qualifications:Master’s degree in Computer Science, AI, or a related field.+4 years of expirence in Machine Learning, Generative AI, and cloud-based AI deployment.Strong programming skills in Python and experience with CI/CDHands-on experience with Azure, AWS or GCPFamiliarity with MLOps practices and tools.Excellent problem-solving skills and a strong engineering mindset.Effective communication and collaboration skills.Hans on experience with Agent frameworksSiemens is an Equal Opportunity and Affirmative Action Employer encouraging diversity in the workplace. All qualified applicants will receive consideration for employment without regard to their race, color, creed, religion, national origin, citizenship status, ancestry, sex, age, physical or mental disability, marital status, family responsibilities, pregnancy, genetic information, sexual orientation, gender expression, gender identity, transgender, sex stereotyping, protected veteran or military status, and other categories protected by federal, state or local law.Show moreShow less",N/A,On-site/Hybrid,https://www.linkedin.com/jobs-guest/jobs/api/jobPosting/4272740974,2025-09-29
Engenheiro de Machine Learning,Einstein Hospital Israelita,"São Paulo, São Paulo, Brazil",1 week ago,"Com mais de 60 anos de existência, a Sociedade Beneficente Israelita Brasileira Albert Einstein ainda mantém uma premissa: inovar e crescer, sempre com excelência. Ajudamos a salvar vidas, difundir o conhecimento em educação, prevenção e inovação em saúde. Além da atuação em setores assistenciais, temos oportunidades na área de Inovação, Tecnologia, Pesquisa, Ensino, entre outras. Seguimos oferecendo qualidade, afirmando nosso compromisso com a Responsabilidade Social e com o propósito de levar uma gota de Einstein para cada cidadão. Valorizamos a diversidade e inclusão de todos os talentos e buscamos profissionais que compartilhem deste mesmo propósito!DADOS DA VAGA:Unidade: UNID CENTRO DE ENS E PESQUISA (Morumbi)Horário: 09h às 18hModelo de Trabalho: HíbridoRESPONSABILIDADES:Manutenção, Debugging, e monitoramento de sistemas analíticos avançadosDesenvolvimento, execução e manutenção de esteiras de integração e entrega contínuaSustentação de sistemas analíticos avançadosImplantação de soluções analíticas avançadas por meio de rotinas agendadas, APIs, e/ou sistemas em realtimeDefinição de arquiteturas de soluções e plataformas que incorporem algoritmos de inteligência artificialColaboração com cientistas de dados e engenheiros de dados para a prototipação e desenvolvimento de sistemas analíticos avançadosAprimoramento da performance, tempo de execução, escalabilidade e confiabilidade de soluções analíticas avançadasCriação e/ou mapeamento de processos que garantam estabilidade, escalabilidade e segurança de projetos implantadosMapeamento e validação de soluções de mercado para MLOpsREQUISITOS:Experiência com ecossistemas de dados em nuvem (AWS, Azure e/ou Databricks)Conhecimento avançado em PythonConhecimento avançado de GIT e padrões de GIT workflowConhecimento avançado em conteinerização (Docker, Kubernets)Conhecimento em padrões de design de códigoConhecimento em bancos de dados relacionais e não relacionaisExperiência com Terraform para infraestrutura como códigoExperiencia com frameworks de machine learning: Pandas, Sklearn, Tensorflow, Tidyverse, Pytorch, FastAPIExperiência com testes unitários e de integraçãoExperiência com sistemas LinuxExperiência com refatoração de código (qualidade e performance)Experiência com desenvolvimento, uso e manutenção de esteiras de integração e entrega contínua (CI/CD)Experiência com SonarQube para análise contínua de código e garantia de padrões de qualidade em pipelinesExperiência com Flask ou outras ferramentas de desenvolvimento de APIsExperiência com Airflow como ferramenta de orquestração de rotinas de dados e machine learningExperiência com MLflow para gerenciamento do ciclo de vida de ML.Experiência com construção de dashboards Python e R (Streamlit, Django, Shiny)Experiência com monitoramento de sistemas e suas ferramentas (Elastic, Grafana e Prometheus)Experiência com monitoramento de modelos de machine learning (Drift, Saturação)Experiência com Spark e processamento distribuído de dados com PysparkNível de leitura em inglês avançadoEinstein Benefícios – Compartilhando Bem-EstarCuidados com a saúde: Programa Cuidar com serviços realizados no Einstein para promover a saúde e bem-estar dos colaboradores e dependentes, Clínicas Einstein, Telemedicina, Convênio Farmácia, Convênio Médico, Assistência Odontológica e Consultório Dental in Company.Bem-Estar: Wellhub (Gympass), TotalPass, Coral, Programa de Orientação Pessoal e SESC.Para você e sua família: Licença paternidade estendida, Seguro de Vida, Creche ou Auxílio Creche para mães ou pais com guarda legal, Auxílio para Filhos com Deficiência e Previdência Privada com taxa zero.Alimentação: Vale Alimentação, Vale Refeição ou Refeitório no local de trabalho.Mobilidade: Vale Transporte, Fretado, Estacionamento, Aplicativo de Caronas e Circular Metrô.Clube de Benefícios: Para economizar e obter vantagens nas compras de produtos e serviços de diversas categorias, como Beleza e Fitness, Comer e Beber, Compras, Cultura e Lazer, Educação Ensino Einstein, Turismo e muito mais.Programa Mais Conectados: Trabalho remoto nas modalidades Teletrabalho ou Híbrido conforme atividade e área de atuação.Observações: Os benefícios podem sofrer alteração de acordo com a convenção coletiva, unidade de trabalho e políticas vigentes.Show moreShow less",N/A,On-site/Hybrid,https://www.linkedin.com/jobs-guest/jobs/api/jobPosting/4301007407,2025-09-29
Machine Learning Engineer,Blue Orange Digital,"São Paulo, São Paulo, Brazil",3 days ago,"Company overview:Blue Orange Digital is a boutique data & AI consultancy that delivers enterprise-grade results. We design and build modern data platforms, analytics, and ML/AI Agent solutions for mid‑market and enterprise clients across Private Equity, Financial Services, Healthcare, and Retail.Our teams work with technologies like Databricks, Snowflake, dbt, and the broader Microsoft ecosystem to turn messy, real-world data into trustworthy, actionable insight.We’re a builder‑led, client‑first culture that prizes ownership, clear communication, and shipping high‑impact work.Position overview:Blue Orange is seeking to expand our Team of expert consultants with an experienced Machine Learning Engineer to address a set of expanding opportunities in the next several months. The ideal candidate will possess a deep passion for machine learning, AI tech and innovative data solutions with proficiency in advanced machine learning techniques, strong skills in programming languages such as Python, expertise around data analytics and feature engineering, experience working with some of the main ML and D frameworks, a proven track record of working with cloud-native solutions in at least 1 of the main clouds (AWS, GCP, Azure, or Snowflake, etc.), MLOps and LLMs, and strong proficiency in the end-to-end ML/AI cycle, from ideation to production. The candidate will play a crucial role in driving our machine-learning initiatives forward. The candidate will have excellent communication skills to collaborate with technical and non-technical stakeholders effectively.At Blue Orange, you'll have the opportunity to work on cutting-edge projects, leveraging modern machine-learning and AI techniques to deliver tangible business outcomes and drive innovation in our data-driven solutions.Note:Please submit your resume in English, as all application materials must be in English for review and consideration.Responsibilities:Collaborate with cross-functional teams to understand business requirements and design to productionize Gen AI solutions into practical product driven applications.Design and implement application integrations to leverage newly build GenAI Products.Build solutions that improve delivery speed and scalability of product pipelines.Leverage managed and serverless cloud offerings to create performant and scalable cloud native application solutions and data pipelines.Experiment with retrieval-augmented generation (RAG) approaches to improve the relevance and coherence of AI-generated outputs.Work closely with GenAI engineers and researchers to integrate prompt engineering and RAG components into production systems and ensure seamless deployment.Stay up to date with the latest advancements in prompt engineering, RAG, data science, machine learning, and AI technologies, and explore innovative approaches to enhance Gen AI capabilities.Requirements:Experience with NLP and LLM-based technologies and frameworks.Proficiency in programming languages such as Python and JavaScript is preferred.Proven track record of successful delivery of software engineering projects.Ability to think and learn on your feet, and the ability to quickly become proficient with new technologies in a fast-paced environment.Understanding and passion for Test Driven Design.Familiarity with ETL concepts and best practices.Experience with prompt engineering and RAG techniques preferred.Excellent problem-solving skills, critical thinking abilities, and attention to detail.Effective communication skills and the ability to collaborate effectively in a team environment.Passion for AI and a desire to contribute to the advancement of Gen AI technologies.Strong problem-solving and analytical skills.Self-driven and autonomous.Excellent verbal and written communication skills.Team player.Eagerness to learn and adapt in a fast-paced environment.5+ years of industry experience as a hands-on practitioner of software engineering and proven experience with cloud offerings.3+ years of experience with cloud platforms such as AWS.Experience with Docker preferred.Bachelor's degree or higher in Computer Science or a related field.Preferred qualifications:Advanced degree in a relevant field.Publications in relevant AI/ML communities and journals.Experience fine-tuning OpenSource LLMs and deploying them.MLFlow, etc., a plus.Benefits:Fully remoteFlexible ScheduleUnlimited Paid Time Off (PTO)Paid parental/bereavement leaveWorldwide recognized clients to build skills for an excellent resumeTop-notch team to learn and grow withSalary:USD $7,454 - $9,486 (monthly salary range)Background checks may be required for certain positions/projects.Blue Orange Digital is an equal opportunity employer.Show moreShow less",N/A,Remote,https://www.linkedin.com/jobs-guest/jobs/api/jobPosting/4303767270,2025-09-29
Freelance Annotator (Portuguese) - AI Trainer,Toloka Annotators,"São Paulo, São Paulo, Brazil",3 days ago,"At Toloka, we connect smart, curious people from around the world with freelance online tasks that train and improve artificial intelligence.What We DoThe Toloka Annotators connects individuals with Generative AI projects from leading tech innovators. Our mission is to unlock the full potential of AI by involving real people from around the world in the development process.About The RoleAnnotation is what helps AI make sense of the world. As an annotator, you may be invited to take part in online projects such as rating AI-generated content, evaluating factual accuracy, or comparing responses - when projects are available.Responsibilities:Carefully review provided data (text, images, or videos)Label or classify content based on project guidelinesIdentify and flag factually incorrect, sensitive, inappropriate, or unclear materialImportant note:This is project-based work. Tasks are available only when projects are active. You may be invited to one or more projects depending on your profile and current opportunities.RequirementsBachelor's degree in any disciplineMinimum 1 year of experience in any professional roleYou have advanced proficiency in Portuguese (C1) and a B2 level of English, both written and spokenLogical thinking, fact-checking and reasoning abilitiesStrong attention to detail and ability to understand and follow complex instructionsStrong communication skills, including the ability to ask clarifying questions when neededGenuine interest in technology and artificial intelligenceBenefitsWhy this freelance opportunity might be a great fit for you?Take part in a part-time, remote, freelance project that fits around your primary professional or academic commitmentsWork on advanced AI projects and gain valuable experience that enhances your portfolioInfluence how future AI models understand and communicate in your field of expertiseShow moreShow less",N/A,Remote,https://www.linkedin.com/jobs-guest/jobs/api/jobPosting/4305706723,2025-09-29
AI Engineer,MLabs,"São Paulo, São Paulo, Brazil",6 days ago,"Our client is an innovative AI company building the future of healthcare with AI doctors and nurses, starting in Latin America. Their mission is to reinvent healthcare delivery in the region with AI-native medical solutions. This is an urgent hiring process for a high-impact role. You will have a unique opportunity to be the first AI Engineer in the San Francisco office, helping to shape both the product and the team from the ground up.Our client is seeking an experiencedAI Engineerwith a strong backend focus. This is a role for a hands-on builder who can quickly translate non-technical requirements from a strong medical team into production-ready code. You will own product features end-to-end, from conception to deployment, and will have the potential to lead the AI engineering team in the SF office.You will be responsible for:Developing and deploying Python microservices using FastAPIImplementing LLM orchestration with tools like LangChain or CrewAIBuilding frontend prototypes using React/Tailwind or FlutterApplying production experience with RAG, vector databases, and evaluation systemsDesigning and implementing data pipeline architectures for AI applicationsWorking closely with the medical team to translate clinical requirements into AI solutionsRequirementsWe are looking for a fast-moving, hands-on engineer who has a proven ability to ship quickly and reliably.Must-Haves:2-5 years of experience in AI application development with a heavy backend focusProven ability to ship quickly without sacrificing qualityFamiliarity with top AI companies and a sense of ""what great looks like.""Strong experience with Python microservices (FastAPI) and LLM orchestration (LangChain, CrewAI)Hands-on experience with AI agents, APIs, RAG, and vector databasesOpenness to working on-site in one of the listed locations: San Francisco, São Paulo, or MedellínBonus Points:A background in Physics or MathExperience in healthcare AIFluency in Spanish or PortugueseExperience at a top AI company like OpenAI, Anthropic, or DeepMindBenefitsSalary: $100,000-$300,000Equity: GenerousVisa Sponsorship: Not specifiedDue to the high volume of applications we anticipate, we regret that we are unable to provide individual feedback to all candidates. If you do not hear back from us within 4 weeks of your application, please assume that you have not been successful on this occasion. We genuinely appreciate your interest and wish you the best in your job search.Commitment to Equality and Accessibility:At MLabs, we are committed to offer equal opportunities to all candidates. We ensure no discrimination, accessible job adverts, and providing information in accessible formats. Our goal is to foster a diverse, inclusive workplace with equal opportunities for all. If you need any reasonable adjustments during any part of the hiring process or you would like to see the job-advert in an accessible format please let us know at the earliest opportunity by emailing human-resources@mlabs.city.MLabs Ltd collects and processes the personal information you provide such as your contact details, work history, resume, and other relevant data for recruitment purposes only. This information is managed securely in accordance with MLabs Ltd's Privacy Policy and Information Security Policy, and in compliance with applicable data protection laws. Your data may be shared only with clients and trusted partners where necessary for recruitment purposes. You may request the deletion of your data or withdraw your consent at any time by contacting legal@mlabs.city.Show moreShow less",N/A,On-site/Hybrid,https://www.linkedin.com/jobs-guest/jobs/api/jobPosting/4304131360,2025-09-29
