title,company,location,posted,description,applicants,work_mode,link,data_coleta
Cientista de dados,SulAmérica,"São Paulo, São Paulo, Brazil",1 week ago,"Para o match perfeito acontecer precisa de PESSOAS, com as mais diversas experiências e pontos de vista, para que possamos continuar evoluindo enquanto empresa.Por isso, aqui na SulAmérica, incentivamos a candidatura de pessoas de todas as raças/etnias, orientações sexuais, identidades de gênero, gerações, com ou sem deficiência, para todas as nossas vagas. Afinal, as nossas diferenças é o que nos complementam!#LGBTI+ #PessoasNegras #PcD #50+ #Gerações #PessoasComDeficiênciaComo será o seu dia a dia nessa área:Tratar e analisar grandes conjuntos de dados para identificar padrões, tendências e anomalias que possam indicar atividades de fraude ou abuso.Criar modelos estatísticos e algoritmos para a detecção de fraude/abusos ou má utilização do plano.Trabalhar em estreita colaboração com a equipe de combate à fraude para compartilhar informações, relatar descobertas e auxiliar em investigações.Apresentar resultados por meio de visualizações de dados, como gráficos / dashboards, para tornar as informações acessíveis e compreensíveis para a equipe de combate à fraude.Garantir a segurança e a privacidade dos dados utilizados nas análises, cumprindo os regulamentos de proteção de dados.Documentar descobertas e resultados de análises em relatórios que podem ser usados para investigações, auditorias e relatórios de status.Entre outras atividades.Requisitos necessários para ser Cientista de dados na #SulA:Graduação completa equivalente em Estatística, Matemática, Economia, Ciência da Computação, Engenharia ou campo relacionado.Domínio com linguagens de programação usadas na análise de dados, como Python e R.Conhecimento em SQL e experiência com Google BigQuery.Ter atuado com ciência de dados ou campo similar.Será um diferencial se você tiver:Conhecimento em seguradoras.Local de trabalho:São Paulo – Região da Avenida PaulistaO que a SulA vai te proporcionar?Além de um ambiente de inovação e aberto a experimentação:Salário competitivo com o mercado;Vale Refeição e Alimentação - para matar aquela fome;Assistência Média e Odontológica (extensível a dependentes) - Claro, da SulAmérica né!Seguro de vida;Auxílio Creche para papais e mamães;Previdência Privada com uma ajudinha da SulA;Seguro de Vida.A SulAmérica é uma empresa em transformação, com DNA inovador e sempre preocupada em atender as necessidades dos seus clientes com soluções e produtos encantadores. Se identificou? Então vem com a gente e fazer parte desse time #sanguelaranja 🧡🚀Buscamos pessoas que gostem de desafios e:Sejam colaborativas;Tenham foco no resultado e centralidade em nossos(as) clientes;Saibam se adaptar aos diferentes desafios do dia a dia;Que tenha sempre em mente o inconformismo, propondo soluções inovadoras.O que oferecemos para você:Salário competitivo com o mercado.Vale Refeição e Alimentação.Assistência Médica e Odontológica (extensiva a dependentes) da SulAmérica!Seguro de vida SulAmérica.Auxílio Creche /Babá.Previdência Privada com contrapartida SulAmérica.Programa de Participação nos Resultados.Vale transporte.Se identificou? Então, vem fazer parte do time #SangueLaranja 🧡🚀Sobre nós:Há mais de 129 anos, a SulAmérica tem como missão melhorar a vida das pessoas, oferecendo apoio, segurança e autonomia em todos os momentos. Atendemos 6.8 milhões de clientes por meio de nossos produtos e serviços de Saúde, Odonto, Vida, Previdência e Investimentos. Para tornar isso possível, contamos com o engajamento e a dedicação de mais de 4 mil colaboradores(as) comprometidos(as) com o nosso propósito.Acreditamos que por meio da inclusão e da diversidade construímos um ambiente seguro e de pertencimento que valoriza e respeita as pessoas integralmente. Assim, incentivamos a candidatura de pessoas com deficiência, de diferentes raças e etnias, gêneros, orientações sexuais, identidades de gênero e gerações para todas as nossas vagas.Quer saber mais sobre nós?Acompanhe a gente aqui no LinkedIn e no Instagram: @sulamericaShow moreShow less",N/A,On-site/Hybrid,https://www.linkedin.com/jobs-guest/jobs/api/jobPosting/4247962292,2025-07-12
Cientista de Dados (área Business Development) - São Paulo/SP,Shopee,"São Paulo, São Paulo, Brazil",1 week ago,"About The TeamSobre a ShôAqui na Shô, acreditamos que cada membro de nossa equipe é fundamental para o nosso sucesso, e que diversidade de perspectivas e vivências são essenciais para movimentar nosso negócio e impulsionar o nosso propósito de mudar o mundo para melhor.Fazer parte do nosso time é a oportunidade de se desenvolver dentro de uma cultura de muita agilidade. Se você ama assumir grandes responsabilidades e fazer o que nunca foi feito, a Shô é seu lugar. Aqui você terá grandes desafios, trabalhará em colaboração com um time diverso e contribuirá para o futuro do e-commerce no Brasil, criamos impacto positivo na vida de milhões de pessoas.Modelo de TrabalhoAdotamos um modelo de trabalho híbrido, esse modelo permite que as pessoas ajustem seu ambiente de trabalho de acordo com suas necessidades pessoais, ao mesmo tempo em que promove a colaboração e interação no escritório.Qual será a sua missãoVocê atuará no time de Business Development e será responsável por estruturar e automatizar processos de coleta, classificação, organização e análise de dados que apoiem decisões estratégicas em um ambiente de negócio altamente dinâmico e competitivo.Buscamos alguém com perfil técnico e aplicado, que saiba construir soluções escaláveis, com forte raciocínio analítico e autonomia.Job DescriptionComo será o seu dia a diaProjetar e implementar pipelines robustos para processamento de dados em larga escala;Participar ativamente da evolução da esteira de dados e modelos, com foco em escalabilidade, confiabilidade e impacto;Colaborar com desenvolvedores, analistas de negócio e stakeholders de outras áreas, mantendo uma comunicação clara e objetiva;Desenvolver dashboards e relatórios com dados processados, apoiando a geração de insights para o negócio;Construir soluções com mentalidade DevOps e MLOps, utilizando automações, versionamento, CI/CD e monitoramento.RequirementsO que você precisa para assumir o desafioExperiência sólida com Python e bibliotecas de dados e machine learning (Pandas, Scikit-learn, etc.);Vivência com PySpark ou ferramentas de processamento distribuído;Experiência no tratamento e classificação de dados textuais não estruturados (ex: nomes e descrições de produtos, marcas, categorias), usando regex, Fuzzy Matching, embeddings ou LLMs;Experiência com machine learning aplicado a problemas como classificação e segmentação;Domínio de SQL, com experiência em modelagem de dados, otimização de consultas e organização de bases relacionais para consumo analítico;Habilidade de colaborar em equipes multidisciplinares, com boa comunicação e visão de negócio;Diferencial: domínio de frameworks como TensorFlow ou PyTorch;Diferencial: experiência com sistemas de recomendação, otimização ou personalização em larga escala;Diferencial: experiência com ingestão de dados externos e integração com fontes diversas (APIs, arquivos, dados públicos em escala);Diferencial: familiaridade com ferramentas de orquestração como Airflow ou Kubeflow;Diferencial: vivência em ambientes de e-commerce ou mercados com alta complexidade competitiva.BenefíciosAssistência médica e odontológica, estendendo-se aos dependentes;Parceira com Gympass e TotalPass;Vale Refeição/Alimentação flexível;Vale Transporte, Vale Mobilidade ou Estacionamento no local;Benefício flexível;Zenklub;Bônus anual discricionário, atrelado à performance.VEM FAZER HISTÓRIA COM A GENTE.O QUE TE FAZ ÚNICO, NOS FAZ MELHORES! 🧡Show moreShow less",N/A,On-site/Hybrid,https://www.linkedin.com/jobs-guest/jobs/api/jobPosting/4260617702,2025-07-12
Cientista de Dados em People Analytics,Cielo,"Barueri, São Paulo, Brazil",2 weeks ago,"Job DescriptionSomos mais que uma máquina, somos pessoas que transformam ecriam infinitas possibilidades.Trabalhamos parasimplificar e impulsionar negócios para todas as pessoas,oferecendo soluções financeiras inteligentes. Aqui, investimos emtecnologia,promovemosdesenvolvimentoe fomentamos ainovaçãopara criar novos caminhos possíveis e gerar impacto positivo no mundo.Na Cielo, a gente trabalha comautonomiapara escrever nossa própria jornada,liberdadepara ser quem a gente é, e a oportunidade defazer acontecer.Somos um time que sonha no plural, oferecendo uma experiência completa e focando no bem-estar físico e mental de nossos mais de 6.000 colaboradores e suas famílias.Acreditamos nainclusão e acolhimentode todas as pessoas, com suas singularidades e diversidade de vivências.Bora realizar seus sonhos com a gente!Conheça mais sobre a áreaGerência de People Analytics:A Gerência de People Analytics tem como missão ser a área de referência no mercado atuando através de dados na estratégia de pessoas na Cielo.#VemPraCima #VemPraCieloResponsibilities and assignmentsTem Lugar Para Você Nesse PropósitoColetar, limpar, explorar e analisar dados de pessoas relacionados aos temas de RH, exemplos: recrutamento, performance, engajamento, turnover, dados de áreas comerciais, entre outros;Desenvolver modelos estatísticos preditivos / prescritivos (ex.: propensão de rotatitividade; análise de produtividade, clustering de perfis de colaboradores, etc);Criação de dashboards e visualizações de dados, garantir que esses dashboards respondam a perguntas estratégicas e estejam atualizados com dados confiáveis;Elaborar estudos de correlação e casualidade (ex: impacto de turnover sobre performance);Trabalhar com diferentes fontes de dados, de diversos sistemas, conhecimentos de automatizações de fluxo e garantir a qualidade dos dados/informações;Estabelecer parcerias internas e com áreas de negócio com o intuito de resolver problemas complexos e propor soluções baseadas em dados.Requirements And QualificationsO que o #TimeCielo espera de você?Formação superior completa em disciplina quantitativa, como Estatística, Matemática, Ciência de Dados, Economia, Finanças, Engenharia, Ciência da Computação e afins;Sólida experiência como Especialista de Dados ou função semelhante envolvendo extração de dados, análise, modelagem estatística e visualização de dados;Sólida experiência utilizando linguagens de consulta de dados e lógica de programação (exemplo: SQL, Python, R, entre outras linguagens);Análise estatística prática com uma sólida compreensão e utilização dos fundamentos de análise descritiva, probabilidade, regressão, inferência, testes de hipóteses, modelos de otimização e métodos quantitativos e/ou machine learning;Perfil analítico, raciocínio logico e de resolução de problemas, com grande capacidade de manipulação de dados estruturados e não estruturados, para simplificação de análises e processos;Desenvolvimento de apresentações executivas para liderança e áreas internas da companhia.Additional informationPor que viver infinitas possibilidades ao nosso lado?Assistência Médica e Odontológica;Remuneração Variável Anual (PPR);Auxílio Refeição e Alimentação;Modelo Híbrido;Auxílio Trabalho Remoto;Seguro de Vida;Seguro residencial e automóvel;Assistência funeral familiar;Previdência Privada;Canal de apoio à especialistas (nutrição, psicologia, ginecologia, etc);Campanha de Vacinação;Acesso à diversos cursos em nossa plataforma Educa;Wellhub;Fretado/vale-transporte ou estacionamento;Programa de Gestação Saudável;Licença Maternidade e Paternidade estendida;Auxílio Creche;Dress Code Flexível;Horário Flexível;Sexta-curta;Almoço estendido (1h30).Process stagesRegistrationTriagemEntrevista RHEntrevista Gestor(a)HiringVem pro #TimeCIelo, onde seu sonho de transformação encontra infinitas possibilidades de se tornar realidade!Somos mais que uma máquina, somos pessoas quesonham,transformame criaminfinitas possibilidadesjuntas.Aqui a gente é movido por sonhos e, mais importante, por transformação! Por isso, nos empenhamos todos os dias para cumprir anosso propósito de simplificar e impulsionar negócios para todas as pessoas, oferecendo soluções financeiras inteligentes e acessíveis que estão no dia a dia de quem movimenta o Brasil.Para isso, Investimos fortemente em tecnologia, criamos um ambiente propenso ao desenvolvimento e fomentamos a inovação para aumentar cada vez mais a nossa capacidade de criar novos caminhos possíveis e gerar impacto positivo no mundo.Trabalhar na Cielo é aprender na prática e construir uma carreira diariamente.No nosso dia a dia, a gente trabalha comautonomiapara escrever nossa própria jornada,liberdadepara ser quem a gente é e aoportunidadede fazer acontecer.Nós sonhamos no plural, acolhendo e ajudando a realizar os sonhos das mais de 6.000 pessoas que fazem parte do #TimeCielo. E, para torná-los realidade, a gente oferece uma experiência completa e inesquecível para o nosso time, focando no bem-estar físico e mental não apenas dos nossos colaboradores e colaboradoras, mas também de suas famílias.Além disso, a gente acredita que a resposta para conseguir vislumbrar novos futuros está na inclusão e acolhimento de todas as pessoas, com suassingularidadesediversidadede vivências. Por isso, não importa qual seja o seu sonho – pra sua vida, sua carreira, pra deixar sua marca no mundo –, tem lugar pra ele aqui, junto com os nossos. Vem pra Cima, vem pra Cielo!Show moreShow less",N/A,On-site/Hybrid,https://www.linkedin.com/jobs-guest/jobs/api/jobPosting/4232209586,2025-07-12
Cientista de dados Especialista - Banco de talentos,Serasa Experian,"São Paulo, São Paulo, Brazil",1 day ago,"Company DescriptionA Serasa Experian é a primeira e a maior Datatech do Brasil. Líder em soluções de inteligência para análise de riscos e oportunidades, com foco nas jornadas de crédito, autenticação e prevenção à fraude. Com tecnologia de ponta, inovação e os melhores talentos, transforma a incerteza do risco na melhor decisão, ajudando pessoas a realizarem seus sonhos e empresas de todos os portes e segmentos a prosperarem.Temos 22.000 pessoas operando em 32 países e a cada dia estamos investindo em novas tecnologias, profissionais talentosos e inovação para ajudar todos os clientes a maximizarem cada oportunidade. Com sede corporativa em Dublin, Irlanda, a Experian está listada na Bolsa de Valores de Londres (EXPN) e compõe o índice FTSE 100.Job DescriptionRealizar estudos para buscar oportunidades de otimização e melhoria nos produtos com estudos estatístico;Modelagem preditiva para o crescimento da performance e receita dos produtos;Desenvolver estudos Ad Hoc e análises estatísticas de acordo com a necessidade do cliente;Desenvolver modelos de machine learning;Trabalhar com inteligência artificial generativa;Iniciativas para mapear o funcionamento do negócio e buscar ativamente melhorias e eficiência nos modelos.QualificationsVisão de negócio para entender a necessidade do produto e traduzir em uma solução estratégica utilizando estatística ou métodos matemáticos;Capacidade de se comunicar de forma colaborativa com as demais equipes demandantes ou de tecnologia;Habilidade em mensurar e analisar os ganhos da estratégia do uso de dados;Possuir conhecimentos de programação em SQL, Python;Experiência em modelagem estatística;Diferencial conhecimento em Spark e nuvem AWS e Azure.Additional InformationNão atendeu todas as competências descritas na vaga? Estudos mostram que mulheres, pessoas não brancas e PcD deixam de se candidatar em vagas que não atendam 100% dos requerimentos. Aqui na Serasa Experian nós somos dedicados a criar um ambiente diverso e inclusivo. Se você gostou dessa vaga mas sua experiência não se encaixa totalmente, não se preocupe, nós te encorajamos a se aplicar de qualquer forma para que seu perfil seja avaliado!Temos importantes reconhecimentos do mercado como selo Ideia Sustentável e WEPS – Empresas empoderando mulheres. Além disso, fomos considerados, pela quinta vez consecutiva, uma das empresas mais inovadoras do mundo pela revista Forbes.Temos muito cuidado com o bem-estar dos nossos colaboradores! Em nossos escritórios, mantemos uma estrutura que conta com diversos profissionais e serviços ligados à saúde como massagem, RPG, psicólogo, sala de relaxamento e muito mais! Além disso, temos alguns benefícios diferenciais como licença maternidade e paternidade estendida, horário de trabalho flexível, programa de participação nos lucros e resultados e o Share Saving - programa de ações para todos os funcionários da Experian!E ainda tem mais! Não deixe de acessar a nossa página de carreiras para conhecer todos os nossos benefícios e diferenciais!Experian Careers - Creating a better tomorrow togetherFind out what its like to work for Experian by clicking hereShow moreShow less",N/A,On-site/Hybrid,https://www.linkedin.com/jobs-guest/jobs/api/jobPosting/3957740011,2025-07-12
Cientista de Dados Júnior – Bilingue (ES/PT),NielsenIQ,"Cotia, São Paulo, Brazil",1 day ago,"Descrição da vagaVocê é apaixonado por estatística aplicada, análise rigorosa de dados e resolução de problemas complexos? Esta é a sua oportunidade de iniciar sua carreira em ciência de dados em um ambiente colaborativo e multicultural.ComoCientista de Dados Júnior, você será responsável por apoiar a execução de atividades-chave como estimativa de universos (Universe Estimation) e desenho amostral (Sample Design), garantindo que sejam realizadas com precisão, qualidade e dentro dos prazos estabelecidos. Você atuará sob a supervisão de um líder técnico, aplicando sólidos conhecimentos estatísticos para resolver problemas analíticos complexos e contribuir para a tomada de decisões baseada em dados.ResponsabilidadesExecutar tarefas relacionadas à estimativa de universos, desenho amostral, estudos de viabilidade e outros processos analíticosAplicar técnicas estatísticas para análise de dados e geração de insights acionáveisGarantir a qualidade e integridade dos dados utilizadosDocumentar processos e raciocínios estatísticos de forma claraColaborar com equipes multiculturais em ambientes remotosContribuir para a melhoria contínua de metodologias e ferramentas analíticasQualificaçõesFormação: Graduação em Estatística, Atuária, Matemática Aplicada ou áreas correlatas que envolvam análise estatística de grandes volumes de dadosIdiomas: Espanhol intermediário/avançado (B2–C1). Inglês avançado é um diferencialExperiência: Mínimo de 1 ano utilizando Python para análise de dados. Desejável experiência com pesquisas ou estudos de mercadoFerramentas: Domínio de Python, Excel avançado e PowerPoint. Desejável conhecimento em ferramentas de visualização de dadosHabilidades: Pensamento analítico, curiosidade, atenção aos detalhes e capacidade de trabalhar com equipes remotas e multiculturaisPor favor, envie seu currículo em espanhol ou inglês.Informações adicionaisO que oferecemosOportunidades personalizadas de desenvolvimento de carreira dentro da NielsenIQAcesso a um programa global de mentoria e reconhecimentoOportunidade de trabalhar em um ambiente diverso, global e multiculturalShort Fridays – comece seu fim de semana mais cedo!Our BenefitsFlexible working environmentVolunteer time offLinkedIn LearningEmployee-Assistance-Program (EAP)About NIQNIQ is the world’s leading consumer intelligence company, delivering the most complete understanding of consumer buying behavior and revealing new pathways to growth. In 2023, NIQ combined with GfK, bringing together the two industry leaders with unparalleled global reach. With a holistic retail read and the most comprehensive consumer insights—delivered with advanced analytics through state-of-the-art platforms—NIQ delivers the Full View™. NIQ is an Advent International portfolio company with operations in 100+ markets, covering more than 90% of the world’s population.For more information, visit NIQ.comWant to keep up with our latest updates?Follow us on: LinkedIn | Instagram | Twitter | FacebookOur commitment to Diversity, Equity, and InclusionNIQ is committed to reflecting the diversity of the clients, communities, and markets we measure within our own workforce. We exist to count everyone and are on a mission to systematically embed inclusion and diversity into all aspects of our workforce, measurement, and products. We enthusiastically invite candidates who share that mission to join us. We are proud to be an Equal Opportunity/Affirmative Action-Employer, making decisions without regard to race, color, religion, gender, gender identity or expression, sexual orientation, national origin, genetics, disability status, age, marital status, protected veteran status or any other protected class. Our global non-discrimination policy covers these protected classes in every market in which we do business worldwide. Learn more about how we are driving diversity and inclusion in everything we do by visiting the NIQ News Center: https://nielseniq.com/global/en/news-center/diversity-inclusionShow moreShow less",N/A,On-site/Hybrid,https://www.linkedin.com/jobs-guest/jobs/api/jobPosting/4265077023,2025-07-12
Cientista de Dados Pleno,Serasa Experian,"São Paulo, São Paulo, Brazil",12 hours ago,"Company DescriptionA Serasa Experian é a primeira e a maior Datatech do Brasil. Líder em soluções de inteligência para análise de riscos e oportunidades, com foco nas jornadas de crédito, autenticação e prevenção à fraude. Com tecnologia de ponta, inovação e os melhores talentos, transforma a incerteza do risco na melhor decisão, ajudando pessoas a realizarem seus sonhos e empresas de todos os portes e segmentos a prosperarem.Temos 22.000 pessoas operando em 32 países e a cada dia estamos investindo em novas tecnologias, profissionais talentosos e inovação para ajudar todos os clientes a maximizarem cada oportunidade. Com sede corporativa em Dublin, Irlanda, a Experian está listada na Bolsa de Valores de Londres (EXPN) e compõe o índice FTSE 100.Job DescriptionNa Serasa, estamos em constante evolução para transformar dados em soluções que impactam positivamente a vida de milhões de brasileiros. Como Cientista de Dados Pleno, você fará parte de um time multidisciplinar que atua com grandes volumes de dados, aplicando técnicas avançadas de modelagem estatística, machine learning, inteligência artificial e Ia Generativa para resolver problemas reais de negócio. Se você é apaixonado por dados, inovação e quer trabalhar em um ambiente colaborativo e dinâmico, essa vaga é para você.QualificationsGraduação completa em Ciência da Computação, Engenharia, Estatística, Matemática, ou áreas correlatasVivência prévia como Cientista de Dados, com domínio de todo o ciclo de desenvolvimento de modelos — desde a exploração de dados até a implantação em produção.Conhecimentos em estatística, machine learning supervisionado e não supervisionado, validação de modelos e métricas de performance.Programação em Python, manipulação e análise de grandes volumes de dados e experiência com ferramentas de versionamento e pipelines de dadosCapacidade de entender o problema de negócio, propor soluções baseadas em dados e comunicar resultados de forma clara para stakeholders não técnicos.Diferenciais: experiência com ambientes em nuvem (AWS, ou Azure), onhecimento em MLOps e ferramentas como MLflow, Airflow ou similaresAdditional InformationA Serasa Experian é muito mais do que você imagina. Com o propósito de criar um futuro melhor, ampliando oportunidades para pessoas e empresas, no Brasil somos mais de 4 mil pessoas que atuam em diversos times e especialidades. Aqui, cada conhecimento e diversidade se complementa e você pode trabalhar no que mais ama, estamos comprometidos a construir uma cultura inclusiva e um ambiente no qual pessoas possam equilibrar a carreira com seus compromissos e interesses pessoais, prezando pelo bem-estar.A gente se dedica muito em ser uma das melhores e mais inovadoras empresas para se trabalhar do país, possibilitando experiências e carreiras incríveis para nossas pessoas. Nossa forte abordagem de pessoas em primeiro lugar é reconhecida externamente por meio de diversas certificações de mercado: fomos premiados pelo Great Place To Work™ em 24 países e pela certificação internacional Top Employers, além de sermos reconhecidos como uma das melhores empresas para jovens profissionais e contarmos com uma avaliação de 4,6 no Glassdoor. Cada reconhecimento nos indica que estamos no caminho certo, proporcionando um ambiente de trabalho cada vez melhor para nossos talentos.Experian Careers - Creating a better tomorrow togetherFind out what its like to work for Experian by clicking hereShow moreShow less",N/A,On-site/Hybrid,https://www.linkedin.com/jobs-guest/jobs/api/jobPosting/4265502046,2025-07-12
