title,company,location,posted,description,applicants,work_mode,link,data_coleta
Analista Cientista de Dados Pl.,PagBank,"São Paulo, São Paulo, Brazil",4 days ago,"Descrição da vagaQuando você pensa em carreira, o que vem à sua mente? Propósito? Colaboração? Ser protagonista para fazer a diferença? No PagBank temos tudo isso e muito mais. 💛Estamos em busca de pessoas que vistam a camisa com orgulho. Gente com vontade de facilitar a vida financeira das pessoas e impulsionar negócios!Tá a fim de uma carreira que rende mais?Confira essa oportunidade e #VemProPags!Responsabilidades e atribuiçõesDesenvolver modelos preditivos de crédito e cobrança.Implementar e monitorar modelos em produção.Otimizar processos e aplicar melhoria contínua nos modelos.Interagir com times de engenharia e produtos para garantir a escalabilidade das soluções.Requisitos e qualificaçõesSuperior completo em Estatística, Matemática, Ciência da Computação, Engenharia ou áreas correlatas.Conhecimento avançado de linguagens de programação (estrutura e lógica) com SQL, Python ou R.Domínio de estatística aplicada e ciência de dados (Modelos de classificação e Preditivos).Conhecimentos em Machine Learning (como por exemplo: Random Forest, Gradient Boosting Machines (GBM), XGBoost, LightGBM) aplicados a riscos.Conhecimento em modelos de previsão de cobrança e análise preditiva.Experiência no uso de técnicas de feature engineering e tuning de hiperparâmetros para otimização de modelos.Conhecimento em criação de book de target no universo de riscos e criação de book de covariáveis (feature Engineer e feature Store)Conhecimento de monitoramento de modelos de Machine Learning.Experiência em estrutura e manipulação de dados.Conhecimentos na utilização de Spark para manipulações big data.Conhecimento de gerais de estrutura Cloud (AWS, Azure ou GCP).Conhecimento em versionamento de código (como Github).Informações adicionaisPara se destacar nessa posição, seria legal se você também tivesse:Experiência com risco de crédito ou áreas correlatas.Experiência com MLOps e Feature Eng., implementação, homologação, sustentação e otimização.Disponibilidade para atuação em modelo híbrido. Nosso escritório está localizado na cidade de São Paulo/SP.Olá, somos o PagBank!Talvez você nos conheça por maquininhas ou comerciais que ficam na memória, mas somos muito mais!Todos os dias desenvolvemos produtos e soluções inspiradas pelo nosso propósito: facilitar a vida financeira das pessoas e negócios.Trabalhamos para transformar a forma como as pessoas lidam com dinheiro abrindo novas possibilidades para alcançarem seus sonhos.Como fazemos tudo isso?💛Com genteSomos um time que joga junto! Aqui valorizamos todas as diversidades, seja de raça/etnia, gênero, idade, origem, pessoa com deficiência, orientação afetivo-sexual, constituição familiar e estética.💛Com tecnologiaO espírito disruptivo e inovador está no nosso DNA: somos parte do Grupo UOL, empresa 100% brasileira, foi pioneira na internet e transforma a vida das pessoas desde 1996.💛Com uma só culturaTemos uma cultura forte e única, capaz de nos levar além, para continuarmos crescendo e perpetuando o nosso negócio.Somos um dos maiores bancos digitais do país e uma das fintechs mais rentáveis do segmento.Para vivenciar tudo isso, você terá um pacote completo de benefícios que fazem toda a diferença:Vale-alimentação e/ou refeição.Plano de saúde e odontológico.Seguro de vida.Parceria com TotalPass e ZenKlub.Licença maternidade e paternidade estendidas.Auxílio-creche.Descontos de até 50% em pós-graduação e MBA de grandes instituições, como FIA, FAAP e PUCRS.E tem mais:No dress code: o importante é você usar o que te faz bem.#TáDeParabéns: Day off no aniversário.Baby Gift: presente para recém-nascidos.Tá a fim de uma carreira que rende mais?Vem pro nosso time imbatível!#VemProPags.Show moreShow less",N/A,On-site/Hybrid,https://www.linkedin.com/jobs-guest/jobs/api/jobPosting/4257082157,2025-07-23
Data Scientist,Brex,"São Paulo, São Paulo, Brazil",1 week ago,"Why join usBrex is the AI-powered spend platform. We help companies spend with confidence with integrated corporate cards, banking, and global payments, plus intuitive software for travel and expenses. Tens of thousands of companies from startups to enterprises — including DoorDash, Flexport, and Compass — use Brex to proactively control spend, reduce costs, and increase efficiency on a global scale.Working at Brex allows you to push your limits, challenge the status quo, and collaborate with some of the brightest minds in the industry. We’re committed to building a diverse team and inclusive culture and believe your potential should only be limited by how big you can dream. We make this a reality by empowering you with the tools, resources, and support you need to grow your career.Data at BrexOur Scientists and Engineers work together to make data — and insights derived from data — a core asset across Brex. But it's more than just crunching numbers. The Data team at Brex develops infrastructure, statistical models, and products using data. Our work is ingrained in Brex's decision-making process, the efficiency of our operations, our risk management policies, and the unparalleled experience we provide our customers.What You’ll DoAs a Data Scientist focused on Product Analytics, you will work closely with Product, Engineering, and Customer Success teams to understand the interactions between product engagement, customer retention, and overall customer growth. Your work will be instrumental in shaping product decisions by uncovering insights into how customers interact with Brex’s platform, identifying opportunities to refine the product experience, optimize user workflows, and introduce impactful changes that increase long-term customer value and drive sustainable revenue growth.The ideal candidate has experience leveraging product intuition and advanced analytics to understand customer behavior, measure product impact on revenue retention and growth, and derive insights through causal inference and predictive modeling. They should also have a strong ability to translate data insights into actionable recommendations for product and business teams.Where you’ll workThis role will be based in our Sao Paulo office. You must be willing to work in office at least 2 days per week on Wednesday and Thursday, starting the week of September 1st, 2025. when we open our Sao Paulo office. Employees will be able to work remotely for up to 4 weeks per year.ResponsibilitiesDevelop and apply data-driven methodologies to analyze customer behavior, retention trends, and product adoption, focusing on how product changes impact long-term customer value.Design and implement predictive models, causal inference methods, as well as experimentation strategies to measure and optimize the effect of product changes on customer growth and engagement.Partner with Product, Engineering, and Customer Success teams to identify key opportunities for improving customer engagement and long-term retention.Collaborate with Data Engineering to build scalable data pipelines that support product analytics and reporting.Clearly communicate findings and strategic recommendations to both technical and non-technical stakeholders.RequirementsMaster’s degree or Ph.D. in Statistics, Computer Science, Economics, or a related quantitative field.3+ years of experience in a data science, analytics, or related role focused on product analytics.Strong experience with SQL and Python (or R) for data analysis and modeling.Proficiency in A/B testing methodologies, causal inference, and predictive modeling.Ability to translate complex data insights into strategic business recommendations.Familiarity with BI tools (e.g., Tableau, Looker) and data visualization best practices.Strong problem-solving skills and the ability to work in a fast-paced, cross-functional environment.English proficiency/fluency, both written and spoken (note: interviews will be conducted in English).Bonus PointsExperience working in B2B SaaS or fintech.Experience in developing frameworks to measure feature adoption and identifying product opportunities that drive customer lifetime value.Familiarity with product analytics tools (e.g., Amplitude, StatSig).LocationMust be working in Brazil at the start of rolePlease be aware, job-seekers may be at risk of targeting by malicious actors looking for personal data. Brex recruiters will only reach out via LinkedIn or email with a brex.com domain. Any outreach claiming to be from Brex via other sources should be ignored.Show moreShow less",N/A,Remote,https://www.linkedin.com/jobs-guest/jobs/api/jobPosting/4193629668,2025-07-23
Risk Management Specialist - Model Risk Data Science and AI Models,Nubank,"São Paulo, São Paulo, Brazil",1 hour ago,"About NubankNubank was founded in 2013 to free people from a bureaucratic, slow and inefficient financial system. Since then, through innovative technology and outstanding customer service, the company has been redefining people's relationships with money across Latin America. With operations in Brazil, Mexico, and Colombia, Nubank is today one of the largest digital banking platforms and technology-leading companies in the world.Today, Nubank is a global company, with offices in São Paulo (Brazil), Mexico City (Mexico), Buenos Aires (Argentina), Bogotá (Colombia), Durham (United States), and Berlin (Germany). It was founded in 2013 in Sao Paulo, by Colombian David Vélez, and cofounded by Brazilian Cristina Junqueira and American Edward Wible. For more information, visit www.nubank.com.br.About The TeamAt Nubank we heavily rely on data, machine learning and other quantitative models & techniques to drive our strategy and provide the best experience and products to our customers.The position holder will be part of the Model Risk team, within the Risk Management structure at Nubank.The Model Risk team is the second line of defense for our models. Our mission is to ensure Nubank relies on world-class solutions that will lead to optimal and sustainable decisions. We act by providing independent review & challenge to models, staying tuned to cutting edge techniques, along with business and customers needs. We also work to identify and control risks related to our models, as well as in the definition and implementation of feedback loops to constantly improve them.About The RoleProvide effective challenges, identify risks, and enhancement opportunities, and engage with other Data Scientists and Business Analysts to strengthen our decision-making tools;Discuss and report model risk status and independent opinions on models with different stakeholders, including senior managers and regulators;Contribute to the consolidation of and improve Nubank's Model Risk Management and Model Review frameworks with autonomy and creativity;Be exposed to different types of decisions and processes (e.g. credit, fraud, operations and in different countries)Conduct independent reviews of quantitative models based on statistical, machine learning and AI techniques, with a stronger focus on credit models;Develop playbooks and toolkits (Python, Scala, SQL, etc.) to optimize model reviews, ongoing models monitoring, and assess the impact of models in decisions;Ensure the team maintains a high level of technical excellence.We Are Looking For a Person Who HasGreat communication skills: clear, concise and structured.Problem-solving skills: Strong analytical and problem-solving abilities are essential for identifying risk factors and implementing effective risk management strategies.Experience developing or validating machine learning models used to leverage important decision-making processes or to solve relevant academic problems;Interest in reviewing complex machine learning and other types of models to identify risks and propose enhancements;Ability to work autonomously and demonstrate a sense of prioritizationData Science skills, strong knowledge of machine learning tools and techniques;Strong programming skills, desirable previous experience with Python, SQL, GitHub;Stakeholder management and influencing skills across levelsOrganized and detail-oriented, without losing track of the big picture;Advanced English skills.Previous experience in credit risk management and/or other risk management frameworks would be a plusMaster's degree or relevant undergraduate scientific project would be a plusPrevious knowledge of expected loss provisions modeling would be a plusBenefitsHealth, dental and life insurancesMeal allowanceTransportation assistance30 days of paid vacationChance of earning equity at NubankParking partnership - discounted parking in our officeFree bike parking with showers availableNuCare - Our mental health and wellness assistance programNuLanguage - Our language learning programGympass partnershipExtended maternity and paternity LeavesChild care allowance‘Espaço Feijão’- Private nursing and breastfeeding spaces in our buildingsOnsite Health Center - Medical support for every Nubanker in our officeDiversity & InclusionAt Nubank, we want to be sure that we're building a more diverse and inclusive workplace that reflects the customers we serve and seek to empower. That's why we hire based on equality. We consider gender, ethnicity, race, religion, sexual orientation, and other identity markers as enriching elements to our company while ensuring neither of them represent a barrier when recruiting fantastic talent.Show moreShow less",N/A,On-site/Hybrid,https://www.linkedin.com/jobs-guest/jobs/api/jobPosting/4245166549,2025-07-23
Pessoa Coordenadora Cientista de Dados | Crédito,C6 Bank,"São Paulo, São Paulo, Brazil",2 weeks ago,"Nossa área de Ciência de DadosNosso ambiente de trabalho é extremamente leve e colaborativo, que estimula a autonomia e liberdade, sempre muito próximos dos times de negócios e com a entrega final em mente. Nossa Cultura é forte e foi construída para estimular a inovação e garantir relações verdadeiras com clientes e colaboradores.Suas atividades como CSixerTrabalhar com parceiros de negócios, engenheiros de dados e times de tecnologia para desenvolvimento e deploy de soluções de machine learning como parte dos produtos;Analisar dados para validar hipóteses e gerar insights de negócio;Manipular dados para tratamento, limpeza e exploração;Implementar, testar, fazer deploy, documentar e depurar processos de dados e de machine learning;Contribuir com os repositórios de código e documentação da equipe e qualificar a discussão técnica com referências científicas e metodológicas.Requisitos e experiênciaExperiência com técnicas de modelagem descritiva e preditiva;Experiência na construção de ETL usando SQL;Experiência com Python e/ou R para construção de modelos.Nossos benefíciosVale-Refeição;Vale-Alimentação;Plano e saúde e odontológico;Auxílio-Creche;Seguro de Vida;Wellhub;Psicologia Viva;Cartão de Crédito C6 Bank Carbon;Carbon Spa;Sala de amamentação;Bicicletário;Vestiário;Espaço de convivência;Empresa Cidadã - Prorrogação do prazo da licença-maternidade e licença-paternidade.C6 BANKO BANCO DA SUA VIDAAtendemos pessoas físicas, MEIs e PMEs em todos os estados do Brasil. Sem agências físicas, oferecemos mais de 90 produtos e serviços financeiros feitos para todos os perfis de clientes.Estamos localizados em São Paulo-SP e contamos com mais de 3.000 CSixers que estão sempre a mil por hora. Em pouco mais de cinco anos, conquistamos muitos prêmios e reconhecimentos.No C6 Bank, acreditamos que a diversidade impulsiona a inovação e fortalece nosso ambiente de trabalho. Por isso, promovemos uma cultura inclusiva, que valoriza a equidade e garante oportunidades para todas as pessoas, independentemente de raça, cor, idade, credo, deficiência, nacionalidade, estado civil, orientação sexual, identidade ou expressão de gênero. Aqui, todo mundo é bem-vindo para ser quem é.Confira mais informações no vídeo abaixo:Show moreShow less",N/A,On-site/Hybrid,https://www.linkedin.com/jobs-guest/jobs/api/jobPosting/3923094040,2025-07-23
Engenheiro(a) de Machine Learning,Banco BS2,"São Paulo, São Paulo, Brazil",1 week ago,"Sobre o BS2Somos um banco 100% digital e focado em empresas, com atendimento humanizado e soluções sob medida para cada cliente - afinal, nenhum negócio é igual ao outro. Essa lógica também se aplica à nossa cultura: temos um DNA inovador que instiga todo o nosso time a se reinventar constantemente. Por aqui, nossos colaboradores (os bessers) podem contar com um ambiente que impulsiona o crescimento da carreira e traz a oportunidade de lidar com os desafios do mercado financeiro com quem mais entende do assunto.Responsabilidades Principais:Projetar, implementar e evoluir agentes de IA para automatizar processos e apoiar a tomada de decisão na organização.Monitorar e manter o desempenho dos agentes implantados, garantindo alinhamento com os objetivos de negócio e necessidades dos usuários.Colaborar com equipes para identificar oportunidades de automação baseada em agentes e recomendar soluções adequadas.Contribuir para o desenvolvimento de componentes reutilizáveis, pipelines de orquestração e boas práticas para o ciclo de vida dos agentes.Avaliar e integrar ferramentas como Vertex AI Agent Builder, LangChain e outros frameworks de orquestração.Apoiar a equipe de governança com insights técnicos sobre comportamento, desempenho e oportunidades de melhoria dos agentes.Liderar ou coordenar projetos multifuncionais envolvendo implantação e monitoramento de agentes de IA.Requisitos Técnicos:Proficiência emPythonouC#, com foco em desenvolvimento limpo e escalável.Domínio deSQLpara manipulação e análise de dados.Experiência comAPIs de LLMs(como OpenAI, Vertex AI) e técnicas deorquestração de agentes.Conhecimento emarquitetura de agentes, incluindo memória, gerenciamento de contexto e interações multi-turno.Vivência comambientes em nuvem, especialmenteGoogle Cloud Platform (GCP).Inglês avançado (será necessário para participação de reuniões)Diferenciais:Experiência comobservabilidade de agentese ferramentas de monitoramento.Conhecimento emgovernança de RAG (Retrieval-Augmented Generation).Modelo de Trabalho:O modelo de trabalho dessa posição é híbrido 3x2 (três dias presenciais e 2 de home office) na Vila Olímpia em São PauloNossos benefícios:🍽️ Vale refeição no valor de R$ 1.003,48 ao mês;🛒 Vale alimentação no valore de R$ 797,99 ao mês;🍾 13º do vale alimentação;💰 PLR;👨🏻‍⚕️ Assistência médica;🦷 Assistência odontológica;🗣️ Programa + Saúde: Telemedicina;🚀 Previdência Privada;👶🏽 Auxílio Creche no valor de R$ 613,19 por filho até 6 anos;🤰🏼 Programa Maternar: Acompanhamento profissional da gestação e puerpério;🍼 Espaço Lactário, para o retorno das mamães;🏋🏻 Wellhub, o antigo Gympass;🏖️ Dayoff, um dia de folga no seu aniversário;🤓 Potencializa: Nossa plataforma de cursos internos;💵 Empréstimo para colaboradores;⏰ Jornada reduzida, 40 horas semanais;No BS2, incentivamos candidaturas de diferentes etnias, gêneros, religiões, orientações sexuais e/ou nacionalidades. Consideramos pessoas com deficiência para todas as nossas oportunidades. Todas as pessoas são muito bem-vindas!Show moreShow less",N/A,On-site/Hybrid,https://www.linkedin.com/jobs-guest/jobs/api/jobPosting/4249949736,2025-07-23
Desenvolvedor Inteligência Artificial - IA,Legalbot,"São Paulo, São Paulo, Brazil",4 months ago,"DescriçãoSomos um Reg Tech que está revolucionando ocompliance regulatóriocom tecnologia deinteligência artificial e busca semântica, automatizando processos e simplificando a complexidade jurídica para empresas. Estamos em busca de umDesenvolvedor de Softwareapaixonado porIA, aprendizado de máquina e desenvolvimento de sistemas escaláveispara impulsionar nossa plataforma. Se você buscadesafios reais, inovação e impacto direto em um produto líder, essa vaga é para você!Requisitos ObrigatóriosLinguagens de Programação:Proficiência em Python (essencial) e familiaridade com outras linguagens como R, Java ou C++ (dependendo do projeto).Bibliotecas e Frameworks De IA/MLExperiência com bibliotecas/frameworks de machine learning e deep learning, como TensorFlow, PyTorch, Scikit-learn, Keras ou FastAI.Fundamentos De IA e MLCompreensão de algoritmos de aprendizado supervisionado, não supervisionado e aprendizado por reforço.Conhecimento de algoritmos clássicos como regressão linear, árvores de decisão, SVM, redes neurais, etc.Matemática e EstatísticaDomínio de álgebra linear, cálculo, estatística e probabilidade, aplicados ao desenvolvimento de modelos de IA.Análise De DadosExperiência em limpeza, preparação e análise de grandes conjuntos de dados (usando ferramentas como Pandas e NumPy).Familiaridade com bancos de dados SQL e NoSQL.Habilidade InterpessoalRaciocínio lógico e resolução de problemas: pensar criticamente sobre problemas e propor soluções inovadoras.Trabalho em equipe: colaborar com engenheiros de dados, cientistas de dados e outras equipes.Autonomia e Proatividade: buscar soluções por conta própria e sugerir melhorias no processo.Comunicação: capacidade de traduzir conceitos técnicos complexos para stakeholders não técnicos.Show moreShow less",N/A,On-site/Hybrid,https://www.linkedin.com/jobs-guest/jobs/api/jobPosting/4181199852,2025-07-23
