title,company,location,posted,description,applicants,work_mode,link,data_coleta
Cientista de Dados - Pleno,Omni Conectado,"São Paulo, São Paulo, Brazil",1 month ago,"Descrição da vagaSomos uma empresa em constante transformaçãoA Omni, presente há 30 anos no mercado, é uma instituição sólida e reconhecida por possui um dos melhores serviços de crédito do Brasil. Temos orgulho da nossa importância para pessoas com menor acesso a crédito. Por isso, empenhamos toda dedicação e responsabilidade para seguirmos adiante sempre,melhorando a Vida das PessoasNos dedicamos aodesenvolvimento contínuodos nossos colaboradores. Cultivamos relacionamentos comproximidadepara criar vínculos comlealdade e parceria, com forte senso de fazer o que écorreto,em um ambiente derespeito e cordialidade.Somos uma empresa humanizada e valorizamos a diversidade de nossos colaboradores como uma verdadeira força, e essa força só poderá ser utilizada se fizermos com que todos sintam que realmente podem ser eles mesmos no dia a dia, independentemente de sua etnia, religião, orientação sexual, gênero, deficiência ou qualquer outra característica pessoal.Cultura OmniO que vivemos diariamente e temos orgulho de ser!PropósitoOMNIZAR!Omnizar é... Fazer o melhor hoje para o amanhã ser ainda melhor!VisãoSer o seu melhor parceiro em soluções financeiras.ValoresAgir de modo empreendedor;Garantir eficiência;Respeitar nossas parcerias;Ter senso de justiça;Trabalhar pra valer.Se você se identifica com este ambiente e se considera,colaborativo,integradoretransformador, venha fazer parte do nosso time.Aqui você será desafiadoResponsabilidades e atribuiçõesO profissional atuará na estrutura de Data Science da Omni, contribuindo para o aumento da eficiência e competitividade.Nosso trabalho diário envolve o desenvolvimento e monitoramento de soluções analíticas, além da busca contínua por inovação técnica e novos dados.Requisitos e qualificaçõesÉ imprescindível possuir graduação completa em Estatística, Matemática, Física, Ciências da Computação, Engenharia ou áreas correlatas de exatas.-Imprescindível conhecimento em Python e SQL.Habilidade para identificar e propor soluções para problemas, garantindo a aplicabilidade das soluções.Boa comunicação, com capacidade de transmitir análises complexas de forma simples para as áreas de negócios.Informações adicionaisNossos BenefíciosAuxilio creche;TotalPass (atividade física)Modelo de trabalho híbrido 3x2Vale alimentação e vale refeição;Vale transporte;Assistência médica e Odontológica;Seguro de vida;Programa de bem-estar e saúde;Day off no dia do seu aniversário;Participação nos lucros;Sem dress code: você pode se vestir como preferir;Horário de trabalho Flexível;Entre outros.Se você é apaixonado por novos desafios e não tem medo de ousar, venha fazer parte do time Omni!Somos uma empresa com 31 anos de mercado e que não perde a vontade de crescer e inovar. Nesse tempo, aprendemos uma coisa importante: VOCÊ é o nosso maior patrimônio.Chegamos a essa conclusão da nossa maneira, olho no olho, porque o nosso trabalho é oferecer soluções financeiras, do jeito que você precisar. Simples, não é?Seja por meio de um Financiamento de Veículos, Crediário Loja, Crédito com Garantia de Veículo, Investimentos Financeiros ou Cartões Private Label. Essa é a nossa forma de ampliar um mundo de opções para você realizar seus objetivos na vida.O nosso cliente é aquele que já passou por outros bancos e financeiras e por ter dificuldades de comprovação de renda e baixo score o crédito é negado, aqui no Omni nós trabalhamos para encontrar possibilidades de crédito que se adequem a realidade dos nossos clientes!Nossa filosofia está em impactar positivamente o mundo, e assim praticamos o nosso propósito junto aos nossos clientes, nós Omizamos Vidas apoiando famílias inteiras na realização dos seus sonhos, seja na compra de um veículo, na reforma da casa ou até mesmo em uma viagem.Nós queremos e estamos pertinho dos microempreendedores que estão iniciando o seu negócio ou precisam de um capital de giro, nós disponibilizamos crédito para o pipoqueiro (a), para a rendeira (o), para o dono (a) do mercadinho, para a cabeleireira (o) e para o caminhoneiro! Nos orgulhamos disso, pois reconhecemos nossa relevância para tanta gente!Para nós Omnizar é “fazer o melhor hoje, para o seu amanhã ser ainda melhor”!Melhor para os nossos clientes, colaboradores, parceiros e para a sociedade como um todo, pois sabemos da nossa responsabilidade e possibilidades de tornar o mundo um lugar muito melhor.Juntos somos únicos, juntos somos Omni!Sim somos únicos! Temos um jeito só nosso. Respiramos a nossa Cultura e nos orgulhamos muito disso!Somos umaempresa humanizadae valorizamos adiversidadede nossos colaboradores como uma verdadeira força, e essa força só poderá ser utilizada se fizermos com que todos sintam que realmente podem ser eles mesmos no dia a dia, independentemente de sua etnia, religião, orientação sexual, gênero, deficiência ou qualquer outra característica pessoal.Adoramos a diversidade! E isso é muito natural para nós. Quanto mais diverso, melhor!Muito prazer, somos a Omni.Conectado com você!Show moreShow less",N/A,On-site/Hybrid,https://www.linkedin.com/jobs-guest/jobs/api/jobPosting/4249180217,2025-07-23
Data Scientist,Equifax,"Barueri, São Paulo, Brazil",5 days ago,"Funções que serão desempenhadas:Gerenciar rotinas de tratamento, transformação e disponibilização de dados;Preparar ambientes e insumos para análises, indicadores, relatórios e modelos;Atuar como parceiro(a) das áreas internas, garantindo a qualidade das informações e propondo soluções inovadoras;Colaborar com stakeholders para atender às demandas do negócio;Preparar materiais e apresentações de insights estratégicos para níveis executivos.Busca constante por melhoria nos processos e inovações em relação ao tratamento das bases de dadosRequisitos necessários:Formação em áreas como Tecnologia, Estatística, Matemática, Engenharias ou similares;Experiência com ferramentas de ETL/ELT (ex.: Airflow, dbt);Domínio de linguagens de programação para manipulação e análise de dados (ex.: SQL, Python ou R);Experiência com plataformas de dados em nuvem (ex.: BigQuery, Snowflake, Redshift);Conhecimento de versionamento de código e pipelines CI/CD.Inglês avançado (diferencial);Experiência com metodologias ágeis (diferencial);Conhecimento em modelagem preditiva ou no ciclo de crédito (diferencial)Certificação em plataformas de dados em nuvem AWS, GCP ou Azure (diferencial).ATENÇÃO!Para essa vaga, o modelo de trabalho é híbrido, sendo necessário ter fácil acesso para atuar em nosso escritório que está localizado em Barueri/SP.Show moreShow less",N/A,On-site/Hybrid,https://www.linkedin.com/jobs-guest/jobs/api/jobPosting/4268446663,2025-07-23
Data Scientist Sr,Banco Bradesco,"Osasco, São Paulo, Brazil",5 days ago,"Sobre o BradescoO Bradesco é um dos maiores grupos financeiros do Brasil, com uma história marcada pelo pioneirismo e inovação. Por meio da nossa carteira amplamente diversificada de produtos financeiros, serviços bancários e de seguros contribuímos com a realização das pessoas e o crescimento sustentável de empresas e sociedade. Venha fazer parte do nosso ecossistema financeiro e impactar a experiência de milhões de pessoas!Saiba mais em https://banco.bradesco/html/classic/sobre/index.shtmResponsabilidades e atribuiçõesO que é o nosso time de Controladoria?A área de A área de Controladoria tem a missão de garantir ao Grupo Bradesco informações gerenciais, resultados, análises e projeções com governança, bem como ser referência em análises, estudos e projeções de finanças para aumentar a qualidade e precisão das decisões tomadas pela Organização.Modelo de trabalho :Híbrido - 2 dias presenciaisUnidade: Osasco/SPComo será seu dia a dia?Sendo Data Scientist Sr, atuará na gerência Analytics para FP&A (Planejamento e Análise Financeira) e suas principais atividades serão:Desenvolver estudos para responder demandas de negócios, realizar diagnósticos de problemas e de performance de carteiras e identificar insights acionáveis e oportunidades de rentabilidade sustentável;Aplicar ferramentas analíticas que suportem a área de FP&A a alavancar a rentabilidade sustentável do banco nos diversos segmentos de negócio empregando desenvolvimento de modelos estatísticos supervisionados e não supervisionados;Elaboração de ferramentas para projeções de indicadores; Condução de testes e experimentos para identificar quais fatores potencializam a geração de resultados;Construção e gestão de simuladores de cenários;Construção e gestão de dashboards;Desenhar propostas para novos estudos visando geração contínua de insights acionáveis;Identificação e busca de novas fontes de dados e variáveis que adicionem valor ao negócio;Suporte no planejamento/organização/melhoria do pipeline de dados da área;Suportar as demais áreas de FP&A com estudos, insights e modelos estatísticos.Requisitos e QualificaçõesO que você precisa ter ou saber?Formação em Engenharia, Estatística, Matemática, Ciências da Computação, Economia, Adm. Empresas ou Física;Conhecimentos sólidos de Estatística, Machine Learning, SQL, Python, Power BI, Excel e Powerpoint;Experiência com manipulação de bases de dados/ETL;Experiência com desenvolvimento de dashboards e estatística descritiva;Experiência em análise estatística de dados, elaboração de diagnósticos, identificação de causas raízes de problemas, identificação de tendências, riscos e oportunidades e construção do devido storytelling;Experiência com técnicas de modelagem estatística/machine learning/modelos preditivos/modelos de clusterização/modelos de lifetime value/modelos de projeção;Experiência com Projeção/Forecast de indicadores de negócios e resultados financeiros;Experiência com planejamento de Experimentos/Testes de negócios;Experiência com simulação de cenários/desenvolvimento de ferramentas de simulação.Será um diferencial se você tiver:Inglês Avançado;Planejamento Financeiro/FP&A.O que nós oferecemosNo Bradesco valorizamos a saúde e bem-estar, oferecendo um extenso portfólio de benefícios a todas nossas pessoas funcionárias:PLR ou Bônus: Conforme a elegibilidade de cargo*Convênio MédicoConvênio OdontológicoSeguro de VidaVale AlimentaçãoVale Refeição13º Cesta AlimentaçãoTotal PassVale Transporte (adesão opcional)Descontos em produtos e serviços em empresas parceirasPrevidência Privada (adesão opcional, com participação financeira da Organização Bradesco)Viva Bem Bradesco: programa de saúde, bem-estar e qualidade de vidaUnibrad: Universidade Corporativa BradescoIsenção de Tarifas: condições especiais em diversos produtos e serviçosAuxílio Creche ou BabáLicença Paternidade estendida de 20 diasLicença Maternidade de 180 dias, acompanhamento assistencial da gestação até o pós-partoShow moreShow less",N/A,On-site/Hybrid,https://www.linkedin.com/jobs-guest/jobs/api/jobPosting/4268658548,2025-07-23
Analista Cientista de Dados Pleno,PagBank,"São Paulo, São Paulo, Brazil",2 weeks ago,"Responsabilidades e atribuiçõesDesenvolver modelos preditivos de crédito e cobrança.Implementar e monitorar modelos em produção.Otimizar processos e aplicar melhoria contínua nos modelos.Interagir com times de engenharia e produtos para garantir a escalabilidade das soluções.Requisitos e qualificaçõesFormação completa em Estatística, Matemática, Ciência da Computação, Engenharia ou áreas correlatas.Conhecimento avançado de linguagens de programação (estrutura e lógica) com SQL, Python ou R.Domínio de estatística aplicada e ciência de dados (Modelos de classificação e Preditivos).Conhecimentos em Machine Learning (como por exemplo: Random Forest, Gradient Boosting Machines (GBM), XGBoost, LightGBM) aplicados a riscos.Conhecimento em modelos de previsão de cobrança e análise preditiva.Experiência no uso de técnicas de feature engineering e tuning de hiperparâmetros para otimização de modelos.Conhecimento em criação de book de target no universo de riscos e criação de book de covariáveis (feature Engineer e feature Store)Conhecimento de monitoramento de modelos de Machine Learning.Experiência em estrutura e manipulação de dados.Conhecimentos na utilização de Spark para manipulações big data.Conhecimento de gerais de estrutura Cloud (AWS, Azure ou GCP).Conhecimento em versionamento de código (como Github).Informações adicionaisPara se destacar nessa posição, seria legal se você também tivesse:Experiência com risco de crédito ou áreas correlatas.Experiência com MLOps e Feature Eng., implementação, homologação, sustentação e otimização.Disponibilidade para atuação em modelo híbrido. Nosso escritório está localizado na cidade de São Paulo/SP.Show moreShow less",N/A,On-site/Hybrid,https://www.linkedin.com/jobs-guest/jobs/api/jobPosting/4255867417,2025-07-23
Junior Data Scientist – Bilingual (ES/PT) (Temporary - 7 months),NielsenIQ,"Cotia, São Paulo, Brazil",1 week ago,"Job DescriptionAre you passionate about applied statistics and rigorous data analysis? This is your opportunity to kick-start your data science career in a collaborative and multicultural environment.As aJunior Data Scientist, you will support the execution of key activities such as Universe Estimation and Sample Design, ensuring they are completed with accuracy, quality, and within established timelines. You will work under the guidance of a technical lead, applying strong statistical knowledge to solve analytical challenges and contribute to data-driven decision-making.ResponsibilitiesExecute tasks related to universe estimation, sample design, feasibility studies, and other analytical processesApply statistical techniques to analyze data and generate actionable insightsEnsure the quality and integrity of the data usedClearly document processes and statistical rationalesCollaborate with multicultural teams in remote environmentsContribute to the continuous improvement of analytical methodologies and toolsQualificationsEducation: Bachelor’s degree in Statistics, Actuarial Science, Applied Mathematics, or related fields involving statistical analysis of large data setsLanguages: Spanish (B2–C1). Advanced English is a plusExperience: At least 1 year of experience using Python for data analysis. Experience with surveys or market research is a plusTools: Proficiency in Python, advanced Excel, and PowerPoint. Experience with data visualization tools is desirableSkills: Analytical thinking, curiosity, attention to detail, and ability to work in remote, multicultural teamsLocation: BrazilPlease upload your résumé in English or Spanish.Please note that this is a temporary position for a 7-month project, which may be extended up to one year. There is also the possibility of becoming a full-time employee depending on your performance and available opportunitiesAdditional InformationWhat We OfferPersonalized career development opportunities within NielsenIQAccess to a global mentoring and recognition programOpportunity to work in a diverse, global, and multicultural environmentShort Fridays – start your weekend early!Our BenefitsFlexible working environmentVolunteer time offLinkedIn LearningEmployee-Assistance-Program (EAP)About NIQNIQ is the world’s leading consumer intelligence company, delivering the most complete understanding of consumer buying behavior and revealing new pathways to growth. In 2023, NIQ combined with GfK, bringing together the two industry leaders with unparalleled global reach. With a holistic retail read and the most comprehensive consumer insights—delivered with advanced analytics through state-of-the-art platforms—NIQ delivers the Full View™. NIQ is an Advent International portfolio company with operations in 100+ markets, covering more than 90% of the world’s population.For more information, visit NIQ.comWant to keep up with our latest updates?Follow us on: LinkedIn | Instagram | Twitter | FacebookOur commitment to Diversity, Equity, and InclusionNIQ is committed to reflecting the diversity of the clients, communities, and markets we measure within our own workforce. We exist to count everyone and are on a mission to systematically embed inclusion and diversity into all aspects of our workforce, measurement, and products. We enthusiastically invite candidates who share that mission to join us. We are proud to be an Equal Opportunity/Affirmative Action-Employer, making decisions without regard to race, color, religion, gender, gender identity or expression, sexual orientation, national origin, genetics, disability status, age, marital status, protected veteran status or any other protected class. Our global non-discrimination policy covers these protected classes in every market in which we do business worldwide. Learn more about how we are driving diversity and inclusion in everything we do by visiting the NIQ News Center: https://nielseniq.com/global/en/news-center/diversity-inclusionShow moreShow less",N/A,Remote,https://www.linkedin.com/jobs-guest/jobs/api/jobPosting/4264914489,2025-07-23
Especialista Cientista de Dados II,Serasa Experian,"São Paulo, São Paulo, Brazil",2 days ago,"Company DescriptionA Serasa Experian é a primeira e a maior Datatech do Brasil. Líder em soluções de inteligência para análise de riscos e oportunidades, com foco nas jornadas de crédito, autenticação e prevenção à fraude. Com tecnologia de ponta, inovação e os melhores talentos, transforma a incerteza do risco na melhor decisão, ajudando pessoas a realizarem seus sonhos e empresas de todos os portes e segmentos a prosperarem.Temos 22.000 pessoas operando em 32 países e a cada dia estamos investindo em novas tecnologias, profissionais talentosos e inovação para ajudar todos os clientes a maximizarem cada oportunidade. Com sede corporativa em Dublin, Irlanda, a Experian está listada na Bolsa de Valores de Londres (EXPN) e compõe o índice FTSE 100.Job DescriptionO DataLab é a unidade de pesquisa e inovação do grupo Experian na América Latina junto com a Serasa Experian no Brasil. Temos oobjetivode ser propositivo, antecipando o futuro,econsultivo, identificando oportunidades de evolução no mercado, por meio de técnicas de Inteligência Artificial e Machine Learning combinada com uso de novas fontes de dados.Criamos soluções inovadoras avançadas, que ajudam clientes e mercado a se prepararem hoje para o amanhã de decisões mais assertivas. Além de termos um olhar 360º para trocar com o que há de melhor no âmbito global, considerando o todoeproduzindo soluções capazes de alcançar grande escalabilidade.Como Especialista em Ciência de Dados, você terá um papel central no time, utilizando sua experiência e conhecimentos em programação, tratamento e análise de dados, modelagem e machine learning para compreender e resolver complexos problemas de negócios. Você será responsável pela liderança técnica de uma equipe de cientistas de dados assim como pela interação da equipe com os times de engenharia e negócios.Suas ResponsabilidadesDesenvolver e implementar análises de dados avançadas e modelos de Machine Learning;Manipular eficientemente grandes volumes de dados;Colaborar com times de Engenharia de Dados, Produtos e de Negócios para entender as necessidades e sugerir soluções orientadas a dados;Explorar continuamente novas fontes de dados e técnicas de análise com foco em melhoria contínua de modelos;Apresentar os resultados e recomendações para stakeholders e times executivos;Se manter atualizado com as tendências em Ciência de Dados e indústrias correlatas;Desenhar roadmaps de desenvolvimento de produtos data-driven em concordância com as necessidades de negócio;Orientar tecnicamente os demais integrantes do time Manter-se atualizado com as últimas pesquisas e avanços em GenAI.QualificationsO que estamos buscando em você?Bacharelado em Ciência de Dados, Estatística, Ciências da Computação ou cursos relacionados;Experiência em modelagem estatística nos setores de crédito e seguros será considerado um diferencial;Sólidos conhecimentos em Python, principalmente em manipulação de dados, bibliotecas de análise (ex. Pandas, Numpy) e frameworks de Machine Learning (ex. scikit-learn, TensorFlow);Experiência na manipulação de grandes bases de dados, em especial armazenadas em ambiente Hadoop (HDFS), processamento distribuído de dados (PySpark) e linguagem SQL;Experiência em desenvolver e implantar modelos de Machine Learning, com bons conhecimentos em validação, tuning e monitoramento de modelos;Habilidade para o entendimento e a resolução de problemas de negócios de forma versátil e ágil;Habilidade de comunicação com pares, áreas parceiras e executivos, incluindo apresentações e tradução de insights em ações de negócios;Colaboração e trabalho em equipe;Aprendizado constante;Inglês avançado;Disponibilidade para atuação híbrida em São Paulo/SP.Desejável:pós-graduação ou mestrado em alguma das áreas correlatas.Additional InformationNa Serasa Experian, acreditamos que a diversidade é fundamental para um ambiente de trabalho mais saudável e inovador, onde todas as pessoas possam trocar experiências e expressar suas ideias. Por isso, contamos com diversas ações para promover um recrutamento inclusivo e apoiar no desenvolvimento profissional das nossas pessoas. Além disso, temos os nossos grupos de afinidade, criados para empoderar e acolher as pessoas de grupos sub-representados:ExperianPride (comunidade LGBTQIAPN+), Ubuntu (equidade racial), Women in Experian (equidade de gênero) e Aspire (pessoas com deficiência) e Connecting Generations (gerações). Venha fazer parte dessa transformação!Experian Careers - Creating a better tomorrow togetherFind out what its like to work for Experian by clicking hereShow moreShow less",N/A,On-site/Hybrid,https://www.linkedin.com/jobs-guest/jobs/api/jobPosting/4215177187,2025-07-23
Cientista de Dados,Stocci,"São Paulo, São Paulo, Brazil",1 month ago,"Procuramos uma pessoa Cientista de Dados para integrar nosso time de Soluções IA e contribuir com o desenvolvimento de análises avançadas, modelos preditivos e algoritmos que impactem diretamente objetivos estratégicos de nossos clientes.Esta pessoa terá um papel relevante na aplicação de machine learning e inteligência artificial, colaborando com equipes multidisciplinares para transformar dados em soluções acionáveis e de alto valor para o negócio. A posição está aberta para profissionais com diferentes níveis de experiência, desde quem está iniciando na área até quem já possui trajetória consolidada.Se você possui paixão por ciência de dados, inovação e busca um ambiente desafiador e dinâmico, queremos conhecer você!Responsabilidades:Integrar ou liderar projetos de ciência de dados, desde a identificação de problemas de negócios até a entrega de soluções analíticas que gerem impacto mensurável.Criar, implementar e manter modelos preditivos e soluções de machine learning, utilizando grandes volumes de dados estruturados e não estruturados.Conduzir análises exploratórias, fornecendo insights estratégicos e recomendações baseadas em dados para apoiar a tomada de decisão.Colaborar com equipes de engenharia de dados, produto e negócios para integrar modelos e algoritmos aos sistemas e fluxos operacionais.Pesquisar e implementar novas técnicas, ferramentas e frameworks em machine learning e inteligência artificial, acompanhando tendências de mercado e tecnologia.Compartilhar boas práticas com o time, promovendo uma cultura de excelência técnica e colaboração.Garantir que as soluções entregues sejam escaláveis, interpretáveis e alinhadas às melhores práticas de ciência de dados e engenharia.Monitorar e avaliar o desempenho dos modelos implementados, propondo melhorias contínuas.Requisitos:Graduação completa ou em andamento em Ciência da Computação, Estatística, Matemática, Engenharia ou áreas correlatas.Programação em Python ou R.Bibliotecas e frameworks de análise e modelagem de dados (ex.: Pandas, Scikit-learn, TensorFlow, etc.).Fundamentos de estatística, probabilidade e modelagem preditiva.Manipulação de bancos de dados relacionais (SQL) e/ou não relacionais.Ferramentas de visualização de dados (Power BI, Tableau ou similares).Diferenciais:Experiência prática com Deploy e monitoramento de modelos em produção.Vivência com ambientes de computação em nuvem (AWS, Azure ou GCP).Conhecimento em frameworks de MLOps.Participação em projetos estratégicos de ciência de dados aplicados ao negócio.Perfil profissional:Visão analítica e foco em resultados.Curiosidade intelectual e disposição para explorar novas abordagens e tecnologias.Capacidade de trabalhar em equipe, colaborar com diferentes áreas e comunicar soluções técnicas de forma clara.Proatividade, organização e autonomia para conduzir projetos.Facilidade para lidar com desafios complexos, propondo soluções criativas e práticas.Se você se identificou com a oportunidade, inscreva-se! Valorizamos potenciais, trajetórias diversas e acreditamos no desenvolvimento contínuo.Show moreShow less",N/A,On-site/Hybrid,https://www.linkedin.com/jobs-guest/jobs/api/jobPosting/4242248792,2025-07-23
