title,company,location,posted,description,applicants,work_mode,link,data_coleta
Cientista de Dados Sr.,PicPay,"São Paulo, São Paulo, Brazil",2 weeks ago,"Sobre o PicPayCom mais de dez anos de história, o PicPay é um ecossistema completo de serviços financeiros e não-financeiros que tem como objetivo atender as necessidades diárias de milhares de pessoas e negócios, tornando-se a sua principal conta do dia a dia.Fundada em Vitória (ES), a empresa já conta com mais de 35 milhões de clientes ativos e faz parte do grupo J&F, um dos maiores conglomerados empresariais do Brasil. A companhia atua em diversas frentes, como Serviços Financeiros para Pessoa Física, Serviços Financeiros para Pessoa Jurídica, Investimentos e PicPay Shop.Pautados pela nossa cultura, seguimos no propósito de dar muito mais pique para a vida de milhões de brasileiros. Conheça nossos valores: Atitude de Dono(a), Disciplina, Determinação, Disponibilidade, Simplicidade, Humildade e Franqueza.O respeito, a ética, a busca pela equidade e a valorização da pluralidade são elementos inegociáveis e fazem parte da prática no nosso dia a dia aqui no PicPay. Por isso, esta vaga está aberta para todas as pessoas, independente de gênero, religião, etnia, deficiência, idade, orientação sexual ou qualquer outro fator.Sobre a vaga:Estamos em busca de um(a) Cientista de Dados para compor nosso time de Prevenção à Fraude, com foco no desenvolvimento de soluções de machine learning que garantam decisões seguras e eficientes em tempo real para o problema de fraude transacional.Profissional responsável por atuar de ponta a ponta na construção e manutenção de modelos preditivos voltados para detecção e mitigação de fraudes que garantam a melhor eficiência para o negócio.Responsabilidade e atribuições:Atuar em todo o ciclo de vida de modelos de machine learning para prevenção à fraude, incluindo definição de público, construção de target, engenharia de features e modelagem.Desenvolver, manter e disponibilizar feature stores para uso em modelagem e produção.Automatizar pipelines de modelagem e reavaliação periódica de modelos.Avaliar e selecionar algoritmos com base em performance, estabilidade e impacto no negócio.Criar e manter APIs para scoring em tempo real e em batch.Homologar modelos em produção, garantindo conformidade com os backtests e expectativas de negócio.Trabalhar em parceria com times de tecnologia para deploy e sustentação dos modelos em produção.Assegurar a implementação e manutenção de monitoramento contínuo dos modelos.Documentar os processos de desenvolvimento e implantação dos modelos e features.Requisitos e qualificações:Modelagem estatísticaConhecimento e experiência com modelos de classificaçãoPySparkPythonMLFlowGitHubAWSConhecimento e experiência sobre APIs e banco de dados produtivos (diferencial)O que oferecemos:Saúde e Bem-estarAssistência Médica e Odontológica;Seguro de Vida;Programa Lado a Lado, com apoio jurídico, social, psicológico e financeiro;TotalPass.Alimentação/ Mobilidade ou Teletrabalho:Cartão de crédito PicPay Benefícios, com ampla aceitação, onde você recebe seu saldo de Alimentação/Refeição e Mobilidade ou Teletrabalho (de acordo com o seu contrato de trabalho).Licença Paternidade e Maternidade:Licença Maternidade estendida de 6 meses, e de Paternidade também estendida de 20 dias.Programa ""Novo Ser"", que acompanha nossas mamães durante toda a gestação e no retorno da licença. Falando nisso, ao retornar da licença maternidade, as mamães ainda contam com a ajuda do Auxílio Creche e também os papais que possuem guarda unilateral ou compartilhada.Reconhecemos resultados: PPR-Participação nos Resultados do PicPay.#VemserPicpayLover #PicpayShow moreShow less",N/A,On-site/Hybrid,https://www.linkedin.com/jobs-guest/jobs/api/jobPosting/4212544406,2025-07-12
Cientista de Dados,IBM,"São Paulo, São Paulo, Brazil",13 hours ago,"IntroductionColetar, gerenciar e modelar um grande volume de dados estruturados ou não-estruturados.Necessário conhecimentos em estatísticas, matemática e técnicas analíticas.Capacidade de navegar entre negócios e técnicos. Linguagens e Frameworks: Python: bibliotecas como Pyomo, DEAP, Scikit-Optimize. Bibliotecas e Estatística: Scikit-learn, TensorFlow/PyTorch (se necessário incorporar modelos ML), Statsmodels para análises estatísticas. Ambientes de Desenvolvimento: Jupyter Notebook, VS Code. Tempo Experiência: 1 a 2 anosYour Role And ResponsibilitiesColetar, gerenciar e modelar um grande volume de dados estruturados ou não-estruturados.Necessário conhecimentos em estatísticas, matemática e técnicas analíticas.Capacidade de navegar entre negócios e técnicos. Linguagens e Frameworks: Python: bibliotecas como Pyomo, DEAP, Scikit-Optimize. Bibliotecas e Estatística: Scikit-learn, TensorFlow/PyTorch (se necessário incorporar modelos ML), Statsmodels para análises estatísticas. Ambientes de Desenvolvimento: Jupyter Notebook, VS Code. Tempo Experiência: 1 a 2 anosRequired Technical And Professional ExpertiseColetar, gerenciar e modelar um grande volume de dados estruturados ou não-estruturados.Necessário conhecimentos em estatísticas, matemática e técnicas analíticas.Capacidade de navegar entre negócios e técnicos. Linguagens e Frameworks: Python: bibliotecas como Pyomo, DEAP, Scikit-Optimize. Bibliotecas e Estatística: Scikit-learn, TensorFlow/PyTorch (se necessário incorporar modelos ML), Statsmodels para análises estatísticas. Ambientes de Desenvolvimento: Jupyter Notebook, VS Code. Tempo Experiência: 1 a 2 anosShow moreShow less",N/A,On-site/Hybrid,https://www.linkedin.com/jobs-guest/jobs/api/jobPosting/4263542326,2025-07-12
Cientista de Dados Pleno,Jeitto,"São Paulo, São Paulo, Brazil",1 week ago,"Há 10 anos, desafiamos o mercado financeiro com soluções acessíveis e inovadoras. Aprovamos até 2x mais que outros players, com tecnologia que combina mais de 400 fatores para oferecer crédito rápido e sem complicação, usando só CPF e celular.No Jeitto, dar um jeito é pra hoje.Temos urgência porque nosso cliente tem urgência. É por isso que buscamos, todo dia,dar um jeito pra que quem faz muito com pouco continue fazendo mais e melhor sempre.Como Cientista de Dados Pleno, você terá um papel crucial no desenvolvimento e implementação de modelos preditivos que ajudam a identificar perfis de clientes e definir as melhores abordagens de cobrança.Nesta posição você irá:Explorar dados internos e externos para identificar padrões e insights relevantes para as estratégias de cobrança.Colaborar na criação de variáveis e na manutenção de repositórios para uso em modelos de cobrança.Aplicar técnicas de modelagem preditiva e Machine Learning (com orientação) para resolver problemas relacionados à recuperação de crédito, como propensão à inadimplência e melhor canal de contato.Apoiar na análise de performance de modelos preditivos de cobrança, auxiliando na identificação de oportunidades de melhoria.Trabalhar em conjunto com os times de Cobrança, Produto e Tecnologia para entender as necessidades do negócio e traduzi-las em soluções baseadas em dados.Auxiliar na comunicação de resultados e insights para stakeholders, de forma clara e compreensível.Para essa posição, é importante que você tenha:Graduação em Estatística, Matemática, Engenharia, Computação ou áreas correlatas.Experiência no desenvolvimento de modelos preditivos, preferencialmente em risco de crédito, cobrança ou áreas afins em instituições financeiras.Conhecimento prático em Machine Learning (e.g., Regressão Logística, Árvores de Decisão, Random Forest) e familiaridade com ferramentas como scikit-learn.Experiência prática com Python ou R e bons conhecimentos em bancos de dados (SQL).Noções sobre as melhores práticas para implantação e monitoramento de performance de modelos.Noções de Big Data e tecnologias de cloud computing.Conhecimento básico em regulamentações do setor financeiro brasileiro, como a LGPD.Vai ser um diferencial se você tiver:Inglês intermediário (para leitura de documentação técnica).Experiência com dados alternativos (dados transacionais, não convencionais, SDK, mídias sociais, etc.) e metodologias de integração de dados, especialmente para o contexto de cobrança.Conhecimento e aplicação de técnicas de otimização em estratégias de cobrança.Conhecimento de ferramentas de visualização como Tableau.Experiência em trabalhar em startups ou fintechs, com ambientes dinâmicos e colaborativos.O Jeitto acredita e celebra o poder da diversidade em todas as suas formas e pluralidades como ferramenta de desenvolvimento, crescimento e transformação. Reafirmamos nosso compromisso com a inclusão e estamos empenhados com a criação de um ambiente de igualdade de oportunidades para todos os recortes sociais.Show moreShow less",N/A,On-site/Hybrid,https://www.linkedin.com/jobs-guest/jobs/api/jobPosting/4259924115,2025-07-12
Engenheiro de Inteligência Artificial,Cliente FC,Greater São Paulo Area,2 months ago,"Estamos contratando Engenheiro de Inteligência Artificial!Presencial - São PauloRequisitos"" Formação em Ciência da Computação, Matemática ou áreas correlatas."" IA"" MLOps e deploy"" AWS, GCP, Azure"" Bancos de dados para IA (vector databases, NoSQL, etc.).Diferenciais"" Experiência em projetos de telecomunicações, com foco em soluções de IA aplicadas ao setor."" Conhecimento em metodologias ágeis e gestão de projetos.Show moreShow less",N/A,On-site/Hybrid,https://www.linkedin.com/jobs-guest/jobs/api/jobPosting/4212783316,2025-07-12
Analista Cientista de Dados Sênior,Experian,"São Paulo, São Paulo, Brazil",2 weeks ago,"A Serasa Experian é a primeira e a maior Datatech do Brasil. Líder em soluções de inteligência para análise de riscos e oportunidades, com foco nas jornadas de crédito, autenticação e prevenção à fraude. Com tecnologia de ponta, inovação e os melhores talentos, transforma a incerteza do risco na melhor decisão, ajudando pessoas a realizarem seus sonhos e empresas de todos os portes e segmentos a prosperarem.Temos 22.000 pessoas operando em 32 países e a cada dia estamos investindo em novas tecnologias, profissionais talentosos e inovação para ajudar todos os clientes a maximizarem cada oportunidade. Com sede corporativa em Dublin, Irlanda, a Experian está listada na Bolsa de Valores de Londres (EXPN) e compõe o índice FTSE 100.Job DescriptionEstamos procurando uma pessoa Analista Cientista de Dados Sênior para se juntar à nossa equipe.A pessoa candidata ideal terá experiência significativa em análise de dados, modelagem estatística e machine learning, além de habilidades avançadas em programação e manipulação de grandes volumes de dados. Este (a) profissional será responsável por liderar projetos de análise de dados, desenvolver modelos preditivos e fornecer insights acionáveis para apoiar a tomada de decisões estratégicas.Você será responsável por:Manutenção e criação de novos modelos de machine learning;Estudos e análises olhando a ótica de insights para negócios;Captação e integração de dados externos via webscrapping e IA;Identificação de padrões internos e como se relacionam com índices e movimentos macroeconômicos;Apresentar resultados e recomendações para stakeholders de diferentes níveis hierárquicos;Testes de hipóteses;Manter-se atualizado com as últimas tendências e tecnologias em ciência de dados;Realizar análises exploratórias e descritivas de grandes conjuntos de dados;Colaborar com equipes multidisciplinares para identificar oportunidades de melhoria e inovação.QualificationsO que buscamos em você?Graduação em Ciência de Dados, Estatística, Matemática, Computação ou área relacionada;Conhecimento Databricks;Vivência em ambiente Azure será um diferencial;Proficiência em linguagens de programação como Python e SQL;Conhecimento em Analytics e Machine learning;Habilidade técnica e de negócios;Disponibilidade para atuação híbrida em São Paulo.Additional InformationNa Serasa Experian, acreditamos que a diversidade é fundamental para um ambiente de trabalho mais saudável e inovador, onde todas as pessoas possam trocar experiências e expressar suas ideias. Por isso, contamos com diversas ações para promover um recrutamento inclusivo e apoiar no desenvolvimento profissional das nossas pessoas. Além disso, temos os nossos grupos de afinidade, criados para empoderar e acolher as pessoas de grupos sub-representados:ExperianPride (comunidade LGBTQIAPN+), Ubuntu (equidade racial), Women in Experian (equidade de gênero) e aspire (pessoas com deficiência) e Connecting Generations (gerações).Venha fazer parte dessa transformação!Experian Careers - Creating a better tomorrow togetherFind out what its like to work for Experian by clicking hereShow moreShow less",N/A,On-site/Hybrid,https://www.linkedin.com/jobs-guest/jobs/api/jobPosting/4256529685,2025-07-12
Visagio Talentos - Estágio: Data Science e IA Generativa SP,Visagio,"São Paulo, São Paulo, Brazil",13 hours ago,"Destinado a universitários dos cursos de Engenharias, Administração, Economia, Estatística, Matemática, Ciência da Computação e Sistemas de Informação, com foco de atuação em projetos envolvendo Ciência de Dados e IA Generativa (Inteligência Artificial, Machine Learning, NLP, IA Generativa, Otimização, Simulação, entre outros). Você trabalhará com um time multidisciplinar, direcionado ao desenvolvimento de análises e à implantação de soluções baseadas em dados para geração de valor para nossos clientes.Responsabilidades e atribuiçõesIdentificar oportunidades de melhoria em áreas do negócio, propondo soluções baseadas em dados;Realizar análises de dados para apoiar diagnósticos e tomadas de decisões;Desenvolver e implantar soluções baseados em Machine Learning, NLP, IA Generativa, Otimização, Simulação, entre outros;Acompanhar e gerenciar projetos através de metodologias ágeis;Desenvolvimento interpessoal através de cursos, contato direto com clientes e trabalho em equipe.Requisitos e qualificaçõesGraduandos, a partir do 5º semestre, dos cursos de Engenharias, Administração, Economia, Estatística, Matemática, Ciência da Computação e Sistemas de Informação;Bom raciocínio lógico, capacidade analítica e criatividade para propor e implantar as soluções;Visão crítica, habilidade de comunicação e apresentação, e bom relacionamento interpessoal;Rápido aprendizado, com alta curiosidade para aprender continuamente sobre novas tecnologias, além de vontade de fazer a diferença;Preferível experiência em atividades extracurriculares (ex: empresa júnior, PET, iniciação científica, etc).Recomendado o conhecimento dos conceitos de Ciência de Dados, NLP, IA Generativa, Estatística, Banco de Dados e SQL, além de domínio de linguagens de programação (Python, R ou outros).Informações adicionaisConforme necessidade, alguns candidatos, que concluírem todas as etapas online, poderão ser convocados antecipadamente para a etapa de entrevistas.Show moreShow less",N/A,On-site/Hybrid,https://www.linkedin.com/jobs-guest/jobs/api/jobPosting/4263543354,2025-07-12
Analista Júnior de Dados - Prevenção à Fraude,Shopee,"São Paulo, São Paulo, Brazil",2 weeks ago,"About The TeamSobre a ShôAqui na Shô, acreditamos que cada membro de nossa equipe é fundamental para o nosso sucesso, e que diversidade de perspectivas e vivências são essenciais para movimentar nosso negócio e impulsionar o nosso propósito de mudar o mundo para melhor. Fazer parte do nosso time é a oportunidade de se desenvolver dentro de uma cultura de muita agilidade. Se você ama assumir grandes responsabilidades e fazer o que nunca foi feito, a Shô é seu lugar. Aqui você terá grandes desafios, trabalhará em colaboração com um time diverso e contribuirá para o futuro do e-commerce no Brasil, criamos impacto positivo na vida de milhões de pessoas.Modelo de TrabalhoAdotamos um modelo de trabalho híbrido, esse modelo permite que as pessoas ajustem seu ambiente de trabalho de acordo com suas necessidades pessoais, ao mesmo tempo em que promove a colaboração e interação no escritório.Qual será a sua missãoEstamos buscando uma (a) analista júnior de dados para apoiar a tomada de decisões relacionadas às iniciativas de prevenção à fraudes. Com a orientação do gestor, esse profissional ajudará a propor abordagens criativas, buscar dados e interpretar informações estatísticas para responder questões complexas e gerar insumos importantes para as discussões do time.Job DescriptionComo será o seu dia a diaEstruturar e conduzir análises de dados para apoiar a construção de novas regras e modelos de fraude ou propor mudanças nas regras e modelos existentes;Construir análises de impacto para justificar a implementação de novas funcionalidades que possam melhorar nossas defesas contra fraude;Estruturar, construir e manter dashboards para acompanhar ativamente as perdas por fraude e identificar riscos potenciais;Apoiar o gerente na criação de apresentações impactantes para comunicar efetivamente as principais descobertas dentro de seu escopo;Buscar outras equipes (dentro ou fora da equipe de Prevenção à Fraude) para obter as melhores práticas relacionadas à análise de dados e pedir apoio quando necessário;Apoiar outras equipes da Shopee fornecendo informações, conduzindo análises e resolvendo problemas pontuais que estejam dentro de seu escopo de trabalho;Ajudar na criação de metas para fraude no marketplace, monitorar indicadores e enviar alertas quando necessário (por exemplo, para mudar prioridades visando alcance de metas);Realizar estudos de benchmarking externos para reunir as melhores práticas relacionadas à Análise de Dados na Prevenção à Fraude.RequirementsO que você precisa para assumir o desafioFormação em andamento ou completa em cursos de Engenharia, Ciências da Computação, Administração de Empresas ou áreas relacionadas;Conhecimento intermediário no Pacote Office, principalmente Excel/Sheets;Conhecimento avançado em SQL (Experiência em outras linguagens de programação é um diferencial)Experiência em Prevenção de Fraude é um diferencial;Inglês avançado (será testado durante o processo de seleção).BenefíciosAssistência médica e odontológica, estendendo-se aos dependentes;Parceira com Wellhub (Gympass) e TotalPass;Vale Refeição/Alimentação flexível;Vale Transporte ou, Vale Mobilidade;Benefício flexível;Parceria com o app Zenklub;Bônus anual discricionário, atrelado à performance.VEM FAZER HISTÓRIA COM A GENTE.O QUE TE FAZ ÚNICO, NOS FAZ MELHORES!Show moreShow less",N/A,On-site/Hybrid,https://www.linkedin.com/jobs-guest/jobs/api/jobPosting/4150286242,2025-07-12
Data Scientist,Bunge,"São Paulo, São Paulo, Brazil",5 days ago,"Location : BAL - SEDECity : Sao PauloState : São Paulo (BR-SP)Country : Brazil (BR)Requisition Number : 38806We are seeking a highly motivated and experienced Lead Data Scientist with strong expertise in optimization to join our growing team. As Lead Data Scientist, you will be responsible for leading the construction of optimization models to solve business problems and communicate the result to the business stakeholders. You will also be responsible for working with cross-functional teams to identify and prioritize data analytics initiatives. Bunge is committed to operating and thriving in the digital world – creating world class agile teams where teammates are empowered and encouraged to collaborate and test and learn to succeed.At Bunge, people don’t just come here to work, they come here to grow – solving challenges that directly impact the world with a diverse team of thinkers and doers. Most importantly, in all we do we live our values:Act as One Team by fostering inclusion, collaboration, and respectDrive for Excellence by being agile, innovative and efficientDo What's Right by acting safely, ethically, and sustainablyOverview:The Data Scientist applies strong expertise in machine learning, data mining, and information retrieval to design, prototype, and build next generation advanced analytics engine and services. The data scientist collaborates with translators to define technical problem statement and hypothesis to test; develops efficient and accurate analytical models that mimic business decisionsResponsibilities:Design, create, test and implement complex models and algorithms that drive analytical solutions throughout the organizationConduct advanced statistical and other analysis to provide actionable insights, identify trends, and measure performance.Collaborate with translators and understands business problems to implement scalable and sustainable solutionsCoordinate with MIS, Digital Specialists, and Data Engineers to deliver holistic analytical solutionsSupport translators in communicating the design, functioning and output of the analytical models/solutions developedEnsure timely analysis and testing for regular maintenance of solutions over timeQualifications/Requirements:Post graduate degree in STEM field or Bachelor’s degree with 5-7 years' experience as Data Scientist IIProficient in programming language like Python or RStrong foundations in math, analytics and computer science, knowledge of machine learning methods, statistical models, advanced data science programmingAvoid greenhorn mistakes, avoid logical flaws in the models, revisit high-performing systems, write reusable code, build resilient data pipelines in the cloud environment, and prepare immaculate data.Deep understanding of Database designs. Prior course work is a plusCreative & innovative thinking; demonstrating drive to solve problems.Act as a great team player and pitch new ideas, take responsibility to improve code quality and impact.Has optimization background or at least 3 years of experience with optimization modelingHas at least 1 year of experience in coordinating technical teamsProficient in data science, optimization, machine learning, Python, R, SQL, data analysis, analytical skills, teamwork, and communication skills.Can translate business needs into optimization components (e.g., Constraints, penalties, and objective functionDevelop business awareness of use cases and help them to understand the necessary concepts of data science and optimization to ensure better communication across functions.Bunge (NYSE: BG) is a world leader in sourcing, processing and supplying oilseed and grain products and ingredients. Founded in 1818, Bunge’s expansive network feeds and fuels a growing world, creating sustainable products and opportunities for more than 70,000 farmers and the consumers they serve across the globe. The company is headquartered in St. Louis, Missouri and has 25,000 employees worldwide who stand behind more than 350 port terminals, oilseed processing plants, grain facilities, and food and ingredient production and packaging facilities around the world.Bunge is an Equal Opportunity Employer. All qualified applicants will receive consideration for employment without regard to race, color, religion, sex, sexual orientation, gender identity, gender expression, transgender status, national origin, citizenship, age, disability or military or veteran status, or any other legally protected status. Bunge is an Equal Opportunity Employer. Minorities/Women/Veterans/DisabledShow moreShow less",N/A,On-site/Hybrid,https://www.linkedin.com/jobs-guest/jobs/api/jobPosting/4168677259,2025-07-12
AI Specialist,MYKE SHARE,"São Paulo, São Paulo, Brazil",2 weeks ago,"Estamos contratando: Especialista em Software baseado em AIEstamos em busca de um profissional altamente qualificado e experiente para se juntar à nossa equipe como Especialista em Software baseado em AI. Este é um papel fundamental para impulsionar a inovação e o desenvolvimento de soluções inteligentes em nossa organização.Requisitos:• Experiência comprovada no desenvolvimento e implementação de software utilizando inteligência artificial.• Experiência em engenharia de software / desenvolvimento.• Conhecimento profundo sobre algoritmos de aprendizado de máquina e redes neurais.• Experiência em trabalhar com grandes volumes de dados e otimização de modelos.• Habilidade em resolver problemas complexos e inovar constantemente em ambientes dinâmicos.Localização:• O candidato deve residir em São Paulo ou estar disposto a se mudar para a cidade.O que oferecemos:• Oportunidade de trabalhar em projetos inovadores.• Ambiente colaborativo e focado no desenvolvimento contínuo.• Pacote de benefícios competitivo e participação nos lucros.Se você é apaixonado por IA e tem o perfil que buscamos, envie seu currículo para nossa equipe de recrutamento.Junte-se a nós e faça parte de um futuro tecnológico inovador!#Contratação #AI #Tecnologia #DesenvolvimentoDeSoftware #InteligenciaArtificial #Vaga #SãoPaulo #Carreira #InovaçãoShow moreShow less",N/A,On-site/Hybrid,https://www.linkedin.com/jobs-guest/jobs/api/jobPosting/4253918837,2025-07-12
