title,company,location,posted,description,applicants,work_mode,link,data_coleta
"Analista de Melhoria Contínua, ACES",Amazon,"Cajamar, São Paulo, Brazil",1 week ago,"DescriptionA equipe da Amazon Brasil está em busca de um(a) Analista de Melhoria Contínua para integrar o time de melhoria contínua. Esta pessoa será responsável por liderar iniciativas de otimização de processos por meio de Kaizens, realizar análises profundas (dive deep) para identificação e solução de problemas operacionais, além de apoiar a gestão de dados e processos do Fulfillment Center (FC), garantindo desempenho, eficiência e conformidade das operações.Essa pessoa atuará em um ambiente altamente colaborativo e multidisciplinar, trabalhando de forma próxima à operação e às áreas de suporte. Espera-se que prospere e entregue resultados em um ambiente dinâmico, acelerado e com alto grau de ambiguidade, onde a análise de dados e a tomada de decisão baseada em fatos são fundamentais para o sucesso do negócio.Key job responsibilitiesRealizar análises detalhadas (dive deep) para identificar oportunidades de melhoria nos processos operacionais;Conduzir investigações de causa raiz para problemas operacionais, utilizando metodologias estruturadas;Propor e implementar soluções simples, eficazes e sustentáveis para problemas complexos, com base em dados e observações in loco (gemba);Desenvolver, manter e aprimorar dashboards, relatórios e indicadores de desempenho operacional;Analisar dados provenientes de diferentes fontes, identificar tendências relevantes e apoiar a tomada de decisões do negócio;Apoiar a configuração e o uso de sistemas e ferramentas com foco na otimização de processos;Criar e implementar ferramentas analíticas que contribuam para o aumento da eficiência operacional;Atuar de forma colaborativa com diferentes áreas para garantir a execução e a sustentação das melhorias implementadas.Basic QualificationsGraduação completa ou em andamento em Engenharia ou áreas correlatas;Experiência com melhoria contínua, análise de processos, operações ou áreas similares;Experiência no uso de Excel ou ferramentas similares para manipulação e visualização de dados;Capacidade de interpretar dados operacionais e transformá-los em ações práticas de melhoria;Conhecimento básico de SQL ou outras ferramentas de consulta e manipulação de dados.Preferred QualificationsExperiência em ambientes logísticos, industriais, centros de distribuição ou operações de grande escala;Conhecimento em metodologias de melhoria contínua, como Lean, Kaizen e/ou Six Sigma;Experiência com ferramentas de BI (ex.: Power BI, QuickSight);Experiência no desenvolvimento e manutenção de dashboards e indicadores de desempenho (KPIs);Vivência em projetos de otimização de processos e redução de desperdícios;Inglês intermediário para leitura de documentações e interação com times globaisOur inclusive culture empowers Amazonians to deliver the best results for our customers. If you have a disability and need a workplace accommodation or adjustment during the application and hiring process, including support for the interview or onboarding process, please visit https://amazon.jobs/content/en/how-we-hire/accommodations for more information. If the country/region you’re applying in isn’t listed, please contact your Recruiting Partner.Company- Amazon Servicos de Varejo do Brasil Ltda.Job ID: A3161395Show moreShow less",N/A,On-site/Hybrid,https://www.linkedin.com/jobs-guest/jobs/api/jobPosting/4363846004,2026-01-25
Especialista em Ciências de Dados | Vaga afirmativa para mulheres,Cielo,"Barueri, São Paulo, Brazil",2 weeks ago,"Somos mais que uma máquina, somos pessoas que transformam ecriam infinitas possibilidades.Trabalhamos parasimplificar e impulsionar negócios para todas as pessoas, oferecendo soluções financeiras inteligentes. Aqui, investimos emtecnologia, promovemosdesenvolvimentoe fomentamos ainovaçãopara criar novos caminhos possíveis e gerar impacto positivo no mundo.Na Cielo, a gente trabalha comautonomiapara escrever nossa própria jornada,liberdadepara ser quem a gente é, e a oportunidade defazer acontecer. Somos um time quesonha no plural, oferecendo uma experiência completa e focando no bem-estar físico e mental de nossos mais de 7.000 colaboradores e suas famílias.Acreditamos nainclusão e acolhimentode todas as pessoas, com suas singularidades e diversidade de vivências.Bora realizar seus sonhos com a gente!Conheça mais sobre a área Gerência de People Analytics:A Gerência de People Analytics tem como missão ser a área de referência no mercado atuando através de dados na estratégia de pessoas na Cielo. #VemPraCima #VemPraCieloResponsabilidades e atribuiçõesSeu desafio será:Coletar, limpar, explorar e analisar dados de pessoas relacionados aos temas de RH, exemplos: recrutamento, performance, engajamento, turnover, dados de áreas comerciais, entre outros;Desenvolver modelos estatísticos preditivos / prescritivos (ex.: propensão de rotatividade; análise de produtividade, clustering de perfis de colaboradores, etc);Criação de dashboards e visualizações de dados, garantir que esses dashboards respondam a perguntas estratégicas e estejam atualizados com dados confiáveis;Elaborar estudos de correlação e casualidade (ex: impacto de turnover sobre performance);Trabalhar com diferentes fontes de dados, de diversos sistemas, conhecimentos de automatizações de fluxo e garantir a qualidade dos dados/informações;Estabelecer parcerias internas e com áreas de negócio com o intuito de resolver problemas complexos e propor soluções baseadas em dados.Pré-RequisitosO que o #TimeCielo espera de você?Formação superior completa em disciplina quantitativa, como Estatística, Matemática, Ciência de Dados, Economia, Finanças, Engenharia, Ciência da Computação e afins;Sólida experiência como Especialista de Dados ou função semelhante envolvendo extração de dados, análise, modelagem estatística e visualização de dados;Sólida experiência utilizando linguagens de consulta de dados e lógica de programação (exemplo: SQL, Python, R, entre outras linguagens);Análise estatística prática com uma sólida compreensão e utilização dos fundamentos de análise descritiva, probabilidade, regressão, inferência, testes de hipóteses, modelos de otimização e métodos quantitativos e/ou machine learning;Perfil analítico, raciocínio lógico e de resolução de problemas, com grande capacidade de manipulação de dados estruturados e não estruturados, para simplificação de análises e processos;Desenvolvimento de apresentações executivas para liderança e áreas internas da companhia.Informações adicionaisPor que viver infinitas possibilidades ao nosso lado?Assistência Médica e Odontológica;Remuneração Variável Anual (PPR);Auxílio Refeição e Alimentação;Fretado/vale-transporte ou estacionamento;Modelo Híbrido;Auxílio Trabalho Remoto;Seguro de Vida;Seguro residencial e automóvel;Assistência funeral familiar;Previdência Privada;Canal de apoio à especialistas (nutrição, psicologia, ginecologia, etc);Campanha de Vacinação;Acesso à diversos cursos em nossa plataforma Educa;Wellhub;Programa de Gestação Saudável;Licença Maternidade e Paternidade estendida;Auxílio Creche;Day Off de Aniversário;Dress Code Flexível;Horário Flexível;Sexta curta;Almoço estendido (1h30).Show moreShow less",N/A,On-site/Hybrid,https://www.linkedin.com/jobs-guest/jobs/api/jobPosting/4281729684,2026-01-25
Cientista de dados Pleno,Cielo,"Barueri, São Paulo, Brazil",2 weeks ago,"Somos mais que uma máquina, somos pessoas que transformam ecriam infinitas possibilidades.Trabalhamos parasimplificar e impulsionar negócios para todas as pessoas, oferecendo soluções financeiras inteligentes. Aqui, investimos emtecnologia, promovemosdesenvolvimentoe fomentamos ainovaçãopara criar novos caminhos possíveis e gerar impacto positivo no mundo.Na Cielo, a gente trabalha comautonomiapara escrever nossa própria jornada,liberdadepara ser quem a gente é, e a oportunidade defazer acontecer. Somos um time quesonha no plural, oferecendo uma experiência completa e focando no bem-estar físico e mental de nossos mais de 7.000 colaboradores e suas famílias.Acreditamos nainclusão e acolhimentode todas as pessoas, com suas singularidades e diversidade de vivências.Conheça mais sobre a área:Nossa missão é analisar dados e perfis, garantindo o direcionamento correto dos produtos de prazo para os clientes e otimizando a conversão da força comercial. Utilizamos técnicas avançadas de modelagem analítica e estatística para assegurar rentabilidade e gerar valor estratégico para a companhia.Bora realizar seus sonhos com a gente!Juntos com você, em infinitas possibilidades.Responsabilidades e atribuiçõesTem lugar para você nesse propósito:Apoiar análises do time de modelagem por meio do desenho de construção de features para produtos de prazo no varejo.Mapear necessidades das áreas de negócio, avaliar requisitos de dados, construir códigos analíticos e acompanhar a implementação e resultados das análises.Desenvolver e implementar modelos analíticos utilizando técnicas estatísticas, identificando padrões, tendências e oportunidades de otimização.Colaborar com equipes multidisciplinares para traduzir problemas de negócio em soluções de modelagem de dados.Interpretar resultados dos modelos e comunicar insights de forma clara.Requisitos e qualificaçõesO que o #TimeCielo espera de você?Formação superior em Estatística, Matemática, Engenharia, Ciência da Computação, Economia ou áreas correlatas.Experiência com analises estatísticas.Conhecimento em linguagens de programação como Python e ferramentas de manipulação de dados (SQL).Familiaridade com técnicas estatísticas e de análise de grande volume de dados.Capacidade de traduzir dados em insights acionáveis e comunicar resultados de forma clara.Desejável experiência com ferramentas de visualização (Power BI, Tableau) e ambientes de Big Data.Informações adicionaisPor que viver infinitas possibilidades ao nosso lado?Assistência Médica e Odontológica;Remuneração Variável Anual (PPR);Auxílio Refeição e Alimentação;Fretado/vale-transporte ou estacionamento;Modelo Híbrido;Auxílio Trabalho Remoto;Seguro de Vida;Seguro residencial e automóvel;Assistência funeral familiar;Previdência Privada;Canal de apoio à especialistas (nutrição, psicologia, ginecologia, etc);Campanha de Vacinação;Acesso à diversos cursos em nossa plataforma Educa;Wellhub;Programa de Gestação Saudável;Licença Maternidade e Paternidade estendida;Auxílio Creche;Day Off de Aniversário;Dress Code Flexível;Horário Flexível;Sexta curta;Almoço estendido (1h30).Show moreShow less",N/A,On-site/Hybrid,https://www.linkedin.com/jobs-guest/jobs/api/jobPosting/4337899562,2026-01-25
Engenheiro(a) de Software IA,Vivo (Telefônica Brasil),Greater São Paulo Area,4 days ago,"Descrição da vagaVP TIDiretoria de Dados e Inteligência ArtificialLocal: São Paulo - SP | HíbridoVocê quer fazer parte de um time de inovação disruptiva e constante, trabalhando com volume de dados quase “infinito” e ajudando na transformação digital da Vivo? Então, seu time é o de Inteligência Artificial. Aqui você trabalhará com projetos e produtos ligados à Aura, plataforma de Inteligência Artificial da Vivo.Aqui você terá a oportunidade de pesquisar e criar, desenvolver e consolidar o roadmap futuro e backlog de produtos ligados à Aura, a IA da Vivo, e seus vários projetos, além de medir e garantir que nossos produtos apresentam resultados sólidos.Responsabilidades e atribuiçõesProjetar, desenvolver e manter APIs, SDKs e serviços de plataforma (Node.js/Nest.js e/ou Python).Implementar integrações e camadas de orquestração para agentes e serviços de IA.Garantir segurança, performance, resiliência e observabilidade em sistemas distribuídos (cloud‑native).Colaborar com squads e apoiar decisões técnicas (design docs/RFCs, code reviews).Evoluir CI/CD (Azure DevOps), boas práticas de DevOps/Infra as Code e automações.Fortalecer a cultura de qualidade (tests, linters, padrões).Construção de microserviços com comunicação síncrona (REST/gRPC) e assíncrona (mensageria, SSE/WebSockets).Kubernetes e Docker em produção; troubleshooting de rede, storage, escalabilidade.Observabilidade (logs, métricas, tracing, alertas) e resposta a incidentes.Automação de rotinas e integrações (scripts de inferência, tratamento de dados, testes de API).Manipulação de requests/JSON e contextos de prompt em soluções de IARequisitos e qualificaçõesBackend sólido em Node.js (preferencialmente Nest.js) e/ou Python.Arquitetura de microserviços e desenho de APIs (REST e gRPC).Docker e Kubernetes (implantação, operação e troubleshooting).Cloud‑native (preferência Azure: AKS, Event Hub, Cosmos DB, Redis e mongoDB).CI/CD em Azure DevOps e Git (branching, PRs, automação).Segurança de APIs (OAuth 2.0/OIDC, autenticação/autorização, gestão de segredos).Experiência com mensageria e comunicação assíncrona (SSE, WebSockets).Prática com observabilidade (logs, métricas, tracing, dashboards e alertas).Superior Completo - Certificado de conclusãoDiferenciaisExperiência com modelos de linguagem e GenAI.Boas práticas de prompt engineering.Bibliotecas de agentes/orquestração (ex.: LangChain, LangGraph).Infra as Code (Terraform, Ansible).Soft skillsComunicação clara e objetiva, colaboração em times multidisciplinares, proatividade e foco em qualidade, escalabilidade e governança técnica.Informações adicionaisNa Vivo não medimos esforços em apoiar e valorizar nossos colaboradores. Não são apenas excelentes benefícios, mas também flexíveis.• Escolher o benefício ideal para você e seus dependentes, numa plataforma digital com diversas categorias de Academia, VR, VA, Auxílio Farmácia, Assistência Médica, Odontológica e Seguro de Vida;• Celular corporativo. Sim, um smartphone novinho para você!• Plano de voz e Dados ilimitado! Sim ilimitado! Com a melhor rede móvel, ainda mais rápida com o 5G da Vivo!• Uma oferta exclusiva da Vivo, com desconto especial em linha fixa, banda larga, TV e apps;• Terá direito a receber Bônus ou PPR anual;• Planejará seu futuro através do plano de Previdência Privada;• Tem filhos? Terá direito a um subsídio para ajudar nas despesas com escola, creche ou babá;• Viver em um ambiente que respeitará sua personalidade, seu estilo de se vestir, seu jeito de ser e poderá ser autêntico. #VemdeVocê• Trabalhar remotamente até 2 vezes por semana. #Mobility• Ter flexibilidade de horário;• Aproveitar um dia de folga (Day off) para comemorar seu aniversário;• Participar de um dos maiores programas de voluntariado corporativo para você transformar o mundo;• Usufruir do nosso Programa de Desenvolvimento Educacional que oferece parcerias em instituições de ensino com desconto; certificações e cursos online.• Potencializar sua carreira por meio do nosso Programa de Recrutamento Interno, no Brasil ou fora, afinal estamos presentes em mais de 17 países! #VivoMinhaCarreira• Contar com uma série de iniciativas para melhorar a sua saúde física, emocional e social! Por aqui, temos o #VivoBemEstar, que estimula o nosso time a ter hábitos saudáveis e mais qualidade de vida! Disponibilizados aos nossos colaboradores consultas com nutricionista, psicólogos, serviço social, telemedicina, e muito mais!#VempraVivoSobre nósSomos uma empresa do Grupo Telefônica, líder em telecomunicações no Brasil. Trabalhamos com o propósito deDigitalizar para Aproximarpessoas, negócios e toda sociedade, construindo uma nação mais conectada e transformando a vida dos brasileiros. Buscamos ampliar a autonomia, a personalização e as escolhas em tempo real dos nossos clientes, colocando-os no comando da sua vida digital, com segurança e confiabilidade – tudo isso com a qualidade que só a Vivo tem.Para que isso seja possível, lideramos um processo de transformação digital e estamos revolucionando nossa companhia de dentro para fora. Implementamos metodologias ágeis por toda a empresa, buscando nos conectar com as formas mais inovadoras e colaborativas de trabalho. Atuamos para fomentar um ambiente diverso e inclusivo, que estimula a criatividade, gerando inovação e aumentando o engajamento.Acreditamos que adiversidadede pessoas, vivência, culturas, comportamentos, habilidades e atitudes é um diferencial, que reflete a sociedade em que vivemos. Temos um sólido programa interno, pautados nos pilares de Gênero, LGBTI+, Raça, PcD e 50+ para assegurar uma cultura mais inclusiva e um ambiente mais diverso e representativo. Somos uma empresa detecnologia,inspirada na diversidade e nainovação,que oferece espaço para todos, apoia e acolhe as diferenças.Acreditamos que o caminho para oferecer a melhor experiência ao nosso cliente começa pela boa experiência do nosso colaborador.#VemPraVivoShow moreShow less",N/A,On-site/Hybrid,https://www.linkedin.com/jobs-guest/jobs/api/jobPosting/4354083300,2026-01-25
Cientista de Dados Sênior,XP Inc.,"São Paulo, São Paulo, Brazil",4 days ago,"Sobre nósA XP Inc. é uma das maiores instituições financeiras independente do Brasil, dona das marcas XP, Rico, Clear, XP Educação, InfoMoney, entre outras. Com mais de 4,6 milhões de clientes ativos e um valor superior a R$ 1,1 trilhão de ativos sob custódia, há 24 anos vem transformando o mercado financeiro para melhorar a vida das pessoas.Com uma cultura marcante guiada por quatro valores -Sonho Grande, Espírito Empreendedor, Foco no Cliente e Mente Aberta- a XP Inc. está sempre em busca dos melhores talentos que tem ambição de fazer o impossível.🚀 Sobre a OportunidadeVocê será parte de um time multidisciplinar (dados, data science, mlops, risco, compliance e tecnologia) responsável por:Desenvolver e evoluir modelos de detecção de transações suspeitas de lavagem de dinheiro e financiamento ao terrorismo.Aumentar a efetividade do monitoramento, regras (mais casos relevantes) e reduzir o volume de falsos positivos, melhorando a eficiência das áreas de investigação.Estruturar e analisar grandes volumes de dados transacionais, cadastrais e comportamentais dos clientes para identificar padrões anômalos.Traduzir requisitos regulatórios de PLD em lógicas, regras, features e modelos que possam ser auditados e explicados para áreas internas e reguladores.ResponsabilidadesTrabalhar lado a lado com times de PLD/Compliance, Risco, Controles Internos e Tecnologia, entendendo regras, cenários de risco, tipologias e necessidades regulatórias.Criar e acompanhar KPIs de performance dos modelos.Apoiar o desenho de estratégias híbridas (modelos + regras) para garantir:Eficácia na detecção;Aderência a normas de PLD (BACEN, CVM, COAF);Explicabilidade mínima para investigações e auditorias.Prototipar, testar e colocar em produção soluções analíticas em parceria com engenheiros de dados e de machine learning.Documentar abordagens, premissas, limitações e resultados, garantindo auditoria e rastreabilidade.Acompanhar tendências e melhores práticas em AML/PLD IA/LLM, trazendo inovações estratégicas para o time.Saiba mais sobre nosso dia a dia no Instagram e no LinkedIn.Confira nossas avaliações no Glassdoor.🔍 O Que ProcuramosPré-requisitos EssenciaisFormação em cursos como: Engenharia, Ciência da Computação, Estatística, Matemática, Física, Economia, Ciências de Dados ou áreas correlatas.Experiência prévia (sênior) trabalhando com Ciência de Dados ou Machine Learning em ambiente de negócios (não precisa ser necessariamente em PLD, mas será diferencial).Domínio de Python e principais bibliotecas de dados/ML (p.ex. pandas, NumPy, scikit-learn, PySpark etc).Experiência com SQL para manipulação de grandes volumes de dados.Vivência EmProblemas supervisionados (classificação, regressão) e não supervisionados (clustering, detecção de anomalias);Construção de features e avaliação de modelos.Capacidade de traduzir problemas de negócio (PLD, risco, compliance) em problemas analíticos e de dados.Boa comunicação para dialogar com stakeholders não técnicos (PLD, Jurídico, Controles, Operações).DiferenciaisExperiência prévia em PLD/AML, prevenção à fraude, risco de crédito ou modelos de risco em instituições financeiras.Conhecimento ou experiência com:Grafos e análise de redes (p.ex. para relacionamentos entre clientes, contas, contrapartes);Modelos de detecção de anomalias (Isolation Forest, Autoencoders, etc.);Ambientes de big data (Spark e Databricks) e cloud (Azure).Familiaridade com normativos de PLD e reguladores (BACEN, CVM, COAF).Experiência com MLOps (versionamento de modelos, monitoramento em produção, retraining).Conhecimento em explicabilidade de modelos (SHAP, LIME) para apoiar times de PLD/Compliance na justificativa de decisões.Benefícios:Saúde e Bem-estarPlano de saúde sem coparticipação (inclusive, para dependentes)Plano odontológicoWellhub (Gympass)ZenklubSeguro de VidaiFood Benefícios (VA e VR flexível)Vale TransporteNew Value (clube de benefícios)Licença parental: maternidade de 6 meses e paternidade de 20 dias.Auxílio CrecheVida FinanceiraFundos de Investimentos ExclusivosAssessoria de InvestimentosCartão XP Visa Infinite sem anuidadeCrédito (consignado, home equity, CCB Imobiliário, etc.)Modelo de Trabalho Presencial FlexívelO nosso modelo de trabalho varia de acordo com a função, podendo ser totalmente presencial para frentes de negócio e mais flexível para outras equipes.Seguimos um modelo com mais frequência presencial, mas sempre guiado por flexibilidade e autonomia com a responsabilidade da nossa cultura empreendedora.Aqui na XP Inc., valorizamos as interações pessoais e acreditamos no uso do escritório como uma ferramenta para potencializar nossas relações no trabalho.Show moreShow less",N/A,On-site/Hybrid,https://www.linkedin.com/jobs-guest/jobs/api/jobPosting/4342822057,2026-01-25
Desenvolvedor React Junior - Trabalho Remoto,BairesDev,"São Paulo, São Paulo, Brazil",4 days ago,"Há mais de 15 anos, a BairesDev® é líder em projetos tecnológicos. Entregamos soluções inovadoras para gigantes como Google e Rolls-Royce e as startups mais inovadoras do Vale do Silício.Temos uma equipe diversa de mais de 4.000 profissionais formada pelo Top 1% dos talentos de tecnologia do mundo, trabalhando remotamente em cargos de impacto global.Ao se candidatar para este cargo, você está dando o primeiro passo em um processo que vai além do comum. Nosso objetivo é alinhar suas paixões, habilidades, e expectativas às nossas vagas, colocando você no caminho para desenvolver uma carreira de sucesso excepcional.Desenvolvedor React Junior na BairesDevJunte-se à nossa equipe de desenvolvimento, seja nosso novo Desenvolvedor React Junior. Traga seu conhecimento básico em React, JavaScript e desenvolvimento web. Sua dedicação ao aprimoramento de habilidades e a sua vontade de construir aplicativos web amigáveis também serão valorizadas.Suas atribuições:- Desenvolver e manter aplicativos React, garantindo a qualidade do código e o atendimento às especificações de design.- Identificar e resolver bugs e auxiliar na implementação de testes para tornar o aplicativo mais confiável.- Participar de revisões de código para aprender as melhores práticas e contribuir para a manutenção de altos padrões de desenvolvimento.- Colaborar efetivamente com membros da equipe, incluindo outros desenvolvedores, designers e gerentes de produto.- Aprender continuamente e se manter atualizado sobre React e outras tecnologias front-end relacionadas.- Participar ativamente de reuniões de equipe e planejamento de projetos, garantindo a entrega pontual das tarefa.""Esperamos que você tenha:- 1 ano de experiência com React.- Bom entendimento de algoritmos básicos e estruturas de dados.- Conhecimento básico de sistemas de controle de versão, preferencialmente Git.- Capacidade de resolver problemas com eficácia e aprender novas tecnologias rapidamente.- Bom nível de inglês.Como tornamos seu trabalho (e sua vida) mais fácil:- Modalidade 100% remota - trabalhe de qualquer lugar.- Excelente remuneração em USD ou na sua moeda local, como preferir.- Hardware para você trabalhar de casa.- Horários flexíveis - faça seu próprio horário.- Licença parental remunerada, férias, e feriados nacionais.- Ambiente de trabalho inovador e multicultural.- Colabore e aprenda com o Top 1% global dos talentos de cada área.- Ambiente de apoio com mentoria, promoções, desenvolvimento de habilidades, e diversas oportunidades de crescimento.Junte-se a uma equipe global onde seus talentos excepcionais podem se destacar!Show moreShow less",N/A,On-site/Hybrid,https://www.linkedin.com/jobs-guest/jobs/api/jobPosting/4360991759,2026-01-25
