title,company,location,posted,description,applicants,work_mode,link,data_coleta
Cientista de dados Pleno,Cielo,"Barueri, São Paulo, Brazil",23 hours ago,"Somos mais que uma máquina, somos pessoas que transformam ecriam infinitas possibilidades.Trabalhamos parasimplificar e impulsionar negócios para todas as pessoas, oferecendo soluções financeiras inteligentes. Aqui, investimos emtecnologia, promovemosdesenvolvimentoe fomentamos ainovaçãopara criar novos caminhos possíveis e gerar impacto positivo no mundo.Na Cielo, a gente trabalha comautonomiapara escrever nossa própria jornada,liberdadepara ser quem a gente é, e a oportunidade defazer acontecer. Somos um time quesonha no plural, oferecendo uma experiência completa e focando no bem-estar físico e mental de nossos mais de 7.000 colaboradores e suas famílias.Acreditamos nainclusão e acolhimentode todas as pessoas, com suas singularidades e diversidade de vivências.Conheça mais sobre a área:Nossa missão é analisar dados e perfis, garantindo o direcionamento correto dos produtos de prazo para os clientes e otimizando a conversão da força comercial. Utilizamos técnicas avançadas de modelagem analítica e estatística para assegurar rentabilidade e gerar valor estratégico para a companhia.Bora realizar seus sonhos com a gente!Juntos com você, em infinitas possibilidades.Responsabilidades e atribuiçõesTem lugar para você nesse propósito:Apoiar análises do time de modelagem por meio do desenho de construção de features para produtos de prazo no varejo.Mapear necessidades das áreas de negócio, avaliar requisitos de dados, construir códigos analíticos e acompanhar a implementação e resultados das análises.Desenvolver e implementar modelos analíticos utilizando técnicas estatísticas, identificando padrões, tendências e oportunidades de otimização.Colaborar com equipes multidisciplinares para traduzir problemas de negócio em soluções de modelagem de dados.Interpretar resultados dos modelos e comunicar insights de forma clara.Requisitos e qualificaçõesO que o #TimeCielo espera de você?Formação superior em Estatística, Matemática, Engenharia, Ciência da Computação, Economia ou áreas correlatas.Experiência com analises estatísticas.Conhecimento em linguagens de programação como Python e ferramentas de manipulação de dados (SQL).Familiaridade com técnicas estatísticas e de análise de grande volume de dados.Capacidade de traduzir dados em insights acionáveis e comunicar resultados de forma clara.Desejável experiência com ferramentas de visualização (Power BI, Tableau) e ambientes de Big Data.Informações adicionaisPor que viver infinitas possibilidades ao nosso lado?Assistência Médica e Odontológica;Remuneração Variável Anual (PPR);Auxílio Refeição e Alimentação;Fretado/vale-transporte ou estacionamento;Modelo Híbrido;Auxílio Trabalho Remoto;Seguro de Vida;Seguro residencial e automóvel;Assistência funeral familiar;Previdência Privada;Canal de apoio à especialistas (nutrição, psicologia, ginecologia, etc);Campanha de Vacinação;Acesso à diversos cursos em nossa plataforma Educa;Wellhub;Programa de Gestação Saudável;Licença Maternidade e Paternidade estendida;Auxílio Creche;Day Off de Aniversário;Dress Code Flexível;Horário Flexível;Sexta curta;Almoço estendido (1h30).Show moreShow less",N/A,On-site/Hybrid,https://www.linkedin.com/jobs-guest/jobs/api/jobPosting/4337899562,2026-02-23
"Analista de Melhoria Contínua, ACES",Amazon,"Cajamar, São Paulo, Brazil",2 weeks ago,"DescriptionA equipe da Amazon Brasil está em busca de um(a) Analista de Melhoria Contínua para integrar o time de melhoria contínua. Esta pessoa será responsável por liderar iniciativas de otimização de processos por meio de Kaizens, realizar análises profundas (dive deep) para identificação e solução de problemas operacionais, além de apoiar a gestão de dados e processos do Fulfillment Center (FC), garantindo desempenho, eficiência e conformidade das operações.Essa pessoa atuará em um ambiente altamente colaborativo e multidisciplinar, trabalhando de forma próxima à operação e às áreas de suporte. Espera-se que prospere e entregue resultados em um ambiente dinâmico, acelerado e com alto grau de ambiguidade, onde a análise de dados e a tomada de decisão baseada em fatos são fundamentais para o sucesso do negócio.Key job responsibilitiesRealizar análises detalhadas (dive deep) para identificar oportunidades de melhoria nos processos operacionais;Conduzir investigações de causa raiz para problemas operacionais, utilizando metodologias estruturadas;Propor e implementar soluções simples, eficazes e sustentáveis para problemas complexos, com base em dados e observações in loco (gemba);Desenvolver, manter e aprimorar dashboards, relatórios e indicadores de desempenho operacional;Analisar dados provenientes de diferentes fontes, identificar tendências relevantes e apoiar a tomada de decisões do negócio;Apoiar a configuração e o uso de sistemas e ferramentas com foco na otimização de processos;Criar e implementar ferramentas analíticas que contribuam para o aumento da eficiência operacional;Atuar de forma colaborativa com diferentes áreas para garantir a execução e a sustentação das melhorias implementadas.Basic QualificationsGraduação completa ou em andamento em Engenharia ou áreas correlatas;Experiência com melhoria contínua, análise de processos, operações ou áreas similares;Experiência no uso de Excel ou ferramentas similares para manipulação e visualização de dados;Capacidade de interpretar dados operacionais e transformá-los em ações práticas de melhoria;Conhecimento básico de SQL ou outras ferramentas de consulta e manipulação de dados.Preferred QualificationsExperiência em ambientes logísticos, industriais, centros de distribuição ou operações de grande escala;Conhecimento em metodologias de melhoria contínua, como Lean, Kaizen e/ou Six Sigma;Experiência com ferramentas de BI (ex.: Power BI, QuickSight);Experiência no desenvolvimento e manutenção de dashboards e indicadores de desempenho (KPIs);Vivência em projetos de otimização de processos e redução de desperdícios;Inglês intermediário para leitura de documentações e interação com times globaisOur inclusive culture empowers Amazonians to deliver the best results for our customers. If you have a disability and need a workplace accommodation or adjustment during the application and hiring process, including support for the interview or onboarding process, please visit https://amazon.jobs/content/en/how-we-hire/accommodations for more information. If the country/region you’re applying in isn’t listed, please contact your Recruiting Partner.Company- Amazon Servicos de Varejo do Brasil Ltda. - C41Job ID: A3161392Show moreShow less",N/A,On-site/Hybrid,https://www.linkedin.com/jobs-guest/jobs/api/jobPosting/4363836368,2026-02-23
"Analista de Melhoria Contínua, ACES",Amazon,"Cajamar, São Paulo, Brazil",2 weeks ago,"DescriptionA equipe da Amazon Brasil está em busca de um(a) Analista de Melhoria Contínua para integrar o time de melhoria contínua. Esta pessoa será responsável por liderar iniciativas de otimização de processos por meio de Kaizens, realizar análises profundas (dive deep) para identificação e solução de problemas operacionais, além de apoiar a gestão de dados e processos do Fulfillment Center (FC), garantindo desempenho, eficiência e conformidade das operações.Essa pessoa atuará em um ambiente altamente colaborativo e multidisciplinar, trabalhando de forma próxima à operação e às áreas de suporte. Espera-se que prospere e entregue resultados em um ambiente dinâmico, acelerado e com alto grau de ambiguidade, onde a análise de dados e a tomada de decisão baseada em fatos são fundamentais para o sucesso do negócio.Key job responsibilitiesRealizar análises detalhadas (dive deep) para identificar oportunidades de melhoria nos processos operacionais;Conduzir investigações de causa raiz para problemas operacionais, utilizando metodologias estruturadas;Propor e implementar soluções simples, eficazes e sustentáveis para problemas complexos, com base em dados e observações in loco (gemba);Desenvolver, manter e aprimorar dashboards, relatórios e indicadores de desempenho operacional;Analisar dados provenientes de diferentes fontes, identificar tendências relevantes e apoiar a tomada de decisões do negócio;Apoiar a configuração e o uso de sistemas e ferramentas com foco na otimização de processos;Criar e implementar ferramentas analíticas que contribuam para o aumento da eficiência operacional;Atuar de forma colaborativa com diferentes áreas para garantir a execução e a sustentação das melhorias implementadas.Basic QualificationsGraduação completa ou em andamento em Engenharia ou áreas correlatas;Experiência com melhoria contínua, análise de processos, operações ou áreas similares;Experiência no uso de Excel ou ferramentas similares para manipulação e visualização de dados;Capacidade de interpretar dados operacionais e transformá-los em ações práticas de melhoria;Conhecimento básico de SQL ou outras ferramentas de consulta e manipulação de dados.Preferred QualificationsExperiência em ambientes logísticos, industriais, centros de distribuição ou operações de grande escala;Conhecimento em metodologias de melhoria contínua, como Lean, Kaizen e/ou Six Sigma;Experiência com ferramentas de BI (ex.: Power BI, QuickSight);Experiência no desenvolvimento e manutenção de dashboards e indicadores de desempenho (KPIs);Vivência em projetos de otimização de processos e redução de desperdícios;Inglês intermediário para leitura de documentações e interação com times globaisOur inclusive culture empowers Amazonians to deliver the best results for our customers. If you have a disability and need a workplace accommodation or adjustment during the application and hiring process, including support for the interview or onboarding process, please visit https://amazon.jobs/content/en/how-we-hire/accommodations for more information. If the country/region you’re applying in isn’t listed, please contact your Recruiting Partner.Company- Amazon Servicos de Varejo do Brasil Ltda.Job ID: A3161395Show moreShow less",N/A,On-site/Hybrid,https://www.linkedin.com/jobs-guest/jobs/api/jobPosting/4363846004,2026-02-23
Cientista de Dados Sr. – (Modelagem Crédito Cartões),Banco PAN,"São Paulo, São Paulo, Brazil",2 weeks ago,"Somos oPANÁgeis, flexíveis e criativos, exploramos possibilidades com disposição e desejo de fazer acontecer. Sempre prontos para encarar novos desafios, nutrimos líderes que, além de ter garra, são abertos e empáticos, veem na proximidade das relações, o elo entre cada um.Nossa missão, se faz cumprida quando transformamos a vida dos outros através dos nossos conhecimentos. Nossos pilares de cultura, reforçam nossa postura idealizadora e com desejo de fazer acontecer:Trabalho em equipe, Transparência , Excelência e Eficiência com profundidade.Dominamos nossos processos e trazemos melhorias para quem deseja ter umavida financeira mais inteligente.Principais desafios:Desenvolver modelos preditivos, para apoiar a tomada de decisão da área de crédito;Atuar com Machine Learning e Gen-IA, para soluções de clusterização, regressão, classificação e criação de features;Atuar no processo de deploy de modelos (MLOp) de acordo com a melhores práticas;Lidar com drivers da concessão e manutenção de crédito, como credit score, endividamento, capacidade de pagamento e rentabilidade;Analisar impactos e variações dos negócios/produtos, buscando propostas de soluções data-driven;Explorar as informações disponíveis para entendimento do portfólio, tendências e oportunidades de negócio;Acompanhar e propor métodos de monitoramento da qualidade dos modelos, visando melhorias.Quais as principais competências para a posição?Formação acadêmica dentre os cursos de Matemática Aplicada, Estatística, Computação Científica, Engenharias ou similares;Experiência no setor financeiro/bancário com: modelos de crédito, score de crédito;Experiência específica em cartões é desejável;Conhecimento em dados do Banco Central (SCR) seria um grande diferencial;Domínio de programação em SQL e Python;Capacidade de trabalhar com fontes distintas de dados, incluindo dados não estruturados;Domínio sobre as principais técnicas estatísticas de modelagem, de avaliação de performance dos modelos, testes de hipóteses e seus usos;Conhecimento das principais implementações dos algoritmos de Machine Learning e Gen-IA.Modelo de atuação: Híbrido (4 dias presencial no escritório e 1 dia de home office)Benefícios do PAN:Bônus / PLRVale RefeiçãoVale Alimentação13º de Vale AlimentaçãoConvênio Médico (internação em apartamento para titular e dependentes)Convênio Odonto/OrtodônticoAmbulatório Médico no escritórioTelemedicina Dr. Alper (Einstein Conecta) ilimitado.Seguro de VidaDescontos em mais de 10 mil farmácias4 Sessões de psicoterapia por mêsLicença familiar estendida (Responsável 6 meses e corresponsável 30 dias)Auxílio Creche / BabáAcomPANha (programa de acompanhamento para gestantes)Wellhub/TotalpassAuxílio tecnologia assistivas (reembolso de 85% para colaboradores com deficiência)Programas de desenvolvimentoMassagem e AuriculoterapiaSalão de beleza no escritórioPAE (Orientação Jurídica, Financeira, Psicológica e Social)Portal de descontos em diversos segmentos (Allya)Campanha de vacinação (colaborador e dependente)Facilitação no financiamento de veículos (Mediante análise)Cartão de crédito PAN com limite diferenciado (Mediante análise)Vale Transporte (desconto de apenas 4%)Assistência FuneralAssim como todas as nossas vagas, essa também é destinada à diversidade e inclusão. Independentemente de qualquer fator, perfil ou característica,Expanda sua carreira no PAN!Para conhecer mais sobre nossos benefícios e cultura, acesse o Trabalhe Conosco:https://www.bancopan.com.br/trabalhe-conosco/Show moreShow less",N/A,On-site/Hybrid,https://www.linkedin.com/jobs-guest/jobs/api/jobPosting/4370180093,2026-02-23
Especialista Cientista de Dados,Serasa Experian,"São Paulo, São Paulo, Brazil",3 days ago,"Company DescriptionA Serasa Experian é a primeira e a maior Datatech do Brasil. Líder em soluções de inteligência para análise de riscos e oportunidades, com foco nas jornadas de crédito, autenticação e prevenção à fraude. Com tecnologia de ponta, inovação e os melhores talentos, transforma a incerteza do risco na melhor decisão, ajudando pessoas a realizarem seus sonhos e empresas de todos os portes e segmentos a prosperarem.Temos 22.000 pessoas operando em 32 países e a cada dia estamos investindo em novas tecnologias, profissionais talentosos e inovação para ajudar todos os clientes a maximizarem cada oportunidade. Com sede corporativa em Dublin, Irlanda, a Experian está listada na Bolsa de Valores de Londres (EXPN) e compõe o índice FTSE 100.Job DescriptionO DataLab é a unidade de pesquisa e inovação do grupo Experian na América Latina junto com a Serasa Experian no Brasil. Temos o objetivo de ser propositivo, antecipando o futuro, e consultivo, identificando oportunidades de evolução no mercado, por meio de técnicas de Inteligência Artificial e Machine Learning combinada com uso de novas fontes de dados.Criamos soluções inovadoras avançadas, que ajudam clientes e mercado a se prepararem hoje para o amanhã de decisões mais assertivas. Além de termos um olhar 360º para trocar com o que há de melhor no âmbito global, considerando o todo e produzindo soluções capazes de alcançar grande escalabilidade.Como Especialista em Ciência de Dados, você terá um papel central no time, utilizando sua experiência e conhecimentos em Machine Learning, GenAI, programação, tratamento e análise de dados para liderar tecnicamente projetos junto aos times de engenharia e negócios.Principais ResponsabilidadesPropor e implementar análises de dados avançadas e modelos de Machine Learning;Manipular eficientemente grandes volumes de dados;Colaborar com times de Engenharia de Dados, Engenharia de Software, Produtos e Negócios para entender as necessidades, sugerir soluções orientadas a dados e influenciar positivamente o rumo dos projetos;Explorar continuamente novas fontes de dados e novidades técnicas;Manter-se atualizado com as últimas pesquisas e avanços em GenAI e Machine Learning.Apresentar os resultados e recomendações para stakeholders e times executivos;Desenhar roadmaps de desenvolvimento de produtos data-driven em concordância com as necessidades de negócio;Conduzir experimentos e testes de forma ágil visando decisões conclusivas.O Que Estamos BuscandoBacharelado em Ciência de Dados, Estatística, Ciência da Computação, Engenharia, Física ou cursos relacionados;Sólidos conhecimentos em Python, principalmente em manipulação de dados, bibliotecas de análise (ex. Pandas, Numpy) e frameworks de Machine Learning (ex. scikit-learn, TensorFlow);Experiência na manipulação de grandes bases de dados, em especial armazenadas em ambiente Hadoop (HDFS), processamento distribuído de dados (PySpark) e linguagem SQL;Experiência em desenvolver e implantar modelos de Machine Learning, com bons conhecimentos em validação, tuning e monitoramento de modelos;Experiência em versionamento de código;Habilidade para o entendimento e a resolução de problemas de negócios de forma versátil e ágil;Habilidade de comunicação com pares, áreas parceiras e executivos, incluindo apresentações e tradução de insights em ações de negócios;Colaboração e trabalho em equipe;Aprendizado constante;Inglês avançado;Disponibilidade para atuação híbrida (2x na semana) em São Paulo/SP (Chácara Santo Antônio).DiferenciaisMestrado ou doutorado em alguma das áreas correlatas;Conhecimento e experiência com processamento de grafos e redes complexas;Conhecimento de frameworks de GenAI como LangChain, LangGraph, Agno ou equivalentes;Atuação prévia em produtos corporativos baseados em LLMs, RAG, MCP e sistemas multiagentes.QualificationsData sciencePythonCodingBig dataAIStatisticsAdditional InformationA Serasa Experian é muito mais do que você imagina. Com o propósito de criar um futuro melhor, ampliando oportunidades para pessoas e empresas, no Brasil somos mais de 4 mil pessoas que atuam em diversos times e especialidades. Aqui, cada conhecimento e diversidade se complementa e você pode trabalhar no que mais ama, estamos comprometidos a construir uma cultura inclusiva e um ambiente no qual pessoas possam equilibrar a carreira com seus compromissos e interesses pessoais, prezando pelo bem-estar.A gente se dedica muito em ser uma das melhores e mais inovadoras empresas para se trabalhar do país, possibilitando experiências e carreiras incríveis para nossas pessoas. Nossa forte abordagem de pessoas em primeiro lugar é reconhecida externamente por meio de diversas certificações de mercado: fomos premiados pelo Great Place To Work™ em 24 países e pela certificação internacional Top Employers, além de sermos reconhecidos como uma das melhores empresas para jovens profissionais e contarmos com uma avaliação de 4,6 no Glassdoor. Cada reconhecimento nos indica que estamos no caminho certo, proporcionando um ambiente de trabalho cada vez melhor para nossos talentos.Experian Careers - Creating a better tomorrow togetherFind out what its like to work for Experian by clicking hereShow moreShow less",N/A,On-site/Hybrid,https://www.linkedin.com/jobs-guest/jobs/api/jobPosting/4367331072,2026-02-23
"Data Scientist, Brazil - BCG X",BCG X,"São Paulo, São Paulo, Brazil",1 day ago,"Who We AreBoston Consulting Group partners with leaders in business and society to tackle their most important challenges and capture their greatest opportunities. BCG was the pioneer in business strategy when it was founded in 1963. Today, we help clients with total transformation-inspiring complex change, enabling organizations to grow, building competitive advantage, and driving bottom-line impact.To succeed, organizations must blend digital and human capabilities. Our diverse, global teams bring deep industry and functional expertise and a range of perspectives to spark change. BCG delivers solutions through leading-edge management consulting along with technology and design, corporate and digital ventures—and business purpose. We work in a uniquely collaborative model across the firm and throughout all levels of the client organization, generating results that allow our clients to thrive.We Are BCG XWe’re a diverse team of more than 3,000 tech experts united by a drive to make a difference. Working across industries and disciplines, we combine our experience and expertise to tackle the biggest challenges faced by society today. We go beyond what was once thought possible, creating new and innovative solutions to the world’s most complex problems. Leveraging BCG’s global network and partnerships with leading organizations, BCG X provides a stable ecosystem for talent to build game-changing businesses, products, and services from the ground up, all while growing their career. Together, we strive to create solutions that will positively impact the lives of millions.What You'll DoOur BCG X teams own the full analytics value-chain end to end: framing new business challenges, designing innovative algorithms, implementing, and deploying scalable solutions, and enabling colleagues and clients to fully embrace AI. Our product offerings span from fully custom-builds to industry specific leading edge AI software solutions.As aData Scientist, you'll be part of our rapidly growing team. You'll have the chance to apply data science methods and analytics to real-world business situations across a variety of industries to drive significant business impact. You'll have the chance to partner with clients in a variety of BCG regions and industries, and on key topics like climate change, enabling them to design, build, and deploy new and innovative solutions.Additional responsibilities will include developing and delivering thought leadership in scientific communities and papers as well as leading conferences on behalf of BCG X. Successful candidates are intellectually curious builders who are biased toward action, scrappy, and communicative.What You'll BringWe Are Looking For Talented Individuals With a Passion For Data Science, Statistics, Operations Research And Transforming Organizations Into AI Led Innovative Companies. Successful Candidates Possess The FollowingBachelor’s, Master's or Advanced degree with excellent academic achievements in a field linked to computer science, applied mathematics, statistics, machine learning, or related data centric areasRelevant internships or post-college industry or consulting experienceComfortable in a client-facing role with the ambition to lead teamsLikes to distill complex results or processes into simple, clear visualizationsExplain sophisticated data science concepts in an understandable mannerLove building things and are comfortable working with modern development tools and writing code collaboratively (bonus points if you have a software development or DevOps experience)Significant experience applying advanced analytics to a variety of business situations and a proven ability to synthesize complex dataDeep understanding of modern machine learning techniques and their mathematical underpinnings, and can translate this into business implications for our clientsHave strong project management skillsTechnologiesProgramming Languages: PythonAdditional info#BCGXjobBoston Consulting Group is an Equal Opportunity Employer. All qualified applicants will receive consideration for employment without regard to race, color, age, religion, sex, sexual orientation, gender identity / expression, national origin, disability, protected veteran status, or any other characteristic protected under national, provincial, or local law, where applicable, and those with criminal histories will be considered in a manner consistent with applicable state and local laws.BCG is an E - Verify Employer. Click here  for more information on E-Verify.Show moreShow less",N/A,On-site/Hybrid,https://www.linkedin.com/jobs-guest/jobs/api/jobPosting/4328172184,2026-02-23
