title,company,location,posted,description,applicants,work_mode,link,data_coleta
Data Scientist [All Levels],Nubank,"São Paulo, São Paulo, Brazil",2 days ago,"About UsNu was born in 2013 with the mission to fight complexity to empower people in their daily lives by reinventing financial services. We are one of the world’s largest digital banking platforms, serving millions of customers across Brazil, Mexico, and Colombia. For more information, visit our institutional page https://international.nubank.com.br/careers/Data Science at NubankData Science is essential to every part of the business at Nubank, since Day 1. Most areas of the company use data science to some extent. Data Scientists are responsible for translating business needs into models and other types of data-driven solutions.As a Data Scientist, you’re expected toInteract with other team members to understand how to best apply data science and artificial intelligence to Nubank’s problems;Investigate problems and discover insights through exploratory data analysis and other quantitative methods;Have great numerical and analytical literacy, including knowledge of statistics and linear algebra as needed;Work on multiple stages of the ML model lifecycle–from ideation to training and steady-state operation;Work across multiple types of models, algorithms and learning paradigms;Communicate technical points, decisions and tradeoffs to peers and stakeholders;Our ideal candidateHas experience working with ML models in a production environment;Understands possible pitfalls and tradeoffs when applying ML to real-word, sometimes messy problems;Is familiar with the technical aspects of learning theory and algorithms and is able to discuss details if needed;Has experience working with the Python scientific stack (Numpy, Pandas, Scipy, Sklearn, Boosted Tree Libraries, etc);Has experience working with Tensor/Deep Learning libraries such as Tensorflow and Pytorch;Is able to connect analytical outcomes to business priorities and advise stakeholders on the best course of action;Has good communication skills and is able to convey technical topics and decision points to diverse audiences;Has experience writing general-purpose code using modern tools;Understands the implications of causality when applying ML to problems;Is up-to-date with recent developments in the area as a whole and is able to identify opportunities for improvement and innovation;Our BenefitsChance of earning equity at NubankFood/ Meal Card (Vale-Refeição and/or Vale Alimentação)Public Transportation Commuting Benefit (Vale-Transporte)NuCare – Psychological, Financial and Legal Assistance ProgramLife InsuranceMedical PlanDental PlanNuLanguage – Language Course ProgramNucleo - Our learning platform of coursesExtended Parental LeaveDaycare AllowanceParental ConsultancyWork-from-home AllowanceGym Partnerships30 days of paid vacationWork Model for this RoleHybrid 2-3 times/week:Our hybrid work model brings us to the office at least twice a week, on strategic days designed to maximize team connection and collaboration. For more details, visit https://building.nubank.com/nu-hybrid-work-model/Show moreShow less",N/A,On-site/Hybrid,https://www.linkedin.com/jobs-guest/jobs/api/jobPosting/4364197061,2026-03-10
Data Scientist I,Banco Bradesco,"Osasco, São Paulo, Brazil",1 week ago,"Sobre o BradescoO Bradesco é um dos maiores grupos financeiros do Brasil, com uma história marcada pelo pioneirismo e inovação. Por meio da nossa carteira amplamente diversificada de produtos financeiros, serviços bancários e de seguros contribuímos com a realização das pessoas e o crescimento sustentável de empresas e sociedade. Venha fazer parte do nosso ecossistema financeiro e impactar a experiência de milhões de pessoas!No Bradesco valorizamos a diversidade em todas as suas formas. Por isso, as nossas vagas são abertas a todas as pessoas, independentemente de gênero, raça, orientação sexual, deficiência, idade ou qualquer outra característica.Saiba mais em https://banco.bradesco/html/classic/sobre/index.shtmResponsabilidades e atribuiçõesO que é o nosso time de Cobrança e Recuperação de Créditos (DRC)?Temos como missão garantir a aplicação da Política de Cobrança e Recuperação de Créditos, estabelecendo um processo estruturado para cobrança dos vencidos, gestão de alçadas, regras e limites de descontos nas regularizações de dívidas, atribuição de responsabilidade e de delegação de autoridade, segregando funções e assegurando a existência de controles efetivos que permitam o cumprimento das diretrizes da Organização.Modelo de trabalho : Híbrido - 2x PresencialUnidade: Osasco/SPComo será seu dia a dia?Sendo Data Scientist I - Precificação e Cobrança, atuará na gerência Varejo PJ - Estratégia de Precificação e suas principais atividades serão:Identificar dados de fontes primárias ou secundárias necessários para a análise de oportunidades em redução de inadimplência;Determinar os dados necessários para coleta e inclusão no BI, encontrando as melhores formas de organizar e armazenar as informações de renegociações;Atuar na análise das curvas de inadimplência, reunindo informações pertinentes, organizando-as de forma lógica e funcional;Analisar e identificar oportunidades nas réguas de cobrança do PJ, políticas de renegociação e comissão para terceiros;Gerar e analisar resultados usando técnicas estatísticas e fornecendo relatórios de progresso, seja de impactos regulatórios ou ainda de análise de desempenho (qualidade e produtividade);Identificar, analisar e interpretar os dados de forma a extrair padrões e tendências, torná-los visíveis e compreensíveis, apontar caminhos e soluções para eventuais problemas, entre outros.Requisitos e QualificaçõesO que você precisa ter ou saber?Superior Completo em áreas de exatas, tecnologia ou similares;Conhecimentos em SAS, SQL e Python;Conhecimentos em Databricks;Conhecimentos intermediários nas ferramentas de BI (Tableau, Looker, PowerBI).Será um diferencial se você tiver:Conhecer clusterização e estratégia de Preço / Cobrança.Show moreShow less",N/A,On-site/Hybrid,https://www.linkedin.com/jobs-guest/jobs/api/jobPosting/4380169346,2026-03-10
Data Science - Analytics & Machine Learning,Mercado Livre Brasil,Greater São Paulo Area,1 week ago,"ComoData Science - Analytics & Machine Learningno Mercado Livre, você projetará e escalará sistemas inovadores e seguros que resolvem problemas reais e de alto impacto. Trabalhará em um ambiente dinâmico com tecnologia de ponta, aplicando boas práticas de engenharia, modelos próprios de IA e aprendizado contínuo, com o propósito de democratizar o comércio eletrônico e os serviços financeiros na América Latina.Imagine-se empreendendo projetos desafiadores, dinâmicos e inovadores esendo responsável por:Realizar análises exploratórias e gerar insights acionáveis para suporte à tomada de decisão.Desenvolver, validar e implementar modelos estatísticos e de Machine Learning.Preparar e estruturar dados, realizar tratamento, transformação e feature engineering.Definir, acompanhar e analisar métricas e KPIs de performance.Apoiar o desenho e a análise de experimentos, incluindo testes A/B.Documentar processos, garantir boas práticas de versionamento e monitoramento e colaborar com times multidisciplinares (Dados, Engenharia, Produto e Negócio).O que buscamos em você?Dominar Python e possuir sólidos conhecimentos em SQL.Possuir experiência com bibliotecas de Machine Learning (scikit-learn, XGBoost, TensorFlow ou similares) e aplicar estatística e modelagem preditiva.Utilizar Git e atuar em ambientes em nuvem, possuir conhecimento em MLOps e deploy de modelos como diferencial.Demonstrar experiência com modelos de linguagem (LLMs), aplicar técnicas de prompt engineering, utilizar APIs de IA generativa e compreender conceitos de IA Agêntica, incluindo orquestração de agentes e automação baseada em LLMs.Você se anima a deixar sua marca na tecnologia da América Latina?Candidate-se e junte-se ao nosso propósito!Modalidade de trabalho híbrida. Escritório Melicidade (São Paulo).Show moreShow less",N/A,On-site/Hybrid,https://www.linkedin.com/jobs-guest/jobs/api/jobPosting/4378108155,2026-03-10
Cientista de Dados Pleno,Itaú Unibanco,"São Paulo, São Paulo, Brazil",1 week ago,"Vem ser Ituber & vem fazer ItaúO Itaú é a marca mais valiosa do Brasil, a melhor empresa para trabalhar segundo o Great Place to Work e o maior banco da América Latina. Nós impactamos diariamente mais de 98 milhões de clientes em 18 países.Somos feitos de pessoas e acreditamos que ter um time com pluralidade de origens, culturas, crenças, experiências, raças, deficiências, gêneros, orientações afetivo-sexuais e gerações ampliam as perspectivas e contribuem para um clima de respeito e valorização das diferenças.Na IGA, você estará em um ambiente dinâmico, contribuindo para a construção da rentabilidade não apenas do Itaú, mas também de clientes que passaram a contratar a IGA para apoiar seus projetos.A gerência atua em dois pilares principais:Dados: Desenvolvimento de soluções baseadas em Machine Learning (ML) e Generative AI (GenAI) para resolver dores ou desbloquear potenciais de áreas e produtos.Sourcing: Mapeamento de oportunidades e projetos voltados à redução de despesas por meio de dados, com foco em otimizações e ML.O ambiente é repleto de desafios e oportunidades, com dados como pilar fundamental para impulsionar o futuro da IGA.Estamos buscando uma pessoa para a posição deCientista de Dados Pleno, que queira se desenvolver e aprender, compartilhar, colaborar e inovar, entregando valor para todos os nossos clientes.Internamente, o profissional terá uma atuação transversal na IGA, podendo participar de projetos em diferentes frentes:Ativos: Modelos para avaliação de imóveis (vendas diretas e de imóveis retomados), além de precificação de veículos pesados e leves.Comercial: Modelos de propensão, identificação de potenciais e construção de pitches com LLMs.Produtos Digitais: Iniciativas como o Nosso Mercado IGA (modelos de recomendação, buscadores semânticos e growth), Inotas (GenAI estruturante) e soluções para viagens.Produtos: Projetos de Sourcing (redução de despesas por meio de compras) e Gráfica (modelagem de personas).Além disso, você irá:Atuar através dos dados para mapeamento e melhoria de processosIrá participar do discovery técnico e de negócio para aprimorar produtos digitaisConstruirá agentes de Machine Learning e GenAINo que você precisa mandar bem?Experiência prática com PythonConhecimento de consultas de banco de dados com SQLVivência com serviços de big data da AWS (Athena, Sagemaker, Glue)Familiaridadedesejávelcom IA Generativa (GenAI)Conhecimento em tipos de modelagem de dados (clusterização, regressão, categorização, etc)Ao se tornar um ituber você tem_Vale-TransporteVale-Refeição (Restaurantes) / Vale-Alimentação (Supermercados)Plano médico (Fundação Saúde ItaúouCentral Nacional Unimed)Plano odontológico (OdontoprevouInterodonto)Seguro de VidaPLR – Participação nos Lucros e Resultados (Mediante resultados do banco)Previdência privadaDescontos exclusivos em nossos produtos financeirosLicença maternidade e paternidade estendidaAuxílio Creche / Babá (para papais e mamães)Incentivo a estudosWellhub ou TotalPassAcesso aos Clubes de Lazer Itaú (Guarapiranga / Itanhaém e São Sebastião)+ Algumas vantagens que você pode conhecer durante o processo 😊Conheça mais sobre nossa cultura: https://www.itau.com.br/relacoes-com-investidores/noticias/cultura-itubers-e-nosso-novo-conjunto-de-valores/*Estimulamos candidaturas de pessoas com deficiência em todas as nossas posições, sendo assim, sinta-se à vontade para se candidatar em vagas sinalizadas como exclusivas ou não para pessoas com deficiência. Somos comprometidos com a inclusão e valorizamos a diversidade.#VemProItaú #VemSerItuberShow moreShow less",N/A,On-site/Hybrid,https://www.linkedin.com/jobs-guest/jobs/api/jobPosting/4377760456,2026-03-10
Cientista de Dados Junior/Pleno,EY,"São Paulo, São Paulo, Brazil",3 days ago,"Na EY, estamos comprometidos em moldar seu futuro com confiança.Nós ajudaremos você a ter sucesso em um ambiente globalmente conectado, repleto de equipes diversas, e a levar sua carreira para onde você desejar.Venha para EY e ajude-nos a construir um mundo de negócios melhor.Oportunidade disponível em modelo presencial (com flexibilidade) nos escritórios da EY em São Paulo e Rio de Janeiro.Você assumirá as seguintes responsabilidades:Foco em aprendizado e desenvolvimento de habilidades em ciência de dados.Auxiliar na coleta, limpeza e preparação de dados para análise.Realizar análises exploratórias de dados sob supervisão, identificando padrões e tendências iniciais.Apoiar na construção de visualizações de dados simples para relatórios e apresentações.Colaborar com membros da equipe em projetos de ciência de dados, aprendendo as melhores práticas e metodologias.Participar de reuniões de equipe e contribuir com ideias e feedback. Documentar processos e resultados de análises realizadas.Requisitos e habilidades que buscamos:Experiência Profissional em Ciência de Dados, Análise de Dados ou áreas afins.Experiência com linguagens de programação como Python, R ou Scala.Experiência com bibliotecas de ciência de dados (como Pandas, NumPy, Scikit-learn).Habilidade em criar visualizações de dados eficazes usando ferramentas como Tableau, Power BI ou bibliotecas de visualização em Python (Matplotlib, Seaborn).Experiência com bancos de dados relacionais (SQL) e não relacionais (NoSQL), além de conhecimento em otimização de consultas.Capacidade de identificar problemas complexos e desenvolver soluções baseadas em dados.Habilidade em comunicar resultados e insights de forma clara e eficaz para públicos não técnicos.Experiência em colaborar com equipes multidisciplinares, incluindo engenheiros de dados, analistas de negócios e stakeholders.DiferenciaisInglês intermediárioEspanhol básicoO que oferecemos:Acesse go.ey.com/beneficios e conheça nosso universo debenefícios.Na EY, você se desenvolve com habilidades voltadas para o futuro e se abastece de experiências de classe mundial. Nós capacitaremos você em um ambiente flexível e potencializaremos seus talentos extraordinários em uma cultura diversa e inclusiva, com equipes globalmente conectadas.Pelo 4o ano consecutivo, a EY está na lista do Great Place to Work como uma das melhores empresa para se trabalhar, com destaque para as categorias de diversidade. Você poderá fazer parte de nossos programas e grupos que, juntos a inúmeras iniciativas internas, apoiam nossa constante busca pela equidade.Você gostaria de moldar seu futuro com confiança? Inscreva-se hoje!Saiba mais sobre como é trabalhar na EY:Carreiras na EY LinkedIn @EY Instagram @eybrasilcarreirasShow moreShow less",N/A,On-site/Hybrid,https://www.linkedin.com/jobs-guest/jobs/api/jobPosting/4371597197,2026-03-10
Desenvolvedor(a) Júnior,Porto,"São Paulo, São Paulo, Brazil",1 week ago,"Descrição da vagaBuscamos um(a) Desenvolvedor(a) Junior, proativo(a) e com grande disposição para aprender, para integrar nossa equipe e contribuir diretamente para o desenvolvimento e a manutenção de sistemas.Responsabilidades e atribuiçõesEstimar o esforço necessário para desenvolvimento dos cards / tasks que serão desenvolvidasDesenvolver o código necessário para implementar funcionalidades do backlog do produto, seguindo priorização do backlog e comunicando eventuais dificuldades/impedimentosResponsável pela qualidade do código desenvolvido, adequação ao critério de aceite, manutenção e melhoria continuaResponsável pela manutenção daquilo que constrói (conceito Build and Run)Zelar pela qualidade do código desenvolvido, adequação ao critério de aceite, manutenção e melhoria continuaRequisitos e qualificaçõesEnsino superior completo ou em andamento em Ciência da Computação, Engenharia de Software, Sistemas de Informação ou áreas correlatas;Boas práticas de programação, como refatoração, testes unitários e documentação.Conhecimento básico em desenvolvimento fullstackExperiência com Java (pelo menos conhecimento em desenvolvimento de aplicações simples utilizando a linguagem).Conhecimento em HTML, CSS e JavaScript.Conhecimento básico de frameworks e bibliotecas JavaScript como React ou Angular.Experiência com SQL e bancos de dados relacionais (MySQL, PostgreSQL, etc.).Familiaridade com frameworks Spring Boot para desenvolvimento de back-end em Java.Conhecimento CI/CD (Integração Contínua/Entrega Contínua).Conhecimento em controle de versão utilizando Git.Familiaridade com metodologias ágeis (Scrum, Kanban).Conhecimento de ferramentas de desenvolvimento colaborativo como GitHub ou GitLab.Informações adicionaisVale Alimentação e Refeição Flexíveis;Plano de Saúde;Plano Odontológico;Wellhub e TotalPass;Academia Bio Ritmo exclusiva para Colaboradores: no Complexo Matriz;Participação nos Lucros - PLR;Programa de Ações: Porto em Ação: complementar à PLR até 2025;Quadras de Areia e Poliesportiva: no Complexo Matriz;Vale-Transporte;Serviços de Transporte de Vans; disponibilizadas nas principais estações de acesso à Porto (Luz, Barra Funda, Santa Cecília e Júlio Prestes);Licença Parental Estendida: até 40 dias para todas as configurações familiares;Licença Maternidade Estendida de 6 meses.;Ambulatório Médico com Especialidades: no Complexo Matriz e Barra Funda;Auxílio creche ou babá;Seguro de Vida;Previdência Privada - PortoPrev;Desconto em Produtos e Serviços;Bolsa de estudos: Reembolso para graduação, pós ou MBA;Corridas mensais: subsídio para as principais corridas de ruas de São PauloReembolso para idiomas (inglês ou espanhol);Teatro Porto: sessões exclusivas para Colaboradores;Biblioteca;Sala de descanso: no completo MatrizSalão de jogos: no complexo MatrizServiços de massagem e podologia: no completo MatrizLocal de trabalho: Local (Atuamos com modelos híbridos, que serão explorados no processo seletivo);Na Porto, Você Importa!A Porto é muito mais que uma seguradora: é um ecossistema gigante que utiliza tecnologia para criar soluções, através de quatro verticais de negócio:Porto Bank, Porto Saúde, Porto Seguro e Porto Serviço.A reputação e o reconhecimento conquistados ao longo de mais de 7 décadas reforçam o tamanho da Porto, uma empresa referência em negócios, feita para e por pessoas.Aqui, bate no peito de 13 mil colaboradores oorgulho de fazer parte de uma organização sólida e ética,que transforma sonhos em realidades fantásticaspara os nossos mais de 15,8 milhões de clientes. São mais de 101 sucursais e escritórios regionais em todo o Brasil.O aprendizado faz parte do nosso DNA, e aqui, você teráincentivos, ferramentas e gente boa para você aprender e crescer, a cada dia,um ambiente de acolhimento e segurança, onde cada um possa ser e se orgulhar de quem se é, promovendo um espaço de respeito evivendo de forma integral e com bem-estar, em uma empresa genuinamente humana.DIVERSIDADE & INCLUSÃO NA PORTOAqui na Porto, valorizamos a diversidade e acreditamos que um time plural é imprescindível para o desenvolvimento de todo o nosso negócio, da sociedade, e de cada pessoa, pois entendemos que cada indivíduo é único na construção de um ambiente mais inovador e inclusivo. Juntos, trabalhamos diariamente para construirmos um espaço seguro, livre e acolhedor, com mais pluralidade e respeito. Por isso,incentivamos fortemente a inscrição de mulheres, de pessoas negras e indígenas, de pessoas com deficiência e de pessoas LGBTQIA+em todas as nossas vagas.Show moreShow less",N/A,On-site/Hybrid,https://www.linkedin.com/jobs-guest/jobs/api/jobPosting/4378842918,2026-03-10
Cientista de Dados,OXXO Brasil,"São Paulo, São Paulo, Brazil",16 minutes ago,"Estamos construindo um dos maiores ecossistemas de varejo de proximidade do Brasil. Desde 2020, quando abrimos nossa primeira loja, aOXXO Brasilcresce de forma acelerada no varejo de proximidade, sempre acreditando que cada nova esquina é uma oportunidade de estar mais próximo, salvar o dia e fazer parte da rotina das pessoas.Fazemos parte da divisão FEMSA Proximidade, Américas e Mobilidade e nossa cultura marcada pelo“Sempre Próximo”se reflete em comportamentos como disciplina, foco nas pessoas e desenvolvimento de talentos.Se você valoriza melhoria contínua, tem foco no cliente e quer crescer em um negócio em constante evolução, aqui é o seu lugar.Venha fazer parte da OXXO Brasil e construa com a gente um futuro mais próximo, simples e humano.Responsabilidades e atribuiçõesDesenvolvimento e implementação de modelos de Machine Learning aplicados a problemasreais de negócio;Fazer uso de IA Generativa (GenAI) e modelos de linguagem (LLMs)para desenvolver soluções analíticas e automações que apoiem a tomada de decisão e gerem impacto direto no negócio;Monitoramento contínuo de performance dos modelos (drift, estabilidade, métricas técnicas e de negócio);Realização de análises avançadas para direcionamento estratégico;Deploy de modelos de Machine Learning em ambientes produtivos;Atuação próxima às áreas de negócio para entendimento do problema, definição de abordagem analítica e entrega de impacto mensurável.Requisitos e qualificaçõesEnsino superior completo;Experiência sólida em modelagem estatística e técnicas de Machine Learning,Manipulação de grandes volumes de dados estruturados e não estruturados;Vivência com Python, SQL, Spark e ferramentas de processamento e análise de dados;Experiência com deploy de modelos e acompanhamento em produção;Experiência com modelos de classificação, regressão e séries temporais;Vivência com frameworks de IA generativa como LangChain e LangGraph, serão considerados diferenciais.Informações adicionais⬇️ O que oferecemos:🏡 Sistema de trabalho MultiFlex – aqui você pode trabalhar de sua casa ou de onde quiser 2 vezes na semana.🕗 Horário Flexível - temos flexibilidade para o horário de entrada e saída, desta forma, você organiza melhor no seu cotidiano.👕 Sem Dress Code - você é livre para trabalhar como se sentir confortável no dia-a-dia, respeitando as demais pessoas que irão conviver junto a você.🚗 Vale Transporte ou Estacionamento no local - você poderá vir para o escritório de transporte comum ou com seu veículo próprio tendo cobertura de 50% do estacionamento.💳 Vale Refeição - disponibilizado no cartão Ticket.🏥 Assistência Médica e Odontológica - temos parceria com a SulAmérica, abrangência nacional, sem desconto de mensalidade para você e seus dependentes, apenas com coparticipação.🧡 Seguro de Vida - para você e sua família, com toda assistência em caso de acidente ou falecimento.💪Convênio Academia - por aqui colocamos a saúde em primeiro lugar, por isso temos parceria com o Gympass, que oferece diversas soluções de bem-estar para o nosso time!👶🏻 Auxílio Creche ou Acompanhante - as mamães que fazem parte do nosso time contam com auxilio creche ou reembolso de babá para seus filhos.💲 Cooperativa de Crédito - temos a parceria com a Barracred para oferecer a você empréstimos consignados com juros abaixo dos praticados pelo mercado.🛒 Clube de descontos - você terá acesso a Allya, que conecta mais de 30.000 estabelecimentos, oferecendo benefícios e vantagens financeiras, tudo de forma personalizada em uma única plataforma.📈 Previdência Privada - para você investir no seu futuro com a Raizprev.💰Bônus Anual - valorizamos o potencial das NOSsas pessoas, por isso reconhecemos anualmente o atingimento de metas.🤝Parceria com SESC - visando o seu bem estar e de seus familiares, com atuação em todo o Brasil!👩👨 Licença Maternidade e Paternidade - aqui a nossa licença maternidade é estendida para 6 meses e a paternidade para 20 dias.📚 Educa - NOSsa plataforma de universidade corporativa, voltada para o desenvolvimento e capacitação das NOSsas pessoas e clientes.💬 Carreira além da hierarquia - nosso plano de desenvolvimento de carreira é claro para as NOSsas pessoas, por isso contamos com uma cultura de feedbacks e 1:1's frequentes!Show moreShow less",N/A,On-site/Hybrid,https://www.linkedin.com/jobs-guest/jobs/api/jobPosting/4376708344,2026-03-10
