title,company,location,posted,description,applicants,work_mode,link,data_coleta
Especialista Inteligência Artificial,Vivo (Telefônica Brasil),"São Paulo, São Paulo, Brazil",1 week ago,"Descrição da vagaVice-Presidência:CHIEF INFORMATION OFFICERDiretoria:DIR INTELIGÊNCIA ARTIFICIALLocal de Trabalho:RemotoVocê não está aqui para apenas ""implementar modelos"". Você está aqui pararedefinir a engenharia.Estamos construindo a fundação de uma nova era. Na nossa estrutura deDiretoria de Inteligência Artificial, não tratamos a IA como um ""puxadinho"" tecnológico ou um chat isolado; nós construímossoluções nativas de IA. Nosso foco é arquitetar plataformas, produtos e ecossistemas onde a inteligência é o motor central, e não um acessório.Buscamos profissionais que tenham a mentalidade deAI-Native. Pessoas que queiram sujar as mãos na construção de arquiteturas de agentes, sistemas multi-modais e infraestruturas de alta performance que sustentam a escala da maior empresa de tecnologia e telecomunicações do país.O DesafioO papel doEngenheiro de IAaqui é o de um construtor de elite. Você atuará na intersecção entre o código elegante e a inteligência computacional, transformando o ""estado da arte"" em ""estado da produção"".Esqueça o trabalho puramente experimental. O nosso foco é odelivery de alto impacto:Construir do Zero: Criar plataformas e produtos que nascem com IA no core.Orquestrar o Futuro: Implementar arquiteturas de agentes autônomos e sistemas de RAG avançados que resolvam problemas reais em milissegundos.Escalar a Inteligência: Garantir que nossas soluções sejam resilientes, seguras e capazes de processar volumes massivos de dados com eficiência e baixo custo.Responsabilidades e atribuiçõesBuscamos um(a)Especialista em Engenharia de Softwarepara ser a referência técnica máxima na nossa estrutura de Plataforma de Engenharia IA. Você será responsável por garantir que o ""core"" das nossas soluções de IA e Agentes seja de classe mundial, atuando na resolução de desafios complexos de escalabilidade, baixa latência e integração de modelos de linguagem em larga escala.ResponsabilidadesDesenhar e sustentar arquiteturas complexas de alta disponibilidade para APIs e serviços que suportam o ecossistema de IA da Vivo.Liderar a definição de padrões de codificação e design (Design Patterns, Clean Architecture), servindo de referência para os desenvolvedores Sêniores e Plenos.Otimizar a performance e custos de serviços em nuvem, garantindo eficiência no processamento de grandes volumes de dados e chamadas de modelos (LLMs).Mentor técnico prático: Realizar revisões de código críticas e sessões de pairing para elevar o nível técnico do time.Desenvolver componentes críticos e SDKs internos que serão consumidos por múltiplas squads de IA.Garantir a resiliência do sistema através de estratégias avançadas de observabilidade, tratamento de falhas e automação de infraestrutura.Requisitos e qualificaçõesRequisitos (Profundidade Técnica)Vasta experiência com desenvolvimento backend utilizando Node.js e Nest.js.Domínio profundo de arquitetura de microsserviços, padrões de mensageria e comunicação assíncrona (Event-driven, WebSockets, gRPC).Expertise em Kubernetes (AKS): configuração de recursos, escalonamento horizontal/vertical e gestão de containers em larga escala.Conhecimento avançado em Cloud Native (Azure): Event Hub, Cosmos DB, Redis e estratégias de cache.Experiência sólida em Segurança: Implementação de fluxos de autenticação complexos (OAuth 2.0, OIDC) e proteção de dados.Domínio de Infra as Code (Terraform) e automação de infraestrutura para ambientes produtivos críticos.Forte base em Bancos de Dados: Otimização de queries, modelagem NoSQL e gestão de consistência.Diferenciais de EspecialidadeExperiência profunda com LangChain, LangGraph e orquestração de Agentes Autônomos.Conhecimento técnico em Engenharia de Prompt e RAG (Retrieval-Augmented Generation) para otimizar respostas de LLMs.Familiaridade com ferramentas de APM e Observabilidade (Dynatrace, Prometheus, Grafana) para diagnóstico de causa raiz em sistemas distribuídos.Perfil EsperadoHands-on e Mentor: Você ama o código, mas sente prazer em ensinar e elevar a barra técnica do time.Foco em Excelência: Inconformismo com soluções ""que apenas funcionam""; busca sempre a melhor arquitetura e performance.Resolução de Problemas: Capacidade analítica para diagnosticar gargalos técnicos complexos em produção.Comunicação Técnica: Habilidade para explicar decisões arquiteturais complexas de forma clara para o time de engenharia.Informações adicionaisVeja o que ofereceremos para você: Na Vivo não medimos esforços em apoiar e valorizar nossos colaboradores. Não são apenas excelentes benefícios, mas também flexíveis.Escolher o benefício ideal para você e seus dependentes, numa plataforma digital com diversas categorias de Academia, VR, VA, Auxílio Farmácia, Assistência Médica, Odontológica e Seguro de Vida;Celular corporativo. Sim, um smartphone novinho para você!Plano de voz e Dados ilimitado! Sim ilimitado! Com a melhor rede móvel, ainda mais rápida com o 5G da Vivo!Uma oferta exclusiva da Vivo, com desconto especial em linha fixa, banda larga, TV e apps;Terá direito a receber Bônus ou PPR anual;Planejará seu futuro através do plano de Previdência Privada;Tem filhos? Terá direito a um subsídio para ajudar nas despesas com escola, creche ou babá;Viver em um ambiente que respeitará sua personalidade, seu estilo de se vestir, seu jeito de ser e poderá ser autêntico. #VemdeVocêTrabalhar remotamente até 2 vezes por semana. #MobilityTer flexibilidade de horário;Aproveitar um dia de folga (Day off) para comemorar seu aniversário;Participar de um dos maiores programas de voluntariado corporativo para você transformar o mundo;Usufruir do nosso Programa de Desenvolvimento Educacional que oferece parcerias em instituições de ensino com desconto; certificações e cursos online.Potencializar sua carreira por meio do nosso Programa de Recrutamento Interno, no Brasil ou fora, afinal estamos presentes em mais de 17 países! #VivoMinhaCarreiraContar com uma série de iniciativas para melhorar a sua saúde física, emocional e social! Por aqui, temos o #VivoBemEstar, que estimula o nosso time a ter hábitos saudáveis e mais qualidade de vida! Disponibilizados aos nossos colaboradores consultas com nutricionista, psicólogos, serviço social, telemedicina, e muito mais!Todas as nossas vagas são elegíveis a pessoas com deficiência e/ou reabilitados. Temos uma cultura que valoriza a diversidade, as diferenças e o potencial das pessoas! #VivoDiversidade #VemPraVivo Importante: A única forma de participar de processos seletivos da Vivo é por meio das páginas da empresa na plataforma Gupy https://vivo.gupy.io e não há pagamento de taxa de participação ou contratação.Etapas do processoCadastroTriagemAvaliação comportamental MAPAEntrevista com RHAvaliação comportamental PPA (DISC)Entrevista com GestorPropostaContrataçãoSobre nósSomos uma empresa do Grupo Telefônica, líder em telecomunicações no Brasil. Trabalhamos com o propósito deDigitalizar para Aproximarpessoas, negócios e toda sociedade, construindo uma nação mais conectada e transformando a vida dos brasileiros. Buscamos ampliar a autonomia, a personalização e as escolhas em tempo real dos nossos clientes, colocando-os no comando da sua vida digital, com segurança e confiabilidade – tudo isso com a qualidade que só a Vivo tem.Para que isso seja possível, lideramos um processo de transformação digital e estamos revolucionando nossa companhia de dentro para fora. Implementamos metodologias ágeis por toda a empresa, buscando nos conectar com as formas mais inovadoras e colaborativas de trabalho. Atuamos para fomentar um ambiente diverso e inclusivo, que estimula a criatividade, gerando inovação e aumentando o engajamento.Acreditamos que adiversidadede pessoas, vivência, culturas, comportamentos, habilidades e atitudes é um diferencial, que reflete a sociedade em que vivemos. Temos um sólido programa interno, pautados nos pilares de Gênero, LGBTI+, Raça, PcD e 50+ para assegurar uma cultura mais inclusiva e um ambiente mais diverso e representativo. Somos uma empresa detecnologia,inspirada na diversidade e nainovação,que oferece espaço para todos, apoia e acolhe as diferenças.Acreditamos que o caminho para oferecer a melhor experiência ao nosso cliente começa pela boa experiência do nosso colaborador.#VemPraVivoShow moreShow less",N/A,On-site/Hybrid,https://www.linkedin.com/jobs-guest/jobs/api/jobPosting/4380168452,2026-03-10
Cientista de dados Pleno | Inflação,Warren Investimentos,"São Paulo, São Paulo, Brazil",1 month ago,"Na Warren, confiança é a base de tudo. Nossos clientes sabem, com total transparência, como seus investimentos são geridos, quais as taxas envolvidas e o nível de risco de cada um. Nosso propósito é eliminar o conflito de interesses no mercado de investimentos brasileiro: não somos comissionados pelos produtos sugeridos, garantindo que o perfil e os objetivos de cada cliente estejam no centro de todas as decisões.Se você acredita em ummercado financeiro mais transparente, capaz de oferecer a melhor experiência de investimentos para seus clientes, a Warren é o seu lugar. Aqui, você terá a oportunidade de se desenvolver enquanto atua em um ambiente de alta performance, aprendendo com os melhores profissionais do mercado. Buscamos pessoas que valorizam o trabalho em equipe, sempre prezando pela ética e excelência em suas entregas.Somos uma empresa para todas as pessoas que desejam fazer o seu melhor todos os dias, independentemente de gênero, etnia, orientação ou qualquer outra condição, e nosso processo seletivo é baseado na neutralidade.Responsabilidades e AtribuiçõesÉ uma vaga ideal para quem tem interesse em trabalhar com dados aplicados à macroeconomia..Criar relatórios e dashboards que auxiliem no acompanhamento de coleta de preços;Garantir a interface com o time de dados interno, alinhando demandas e consolidando informaçõesRequisitos e QualificaçõesDatabricksAWSLógica de programaçãoBoa comunicaçãoSQLPythonExcelSerá considerado um diferencialConhecimento em limpeza com arquivos Excel e ou CSV.Experiência com ETL/ELT.Extração de dados via API.Pensamento analítico.Matemática e Estatística.O que a Warren te proporciona?Cultura de inovação com times multidisciplinares e estrutura horizontal, focados em desenvolver as melhores soluções para nossas pessoas usuárias. Possibilidade de contribuir em frentes diversas para o seu crescimento.Plano de Saúde SulAmérica para você e seus dependentes;Plano Odontológico Care Plus para você e seus dependentes;Benefício VR e VA;Licença maternidade estendida;Licença paternidade estendida;Day off de aniversário;2 Day Offs remunerados por ano;Auxílio Creche;Auxílio Transporte;Programa de Partnership: seja uma pessoa sócia da Warren.Bonificação Variável Semestral;TotalPass;Seguro de Vida Prudential.Show moreShow less",N/A,On-site/Hybrid,https://www.linkedin.com/jobs-guest/jobs/api/jobPosting/4367025775,2026-03-10
BRA Data Scientist Spec III,Santander Brasil,"São Paulo, São Paulo, Brazil",6 days ago,"Country: BrazilSe você tem vontade de crescer e aprender sempre, e tem paixão em impactar pessoas através de soluções de dados, esse pode ser o seu lugar.Temos uma vaga para você se tornarData & Analytics Spec III.Aqui, seu papel será:Desenvolver, implementar e manter soluções de otimização matemática e ciências de dados, para desafios em cobrança.Projetar, construir e colocar em produção modelos de machine learning e pipelines de dados robustos, com foco em escalabilidade e manutenibilidade.Colaborar estreitamente com equipes de ciências de dados, engenharia e negócios para entender necessidades, traduzir problemas de negócio em soluções, e comunicar resultados e insights.Liderar boas práticas de engenharia de software (CI/CD, testes, versionamento, documentação) dentro do time de data science, atuando como referência técnica.Mentorar e apoiar no desenvolvimento de outros membros do time de dados.Para esse papel, valorizamos:Habilidades e Experiência Necessárias:Formação em Ciência da Computação, Engenharia, Matemática, Estatística, Física ou áreas correlatas.Experiência sólida e comprovada (5+ anos) em Ciência de Dados/Análise de dados, com Python como linguagem principal.Domínio em otimização matemática: experiência prática com bibliotecas como PuLP, CVXPY, Gurobi, CPLEX, OR-Tools ou similares.Forte habilidade de desenvolvimento em python e spark: experiência com ambientes de produção, versionamento (Git), testes unitários/integração, princípios de código limpo.Experiência com ecossistema de dados (pandas, NumPy, Scikit-learn, PySpark) e em colocar modelos em produção (APIs, contêineres, workflows) e Databricks.Capacidade de comunicar conceitos técnicos complexos para públicos não-técnicos de forma clara.Diferenciais:Pós-graduação (especialização, mestrado, doutorado) com foco em pesquisa operacional, otimização ou áreas afins.Conhecimento em arquitetura de dados e ferramentas de cloud (Databricks e Azure).Experiência com orquestração de pipelines (Airflow, Prefect).Conhecimento em DevOps/MLOps.Idioma:Inglês intermediário/avançado para leitura de documentação e comunicação em ambientes internacionais (desejável).Qual a modalidade da vaga?HíbridaO escritório está localizado em Vila Olímpia, São Paulo (Capital).Você vai se identificar com a gente se tiver:Think Customer – Penso no ClienteEmbrace Change – Impulsiono a mudançaAct Now – Atuo com rapidezMove Together – Trabalho em equipeSpeak Up – Falo abertamenteSe isso te chama, vem para o Santander! ♨️#AquiSuaChamaTransforma #VemProSantander #VemSerChamaShow moreShow less",N/A,On-site/Hybrid,https://www.linkedin.com/jobs-guest/jobs/api/jobPosting/4380588918,2026-03-10
Cientista de Dados Sênior,XP Inc.,"São Paulo, São Paulo, Brazil",5 days ago,"Sobre nósA XP Inc. é uma das maiores instituições financeiras independente do Brasil, dona das marcas XP, Rico, Clear, XP Educação, InfoMoney, entre outras. Com mais de 4,6 milhões de clientes ativos e um valor superior a R$ 1,1 trilhão de ativos sob custódia, há 24 anos vem transformando o mercado financeiro para melhorar a vida das pessoas.Com uma cultura marcante guiada por quatro valores -Sonho Grande, Espírito Empreendedor, Foco no Cliente e Mente Aberta- a XP Inc. está sempre em busca dos melhores talentos que tem ambição de fazer o impossível.🚀 Sobre a OportunidadeVocê será parte de um time multidisciplinar (dados, data science, mlops, risco, compliance e tecnologia) responsável por:Desenvolver e evoluir modelos de detecção de transações suspeitas de lavagem de dinheiro e financiamento ao terrorismo.Aumentar a efetividade do monitoramento, regras (mais casos relevantes) e reduzir o volume de falsos positivos, melhorando a eficiência das áreas de investigação.Estruturar e analisar grandes volumes de dados transacionais, cadastrais e comportamentais dos clientes para identificar padrões anômalos.Traduzir requisitos regulatórios de PLD em lógicas, regras, features e modelos que possam ser auditados e explicados para áreas internas e reguladores.ResponsabilidadesTrabalhar lado a lado com times de PLD/Compliance, Risco, Controles Internos e Tecnologia, entendendo regras, cenários de risco, tipologias e necessidades regulatórias.Criar e acompanhar KPIs de performance dos modelos.Apoiar o desenho de estratégias híbridas (modelos + regras) para garantir:Eficácia na detecção;Aderência a normas de PLD (BACEN, CVM, COAF);Explicabilidade mínima para investigações e auditorias.Prototipar, testar e colocar em produção soluções analíticas em parceria com engenheiros de dados e de machine learning.Documentar abordagens, premissas, limitações e resultados, garantindo auditoria e rastreabilidade.Acompanhar tendências e melhores práticas em AML/PLD IA/LLM, trazendo inovações estratégicas para o time.Saiba mais sobre nosso dia a dia no Instagram e no LinkedIn.Confira nossas avaliações no Glassdoor.🔍 O Que ProcuramosPré-requisitos EssenciaisFormação em cursos como: Engenharia, Ciência da Computação, Estatística, Matemática, Física, Economia, Ciências de Dados ou áreas correlatas.Experiência prévia (sênior) trabalhando com Ciência de Dados ou Machine Learning em ambiente de negócios (não precisa ser necessariamente em PLD, mas será diferencial).Domínio de Python e principais bibliotecas de dados/ML (p.ex. pandas, NumPy, scikit-learn, PySpark etc).Experiência com SQL para manipulação de grandes volumes de dados.Vivência EmProblemas supervisionados (classificação, regressão) e não supervisionados (clustering, detecção de anomalias);Construção de features e avaliação de modelos.Capacidade de traduzir problemas de negócio (PLD, risco, compliance) em problemas analíticos e de dados.Boa comunicação para dialogar com stakeholders não técnicos (PLD, Jurídico, Controles, Operações).DiferenciaisExperiência prévia em PLD/AML, prevenção à fraude, risco de crédito ou modelos de risco em instituições financeiras.Conhecimento ou experiência com:Grafos e análise de redes (p.ex. para relacionamentos entre clientes, contas, contrapartes);Modelos de detecção de anomalias (Isolation Forest, Autoencoders, etc.);Ambientes de big data (Spark e Databricks) e cloud (Azure).Familiaridade com normativos de PLD e reguladores (BACEN, CVM, COAF).Experiência com MLOps (versionamento de modelos, monitoramento em produção, retraining).Conhecimento em explicabilidade de modelos (SHAP, LIME) para apoiar times de PLD/Compliance na justificativa de decisões.Benefícios:Saúde e Bem-estarPlano de saúde sem coparticipação (inclusive, para dependentes)Plano odontológicoWellhub (Gympass)ZenklubSeguro de VidaiFood Benefícios (VA e VR flexível)Vale TransporteNew Value (clube de benefícios)Licença parental: maternidade de 6 meses e paternidade de 20 dias.Auxílio CrecheVida FinanceiraFundos de Investimentos ExclusivosAssessoria de InvestimentosCartão XP Visa Infinite sem anuidadeCrédito (consignado, home equity, CCB Imobiliário, etc.)Modelo de Trabalho Presencial FlexívelO nosso modelo de trabalho varia de acordo com a função, podendo ser totalmente presencial para frentes de negócio e mais flexível para outras equipes.Seguimos um modelo com mais frequência presencial, mas sempre guiado por flexibilidade e autonomia com a responsabilidade da nossa cultura empreendedora.Aqui na XP Inc., valorizamos as interações pessoais e acreditamos no uso do escritório como uma ferramenta para potencializar nossas relações no trabalho.Ao seguir com a inscrição, você declara que leu, compreendeu e concorda com a Política de Privacidade do Grupo XP Inc. e de seus fornecedores e parceiros que apoiam com a realização do processo seletivo. O Grupo XP Inc. poderá utilizar de soluções de inteligência artificial para apoiar a equipe de recrutamento no decorrer do processo, o que poderá envolver o tratamento de seus dados pessoais para tal finalidade, conforme princípios da Lei Geral de Proteção de Dados e da Política de Privacidade do Grupo XP Inc.Show moreShow less",N/A,On-site/Hybrid,https://www.linkedin.com/jobs-guest/jobs/api/jobPosting/4342822057,2026-03-10
Cientista de Dados Sênior  - SP,innolevels,Greater São Paulo Area,10 hours ago,"Estamos contratandoCientista de Dados Sêniorpara a execução de projetos de transformação digital, desenvolvendo ferramentas inovadoras para entregar a melhor experiência para os usuários da plataforma de uma grande empresa.Para Essa Evolução, é Necessário Conhecimento EmPython, R e SQL avançado;Machine Learning, estatística e modelagem preditiva;Big Data: Spark, Hadoop, Databricks;Ferramentas de visualização: Power BI, Tableau, Matplotlib, Seaborn;Bancos de dados relacionais e não relacionais (SQL Server, PostgreSQL, MongoDB);ETL/ELT e pipelines de dados;Cloud computing: AWS, Azure, GCP.RESPONSABILIDADES PRINCIPAISVivência com projetos modelagem, estatística, Machine Learning e Business Analytics;Experiência em implementação de modelos de predição e análise de grande volume de dados;Graduação em Estatística, Matemática, Engenharia, Ciência da Computação, TI ou áreas correlatas.Pós-graduação, MBA ou especialização em Data Science, Machine Learning, Analytics ou Inteligência Artificial;Certificações desejáveis: Data Science/ Machine Learning (ex.: Microsoft, Google, IBM, DataCamp)/ Big Data & Analytics (ex.: Databricks, AWS, Azure ML).Tem interesse?Candidate-se à nossa vaga — teremos o grande prazer de compartilhar essa experiência com você.“Grandes coisas em termos de negócios nunca são feitas por uma pessoa. São feitas por uma equipe de pessoas.""Formação AcadêmicaNão informadoSalário8000CargoOutrosEmpresaInnolevelsAtua como reparação e manutenção de computadores e de equipamentos periféricos.RamoInformática/ Tecnologia(GG)Show moreShow less",N/A,On-site/Hybrid,https://www.linkedin.com/jobs-guest/jobs/api/jobPosting/4381799433,2026-03-10
