title,company,location,posted,description,applicants,work_mode,link,data_coleta
Cientista de Dados Sênior - Hibrido,FOURSYS,"Barueri, São Paulo, Brazil",6 days ago,"A Foursys é um time apaixonado por inovação, design e transformação digital.Somos globais, somos GPTW.🌈 👵 ♿️👩🏾 Na Foursys, celebramos a diversidade e acreditamos que são as diferentes ideias e perspectivas que nos enriquecem. Portanto, sua cor, religião, gênero, raça, nacionalidade, idade, origem, identidade de gênero, deficiência ou orientação sexual não são barreiras para se juntar à nossa equipe.#VemSerFoursys!Todas as nossas vagas estão abertas para Pessoas com Deficiência (PCD). Caso você se enquadre ou conheça alguém com o perfil, a Foursys é a empresa ideal!Que tal se juntar a nós e se tornar um(a) #FourTalent?Então se liga nessa oportunidade incrível: 👇Detalhes da vaga-CLT + Benefícios-Local de atuação: Barueri-Modelo de atuação: Hibrido, presencial 2x📋 Principais DesafiosAtuar na análise, gestão e evolução de dados de crédito, apoiando a tomada de decisão estratégica por meio de análises robustas, garantindo qualidade da informação, mitigação de riscos e melhoria contínua dos processos.📌 Responsabilidades e AtividadesGerenciar bases de dados, garantindo integridade, consistência e atualização das informações de crédito.Identificar e tratar inconsistências, realizando análises e correções necessárias.Monitorar bases de clientes, identificando riscos, divergências e oportunidades de melhoria.Atuar na melhoria contínua dos processos de qualidade e tratamento de dados.Trabalhar em conjunto com áreas internas para correção de falhas e alinhamento de informações.Elaborar relatórios, controles e apresentações executivas com análises de desempenho.Garantir aderência às políticas internas e critérios de análise de crédito.Mapear e revisar processos de concessão de crédito, identificando ganhos de eficiência.Apoiar áreas de negócio na análise de propostas e decisões de crédito.Analisar demonstrações financeiras, histórico de crédito e capacidade de pagamento.Elaborar pareceres de crédito com recomendações técnicas e estratégicas.Monitorar carteira de crédito, acompanhando indicadores de risco, inadimplência e exposição.Apoiar na definição e revisão de políticas de crédito, limites e garantias.📌 Requisitos TécnicosExperiência com análise de crédito, risco e dados financeiros.Domínio de SQL Server para consultas e manipulação de dados.Excel avançado (uso intensivo para análise e modelagem).Experiência com ferramentas de BI (Power BI ou similares).Familiaridade com bureaus de crédito (Serasa, SPC ou similares).Conhecimento em políticas de crédito, compliance e indicadores financeiros.Noções de modelagem de risco e score de crédito.Conhecimento em automação de processos (RPA) e integração de sistemas.Python (diferencial relevante).💡 Habilidades TécnicasSQL Server (Avançado)Excel (Avançado)Power BI (Avançado)Análise de Crédito e RiscoModelagem de Dados e IndicadoresSistemas de CréditoAutomação (RPA)Python (Desejável/Intermediário)E temos o Clube da Four que oferece ótimas vantagens!👇🩺 Assistência médica;🍲 VR e VA flexível;🏋️ Gympass e Wellz;⚽ Parceria com o SESC;🍣 Descontos em restaurantes;📚 Descontos em cursos técnicos e de ensinos superior;🧠 Descontos em escolas e plataformas de idiomas.E aí, aceita o desafio? Então conclua sua inscrição e #VemSerFoursys! Boa sorte! 🍀Show moreShow less",N/A,On-site/Hybrid,https://www.linkedin.com/jobs-guest/jobs/api/jobPosting/4427573782,2026-06-18
Cientista de dados sênior,ClickBus,"São Paulo, São Paulo, Brazil",1 day ago,"O que nos move diariamente?Viabilizamos momentos únicos e transformadores viajando de Bus.E sabe como a gente faz isso?Mais do que construir a maior plataforma de marketplace de passagens rodoviárias, atuamos com contribuição contínua para o desenvolvimento, compreensão e empatia interfuncional, trabalho em equipee comunicação assertiva, para criar soluções que realmente façam a diferença.Experimentamos, aprendemos rápido e evoluímos sempre, movidos pelo inconformismo, pela adaptabilidade, pela velocidade e pela busca constantepor eficiência e excelência. É assim que garantimos entregas relevantes, inovadoras e com alto impacto.Trabalhamos para que as pessoas possam estar presentes onde querem e precisam e, principalmente, para viabilizar aquela viagem a mais — aquela que, muitas vezes, nem imaginavam ser possível.Porque a gente sabe que não basta vislumbrar apenas a chegada ao destino. O nosso papel é viabilizar momentos únicos e transformadores, impactando positivamente a vida de milhões de pessoas.#DeUmBus #VemPraBus#GoBusNossa Cultura eValoresValores Da BusRespeito: Somos empáticos e não abrimos mão da integridade e respeito mútuo. Sempre contribuímos com feedbacks construtivos para potencializar o crescimento pessoal e profissional dos nossos colegas. Compartilhamos conhecimento e comemoramos o sucesso uns dosoutros.Inovação: Somos inquietos e sempre questionamos o status quo. Experimentamos novas ideias e abordagens, agimos e reagimos rapidamente visando sempre o impacto positivo no negócio, mesmo que isso envolva riscos ou incertezas e somos flexíveis o suficiente para mudar de direção quando necessário.Colaboração Efetiva: Somos um time de alta performance e acreditamos que atuamos melhor juntos, sempre buscando colaborar, co-criar e nos desafiar. Somos assertivos, escutamos de forma ativa, considerando os feedbacks recebidos e garantimos que nossa fala tenha clareza e objetividade. Damos visibilidade ao que é importante e estamos sempre trocando ideias uns com osoutros.Ownership: Assumimos o compromisso pelos resultados finais, nos comportamos como donos do negócio, mesmo quando a atividade não está diretamente relacionada às nossas atribuições. Valorizamos a excelência em tudo que fazemos e nos sentimos responsáveis pelo sucesso ou insucesso dos projetos e da ClickBus comoum todo.Responsabilidades e atribuiçõesVocê Irá: (Responsabilidades)ConduçãoTécnica: Conduzir projetos complexos de Data Science, tomando decisões críticas e garantindo o alinhamento com os objetivos estratégicos da companhia.Resolução de Problemas: Traduzir necessidades de negócio ambíguas em problemas de ciência de dados bem definidos, identificando oportunidades para aplicar soluções avançadas de Machine Learning, Deep Learning e IA Generativa.Desenvolvimento deModelos: Criar, implementar e otimizar modelos preditivos e prescritivos (como otimização, classificação, regressão e deep learning) para resolver problemas específicos e alavancar nossos processos.Inovação com IA Generativa: Aplicar e experimentar com Inteligência Artificial Generativa para criar novas oportunidades de negócio e soluções disruptivas.Gestão do Ciclo de Vida deModelos: Garantir a entrega de produtos de dados de alta performance, desde a coleta e identificação de fontes de dados até a avaliação, validação, ajuste e monitoramento contínuo dos modelos emprodução.Comunicação de AltoImpacto: Comunicar resultados, insights e recomendações estratégicas de forma clara e eficaz para stakeholders e liderança executiva.Colaboração Multidisciplinar: Trabalhar em estreita colaboração com times de engenharia de dados, analistas de negócio e desenvolvedores para garantir a integração, viabilidade e escalabilidade dassoluções.Requisitos e qualificaçõesEsses são os itens que não podem faltar na sua bagagem:Experiência Comprovada: Sólida experiência na condução de projetos de grande escala em Ciência de Dados, desde a concepção até a implementação e manutenção.Proficiência em MachineLearning: Domínio no desenvolvimento e implementação de uma variedade de modelos (Machine Learning clássico, Deep Learning) e algoritmos estatísticos.Inovação em IA: Experiência prática ou forte conhecimento em Inteligência Artificial Generativa (GenAI/LLMs) e sua aplicação para resolver problemas de negócio.Arquitetura e engenharia: Conhecimento das ferramentas AWS para colocar em produção projetos de IA e ML.Visão Estratégica e de Negócio: Habilidade para traduzir desafios de negócio em planos de trabalho técnicos, gerenciar expectativas de stakeholders e influenciar a estratégia de dados da empresa.Habilidades de Comunicação: Excelente capacidade de comunicar conceitos técnicos complexos, resultados e recomendações para públicos variados, incluindo a liderança sênior.Mentalidade Colaborativa: Experiência em trabalhar com equipes interdisciplinares, promovendo um ambiente de colaboração einovação.Curiosidade e AprendizadoContínuo: Paixão por se manter atualizado(a) com as mais recentes pesquisas e técnicas em ML, DL e IA, trazendo inovação para dentroda equipe.InformaçõesadicionaisBenefíciosO que nósoferecemos:🥘Alimentação/Refeição: R$ 1.000,00/mês creditado nocartão Flash;💻 Auxílio home office: R$ 149,00/Mês creditado nocartão Flash;💰Benefício Flexíveis: R$ 200,00/Mês creditado nocartão Flash;🚐Busonauta Viajante: Nosso benefício exclusivo para pessoas Busonautas, são R$ 2.000,00/Ano para utilizar nas compras de passagens rodoviárias noAPP ou SITE;🚋Vale transporte.🅿️Estacionamento.🏥Assistência Médica SulAmérica: sem coparticipação e semmensalidade;🦷Assistência Odontológica Bradesco;👶Auxílio Creche para mamães e papais;🤰Licença Maternidade de 06 meses e licença paternidade de 30 dias;🔒Seguro de Vida;🏋️ ♀️ Wellhub e totalPass💸PLR anual🏖️Day OFF deaniversário;🐶Convênio Petlove;🩹Auxílio Farmácia;🧑 🦽 ➡️Auxílio filho PCD.📚 Parceiras com instituições de ensino e lazer;Show moreShow less",N/A,On-site/Hybrid,https://www.linkedin.com/jobs-guest/jobs/api/jobPosting/4429578602,2026-06-18
AI Training Experts,Prolific,"São Paulo, São Paulo, Brazil",1 month ago,"About ProlificProlific is not just another player in the AI space – we are building the biggest pool of quality human data in the world.Over 35,000 AI developers, researchers, and organizations use Prolific to gather data from paid study participants with a wide variety of experiences, knowledge, and skills.The roleWe're looking for AI Training Experts to help train and evaluate cutting-edge AI models. If you have the necessary experience, we'll send you a quick 10- to 15-minute test to assess your skills and suitability for AI tasks. If successful, you'll be invited to join Prolific as a participant, where you'll get paid to train and evaluate powerful AI models.Researchers looking for your skills tend to pay upto of $25/hr per AI task completed. You must be prepared to complete paid tasks that require one hour of uninterrupted work, though many are shorter.What you'll bringAI Training task skills and verifiable professional experience as an AI TrainerA willingness to take our skills verification test to assess your suitability for our participant poolStrong attention to detail and the ability to concentrate on complex tasks for up to one hour at a timeA reliable and fast internet connection and access to a computerA willingness to self-declare your earnings, as our participants are self-employedA Paypal account to receive payment from our clientsWhat you'll be doing in the roleCompleting AI training tasks such as analyzing, editing, and writing annotationsJudging the performance of AI in performingImproving cutting-edge AI modelsWhy Prolific is a great platform to join as a ParticipantJoining our platform as a Prolific participant will give you the chance to influence the AI models of the future using professional legal expertise. Once you pass our assessment, you can join Prolific in just 15 minutes, and start enjoying competitive pay rates, flexible hours, and the ability to work from home.We've built a unique platform that connects researchers and companies with a global pool of participants, enabling the collection of high-quality, ethically sourced human behavioural data and feedback. This data is the cornerstone of developing more accurate, nuanced, and aligned AI systems.We believe that the next leap in AI capabilities won't come solely from scaling existing models, but from integrating diverse human perspectives and behaviours into AI development. By providing this crucial human data infrastructure, Prolific is positioning itself at the forefront of the next wave of AI innovation – one that reflects the breadth and the best of humanity.Links to more information on ProlificWebsiteYoutubePrivacy StatementBy submitting your application, you agree that Prolific may collect your personal data for recruiting and global organisation planning. Prolific's Candidate Privacy Notice explains what personal information Prolific may process, where Prolific may process your personal information, its purposes for processing your personal information, and the rights you can exercise over Prolific use of your personal personal information.Show moreShow less",N/A,On-site/Hybrid,https://www.linkedin.com/jobs-guest/jobs/api/jobPosting/4410773495,2026-06-18
Data Scientist,Reflow,Greater São Paulo Area,2 months ago,"We’re building Reflow, a workforce and workflow intelligence platform that helps teams understand and improve how work gets done. We’re a U.S.-based tech company with a high bar for talent, ownership, and execution — and we’re intentional about building a strong, globally distributed team from the start.We need a Data Scientist to help design and build the algorithms that power insights, pre-label data, and reduce the need for manual configuration by users. This role sits at the intersection of machine learning, product, and data, turning complex data into clear, actionable value for our customers.What You’ll DoDesign and build algorithms that power Reflow’s core intelligence and analytics capabilities.Develop models to pre-label, classify, and structure data, reducing the need for manual setup by users.Collaborate with machine learning engineers to productionize models and integrate them into scalable systems.Partner with product and engineering to translate business problems into data-driven solutions.Build and iterate on models that generate insights, predictions, and recommendations. Help define and improve data structures that support modeling, analysis, and automation.Work on improving the SOP driven experience by reducing manual steps and increasing automation.Analyze complex datasets to identify patterns, trends, and opportunities for product value.Continuously evaluate model performance and iterate to improve accuracy, reliability, and impact.Ensure solutions are efficient, scalable, and aligned with real-world workflows and user needs.Who You AreExperienced in applied data science, machine learning, or advanced analytics in a product-driven environment.Strong foundation in statistics, modeling, and experimental design.Hands-on with Python and common data science libraries.Comfortable building and evaluating models that move into production.Strong SQL skills and ability to work with large, complex datasets.Able to translate ambiguous problems into structured, data-driven solutions. Focused on building systems that reduce manual work and deliver clear value to users. Collaborative and comfortable working across engineering, product, and leadership teams.Bonus pointsExperience with pre-labeling, weak supervision, or automated data labeling techniques. Familiarity with recommendation systems, classification, or predictive modeling.Experience working with ML engineers to productionize models.Understanding of workflow automation, process optimization, or operations analytics.Exposure to real-time data or event-driven systems.Why joinYou’ll help build the intelligence layer of Reflow, creating the algorithms that power automation, reduce manual setup, and unlock meaningful insights for our customers. You’ll work directly with founders and engineers across product, data, and machine learning to shape how intelligence is delivered at scale. This is a high-impact role focused on turning data into real, measurable value.We’re open to part-time or full-time. Ideal for builders who care about applying machine learning to solve real-world problems and creating systems that make users more effective.Compensation:We offer competitive pay based on the market and where you’re located. The salary ranges in our job postings are intentionally wide because they need to cover both U.S. and international candidates. Our final offer will depend on things like your experience, skill set, and location.Show moreShow less",N/A,On-site/Hybrid,https://www.linkedin.com/jobs-guest/jobs/api/jobPosting/4403117242,2026-06-18
CIENTISTA DE DADOS PL,Marketdata,"São Paulo, São Paulo, Brazil",3 months ago,"AMarketdata&Matché a união de duas líderes em Customer Experience e Marketing Automation, formando uma das maiores potências do setor na América Latina. Atuamos com excelência em dados, tecnologia e marketing, implementando e operando plataformas como Salesforce Marketing Cloud. Unimos inteligência analítica, personalização e performance para impulsionar estratégias de CRM e Customer Experience.Integramos uma equipe multidisciplinar e uma metodologia orientada a resultados, entregando soluções que fortalecem o relacionamento entre marcas e consumidores e promovem experiências relevantes, mensuráveis e escaláveis. Somos reconhecidos comoParceira do Ano no ecossistema Salesforce, e integramos o maior hub de Martech e CX da América Latina, entregando excelência em toda a jornada de consumo.Aqui, dados não são apenas números — são direcionamento estratégico. Você vai conectar dados ao negócio e transformar informação em decisões concretas. Seu papel será provocar discussões, estruturar hipóteses, desenvolver análises profundas e criar modelos preditivos que realmente impactem resultados. Mais do que gerar relatórios, você irá interpretar cenários, identificar oportunidades, mensurar campanhas com rigor e construir sistemas de acompanhamento que elevem o nível das decisões.Se você gosta de questionar, investigar, modelar e influenciar com dados — esse desafio é para você.Desafios e AtividadesElo Analítico: Atuar como o braço de inteligência da squad, contribuindo com a geração de insights para orientar os trabalhos.Planejamento Estratégico: Discutir demandas com a gestão e participar ativamente no planejamento das atividades de Analytics que alimentam a squad.Modelagem e Investigação: Desenvolver análises de dados, estudos investigativos e modelos preditivos, aplicando senso crítico apurado aos resultados obtidos.Visão de Negócio: Interpretar os resultados das análises sob a perspectiva estratégica e gerar relatórios, dashboards e materiais executivos de alto impacto.Mensuração: Criar sistemas de acompanhamento de resultados e métodos robustos para mensuração de campanhas.Governança: Manter uma documentação organizada de todas as etapas de trabalho durante a elaboração das análises e modelos.Para Assumir Esse Desafio, Você Precisa TerEstatística e Modelagem: Experiência sólida em modelagem estatística, com foco em segmentação e modelos de propensão.Conhecimento de Marketing: Familiaridade com métodos de mensuração de campanhas e métricas de performance.Programação: Domínio de R ou Python para execução e automação de modelos.Manipulação de Dados: SQL Avançado para extração e tratamento de grandes volumes de informação.Idiomas: Fluência em inglês (essencial para colaboração e documentação).Ferramentas de Apoio: Domínio de Excel e PowerPoint para análises rápidas e apresentações executivas.Formato De AtuaçãoModelo híbrido, com atuação presencial média de 2x por semana na região da Vila Leopoldina (São Paulo).Como atuamos diretamente com diferentes clientes, pode haver necessidade de presença adicional de acordo com o projeto ou demanda. Buscamos profissionais com flexibilidade.O Que OferecemosAuxílio Educacional (inglês, espanhol, graduação e pós-graduação)Plataforma exclusiva de IA + Academia própria de formação em Inteligência ArtificialMarketdata Academy (Treinamentos mensais à disposição dos colaboradores)Parcerias com diversas instituições de ensinoPLR e Happy Day (day off no dia do aniversário)Assistência Médica e OdontológicaAuxílio home office*Programa interno de orientação psicológica, financeira e jurídicaTotalPass e Ginástica LaboralVale Refeição e/ou Alimentação (inclusive no mês das férias)Vale Transporte (opcional)Seguro de Vida e Banco de HorasLicença Maternidade/Paternidade Estendidos e Auxílio CrecheConvênio com CinemarkNa VML, estamos comprometidos em promover um ambiente de trabalho totalmente inclusivo que seja gratificante e que impulsione a carreira. Acreditamos na criação de um ambiente de trabalho dinâmico que valorize a diversidade e a inclusão e nos esforçamos para recrutar uma lista diversificada de candidatos para nos ajudar a atingir esse objetivo. Teremos o prazer de fornecer adaptações razoáveis a pessoas com deficiência que precisem de uma adaptação para usar ou acessar o site de carreiras da VML ou para participar plenamente do processo de candidatura. Caso necessite de uma adaptação para concluir a sua candidatura ou outro aspeto do nosso processo de recrutamento devido a uma deficiência, entre em contato com o nosso departamento de Recursos Humanos ou envie um e-mail para (contato de RH) para solicitar uma adaptação.Ao clicar em ""Enviar Candidatura"", as informações que você inserir abaixo serão encaminhadas para a VML. Recomendamos que, antes de prosseguir, você consulte a nossa Política de Privacidade de Recrutamento. Residentes da Califórnia devem consultar o nosso Aviso de Privacidade de Recrutamento da Califórnia. Nestes documentos, explicamos como tratamos os seus dados pessoais no âmbito do processo de candidatura, bem como a forma como poderá atualizar ou remover as informações que nos forneceu.Show moreShow less",N/A,On-site/Hybrid,https://www.linkedin.com/jobs-guest/jobs/api/jobPosting/4376590932,2026-06-18
