title,company,location,posted,description,applicants,work_mode,link,data_coleta
Analista de Sustentabilidade PL | Viveo |São Paulo/SP,Viveo,"São Paulo, São Paulo, Brazil",2 weeks ago,"VIVEO - Cuidar de cada vida, simples assim!Fundados em 1996, somos líderes na fabricação e na distribuição de materiais e medicamentos para o segmento da saúde, com produtos e soluções para todo o Brasil. Com capital 100% nacional, com mais de 50 unidades operacionais e centros de distribuição em todas as regiões do país, temos nossa própria frota e contamos com mais de 6.500 colaboradores diretos.Com o propósito de cuidar de cada vida, somos a única empresa do Brasil que atua de forma completa no mercado da saúde. Essa atuação reforça nosso compromisso em oferecer soluções confiáveis, ágeis e inovadoras ao setor – incluindo fabricação, distribuição, gestão de estoque, transporte e soluções personalizadas aos hospitais, clínicas, laboratórios, farmácias, atacados, indústrias farmacêuticas e aos pacientes finais. Buscamos encontrar e viabilizar as inovações que definirão como cuidar das pessoas do amanhã.Responsabilidades e atribuiçõesColetar, consolidar e validar informações e indicadores ESG junto às áreas da Companhia;Apoiar a elaboração de relatórios, questionários e reportes de Sustentabilidade para clientes, auditorias e iniciativas de mercado;Acompanhar cronogramas, prazos e planos de ação relacionados à agenda ESG;Realizar follow-up com áreas internas para obtenção e validação de informações;Organizar bases de dados, evidências e documentos de suporte para reportes e auditorias;Apoiar o monitoramento e atualização de indicadores de Sustentabilidade;Auxiliar na preparação de apresentações, materiais executivos e documentos da área;Apoiar processos de auditoria e asseguração de informações ESG;Contribuir para a melhoria de controles, fluxos e processos internos da área;Atuar em parceria com áreas como Meio Ambiente, RH, Compliance, Qualidade e Operações para consolidação de informações e acompanhamento de iniciativas.Requisitos e qualificaçõesRequisitos -Ensino superior completo em Administração, Economia, Engenharia, Gestão Ambiental ou áreas correlatas;Experiência prévia de 2 a 4 anos em atividades analíticas, operacionais ou de suporte a projetos;Vivência ou interesse em temas relacionados à Sustentabilidade, ESG, Meio Ambiente ou Responsabilidade Social;Excel intermediário/avançado;Inglês intermediário para leitura e compreensão de materiais técnicos e questionários internacionais;Boa capacidade de organização, atenção a detalhes e gestão de múltiplas demandas;Facilidade de relacionamento e comunicação com diferentes áreas da Companhia. Diferenciais:Experiência com indicadores ESG, relatórios de sustentabilidade ou frameworks de mercado (GRI, CDP, SASB, entre outros);Participação em processos de auditoria, asseguração ou reporte de informações;Pós-graduação ou especialização em Sustentabilidade, ESG ou áreas correlatas.Informações adicionaisPlano de saúde - cuidando do que mais importa: sua saúde;Plano odontológico - cuidar do sorriso também faz parte;Vale Alimentação - praticidade e qualidade no seu dia a dia;Seguro de vida - segurança e proteção para você e sua família;Previdência Privada - ajudando você a planejar seu futuro;PPR - Programa de Participação nos Resultados;Centro de Saúde Viveo - acesso prático a diversas especialidades presenciais e também em uma plataforma online;Descontos exclusivos na loja Mafra Especialidades;Total Pass - para cuidar e movimentar o corpo;Parcerias e descontos exclusivos para colaboradores - para estudos, lazer e muito mais.Show moreShow less",N/A,On-site/Hybrid,https://www.linkedin.com/jobs-guest/jobs/api/jobPosting/4420713449,2026-06-18
Cientista de dados,Vertem,"Barueri, São Paulo, Brazil",5 days ago,"Estamos em busca de umCientista de Dados Sêniorpara fortalecer a agenda de inteligência e analytics avançado na Vertem.Essa posição terá papel estratégico na construção e operacionalização de modelos deMachine Learningaplicados a problemas reais de negócio, utilizando uma arquitetura moderna de dados baseada emDatabricksem ambienteAWS.O profissional atuará diretamente no desenvolvimento, treinamento, implantação e monitoramento de modelos preditivos, contribuindo para transformar dados em soluções inteligentes que apoiem decisões estratégicas, produtos analíticos e geração de valor para clientes e parceiros.Buscamos alguém com forte capacidade analítica, domínio técnico em ciência de dados e experiência prática em ambientes modernos de dados e inteligência artificial.Responsabilidades e atribuiçõesO Cientista de Dados Sênior será responsável por desenvolver soluções analíticas avançadas e modelos de machine learning que contribuam diretamente para a geração de valor para o negócio.Entre as principais responsabilidades estão:Desenvolver, treinar e validarmodelos de Machine Learningaplicados a problemas reais de negócio.Trabalhar com grandes volumes de dados armazenados noData Lake corporativo em AWS.Utilizar o ecossistema da plataformaDatabrickspara experimentação, treinamento e operacionalização de modelos.Construir pipelines de dados e pipelines de treinamento de modelos.Utilizar recursos deAutoML do Databrickspara acelerar experimentação e geração de modelos.Realizarfeature engineeringe preparação de dados para modelos analíticos.Implementar e manter rotinas dedeploy e scoring de modelos de machine learning em produção.Monitorar performance de modelos, avaliando possíveis degradações e necessidade de re-treinamento.Trabalhar em conjunto com times deengenharia de dados, BI e produtos de dadospara transformar dados em soluções analíticas escaláveis.Apoiar a evolução da plataforma de inteligência da empresa, contribuindo com boas práticas de ciência de dados e machine learning.Esperamos que a pessoa tenha experiência sólida em ciência de dados aplicada a ambientes corporativos e plataformas modernas de dados.Entre os conhecimentos e experiências desejados estão:Requisitos e qualificaçõesExperiência técnicaVivência comDatabricks.Vivência em desenvolvimento demodelos de machine learning supervisionados e não supervisionados.Conhecimento emAutoML no Databricks.Vivência emdeploy de modelos de machine learning em produção.Conhecimento emscoring de modelos e pipelines de inferência.Vivência comfeature engineeringe preparação de dados para modelos analíticos.Domínio dePython aplicado à ciência de dados.Vivência com bibliotecas como:scikit-learnXGBoostLightGBMTer atuado com dados em ambientes deData Lake e Big Data.Diferenciais:Vivência comMLflow.Vivência com monitoramento e governança de modelos de machine learning.Atuação em projetos derecomendação, segmentação ou modelos de propensão.Vivência em ambientes de dados emAWS.Vivência em projetos deanalytics avançado e produtos de dadosInformações adicionais✨O que temos para te oferecer?✨Para equilibrar trabalho e vida pessoal:🏡 Flex Office – 2 dias de home office e 3 dias presenciais.🎂 Day Off no aniversário – Seu dia especial, do jeito que preferir!⏰ Horário flexível – Mais autonomia para organizar sua rotina.Para cuidar da sua saúde e bem-estar:🩺 Plano de saúde e odontológico Sul América.🛡 Seguro de vida Sul América.💙 Atendimento psicológico – Acesso a uma plataforma com psicólogos.💆 ♂️ Massagem no escritório – Um momento de relaxamento no seu dia.🛋 Sala de descompressão – Para recarregar as energias.🏋️ Total Pass – Acesso a academias e atividades físicas.Para facilitar o seu dia a dia:🍽 Vale Refeição ou Alimentação flexível – R$ 41,91 por dia.👶 Auxílio creche – Para filhos de até 5 anos.🚍 VT, estacionamento ou fretado – Mobilidade garantida.Para apoiar seu crescimento:📈 QultureRocks – Plataforma de gestão de performance e desenvolvimento.🎓 Auxílio educação – A partir de 12 meses de empresa, investimos no seu aprendizado.🚀 Cultura inspiradora e disruptiva – Um ambiente dinâmico, colaborativo e inovador.Para celebrar conquistas e momentos especiais:🍼 Kit Nascimento – Um carinho especial para os novos papais e mamães.🎊 Eventos internos e ações de engajamento – Confraternizações e momentos de descontração com o time.🎁 Benefícios exclusivos em datas comemorativas – Porque cada momento especial merece ser celebrado!Show moreShow less",N/A,On-site/Hybrid,https://www.linkedin.com/jobs-guest/jobs/api/jobPosting/4425309950,2026-06-18
ANALISTA DE DADOS JR,J&T Express Brasil,"Barueri, São Paulo, Brazil",2 days ago,"Principais AtividadesRealizar análises de dados e monitoramento dos indicadores de qualidade das operações logísticas;Acompanhar e analisar indicadores das etapas de:🚚First Mile (Coleta)🚛Middle Mile (Transferência)📦Last Mile (Entrega)Elaborar relatórios e controles para acompanhamento da performance operacional;Identificar desvios, inconsistências e oportunidades de melhoria nos processos;Apoiar a gestão na tomada de decisões por meio da análise de dados e indicadores;Monitorar o cumprimento de metas operacionais e indicadores de qualidade;Realizar o acompanhamento de planos de ação e melhorias contínuas;Trabalhar em conjunto com as áreas operacionais para garantir a eficiência dos processos.RequisitosEnsino Superior cursando ou completo em Administração, Logística, Engenharia, Estatística, Tecnologia da Informação ou áreas correlatas;Domínio das ferramentas do Pacote Office, com foco em:Excel (intermediário/avançado);Word;Facilidade com análise e interpretação de dados;Conhecimento em indicadores operacionais e de qualidade;Perfil analítico e atenção aos detalhes.Experiência em operações logísticas, transportes ou e-commerce;Conhecimento em Power BI;Vivência com elaboração de relatórios e dashboards;Experiência com análise de KPIs operacionais.🎁 Benefícios🚌 Vale-transporte🏥 Assistência Médica (sem desconto)😁 Assistência Odontológica Amil (sem desconto)🛒 Vale-alimentação: R$ 150,00 por mês (sem desconto)🛡️ Seguro de Vida (sem desconto)🏋️ Total Pass💊 Convênio Farmácia🎓 Convênio com Universidades (20% a 50% de desconto)💵 PLR de R$ 1.400,00 por anoShow moreShow less",N/A,On-site/Hybrid,https://www.linkedin.com/jobs-guest/jobs/api/jobPosting/4429544540,2026-06-18
CIENTISTA DE DADOS,Biolab & Co,"São Paulo, São Paulo, Brazil",1 week ago,"Somos uma empresa brasileira, com presença internacional, que traz a inovação em seu DNA! Na Biolab, acreditamos que equipes diversas constroem resultados mais sólidos e transformadores.Valorizamos a inclusão e a diversidade em todas as nossas posições. Por isso, incentivamos a candidatura de pessoas com deficiência e de todas as identidades, histórias e origens.Explorar, analisar e modelar dados por meio de Python, SQL e técnicas de Machine Learning, com foco na geração de insights, previsões e soluções analíticas que apoiem a tomada de decisão e a geração de valor para o negócio. Atuar na identificação de oportunidades e no desenvolvimento de modelos analíticos para resolver problemas complexos e otimizar resultados.Que Esperamos De VocêGraduação completa em Ciência da Computação, Estatística, Engenharia de Dados, Análise de Sistemas ou áreas correlatas;Experiência sólida com Python aplicado à análise de dados e modelos de Machine Learning;Forte base em Estatística Aplicada, com capacidade analítica e visão crítica;Domínio em SQL / T-SQL para manipulação e extração de dados;Vivência com Análise Exploratória de Dados (EDA), identificando padrões e oportunidades;Experiência com bibliotecas de Data Science, como Pandas e Scikit-Learn;Conhecimento em visualização de dados para comunicação clara de insights;Atuação com experimentação e testes estatísticos;Prática em Feature Engineering para melhoria de modelos;Experiência com versionamento de código (Git);Conhecimento em governança de dados e ética em IA.DiferenciaisVivência com metodologias ágeis (Scrum, Kanban, etcExperiência com Power BI ou outras ferramentas de BIConfira Abaixo As Principais Atividades Desta PosiçãoAtuar como referência técnica em análises avançadas e machine learning, utilizando Python, Spark e plataformas como Databricks, a fim de estabelecer padrões e direcionamentos analíticos;Liderar iniciativas analíticas complexas, definindo abordagens com uso de cloud computing como Azure e Databricks, visando a atingir objetivos estratégicos do negócio;Documentar modelos, premissas e resultados, com objetivo de manter rastreabilidade e transparência das análises;Traduzir desafios estratégicos em soluções orientadas a dados, utilizando técnicas avançadas de modelagem e experimentação, para promover decisões baseadas em evidências;Avaliar impactos e riscos de modelos analíticos, utilizando ferramentas de monitoramento e governança de modelos, visando a mitigar riscos e otimizar resultados;Trabalhar em parceria com liderança e áreas de negócio, utilizando ferramentas de priorização como DevOps Boards, para priorizar iniciativas analíticas de alto impacto;Apoiar a evolução da maturidade analítica, disseminando conhecimento por meio de treinamentos, com objetivo de promover cultura orientada a dados;Trabalhar em conjunto com times de engenharia e analytics, utilizando Git, Databricks, para implementar e operacionalizar soluções analíticas.Para saber mais sobre nós, acesse www.biolabfarma.com.br e siga nossas redes sociais.Show moreShow less",N/A,On-site/Hybrid,https://www.linkedin.com/jobs-guest/jobs/api/jobPosting/4422753444,2026-06-18
Cientista de Dados Pleno - Híbrido SP,Just a Little Data / Unlock Knowledge,"São Paulo, São Paulo, Brazil",4 weeks ago,"Estamos em busca de um(a) Cientista de Dados Pleno com foco em Performance (CRM) para impulsionar resultados por meio de análises e modelos orientados à impacto.Somos inquietos, comprometidos e colaborativos, se você entende que consegue atuar em um cenário com profissionais assim, se candidate.Responsabilidades e atribuiçõesOs seguintes pontos devem ser considerados na atuação:O profissional deve identificar oportunidades de otimização e crescimento em diferentes clientes, transformando dados estruturados em insights acionáveis;Este deve construir análises e modelos preditivos que suportem decisões estratégicas e maximizem a eficiência das iniciativas de CRM;Sua atuação ocorrera diretamente com o cliente, compreendendo desafios, necessidades e dados disponíveis para propor, validar e implementar as soluções;Este deve monitorar KPIs críticos, garantindo que cada solução gere impacto mensurável e esteja alinhada com os objetivos de negócio;Por fim deve colaborar com o resto do time de forma a garantir corretude e robustez nas soluções desenhadas.Requisitos e qualificaçõesO candidato deve ser proativo no processo de busca de problemas a serem resolvidos dentro da área de CRM.Ter experiência comprovada em bases transacionais. Dados tabulares e series temporais.Boa fundação na linguagem python e métodos clássicos de machine learningConhecimento profundo de processos de EDA em bancos de dados SQLConhecimento profundo em métodos de segmentação de clientes para otimização de receitaHabilidades de comunicação e direcionamento com clientes e áreas não técnicas.Capacidade de atuar em processo colaborativo.Será considerado diferencial se você tiver:Conhecimentos sobre personas e atuação previa nisto.Conhecimento em ML Ops para deploy e monitoramento de modelosExperiência em dados não estruturadosConhecimento em análise de grafos e descrição de comunidadesProcessamento de dados de mídias sociaisInformações adicionaisOferecemos:💻 Notebook da empresa para quem está em SP, ou 💸 auxílio home office, para quem está fora de SP.🏥 Assistência Médica SulAmérica (plano apartamento)💚Seguro de Vida;💳 VR no Cartão Flash; Crédito/Débito; podendo utilizar em redes com CNPJ de food (Exemplo: Restaurante;Mercado e Aplicativos)📴 Day-off + crédito extra no VR no dia do aniversário;🦷 Assistência Odontológica SulAmérica - Plano opcional🏋🏻Incentivo a prática de exercício físico - TotalPass📚 Incentivo a educação - Reembolsos mensais de cursos e treinamentos, além de custeio de certificações (alinhamento prévio com liderança)✅Avaliações de performance semestrais com feedbacks e construção de PDI.🪴Escritório moderno, preparado para atender a todos, com restaurante próprio em estilo bistrô.📣Campanhas de incentivo de indicações de novos negócios ou novos colaboradores que rendem $💸Show moreShow less",N/A,On-site/Hybrid,https://www.linkedin.com/jobs-guest/jobs/api/jobPosting/4413691202,2026-06-18
jessica Wayne Da SIlva Petrini,WTime Business Intelligence,"São Paulo, São Paulo, Brazil",1 month ago,"Requisitos:Graduação concluída em Estatística, Ciência da Computação, Engenharia, Matemática, Economia ou áreas correlatas.Experiência prévia com projetos de ciência de dados ou análise de dados.Experiência no setor de saúde será considerada um diferencial.Programação: Conhecimento básico em Python (pandas, scikit-learn) e SQL.Modelagem: Familiaridade com técnicas como regressão, classificação e séries temporais.Ferramentas: Noções de Git, MLflow e uso de ambientes em nuvem (Azure, AWS ou GCP).Visualização de dados: Experiência com Power BI ou ferramentas similares será um diferencial.Principais Responsabilidades:Realizar tradução de problemas de negócio em hipóteses e análises exploratórias.Participar da construção e avaliação de modelos de machine learning.Desenvolver scripts e pipelines simples para tratamento e análise de dados.Colaborar com engenheiros de dados, equipes clínicas e áreas de negócio.Documentar aprendizados e garantir organização do código.Contribuir com dashboards e relatórios para comunicação dos resultados.Show moreShow less",N/A,On-site/Hybrid,https://www.linkedin.com/jobs-guest/jobs/api/jobPosting/4408941137,2026-06-18
Lead/Staff Data Scientist,Nubank,"São Paulo, São Paulo, Brazil",2 weeks ago,"About UsNu was born in 2013 with the mission to fight complexity to empower people in their daily lives by reinventing financial services. We are one of the world’s largest digital banking platforms, serving millions of customers across Brazil, Mexico, and Colombia. For more information, visit our institutional page https://international.nubank.com.br/careers/Data Science at NubankData Science is essential to every part of the business at Nubank, since Day 1. Most areas of the company use data science to some extent. Data Scientists are responsible for translating business needs into models and other types of data-driven solutions.As a Data Scientist, you’re expected toInteract with other team members to understand how to best apply data science and artificial intelligence to Nubank’s problems;Investigate problems and discover insights through exploratory data analysis and other quantitative methods;Have great numerical and analytical literacy, including knowledge of statistics and linear algebra as needed;Work on multiple stages of the ML model lifecycle–from ideation to training and steady-state operation;Work across multiple types of models, algorithms and learning paradigms;Communicate technical points, decisions and tradeoffs to peers and stakeholders;Our ideal candidateHas experience working with ML models in a production environment;Understands possible pitfalls and tradeoffs when applying ML to real-word, sometimes messy problems;Is familiar with the technical aspects of learning theory and algorithms and is able to discuss details if needed;Has experience working with the Python scientific stack (Numpy, Pandas, Scipy, Sklearn, Boosted Tree Libraries, etc);Has experience working with Tensor/Deep Learning libraries such as Tensorflow and Pytorch;Is able to connect analytical outcomes to business priorities and advise stakeholders on the best course of action;Has good communication skills and is able to convey technical topics and decision points to diverse audiences;Has experience writing general-purpose code using modern tools;Understands the implications of causality when applying ML to problems;Is up-to-date with recent developments in the area as a whole and is able to identify opportunities for improvement and innovation;Our BenefitsChance of earning equity at NubankFood/ Meal Card (Vale-Refeição and/or Vale Alimentação)Public Transportation Commuting Benefit (Vale-Transporte)NuCare – Psychological, Financial and Legal Assistance ProgramLife InsuranceMedical PlanDental PlanNuLanguage – Language Course ProgramNucleo - Our learning platform of coursesExtended Parental LeaveDaycare AllowanceParental ConsultancyWork-from-home AllowanceGym Partnerships30 days of paid vacationWork Model for this RoleHybrid 2-3 times/week:Our hybrid work model brings us to the office at least twice a week, on strategic days designed to maximize team connection and collaboration. For more details, visit https://building.nubank.com/nu-hybrid-work-model/Show moreShow less",N/A,On-site/Hybrid,https://www.linkedin.com/jobs-guest/jobs/api/jobPosting/4364197061,2026-06-18
Software Engineer - IoT Applications,TRACTIAN,"São Paulo, São Paulo, Brazil",1 day ago,"Engineering at TRACTIANThe Engineering team at TRACTIAN is at the forefront of developing cutting-edge infrastructure, technologies, and products to harness the power of IoT data. Our team of talented Engineers collaborates to build robust systems, innovative solutions, and scalable platforms that drive Tractian's success. We are instrumental in shaping the company's decision-making process, optimizing operational efficiency, and delivering exceptional consumer experiences.What You'll DoAs a Software Engineer focusing on IoT Systems, your primary responsibility will be to develop and enhance software solutions capable of managing and processing large sensor data volumes. You’ll work closely with our sensor data, the sensor firmware team, and the Machine Condition Monitoring product team to make sensor data available reliably and on time. Your daily activities will involve designing, building, and maintaining robust applications using Python, Go, and/or Rust.ResponsibilitiesDesign, develop, and maintain high-performance data-intensive applications using Go, Python and/or Rust, focusing on event-driven architectures.Implement and optimize queue mechanisms and tools to manage high-volume data streams effectively.Create tools so internal teams can access and better understand sensor data and how the devices perform on the field.Collaborate with cross-functional teams to ensure seamless integration of event-driven systems within the larger application infrastructure.Optimize data processing workflows for efficiency and reliability in handling large datasets.Identify and resolve performance bottlenecks in data-intensive applications.RequirementsBachelor's degree in Engineering, Computer Science, Information Technology, or related fields.Proven experience as a Software Developer/Software Engineer or similar role, with either Internet of Things expertise or experience with large amounts of data.Technical proficiency with programming languages such as Go and Python and experience with event-driven architecture and queue tools like Kafka, RabbitMQ, or similar.Proficient understanding of distributed systems, data structures, and advanced algorithms.Good knowledge of database technologies (Postgres, Scylla, Mongo, ClickHouse, Redis).Familiarity with security best practices in software integration.Excellent problem-solving skills and the ability to work well under strict deadlines.Experience in fast-paced environments and critical systems with very high SLA requirements.Effective communication skills for collaborating with cross-functional teams and stakeholders.Experience with project documentation and maintenance.Advanced proficiency in English.Bonus PointsFluent in EnglishExperience with Low-Level Coding (C or C++ Firmware Development)Experience with IoT HardwareExperience with cloud computing platforms (AWS, Azure, GCP).Proficiency in data structures and algorithms.Show moreShow less",N/A,On-site/Hybrid,https://www.linkedin.com/jobs-guest/jobs/api/jobPosting/4429546575,2026-06-18
