title,company,location,posted,description,applicants,work_mode,link,data_coleta
Cientista de dados - Berrini/São Paulo,DXON,"São Paulo, São Paulo, Brazil",10 months ago,"Desenvolver e aprimorar modelos preditivos, análise de risco e estratégias baseadas em dados. O(a) profissional será responsável por explorar grandes volumes de dados, construir modelos estatísticos e de machine learning, além de gerar insights que otimizem a tomada de decisão no processo de concessão de crédito.ResponsabilidadesDesenvolver, testar e implantar modelos de risco de crédito, incluindo credit scoring, propensão de inadimplência e recuperação de crédito.Explorar e tratar grandes volumes de dados para identificar padrões e tendências que impactam o risco de crédito.Criar e otimizar modelos de machine learning para melhorar a acurácia das decisões de crédito.Trabalhar com times de engenharia de dados para garantir a disponibilidade e qualidade dos dados utilizados.Implementar e monitorar modelos de crédito em produção, garantindo performance e compliance com regulamentações vigentes.Desenvolver dashboards e relatórios para acompanhar métricas de crédito e comportamento da carteira.Aplicar técnicas de Explainable AI (XAI) para garantir transparência nas decisões baseadas em modelos preditivos.Colaborar com times de negócios, risco e produtos financeiros para alinhar estratégias baseadas em dados.RequisitosFormação em Estatística, Engenharia, Ciência da Computação, Matemática, Economia ou áreas correlatas.Experiência sólida com modelagem estatística e machine learning, especialmente em problemas de crédito.Conhecimento avançado em Python, R ou SQL para análise e modelagem de dados.Experiência com bibliotecas e frameworks de machine learning, como Scikit-learn, XGBoost, TensorFlow ou PyTorch.Familiaridade com bancos de dados relacionais e não relacionais (SQL, NoSQL).Experiência com manipulação e limpeza de grandes volumes de dados.Habilidade em comunicação e visualização de dados, utilizando Power BI, Tableau ou Matplotlib/Seaborn.Conhecimento em regulamentações de crédito, como Basileia, LGPD e SCR, é um diferencial.Experiência em deploy de modelos em ambiente produtivo (MLOps) é um plus.DiferenciaisExperiência em modelagem de crédito em bancos, fintechs ou bureaus de crédito.Conhecimento em técnicas avançadas de machine learning, como modelos generativos e deep learning aplicados a crédito.Experiência com Big Data e computação em nuvem (AWS, Azure, GCP).Experiência com modelos de precificação e otimização de portfólio de crédito.BenefíciosSalário competitivo e compatível com o mercado.Modelo de trabalho híbrido.Oportunidade de crescimento e desenvolvimento profissional.Se você é apaixonado por dados e quer ajudar a construir soluções inovadoras para crédito, venha fazer parte do nosso time!Candidate-se agora!A vaga aceita trabalho remoto?NãoShow moreShow less",N/A,On-site/Hybrid,https://www.linkedin.com/jobs-guest/jobs/api/jobPosting/4243100867,2026-04-23
Data Scientist,Tata Consultancy Services,Greater São Paulo Area,2 weeks ago,"Come to one of the biggest IT Services companies in the world!! Here you can transform your career! Why to join TCS? Here at TCS we believe that people make the difference, that's why we live a culture of unlimited learning full of opportunities for improvement and mutual development. The ideal scenario to expand ideas through the right tools, contributing to our success in a collaborative environment.We are looking for a Data Scientist with a strong focus on Generative AI, capable of designing, developing, and evolving solutions based on LLMs, intelligent agents, and cognitive automations. This professional will work in the creation of agent architecture, integration with corporate data, construction of automated service and decision support flows, in addition to the continuous experimentation of generative models applied to real business problems.The role requires a combination of data science, applied engineering, prompt engineering, RAG, and agent orchestration, with practical insight into how to scale GenAI solutions in a secure, governed, and measurable way.Responsibilities§ Design and implement Generative AI solutions based on LLMs for customer service, operational support, and process automation.§ Develop and orchestrate AI agents (single-agent and multi-agent), with decision-making, planning, and task execution capabilities.§ Build RAGE (Retrieval-Augmented Generation) pipelines by integrating LLMs into structured and unstructured foundations.§ Develop and optimize prompts, chunking strategies, embeddings, and semantic retrieval.§ Integrate agents and generative models with automation workflows, APIs, legacy systems, and fulfillment platforms.§ Evaluate quality, safety, and performance of GenAI solutions (hallucination, groundedness, latency, cost).§ Apply statistical and machine learning concepts for evaluation, experimentation, and continuous improvement of solutions.§ Work together with data, engineering, product, UX, and business teams to evolve solutions.§ Support the definition of standards, good practices, and governance for the use of Generative AI in a corporate environment.Hard Skills§ Solid experience with Generative AI and LLMs (OpenAI, Azure OpenAI, Anthropic, Google, or equivalent).§ Development of AI agents and orchestration frameworks (e.g., LangChain, LangGraph, CrewAI, Semantic Kernel or similar).§ Hands-on experience with RAG, embeddings, vectors, and vector bases.§ Strong Python domain and integration via APIs.§ Knowledge in Machine Learning and fundamentals of applied statistics.§ Experience with intelligent automations and integration with corporate systems.§ Knowledge of cloud architecture (Azure, AWS or GCP).§ Notions of MLOps / LLMOps (versioning, monitoring, evaluation and costs).Soft Skills§ Experimental and innovation-oriented mindset.§ Ability to transform business problems into solutions with agents and GenAI.§ Clear communication with technical and executive stakeholders.§ Autonomy, sense of ownership and continuous learning.§ Collaboration in multidisciplinary teams.Differentials§ Experience with corporate copilots, advanced chatbots, and virtual assistants.§ Experience in customer service automation or Backoffice projects with AI.§ Knowledge in AI governance, security, and ethics.§ Experience with advanced LLM evaluation (A/B testing, human feedback, custom metrics).§ Previous experience in regulated environments (banking, insurance, health, energy).What can you expect from us?• Professional development and constant evolution of your skills, always in line with your interests.• Opportunities to work outside Brazil• A collaborative, diverse and innovative environment that encourages teamwork.What do we offer?TCS Benefits – Brazil:Health insuranceDental PlanLife insuranceTransportation vouchersMeal/Food VoucherChildcare assistanceGympassTCS Cares – free 0800 that provides psychological assistance (24 hrs/day), legal, social and financial assistance to associatesPartnership with SESCReimbursement of CertificationsFree TCS Learning Portal – Online courses and live trainingInternational experience opportunityDiscount Partnership with Universities and Language SchoolsBring Your Buddy – By referring people you become eligible to receive a bonus for each hireTCS Gems – Recognition for performanceXcelerate – Free Mentoring Career PlatformAt TATA Consultancy Services we promote an inclusive culture, we always work for equity. This applies to Gender, People with Disabilities, LGBTQIA+, Religion, Race, Ethnicity. All our opportunities are based on these principles. We think of different actions of inclusion and social responsibility, in order to build a TCS that respects individuality. Come to be a TCSer!Show moreShow less",N/A,On-site/Hybrid,https://www.linkedin.com/jobs-guest/jobs/api/jobPosting/4383326360,2026-04-23
Data Scientist,IBM,Greater São Paulo Area,3 weeks ago,"Linguagens como Python, R, e SQL. Experiência com algoritmos de aprendizado de máquina e frameworks como TensorFlow, Scikit-Learn e PyTorch. Habilidade em criar visualizações de dados usando ferramentas como Tableau, Matplotlib e Seaborn.Boa experiência com estas tecnologias, inglês intermediário mínimoShow moreShow less",N/A,On-site/Hybrid,https://www.linkedin.com/jobs-guest/jobs/api/jobPosting/4392101698,2026-04-23
Cientista de Dados - Prevenção a Fraudes Pleno,TotalPass Brasil,"São Paulo, São Paulo, Brazil",3 weeks ago,"DESCRIÇÃONosso time de Dados em Prevenção a Fraude atua de maneira analítica observando padrões e comportamentos para manter nosso aplicativo cada vez mais seguro. Hoje tem participação expressiva nos resultados da área de tecnologia. Trabalhamos em um ambiente que valoriza a comunicação aberta, a inovação e o desenvolvimento contínuo.Como Será o Seu Dia a DiaPlenejar, desenvolver e implementar modelos estatísticos e algoritmos de machine learning para detectar fraudes de forma escalável e com alta precisão.Fomentar a criação de segmentações comportamentais e análises preditivas, utilizando técnicas avançadas de modelagem.Analisar grandes volumes de dados, propondo estratégias e soluções para otimizar a prevenção a fraudes.Fornecer insights estratégicos para a liderança sobre tendências de fraude, comportamentos suspeitos e melhorias em processos.Mentorizar e treinar membros da equipe júnior e pleno, promovendo o compartilhamento de conhecimentos e melhores práticas.Trabalhar em colaboração com outras áreas para garantir que as soluções sejam alinhadas às necessidades de negócio e que os modelos se integrem eficientemente às plataformas e sistemas.Manter-se atualizado sobre as tendências e inovações no campo da prevenção a fraudes e implementar soluções de ponta.O Que Esperamos Que Você TenhaREQUISITOSExperiência avançada em linguagens de programação como Python, SQL, R, e frameworks de Machine Learning.Sólido conhecimento em manipulação de grandes volumes de dados e ambientes de nuvem, com foco em AWS.Capacidade de desenvolver e implementar modelos preditivos e de análise de dados de forma escalável e eficiente.Conhecimento em metodologias ágeis e experiência em ambientes de trabalho colaborativos.Formação acadêmica avançada em Estatística, Matemática, Ciência da Computação ou áreas relacionadas.Capacidade de tomar decisões baseadas em dados e resultados.Comunicação clara com stakeholders e capacidade de apresentar soluções estratégicas.Excelente capacidade de comunicação tanto técnica, quanto para públicos não técnicos.Visão crítica e de inovação para aprimorar processos e implementar novas abordagens.Local de trabalho: São Paulo, SPRegime de contratação de tipo: Efetivo – CLTJornada: Período IntegralÁrea e especialização profissional: Administração - Administração GeralNível hierárquico: AnalistaEscolaridade Mínima: Ensino SuperiorShow moreShow less",N/A,On-site/Hybrid,https://www.linkedin.com/jobs-guest/jobs/api/jobPosting/4392962738,2026-04-23
Pesquisador de Campo - Guarulhos/SP,Zukkin - Inteligência de Preços,"Guarulhos, São Paulo, Brazil",6 months ago,"A vaga é para atuar como Pesquisador de Campo em Guarulhos/SPOferecemos uma remuneração de R$75,00 por diária para a realização das pesquisas. Esse valor contempla 8 horas de trabalho diário, permitindo flexibilidade para conciliar com outras atividades. Nosso formato de contratação é no regime MEI com pagamento efetuado todo dia 10.Segue a rota:SEGUNDA-FEIRASão JoãoQnt itens: 400 itensPrazo: 16:00Parque Santo AgostinhoQnt itens: 475 itensPrazo: 16:00AV BRIGADEIRO FARIA LIMAQnt itens: 400 itensPrazo: 16:00Responsabilidades:Realizar pesquisas de campo para coletar informações sobre preços de produtos e serviços;Registrar e analisar os dados obtidos durante as pesquisas;Identificar tendências de mercado relacionadas aos preços pesquisados;Reportar os resultados das pesquisas à equipe responsável;Manter-se atualizado sobre as práticas de precificação do setor.Requisitos:Experiência prévia em pesquisas de campo ou áreas relacionadas.Conhecimento em técnicas de coleta e análise de dados.Habilidade para trabalhar de forma independente e em equipe.Boa comunicação e capacidade de reportar informações de forma clara.Atenção aos detalhes e capacidade de observação.Ensino médio completo.Interessado(a) em participar do nosso processo seletivo?Show moreShow less",N/A,On-site/Hybrid,https://www.linkedin.com/jobs-guest/jobs/api/jobPosting/4311524203,2026-04-23
"Data Scientist - QuantumBlack, AI by McKinsey","QuantumBlack, AI by McKinsey","São Paulo, São Paulo, Brazil",1 week ago,"Who You'll Work WithDriving lasting impact and building long-term capabilities with our clients is not easy work. You are the kind of person who thrives in a high performance/high reward culture - doing hard things, picking yourself up when you stumble, and having the resilience to try another way forward.In return for your drive, determination, and curiosity, we'll provide the resources, mentorship, and opportunities you need to become a stronger leader faster than you ever thought possible. Your colleagues—at all levels—will invest deeply in your development, just as much as they invest in delivering exceptional results for clients. Every day, you'll receive apprenticeship, coaching, and exposure that will accelerate your growth in ways you won’t find anywhere else.When you join us, you will have:Continuous learning: Our learning and apprenticeship culture, backed by structured programs, is all about helping you grow while creating an environment where feedback is clear, actionable, and focused on your development. The real magic happens when you take the input from others to heart and embrace the fast-paced learning experience, owning your journey.A voice that matters: From day one, we value your ideas and contributions. You’ll make a tangible impact by offering innovative ideas and practical solutions, all while upholding our unwavering commitment to ethics and integrity. We not only encourage diverse perspectives, but they are critical in driving us toward the best possible outcomes.Global community: With colleagues across 65+ countries and over 100 different nationalities, our firm’s diversity fuels creativity and helps us come up with the best solutions for our clients. Plus, you’ll have the opportunity to learn from exceptional colleagues with diverse backgrounds and experiences.World-class benefits: On top of a competitive salary (based on your location, experience, and skills), we provide a comprehensive benefits package to enable holistic well-being for you and your family.Your ImpactAs a Data Scientist at QuantumBlack in Brazil, you will partner with some of the world’s leading organizations to tackle their most critical challenges using data.From data owners and end users to C-level executives, you will work closely with clients to understand their needs and design impactful analytics solutions that drive performance.You will be a key contributor in cross-functional problem-solving sessions, translating complex business questions into analytical problems and building models that address them—ensuring those models are evaluated with relevant, actionable metrics.You will help shape the development of our internal Data Science Toolbox, writing highly optimized code and supporting the delivery of innovative, scalable solutions.You will also:Present your work to colleagues and clients, communicating insights in a clear and compelling wayWrite and present papers at internal and external conferences (such as NeurIPS and ICML), if you choose toJoin global retrospectives and R&D initiatives, learning and sharing alongside experts across QuantumBlackCollaborate with interdisciplinary teams that bring together data science, engineering, design, and business expertiseOur projects range from accelerating clinical research to improving urban air quality or enhancing elite sport performance - always focused on creating real-world impact.You will be based in Sao Paulo and collaborate with data scientists, engineers, machine learning specialists, designers, and product managers from around the world.Together, you will work across sectors - such as healthcare, automotive, energy, finance, and more - to apply mathematical, statistical, and machine learning approaches to real-world data.At QuantumBlack, your growth is continuous and personalized.You will benefit from:Diverse projects and clients, giving you international exposure and unique challengesCutting-edge tools and technologies, enabling you to sharpen your skills in modern data science workflowsTailored learning and mentorship, including training programs, technical deep dives, and global knowledge-sharingCareer path flexibility, with opportunities to explore new domains or geographies as you growA strong sense of community, connecting with colleagues through meetups, workshops, and events across the QuantumBlack and McKinsey networks.Here, you won’t just build solutions - you’ll help shape how we define excellence in data science.Please submit your CV in English.Your Qualifications and SkillsUniversity degree with a strong academic record; master’s in computer science, applied statistics, mathematics, artificial intelligence, or related field preferred2+ years of experience applying machine learning and data mining techniques to large, real-world datasetsStrong background in computer science, engineering, statistics, mathematics, physics, or similarAbility to lead and drive model development independently, balancing quality and deadlinesProven track record in prototyping and applying advanced analytical and statistical methodsProficiency in Python and at least one additional language (e.g., R, Scala, SQL)Experience working with relational databases (SQL) and large datasetsExperience in the real-world application of machine learning methods and algorithmsAbility to communicate ideas most effectively, both verbally and in writing, in English and PortugueseShow moreShow less",N/A,On-site/Hybrid,https://www.linkedin.com/jobs-guest/jobs/api/jobPosting/4400579249,2026-04-23
Cientista de Dados Especialista - Modelos Regulatórios,Porto,"São Paulo, São Paulo, Brazil",1 week ago,"Descrição da vagaA área de Modelos Regulatórios é responsável pelo desenvolvimento dos modelos de perda esperada de crédito para os produtos do Porto Bank (Cartões, Empréstimos, Financiamentos e Consórcio), tanto no padrão IFRS quanto padrão BR-GAAP, de forma a atender às normas vigentes e políticas internas.Responsabilidades e atribuiçõesDesenvolver, documentar e avaliar os impactos dos modelos de perda esperada, incluindo modelos de PD, EAD, LGD e Forward Looking;Desenvolvimento de modelos preditivos, como Machine Learning;Suporte à área que realiza a validação independente dos modelos;Suporte à auditoria externa nos tópicos referentes aos modelos;Assistir pares e parceiros com questões técnicas e de negócio, sendo uma referência nos assuntos relacionados a modelos de perda de crédito.Requisitos e qualificaçõesGraduação em ciências exatas (Estatística, Matemática, Economia ou áreas corretas);Sólidos conhecimentos em modelagem estatística, incluindo modelos de regressão, modelos lineares generalizados, machine learning, árvores de decisão e séries temporais;Conhecimento sobre as normas vigentes para mensuração da perda de crédito (IFRS, Res. CMN 4966), assim como noções de Contabilidade;Excelente raciocínio lógico e quantitativo;Informações adicionaisBENEFÍCIOSVale Alimentação e Refeição Flexíveis;Plano de Saúde;Plano Odontológico;Wellhub e TotalPass;Academia Bio Ritmo exclusiva para Colaboradores:no Complexo Matriz;Participação nos Lucros - PLR;Programa de Ações: Porto em Ação:complementar à PLR até 2025;Quadras de Areia e Poliesportiva:no Complexo Matriz;Vale-Transporte;Serviços de Transporte de Vans;disponibilizadas nas principais estações de acesso à Porto (Luz, Barra Funda, Santa Cecília e Júlio Prestes);Licença Parental Estendida:até 40 dias para todas as configurações familiares;Licença Maternidade Estendidade 6 meses.;Ambulatório Médico com Especialidades:no Complexo Matriz e Barra Funda;Auxílio creche ou babá;Seguro de Vida;Previdência Privada - PortoPrev;Desconto em Produtos e Serviços;Bolsa de estudos: Reembolso para graduação, pós ou MBA;Corridas mensais:subsídio para as principais corridas de ruas de São PauloReembolso para idiomas (inglês ou espanhol);Teatro Porto:sessões exclusivas para Colaboradores;Biblioteca;Sala de descanso:no completo MatrizSalão de jogos:no complexo MatrizServiços de massagem e podologia:no completo MatrizLocal de trabalho:Local (Atuamos com modelos híbridos, que serão explorados no processo seletivo);Na Porto, Você Importa!A Porto é muito mais que uma seguradora: é um ecossistema gigante que utiliza tecnologia para criar soluções, através de quatro verticais de negócio:Porto Bank, Porto Saúde, Porto Seguro e Porto Serviço.A reputação e o reconhecimento conquistados ao longo de mais de 7 décadas reforçam o tamanho da Porto, uma empresa referência em negócios, feita para e por pessoas.Aqui, bate no peito de 13 mil colaboradores oorgulho de fazer parte de uma organização sólida e ética,que transforma sonhos em realidades fantásticaspara os nossos mais de 15,8 milhões de clientes. São mais de 101 sucursais e escritórios regionais em todo o Brasil.O aprendizado faz parte do nosso DNA, e aqui, você teráincentivos, ferramentas e gente boa para você aprender e crescer, a cada dia,um ambiente de acolhimento e segurança, onde cada um possa ser e se orgulhar de quem se é, promovendo um espaço de respeito evivendo de forma integral e com bem-estar, em uma empresa genuinamente humana.DIVERSIDADE & INCLUSÃO NA PORTOAqui na Porto, valorizamos a diversidade e acreditamos que um time plural é imprescindível para o desenvolvimento de todo o nosso negócio, da sociedade, e de cada pessoa, pois entendemos que cada indivíduo é único na construção de um ambiente mais inovador e inclusivo. Juntos, trabalhamos diariamente para construirmos um espaço seguro, livre e acolhedor, com mais pluralidade e respeito. Por isso,incentivamos fortemente a inscrição de mulheres, de pessoas negras e indígenas, de pessoas com deficiência e de pessoas LGBTQIA+em todas as nossas vagas.Show moreShow less",N/A,On-site/Hybrid,https://www.linkedin.com/jobs-guest/jobs/api/jobPosting/4389965155,2026-04-23
