title,company,location,posted,description,applicants,work_mode,link,data_coleta
Politica de Crédito/Cientista de Dados,FOURSYS,"Barueri, São Paulo, Brazil",14 hours ago,"A Foursys é um time apaixonado por inovação, design e transformação digital.Somos globais, somos GPTW.🌈 👵 ♿️👩🏾 Na Foursys, celebramos a diversidade e acreditamos que são as diferentes ideias e perspectivas que nos enriquecem. Portanto, sua cor, religião, gênero, raça, nacionalidade, idade, origem, identidade de gênero, deficiência ou orientação sexual não são barreiras para se juntar à nossa equipe.#VemSerFoursys!Todas as nossas vagas estão abertas para Pessoas com Deficiência (PCD). Caso você se enquadre ou conheça alguém com o perfil, a Foursys é a empresa ideal!Que tal se juntar a nós e se tornar um(a) #FourTalent?Então se liga nessa oportunidade incrível: 👇Politica de Crédito/Cientista de DadosHibrido 3x presenciais por semana em Barueri e 2x Home OfficePrincipais DesafiosAtuar na análise, gestão e evolução de dados de crédito, apoiando a tomada de decisão estratégica por meio de análises robustas, garantindo qualidade da informação, mitigação de riscos e melhoria contínua dos processos.📌 Responsabilidades e AtividadesGerenciar bases de dados, garantindo integridade, consistência e atualização das informações de crédito.Identificar e tratar inconsistências, realizando análises e correções necessárias.Monitorar bases de clientes, identificando riscos, divergências e oportunidades de melhoria.Atuar na melhoria contínua dos processos de qualidade e tratamento de dados.Trabalhar em conjunto com áreas internas para correção de falhas e alinhamento de informações.Elaborar relatórios, controles e apresentações executivas com análises de desempenho.Garantir aderência às políticas internas e critérios de análise de crédito.Mapear e revisar processos de concessão de crédito, identificando ganhos de eficiência.Apoiar áreas de negócio na análise de propostas e decisões de crédito.Analisar demonstrações financeiras, histórico de crédito e capacidade de pagamento.Elaborar pareceres de crédito com recomendações técnicas e estratégicas.Monitorar carteira de crédito, acompanhando indicadores de risco, inadimplência e exposição.Apoiar na definição e revisão de políticas de crédito, limites e garantias.📌 Requisitos TécnicosExperiência com análise de crédito, risco e dados financeiros.Domínio de SQL Server para consultas e manipulação de dados.Excel avançado (uso intensivo para análise e modelagem).Experiência com ferramentas de BI (Power BI ou similares).Familiaridade com bureaus de crédito (Serasa, SPC ou similares).Conhecimento em políticas de crédito, compliance e indicadores financeiros.Noções de modelagem de risco e score de crédito.Conhecimento em automação de processos (RPA) e integração de sistemas.Python (diferencial relevante).💡 Habilidades TécnicasSQL Server (Avançado)Excel (Avançado)Power BI (Avançado)Análise de Crédito e RiscoModelagem de Dados e IndicadoresSistemas de CréditoAutomação (RPA)Python (Desejável/Intermediário)🤝 Habilidades ComportamentaisPensamento analítico e críticoTomada de decisão orientada a dadosAtenção a detalhesComunicação clara e escuta ativaOrganização e gestão de prioridadesProatividade e senso de responsabilidadeÉtica e confidencialidadeTrabalho em equipe e colaboraçãoVisão de risco e capacidade de negociaçãoAdaptabilidade🏢 Domínio de NegócioCrédito, risco e análise financeiraE temos também o Clube da Four que oferece ótimas vantagens! 👇🩺 Assistência médica;🍲 VR e VA flexível;🏋️ Gympass e Wellz;⚽ Parceria com o SESC;🍣 Descontos em restaurantes;📚 Descontos em cursos técnicos e de ensinos superior;🧠 Descontos em escolas e plataformas de idiomas.E aí, aceita o desafio? Então conclua sua candidatura e #VemSerFoursys! Boa sorte! 🍀Show moreShow less",N/A,On-site/Hybrid,https://www.linkedin.com/jobs-guest/jobs/api/jobPosting/4411277834,2026-05-07
Data Scientist,Zicasso,"São Paulo, São Paulo, Brazil",3 weeks ago,"Company OverviewEstablished in 2008, Zicasso is the most-reviewed and highest-rated luxury travel company, specializing in immersive custom tours, vacations, and safaris. Our Zicasso travel specialists are the world's top 2% of boutique tour operators and travel agents, pre-vetted and handpicked to compete in creating itineraries tailored to each of our travelers' unique preferences. Joining Zicasso, you'll play a key role in bringing our travelers' dreams to life—pushing the boundaries of what's possible with luxury travel experiences.As a member of our team, you'll be part of a company recognized for its strong brand reputation among discerning travelers. Our authority in the luxury travel industry is consistently affirmed through features in top media outlets, including The New York Times, The Wall Street Journal, BBC, Forbes, CNN, and Condé Nast Traveler, to name a few. See our press coverage here.We are a fully remote company spanning five continents, and we foster a dynamic, progressive global work environment that values creativity, initiative, and continuous learning. We're seeking passionate, data-driven individuals who thrive in a high-performance environment and are eager to contribute to our innovative company culture, underpinned by a consistent pursuit of excellence, integrity, and teamwork.Our global team comes together biannually for international retreats and summits. These are typically held for a week at a new location each time, providing opportunities to share ideas, collaborate in person, and strengthen our culture, all while learning firsthand about the destinations we serve. These events embody our commitment to both professional growth and the transformative power of travel.Join us in shaping the future of luxury travel while working towards our vision—creating a more connected humanity through travel. To learn more, visit https://www.zicasso.com/careers.The RoleAs a Data Scientist at Zicasso, you will have the opportunity to leverage your expertise in data analysis and modeling to extract valuable insights that will drive the company's strategic decision-making. You will work closely with cross-functional teams to develop and implement data-driven solutions that improve operations, enhance customer experiences, and optimize business performance.This is aninternational, fully-remote, freelance contractorposition, working from home, at a location outside of the United States. We are particularly seeking candidates who are based in Latin America.There is flexibility in your work hours but we expect that you will generallymaximize your overlap with California hours(eg. until 3pm Pacific Time Zone).The work will all be conducted in English.Key ResponsibilitiesAnalyze large datasets to uncover trends, patterns, and insights that drive strategic business decisionsDevelop and refine predictive models for customer segmentation, pricing optimization, and demand forecastingBuild and enhance recommendation systems to personalize travel experiences and increase customer engagementDesign, implement, and analyze A/B tests and other experiments to evaluate the impact of product and operational initiativesAnalyze user behavior across the entire customer journey to identify friction points, optimize conversion funnels, and uncover opportunities for growthProvide actionable data insights to support targeted marketing campaigns, customer retention strategies, and personalized communicationPartner with product, marketing, and customer experience teams to uncover opportunities for conversion and retention improvementCreate and maintain data pipelines, dashboards, and automated reporting systems using best-in-class toolsApply advanced statistical methods and machine learning techniques to solve complex business problems and improve operational efficiencyCollaborate with data engineering to ensure data quality, consistency, and scalability across systemsDocument methodologies and communicate findings clearly to both technical and non-technical stakeholdersContribute to fostering a data-driven culture by sharing insights, tools, and best practices across teamsRequired ExperienceBachelor's degree in Statistics, Mathematics, Computer Science, or a related field. Master or Ph.D. preferredProven experience as a Data Scientist in a fast-paced and data-driven environmentExpertise in statistical analysis, machine learning, and predictive modeling techniquesProficiency in programming languages such as Python or RStrong SQL skills and experience working with large-scale datasetsExperience with data visualization tools such as Tableau or Power BIExcellent problem-solving skills and ability to translate business requirements into analytical solutionsStrong communication skills and ability to present complex findings to both technical and non-technical stakeholdersAbility to thrive in a fully remote environment, working independently while maintaining close collaboration with cross-functional teamsMinimum of 3 years of experience embedded within or consulting for a marketing department. Ability to translate complex statistical findings into actionable insights for non-technical stakeholdersDeep technical expertise in navigating and extracting data from the Google ecosystem (Google Ads, GA4, and Search Console). Proven track record of using BigQuery to join disparate marketing datasets for cross-channel analysis and attribution modelingWhat We OfferRemote work from your home base and flexible hours that allow you to enjoy a great work-life balanceInnovative, fast-paced and collaborative culture that values diverse voices and opinionsLearning and development annual budgetTwo company-sponsored business trips each year at international destinations we serve!All applications should be submitted in English.Show moreShow less",N/A,Remote,https://www.linkedin.com/jobs-guest/jobs/api/jobPosting/4402013062,2026-05-07
Cientista de dados,Vertem,"Barueri, São Paulo, Brazil",6 days ago,"Estamos em busca de umCientista de Dados Sêniorpara fortalecer a agenda de inteligência e analytics avançado na Vertem.Essa posição terá papel estratégico na construção e operacionalização de modelos deMachine Learningaplicados a problemas reais de negócio, utilizando uma arquitetura moderna de dados baseada emDatabricksem ambienteAWS.O profissional atuará diretamente no desenvolvimento, treinamento, implantação e monitoramento de modelos preditivos, contribuindo para transformar dados em soluções inteligentes que apoiem decisões estratégicas, produtos analíticos e geração de valor para clientes e parceiros.Buscamos alguém com forte capacidade analítica, domínio técnico em ciência de dados e experiência prática em ambientes modernos de dados e inteligência artificial.Responsabilidades e atribuiçõesO Cientista de Dados Sênior será responsável por desenvolver soluções analíticas avançadas e modelos de machine learning que contribuam diretamente para a geração de valor para o negócio.Entre as principais responsabilidades estão:Desenvolver, treinar e validarmodelos de Machine Learningaplicados a problemas reais de negócio.Trabalhar com grandes volumes de dados armazenados noData Lake corporativo em AWS.Utilizar o ecossistema da plataformaDatabrickspara experimentação, treinamento e operacionalização de modelos.Construir pipelines de dados e pipelines de treinamento de modelos.Utilizar recursos deAutoML do Databrickspara acelerar experimentação e geração de modelos.Realizarfeature engineeringe preparação de dados para modelos analíticos.Implementar e manter rotinas dedeploy e scoring de modelos de machine learning em produção.Monitorar performance de modelos, avaliando possíveis degradações e necessidade de re-treinamento.Trabalhar em conjunto com times deengenharia de dados, BI e produtos de dadospara transformar dados em soluções analíticas escaláveis.Apoiar a evolução da plataforma de inteligência da empresa, contribuindo com boas práticas de ciência de dados e machine learning.Esperamos que a pessoa tenha experiência sólida em ciência de dados aplicada a ambientes corporativos e plataformas modernas de dados.Entre os conhecimentos e experiências desejados estão:Requisitos e qualificaçõesExperiência técnicaVivência comDatabricks.Vivência em desenvolvimento demodelos de machine learning supervisionados e não supervisionados.Conhecimento emAutoML no Databricks.Vivência emdeploy de modelos de machine learning em produção.Conhecimento emscoring de modelos e pipelines de inferência.Vivência comfeature engineeringe preparação de dados para modelos analíticos.Domínio dePython aplicado à ciência de dados.Vivência com bibliotecas como:scikit-learnXGBoostLightGBMTer atuado com dados em ambientes deData Lake e Big Data.Diferenciais:Vivência comMLflow.Vivência com monitoramento e governança de modelos de machine learning.Atuação em projetos derecomendação, segmentação ou modelos de propensão.Vivência em ambientes de dados emAWS.Vivência em projetos deanalytics avançado e produtos de dadosInformações adicionais✨O que temos para te oferecer?✨Para equilibrar trabalho e vida pessoal:🏡 Flex Office – 2 dias de home office e 3 dias presenciais.🎂 Day Off no aniversário – Seu dia especial, do jeito que preferir!⏰ Horário flexível – Mais autonomia para organizar sua rotina.Para cuidar da sua saúde e bem-estar:🩺 Plano de saúde e odontológico Sul América.🛡 Seguro de vida Sul América.💙 Atendimento psicológico – Acesso a uma plataforma com psicólogos.💆 ♂️ Massagem no escritório – Um momento de relaxamento no seu dia.🛋 Sala de descompressão – Para recarregar as energias.🏋️ Total Pass – Acesso a academias e atividades físicas.Para facilitar o seu dia a dia:🍽 Vale Refeição ou Alimentação flexível – R$ 41,91 por dia.👶 Auxílio creche – Para filhos de até 5 anos.🚍 VT, estacionamento ou fretado – Mobilidade garantida.Para apoiar seu crescimento:📈 QultureRocks – Plataforma de gestão de performance e desenvolvimento.🎓 Auxílio educação – A partir de 12 meses de empresa, investimos no seu aprendizado.🚀 Cultura inspiradora e disruptiva – Um ambiente dinâmico, colaborativo e inovador.Para celebrar conquistas e momentos especiais:🍼 Kit Nascimento – Um carinho especial para os novos papais e mamães.🎊 Eventos internos e ações de engajamento – Confraternizações e momentos de descontração com o time.🎁 Benefícios exclusivos em datas comemorativas – Porque cada momento especial merece ser celebrado!Show moreShow less",N/A,On-site/Hybrid,https://www.linkedin.com/jobs-guest/jobs/api/jobPosting/4406733161,2026-05-07
Cientista de Dados (Júnior a Sênior),Accenture Brasil,"São Paulo, São Paulo, Brazil",2 months ago,"Buscamos um(a) profissionalsênior em Ciência de Dados, com forte atuação emIA Generativa e Machine Learning aplicado, para desenvolver soluções analíticas avançadas e apoiar a tomada de decisão em um grande cliente brasileiro.A posição envolve a construção de soluçõesend-to-end, desde ingestão e tratamento de dados até o desenvolvimento, deploy e monitoramento de modelos em ambiente produtivo, com foco emdados em escala e impacto real no negócio.Conhecimentos necessários:Domínio avançado de Python para desenvolvimento de soluções de dados e machine learning em produçãoExperiência prática com IA Generativa (LLMs, RAG, embeddings, prompting ou fine-tuning)Vivência com frameworks como LangChain, LlamaIndex ou similaresExperiência com desenvolvimento e deploy de modelos em produçãoConhecimento sólido em estatística aplicada (testes de hipótese, inferência, experimentação)Experiência comprovada com grandes volumetrias de dados e otimização de performanceExperiência com construção e automação de pipelines de dados (ETL/ELT)Experiência prática com cloud (AWS, Azure ou GCP), incluindo serviços de dados e IAO que você vai fazer no seu dia a dia:Desenvolver soluções com IA Generativa aplicadas a problemas reais de negócioConstruir pipelines de RAG (ingestão, embeddings, recuperação e geração de respostas)Desenvolver, validar e colocar em produção modelos de machine learning e deep learningAtuar na integração de modelos em sistemas e aplicações corporativasTrabalhar com grandes volumes de dados, garantindo performance e escalabilidadeImplementar práticas de monitoramento e avaliação de modelos (drift, acurácia, etc.)Automatizar pipelines de dados e processos analíticos (ETL/ELT)Colaborar com times multidisciplinares (engenharia, produto e negócio)Diferenciais:Experiência com arquiteturas multiagentes e orquestração de modelosVivência com observabilidade de modelos (monitoramento, métricas, avaliação)Experiência com deploy de soluções de IA em escala corporativaConhecimento em MLOps (CI/CD, versionamento e governança de modelos)Experiência com serviços de IA em cloud (ex: SageMaker, Bedrock ou equivalentes)Benefícios:Assistência Médica 100% subsidiada pela empresa (titular e dependentes).Assistência Odontológica.Vale Refeição ou Alimentação sem desconto.Seguro de vida.Previdência Privada.Gympass.Opção de compra de ações da empresa com desconto.Desconto Farmácia*.Auxílio Creche*.Parceria com escola de idiomas*.Licença Maternidade e Paternidade Estendida.PPR.Conforme política vigente.Localidade da vaga:BrasilUm time que faz parte da mudançaAbraçamos o poder da mudança para criar valor e sucesso compartilhado para nossos clientes, funcionários, acionistas, parceiros e comunidades. Contamos com a maior rede mundial de centros de tecnologia avançada e operações inteligentes.Provocamos a mudança no mercadoTrabalhamos juntos mundo afora para fazer um mundo de diferenças. A Accenture é uma empresa global de serviços profissionais líder em soluções para digital, nuvem e segurança. Ao combinar experiência incomparável e habilidades especializadas em mais de 40 setores, oferecemos serviços em Estratégia e Consultoria, Tecnologia, Operações, Industry X e a Accenture Song.Ao trabalharmos juntos, a mudança se torna a fonte de progresso mais dinâmica e poderosa que você tem. Somos mais de 738 mil pessoas, presentes em mais de 120 países, engajados em fazer inovação todos os dias e transformar o mundo em um lugar melhor para as pessoas.Junte-se a nós - TechnologyReunimos inovação, novas habilidades tecnológicas e conhecimento do setor para ajudar os clientes a inovar em escala, transformar e expandir negócios. Venha trabalhar em uma cultura que incentiva ideias inovadoras a florescer e causar um impacto significativo nos negócios de nossos clientes e em nossas comunidades. Combine o melhor da tecnologia e criatividade humana em programas de transformação de TI e negócios em larga escala para clientes globais usando as tecnologias mais recentes em nuvem, segurança, dados, IA, digital, Industry X, plataformas corporativas e automação inteligente.Show moreShow less",N/A,On-site/Hybrid,https://www.linkedin.com/jobs-guest/jobs/api/jobPosting/4379106073,2026-05-07
Especialista Cientista de Dados,Serasa Experian,"São Paulo, São Paulo, Brazil",1 week ago,"Company DescriptionA Serasa Experian é a primeira e a maior Datatech do Brasil. Líder em soluções de inteligência para análise de riscos e oportunidades, com foco nas jornadas de crédito, autenticação e prevenção à fraude. Com tecnologia de ponta, inovação e os melhores talentos, transforma a incerteza do risco na melhor decisão, ajudando pessoas a realizarem seus sonhos e empresas de todos os portes e segmentos a prosperarem.Temos 22.000 pessoas operando em 32 países e a cada dia estamos investindo em novas tecnologias, profissionais talentosos e inovação para ajudar todos os clientes a maximizarem cada oportunidade. Com sede corporativa em Dublin, Irlanda, a Experian está listada na Bolsa de Valores de Londres (EXPN) e compõe o índice FTSE 100.Job DescriptionO DataLab é a unidade de pesquisa e inovação do grupo Experian na América Latina junto com a Serasa Experian no Brasil. Temos o objetivo de ser propositivo, antecipando o futuro, e consultivo, identificando oportunidades de evolução no mercado, por meio de técnicas de Inteligência Artificial e Machine Learning combinada com uso de novas fontes de dados.Criamos soluções inovadoras avançadas, que ajudam clientes e mercado a se prepararem hoje para o amanhã de decisões mais assertivas. Além de termos um olhar 360º para trocar com o que há de melhor no âmbito global, considerando o todo e produzindo soluções capazes de alcançar grande escalabilidade.Como Especialista em Ciência de Dados, você terá um papel central no time, utilizando sua experiência e conhecimentos em Machine Learning, GenAI, programação, tratamento e análise de dados para liderar tecnicamente projetos junto aos times de engenharia e negócios.Principais ResponsabilidadesPropor e implementar análises de dados avançadas e modelos de Machine Learning;Manipular eficientemente grandes volumes de dados;Colaborar com times de Engenharia de Dados, Engenharia de Software, Produtos e Negócios para entender as necessidades, sugerir soluções orientadas a dados e influenciar positivamente o rumo dos projetos;Explorar continuamente novas fontes de dados e novidades técnicas;Manter-se atualizado com as últimas pesquisas e avanços em GenAI e Machine Learning.Apresentar os resultados e recomendações para stakeholders e times executivos;Desenhar roadmaps de desenvolvimento de produtos data-driven em concordância com as necessidades de negócio;Conduzir experimentos e testes de forma ágil visando decisões conclusivas.O Que Estamos BuscandoBacharelado em Ciência de Dados, Estatística, Ciência da Computação, Engenharia, Física ou cursos relacionados;Sólidos conhecimentos em Python, principalmente em manipulação de dados, bibliotecas de análise (ex. Pandas, Numpy) e frameworks de Machine Learning (ex. scikit-learn, TensorFlow);Experiência na manipulação de grandes bases de dados, em especial armazenadas em ambiente Hadoop (HDFS), processamento distribuído de dados (PySpark) e linguagem SQL;Experiência em desenvolver e implantar modelos de Machine Learning, com bons conhecimentos em validação, tuning e monitoramento de modelos;Experiência em versionamento de código;Habilidade para o entendimento e a resolução de problemas de negócios de forma versátil e ágil;Habilidade de comunicação com pares, áreas parceiras e executivos, incluindo apresentações e tradução de insights em ações de negócios;Colaboração e trabalho em equipe;Aprendizado constante;Inglês avançado;Disponibilidade para atuação híbrida (2x na semana) em São Paulo/SP (Chácara Santo Antônio).DiferenciaisMestrado ou doutorado em alguma das áreas correlatas;Conhecimento e experiência com processamento de grafos e redes complexas;Conhecimento de frameworks de GenAI como LangChain, LangGraph, Agno ou equivalentes;Atuação prévia em produtos corporativos baseados em LLMs, RAG, MCP e sistemas multiagentes.QualificationsData sciencePythonCodingBig dataAIStatisticsAdditional InformationA Serasa Experian é muito mais do que você imagina. Com o propósito de criar um futuro melhor, ampliando oportunidades para pessoas e empresas, no Brasil somos mais de 4 mil pessoas que atuam em diversos times e especialidades. Aqui, cada conhecimento e diversidade se complementa e você pode trabalhar no que mais ama, estamos comprometidos a construir uma cultura inclusiva e um ambiente no qual pessoas possam equilibrar a carreira com seus compromissos e interesses pessoais, prezando pelo bem-estar.A gente se dedica muito em ser uma das melhores e mais inovadoras empresas para se trabalhar do país, possibilitando experiências e carreiras incríveis para nossas pessoas. Nossa forte abordagem de pessoas em primeiro lugar é reconhecida externamente por meio de diversas certificações de mercado: fomos premiados pelo Great Place To Work™ em 24 países e pela certificação internacional Top Employers, além de sermos reconhecidos como uma das melhores empresas para jovens profissionais e contarmos com uma avaliação de 4,6 no Glassdoor. Cada reconhecimento nos indica que estamos no caminho certo, proporcionando um ambiente de trabalho cada vez melhor para nossos talentos.Experian Careers - Creating a better tomorrow togetherFind out what its like to work for Experian by clicking hereShow moreShow less",N/A,On-site/Hybrid,https://www.linkedin.com/jobs-guest/jobs/api/jobPosting/4367331072,2026-05-07
