title,company,location,posted,description,applicants,work_mode,link,data_coleta
Cientista de Dados Especialista,iFood,"Osasco, São Paulo, Brazil",1 week ago,"Nosso Modo de Fazer no Time:Transforme sua carreira com o iFood! Somos uma empresa brasileira de tecnologia referência na América Latina. Por meio de soluções inovadoras, conectamos milhares de restaurantes a milhões de consumidores diariamente com uma média de 100 milhões de pedidos mensais. Além do delivery de comida, também somos Mercado, Farmácia e Pet. Temos também o iFood Pago, nossa Fintech, que engloba o iFood Benefícios, o vale alimentação e refeição do iFood e o próprio iFood Pago, o banco do restaurante. Junte-se a nós e faça parte de uma equipe que está sempre à frente com tecnologia de ponta e inovação constante.Seu Cardápio Diário:Construir modelos preditivos sólidos para prever e prevenir falhas operacionais em restaurantes.Realizar testes e inferências causais para identificar causas de cancelamentos e insatisfações.Colaborar ativamente com quartetos multidisciplinares, incluindo dados, desenvolvimento, negócios e parceiros.Atuar como ponte entre diferentes times, levantando questões e facilitando a comunicação.Participar na evolução da estratégia de intervenções preventivas, antecipando problemas antes que ocorram.Ingredientes Que Buscamos:Habilidade sólida em modelos estatísticos e experiência com testes de causalidade.Conhecimento em Python e experiência com DAB/databricks como diferencial.Capacidade de trabalhar de forma independente e colaborativa.Experiência em antifraude será considerada um diferencial importante.Facilidade para levantar questões e atuar de forma integrada com equipes diversas.Para Realçar o Sabor:Experiência em ambientes de squad, com foco em tempo real e análise histórica.Capacidade de adaptação e inovação em estratégias preventivas.Habilidade para atuar em ambientes dinâmicos e interdisciplinares.Espírito crítico e proativo para antecipar e resolver problemas complexos.Buscamos uma pessoa apaixonada por transformar dados em soluções preventivas e que goste de desafios. Se você se identifica com este perfil, adoraríamos conhecer você!Ref.50346Show moreShow less",N/A,On-site/Hybrid,https://www.linkedin.com/jobs-guest/jobs/api/jobPosting/4372205910,2026-02-23
Forward-Deployed Data Scientist,Braze,"São Paulo, São Paulo, Brazil",2 weeks ago,"At Braze, we have found our people. We’re a genuinely approachable, exceptionally kind, and intensely passionate crew.We seek to ignite that passion by setting high standards, championing teamwork, and creating work-life harmony as we collectively navigate rapid growth on a global scale while striving for greater equity and opportunity – inside and outside our organization.To flourish here, you must be prepared to set a high bar for yourself and those around you. There is always a way to contribute: Acting with autonomy, having accountability and being open to new perspectives are essential to our continued success.Our deep curiosity to learn and our eagerness to share diverse passions with others gives us balance and injects a one-of-a-kind vibrancy into our culture.If you are driven to solve exhilarating challenges and have a bias toward action in the face of change, you will be empowered to make a real impact here, with a sharp and passionate team at your back. If Braze sounds like a place where you can thrive, we can’t wait to meet you.What You’ll DoAs our customer base continues to grow with the excitement around BrazeAI, we’re expanding our team! Join our Forward-Deployed Data Scientist group of creative technical experts who partner with customers to ensure their success. In this role, you will:Collaborate with customer Analytics/BI teams and Braze colleagues on implementations, including use case definition, data integration, pipeline setup, and ML model configurationExtend product capabilities by improving architecture and developing reusable data pipelines, APIs, and componentsWork closely with the RL pipeline development team to refine and advance our reinforcement learning (self-learning) algorithmsContribute to shaping BrazeAI's product strategy and roadmap through customer-facing insights and technical expertiseProvide ongoing technical expertise to ensure successful adoption, measurable outcomes, and long-term customer successWHO YOU AREEducation: Bachelor’s degree in Computer Science, Data Science, Mathematics, Engineering, or a related field required; Master’s or PhD in a relevant technical discipline preferredExperience: 3–5+ years of hands-on experience as a Data Scientist, Machine Learning Engineer, or similar role working with large-scale data and production environments. Experience in customer-facing or consulting roles is strongly preferredStrong technical expertise: Proficient in Python (Pandas) and core ML libraries (TensorFlow, Keras, scikit-learn, CatBoost, XGBoost). Skilled in SQL for querying/manipulating datasets, with experience in machine learning pipelines and model deploymentEngineering best practices: You write well-structured, modular, documented code; follow strong development practices (Git, CI/CD, testing frameworks, type-hinting, code reviews); and can build scalable, maintainable solutionsNice-to-have skills: Experience with DevOps tools (Airflow, Kubernetes, Terraform, GCP), data integration/ETL and pipeline optimization, or reinforcement learning algorithmsCustomer collaborator: Comfortable working directly with clients and cross-functional teams, aligning stakeholders, and translating technical concepts into clear business valueEntrepreneurial problem-solver: You identify opportunities and risks early, troubleshoot obstacles, and drive creative solutionsContinuous learner: You stay current with industry trends, explore new tools/technologies, and thrive in environments that push you to growClear communicator: Able to explain complex technical ideas persuasively to both technical and non-technical audiencesWhat We OfferBraze benefits vary by location, and we encourage you to review our specific benefits offerings for each country here . More details on benefits plans will be provided if you receive an offer of employment.BenefitsFrom offering comprehensive benefits to fostering hybrid ways of working, we’ve got you covered so you can prioritize work-life harmony. Braze offers benefits such as:Competitive compensation that may include equityRetirement and Employee Stock Purchase PlansFlexible paid time offComprehensive benefit plans covering medical, dental, vision, life, and disabilityFamily services that include fertility benefits and equal paid parental leaveProfessional development supported by formal career pathing, learning platforms, and a yearly learning stipendA curated in-office employee experience, designed to foster community, team connections, and innovationOpportunities to give back to your community, including an annual company-wide Volunteer Week and donation matchingEmployee Resource Groups that provide supportive communities within BrazeCollaborative, transparent, and fun culture recognized as a Great Place to Work®About BrazeBraze is the leading customer engagement platform that empowers brands to Be Absolutely Engaging.™ Braze helps brands deliver great customer experiences that drive value both for consumers and for their businesses. Built on a foundation of composable intelligence, BrazeAI™ allows marketers to combine and activate AI agents, models, and features at every touchpoint throughout the Braze Customer Engagement Platform for smarter, faster, and more meaningful customer engagement. From cross-channel messaging and journey orchestration to Al-powered decisioning and optimization, Braze enables companies to turn action into interaction through autonomous, 1:1 personalized experiences.The company has repeatedly been recognized as a Leader in marketing technology by industry analysts, and was voted a G2 “Best of Marketing and Digital Advertising Software Product” in 2025.Braze was also named a 2025 Best Companies To Work For by U.S. News & World Report, a 2025 America’s Greatest Companies by Newsweek, and a 2025 Fortune Best Workplace in Technology™ by Great Place To Work®, among other accolades. Braze is also proudly certified as a Great Place to Work® in the U.S., the UK, Australia, and Singapore.The company is headquartered in New York with offices in Austin, Berlin, Bucharest, Chicago, Dubai, Jakarta, London, Paris, San Francisco, São Paulo, Singapore, Seoul, Sydney and Tokyo.BRAZE IS AN EQUAL OPPORTUNITY EMPLOYERAt Braze, we strive to create equitable growth and opportunities inside and outside the organization.Building meaningful connections is at the heart of everything we do, and that includes our recruiting practices. We're committed to offering all candidates a fair, accessible, and inclusive experience – regardless of age, color, disability, gender identity, marital status, maternity, national origin, pregnancy, race, religion, sex, sexual orientation, or status as a protected veteran. When applying and interviewing with Braze, we want you to feel comfortable showcasing what makes you you .We know that sometimes different circumstances can lead talented people to hesitate to apply for a role unless they meet 100% of the criteria. If this sounds familiar, we encourage you to apply, as we’d love to meet you.Please see our Candidate Privacy Policy for more information on how Braze processes your personal information during the recruitment process and, if applicable based on your location, how you can exercise any privacy rights.Show moreShow less",N/A,On-site/Hybrid,https://www.linkedin.com/jobs-guest/jobs/api/jobPosting/4319050334,2026-02-23
Cientista de Dados Sênior,XP Inc.,"São Paulo, São Paulo, Brazil",1 week ago,"Sobre nósA XP Inc. é uma das maiores instituições financeiras independente do Brasil, dona das marcas XP, Rico, Clear, XP Educação, InfoMoney, entre outras. Com mais de 4,6 milhões de clientes ativos e um valor superior a R$ 1,1 trilhão de ativos sob custódia, há 24 anos vem transformando o mercado financeiro para melhorar a vida das pessoas.Com uma cultura marcante guiada por quatro valores -Sonho Grande, Espírito Empreendedor, Foco no Cliente e Mente Aberta- a XP Inc. está sempre em busca dos melhores talentos que tem ambição de fazer o impossível.🚀 Sobre a OportunidadeVocê será parte de um time multidisciplinar (dados, data science, mlops, risco, compliance e tecnologia) responsável por:Desenvolver e evoluir modelos de detecção de transações suspeitas de lavagem de dinheiro e financiamento ao terrorismo.Aumentar a efetividade do monitoramento, regras (mais casos relevantes) e reduzir o volume de falsos positivos, melhorando a eficiência das áreas de investigação.Estruturar e analisar grandes volumes de dados transacionais, cadastrais e comportamentais dos clientes para identificar padrões anômalos.Traduzir requisitos regulatórios de PLD em lógicas, regras, features e modelos que possam ser auditados e explicados para áreas internas e reguladores.ResponsabilidadesTrabalhar lado a lado com times de PLD/Compliance, Risco, Controles Internos e Tecnologia, entendendo regras, cenários de risco, tipologias e necessidades regulatórias.Criar e acompanhar KPIs de performance dos modelos.Apoiar o desenho de estratégias híbridas (modelos + regras) para garantir:Eficácia na detecção;Aderência a normas de PLD (BACEN, CVM, COAF);Explicabilidade mínima para investigações e auditorias.Prototipar, testar e colocar em produção soluções analíticas em parceria com engenheiros de dados e de machine learning.Documentar abordagens, premissas, limitações e resultados, garantindo auditoria e rastreabilidade.Acompanhar tendências e melhores práticas em AML/PLD IA/LLM, trazendo inovações estratégicas para o time.Saiba mais sobre nosso dia a dia no Instagram e no LinkedIn.Confira nossas avaliações no Glassdoor.🔍 O Que ProcuramosPré-requisitos EssenciaisFormação em cursos como: Engenharia, Ciência da Computação, Estatística, Matemática, Física, Economia, Ciências de Dados ou áreas correlatas.Experiência prévia (sênior) trabalhando com Ciência de Dados ou Machine Learning em ambiente de negócios (não precisa ser necessariamente em PLD, mas será diferencial).Domínio de Python e principais bibliotecas de dados/ML (p.ex. pandas, NumPy, scikit-learn, PySpark etc).Experiência com SQL para manipulação de grandes volumes de dados.Vivência EmProblemas supervisionados (classificação, regressão) e não supervisionados (clustering, detecção de anomalias);Construção de features e avaliação de modelos.Capacidade de traduzir problemas de negócio (PLD, risco, compliance) em problemas analíticos e de dados.Boa comunicação para dialogar com stakeholders não técnicos (PLD, Jurídico, Controles, Operações).DiferenciaisExperiência prévia em PLD/AML, prevenção à fraude, risco de crédito ou modelos de risco em instituições financeiras.Conhecimento ou experiência com:Grafos e análise de redes (p.ex. para relacionamentos entre clientes, contas, contrapartes);Modelos de detecção de anomalias (Isolation Forest, Autoencoders, etc.);Ambientes de big data (Spark e Databricks) e cloud (Azure).Familiaridade com normativos de PLD e reguladores (BACEN, CVM, COAF).Experiência com MLOps (versionamento de modelos, monitoramento em produção, retraining).Conhecimento em explicabilidade de modelos (SHAP, LIME) para apoiar times de PLD/Compliance na justificativa de decisões.Benefícios:Saúde e Bem-estarPlano de saúde sem coparticipação (inclusive, para dependentes)Plano odontológicoWellhub (Gympass)ZenklubSeguro de VidaiFood Benefícios (VA e VR flexível)Vale TransporteNew Value (clube de benefícios)Licença parental: maternidade de 6 meses e paternidade de 20 dias.Auxílio CrecheVida FinanceiraFundos de Investimentos ExclusivosAssessoria de InvestimentosCartão XP Visa Infinite sem anuidadeCrédito (consignado, home equity, CCB Imobiliário, etc.)Modelo de Trabalho Presencial FlexívelO nosso modelo de trabalho varia de acordo com a função, podendo ser totalmente presencial para frentes de negócio e mais flexível para outras equipes.Seguimos um modelo com mais frequência presencial, mas sempre guiado por flexibilidade e autonomia com a responsabilidade da nossa cultura empreendedora.Aqui na XP Inc., valorizamos as interações pessoais e acreditamos no uso do escritório como uma ferramenta para potencializar nossas relações no trabalho.Ao seguir com a inscrição, você declara que leu, compreendeu e concorda com a Política de Privacidade do Grupo XP Inc. e de seus fornecedores e parceiros que apoiam com a realização do processo seletivo. O Grupo XP Inc. poderá utilizar de soluções de inteligência artificial para apoiar a equipe de recrutamento no decorrer do processo, o que poderá envolver o tratamento de seus dados pessoais para tal finalidade, conforme princípios da Lei Geral de Proteção de Dados e da Política de Privacidade do Grupo XP Inc.Show moreShow less",N/A,On-site/Hybrid,https://www.linkedin.com/jobs-guest/jobs/api/jobPosting/4342822057,2026-02-23
AI Trainer - Freelance Annotator (Portuguese),Toloka Annotators,"São Paulo, São Paulo, Brazil",6 days ago,"This opportunity is only for candidates currently residing in the specified country. Your location may affect eligibility and rates. Please submit your resume in English and indicate your level of English.At Toloka, we connect smart, curious people from around the world with freelance online tasks that train and improve artificial intelligence.What We DoThe Toloka Annotators connects individuals with Generative AI projects from leading tech innovators. Our mission is to unlock the full potential of AI by involving real people from around the world in the development process.About The RoleAnnotation is what helps AI make sense of the world. As an annotator, you may be invited to take part inonline projectssuch as rating AI-generated content, evaluating factual accuracy, or comparing responses — when projects are available.Responsibilities:Carefully review provided data (text, images, or videos)Label or classify content based on project guidelinesIdentify and flag factually incorrect, sensitive, inappropriate, or unclear materialImportant note:This is project-based work. Tasks are availableonly when projects are active. You may be invited to one or more projects depending on your profile and current opportunities.RequirementsCurrently studying at a university or holding a completed Bachelor's, Master's, or PhD degree in any professional fieldProficient in Portuguese (C2) and advanced in English (C1 or higher), both written and spokenLogical thinking, fact-checking and reasoning abilitiesStrong attention to detail and ability to understand and follow complex instructionsStrong communication skills, including the ability to ask clarifying questions when neededGenuine interest in technology and artificial intelligenceBenefitsWhy this freelance opportunity might be a great fit for you?Get paid for your expertise, with rates that can go up to $9/hour depending on your skills, experience, and project needsTake part in a part-time, remote, freelance project that fits around your primary professional or academic commitmentsWork on advanced AI projects and gain valuable experience that enhances your portfolioInfluence how future AI models understand and communicate in your field of expertiseShow moreShow less",N/A,Remote,https://www.linkedin.com/jobs-guest/jobs/api/jobPosting/4373595851,2026-02-23
Test Engineer Automation Career Opportunities at Dev.Pro - 01,Dev.Pro,"São Paulo, São Paulo, Brazil",2 weeks ago,"Are you interested in building an exciting IT career at Dev.Pro? Join our exclusive screening process to gain valuable career insights and access personalized feedback on your skill set.🟩 What you'll get by applying:Personalized career growth plan tailored to your aspirationExpert feedback to elevate your skills for lasting successPriority consideration by Dev.Pro for suitable job openings within the companyOpportunity to work with top global corporations and participate in industry-shaping projectsGive us a chance to get to know you better so that when the right position becomes available, you'll be the first one we reach out to!✅ Is that you?As a Test Engineer Automation, you'll be a vital part of our dynamic and robust community. You'll get to work on various exciting and challenging projects across different domains, using your skills and expertise to deliver excellent services and solutions to clients worldwide.4+ years of experience in automation testing of software products, with experience in web, mobile, and API automated testingProficiency in test automation tools like Selenium or AppiumStrong C#, Java, Python, or JavaScript skillsExperience in developing and implementing test automation frameworks and test toolsFamiliarity with popular CI/CD toolsExperience with version control systems and reporting toolsPractical experience with databases and at least one cloud service providerStrong analytical and problem-solving abilitiesExcellent communication and collaboration skillsUpper-Intermediate English levelGet started now:Send us your CV in EnglishSchedule a 15-30 minute call with Dev.Pro recruitersParticipate in a 30-minute experience interview focused on testing your soft skillsGet a 1-hour online evaluation of your technical skills by our technical expertsIn under 2 hours, you'll know where you stand in your career and be ready for action when Dev.Pro presents you with an exciting job offer!🎾 About Dev.ProDev.Pro is a US-based outsource company with an ambitious and creative mindset that has been delivering superior software products since 2011. Known for its strong human focus, Dev.Pro promotes a work environment that is fair, inclusive, open-minded, and friendly toward people of every race, religion, gender, cultural background, marital/parental status, etc. By joining Dev.Pro, you'll feel what it's like to grow with professionals who support your journey.Interested? Find out more:📋How we work💻 LinkedIn Page📈 Our website💻IG PageShow moreShow less",N/A,On-site/Hybrid,https://www.linkedin.com/jobs-guest/jobs/api/jobPosting/4370508466,2026-02-23
