title,company,location,posted,description,applicants,work_mode,link,data_coleta
AI Scientist,Loft,"São Paulo, São Paulo, Brazil",2 weeks ago,"Como o timede DADOSconstrói a Loft:As principais missões do nosso time são garantir que a Loft tome as melhoresdecisões baseadas em dadose extrair o máximo valor deMachine Learning e IApara gerar soluções de negócio. Além disso, somos responsáveis por criar ferramentas e tecnologias que democratizem o acesso à informação, permitindo que todos na companhia utilizem dados de forma eficiente. Nosso dia a dia envolve a construção de produtos de dados, monitoramento de experimentos, projeções e estudos analíticos, sempre focados em otimizar os resultados de negócio. Buscamos pessoas que sejam movidas por desafios, gostem de trabalhar em equipe e queiram se desenvolver em um ambiente dinâmico. Acreditamos em um time diverso, alinhado ao nosso propósito e com mentalidade de alta performance para construir, juntos, o maior ecossistema imobiliário da América Latina.Os desafios que você vai encontrar:Desenvolver produtos inovadores fundamentados em modelos de fundação e machine learningMonitorar o impacto das soluções de dados, transformando métricas técnicas em insights estratégicos para a alta liderança.Atuar consultivamente junto a stakeholders para identificar oportunidades, desenhar novas soluções ou otimizar produtos legados.Colaborar em squads multidisciplinares, integrando visões de Produto, Design e Engenharia para viabilizar a implementação dessas soluções.Garantir a evolução contínua e a manutenção proativa do ecossistema de produtos existentes.O que você precisa para virar a chave?Domínio Técnico: Sólidos conhecimentos em Estatística e Machine Learning (obrigatório)Ferramental e Engenharia: Proficiência em Python e SQL, experiência prática em versionamento de código (Git) e Experiência prática com APIs de foundation modelsCultura e Colaboração: Experiência em squads multidisciplinares e ter um perfil colaborativo, com foco no compartilhamento de conhecimento e autonomia.Comunicação e Interface: Capacidade de traduzir conceitos técnicos complexos para lideranças e stakeholders de negócio.Soft Skills: Postura proativa, perfil analítico e foco em execução (mão na massa).Diferencial: Experiência com o ciclo completo de deploy e monitoramento de modelos em produção; Experiência com RAG e frameworks de desenvolvimento de LLMs; Experiência com monitoramento de performance e custo de modelos de fundação.Informações adicionais💳Caju - Mais liberdade para usar seus benefícios (Refeição, Alimentação, Mobilidade, Saúde, Home Office, Cultura e Educação);🏥Assistência Médica - Sulamerica🪥Assistência Odontológica - Sulamerica🦺Seguro de Vida - Prudential🏋️WellHub - Acesso a academias no Brasil inteiro🧘Wellz- Plataforma de Saúde Mental🏝️Férias Flexíveis - Tire suas férias a qualquer momento😴Day Off👪Licença Parental - para pais e mães🐕Guapeco - Plano de Saúde Pet com desconto🖥️Trabalho - RemotoShow moreShow less",N/A,On-site/Hybrid,https://www.linkedin.com/jobs-guest/jobs/api/jobPosting/4330717054,2026-01-25
Cientista de Dados Júnior,Farmtech,Greater São Paulo Area,2 weeks ago,"VENHA TRANSFORMAR O AGRO COM A GENTE!O#TeamFarmestá crescendo e queremos você com a gente!Desde 2017, lideramos a revolução do crédito no agronegócio. Já viabilizamos mais deR$ 25 bilhõespara fortalecer esse ecossistema tão importante, conectando todos os elos da cadeia agro: da indústria ao produtor rural. Nosso time é feito de#farmers incríveis, com diferentes histórias e experiências, unidos por um propósito:facilitar o acesso ao crédito rápido, simples e seguro e liderar a transformação do agro no Brasil.Aqui na Farm, fazemos do nosso jeito, com a nossa cara:Cliente no centro de tudo.Colaboração que transforma.Acreditamos que o agro muda o mundo. E você pode fazer parte dessa mudança!Vem com a gente“Do clique pra dentro”.______________________________________________________________Sobre a oportunidade:Na Farmtech, dados são parte central da tomada de decisão. Buscamos uma pessoa Cientista de Dados Júnior que tenha curiosidade analítica, vontade de aprender e interesse em transformar dados em informação útil para o negócio. Essa posição é ideal para quem está no início da carreira em dados e quer se desenvolver em um ambiente dinâmico, com acompanhamento técnico, desafios reais e contato próximo com áreas de negócio, crédito e tecnologia.Principais atividades:Apoiar na manipulação e análise de bases de dados estruturadas e não estruturadas;Apoiar na criação, atualização e manutenção de relatórios gerenciais e dashboards;Auxiliar na geração de insights para o negócio a partir de análises de dados;Apoiar estudos estatísticos básicos para identificação de padrões, tendências e desvios;Auxiliar em backtests simples, validações e monitoramento de indicadores, modelos ou segmentações;Apoiar testes de parâmetros e análises exploratórias de dados;Contribuir na organização, documentação e entendimento de processos internos relacionados a dados;Apoiar iniciativas de automação e padronização de rotinas de coleta e análise de dados;Interagir com áreas parceiras (crédito, produtos, tecnologia e negócios) de forma colaborativa.Hard Skills (requisitos Técnicos)Conhecimento em análise de dados (Excel avançado ou similar);Noções de SQL para consulta e manipulação de dados;Experiência acadêmica ou inicial com ferramentas de BI (Power BI, Looker, Tableau ou similares);Conhecimento básico em estatística descritiva;Familiaridade com documentação de análises e processos;Noções de versionamento de código (Git é diferencial);Inglês técnico para leitura e entendimento de materiais.Conhecimento básico em Python ou R;Experiência acadêmica ou estágio em dados, crédito, risco, modelagem ou áreas correlatas;Diferenciais (não obrigatórios):Vivência com ferramentas de organização (Jira, Confluence, Notion, Monday).FormaçãoEnsino superior completo ou em fase final em: Estatística, Matemática, Engenharia, Economia, Ciência da Computação, Sistemas de Informação ou áreas correlatas.Soft SkillsPensamento analítico e curiosidade intelectual;Organização e gestão do tempo;Atenção aos detalhes;Proatividade e vontade de aprender;Boa comunicação e clareza ao explicar análises;Capacidade de receber feedback e evoluir;Trabalho em equipe e colaboração;Adaptabilidade e resiliência;Senso de responsabilidade.O que esperamos dessa posiçãoEvolução técnica ao longo do tempo;Desenvolvimento de autonomia gradual;Capacidade de transformar dados em informações úteis;Crescimento para níveis mais avançados da área de dados._________________________________________________Por que a Farm?Além de um ambiente de aprendizado contínuo, colaborativo e dinâmico, aqui você terá a chance de participar de um projeto com impacto real no agro brasileiro. Com a gente, você vai crescer, desafiar o status quo e construir o futuro do crédito.Show moreShow less",N/A,On-site/Hybrid,https://www.linkedin.com/jobs-guest/jobs/api/jobPosting/4358582528,2026-01-25
Cientista de Dados Sênior - Prevenção a Fraudes,TotalPass Brasil,"São Paulo, São Paulo, Brazil",4 months ago,"DESCRIÇÃONosso time de Dados em Prevenção a Fraude atua de maneira analítica observando padrões e comportamentos para manter nosso aplicativo cada vez mais seguro. Hoje tem participação expressiva nos resultados da área de tecnologia. Trabalhamos em um ambiente que valoriza a comunicação aberta, a inovação e o desenvolvimento contínuo.Como Será o Seu Dia a DiaPlenejar, desenvolver e implementar modelos estatísticos e algoritmos de machine learning para detectar fraudes de forma escalável e com alta precisão.Fomentar a criação de segmentações comportamentais e análises preditivas, utilizando técnicas avançadas de modelagem.Analisar grandes volumes de dados, propondo estratégias e soluções para otimizar a prevenção a fraudes.Fornecer insights estratégicos para a liderança sobre tendências de fraude, comportamentos suspeitos e melhorias em processos.Mentorizar e treinar membros da equipe júnior e pleno, promovendo o compartilhamento de conhecimentos e melhores práticas.Trabalhar em colaboração com outras áreas para garantir que as soluções sejam alinhadas às necessidades de negócio e que os modelos se integrem eficientemente às plataformas e sistemas.Manter-se atualizado sobre as tendências e inovações no campo da prevenção a fraudes e implementar soluções de ponta.O Que Esperamos Que Você TenhaREQUISITOSExperiência avançada em linguagens de programação como Python, SQL, R, e frameworks de Machine Learning.Sólido conhecimento em manipulação de grandes volumes de dados e ambientes de nuvem, com foco em AWS.Capacidade de desenvolver e implementar modelos preditivos e de análise de dados de forma escalável e eficiente.Conhecimento em metodologias ágeis e experiência em ambientes de trabalho colaborativos.Formação acadêmica avançada em Estatística, Matemática, Ciência da Computação ou áreas relacionadas.Capacidade de tomar decisões baseadas em dados e resultados.Comunicação clara com stakeholders e capacidade de apresentar soluções estratégicas.Excelente capacidade de comunicação tanto técnica, quanto para públicos não técnicos.Visão crítica e de inovação para aprimorar processos e implementar novas abordagens.Regime de contratação de tipo: Efetivo – CLTJornada: Período IntegralÁrea e especialização profissional: Informática, TI, Telecomunicações - Processamento de DadosNível hierárquico: AnalistaEscolaridade Mínima: Ensino SuperiorShow moreShow less",N/A,On-site/Hybrid,https://www.linkedin.com/jobs-guest/jobs/api/jobPosting/4301726573,2026-01-25
Cientista de Dados,Claro Brasil,"São Paulo, São Paulo, Brazil",2 days ago,"Responsabilidades e atribuiçõesO que te espera no dia a dia:Desenvolver, treinar e evoluir modelos de Machine Learning e Deep Learning, aplicados a problemas reais de negócio;Analisar, preparar e transformar grandes volumes de dados em escala, garantindo qualidade, consistência e usabilidade analítica;Definir e direcionar abordagens práticas de Ciência de Dados e Inteligência Artificial, conectando técnica e impacto no negócio;Implantar, monitorar e otimizar modelos em produção, atuando com práticas de MLOps para garantir performance, estabilidade e governança;Avaliar continuamente a aderência das soluções aos objetivos de negócio, experiência do usuário e requisitos de usabilidade;Atuar de forma colaborativa com tradutores de dados, cientistas de dados distribuídos e times de tecnologia, garantindo alinhamento e escala das soluções;Requisitos e qualificaçõesBuscamos alguém que:Pensa e age a partir das perspectivas dos clientes. Demonstra interesse e curiosidade de conhecer os clientes, seus comportamentos e preferências para atender e superar suas expectativas;Demonstra compromisso permanente em aprender, ensinar e desenvolver, contribuindo para um ambiente descontraído, respeitoso e colaborativo, incentivando a diversidade;É flexível para se desprender de paradigmas e modelos mentais existentes. Busca soluções inovadoras e sustentáveis, para criar vantagens competitivas para o negócio, equilibrando os interesses econômicos, ambientais e sociais.Para fazer parte do nosso time, é essencial:Residir em São Paulo;Graduação em Engenharia, Estatística, Matemática, Sistemas da Informação e Ciência da Computação e/ou áreas correlatas;Experiência em Ciência de Dados, modelagem estatística e analítica avançada;Domínio de Python e bibliotecas do ecossistema (Pandas, NumPy, scikit-learn e correlatas);Experiência com grandes volumes de dados e modelagem preditiva;É diferencial:Conhecimento em Cloud (OCI, AWS ou Azure);Domínio de SQL, versionamento com Git e uso de containers;Familiaridade com LangChain, Graph-based frameworks e aplicações de IA generativa;Experiência na preparação e integração de grandes volumes de dados utilizando SQL, Spark, Databricks;Informações adicionaisNaClaro, pessoas é um dos nossos valores.Com este pensamento, investimos sempre no cuidado com a saúde, bem-estar e qualidade de vida dos nossos colaboradores! Para que você tenha a melhor experiência em sua jornada com a gente, oferecemos um atraente pacote de benefícios. Veja só:Jornada Flexível;Vale-Refeição e Alimentação;Assistência Médica e Odontológica;Auxílio para patologias graves;Auxílio ao dependente com deficiência;Benefício Farmácia;Auxílio Creche/Babá;Programa de Apoio Pessoal;Claro Running;Previdência Privada;Seguro de Vida;Combo Colaborador;Wellhub (Gympass)Meu Pet ClubConvênios e Parcerias;Programa de Reconhecimento por tempo de casa;E muito mais!Na nossa empresa, valorizamos um ambiente inclusivo, diverso, ético, colaborativo e harmônico. Não fazemos distinção de gênero, raça, cor, orientação sexual, posição social ou deficiências. Todos e todas são bem-vindos(as)!Show moreShow less",N/A,On-site/Hybrid,https://www.linkedin.com/jobs-guest/jobs/api/jobPosting/4354186883,2026-01-25
Analista de Dados & Analytics Pleno,Itaú Unibanco,"São Paulo, São Paulo, Brazil",4 days ago,"Vem ser Ituber & vem fazer ItaúO Itaú é a marca mais valiosa do Brasil, a melhor empresa para trabalhar segundo o Great Place to Work e o maior banco da América Latina. Nós impactamos diariamente mais de 98 milhões de clientes em 18 países.Somos feitos de pessoas e acreditamos que ter um time com pluralidade de origens, culturas, crenças, experiências, raças, deficiências, gêneros, orientações afetivo-sexuais e gerações ampliam as perspectivas e contribuem para um clima de respeito e valorização das diferenças.Estamos em busca de um(a) Analista de Dados Pleno com forte conhecimento técnico e perfil analítico para atuar na construção de soluções de dados, automação de processos e desenvolvimento de dashboards estratégicos. Essa posição é ideal para quem gosta de trabalhar com grandes volumes de dados, criar insights e apoiar decisões de negcio com tecnologia e análise.Por que você vai amar trabalhar conosco:Projetos desafiadores e inovadores.Ambiente colaborativo e foco em desenvolvimento profissional.Oportunidade de impactar decisões estratégicas com soluções baseadas em dados.Estamos buscando uma pessoa para a posição deAnalista de Dados & Analytics Pleno, que queira se desenvolver e aprender, compartilhar, colaborar e inovar, entregando valor para todos os nossos clientes.Se você é apaixonado por dados e tecnologia, essa oportunidade é para você!Estamos buscando um(a) Analista de Dados Pleno com experiência em Python, AWS e criação de dashboards para integrar nosso time.Nessa função você vai:Desenvolver e manter pipelines de dados utilizando Python e serviços AWS.Criar dashboards interativos e relatórios gerenciais (Power BI, QuickSight ou similares).Automatizar rotinas e processos para otimização de tempo e qualidade.Garantir a integridade, qualidade e segurança dos dados.Colaborar com times multidisciplinares para identificar oportunidades de melhoria e propor soluçõesApoiar na definição de métricas e indicadores de performance.No que você precisa mandar bem?Conhecimento sólido em PythonHabilidades em SQL e bancos de dados relacionaisNoções de conhecimento dos serviços AWS (Glue, S3, Lambda, QuickSight ou serviços relacionados)Experiência na criação de dashboards e indicadores (Power BI, Tableau ou AWS QuickSight).Você sairá na frente se mandar bem:Certificações em AWS ou ferramentas de BI.Experiência com Data Mesh ou arquiteturas distribuídas.Ao se tornar um ituber você tem_Vale-TransporteVale-Refeição (Restaurantes) / Vale-Alimentação (Supermercados)Plano médico (Fundação Saúde ItaúouCentral Nacional Unimed)Plano odontológico (OdontoprevouInterodonto)Seguro de VidaPLR – Participação nos Lucros e Resultados (Mediante resultados do banco)Previdência privadaDescontos exclusivos em nossos produtos financeirosLicença maternidade e paternidade estendidaAuxílio Creche / Babá (para papais e mamães)Incentivo a estudosWellhub ou TotalPassAcesso aos Clubes de Lazer Itaú (Guarapiranga / Itanhaém e São Sebastião)+ Algumas vantagens que você pode conhecer durante o processo 😊Conheça mais sobre nossa cultura: https://www.itau.com.br/relacoes-com-investidores/noticias/cultura-itubers-e-nosso-novo-conjunto-de-valores/*Estimulamos candidaturas de pessoas com deficiência em todas as nossas posições, sendo assim, sinta-se à vontade para se candidatar em vagas sinalizadas como exclusivas ou não para pessoas com deficiência. Somos comprometidos com a inclusão e valorizamos a diversidade.#VemProItaú #VemSerItuberShow moreShow less",N/A,On-site/Hybrid,https://www.linkedin.com/jobs-guest/jobs/api/jobPosting/4354033548,2026-01-25
Intern Data Scientist Brazil,Artefact,Greater São Paulo Area,1 week ago,"Who We AreArtefact is a new generation of a data service provider, specialising in data consulting and data-driven digital marketing, dedicated to transforming data into business impact across the entire value chain of organisations. We are proud to say we’re enjoying skyrocketing growth.Our broad range of data-driven solutions in data consulting and digital marketing are designed to meet our clients’ specific needs, always conceived with a business-centric approach and delivered with tangible results. Our data-driven services are built upon the deep AI expertise we’ve acquired with our 300+ internation brands around the globe.We have 800+ employees across 16 offices in 13 countries who are focused on accelerating digital transformation. Thanks to a unique mix of company assets: State of the art data technologies, lean AI agile methodologies for fast delivery, and cohesive teams of the finest business consultants, data analysts, data scientists, data engineers, and digital experts, all dedicated to bringing extra value to every client.What You Will Be DoingYou will join our Data Marketing Consulting team which helps clients transform and improve their marketing strategy by applying advanced analytics to generate value-creating insights from big data and artificial intelligence.Key ResponsibilitiesAs a Data Scientist Intern, your role will encompass:Conducting ambitious projects in the transformation of clients through dataCollaborating with the other Divisions (Activation, Creativity, and Strategy) to provide comprehensive services to your clientsDeveloping privileged relationships with our clients, using your technical abilities to assist in the transformation of their marketing departmentAmong your responsibilities as a Data Scientist Intern, you will be responsible for:Performing data projectsSecuring delivery on your projectsCommunicating your work and achievements among the teamWorking closely with your Consulting counterpart to build and maintain strong relationships with your clients and best understand their needsEnsuring that your solutions are bringing values to the client problematicBeing a good team player, knowing your role and responsibility in the global ambitionBeing a great tech personDemonstrating the skill and credibility required to ensure the success of our clients’ initiativesResearching and developing new technical approaches to address problems efficientlySharing best practices and contributing to Artefact’s institutional knowledgeEmbodying Artefact’s values and inspiring others to do the sameWhat We Are Looking ForCurrently pursuing a BA/BS or MA/MS in machine learning, mathematics, computer science, or related fields (computer science, statistics, engineering, economics, or a related field) from an accredited college or university.0-1 years of related experience supporting engineering, information technology or other technical operations. A first experience (internship, school project, Junior Entreprise, etc.) in consulting and/or data ecosystem would be a plus.Good understanding of the digital and data ecosystem and its technologies: web analytics, programmatic, DMP, Datalake, dataviz, data science, etc.Strong interest in marketing & business issuesIntellectual curiosity, along with on excellent problem-solving skill, including the ability to disaggregate issues, identify root causes and recommend solutionsA practical and analytical mind-set, you will be passionate about the creation of bespoke solutions for our clientsContinuously striving for high performance in all you doGood Communication skillsIdeal candidates should be passionate about using business acumen along with big data and analytics to address real-world problems and drive significant change.Why you should join usArtefact is the place to be: come and build the future of marketingProgress: every day offers new challenges and new opportunities to learnCulture: join the best team you could ever imagineEntrepreneurship: you will be joining a team of driven entrepreneurs. We won’t give up until we make a huge dent in this industry!Come join us!Show moreShow less",N/A,On-site/Hybrid,https://www.linkedin.com/jobs-guest/jobs/api/jobPosting/4308483980,2026-01-25
"Data Scientist, Search Platforms and Data Quality (English)",Google,Greater São Paulo Area,1 day ago,"Please submit your resume in English - we can only consider applications submitted in this language.Minimum qualifications:Master's degree in Statistics, Data Science, Mathematics, Physics, Economics, Operations Research, Engineering, or a related quantitative field.3 years of work experience using analytics to solve product or business problems, coding (e.g., Python, R, SQL), querying databases or statistical analysis, or a PhD degree.Ability to communicate in English fluently, to interact with internal stakeholders.Preferred qualifications:5 years of work experience using analytics to solve product or business problems, coding (e.g., Python, R, SQL), querying databases or statistical analysis, or a PhD degree.4 years of experience analyzing data and creating reports with statistical, quantitative modeling, and forecasting skills.3 years of experience in an applied research setting.Knowledge of statistics, and proficiency in one or more statistical software packages (e.g., R, SPSS, Stata, SAS).About The JobAt Google, data drives all of our decision-making. Quantitative Analysts work all across the organization to help shape Google's business and technical strategies by processing, analyzing and interpreting huge data sets. Using analytical excellence and statistical methods, you mine through data to identify opportunities for Google and our clients to operate more efficiently, from enhancing advertising efficacy to network infrastructure optimization to studying user behavior. As an analyst, you do more than just crunch the numbers. You work with Engineers, Product Managers, Sales Associates and Marketing teams to adjust Google's practices according to your findings. Identifying the problem is only half the job; you also figure out the solution.Google Research addresses challenges that define the technology of today and tomorrow. From conducting fundamental research to influencing product development, our research teams have the opportunity to impact technology used by billions of people every day.Our teams aspire to make discoveries that impact everyone, and core to our approach is sharing our research and tools to fuel progress in the field -- we publish regularly in academic journals, release projects as open source, and apply research to Google products.ResponsibilitiesCollaborate with stakeholders in cross-projects and team settings to identify and clarify business or product questions to answer. Provide feedback to translate and refine business questions into tractable analysis, evaluation metrics, or mathematical models.Use custom data infrastructure or existing data models as appropriate, using specialized knowledge. Design and evaluate models to mathematically express and solve defined problems with limited precedent.Gather information, business goals, priorities, and organizational context around the questions to answer, as well as the existing and upcoming data infrastructure.Own the process of gathering, extracting, and compiling data across sources via relevant tools (e.g., SQL, R, Python). Independently format, re-structure, and/or validate data to ensure quality, and review the dataset to ensure it is ready for analysis.Google is proud to be an equal opportunity workplace and is an affirmative action employer. We are committed to equal employment opportunity regardless of race, color, ancestry, religion, sex, national origin, sexual orientation, age, citizenship, marital status, disability, gender identity or Veteran status. We also consider qualified applicants regardless of criminal histories, consistent with legal requirements. See also Google's EEO Policy and EEO is the Law. If you have a disability or special need that requires accommodation, please let us know by completing our Accommodations for Applicants form .Show moreShow less",N/A,On-site/Hybrid,https://www.linkedin.com/jobs-guest/jobs/api/jobPosting/4365571888,2026-01-25
