title,company,location,posted,description,applicants,work_mode,link,data_coleta
Cientista de Dados Sênior,Braskem,"São Paulo, São Paulo, Brazil",2 weeks ago,"Job DescriptionCientista de Dados SêniorEstamos buscando um(a) Cientista de Dados Sênior talentoso(a) e experiente para se juntar à nossa equipe. Este(a) profissional será fundamental para impulsionar a tomada de decisões estratégicas por meio da análise avançada de dados, do desenvolvimento de modelos e da geração de insights acionáveis.Como Cientista de Dados Sênior, você terá a oportunidade de liderar projetos complexos de ponta a ponta, desde a concepção e recebimento dos dados até a implementação e o monitoramento de soluções de machine learning e IA Generativa em produção. Você trabalhará em colaboração com diversas áreas, traduzindo desafios de negócios em problemas de dados e comunicando resultados de forma clara e impactante.Buscamos um(a) profissional proativo(a), com forte capacidade analítica, visão estratégica e paixão por transformar dados em valor para o negócio. Se você é um líder técnico nato, com experiência comprovada em ciência de dados e busca um ambiente desafiador e inovador, essa é a sua chance!Responsabilidades:Liderar e executar projetos complexos de ciência de dados, desde a definição do problema até a entrega da solução.Desenvolver e implementar modelos preditivos e algoritmos de machine learning (clássicos e deep learning) e soluções de IA Generativa/LLMs (incluindo RAG, fine-tuning e prompt engineering).Realizar análise exploratória de dados para identificar padrões, tendências e oportunidades de melhoria.Projetar e implementar pipelines de dados eficientes para coleta, limpeza, transformação e armazenamento de grandes volumes de dados.Colaborar com engenheiros de dados para garantir a escalabilidade, segurança e confiabilidade das soluções de dados e de GenAI.Comunicar de forma clara e concisa os resultados das análises e modelos para stakeholders técnicos e não técnicos, incluindo a liderança executiva.Traduzir problemas de negócios em problemas de dados e propor soluções inovadoras baseadas em análise de dados e IA.Avaliar e implementar novas tecnologias e metodologias de ciência de dados, incluindo frameworks de GenAI e LLMOps.Definir e aplicar padrões de governança, responsabilidade e segurança para uso de modelos (incluindo políticas de privacidade e mitigação de vieses).Contribuir para a definição da estratégia de ciência de dados e IA da empresa, atuando como referência técnica e multiplicador(a) de conhecimento.Competências Essenciais:Graduação em engenharia química e outras engenharias, ciência da computação e/ou ciência de materiais, com forte conhecimento e experiência em ciência de dados (análise, estatística e aprendizado de máquina).Pós-graduação em engenharia ou ciência de dados é desejada.Mínimo de 8 anos de experiência no espaço de análise de dados, big data e ML, incluindo liderança técnica de projetos.Inglês avançado.Conhecimento em Inteligência Artificial Generativa (GenAI) e LLMs, com experiência prática em aplicações corporativas (P&D, manufatura, supply chain, manutenção preditiva, qualidade, eficiência operacional, atendimento ao cliente, etc.).Sólida vivência em comunicação com stakeholders, visão de negócios e tomada de decisão orientada por dados.Técnicas (Hard Skills):Linguagens de Programação: Python (Pandas, NumPy, Scikit-learn, TensorFlow, PyTorch), R (desejável).Modelagem Preditiva e ML: Regressão, Classificação, Clustering, Séries Temporais, Deep Learning, NLP tradicional e moderno.GenAI/LLMs:Modelos de linguagem (ex.: GPT, LLaMA, Mistral) — prompt engineering, RAG, fine-tuning e evaluation.Frameworks e ferramentas: Hugging Face, LangChain, Azure OpenAI Service (desejável), OpenAI API, vetorização e vectordb (FAISS, pgvector, Pinecone, ou equivalentes).Avaliação e monitoramento de LLMs (factualidade, segurança, toxicidade, alucinação, rastreabilidade), com métricas e benchmarks apropriados.Estatística e Probabilidade: Testes de Hipóteses, ANOVA, Regressão, Inferência, desenho de experimentos.Visualização de Dados: Tableau, Power BI, Matplotlib, Seaborn ou ferramentas similares; storytelling com dados.Engenharia de Dados: ETL/ELT, Data Warehousing, Data Lakes/Lakehouse, Spark (PySpark desejável), Delta Lake, Databricks (desejável).Cloud: Azure (desejável), AWS ou GCP; serviços gerenciados de ML/AI (ex.: Azure AI, Azure ML, AWS SageMaker, Vertex AI).Bancos de Dados: Relacionais (SQL Server, PostgreSQL, MySQL) e NoSQL (MongoDB, Cassandra).MLOps/LLMOps: Deploy de modelos, versionamento (MLflow, DVC), CI/CD, monitoramento, re-treinamento, governança e segurança de modelos (incluindo logging e auditoria de interações com LLMs).Boas Práticas e Compliance: Privacidade e proteção de dados (LGPD), gestão de metadados, qualidade de dados, segurança e controles de acesso.Comportamentais (Soft Skills):Liderança Técnica: Capacidade de influenciar e guiar tecnicamente a equipe, atuando como mentor(a).Pensamento Estratégico: Habilidade de alinhar projetos de dados e GenAI com os objetivos de negócios.Excelente Capacidade Analítica e de Resolução de Problemas Complexos.Comunicação Eficaz: Clareza e objetividade na comunicação com diferentes públicos, com storytelling e visualização de resultados.Colaboração e Trabalho em Equipe: Atuação transversal com tecnologia, produto, operações e negócio.Gerenciamento de Projetos: Planejamento, execução e monitoramento com métodos ágeis (Scrum/Kanban).Proatividade e Autonomia; Aprendizado Contínuo e Adaptabilidade.Evangelização de IA: Capacidade de educar stakeholders sobre oportunidades, riscos e melhores práticas de IA Generativa.Visão de Negócios: Entendimento do impacto da ciência de dados e GenAI nos resultados da empresa.Show moreShow less",N/A,On-site/Hybrid,https://www.linkedin.com/jobs-guest/jobs/api/jobPosting/4343920934,2026-01-25
Analista de Dados Junior (Afirmativa para mulheres) | Monee,Shopee,"São Paulo, São Paulo, Brazil",1 week ago,"About The TeamAbout ShôHere at Shô, we believe that each member of our team is essential to our success, and that diversity of perspectives and experiences are essential to drive our business forward and drive our purpose of changing the world for the better. Being part of our team is the opportunity to develop within a culture of great agility. If you love taking on big responsibilities and doing what has never been done before, Shô is the place for you. Here you will face great challenges, work collaboratively with a diverse team and contribute to the future of e-commerce in Brazil, creating a positive impact on the lives of millions of people.Work ModelWe adopt a hybrid work model, this model allows people to adjust their work environment according to their personal needs, while promoting collaboration and interaction in the office.Job DescriptionWhat will be your mission?This position is primarily responsible for reporting and structuring data by interpreting and translating diverse regulatory demands into effective data frameworks and products. It requires transforming complex regulatory requirements into actionable data solutions that enable accurate and timely submissions to regulatory bodies (such as Banco Central and Federal Reserve). Additionally, the role leads and supports Risk & Compliance projects, implementing tools, dashboards, and indicators that guide leadership decisions, identify process improvements, and mitigate institutional risks through data science applications. The position also manages projects related to AML, KYC, fincrime, and other regulatory obligations.What will your day-to-day be like?Lead complex data projects centered on regulatory reporting and Risk & Compliance controls, ensuring all deliverables meet current regulatory standards and internal governance policies.Interpret and transform multiple regulatory requirements into scalable, structured data products and automated reporting solutions tailored for regulatory submissions and internal risk management.Design and define data architectures that facilitate efficient data visualization and generation of intuitive dashboards, empowering stakeholders with clear insights for decision-making.Develop comprehensive ad-hoc analyses and provide data-driven insights considering diverse business cases, risk scenarios, and compliance requirements.Drive the creation and deployment of automation tools using Python and SQL to streamline reporting processes and reduce repetitive manual tasks, enhancing accuracy and efficiency.Proactively identify inefficiencies in Risk & Compliance workflows and lead automation initiatives to optimize these processes across the teams.Oversee coordination and technical support for data analysts involved in compliance and risk-related data projects to ensure quality and consistency of outputs.RequirementsRequirements:Bachelor’s or Master’s degree in computer science, statistics, engineering, mathematics, or related fields;Experience with data analysis in the context of payment processing and wallet products is advantageous;Proficiency in SQL is essential.Knowledge of Pyspark, R, or other relevant languages is a plus;Advanced proficiency in English.BenefitsMedical and dental care, extended to dependents;Partnership with Gympass and TotalPass;Flexible meal/food vouchers;Transportation vouchers, mobility vouchers or on-site parking;Flexible benefits;Zenklub;Discretionary annual bonus, linked to performance.COME MAKE HISTORY WITH US.WHAT MAKES YOU UNIQUE MAKES US BETTER! 🧡N-A50Show moreShow less",N/A,On-site/Hybrid,https://www.linkedin.com/jobs-guest/jobs/api/jobPosting/4357688273,2026-01-25
Data Scientist,Amcor,"São Paulo, São Paulo, Brazil",2 days ago,"Back to search resultsData ScientistLocation:São Paulo/SP, BR, 04711-130Department: Sales & MarketingFull-time or Part-time: Full-TimeJob Type: EmployeeShift: On siteAccelerate the possible by joining a winning Amcor team that’s transforming the packaging industry and improving lives around the world.At Amcor, we unpack possibility through our innovative and responsible packaging to provide solutions that benefit our customers, our people and our planet. More than 10,000 consumers worldwide encounter our products every second and rely on us for safe access to food, medicine and other goods. We value their trust by making safety our guiding principle. It’s our core value and integral to how we do business.Beyond this core principle, our shared values and behaviors unite us as we work together to elevate customers, shape lives and protect the future. We champion our customers and help them succeed. We play to win – adapting quickly in an everchanging world – and make smart choices to safeguard our business, our communities and the people we serve for generations to come. And we invest in our world-class team, empowering our colleagues to unpack their potential, because we believe when our people grow, so does our business.To learn more about playing for Team Amcor, visit www.amcor.com I LinkedIn I Glassdoor I Facebook I YouTubeRole OverviewTheData Scientist – Sales Growth & Market Insightswill play a key role in transforming data into actionable strategies that improve sales performance, customer engagement, and market share. This individual will use advanced analytics, statistical modeling, and machine learning to identify trends, forecast demand, and optimize sales initiatives across our diverse product portfolio.Key ResponsibilitiesRevenue Optimization & Cross-SellingAnalyze historical market sales data across thousands of SKUs (Stock Keeping Units), internal sales data, pricing trends, customer behavior, and market data to identifyOpportunities for revenue growth at customer level""White Space"" opportunities (e.g., customers who buy containers but not lids).Build Recommender Systems to suggest next-best-action products for Account Managers to pitch to existing clients.Churn Prediction & RetentionDevelop predictive models to identify B2B clients showing early signs of churn or volume reduction.Create automated alerts for the sales team when a client’s purchasing pattern deviates from the norm (anomaly detection).Pricing StrategyAnalyze pricing elasticity across different regions and industries to recommend margin improvements based on competitor insights.Assist in modeling the impact of raw material cost fluctuations (resin indices) on product pricing and customer demand.Forecasting & Market IntelligenceUtilize time-series forecasting to predict product demand, sales performance and to help us align sales targets with production capacity.Segment our customer base (clustering) to tailor marketing campaigns and sales approaches for specific verticals (e.g., Medical vs. Food Service).Other responsibilitiesDevelop dashboards and data visualization tools to support decision-making for senior management.Integrate data from various sources (CRM, ERP, supply chain, market intelligence platforms) to create a holistic view of commercial performance.Present findings and recommendations in clear, actionable formats to both technical and non-technical stakeholders.Support business planning and performance reviews through advanced analytics and scenario modeling.Qualifications & ExperienceBachelor’s or Master’s degree in Data Science, Statistics, Mathematics, Computer Science, Economics, or a related field.3–5+ years of experience in a data analytics or data science role, preferably in manufacturing, FMCG, or packaging sectors.Proven experience with data analysis tools and programming languages (Python, R, SQL) and in leveraging Artificial Intelligence (AI) and Generative AI (GenAI) technologies to drive business outcomes.Hands-on expertise with AI-driven tools, frameworks, and platforms for data analysis.Ability to identify and implement GenAI use cases across strategy, operations, and client solutions.Strong skills in data visualization (Power BI, Tableau, or equivalent).Familiarity with CRM systems (e.g., Salesforce) and ERP platforms (e.g., SAP) is an asset.Experience with predictive modeling, clustering (K-Means), and regression techniques.Excellent analytical thinking, business acumen, and communication skills.Key CompetenciesStrong commercial mindset with an ability to translate data insights into business opportunities.High attention to detail and data accuracy.Collaborative and able to work cross-functionally across sales, marketing, and operations.Curious, proactive, and passionate about driving measurable business results through analytics.About AmcorAmcor is the global leader in developing and producing responsible consumer packaging and dispensing solutions across a variety of materials for nutrition, health, beauty and wellness categories. Our global product innovation and sustainability expertise enables us to solve packaging challenges around the world every day, producing a range of flexible packaging, rigid packaging, cartons and closures that are more sustainable, functional and appealing for our customers and their consumers. We are guided by our purpose of elevating customers, shaping lives and protecting the future. Supported by a commitment to safety, over 75,000 people generate $23 billion in annualized sales from operations that span over 400 locations in more than 40 countries.NYSE: AMCR; ASX: AMC www.amcor.com | LinkedIn | YouTubeAmcor is committed to providing a secure and reliable experience for all job seekers. If you are looking to join Amcor, please read this page to help you avoid recruitment scams. Click Here!Show moreShow less",N/A,On-site/Hybrid,https://www.linkedin.com/jobs-guest/jobs/api/jobPosting/4365096666,2026-01-25
Cientista de Dados Pleno,Comerc Energia,"São Paulo, São Paulo, Brazil",1 month ago,"Com mais de 20 anos de experiência, fazemos parte da maior plataforma multienergia do Brasil, a Vibra, e somos referência no mercado energético. Nossa atuação se divide em: Eficiência Energética, Mercado Livre de Energia, Descarbonização, Energia Elétrica e Geração Renovável, com mais de 100 usinas solares. Vamos juntos construir um futuro mais sustentável para as próximas gerações?A energia que transforma está na diversidade dos nossos talentos e acreditamos na importância de promover um ambiente de trabalho cada vez mais diverso e inclusivo. Por isso, incentivamos a candidatura de pessoas com deficiência, pessoas negras, mulheres, LGBTQIAP+, 60+ e indígenas.Junte-se ao nosso time e faça parte da jornada de transição energética do Brasil!⚡Responsabilidades e atribuiçõesEstamos buscando um(a) Cientista de Dados Pleno que será responsável por:Desenvolver, treinar e validar modelos preditivos e de machine learning aplicados às soluções da empresa;Participar da construção de arquiteturas modernas de IA, incluindo uso de LLMs, RAG e pipelines de ML;Colaborar na criação de produtos de dados e serviços inteligentes para apoiar jornadas corporativas;Desenvolver APIs e serviços em Python (FastAPI) para disponibilizar modelos e funcionalidades de dados;Construir e manter pipelines de dados eficientes usando Python, SQLRequisitos e qualificaçõesEnsino superior completo em Ciências da Computação, Estatística, Engenharia, Matemática Aplicada, Sistemas de Informação ou áreas correlatas.Inglês intermediário para leitura de documentações técnicasExperiência em Python (pandas) e SQL.Noções de RAG, embeddings e tokenização.Conhecimento em MLOps.Familiaridade com boas práticas de governança de dados e documentação.Experiência com cloud.Conhecimentos desejáveis:Desejável pós-graduação em Machine Learning, IA, Engenharia de Dados ou áreas afins.Vivência com pipelines distribuídos (Spark/PySpark) e dados estruturados em formatos modernos.Experiência em Machine LearningInformações adicionaisLocal de Trabalho: São Paulo - SPModelo de Trabalho: HíbridoO que oferecemos:Salário compatível com o mercado.Benefícios: Vale Refeição, Vale Transporte, Assistência Médica, Assistência Odontológica, Vale Cultura, Totalpass, Galena, PLR, Day Off de Aniversário, Seguro de Vida e muito mais...Cultura organizacional voltada para desenvolvimento, inovação e sustentabilidade.Show moreShow less",N/A,On-site/Hybrid,https://www.linkedin.com/jobs-guest/jobs/api/jobPosting/4349782527,2026-01-25
Cientista de dados,Grupo Renova,"São Paulo, São Paulo, Brazil",1 month ago,"CIENTISTA DE DADOS📍 Local: Arujá - SP (100% presencial)📂 Setor: Gerenciamento e Tratamento de ResíduosO Que Esperamos De VocêNo Grupo Renova, buscamos um(a)Cientista de Dados com especialização em Inteligência Artificial, capaz de transformar dados em soluções de alto impacto para o negócio. Esse profissional será protagonista na liderança e desenvolvimento de projetos de IA, aplicando desde modelos customizados em plataformas low-code/no-code até arquiteturas avançadas em machine learning, deep learning, NLP e visão computacional.Sua missão será construir e aplicar soluções inteligentes que otimizem processos, aumentem a eficiência operacional e gerem insights estratégicos para a tomada de decisão, com foco em inovação e escalabilidade.ResponsabilidadesLiderar projetos de IA ponta a ponta, desde o desenho até o deploy, garantindo resultados alinhados às necessidades do negócio.Construir e aplicar modelos de IA via plataformas no-code/low-code, democratizando o acesso e acelerando a entrega de soluções inteligentes.Prototipar e escalar soluções rapidamente, utilizando recursos de automação low-code integrados a sistemas corporativos.Desenvolver modelos customizados de machine learning e deep learning para aplicações específicas de negócio.Processamento de Linguagem Natural (NLP): estruturar soluções para chatbots, análise semântica de textos e extração de insights.Visão Computacional: implementar sistemas de reconhecimento e análise de imagens/vídeos aplicados às operações industriais.Automação Inteligente: criar pipelines que substituam processos manuais e aumentem a produtividade.Pesquisa e Inovação: acompanhar avanços de IA, testando tecnologias emergentes no-code/low-code e modelos de ponta.Indicadores de Performance (KPIs)Velocidade de entrega e escalabilidade de soluções de IA no-code/low-code.Acurácia e confiabilidade dos modelos de IA implantados.Redução de custos e aumento de eficiência operacional com automação inteligente.Adoção e satisfação das áreas usuárias com as soluções aplicadas.Requisitos TécnicosGraduação em Ciência da Computação, Engenharia, Estatística, Matemática ou áreas correlatas.Experiência comprovada em plataformas no-code/low-code aplicadas à IA (n8n, Power Automate, DataRobot, Azure ML Studio, Google AutoML, Power Platform).Domínio em Python e bibliotecas de IA (TensorFlow, PyTorch, scikit-learn, OpenCV).Conhecimento em NLP, visão computacional e LLMs (transformers).Vivência em nuvem (AWS, Azure ou GCP) para deploy de modelos.Noções de MLOps e versionamento de modelos.Diferencial: experiência em projetos de IA aplicados a indústria, operações complexas ou sustentabilidade.Informações Adicionais✅Jornada:100% presencial - Segunda à Sexta - 08:00 às 17:30✅Remuneração compatível com o mercado - a combinar.🎁 Benefícios Que OferecemosRefeição no local.Cesta básica ou Vale Alimentação (Cartão iFood).Vale-transporte.Convênio médico e odontológico (para titular e dependentes).Wellhub (plataforma de bem-estar e academias parceiras).PLR.Cesta de Natal.Uniformes.Acreditamos que diferentes perspectivas impulsionam a inovação e fortalecem nosso propósito. Venha construir esse futuro conosco!♻️💚Show moreShow less",N/A,On-site/Hybrid,https://www.linkedin.com/jobs-guest/jobs/api/jobPosting/4348388859,2026-01-25
Visagio Talentos - Estágio: Data Science e IA Generativa SP,Visagio,"São Paulo, São Paulo, Brazil",1 week ago,"Destinado a universitários dos cursos de Engenharias, Administração, Economia, Estatística, Matemática, Ciência da Computação e Sistemas de Informação, com foco de atuação em projetos envolvendo Ciência de Dados e IA Generativa (Inteligência Artificial, Machine Learning, NLP, IA Generativa, Otimização, Simulação, entre outros). Você trabalhará com um time multidisciplinar, direcionado ao desenvolvimento de análises e à implantação de soluções baseadas em dados para geração de valor para nossos clientes.Responsabilidades e atribuiçõesIdentificar oportunidades de melhoria em áreas do negócio, propondo soluções baseadas em dados;Realizar análises de dados para apoiar diagnósticos e tomadas de decisões;Desenvolver e implantar soluções baseados em Machine Learning, NLP, IA Generativa, Otimização, Simulação, entre outros;Acompanhar e gerenciar projetos através de metodologias ágeis;Desenvolvimento interpessoal através de cursos, contato direto com clientes e trabalho em equipe.Requisitos e qualificaçõesGraduandos, a partir do 3º ano, dos cursos de Engenharias, Administração, Economia, Estatística, Matemática, Ciência da Computação e Sistemas de Informação;Bom raciocínio lógico, capacidade analítica e criatividade para propor e implantar as soluções;Visão crítica, habilidade de comunicação e apresentação, e bom relacionamento interpessoal;Rápido aprendizado, com alta curiosidade para aprender continuamente sobre novas tecnologias, além de vontade de fazer a diferença;Preferível experiência em atividades extracurriculares (ex: empresa júnior, PET, iniciação científica, etc).Recomendado o conhecimento dos conceitos de Ciência de Dados, NLP, IA Generativa, Estatística, Banco de Dados e SQL, além de domínio de linguagens de programação (Python, R ou outros).Informações adicionaisConforme necessidade, alguns candidatos, que concluírem todas as etapas online, poderão ser convocados antecipadamente para a etapa de entrevistas.Show moreShow less",N/A,On-site/Hybrid,https://www.linkedin.com/jobs-guest/jobs/api/jobPosting/4353195947,2026-01-25
