title,company,location,posted,description,applicants,work_mode,link,data_coleta
Cientista de Dados Jr. (Finanças),Banco PAN,"São Paulo, São Paulo, Brazil",2 days ago,"Somos oPANÁgeis, flexíveis e criativos, exploramos possibilidades com disposição e desejo de fazer acontecer. Sempre prontos para encarar novos desafios, nutrimos líderes que, além de ter garra, são abertos e empáticos, veem na proximidade das relações, o elo entre cada um.Nossa missão, se faz cumprida quando transformamos a vida dos outros através dos nossos conhecimentos. Nossos pilares de cultura, reforçam nossa postura idealizadora e com desejo de fazer acontecer:Trabalho em equipe, Transparência , Excelência e Eficiência com profundidade.Dominamos nossos processos e trazemos melhorias para quem deseja ter umavida financeira mais inteligente.Principais desafios:Apoiar na validação e desenvolvimento de modelos estatísticos voltados à redução de ações cíveis, análise de propensão e crédito;Contribuir tecnicamente utilizando ferramentas como AWS, SQL, Python e Excel, com oportunidade de aprendizado contínuo;Colaborar com diferentes áreas e times em uma estrutura horizontal e dinâmica, com foco no desenvolvimento profissional.Quais as principais competências para a posição?Formação superior em áreas de Exatas (Engenharia, Estatística, Ciência da Computação, Matemática, entre outras);Conhecimento básico em modelagem estatística e ciência de dados (projetos acadêmicos ou experiências iniciais são bem-vindos);Perfil curioso, colaborativo e com boa capacidade analítica para levantar hipóteses e aprender com os desafios;Familiaridade com ferramentas como AWS, SQL, Python e Excel (não é necessário domínio completo, mas disposição para aprender);Experiência prévia em qualquer segmento é um diferencial, mas não obrigatória (buscamos pessoas com vontade de crescer na área).Modelo de atuação: Híbrido (4 dias presenciais no escritório e 1 dia de home office)Benefícios do PAN:Bônus / PLRVale RefeiçãoVale Alimentação13º de Vale AlimentaçãoConvênio Médico (internação em apartamento para titular e dependentes)Convênio Odonto/OrtodônticoAmbulatório Médico no escritórioTelemedicina Dr. Alper (Einstein Conecta) ilimitado.Seguro de VidaDescontos em mais de 10 mil farmácias4 Sessões de psicoterapia por mêsLicença familiar estendida (Responsável 6 meses e corresponsável 30 dias)Auxílio Creche / BabáAcomPANha (programa de acompanhamento para gestantes)Wellhub/TotalpassAuxílio tecnologia assistivas (reembolso de 85% para colaboradores com deficiência)Programas de desenvolvimentoMassagem e AuriculoterapiaSalão de beleza no escritórioPAE (Orientação Jurídica, Financeira, Psicológica e Social)Portal de descontos em diversos segmentos (Allya)Campanha de vacinação (colaborador e dependente)Facilitação no financiamento de veículos (Mediante análise)Cartão de crédito PAN com limite diferenciado (Mediante análise)Vale Transporte (desconto de apenas 4%)Assistência FuneralAssim como todas as nossas vagas, essa também é destinada à diversidade e inclusão. Independentemente de qualquer fator, perfil ou característica,Expanda sua carreira no PAN!Para conhecer mais sobre nossos benefícios e cultura, acesse o Trabalhe Conosco:https://www.bancopan.com.br/trabalhe-conosco/Show moreShow less",N/A,On-site/Hybrid,https://www.linkedin.com/jobs-guest/jobs/api/jobPosting/4328719995,2026-01-16
Data Scientist I,Banco Bradesco,"Osasco, São Paulo, Brazil",3 days ago,"Sobre o BradescoO Bradesco é um dos maiores grupos financeiros do Brasil, com uma história marcada pelo pioneirismo e inovação. Por meio da nossa carteira amplamente diversificada de produtos financeiros, serviços bancários e de seguros contribuímos com a realização das pessoas e o crescimento sustentável de empresas e sociedade. Venha fazer parte do nosso ecossistema financeiro e impactar a experiência de milhões de pessoas!No Bradesco valorizamos a diversidade em todas as suas formas. Por isso, as nossas vagas são abertas a todas as pessoas, independentemente de gênero, raça, orientação sexual, deficiência, idade ou qualquer outra característica.Saiba mais em https://banco.bradesco/html/classic/sobre/index.shtmResponsabilidades e atribuiçõesO que é o nosso time de Avaliação Independente de Modelos (AVIM) ?Em se tratando de simplificações da realidade, os modelos são sujeitos a riscos, que podem desencadear perdas relacionadas a decisões baseadas em estimativas incorretas ou obsoletas ou, ainda, uso inapropriado. Para identificar e mitigar esses riscos, nós da Área de Avaliação Independente de Modelos (AVIM) atuamos efetivamente no fortalecimento do uso de modelos, realizando ações de aculturamento e disseminando as boas práticas em modelagemModelo de trabalho : Híbrido - 2x PresencialUnidade: Osasco - SPComo será seu dia a dia?Sendo Data Scientist I, atuará na gerência Governança e Metodologia e suas principais atividades serão:Atender às demandas de auditoria interna e externa, garantindo respostas consistentes e tempestivas, assim como garantir conformidade com regulações;Participar efetivamente das atividades e discussões de governança e metodologia de validação e gestão de risco de modelo;Apoiar na definição de estratégias e metodologias de validação e de risco de modelo;Propor inovações tecnológicas e novas práticas de mercado;Garantir consistência e homogeneidade nas atividades de validação e risco de modelo.Requisitos e QualificaçõesO que você precisa ter ou saber?Formação superior completa em Matemática, Física, Ciência Atuarial, Economia, Engenharia ou áreas correlatas;Conhecimento avançado em Excel e PowerPoint;Vivência na área de Auditoria;Vivência com Python;Vivência com SQL;Será um diferencial se você tiver:Mestrado ou MBA em Gestão de Riscos ou Ciência de Dados;Vivência com Databricks;Vivência com gestão e avaliação de riscos de modelos.O que nós oferecemosNo Bradesco valorizamos a saúde e bem-estar, oferecendo um extenso portfólio de benefícios a todas nossas pessoas funcionárias:PLR ou Bônus: Conforme a elegibilidade de cargo*Convênio MédicoConvênio OdontológicoSeguro de VidaVale AlimentaçãoVale Refeição13º Cesta AlimentaçãoTotal PassVale Transporte (adesão opcional)Descontos em produtos e serviços em empresas parceirasPrevidência Privada (adesão opcional, com participação financeira da Organização Bradesco)Viva Bem Bradesco: programa de saúde, bem-estar e qualidade de vidaUnibrad: Universidade Corporativa BradescoIsenção de Tarifas: condições especiais em diversos produtos e serviçosAuxílio Creche ou BabáLicença Paternidade estendida de 20 diasLicença Maternidade de 180 dias, acompanhamento assistencial da gestação até o pós-partoShow moreShow less",N/A,On-site/Hybrid,https://www.linkedin.com/jobs-guest/jobs/api/jobPosting/4361123286,2026-01-16
"Cientista de Dados (Brasil, Remoto)",Dell Technologies,"São Paulo, São Paulo, Brazil",1 week ago,"A área de Engenharia Centrada em IA é dinâmica e empolgante, fazendo parte do Escritório do CTO (OCTO) da Dell. Conduzimos pesquisas e engenharia voltadas para o futuro da Dell Technologies em um ambiente de alta visibilidade e colaboração intensa. Nossa equipe é especializada no desenvolvimento de soluções avançadas de IA que capacitam empresas a inovar, se comunicar e otimizar operações de maneiras nunca antes possíveis. Somos compostos por pessoas apaixonadas e dedicadas a ultrapassar os limites da tecnologia de IA.Junte-se a nós para realizar o melhor trabalho da sua carreira e causar um impacto social profundo comoCientista de Dadosem nossa equipe no Brasil (remoto).O que você conquistaráComoCientista de Dadosvocê será responsável por contribuir com a estratégia de negócios e influenciar a tomada de decisões com base em informações obtidas por meio de análises aprofundadas. Você produzirá recomendações acionáveis e envolventes ao interpretar insights de conjuntos de dados complexos. Também irá projetar processos para consolidar e examinar dados não estruturados, gerando insights relevantes. Além disso, colaborará com líderes de negócios, engenheiros e especialistas da indústria para construir modelos preditivos, algoritmos e motores de probabilidade.Você IráColaborar com equipes internas e externas para entender os requisitos dos clientes e desenvolver soluções personalizadas utilizando modelos de IA generativa;Desenvolver aplicações de IA utilizadas em diferentes áreas da Dell, com o objetivo de transformar e modernizar a empresa;Desenvolver e conduzir testes para avaliar a eficácia de algoritmos em diferentes casos analíticos;Manter-se atualizado com os avanços mais recentes em pesquisa de IA e aplicar técnicas de ponta para aprimorar o desempenho dos modelos;Realizar testes rigorosos, validação e avaliação de desempenho das soluções de IA.Dê o primeiro passo em direção à carreira dos seus sonhosCada Membro Da Equipe Da Dell Technologies Traz Algo Único Para a Mesa. Aqui Está o Que Estamos Procurando, Com Esta FunçãoRequisitos EssenciaisFormação acadêmica: Graduação completa em Ciência da Computação, Engenharia (Computação, Software, Elétrica, Controle e Automação), Estatística, Matemática, Física ou áreas correlatas. Pós-graduação stricto sensu (Mestrado ou Doutorado) em áreas relacionadas à Inteligência Artificial, Aprendizado de Máquina ou Ciência de Dados;Domínio avançado do inglês, necessário para interação constante com times internacionais;Sólidas habilidades de programação em Python;Compreensão dos conceitos de Aprendizado de Máquina (Machine Learning);Conhecimento e familiaridade com os conceitos fundamentais de design e análise de algoritmos, além de forte conhecimento em matemática e estatística.Requisitos DesejáveisCompreensão sólida de arquiteturas de Deep Learning, com experiência em ajuste fino e personalização de modelos pré-treinados para aplicações específicas. Proficiência em Python e nas bibliotecas/frameworks relevantes (ex.: TensorFlow, PyTorch);Experiência com modelos de linguagem de grande escala e familiaridade com técnicas e aplicações de processamento de linguagem natural (PLN).Quem somosAcreditamos que cada pessoa tem o poder de gerar impacto. É por isso que colocamos as pessoas da nossa equipe no centro de tudo o que fazemos. Se você está procurando uma oportunidade de desenvolver a sua carreira em um ambiente de trabalho inclusivo e diverso, com a tecnologia mais avançada do setor, estamos procurando por você.A Dell Technologies é uma família única de empresas que ajuda pessoas e organizações a transformar a forma como trabalham, vivem e se divertem. Junte-se a nós para construir um futuro que funcione para todas as pessoas, porque o progresso precisa de nós.A Dell Technologies está comprometida com o princípio de oportunidades iguais de emprego para todas as pessoas, e em fornecer às pessoas da equipe um ambiente de trabalho livre de discriminação e assédio. Leia a nossa Política de Oportunidades de Emprego aqui.Job ID:R283866Show moreShow less",N/A,On-site/Hybrid,https://www.linkedin.com/jobs-guest/jobs/api/jobPosting/4344395115,2026-01-16
Data Scientist,DoorDash,"São Paulo, São Paulo, Brazil",3 days ago,"About The TeamThe Analytics team is looking for experienced Data Scientists to guide measurement, strategy, and tactical decision-making across the company across a variety of teams and levels. Data Scientists at DoorDash work to uncover insights and turn them into relevant recommendations, driving decisions for the entire organization. Analytics is integral to all operational areas at DoorDash.Please apply here for all non-managerial levels within the following analytics teams:Consumer & GrowthBusiness OperationsDasher & LogisticsCustomer Experience & IntegrityMerchant, Ads & SalesNew VerticalsInternational Data ScienceAbout The RoleAs a Data Scientist at DoorDash, you'll use your quantitative background to mentor other scientists and dive into large datasets to guide decision-making. We solve a multitude of exciting challenges including customer acquisition, fraud and support, marketing, balancing supply and demand, new city launches, marketplace efficiency, and more. If you enjoy finding patterns amidst chaos, and have experience using analytics to affect revenue, growth, operations or beyond, we're looking for someone like you!You're Excited About This Opportunity Because You Will…Use quantitative analysis and the presentation of data to see beyond the numbers and understand what drives our businessBuild full-cycle analytics experiments, reports, and dashboards using SQL, R, Python, or other scripting and statistical toolsWork with and mentor junior analysts on how to use more advanced methods and solve challengesProduce recommendations and use statistical techniques and hypothesis testing to validate your findingsProvide insights to help business and product leaders understand marketplace dynamics, user behaviors, and long-term trendsIdentify and measure levers to help move essential metrics and make recommendationsWork backwards from understanding and sizing problems to ideating solutionsReport against our goals by identifying essential metrics and building executive-facing dashboards to track progressCollaborate with engineering to implement, document, validate, and monitor our loggingWe're Excited About You Because You Have…A degree in Math, Physics, Statistics, Economics, Computer Science, or a similar domain2+ years of experience in data analytics, consulting, or related roleExperience working with funnel optimization, user segmentation, cohort analyses, time series analyses, regression models, etcExpertise of SQL queries, ETL, A/B Testing, and statistical analysis (e.g. hypothesis testing, experimentation, regressions) with statistical packages, such as Matlab, R, SAS or PythonProficiency in one or more analytics & visualization tools (e.g. Chartio, Looker, Tableau)The insight to take ambiguous problems and solve them in a structured, hypothesis-driven, data-supported wayAre able to work in our office in São Paulo, BrazilNotice to Applicants for Jobs Located in NYC or Remote Jobs Associated With Office in NYC OnlyWe use Covey as part of our hiring and/or promotional process for jobs in NYC and certain features may qualify it as an AEDT in NYC. As part of the hiring and/or promotion process, we provide Covey with job requirements and candidate submitted applications. We began using Covey Scout for Inbound from August 21, 2023, through December 21, 2023, and resumed using Covey Scout for Inbound again on June 29, 2024.The Covey tool has been reviewed by an independent auditor. Results of the audit may be viewed here: CoveyAbout DoorDashAt DoorDash, our mission to empower local economies shapes how our team members move quickly, learn, and reiterate in order to make impactful decisions that display empathy for our range of users—from Dashers to merchant partners to consumers. We are a technology and logistics company that started with door-to-door delivery, and we are looking for team members who can help us go from a company that is known for delivering food to a company that people turn to for any and all goods.DoorDash is growing rapidly and changing constantly, which gives our team members the opportunity to share their unique perspectives, solve new challenges, and own their careers. We're committed to supporting employees’ happiness, healthiness, and overall well-being by providing comprehensive benefits and perks.Our Commitment to Diversity and InclusionWe’re committed to growing and empowering a more inclusive community within our company, industry, and cities. That’s why we hire and cultivate diverse teams of people from all backgrounds, experiences, and perspectives. We believe that true innovation happens when everyone has room at the table and the tools, resources, and opportunity to excel.If you need any accommodations, please inform your recruiting contact upon initial connection.We use Covey as part of our hiring and/or promotional process for jobs in certain locations.The Covey tool has been reviewed by an independent auditor. Results of the audit may be viewed here:https://getcovey.com/nyc-local-law-144To request a reasonable accommodation under applicable law or alternate selection process, please inform your recruiting contact upon initial connection.Show moreShow less",N/A,Remote,https://www.linkedin.com/jobs-guest/jobs/api/jobPosting/4354742212,2026-01-16
Oportunidades de Carreira: Cientista Dados - Projetos de IA - Externas Morumbi (1306691),Einstein Hospital Israelita,"São Paulo, São Paulo, Brazil",3 days ago,"Com 70 anos de existência, o Einstein Hospital Israelita ainda mantém uma premissa: inovar e crescer, sempre com excelência. Ajudamos a salvar vidas, difundir o conhecimento em educação, prevenção e inovação em saúde. Além da atuação em setores assistenciais, temos oportunidades na área de Inovação, Tecnologia, Pesquisa, Ensino, entre outras. Seguimos oferecendo qualidade, afirmando nosso compromisso com a Responsabilidade Social e com o propósito de levar uma gota de Einstein para cada cidadão. Valorizamos a diversidade e inclusão de todos os talentos e buscamos profissionais que compartilhem deste mesmo propósito!Informações da vagaUnidade de Trabalho: Externas MorumbiSetor: Projetos de IAHorário: 08:00-17:00(8H/D) 2ª/6ª 200 HORAS/MÊSModelo de trabalho: Home Office (Híbrido)Tipo de contrato: CLT prazo indeterminadoResponsabilidadesTratar, transformar e organizar dados (estruturados, semi-estruturados ou não-estruturados), com uso de habilidades em matemática, estatística, programação, machine learning e outros, aplicando suas capacidades analíticas para identificar soluções para os problemas de negócios e contribuir na tomada de decisões e estratégias da sociedade;Explorar e analisar dados para determinar tendências e ou oportunidades para gerar valor ao negócio;Desenvolver novos algoritmos e/ou adaptar algoritmos do estado da arte para resolver problemas e criar ferramentas e soluções;Conectar soluções internas para produtos de uso externo;Comunicar de maneira clara previsões e resultados para as áreas demandantes, através de visualizações de dados eficazes e storytelling, adotando gráficos, tabelas, relatórios e, principalmente, narrativas para apresentar conclusões de um projeto de análise de dados para um público não técnico;Utilizar os dados de forma ética e de acordo com as políticas de segurança da informação da instituição e da lei geral de proteção de dados;Atuar como referência técnica de seu grupo de trabalho, direcionando e acompanhando as atividades.RequisitosFormação Superior Completa;Experiência em projetos utilizando Machine Learning e Deep learning;Conhecimento de Modelagem para predição e simulação de dados;Conhecimento de métodos para simulação de cenários de múltiplas variáveis (especialmente o método de Monte Carlo );Experiência com projetos de IA Generativa;Experiência em tópicos de Engenharia de prompt, LLM Agents, RAG, LangChain e AWS Bedrock;Experiências com projetos de IA e protótipos orientado a produtos;Conhecimento de conceitos de gestão de projetos (metodologia ágil, scrum, PMBOK, entre outros);Nível de inglês avançado.Desejável/DiferencialConhecimento do método Monte-Carlo Markov Chain;Experiência com modelos de cálculo de risco;Conhecimento em MLOps;Mestrado/Doutorado em ciência de dados/IA;Conhecimento em Cloud (AWS e ou Databrics);Experiência em gestão de produtos digitais;Conhecimento de R.CompetênciasComunicação (oral e escrita) assertiva;Capacidade de trabalhar em equipe, bom relacionamento interpessoal e comprometido com as metas e valores da sociedade;Visão sistêmica;Resiliência;Capacidade em conectar tendência de mercado com soluções internas;Análise de Dados com foco em Produto;Proatividade;Cultura de incentivar e dar feedback;Liderança.Einstein Benefícios – Compartilhando Bem-EstarCuidados com a saúde: Programa Cuidar com serviços realizados no Einstein para promover a saúde e bem-estar dos colaboradores e dependentes, Clínicas Einstein, Telemedicina, Convênio Farmácia, Convênio Médico, Assistência Odontológica e Consultório Dental in Company.Bem-Estar: Wellhub (Gympass), TotalPass, Coral, Programa de Orientação Pessoal e SESC.Para você e sua família: Licença paternidade estendida, Seguro de Vida, Creche ou Auxílio Creche para mães ou pais com guarda legal, Auxílio para Filhos com Deficiência e Previdência Privada com taxa zero.Alimentação: Vale Alimentação, Vale Refeição ou Refeitório no local de trabalho.Mobilidade: Vale Transporte, Fretado, Estacionamento, Aplicativo de Caronas e Circular Metrô.Clube de Benefícios: Para economizar e obter vantagens nas compras de produtos e serviços de diversas categorias, como Beleza e Fitness, Comer e Beber, Compras, Cultura e Lazer, Educação Ensino Einstein, Turismo e muito mais.Programa Mais Conectados: Trabalho remoto nas modalidades Teletrabalho ou Híbrido conforme atividade e área de atuação.Os benefícios podem sofrer alteração de acordo com a convenção coletiva, unidade de trabalho e políticas vigentes.Show moreShow less",N/A,On-site/Hybrid,https://www.linkedin.com/jobs-guest/jobs/api/jobPosting/4351819764,2026-01-16
Cientista de Dados Sr. - (Atuação na Mobiauto),Banco PAN,"São Paulo, São Paulo, Brazil",1 week ago,"Somos oPANÁgeis, flexíveis e criativos, exploramos possibilidades com disposição e desejo de fazer acontecer. Sempre prontos para encarar novos desafios, nutrimos líderes que, além de ter garra, são abertos e empáticos, veem na proximidade das relações, o elo entre cada um.Nossa missão, se faz cumprida quando transformamos a vida dos outros através dos nossos conhecimentos. Nossos pilares de cultura, reforçam nossa postura idealizadora e com desejo de fazer acontecer:Trabalho em equipe, Transparência , Excelência e Eficiência com profundidade.Dominamos nossos processos e trazemos melhorias para quem deseja ter umavida financeira mais inteligente.Essa oportunidade é para atuar na equipe da Mobiauto uma empresa do Grupo PAN.Aárea de Dadosé responsável por prover acesso aos dados através de uma plataforma confiável, acessível e escalável para as áreas de negócio e produto. Somos também responsáveis por desenvolver e criar novos produtos de dados para atender o cliente final com novas tecnologias e inteligências artificiais generativas. Nosso objetivo é ajudar a empresa a usar os dados com inteligência e agilidade.Principais desafios:Desenvolvimento de produtos de dados com uso de IA generativa (modelos LLMs), desde definição e refinamento do problema até a implementação final do projeto;Analises de dados mais complexas ajudando a empresa com insights relevantes para tomada de decisão;Modelagem de dados refinando dados, regras de negócio e definindo métodos de uso eficientes.Quais as principais competências para a posição?Ensino Superior Completo exatas e preferencialmente em TI, como: Sistema da Informação, Ciência da Computação, Engenheira da Computação e Estatística.Ter experiência consolidada em ciência de dados com projetos tradicionais de ciência de dados (Machine Learning e modelos estatísticos) e/ou uso de IA generativa (modelos LLMs);Desejável conhecimento em ferramentas do GCP (Google Cloud Platform), como: VertexAI, Gemini, BigQuery, Cloud SQL (PostgreSQL e/ou MySQL), Cloud Storage, Cloud Function, Cloud Data Fusion, Cloud Dataflow, Cloud Dataproc, Looker/Looker Studio e outras;Desejável conhecimento em ferramentas open source, como: MLFlow, AirFlow, DBT, Delta/Iceberg, Apache Superset, Metabase e outras;Solido conhecimento nas linguagens Python, Spark (PySpark) e SQL;Solida experiencia com programação e lógica de programação;Solida experiencia em modelagem de dados para produtos de dados, analises e dados refinados;Desejável conhecimento e vivência em ferramentas de versionamento como GitHub, GitLab e/ou outras;Desejável conhecimento de arquitetura de dados e plataforma de dados com conceitos e métodos de DataLake, Data Mesh e arquitetura Data Lakehouse;Vivência em projetos ágeis e desenvolvimento produtos de dados.Modelo de atuação: Home-Office.Benefícios do Mobiauto:Vale Refeição e Vale AlimentaçãoVale Transporte;Participação nos Lucros e Resultados (PPR) com base em avaliação de desempenho;Convênio médico com plano apartamento (sem desconto mensal + coparticipação);Inclusão de dependentes no convênio médico, sem custo adicional;Plano odontológico sem desconto mensal;Desconto de 35% em escola de idiomas;Empréstimo consignado;Acesso ao GymPass para benefícios em academias e atividades físicas;Day Off no aniversário para celebrar seu dia com liberdade;Parceria exclusiva com o SESC para programas culturais e de lazer;Desconto especial na locação de veículos com a Movida;Seguro de Vida para maior segurança e tranquilidade.Assim como todas as nossas vagas, essa também é destinada à diversidade e inclusão. Independentemente de qualquer fator, perfil ou característica,Expanda sua carreira no PAN!Para conhecer mais sobre nossos benefícios e cultura, acesse o Trabalhe Conosco:https://www.bancopan.com.br/trabalhe-conosco/Show moreShow less",N/A,On-site/Hybrid,https://www.linkedin.com/jobs-guest/jobs/api/jobPosting/4292801863,2026-01-16
