title,company,location,posted,description,applicants,work_mode,link,data_coleta
Especialista Cientista de Dados,Serasa Experian,"São Paulo, São Paulo, Brazil",2 weeks ago,"Company DescriptionA Serasa Experian é a primeira e a maior Datatech do Brasil. Líder em soluções de inteligência para análise de riscos e oportunidades, com foco nas jornadas de crédito, autenticação e prevenção à fraude. Com tecnologia de ponta, inovação e os melhores talentos, transforma a incerteza do risco na melhor decisão, ajudando pessoas a realizarem seus sonhos e empresas de todos os portes e segmentos a prosperarem.Temos 22.000 pessoas operando em 32 países e a cada dia estamos investindo em novas tecnologias, profissionais talentosos e inovação para ajudar todos os clientes a maximizarem cada oportunidade. Com sede corporativa em Dublin, Irlanda, a Experian está listada na Bolsa de Valores de Londres (EXPN) e compõe o índice FTSE 100.Job DescriptionO DataLab é a unidade de pesquisa e inovação do grupo Experian na América Latina junto com a Serasa Experian no Brasil. Temos o objetivo de ser propositivo, antecipando o futuro, e consultivo, identificando oportunidades de evolução no mercado, por meio de técnicas de Inteligência Artificial e Machine Learning combinada com uso de novas fontes de dados.Criamos soluções inovadoras avançadas, que ajudam clientes e mercado a se prepararem hoje para o amanhã de decisões mais assertivas. Além de termos um olhar 360º para trocar com o que há de melhor no âmbito global, considerando o todo e produzindo soluções capazes de alcançar grande escalabilidade.Como Especialista em Ciência de Dados, você terá um papel central no time, utilizando sua experiência e conhecimentos em Machine Learning, GenAI, programação, tratamento e análise de dados para liderar tecnicamente projetos junto aos times de engenharia e negócios.Principais ResponsabilidadesPropor e implementar análises de dados avançadas e modelos de Machine Learning;Manipular eficientemente grandes volumes de dados;Colaborar com times de Engenharia de Dados, Engenharia de Software, Produtos e Negócios para entender as necessidades, sugerir soluções orientadas a dados e influenciar positivamente o rumo dos projetos;Explorar continuamente novas fontes de dados e novidades técnicas;Manter-se atualizado com as últimas pesquisas e avanços em GenAI e Machine Learning.Apresentar os resultados e recomendações para stakeholders e times executivos;Desenhar roadmaps de desenvolvimento de produtos data-driven em concordância com as necessidades de negócio;Conduzir experimentos e testes de forma ágil visando decisões conclusivas.O Que Estamos BuscandoBacharelado em Ciência de Dados, Estatística, Ciência da Computação, Engenharia, Física ou cursos relacionados;Sólidos conhecimentos em Python, principalmente em manipulação de dados, bibliotecas de análise (ex. Pandas, Numpy) e frameworks de Machine Learning (ex. scikit-learn, TensorFlow);Experiência na manipulação de grandes bases de dados, em especial armazenadas em ambiente Hadoop (HDFS), processamento distribuído de dados (PySpark) e linguagem SQL;Experiência em desenvolver e implantar modelos de Machine Learning, com bons conhecimentos em validação, tuning e monitoramento de modelos;Experiência em versionamento de código;Habilidade para o entendimento e a resolução de problemas de negócios de forma versátil e ágil;Habilidade de comunicação com pares, áreas parceiras e executivos, incluindo apresentações e tradução de insights em ações de negócios;Colaboração e trabalho em equipe;Aprendizado constante;Inglês avançado;Disponibilidade para atuação híbrida (2x na semana) em São Paulo/SP (Chácara Santo Antônio).DiferenciaisMestrado ou doutorado em alguma das áreas correlatas;Conhecimento e experiência com processamento de grafos e redes complexas;Conhecimento de frameworks de GenAI como LangChain, LangGraph, Agno ou equivalentes;Atuação prévia em produtos corporativos baseados em LLMs, RAG, MCP e sistemas multiagentes.QualificationsData sciencePythonCodingBig dataAIStatisticsAdditional InformationA Serasa Experian é muito mais do que você imagina. Com o propósito de criar um futuro melhor, ampliando oportunidades para pessoas e empresas, no Brasil somos mais de 4 mil pessoas que atuam em diversos times e especialidades. Aqui, cada conhecimento e diversidade se complementa e você pode trabalhar no que mais ama, estamos comprometidos a construir uma cultura inclusiva e um ambiente no qual pessoas possam equilibrar a carreira com seus compromissos e interesses pessoais, prezando pelo bem-estar.A gente se dedica muito em ser uma das melhores e mais inovadoras empresas para se trabalhar do país, possibilitando experiências e carreiras incríveis para nossas pessoas. Nossa forte abordagem de pessoas em primeiro lugar é reconhecida externamente por meio de diversas certificações de mercado: fomos premiados pelo Great Place To Work™ em 24 países e pela certificação internacional Top Employers, além de sermos reconhecidos como uma das melhores empresas para jovens profissionais e contarmos com uma avaliação de 4,6 no Glassdoor. Cada reconhecimento nos indica que estamos no caminho certo, proporcionando um ambiente de trabalho cada vez melhor para nossos talentos.Experian Careers - Creating a better tomorrow togetherFind out what its like to work for Experian by clicking hereShow moreShow less",N/A,On-site/Hybrid,https://www.linkedin.com/jobs-guest/jobs/api/jobPosting/4367331072,2026-03-10
CIENTISTA DE DADOS PL,Marketdata,"São Paulo, São Paulo, Brazil",2 weeks ago,"AMarketdata&Matché a união de duas líderes em Customer Experience e Marketing Automation, formando uma das maiores potências do setor na América Latina. Atuamos com excelência em dados, tecnologia e marketing, implementando e operando plataformas como Salesforce Marketing Cloud. Unimos inteligência analítica, personalização e performance para impulsionar estratégias de CRM e Customer Experience.Integramos uma equipe multidisciplinar e uma metodologia orientada a resultados, entregando soluções que fortalecem o relacionamento entre marcas e consumidores e promovem experiências relevantes, mensuráveis e escaláveis. Somos reconhecidos comoParceira do Ano no ecossistema Salesforce, e integramos o maior hub de Martech e CX da América Latina, entregando excelência em toda a jornada de consumo.Aqui, dados não são apenas números — são direcionamento estratégico. Você vai conectar dados ao negócio e transformar informação em decisões concretas. Seu papel será provocar discussões, estruturar hipóteses, desenvolver análises profundas e criar modelos preditivos que realmente impactem resultados. Mais do que gerar relatórios, você irá interpretar cenários, identificar oportunidades, mensurar campanhas com rigor e construir sistemas de acompanhamento que elevem o nível das decisões.Se você gosta de questionar, investigar, modelar e influenciar com dados — esse desafio é para você.Desafios e AtividadesElo Analítico: Atuar como o braço de inteligência da squad, contribuindo com a geração de insights para orientar os trabalhos.Planejamento Estratégico: Discutir demandas com a gestão e participar ativamente no planejamento das atividades de Analytics que alimentam a squad.Modelagem e Investigação: Desenvolver análises de dados, estudos investigativos e modelos preditivos, aplicando senso crítico apurado aos resultados obtidos.Visão de Negócio: Interpretar os resultados das análises sob a perspectiva estratégica e gerar relatórios, dashboards e materiais executivos de alto impacto.Mensuração: Criar sistemas de acompanhamento de resultados e métodos robustos para mensuração de campanhas.Governança: Manter uma documentação organizada de todas as etapas de trabalho durante a elaboração das análises e modelos.Para Assumir Esse Desafio, Você Precisa TerEstatística e Modelagem: Experiência sólida em modelagem estatística, com foco em segmentação e modelos de propensão.Conhecimento de Marketing: Familiaridade com métodos de mensuração de campanhas e métricas de performance.Programação: Domínio de R ou Python para execução e automação de modelos.Manipulação de Dados: SQL Avançado para extração e tratamento de grandes volumes de informação.Idiomas: Fluência em inglês (essencial para colaboração e documentação).Ferramentas de Apoio: Domínio de Excel e PowerPoint para análises rápidas e apresentações executivas.Formato De AtuaçãoModelo híbrido, com atuação presencial média de 2x por semana na região da Vila Leopoldina (São Paulo).Como atuamos diretamente com diferentes clientes, pode haver necessidade de presença adicional de acordo com o projeto ou demanda. Buscamos profissionais com flexibilidade.O Que OferecemosAuxílio Educacional (inglês, espanhol, graduação e pós-graduação)Plataforma exclusiva de IA + Academia própria de formação em Inteligência ArtificialMarketdata Academy (Treinamentos mensais à disposição dos colaboradores)Parcerias com diversas instituições de ensinoPLR e Happy Day (day off no dia do aniversário)Assistência Médica e OdontológicaAuxílio home office*Programa interno de orientação psicológica, financeira e jurídicaTotalPass e Ginástica LaboralVale Refeição e/ou Alimentação (inclusive no mês das férias)Vale Transporte (opcional)Seguro de Vida e Banco de HorasLicença Maternidade/Paternidade Estendidos e Auxílio CrecheConvênio com CinemarkNa VML, estamos comprometidos em promover um ambiente de trabalho totalmente inclusivo que seja gratificante e que impulsione a carreira. Acreditamos na criação de um ambiente de trabalho dinâmico que valorize a diversidade e a inclusão e nos esforçamos para recrutar uma lista diversificada de candidatos para nos ajudar a atingir esse objetivo. Teremos o prazer de fornecer adaptações razoáveis a pessoas com deficiência que precisem de uma adaptação para usar ou acessar o site de carreiras da VML ou para participar plenamente do processo de candidatura. Caso necessite de uma adaptação para concluir a sua candidatura ou outro aspeto do nosso processo de recrutamento devido a uma deficiência, entre em contato com o nosso departamento de Recursos Humanos ou envie um e-mail para (contato de RH) para solicitar uma adaptação.Ao clicar em ""Enviar Candidatura"", as informações que você inserir abaixo serão encaminhadas para a VML. Recomendamos que, antes de prosseguir, você consulte a nossa Política de Privacidade de Recrutamento. Residentes da Califórnia devem consultar o nosso Aviso de Privacidade de Recrutamento da Califórnia. Nestes documentos, explicamos como tratamos os seus dados pessoais no âmbito do processo de candidatura, bem como a forma como poderá atualizar ou remover as informações que nos forneceu.Show moreShow less",N/A,On-site/Hybrid,https://www.linkedin.com/jobs-guest/jobs/api/jobPosting/4376590932,2026-03-10
"Data Scientist, Brazil - BCG X",BCG X,"São Paulo, São Paulo, Brazil",2 weeks ago,"Who We AreBoston Consulting Group partners with leaders in business and society to tackle their most important challenges and capture their greatest opportunities. BCG was the pioneer in business strategy when it was founded in 1963. Today, we help clients with total transformation-inspiring complex change, enabling organizations to grow, building competitive advantage, and driving bottom-line impact.To succeed, organizations must blend digital and human capabilities. Our diverse, global teams bring deep industry and functional expertise and a range of perspectives to spark change. BCG delivers solutions through leading-edge management consulting along with technology and design, corporate and digital ventures—and business purpose. We work in a uniquely collaborative model across the firm and throughout all levels of the client organization, generating results that allow our clients to thrive.We Are BCG XWe’re a diverse team of more than 3,000 tech experts united by a drive to make a difference. Working across industries and disciplines, we combine our experience and expertise to tackle the biggest challenges faced by society today. We go beyond what was once thought possible, creating new and innovative solutions to the world’s most complex problems. Leveraging BCG’s global network and partnerships with leading organizations, BCG X provides a stable ecosystem for talent to build game-changing businesses, products, and services from the ground up, all while growing their career. Together, we strive to create solutions that will positively impact the lives of millions.What You'll DoOur BCG X teams own the full analytics value-chain end to end: framing new business challenges, designing innovative algorithms, implementing, and deploying scalable solutions, and enabling colleagues and clients to fully embrace AI. Our product offerings span from fully custom-builds to industry specific leading edge AI software solutions.As aData Scientist, you'll be part of our rapidly growing team. You'll have the chance to apply data science methods and analytics to real-world business situations across a variety of industries to drive significant business impact. You'll have the chance to partner with clients in a variety of BCG regions and industries, and on key topics like climate change, enabling them to design, build, and deploy new and innovative solutions.Additional responsibilities will include developing and delivering thought leadership in scientific communities and papers as well as leading conferences on behalf of BCG X. Successful candidates are intellectually curious builders who are biased toward action, scrappy, and communicative.What You'll BringWe Are Looking For Talented Individuals With a Passion For Data Science, Statistics, Operations Research And Transforming Organizations Into AI Led Innovative Companies. Successful Candidates Possess The FollowingBachelor’s, Master's or Advanced degree with excellent academic achievements in a field linked to computer science, applied mathematics, statistics, machine learning, or related data centric areasRelevant internships or post-college industry or consulting experienceComfortable in a client-facing role with the ambition to lead teamsLikes to distill complex results or processes into simple, clear visualizationsExplain sophisticated data science concepts in an understandable mannerLove building things and are comfortable working with modern development tools and writing code collaboratively (bonus points if you have a software development or DevOps experience)Significant experience applying advanced analytics to a variety of business situations and a proven ability to synthesize complex dataDeep understanding of modern machine learning techniques and their mathematical underpinnings, and can translate this into business implications for our clientsHave strong project management skillsTechnologiesProgramming Languages: PythonAdditional info#BCGXjobBoston Consulting Group is an Equal Opportunity Employer. All qualified applicants will receive consideration for employment without regard to race, color, age, religion, sex, sexual orientation, gender identity / expression, national origin, disability, protected veteran status, or any other characteristic protected under national, provincial, or local law, where applicable, and those with criminal histories will be considered in a manner consistent with applicable state and local laws.BCG is an E - Verify Employer. Click here  for more information on E-Verify.Show moreShow less",N/A,On-site/Hybrid,https://www.linkedin.com/jobs-guest/jobs/api/jobPosting/4328172184,2026-03-10
User Insights Specialist,Keeta,"São Paulo, São Paulo, Brazil",1 week ago,"Role OverviewTheUser Insights Specialistwill be responsible for analyzing user behavior, identifying experience gaps, and generating insights that inform product, operations, and growth strategies.This role combinesdata analytics, user research, and business understanding, requiring strong SQL capabilities and the ability to communicate insights effectively to cross-functional stakeholders.This position requiresfull on-site presence (5 days per week)to enable close collaboration with Product, Operations, and Business teams.Key ResponsibilitiesUser Insights & AnalysisAnalyze user behavior, engagement trends, and operational data to identify opportunities to improve user experience and retention.Translate complex datasets into actionable insights supporting product and business decision-making.Monitor key user metrics and proactively identify risks, friction points, and growth opportunities.Data Analysis & ReportingExtract, manipulate, and analyze large datasets usingSQL.Build dashboards, recurring reports, and insight frameworks to track user experience performance.Partner with Data, Product, and Operations teams to define and monitor KPIs related to user satisfaction and platform performance.User Research & Feedback IntegrationConsolidate quantitative data with qualitative user feedback (surveys, interviews, support data, NPS).Identify root causes behind user pain points and behavioral patterns.Support experimentation initiatives by measuring impact and validating hypotheses.Cross-Functional CollaborationWork closely with Product Managers, Operations, Customer Experience, and Growth teams to influence strategic decisions.Present insights clearly to both technical and non-technical stakeholders.Drive a data-informed culture by promoting user-centric decision-making.QualificationsBachelor’s degree in Business, Data Analytics, Economics, Statistics, or related field.Strong proficiency inSQLfor data extraction and analysis.Professional fluency inEnglish and Portuguese(written and spoken).Experience working with data analytics, user insights, product analytics, or business intelligence.Strong analytical thinking and problem-solving skills.Ability to translate data into clear business recommendations.Willingness to workon-site in the office 5 days per week.Show moreShow less",N/A,On-site/Hybrid,https://www.linkedin.com/jobs-guest/jobs/api/jobPosting/4378858333,2026-03-10
Cientista de Dados - Pleno,EY,"São Paulo, São Paulo, Brazil",4 days ago,"Cientista (a) de Dados PlenoNa EY, estamos comprometidos em moldar seu futuro com confiança.Nós ajudaremos você a ter sucesso em um ambiente globalmente conectado, repleto de equipes diversas, e a levar sua carreira para onde você desejar.Venha para EY e ajude-nos a construir um mundo de negócios melhor.Sobre a oportunidade:Se você é apaixonado/a por dados, tecnologia e inovação, esta é a sua chance de atuar em projetos desafiadores, colaborando com profissionais de diferentes áreas e contribuindo para a transformação digital do setor financeiro. Na EY, você terá a oportunidade de aplicar suas habilidades técnicas em ambientes dinâmicos, impulsionando soluções de alto impacto e desenvolvendo sua carreira em um contexto global e inclusivo.Você assumirá as seguintes responsabilidades:Colaborar em equipes multidisciplinares, comunicando-se de forma eficaz para atingir objetivos comuns. Atuar na resolução de problemas complexos, desenvolvendo soluções criativas e inovadoras. Utilizar pensamento crítico para analisar dados, identificar padrões e tomar decisões baseadas em evidências. Buscar aprendizado contínuo, adaptando-se a novas tecnologias e tendências para aprimorar suas habilidades e contribuir para o sucesso dos projetos.Requisitos e habilidades que buscamos:Superior completo ou em andamento nas áreas de Informática, Matemática, Estatística, Economia, Administração, Engenharias ou áreas correlatas;Experiência avançada em Python, especialmente para aplicações de IA;Experiência com pipelines de dados, ETL, Apache NiFi, Apache Kafka;Conhecimentos dos principais frameworks de modelagem;Experiência com desenvolvimento de Machine Learning;Experiência preferencialmente em empresas do setor financeiro, como bancos e seguradoras, tecnologia, consultorias ou startups.Diferenciais: Certificações em Data Science (ex: IBM Data Science, AWS Certified Machine Learning, Google Professional Data Engineer);Inglês é um diferencialAcesse go.ey.com/beneficios e conheça nosso universo debenefícios.O que oferecemos:Na EY, você se desenvolve com habilidades voltadas para o futuro e se abastece de experiências de classe mundial. Nós capacitaremos você em um ambiente flexível e potencializaremos seus talentos extraordinários em uma cultura diversa e inclusiva, com equipes globalmente conectadas.Pelo 4º ano consecutivo, a EY está na lista do Great Place to Work como uma das melhores empresa para se trabalhar, com destaque para as categorias de diversidade. Você poderá fazer parte de nossos programas e grupos que, juntos a inúmeras iniciativas internas, apoiam nossa constante busca pela equidade.Você gostaria de moldar seu futuro com confiança? Inscreva-se hoje!Para ajudar a criar a melhor experiência durante o processo de recrutamento, por favor, descreva qualquer acessibilidade você possa precisar.Saiba mais sobre como é trabalhar na EY:Carreiras na EY LinkedIn @EY Instagram @eybrasilcarreirasShow moreShow less",N/A,On-site/Hybrid,https://www.linkedin.com/jobs-guest/jobs/api/jobPosting/4362570938,2026-03-10
Cientista de dados (área de Crédito),HUPDATA,"Barueri, São Paulo, Brazil",5 days ago,"Buscamos um(a) Cientista de Dados /Especialista em Modelagem de Crédito para atuar na área de Políticas de Crédito, desenvolvendo análises quantitativas e modelos estatísticos que suportem a definição e evolução das estratégias de concessão de crédito.O profissional será responsável por gerar insights, identificar oportunidades de melhoria nas políticas vigentes, desenvolver modelos estatísticos e preditivos para suporte à concessão de crédito e simular impactos de alterações nas políticas de crédito, apoiando decisões que equilibram crescimento, risco e rentabilidade.Esperamos alguém que vá além de análises descritivas, contribuindo com desenvolvimento de modelos, evolução das estratégias de risco baseadas em dados, simulações robustas para tomada de decisão e geração de insights que impactem diretamente a política de crédito.Principais ResponsabilidadesDesenvolver modelos estatísticos e preditivos aplicados a risco de créditoEvoluir modelos existentesRealizar análises sobre comportamento de carteiraDesenvolver simulações de impacto de alterações em políticas de créditoEstruturar bases analíticas para modelagemGerar insights sobre o comportamento da carteira de créditoIdentificar oportunidades de melhoria nas políticas e estratégias de concessãoConstruir dashboards analíticos para acompanhamento da performance de créditoTrabalhar em parceria com áreas de risco, negócio e tecnologiaRequisitos Técnicos ObrigatóriosExperiência em modelagem estatística aplicada a crédito ou riscoProgramação em PythonForte domínio de SQL para manipulação de grandes basesExperiência com bibliotecas de análise e modelagem (ex: pandas, scikit-learn, statsmodels)Conhecimento em técnicas de modelagem preditiva (regressão logística, árvores, boosting, etc.)Experiência com análise de comportamento de carteira (vintage, roll rate, cohort)Experiência com ferramentas de visualização (Power BI, Tableau ou similares)Conhecimentos desejáveis em risco de créditoModelagem de Probability of Default (PD)Scorecards de créditoEstratégias de cutoff e segmentaçãoLoss rate / NPLSimulação de políticas de créditoEstratégia de concessãoDiferenciaisExperiência em instituições financeiras, fintechs, bancos ou financeirasExperiência com desenvolvimento de credit scoringExperiência com machine learning aplicado a risco de créditoExperiência com motores de decisão de créditoExperiência com deploy de modelos ou MLOpsPerfil ComportamentalForte raciocínio analítico , curiosidade investigativa sobre dados, capacidade de traduzir modelos em insights de negócio, autonomia para conduzir análises complexas, comunicação clara de resultados técnicos para áreas de negócio.Formação Estatística/Matemática/Engenharia/Ciência de Dados/Ciência da ComputaçãoTrabalho híbrido, presencial 3 vezes por semana no cliente (região da Berrini e Barueri), sendo o primeiro mês 100% presencial.Remuneração a definir + benefíciosShow moreShow less",N/A,On-site/Hybrid,https://www.linkedin.com/jobs-guest/jobs/api/jobPosting/4381135795,2026-03-10
