title,company,location,posted,description,applicants,work_mode,link,data_coleta
Cientista de Dados Jr,KPMG Brazil,"São Paulo, São Paulo, Brazil",21 hours ago,"Aqui na KPMG:Fazemos o que é certo #IntegrityAprendemos e nos aprimoramos #ExcellencePensamos e agimos de maneira arrojada #CourageRespeitamos uns aos outros e nos e nos fortalecemos com nossas diferenças #TogetherFazemos o que realmente importa #For BetterResponsabilidades e atribuições:Caso seja aprovado(a), você terá a oportunidade de:Trabalhar com clientes para entender suas necessidades e identificar oportunidades de soluções de dados em diferentes plataformas e sistemas.Participar de todas as etapas dos projetos, desde o mapeamento até a implementação e disponibilização para os usuários finais.Desenvolver e implementar práticas de governança de dados, qualidade, segurança, compliance e controle de acesso.Projetar e implementar pipelines de dados robustos para ingestão, transformação e carga (ETL/ELT) de dados estruturados e não estruturados.Desenvolver e otimizar modelos de dados para data lakes, data warehouses e sistemas analíticos.Contribuir com análises exploratórias de dados e geração de insights relacionados à performance de produtos, comportamento de clientes e oportunidades de performance comercial.Apoiar na construção, atualização e manutenção de dashboards e relatórios gerenciais em Power BI, garantindo qualidade visual, clareza das informações e alinhamento com as necessidades das áreas de negócio.Auxiliar na elaboração de apresentações executivas em PowerPoint, estruturando análises, estudos e recomendações de forma clara e visualmente atrativa para stakeholders internos.Requisitos e qualificações:O que procuramos em você?Formação em Ciência da Computação, análise e desenvolvimento de sistemas e áreas afins.Bons conhecimentos em Python.Possuir experiência com SQL, PySpark e databricks.Desejável Power BI intermediárioDiferenciais:Experiência acadêmica ou prática com modelagem estatísticaConhecimento em técnicas de Machine Learning e Deep LearningConhecimento em técnicas de NLPConhecimento intermediário em PowerPointModelo de atuaçãoTrabalho híbrido em São Paulo, quantidade de dias presenciais varia de acordo com o projeto/cliente.Quais as vantagens de ser KPMG?Aqui atuamos com as mais novas tecnologias;Nossos profissionais são referência no mercado;Somos uma das maiores empresas de prestação de serviço do mundo;Quais benefícios oferecemos?Vale RefeiçãoVale AlimentaçãoAssistência MédicaAssistência OdontológicaVale TransporteBenefício Bem-estar (Academia)Convênio FarmáciaSeguro de VidaKPMG PrevAuxílio CrecheIncentivo a GraduaçãoIncentivo à IdiomasSubsídio de Órgão de ClasseBrinde CasamentoBrinde NascimentoLicença Maternidade estendidaJornada de Trabalho FlexívelMeu Tempo: até 6 dias inteiros por ano — ou 12 meios períodos — para você fazer uma pausa, cuidar de si e usar como quiser, quando precisar.PPLSobre a empresaA KPMG é uma organização global composta por firmas independentes que oferecem serviços profissionais para empresas, governos, startups, agências do setor público, organizações sem fins lucrativos e instituições dos mercados de capitais. Estamos presentes em 145 países e territórios, com mais de 236 mil sócios e profissionais atuando nas firmas-membro em todo o mundo. No Brasil, somos mais de 5.000 profissionais.Orientados pelo nosso propósito de inspirar a confiança e empoderar a mudança, a KPMG é uma organização de referência nos segmentos em que atua. Compartilhamos valores sólidos e atuamos de forma íntegra há mais de 100 anos, transformando pessoas e empresas e gerando impactos positivos que contribuem para mudanças sustentáveis em nossos clientes, governos e na sociedade civil.Prestamos serviços profissionais baseados em princípios éticos e de excelência. Somos divididos em práticas, sendo três delas voltadas ao atendimento de clientes e uma dedicada às operações, que sustentam nosso negócio.Inclusão e respeito à diversidade e equidade fazem parte do DNA da KPMG.Aqui valorizamos todas as pessoas, encorajando e empoderando os nossos profissionais para que se sintam parte das nossas conquistas.Independente da sua idade, gênero, raça, cor, credo, orientação, sexual, etnia, origem nacional ou deficiência, te convidamos a fazer a diferença.🏳️ 🌈 🏳️ ⚧️ ♿ ✊🏿 ✝️ 🕎Inspire Confidence. Empower Change.Aqui na KPMG:Fazemos o que é certo #IntegrityAprendemos e nos aprimoramos #ExcellencePensamos e agimos de maneira arrojada #CourageRespeitamos uns aos outros e nos e nos fortalecemos com nossas diferenças #TogetherFazemos o que realmente importa #For BetterConheça nossa estrutura:AuditAvaliamos e asseguramos as informações geradas por nossos clientes por meio de serviços de auditoria independente, com base em metodologias e tecnologias exclusivas. Dessa forma, contribuímos para a qualidade das informações utilizadas nas tomadas de decisão.AdvisoryApoiamos decisões estratégicas e o desenvolvimento de projetos em áreas como planejamento estratégico, ESG, fusões e aquisições, gestão de riscos e compliance, melhoria de performance financeira e operacional, transformação dos negócios, inovação e tecnologia — sempre com abordagens multidisciplinares.TaxAjudamos nossos clientes a cumprir as obrigações tributárias e a se prepararem para os desafios de seus negócios, aplicando nosso conhecimento e visão de longo prazo para apoiar decisões que gerem valor para as empresas e para a sociedade.OperationsGarantimos que todas as operações internas e externas funcionem com eficiência. Somos a espinha dorsal da organização, lidando com logística, planejamento e execução de projetos em todas as áreas de atuação. Nossa equipe de Operations trabalha incansavelmente para otimizar processos, implementar melhorias contínuas e garantir a excelência na entrega dos serviços.Venha fazer parte do time KPMG! Vem pra K!Show moreShow less",N/A,On-site/Hybrid,https://www.linkedin.com/jobs-guest/jobs/api/jobPosting/4427369651,2026-06-18
Cientista de Dados Jr.,PagBank,"São Paulo, São Paulo, Brazil",1 week ago,"Descrição da vagaQuando você pensa em carreira, o que vem à sua mente? Propósito? Colaboração? Ser protagonista para fazer a diferença? No PagBank temos tudo isso e muito mais. 💛Estamos em busca de pessoas que vistam a camisa com orgulho. Gente com vontade de facilitar a vida financeira das pessoas e impulsionar negócios!Tá a fim de uma carreira que rende mais?Confira essa oportunidade e #VemProPags!Responsabilidades e atribuiçõesDesenvolver modelos para otimização de processos de banking ou adquirência.Analisar grandes volumes de dados transacionais para identificar padrões, tendências e oportunidades de melhoria nos processos.Implementar algoritmos de segmentação de clientes e predição de comportamento para aumentar a eficiência e a personalização dos serviços oferecidos.Trabalhar em estreita colaboração com equipes de engenharia, produto e negócios para definir e implementar soluções de dados que atendam às necessidades do cliente e da empresa.Fornecer insights complexos de maneira clara e eficaz para stakeholders não técnicos, ajudando na tomada de decisões estratégicas.Requisitos e qualificaçõesSuperior completo ou em andamento em Ciências da Computação, Engenharia, Matemática, Estatística ou áreas relacionadas.Experiência com análise de grandes volumes de dados para a geração de insights para times de negócio.Experiência com ferramentas de análise de dados e programação como SQL, Python, R ou bibliotecas de machine learning (TensorFlow, PyTorch, Scikit-Learn, etc.).Habilidade para resolver problemas complexos de maneira criativa e inovadora.Conhecimento de processos de versionamento de código (Git, Github).Habilidade para traduzir dúvidas e necessidades dos times de negócios em requisitos para as análises.Olá, somos o PagBank!Talvez você nos conheça por maquininhas ou comerciais que ficam na memória, mas somos muito mais!Todos os dias desenvolvemos produtos e soluções inspiradas pelo nosso propósito: facilitar a vida financeira das pessoas e negócios.Trabalhamos para transformar a forma como as pessoas lidam com dinheiro abrindo novas possibilidades para alcançarem seus sonhos.Como fazemos tudo isso?💛Com genteSomos um time que joga junto! Aqui valorizamos todas as diversidades, seja de raça/etnia, gênero, idade, origem, pessoa com deficiência, orientação afetivo-sexual, constituição familiar e estética.💛Com tecnologiaO espírito disruptivo e inovador está no nosso DNA: somos parte do Grupo UOL, empresa 100% brasileira, foi pioneira na internet e transforma a vida das pessoas desde 1996.💛Com uma só culturaTemos uma cultura forte e única, capaz de nos levar além, para continuarmos crescendo e perpetuando o nosso negócio.Somos um dos maiores bancos digitais do país e uma das fintechs mais rentáveis do segmento e certificados como um Excelente Lugar para Trabalhar pela Great Place to Work.Para vivenciar tudo isso, você terá um pacote completo de benefícios que fazem toda a diferença:Vale-alimentação e/ou refeição.Plano de saúde e odontológico.Seguro de vida.Parceria com TotalPass e ZenKlub.Licença maternidade e paternidade estendidas.Auxílio-creche.Descontos de até 50% em pós-graduação e MBA de grandes instituições, como FIA, FAAP e PUCRS.E tem mais:No dress code: o importante é você usar o que te faz bem.#TáDeParabéns: Day off no aniversário.Baby Gift: presente para recém-nascidos.Tá a fim de uma carreira que rende mais?Vem pro nosso time imbatível!#VemProPags.Show moreShow less",N/A,On-site/Hybrid,https://www.linkedin.com/jobs-guest/jobs/api/jobPosting/4416323402,2026-06-18
Cientista de Dados,XP Inc.,"São Paulo, São Paulo, Brazil",4 hours ago,"Sobre nósA XP Inc. é uma das maiores instituições financeiras independente do Brasil, dona das marcas XP, Rico, Clear, XP Educação, InfoMoney, entre outras. Com mais de 4,6 milhões de clientes ativos e um valor superior a R$ 1,1 trilhão de ativos sob custódia, há 24 anos vem transformando o mercado financeiro para melhorar a vida das pessoas.Com uma cultura marcante guiada por quatro valores -Sonho Grande, Espírito Empreendedor, Foco no Cliente e Mente Aberta- a XP Inc. está sempre em busca dos melhores talentos que tem ambição de fazer o impossível.>> Sobre a vaga:Esta vaga é direcionada a profissionais detodos os níveis de experiência dentro da trilha de analistasque desejam atuar comocientistas de dadosna XP Inc., desde onível assistente até o sênior.Somos um lugar formado por pessoas que sonham grande, focamos em aprendizado constante em um ambiente com muita liberdade para que você possa criar e deixar a sua marca. Além disso, você trabalhará ao lado de pessoas diversas e talentosas que irão te ajudar a usar todo o seu potencial e gerar o maior impacto possível.Desafios Que Você Vai Encontrar Por AquiAmbiente dinâmico e aberto para novas ideias;Liberdade para trilhar uma carreira protagonista;Espaço para desenvolvimento e aprendizado constantes.O que buscamos e principais responsabilidadesComo cientista de dados, com apoio do centro de excelência de Data Science & Machine Learning, essa pessoa será responsável por construir produtos de dados para otimizar tomada de decisão na companhia, como modelos de classificação/regressão, otimização de heurísticas e análises estatísticas.Principais ResponsabilidadesRealizar estudos e análises com grande volume de dados para embasar decisões estratégicas;Desenvolver uma variedade de modelos de aprendizagem de máquina para resolver problemas específicos e otimizar processos;Participar e conduzir reuniões com stakeholders para alinhar expectativas e comunicar resultados;Trabalhar em conjunto com equipes de diferentes áreas (como engenharia, marketing e produto) para entender as necessidades do negócio e traduzir essas necessidades em soluções baseadas em dados.Realizar testes e validações rigorosas dos modelos e soluções implementadas, assegurando a qualidade e a confiabilidade dos resultados.Pré-requisitos Para CandidaturaTer a nossa culturaConhecimento prático em Python, com experiência na construção, treinamento e avaliação de modelos de machine learning.;Conhecimentos em estatística, probabilidade, técnicas de modelagem estatística, aprendizado de máquina, otimização e sistemas de recomendação;Capacidade de analisar problemas complexos e desenvolver soluções baseadas em dados, abordando questões de negócios com uma mentalidade analítica;Paixão por tecnologia e inovação, com interesse ativo em acompanhar tendências e as melhores práticas da área de ML;Habilidade de comunicação para interagir com diferentes áreas, stakeholders e cientistas de dados;Residir em São Paulo e possuir disponibilidade para atuar no modelo híbrido (3x na semana);DiferencialExperiência prática em DatabricksConhecimento e vivência na manipulação e análise de dados financeiros, com a capacidade de extrair insights relevantes para o setor;Conhecimento prático do framework Kedro, com experiência em sua aplicação para estruturar e gerenciar projetos de ciência de dados de forma eficiente;Experiência com modelos de otimização linearSe identificou com a XP Inc. e com a oportunidade?Inscreva-se e venha conquistar o impossível com a gente!Benefícios:Saúde e Bem-estarPlano de saúdePlano odontológicoWellhub (Gympass)ZenklubSeguro de VidaiFood Benefícios (VA e VR flexível)Vale TransporteNew Value (clube de benefícios)Licença parental: maternidade de 6 meses e paternidade de 20 dias.Auxílio CrecheVida FinanceiraFundos de Investimentos ExclusivosAssessoria de InvestimentosCartão XP Visa Infinite sem anuidadeCrédito (consignado, home equity, CCB Imobiliário, etc.)Modelo de Trabalho Presencial FlexívelO nosso modelo de trabalho varia de acordo com a função, podendo ser totalmente presencial para frentes de negócio e mais flexível para outras equipes.Seguimos um modelo com mais frequência presencial, mas sempre guiado por flexibilidade e autonomia com a responsabilidade da nossa cultura empreendedora.Aqui na XP Inc., valorizamos as interações pessoais e acreditamos no uso do escritório como uma ferramenta para potencializar nossas relações no trabalho.Ao seguir com a inscrição, você declara que leu, compreendeu e concorda com a Política de Privacidade do Grupo XP Inc. e de seus fornecedores e parceiros que apoiam com a realização do processo seletivo. O Grupo XP Inc. poderá utilizar de soluções de inteligência artificial para apoiar a equipe de recrutamento no decorrer do processo, o que poderá envolver o tratamento de seus dados pessoais para tal finalidade, conforme princípios da Lei Geral de Proteção de Dados e da Política de Privacidade do Grupo XP Inc.Show moreShow less",N/A,On-site/Hybrid,https://www.linkedin.com/jobs-guest/jobs/api/jobPosting/4198283063,2026-06-18
Data Scientist Specialist,Banco Bradesco,"Osasco, São Paulo, Brazil",6 days ago,"Sobre o BradescoO Bradesco é um dos maiores grupos financeiros do Brasil, com uma história marcada pelo pioneirismo e inovação. Por meio da nossa carteira amplamente diversificada de produtos financeiros, serviços bancários e de seguros contribuímos com a realização das pessoas e o crescimento sustentável de empresas e sociedade. Venha fazer parte do nosso ecossistema financeiro e impactar a experiência de milhões de pessoas!No Bradesco valorizamos a diversidade em todas as suas formas. Por isso, as nossas vagas são abertas a todas as pessoas, independentemente de gênero, raça, orientação sexual, deficiência, idade ou qualquer outra característica.Saiba mais em https://banco.bradesco/html/classic/sobre/index.shtmResponsabilidades e atribuiçõesO que é o nosso time de Crédito?Temos como missão garantir uma gestão eficiente na concessão e manutenção de crédito, que assegure rentabilidade e o crescimento com solidez dos ativos da Organização.Modelo de trabalho : Híbrido - 2x PresencialUnidade: São Paulo - OsascoComo será seu dia a dia?Sendo Data Scientist Specialist, atuará na gerência Crédito e suas principais atividades serão:Modelagem específica para provisionamento (resolução 4966, PD/EAD/LGD);Identificação de oportunidade nas aplicações dos modelos;Identificação de melhorias em modelos existentes;Análise de dados;Melhoria de processo.Requisitos e QualificaçõesO que você precisa ter ou saber?É necessário conhecimentos em provisionamento/Resolução 4966 e mercado financeiroSerá um diferencial se você tiver:Conhecimentos em Python / Databricks e estatística.O que nós oferecemosNo Bradesco valorizamos a saúde e bem-estar, oferecendo um extenso portfólio de benefícios a todas nossas pessoas funcionárias:PLR ou Bônus: Conforme a elegibilidade de cargo*Convênio MédicoConvênio OdontológicoSeguro de VidaVale AlimentaçãoVale Refeição13º Cesta AlimentaçãoTotal PassVale Transporte (adesão opcional)Descontos em produtos e serviços em empresas parceirasPrevidência Privada (adesão opcional, com participação financeira da Organização Bradesco)Viva Bem Bradesco: programa de saúde, bem-estar e qualidade de vidaUnibrad: Universidade Corporativa BradescoIsenção de Tarifas: condições especiais em diversos produtos e serviçosAuxílio Creche ou BabáLicença Paternidade estendida de 20 diasLicença Maternidade de 180 dias, acompanhamento assistencial da gestação até o pós-partoShow moreShow less",N/A,On-site/Hybrid,https://www.linkedin.com/jobs-guest/jobs/api/jobPosting/4418031756,2026-06-18
Data Scientist III - Estratégia de Investimentos,Banco Bradesco,"Osasco, São Paulo, Brazil",1 week ago,"Sobre o BradescoO Bradesco é um dos maiores grupos financeiros do Brasil, com uma história marcada pelo pioneirismo e inovação. Por meio da nossa carteira amplamente diversificada de produtos financeiros, serviços bancários e de seguros contribuímos com a realização das pessoas e o crescimento sustentável de empresas e sociedade. Venha fazer parte do nosso ecossistema financeiro e impactar a experiência de milhões de pessoas!No Bradesco valorizamos a diversidade em todas as suas formas. Por isso, as nossas vagas são abertas a todas as pessoas, independentemente de gênero, raça, orientação sexual, deficiência, idade ou qualquer outra característica.Saiba mais em https://banco.bradesco/html/classic/sobre/index.shtmResponsabilidades e atribuiçõesO que é o nosso time de Pricing?Somos responsáveis pela definição e gestão estratégica de preços e condições financeiras dos produtos do banco, equilibrando rentabilidade, competitividade e risco. Atuando com dados, modelagens e inteligência de mercado para apoiar decisões comerciais e impulsionar resultados sustentáveis em diversas linhas de negócio.Modelo de trabalho : Híbrido - 3x PresencialUnidade: Osasco/SPComo será seu dia a dia?Sendo Data Scientist III - Estratégia de Investimentos, atuará na gerência Investimentos Pricing e suas principais atividades serão:Desenvolver análises que suportem a definição e revisão das estratégias de pricing para produtos de investimentos (ex.: depósitos, LCI, LCA)Avaliar estruturas de taxas, descontos e incentivos comerciais, identificando oportunidades com base em rentabilidade, competitividade e perfil de cliente, além de elaborar planos de açãoMonitorar a adesão à política de alçadas para descontos comerciais, garantindo o tratamento adequado de desviosOrquestrar e priorizar, junto às áreas de tecnologia, os desenvolvimentos necessários para evolução da precificação, definindo planos de ação e acompanhando sua execuçãoRealizar estudos de mercado, análise de performance de produtos e identificação de oportunidades em novos negóciosGerar, estruturar e comunicar insights acionáveis para suportar decisões estratégicas de pricingRequisitos e QualificaçõesO que você precisa ter ou saber?Ensino superior completo em Economia, Administração, Engenharia ou áreas correlatasSólida experiência com análise de dados, modelagem financeira e precificação, preferencialmente aplicada a produtos de investimentos (ex.: CDB, LCI, LCA)Conhecimento do mercado e da regulamentação de investimentos bancáriosConhecimento em estratégia de precificação e análise de rentabilidadeExcel avançado e SQLSerá um diferencial se você tiver:Experiência com PythonO que nós oferecemosNo Bradesco valorizamos a saúde e bem-estar, oferecendo um extenso portfólio de benefícios a todas nossas pessoas funcionárias:PLR ou Bônus: Conforme a elegibilidade de cargo*Convênio MédicoConvênio OdontológicoSeguro de VidaVale AlimentaçãoVale Refeição13º Cesta AlimentaçãoTotal PassVale Transporte (adesão opcional)Descontos em produtos e serviços em empresas parceirasPrevidência Privada (adesão opcional, com participação financeira da Organização Bradesco)Viva Bem Bradesco: programa de saúde, bem-estar e qualidade de vidaUnibrad: Universidade Corporativa BradescoIsenção de Tarifas: condições especiais em diversos produtos e serviçosAuxílio Creche ou BabáLicença Paternidade estendida de 20 diasLicença Maternidade de 180 dias, acompanhamento assistencial da gestação até o pós-partoShow moreShow less",N/A,On-site/Hybrid,https://www.linkedin.com/jobs-guest/jobs/api/jobPosting/4417407822,2026-06-18
