title,company,location,posted,description,applicants,work_mode,link,data_coleta
Cientista de Dados Sênior,TotalPass Brasil,"São Paulo, São Paulo, Brazil",1 month ago,"DESCRIÇÃOAtividadesLiderar projetos de ciência de dados de ponta a ponta, desde a definição do problema até a implementação de modelos em produção;Extrair, processar, limpar e analisar grandes volumes de dados estruturados e não estruturados;Desenvolver e implementar modelos preditivos e algoritmos de machine learning para resolver problemas de negócios.Identificar padrões, tendências e oportunidades através de análises exploratórias de dados.Criar e otimizar modelos de machine learning (supervisionado, não supervisionado, aprendizado por reforço) para solucionar problemas de negócios, como previsão de demanda, classificação de clientes, detecção de fraudes, entre outros.Explorar novos algoritmos e metodologias de aprendizado profundo (deep learning) para aplicações avançadas, como processamento de linguagem natural (NLP), visão computacional e reconhecimento de padrões.Monitorar o desempenho dos modelos após a implementação em ambiente de produção, ajustando-os conforme necessário para garantir que continuem otimizados à medida que novos dados se tornam disponíveis.Desenvolver relatórios e dashboards interativos, utilizando ferramentas de visualização de dados (Tableau, Power BI, D3.js, Matplotlib, Seaborn), para comunicar os resultados de maneira clara e intuitiva.Garantir que os projetos de ciência de dados sigam todas as regulamentações de proteção de dados, privacidade e segurança, como LGPD (Lei Geral de Proteção de Dados) ou GDPR.RequisitosFormação superior em Ciência de Dados, Estatística, Matemática, Computação, Engenharia ou áreas correlatasExperiência mínima de 3 anos como cientista de dados, com foco em machine learning e análise de dados.Forte habilidade em programação, com proficiência em linguagens como Python, R e SQL.Local de trabalho: São Paulo, SPRegime de contratação de tipo: Efetivo – CLTJornada: Período IntegralÁrea e especialização profissional: Contábil, Finanças, Economia - FinançasNível hierárquico: AnalistaREQUISITOSEscolaridade Mínima: Ensino SuperiorShow moreShow less",N/A,On-site/Hybrid,https://www.linkedin.com/jobs-guest/jobs/api/jobPosting/4385156333,2026-05-07
AI Trainer - Freelance Data Annotator,Toloka Annotators,"São Paulo, São Paulo, Brazil",1 week ago,"Please submit your resume in English and indicate your level of English.At Toloka, we connect smart, curious people from around the world with freelance online tasks that train and improve artificial intelligence.What We DoThe Toloka Annotators connects individuals with Generative AI projects from leading tech innovators. Our mission is to unlock the full potential of AI by involving real people from around the world in the development process.About The RoleAnnotation is what helps AI make sense of the world. As an annotator, you may be invited to take part in online projects such as rating AI-generated content, evaluating factual accuracy, or comparing responses - when projects are available.Responsibilities:Carefully review provided data (text, images, or videos)Label or classify content based on project guidelinesIdentify and flag factually incorrect, sensitive, inappropriate, or unclear materialImportant note:This is project-based work. Tasks are availableonly when projects are active. You may be invited to one or more projects depending on your profile and current opportunities.Each project has its own compensation level based on scope and expertise required. On this project, AI trainers earn up to$9 per hour equivalent.RequirementsBachelor's degree in any disciplineMinimum 1 year of experience in any professional roleAdvanced level of English (C1 or higher), both written and spokenLogical thinking, fact-checking and reasoning abilitiesStrong attention to detail and ability to understand and follow complex instructionsStrong communication skills, including the ability to ask clarifying questions when neededGenuine interest in technology and artificial intelligenceBenefitsWhy this freelance opportunity might be a great fit for you?Take part in a part-time, remote, freelance project that fits around your primary professional or academic commitmentsWork on advanced AI projects and gain valuable experience that enhances your portfolioInfluence how future AI models understand and communicate in your field of expertiseShow moreShow less",N/A,Remote,https://www.linkedin.com/jobs-guest/jobs/api/jobPosting/4407457232,2026-05-07
"Brazil Residents - Survey Participants - Guarulhos, Brazil",Prolific,"Guarulhos, São Paulo, Brazil",1 week ago,"SurveyParticipantsAbout ProlificProlific is not just another player in the AI space – we are building the biggest pool of quality human data in the world.Over 35,000 AI developers, researchers, and organizations use Prolific to gather data from paid study participants with a wide variety of experiences, knowledge, and skills.The roleWe are looking for Study Participants from all professional backgrounds across Brazil to take part in academic and applied research studies for global businesses and educational faculties.Whether you are just starting your career or are a seasoned expert, your perspective is valuable. We are actively seeking a diverse range of educational backgrounds, including:No High School Diploma / High School GraduatesTrade School & Vocational Professionals (MBO)Undergraduate & Master's Degree Holders (HBO/WO)PhD Candidates & Doctoral ResearchersIf you have the necessary experience, we'll send you a quick 10- to 15-minute screening to assess your suitability. If successful, you'll be invited to join Prolific as a participant, where you'll get paid to contribute to a wide range of projects.Compensation: Researchers looking for your profile tend topay up to $18/hrper study completed. While many tasks are short, you should be prepared for studies thatrequire up to one hour of uninterrupted work.Whatyou'll be doing in the roleAs a participant, you will contribute to high-quality research outcomes by responding thoughtfully to various tasks, including:AI Training & Evaluation: helping refine Large Language Models by ranking responses or providing creative prompts.Behavioral Experiments: participating in decision-making tasks and cognitive games.User Research: providing feedback on new software, apps, or product concepts.Academic Studies: assisting university researchers in fields like psychology, economics, and sociology.Interviews: engaging in one-on-one deep dives regarding your professional expertise or lived experience.Surveys & Questionnaires: sharing your opinions on current events, consumer habits, or workplace culture.Whatyou'll bringDiverse Perspective: a track record of relevant experience, knowledge, or lived context (from entry-level roles to executive or academic positions).Attention to Detail: the ability to remain focused and provide high-quality data for the duration of a study.Technical Setup: a reliable, fast internet connection and access to a desktop or laptop computer.Financial Readiness: a PayPal account to receive payments and a willingness to self-declare earnings as a self-employed participant.Why Prolific is a great platform to join as a ParticipantJoining our platform as a Prolific participant will give you the chance to influence the AI models of the future using professional legal expertise. Once you pass our assessment, you can join Prolific in just 15 minutes, and start enjoying competitive pay rates, flexible hours, and the ability to work from home.We've built a unique platform that connects researchers and companies with a global pool of participants, enabling the collection of high-quality, ethically sourced human behavioural data and feedback. This data is the cornerstone of developing more accurate, nuanced, and aligned AI systems.We believe that the next leap in AI capabilities won't come solely from scaling existing models, but from integrating diverse human perspectives and behaviours into AI development. By providing this crucial human data infrastructure, Prolific is positioning itself at the forefront of the next wave of AI innovation – one that reflects the breadth and the best of humanity.Links to more information on ProlificWebsiteYoutubePrivacy StatementBy submitting your application, you agree that Prolific may collect your personal data for recruiting and global organisation planning. Prolific's Candidate Privacy Notice explains what personal information Prolific may process, where Prolific may process your personal information, its purposes for processing your personal information, and the rights you can exercise over Prolific use of your personal personal information.Show moreShow less",N/A,On-site/Hybrid,https://www.linkedin.com/jobs-guest/jobs/api/jobPosting/4404106807,2026-05-07
Data Scientist,IDT Corporation,Greater São Paulo Area,2 months ago,"IDT Corporation is a global communications company founded in 1990 and headquartered in Newark, New Jersey. We are industry leaders in prepaid communication and payment services and one of the largest international voice carriers. We are listed on the NYSE, employ over 1800 people across 20 countries, and have over $1.5 billion in revenues.IDT is not ”another big IT corporation”— we encourage and support in-house entrepreneurs in developing their ideas into business actions.We are looking for a highly technical Data Scientist to join our established Analytics department. This is a modeling-heavy role focused on building high-performance, reproducible machine learning systems that drive core business decisions. You will join an existing Analytics and Data Science department, and partner with IDT’s new AI Lab to push models into production.Responsibilites:Production-Grade Modeling: Design, develop, and maintain reproducible machine learning models for production environmentsBehavioral Forecasting: Build advanced models to predict user engagement patterns, including retention and activity frequencyOptimization & Causal Inference: Develop Uplift models to measure the incremental impact of business interventionsRecommendation Systems: Improve and scale next-best-action (NBA) engines to enhance personalized user experiencesExperimental Design: Lead the statistical design and analysis of A/B testing to validate model performance and business hypothesesRequirementsExperience: 3+ years of professional experience in Data Science, with a deep understanding of Supervised/Unsupervised learning including Regression, Boosting, Clustering, and related frameworksCore Stack:Python: Advanced use of Pandas, Numpy, and Scikit-learn for complex feature engineering, model selection, and pipeline optimizationSQL: Proficiency in querying and structuring data from large-scale databasesVisualization: Ability to leverage Tableau to communicate complex analytical results through interactive dashboards and data storytellingEducation: Bachelor’s degree in a quantitative field (Computer Science, Statistics, Mathematics, or related)What we offer:Remote work opportunity!B2B Employment ($, gross)Stable job with long-term growth perspectiveCompetitive salary with annual performance reviewReally good hardwareAn exciting and challenging job with talented people aroundContinuous learning and career growth opportunitiesCompensation for professional training, seminars, and conferencesReferral program - get rewarded for helping us grow the team with talented peopleCompany-supported English classes to enhance your professional growthWe may use artificial intelligence (AI) tools to support parts of the hiring process, suchas reviewing applications, analyzing resumes, or assessing responses. These toolsassist our recruitment team but do not replace human judgment.PLEASE SUBMIT CV IN ENGLISH.Only accepting candidates from LATAMWe may use artificial intelligence (AI) tools to support parts of the hiring process, such as reviewing applications, analyzing resumes, or assessing responses. These tools assist our recruitment team but do not replace human judgment. Final hiring decisions are ultimately made by humans. If you would like more information about how your data is processed, please contact us.Show moreShow less",N/A,Remote,https://www.linkedin.com/jobs-guest/jobs/api/jobPosting/4364503802,2026-05-07
"Manager, Data Science (Product Analytics)",Jobgether,Greater São Paulo Area,1 day ago,"This position is posted by Jobgether on behalf of a partner company. We are currently looking for a Manager, Data Science (Product Analytics) in Brazil.This role offers the opportunity to lead a high-impact product analytics team that transforms data into actionable insights guiding product strategy and user experience at scale. You will manage a team of data scientists focused on understanding user behavior, evaluating product features, and enabling data-informed decision-making across multiple product teams. The position combines people leadership with deep analytical expertise, requiring a balance between operational excellence and strategic vision. You will collaborate closely with product managers, engineers, and research teams in a fast-paced, mission-driven environment. A strong emphasis is placed on experimentation, measurement rigor, and the development of scalable data products. This is a highly influential role where your work will directly shape product direction and user experience outcomes.AccountabilitiesLead and manage a team of approximately seven data scientists, ensuring high-quality delivery of product analytics insights and reportingOversee the timely production of accurate quantitative analysis to support product strategy, feature evaluation, and impact measurementPartner with product managers, engineers, and research teams to embed data-informed decision-making across product development cyclesDesign and improve experimentation frameworks, measurement systems, and product health metrics to support scalable analysisCollaborate with data engineering and experimentation platform teams to build accessible and reliable data productsGuide the development of dashboards, reports, and visualization tools that improve data accessibility and interpretationMentor team members in statistical thinking, storytelling with data, stakeholder communication, and technical developmentEnsure consistency, rigor, and accuracy in analytical processes, balancing speed with methodological robustnessFoster a collaborative, inclusive, and high-performing team culture grounded in trust and accountabilityRequirementsProven experience in experimental design, statistics, and analysis of large-scale user or product dataPrior experience managing or leading a team of data scientists or analysts in a product-driven environmentStrong background in product analytics, experimentation frameworks, and user behavior analysisExperience working with large-scale data systems and tools such as Hadoop, Hive, Presto, or SparkAbility to translate complex data insights into clear, actionable recommendations for cross-functional stakeholdersStrong collaboration skills with product, engineering, and research teams in fast-paced environmentsDemonstrated commitment to equity, inclusion, and inclusive leadership practicesExcellent communication, mentoring, and stakeholder management abilitiesStrong critical thinking, curiosity, and ability to operate in ambiguous and complex environmentsExperience with data visualization or experimentation tools such as Superset or GrowthBook is a plusAlignment with mission-driven work and openness to contributing in a collaborative, open knowledge ecosystemBenefitsRemote-first working model with global collaboration flexibilityCompetitive compensation aligned with experience and locationOpportunity to lead and scale a high-impact data science teamStrong emphasis on professional growth, mentorship, and continuous learningInclusive, mission-driven work environment focused on open knowledge and collaborationExposure to large-scale product analytics challenges and experimentation systemsFlexible work structure with meaningful impact on product and user experienceHow Jobgether WorksWe use anAI-powered matching processto ensure your application is reviewed quickly, objectively, and fairly against the role's core requirements. Our system identifies the top-fitting candidates, and this shortlist is then shared directly with the hiring company. The final decision and next steps (interviews, assessments) are managed by their internal team.We appreciate your interest and wish you the best!Why Apply Through Jobgether?Data Privacy Notice:By submitting your application, you acknowledge that Jobgether will process your personal data to evaluate your candidacy and share relevant information with the hiring employer. This processing is based on legitimate interest and pre-contractual measures under applicable data protection laws (including GDPR). You may exercise your rights (access, rectification, erasure, objection) at any time.We may use artificial intelligence (AI) tools to support parts of the hiring process, such as reviewing applications, analyzing resumes, or assessing responses. These tools assist our recruitment team but do not replace human judgment. Final hiring decisions are ultimately made by humans. If you would like more information about how your data is processed, please contact us.Show moreShow less",N/A,Remote,https://www.linkedin.com/jobs-guest/jobs/api/jobPosting/4409760806,2026-05-07
Banco de Talentos - Pesquisador(a) - Metodologias Quantitativas,Instituto Cordial,"São Paulo, São Paulo, Brazil",1 year ago,"Banco de TalentosO Instituto Cordial está formando um banco de talentos para futuras oportunidades em projetos de pesquisa com foco emmetodologias quantitativas. Buscamos profissionais com experiência em coleta, tratamento e análise de dados quantitativos, com domínio de técnicas estatísticas e capacidade de aplicação em estudos aplicados. O(a) pesquisador(a) atuará em projetos diversos em colaboração com as equipes do Instituto Cordial, contribuindo com evidências robustas para subsidiar políticas públicas, programas sociais e decisões estratégicas.PerfilMestrado completo, doutorado em desenvolvimento ou defendido em áreas como Estatística, Economia, Ciências Sociais, Saúde Coletiva, Engenharia, Políticas Públicas ou correlatas;Experiência comprovada em pesquisa com dados quantitativos, especialmente em análise estatística aplicada a problemas sociais e políticas públicas;Domínio de softwares de análise de dados (como R, Stata, SPSS, Python, etc.);Capacidade de redigir relatórios técnicos e científicos com clareza, interpretação de dados e apresentação de resultados;Facilidade para trabalhar em equipe multidisciplinar e ambientes colaborativos;Desejável experiência com construção e aplicação de questionários, amostragem, e técnicas de inferência estatística;Experiência com bases de dados públicas (ex: IBGE, DATASUS, PNAD, SIM, SIH, entre outras) será considerada diferencial;Familiaridade com princípios éticos em pesquisa e boas práticas de gestão de dados.AtribuiçõesParticipar da concepção e desenho metodológico de pesquisas quantitativas;Apoiar o planejamento e execução da coleta e tratamento de dados secundários e/ou de dados primários, contribuindo com a elaboração de questionários e instrumentos estruturados de coleta de dados;Realizar análises estatísticas descritivas e inferenciais;Produzir visualizações e dashboards de dados, quando aplicável;Redigir relatórios técnicos e científicos;Participar de reuniões com a equipe e parceiros institucionais;Apoiar a preparação de devolutivas e apresentações de resultados para públicos diversos.Trabalhando na CordialOportunidade de trabalhar com questões reais da sociedade e impactos concretos em projetos multidisciplinares;Ambiente sempre aberto à construção coletiva, sugestões e aprimoramentos;Gostamos de trabalhar com desafios e de criar novas formas para resolver problemas difíceis;Tudo que fazemos, realizamos com excelência, muita organização e cuidado;Trabalhamos sempre com transparência, sinceridade e respeito;Incentivo constante à autonomia, aprendizado contínuo, desenvolvimento pessoal e profissional.Show moreShow less",N/A,On-site/Hybrid,https://www.linkedin.com/jobs-guest/jobs/api/jobPosting/4208848885,2026-05-07
PI Analyst,Jobgether,Greater São Paulo Area,1 day ago,"This position is posted by Jobgether on behalf of a partner company. We are currently looking for a PI Analyst in Brazil.This role focuses on supporting and optimizing industrial data infrastructure, ensuring reliable performance of PI systems and related databases across complex environments. You will be responsible for managing PI Historians and AF SQL servers, enabling secure, efficient, and high-quality data flows used in operational and business decision-making. Acting as a key technical reference, you will collaborate closely with PI analysts and workflow teams to ensure proper tag creation, data structuring, and system integration. The position requires strong analytical thinking and hands-on technical expertise to support high-resolution, real-time industrial data environments. You will also contribute to interface design, troubleshooting, and system optimization, ensuring scalability and performance. This is a highly technical and collaborative role suited for professionals who enjoy working at the intersection of data engineering, industrial systems, and process optimization.AccountabilitiesManage PI Historians, including user access, tag creation, security configuration, and system interfacesAdminister AF SQL servers, including database creation, modification, access control, and security managementCollaborate with PI analysts to define and implement workflow tags on in-country PI Historians for operational outputsSupport the development and maintenance of AF structures, including templates, elements, attributes, and analysesEnsure proper integration and performance of PI systems across multiple environments and data sourcesDesign, implement, and troubleshoot industrial data interfaces (OPC UA, OPC DA, PI-to-PI, PI System Connector)Support configuration of high-volume, high-resolution data systems and ensure data integrity and performanceContribute to automation and optimization of data pipelines and troubleshooting processesWork closely with business and technical teams to translate requirements into data structures and solutionsProvide technical documentation and support continuous system improvementRequirementsMinimum 2 years of experience working with PI Systems and/or PI AFStrong understanding of sensor data and industrial data environmentsExperience with AF Client, AF Builder, and PI tag configurationKnowledge of data archive systems and PI database interconnectivityExperience designing and managing industrial data interfaces (OPC UA, OPC DA, PI-to-PI, PI System Connector)Ability to configure high-tag-count, high-frequency data systemsAdvanced SQL skills (SQL Server, Oracle, or similar databases)Experience with data manipulation tools such as Excel, Access, and TOADKnowledge of programming languages such as VB and ability to write code when neededUnderstanding of DevOps and Agile practices applied to data-centric solutionsFamiliarity with data visualization toolsStrong analytical thinking, problem-solving ability, and attention to detailAbility to work independently and collaboratively in cross-functional teamsStrong communication skills with advanced English proficiencyAbility to translate business needs into technical data solutions and vice versaLeadership skills to guide technical discussions and coordinate deliverablesBenefitsCompetitive compensation package aligned with experienceHealth and dental insuranceLife insurance coverageMeal or food allowanceTransportation supportRemote or hybrid flexibility depending on project needsCareer development in industrial data and advanced analytics environmentsExposure to large-scale, high-performance data systemsContinuous learning opportunities in technical and data engineering domainsCollaborative and international work environmentHow Jobgether WorksWe use anAI-powered matching processto ensure your application is reviewed quickly, objectively, and fairly against the role's core requirements. Our system identifies the top-fitting candidates, and this shortlist is then shared directly with the hiring company. The final decision and next steps (interviews, assessments) are managed by their internal team.We appreciate your interest and wish you the best!Why Apply Through Jobgether?Data Privacy Notice:By submitting your application, you acknowledge that Jobgether will process your personal data to evaluate your candidacy and share relevant information with the hiring employer. This processing is based on legitimate interest and pre-contractual measures under applicable data protection laws (including GDPR). You may exercise your rights (access, rectification, erasure, objection) at any time.We may use artificial intelligence (AI) tools to support parts of the hiring process, such as reviewing applications, analyzing resumes, or assessing responses. These tools assist our recruitment team but do not replace human judgment. Final hiring decisions are ultimately made by humans. If you would like more information about how your data is processed, please contact us.Show moreShow less",N/A,Remote,https://www.linkedin.com/jobs-guest/jobs/api/jobPosting/4409375570,2026-05-07
