title,company,location,posted,description,applicants,work_mode,link,data_coleta
"DATA SCIENTIS III - ANALYTCS & MODELING - INTER PAG (São Paulo, SP)",Inter,"São Paulo, São Paulo, Brazil",4 days ago,"Conheça o InterPioneiros, mudamos o mercado ao lançar o primeiro banco digital do Brasil e seguimos criando tendências com tecnologia de ponta. Evoluímos para um Super App Financeiro Global, com soluções completas e inovação de primeira. Aqui, o trabalho tem propósito: construir oportunidades reais, transformar a vida das pessoas e o mercado financeiro. Esse é o nosso Jeito Inter de Fazer. Se você quer fazer parte dessa mudança e deixar um legado, seu lugar é aqui.Vem ser Sangue Laranja.Get to Know InterAs pioneers, we transformed the market by launching Brazil’s first digital bank and continue to shape the future with cutting-edge technology.We have evolved into a Global Financial Super App, delivering complete solutions and leading innovation. Here, work has purpose: creating real opportunities, transforming people’s lives, and reshaping the financial market.This is the Inter way of making things happen. If you want to be part of this transformation and leave your mark, your place is here.Become Sangue Laranja.Sobre a vaga e missão do cargoBuscamos um(a)Cientista de Dados Sr. - Analytics & Modelagempara fortalecer nosso time deDados & Analytics. Sua missão será desenvolver os primeiros modelos de ciência de dados da área, transformando dados em insights estratégicos que impulsionam decisões de negócio e atuando como referência técnica. Você irá construir pontes entre análise estatística, modelagem preditiva e as necessidades da diretoria de PJ, Produtos, Pricing e Comercial — entregando estudos e modelos que gerem valor real e mensurável para a organização.Este é um papel estratégico com o desafio de ser pioneiro na construção da área de ciência de dados, enquanto garantimos a qualidade das análises atuais. Se você é apaixonado por resolver problemas complexos, tem mentalidade vencedora e busca incessantemente por excelência, seu lugar é aqui.No seu dia a dia, você vai:Desenvolver modelos de ciência de dados do zero (churn, segmentação, propensão, scoring, forecasting).Escrever queries SQL complexas para investigar comportamentos da base de clientes e performance de produtos.Realizar análises e estudos financeiros que suportem decisões estratégicas da diretoria.Atuar como parceiro estratégico das áreas de planejamento comercial, comercial, produtos e operações.Traduzir problemas de negócio em soluções analíticas e modelos preditivos.Apresentar resultados e recomendações para stakeholders de diferentes níveis.Implementar e gerenciar modelos em AWS SageMaker.Apoiar estudos de pricing e análises de rentabilidade.O que buscamosObrigatórios:Formação em áreas quantitativas (Estatística, Matemática, Economia, Engenharia, Ciência da Computação ou correlatas).SQL avançado (queries complexas, CTEs, window functions, otimização).Python para ciência de dados (Pandas, NumPy, Scikit-learn, Statsmodels).Excel avançado para análises financeiras e modelagens.Experiência em trabalhar com múltiplos stakeholders de diferentes níveis.Capacidade de comunicar resultados técnicos para públicos não-técnicos.Autonomia para atuar como referência de ciência de dados na área.Desejáveis:Conhecimento em AWS SageMaker.Experiência com modelagem preditiva (churn, segmentação, scoring, pricing).Vivência em adquirência ou setores financeiros.Domínio de conceitos financeiros (P&L, rentabilidade).Experiência com apresentações executivas (PowerPoint).BenefíciosVale-refeiçãoPlano de saúde e odontológicoVale Transporte ou Vale Combustível/Auxílio PedágioSeguro de vidaDayOff de AniversárioBaby On Board e Sala de AmamentaçãoLicença parental estendidaAuxílio-creche/babáTotalPass e Grupo de Corrida InterEspaço CARE4U (Belo Horizonte): serviços de autocuidado com valores exclusivos, área de descompressão, jogos e minicampo de golfeVantagens no nosso SuperApp, como Duo GourmetCartão Prime InterProgramas de treinamento e capacitação internosEtapas do Processo SeletivoTriagem de currículos;Screening (abordagem inicial para alinhamento de expectativas sobre a vaga);Assessments;Entrevista com Time de Talent;Teste técnico (quando necessário);Entrevista com a liderança;Proposta de Contratação (Offer).Show moreShow less",N/A,On-site/Hybrid,https://www.linkedin.com/jobs-guest/jobs/api/jobPosting/4416934699,2026-06-14
Analista de Monitoramento – Prevenção de Perdas,Mottu,"São Paulo, São Paulo, Brazil",1 week ago,"Nascemos para transformar a vida de milhares de pessoas, provendo as ferramentas e o caminho para quem enfrenta a indiferença e supera cada obstáculo para conquistar os seus sonhos. Trabalhamos com propósito, senso de urgência e cabeça de dono. Somos uma das startups que cresce mais rápido em toda a América Latina.Já são mais de 116.000 clientes alugando nossas motos e mais de 800 empresas utilizando o Mottu Entregas como solução de delivery – totalizando mais de 1.000.000 entregas mensalmente, em 130 unidades no Brasil e na Cidade do México.Grandes investidores já acreditam no nosso sonho, como QED Investors, Bicycle Capital, Base Partners, Crankstart e Tiger Global.Responsabilidades e AtribuiçõesAcompanhar e identificar possíveis inconsistências ou comportamentos fora do padrão na nossa frota;Colaborar com outros times (operação, segurança, atendimento etc.) para resolver problemas de forma rápida e eficiente;Entrar em contato com clientes e parceiros para buscar e validar informações relevantes durante o acompanhamento de ocorrências;Apoiar a tomada de decisão com base em dados operacionais e históricos – aqui, cada informação conta;Contribuir para a padronização e automação de processos, garantindo agilidade, escalabilidade e eficiência nas opreações de prevenção.Requisitos e QualificaçõesFormação superior (bacharelado, licenciatura ou tecnólogo), completa ou em andamento, em cursos voltados para desenvolvimento de sistemas, engenharia, ciência de dados, análise e tecnologia da informação;Disponibilidade para atuar presencialmente no escritório, no Butantã/SP, em escala 12x36;Familiaridade com ferramentas como Power BI e Excel;Raciocínio analítico, atenção aos detalhes e interesse em entender causas, padrões e comportamentos;É essencial ter uma boa base em programação ou análise de dados – buscamos alguém que se sinta confortável trabalhando com dados no dia a dia.About The CompanyNós da Mottu acreditamos no poder de transformar vidas através da mobilidade e da inovação. Fundada em 2020, somos hoje a maior empresa de aluguel de motos do mundo, com mais de 170.000 motos em circulação e presença em mais de 100 filiais no Brasil e no México. Em setembro de 2023, concluímos nossa rodada Series C de US$ 50 milhões, liderada por grandes nomes do Venture Capital, como Crankstart Foundation, Bicycle Capital e QED Investors.Somos a startup que mais cresce na América Latina e atingimos ainda em 2025 o status de unicórnio. Acreditamos em um mundo conectado e simplificado, com soluções tecnológicas que melhoram vidas. Valorizamos a superação, a igualdade e a união para construir juntos e transformar a forma como pensamos e agimos. Nós somos Mottu.Nossos princípios inspiram cada passo da nossa trajetória e guiam nossas ações. Acreditamos no medo de ser mediano e, por isso, não nos conformamos com nada menos do que o excepcional: pensar grande e pensar pequeno dá o mesmo trabalho, então damos cada dia 10% a mais do que conseguimos dar no anterior, sempre buscando a grandeza e a escalabilidade. Nosso Foco no Cliente é inegociável, pois nascemos para dar oportunidade a quem nunca teve uma e somos obstinados em ajudá-los a conquistar seus sonhos. Mantemos a Cabeça de Dono, tomando decisões com coragem, autonomia e responsabilidade para deixar um legado com paixão e “sangue nos olhos”. Com Mão na Graxa, arregaçamos as mangas e fazemos nós mesmos para entender e melhorar cada processo, respeitando sempre a opinião de quem está na ponta da lança. E atuamos Ombro a Ombro, apoiando-nos mutuamente, cultivando relações genuínas, sinceras e duradouras, com a coragem de falar a verdade — afinal, aqui não há espaço para jogar em primeira pessoa.Se você busca crescimento acelerado, desafios constantes e deseja fazer parte da nossa missão de revolucionar a mobilidade, a Mottu é o lugar certo para você! Venha somar ao time e construir conosco o futuro da mobilidade na América Latina.Show moreShow less",N/A,On-site/Hybrid,https://www.linkedin.com/jobs-guest/jobs/api/jobPosting/4422993458,2026-06-14
Cientista de Dados Pleno,Porto,"São Paulo, São Paulo, Brazil",3 days ago,"Descrição da vagaNossa área é responsável por desenvolver modelos estatísticos, segmentações e soluções com modelos de GenAI. Trabalhamos diretamente com as diretorias de Produtos, Riscos, Comercial e Atendimento, traduzindo dados em estratégias de negócio que geram valor. Você terá a oportunidade de atuar em projetos de ponta a ponta, levando evolução e inteligência para o negócio.Responsabilidades e atribuiçõesDesenvolver modelos estatísticos, modelos de renda presumida, segmentações e soluções de alta complexidade e impacto para a diretoria de Riscos da Porto Bank (foco em concessão e manutenção de crédito)Entendimento dos problemas das áreas do BankMapeamento dos riscos e planejamento de projetos em etapas claras;Garantir a implementação dos modelos desenvolvidos junto com os times de MLOps;Construir storytelling do projeto para apresentar e garantir a usabilidade do modelo criado para as áreas do Bank;Desenvolvimento de estudos analiticos, com técnicas tradicionais, Machine Learning e GEN AI.Desenvolvimento e automatização de processos da área garantindo o aumento da produtividade.Requisitos e qualificaçõesExperiência no desenvolvimento de Modelos estatísticos e de Machine Learning voltados ao ciclo de crédito, incluindo Credit Scoring (Application e Behaviour) e modelos de estimativa de capacidade financeira (Renda Presumida).Será um diferencial ter conhecimento em estratégias de política de crédito, compreendendo o impacto dos modelos na definição de réguas de concessão e gestão de limites.Domínio em PySpark, Python e SQL para manipulação e análise de grandes volumes de dados.Experiência comprovada em ambiente Databricks ou plataformas de big data similares.Conhecimento em ferramentas de visualização e reporting, preferencialmente Power BI.Habilidade de comunicação fluida e de liderança em discussões técnicas e de negócio.Capacidade de planejar e gerenciar o próprio tempo e projetos com autonomia.Forte entendimento de negócio para conectar modelos a desafios reais e geração de valor.Informações adicionaisBENEFÍCIOSVale Alimentação e Refeição Flexíveis;Plano de Saúde;Plano Odontológico;Wellhub e TotalPass;Academia Bio Ritmo exclusiva para Colaboradores:no Complexo Matriz;Participação nos Lucros - PLR;Programa de Ações: Porto em Ação:complementar à PLR até 2025;Quadras de Areia e Poliesportiva:no Complexo Matriz;Vale-Transporte;Serviços de Transporte de Vans;disponibilizadas nas principais estações de acesso à Porto (Luz, Barra Funda, Santa Cecília e Júlio Prestes);Licença Parental Estendida:até 40 dias para todas as configurações familiares;Licença Maternidade Estendidade 6 meses.;Ambulatório Médico com Especialidades:no Complexo Matriz e Barra Funda;Auxílio creche ou babá;Seguro de Vida;Previdência Privada - PortoPrev;Desconto em Produtos e Serviços;Bolsa de estudos: Reembolso para graduação, pós ou MBA;Corridas mensais:subsídio para as principais corridas de ruas de São PauloReembolso para idiomas (inglês ou espanhol);Teatro Porto:sessões exclusivas para Colaboradores;Biblioteca;Sala de descanso:no completo MatrizSalão de jogos:no complexo MatrizServiços de massagem e podologia:no completo MatrizLocal de trabalho:Local (Atuamos com modelos híbridos, que serão explorados no processo seletivo);Na Porto, Você Importa!A Porto é muito mais que uma seguradora: é um ecossistema gigante que utiliza tecnologia para criar soluções, através de quatro verticais de negócio:Porto Bank, Porto Saúde, Porto Seguro e Porto Serviço.A reputação e o reconhecimento conquistados ao longo de mais de 7 décadas reforçam o tamanho da Porto, uma empresa referência em negócios, feita para e por pessoas.Aqui, bate no peito de 13 mil colaboradores oorgulho de fazer parte de uma organização sólida e ética,que transforma sonhos em realidades fantásticaspara os nossos mais de 15,8 milhões de clientes. São mais de 101 sucursais e escritórios regionais em todo o Brasil.O aprendizado faz parte do nosso DNA, e aqui, você teráincentivos, ferramentas e gente boa para você aprender e crescer, a cada dia,um ambiente de acolhimento e segurança, onde cada um possa ser e se orgulhar de quem se é, promovendo um espaço de respeito evivendo de forma integral e com bem-estar, em uma empresa genuinamente humana.DIVERSIDADE & INCLUSÃO NA PORTOAqui na Porto, valorizamos a diversidade e acreditamos que um time plural é imprescindível para o desenvolvimento de todo o nosso negócio, da sociedade, e de cada pessoa, pois entendemos que cada indivíduo é único na construção de um ambiente mais inovador e inclusivo. Juntos, trabalhamos diariamente para construirmos um espaço seguro, livre e acolhedor, com mais pluralidade e respeito. Por isso,incentivamos fortemente a inscrição de mulheres, de pessoas negras e indígenas, de pessoas com deficiência e de pessoas LGBTQIA+em todas as nossas vagas.Show moreShow less",N/A,On-site/Hybrid,https://www.linkedin.com/jobs-guest/jobs/api/jobPosting/4417416048,2026-06-14
"Staff Data Scientist (Fraud, Risk)",Uber,Greater São Paulo Area,2 days ago,"About The TeamUber is looking for an experienced and motivated Scientist to join ourGlobal Safety & Risk Team. In this role, you will significantly contribute to the physical safety and security of millions of Uber users globally. You will apply your knowledge in data analysis, machine learning, and statistical modeling to generate insights and develop new algorithms that identify and prevent safety incidents before they occur.This position offers the chance to innovate our technology stack by utilizing the latest breakthroughs inPredictive Modeling,Causal Inference, andReal-time Risk Systemsto create intricate autonomous safety frameworks throughout the Uber ecosystem.About The RoleConduct thorough analyses of large, imbalanced datasets to identify trends, patterns, and opportunities for improving safety incident detection.Design, implement, and optimize binary classification models and algorithms to predict the probability of high-severity incidents.Generate actionable insights from risk data and communicate findings to stakeholders, balancing safety interventions with marketplace growth.Work as a thought expert for your cross-functional partners (Product, Ops, and Engineering), pushing the boundaries of how Uber defines and mitigates risk.Design complex experiments (Diff-in-Diff, Synthetic Controls) and interpret results to draw impactful conclusions in a marketplace environment where classical A/B testing is often not feasible.Define how your cross-functional team measures success by developing Safety & Risk metrics (e.g., Recall, Precision-Recall AUC, Probability Calibration) in partnership with global stakeholders.Stay current with the latest advancements in Supervised Learning, Causal Inference, and Anomaly Detection.Technical SkillsRequiredSenior and/or Staff seniority working as a Data Scientist, Applied Scientist, or Machine Learning Engineer.Experience building and deploying Binary Classification systems in production for large-scale, high-stakes applications (e.g., Fraud, Safety, or Risk).Deep experience in Experimental Design beyond classical A/B testing, including Quasi-experiments (Diff-in-Diff, Synthetic Control) or Marketplace experiments (Switchbacks).Expertise in handling Extreme Class Imbalance and optimizing models for rare event detection.Experience using Python and SQL to work with massive, high-dimensional data sets at scale.Solid foundation in Statistical Methodologies such as probability calibration, sampling, and hypothesis testing.PreferredExperience with Geospatial data analysis (e.g., H3, S2 geometry).Background in Real-time Inference systems (working with streaming data like Kafka or Flink).Knowledge of Causal Inference to measure the incremental impact of safety interventions.Please note:this hybrid position is based in São Paulo or Rio de Janeiro, Brazil - welcoming both local professionals and those open to relocating to those cities.Show moreShow less",N/A,On-site/Hybrid,https://www.linkedin.com/jobs-guest/jobs/api/jobPosting/4408781928,2026-06-14
Analista Cientista de Dados II,Serasa Experian,"São Paulo, São Paulo, Brazil",3 days ago,"Company DescriptionA Serasa Experian é a primeira e a maior Datatech do Brasil. Líder em soluções de inteligência para análise de riscos e oportunidades, com foco nas jornadas de crédito, autenticação e prevenção à fraude. Com tecnologia de ponta, inovação e os melhores talentos, transforma a incerteza do risco na melhor decisão, ajudando pessoas a realizarem seus sonhos e empresas de todos os portes e segmentos a prosperarem.Temos 22.000 pessoas operando em 32 países e a cada dia estamos investindo em novas tecnologias, profissionais talentosos e inovação para ajudar todos os clientes a maximizarem cada oportunidade. Com sede corporativa em Dublin, Irlanda, a Experian está listada na Bolsa de Valores de Londres (EXPN) e compõe o índice FTSE 100.Job DescriptionJob descriptionBuscamos um(a) Cientista de Dados Pleno para atuar no time de Data & Analytics, desenvolvendo modelos preditivos e análises avançadas no ecossistema de pagamentos.ResponsabilidadesDesenvolver e manter modelos de Machine Learning (classificação, regressão, séries temporais)Construir e otimizar pipelines de Feature Engineering utilizando PySpark e Databricks NotebooksCriar análises exploratórias e dashboards analíticos em Databricks SQL e AI/BI DashboardsColaborar com times de engenharia de dados na definição de tabelas e métricas no Unity CatalogRealizar experimentação A/B e validação estatística de hipóteses de negócioDocumentar e versionar modelos utilizando MLflowRequisitos técnicosPython avançado (pandas, scikit-learn, XGBoost/LightGBM, statsmodels)SQL avançado (CTEs, window functions, otimização de queries)Apache Spark / PySpark — manipulação de dados em larga escalaDatabricks — Notebooks, Jobs (Lakeflow), Unity Catalog, Delta LakeCloud AWS — S3, IAM, noções de infraestruturaVersionamento com GitExperiência com séries temporais e/ou modelos de propensãoDiferenciaisExperiência com MLflow para tracking e model registryConhecimento em Spark Declarative Pipelines (ETL/ELT)Familiaridade com dados financeiros (transações, boletos, PIX, antifraude)Experiência com Delta Lake (time travel, Z-ordering, liquid clustering)Conhecimento em técnicas de NLP ou Computer VisionCertificação Databricks (Data Engineer/ML Associate)Soft SkillsComunicação clara para traduzir insights técnicos ao negócioPensamento analítico e orientação a resultadoCapacidade de trabalhar com autonomia em squads multidisciplinaresQualificationsQualificationsDatabricksPySparkUnity CatalogMLflowSQLAWSAdditional InformationA Serasa Experian é muito mais do que você imagina. Com o propósito de criar um futuro melhor, ampliando oportunidades para pessoas e empresas, no Brasil somos mais de 4 mil pessoas que atuam em diversos times e especialidades. Aqui, cada conhecimento e diversidade se complementa e você pode trabalhar no que mais ama, estamos comprometidos a construir uma cultura inclusiva e um ambiente no qual pessoas possam equilibrar a carreira com seus compromissos e interesses pessoais, prezando pelo bem-estar.A gente se dedica muito em ser uma das melhores e mais inovadoras empresas para se trabalhar do país, possibilitando experiências e carreiras incríveis para nossas pessoas. Nossa forte abordagem de pessoas em primeiro lugar é reconhecida externamente por meio de diversas certificações de mercado: fomos premiados pelo Great Place To Work™ em 24 países e pela certificação internacional Top Employers, além de sermos reconhecidos como uma das melhores empresas para jovens profissionais e contarmos com uma avaliação de 4,6 no Glassdoor. Cada reconhecimento nos indica que estamos no caminho certo, proporcionando um ambiente de trabalho cada vez melhor para nossos talentos.Vem ser #TimeVeloz!Vamos crescer juntos! Queremos contribuir de verdade para o crescimento dos que estão ao nosso redor. Nosso Propósito? Melhorar vidas, compartilhar sonhos e realizações.Show moreShow less",N/A,On-site/Hybrid,https://www.linkedin.com/jobs-guest/jobs/api/jobPosting/4423188655,2026-06-14
Analista Cientista de Dados Júnior - Vaga Exclusiva para Pessoas com Deficiência,Serasa Experian,"São Paulo, São Paulo, Brazil",1 week ago,"Company DescriptionA Serasa Experian é a primeira e a maior Datatech do Brasil. Líder em soluções de inteligência para análise de riscos e oportunidades, com foco nas jornadas de crédito, autenticação e prevenção à fraude. Com tecnologia de ponta, inovação e os melhores talentos, transforma a incerteza do risco na melhor decisão, ajudando pessoas a realizarem seus sonhos e empresas de todos os portes e segmentos a prosperarem.Temos 22.000 pessoas operando em 32 países e a cada dia estamos investindo em novas tecnologias, profissionais talentosos e inovação para ajudar todos os clientes a maximizarem cada oportunidade. Com sede corporativa em Dublin, Irlanda, a Experian está listada na Bolsa de Valores de Londres (EXPN) e compõe o índice FTSE 100.Job DescriptionPrincipais Atividades:Monitoramento e análises de indicadores por meio de dashboards;Extração e manipulação de dados através de ferramentas de programação, como SQL e Python;Elaboração de análises para tomadas de decisão;Gestão de ferramentas de prevenção a fraudes.QualificationsO que buscamos em você!Experiência em análise de dados;Conhecimentos em SQL, Python ou ferramentas de análise;Superior completo;Conhecimento prévio em fraude é diferencial;Habilidade com aplicação de IA é diferencial.Additional InformationA Serasa Experian é muito mais do que você imagina. Com o propósito de criar um futuro melhor, ampliando oportunidades para pessoas e empresas, no Brasil somos mais de 4 mil pessoas que atuam em diversos times e especialidades. Aqui, cada conhecimento e diversidade se complementa e você pode trabalhar no que mais ama, estamos comprometidos a construir uma cultura inclusiva e um ambiente no qual pessoas possam equilibrar a carreira com seus compromissos e interesses pessoais, prezando pelo bem-estar.A gente se dedica muito em ser uma das melhores e mais inovadoras empresas para se trabalhar do país, possibilitando experiências e carreiras incríveis para nossas pessoas. Nossa forte abordagem de pessoas em primeiro lugar é reconhecida externamente por meio de diversas certificações de mercado: fomos premiados pelo Great Place To Work™ em 24 países e pela certificação internacional Top Employers, além de sermos reconhecidos como uma das melhores empresas para jovens profissionais e contarmos com uma avaliação de 4,6 no Glassdoor. Cada reconhecimento nos indica que estamos no caminho certo, proporcionando um ambiente de trabalho cada vez melhor para nossos talentos.Experian Careers - Creating a better tomorrow togetherFind out what its like to work for Experian by clicking hereShow moreShow less",N/A,On-site/Hybrid,https://www.linkedin.com/jobs-guest/jobs/api/jobPosting/4406811299,2026-06-14
