title,company,location,posted,description,applicants,work_mode,link,data_coleta
Analista Desenvolvimento Analítico,Biolab Sanus Farmacêutica,"Itapecerica da Serra, São Paulo, Brazil",1 week ago,"Somos uma empresa brasileira, com presença internacional, que traz a inovação em seu DNA! Na Biolab, acreditamos que equipes diversas constroem resultados mais sólidos e transformadores.Valorizamos a inclusão e a diversidade em todas as nossas posições. Por isso, incentivamos a candidatura de pessoas com deficiência e de todas as identidades, histórias e origens.No time de Desenvolvimento Analítico, você será responsável por desenvolver e validar metodologias analíticas para produto acabado, matérias-primas, limpeza e processo. Atuará na execução de estudos de estabilidade, avaliação de perfis de dissolução e qualificação de novos fornecedores de matérias-primas. Também dará suporte técnico às demais áreas, garantindo a qualidade, conformidade regulatória e robustez dos processos analíticos.Que Esperamos De VocêGraduação completa em Farmácia ou QuímicaDisponibilidade para modelo 100% presencial (Itapecerica)Boa comunicação, Relacionamento interpessoal e capacidade para resolução de problemasConhecimento em Cromatografia Liquida e Gasosa, ICP (Desejável), BPL, RDC 31/10; RDC53/15; RDC 73/16; RDC 166/17; RDC 318/19Confira Abaixo As Principais Atividades Desta PosiçãoRealizar análises analíticas de validação em produtos e matérias-primas, conforme orientação de analistas plenos/sêniores e coordenação.Executar estudos de estabilidade (acelerada, longa duração, em uso e fotoestabilidade) para medicamentos, cosméticos e alimentos.Conduzir estudos de degradação forçada e perfis de dissolução, incluindo elaboração de protocolos e relatórios conforme RDC 31 e RDC 53 (Anvisa).Desenvolver, validar e transferir métodos analíticos para produtos, matérias-primas e limpeza.Elaborar e revisar documentos técnicos, como: certificados de análise, métodos analíticos, POPs, fichas de cálculo, protocolos e relatórios técnicos.Realizar análises estatísticas e de tendência de estudos de estabilidade.Preparar soluções, reagentes e materiais necessários para a rotina analítica.Gerenciar, incubar e monitorar amostras em câmaras de estabilidade.Apoiar a conferência, revisão e aprovação de protocolos e estudos de estabilidade.Investigar resultados fora de especificação (OOS) e fora de tendência (OOT), com suporte da liderança.Abrir, acompanhar e tratar desvios analíticos, CMs e RNCs, apoiando na implementação de ações corretivas.Apoiar processos de qualificação, calibração e aferição de equipamentos laboratoriais.Garantir a organização do laboratório, controle de validade de materiais e manutenção das condições adequadas de equipamentos e ambiente.Cumprir normas de qualidade, segurança, meio ambiente e boas práticas laboratoriais.Apoiar processos de compras, follow-up de reagentes, padrões e insumos, bem como lançamento e acompanhamento de notas fiscais no sistema.Prestar suporte técnico às áreas de desenvolvimento farmacotécnico e documentação técnica.Orientar analistas juniores, assistentes, auxiliares e estagiários na execução das atividades laboratoriais.Participar de inspeções e auditorias regulatórias junto à coordenação e gerência.Show moreShow less",N/A,On-site/Hybrid,https://www.linkedin.com/jobs-guest/jobs/api/jobPosting/4377795729,2026-03-10
Data Scientist,General Motors South America,"São Caetano do Sul, São Paulo, Brazil",5 days ago,"Job DescriptionHybrid:for this position is required to be on site 3x/weekThe position:The GM Envolve Data Scientist is responsible for developing data‑driven solutions that help our fleet, rental, and government teams optimize their operations and insights about the business. You will partner with cross‑functional teams across sales, customer success, product, and sales operations to frame business problems, build and deploy analytical and machine‑learning models, automate processes and convert insights into concrete action plans.What you will do (responsabilities):You build predictive models and machine-learning algorithmsYou analyze large amounts of information to discover trends and patternsUndertake preprocessing of structured and unstructured dataMonitor and sustain model effectivenessCombine models through ensemble modelingPresent complex information using data visualization techniquesPropose solutions and strategies to business challenges that drive business impactLocation: São Caetano do Sul/SPYour skills and abilities (required qualifications):Bachelor’s degree in computer science, engineering, information technology, or a related fieldMinimum Intermediate knowledge of the English languageSolid experience in one or more core analytical tools / suites / languages such as SAS, Python, R, Spark Scala and understand their limitationsProficient in one or more analytical methodologies such as numerical optimization, econometric modeling and forecasting, machine learning and text analyticsAbility to identify tasks which require automation and automate them.GM does not provide immigration-related sponsorship for this role. Do not apply for this role if you will need gm immigration sponsorship now or in the future. This role is categorized as hybrid. This means the selected candidate is expected to report to a specific location at least 3 times a week {or other frequency dictated by their manager}. This job is not eligible for relocation benefits. Any relocation costs would be the responsibility of the selected candidate.About GMOur vision is a world with Zero Crashes, Zero Emissions and Zero Congestion and we embrace the responsibility to lead the change that will make our world better, safer and more equitable for all.Why Join UsWe believe we all must make a choice every day – individually and collectively – to drive meaningful change through our words, our deeds and our culture. Every day, we want every employee to feel they belong to one General Motors team.Non-Discrimination and Equal Employment OpportunitiesGeneral Motors is committed to being a workplace that is not only free of unlawful discrimination, but one that genuinely fosters inclusion and belonging. We strongly believe that providing an inclusive workplace creates an environment in which our employees can thrive and develop better products for our customers.We encourage interested candidates to review the key responsibilities and qualifications for each role and apply for any positions that match their skills and capabilities. Applicants in the recruitment process may be required, where applicable, to successfully complete a role-related assessment(s) and/or a pre-employment screening prior to beginning employment. To learn more, visitHow we Hire.AccommodationsGeneral Motors offers opportunities to all job seekers including individuals with disabilities. If you need a reasonable accommodation to assist with your job search or application for employment,emailus or call us at 1-800-865-7580. In your email, please include a description of the specific accommodation you are requesting as well as the job title and requisition number of the position for which you are applying.Show moreShow less",N/A,On-site/Hybrid,https://www.linkedin.com/jobs-guest/jobs/api/jobPosting/4378986513,2026-03-10
Data Scientist,"Hunter Douglas, Inc.","São Paulo, São Paulo, Brazil",4 days ago,"Hunter Douglas is the world’s leading manufacturer of window coverings and a major manufacturer of architectural products. We are a brand that you know and trust. With more than 100 years of innovation, we’ve defined our industry with proprietary products that deliver revolutionary style and functionality and can be found in millions of homes and commercial buildings globally.We are searching for candidates that are driven, intelligent, creative, and entrepreneurial. By offering challenging and accelerated opportunities for growth, powered by a shared hunger for success, we create a space for your career to thrive. In return for your expertise, we are committed to providing competitive and robust total compensation and benefit packages to ensure you feel valued. Our dream is to become the fastest growing, most loved, window covering company in the world.What’s yours?Position OverviewWe are seeking a strategic and technically strong Data Scientist to support high-impact analytical initiatives across finance, strategy, pricing, and commercial functions. This role works directly with the Head of Strategy, and senior commercial leaders to shape business decisions through rigorous analytics, AI-driven insights, and a deep understanding of complex product and channel environments. The ideal candidate brings a blend of technical excellence, business acumen, and the ability to influence outcomes across a diverse set of stakeholders.What you'll doStrategic Partnership & CollaborationServe as a core analytical partner to the CFO, Head of Strategy, and commercial leadership, helping define analytical priorities and shaping strategic decision-making.Translate evolving business needs into robust analytical plans, ensuring clarity around objectives, data requirements, and expected impact.Advanced Analytics & Data Science ExecutionDevelop predictive models, segmentation frameworks and optimization analyses to support financial planning, portfolio strategy, and commercial performance.Build and refine scalable analytics workflows in SQL and Google BigQuery, ensuring high-quality data pipelines and efficient processing of large datasets.Apply AI and machine learning techniques to automate processes, enhance decision-making, and unlock new insights across pricing, customer behavior, and product performance.Revenue, Pricing & Growth InsightsConduct deep-dive analyses into revenue drivers, product mix, elasticity, promotions, and customer/segment profitability.Support revenue management or growth initiatives by identifying leverage points for price optimization, margin enhancement, sales acceleration, and product strategy.Evaluate performance across complex or configurable product portfolios, ensuring insights account for multivariate product and commercial structures.Business Communication & InfluenceSynthesize analytical findings into clear, concise narratives tailored for executives and commercial teams.Help build a data-driven culture by elevating analytical standards, sharing best practices, and improving access to insights.Who you are5+ years in data science, advanced analytics, revenue management, pricing analytics, or growth-focused analytical roles.Deep expertise in SQL and Google BigQuery, with hands-on experience managing large, complex datasets.Proven track record partnering with finance leaders, strategy leaders, or senior commercial executives.Strong business judgment with the ability to proactively identify high-value analytics and AI opportunities.Experience with complex product portfolios, configurable/custom products, or multi-category commercial environments.Hands-on experience implementing AI-driven methods within data science workflows.Excellent communication skills with the ability to align technical insights to business priorities.Ability to communicate effectively in English, both verbally and in writing (Required)Previous experience supporting teams globally with a focus on North America (Preferred)Experience with pricing analytics, elasticity modeling, promotional analysis, or revenue optimization. (Preferred)Prior work in growth, revenue strategy, commercial analytics, or similar functions. (Preferred)Proficiency in Python, R, or comparable languages for advanced modeling. (Preferred)What's in it for youAnnual base salary range: BRL 235,000 - 319,000Bonus target range: 25%Enjoy our Flexible Time Off (FTO) program designed to support work–life balance (excludes new hires in Illinois).Generous benefits packageA company culture that prioritizes internal development and professional growthPlease note, all offers presented to candidates are carefully crafted to ensure market competitiveness, equity, and reflect the individual candidate’s education, experience, skills and potential.Hunter Douglas is an Equal Opportunity Employer and complies with applicable employment laws. EOE/M/F/Vet/Disabled are encouraged to apply.The deadline to apply for this position is March 16, 2026By submitting your application below, you are providing your prior consent to receive SMS messages to notify you of any updates to your application status and to engage in discussion throughout your application process. You can cancel the SMS service at any time. Just text “STOP” to any of our texts to unsubscribe. Message & data rates may apply. Message frequency may vary. If you have any questions regarding privacy, please read our privacy policy, https://www.hunterdouglas.com/privacy-policy or terms of use https://www.hunterdouglas.com/terms-of-useShow moreShow less",N/A,On-site/Hybrid,https://www.linkedin.com/jobs-guest/jobs/api/jobPosting/4380476572,2026-03-10
Cientista de Dados Sênior - Prevenção a Fraudes,TotalPass Brasil,"São Paulo, São Paulo, Brazil",5 months ago,"DESCRIÇÃONosso time de Dados em Prevenção a Fraude atua de maneira analítica observando padrões e comportamentos para manter nosso aplicativo cada vez mais seguro. Hoje tem participação expressiva nos resultados da área de tecnologia. Trabalhamos em um ambiente que valoriza a comunicação aberta, a inovação e o desenvolvimento contínuo.Como Será o Seu Dia a DiaPlenejar, desenvolver e implementar modelos estatísticos e algoritmos de machine learning para detectar fraudes de forma escalável e com alta precisão.Fomentar a criação de segmentações comportamentais e análises preditivas, utilizando técnicas avançadas de modelagem.Analisar grandes volumes de dados, propondo estratégias e soluções para otimizar a prevenção a fraudes.Fornecer insights estratégicos para a liderança sobre tendências de fraude, comportamentos suspeitos e melhorias em processos.Mentorizar e treinar membros da equipe júnior e pleno, promovendo o compartilhamento de conhecimentos e melhores práticas.Trabalhar em colaboração com outras áreas para garantir que as soluções sejam alinhadas às necessidades de negócio e que os modelos se integrem eficientemente às plataformas e sistemas.Manter-se atualizado sobre as tendências e inovações no campo da prevenção a fraudes e implementar soluções de ponta.O Que Esperamos Que Você TenhaREQUISITOSExperiência avançada em linguagens de programação como Python, SQL, R, e frameworks de Machine Learning.Sólido conhecimento em manipulação de grandes volumes de dados e ambientes de nuvem, com foco em AWS.Capacidade de desenvolver e implementar modelos preditivos e de análise de dados de forma escalável e eficiente.Conhecimento em metodologias ágeis e experiência em ambientes de trabalho colaborativos.Formação acadêmica avançada em Estatística, Matemática, Ciência da Computação ou áreas relacionadas.Capacidade de tomar decisões baseadas em dados e resultados.Comunicação clara com stakeholders e capacidade de apresentar soluções estratégicas.Excelente capacidade de comunicação tanto técnica, quanto para públicos não técnicos.Visão crítica e de inovação para aprimorar processos e implementar novas abordagens.Regime de contratação de tipo: Efetivo – CLTJornada: Período IntegralÁrea e especialização profissional: Informática, TI, Telecomunicações - Processamento de DadosNível hierárquico: AnalistaEscolaridade Mínima: Ensino SuperiorShow moreShow less",N/A,On-site/Hybrid,https://www.linkedin.com/jobs-guest/jobs/api/jobPosting/4301726573,2026-03-10
Estatístico(a) / Cientista de Dados – PhD,QiBit,"São Paulo, São Paulo, Brazil",16 hours ago,"Contratação: CLTModelo: Presencial – Centro – SP (Próximo ao Teatro Municipal)ResponsabilidadesDesenvolver modelos estatísticos e analíticos avançadosAtuar com big data, machine learning e inteligência artificialTrabalhar com dados espacializados e geoprocessamentoApoiar pesquisas científicas e estudos estatísticosGerar análises e insights para projetos estratégicosRequisitosFormação em Estatística, Ciência de Dados ou áreas correlatasPhD (ou equivalente)Mais de 10 anos de experiência em estatística, ciência de dados ou pesquisa científicaForte domínio de estatística, IA, machine learning e big dataExperiência com dados geoespaciais / geoprocessamentoInglês avançado ou fluenteDiferenciaisExperiência no agronegócioVivência com estatísticas agrícolasAtuação acadêmica ou produção científica relevanteBenefíciosVR de 35,00VT (desc 6%)Plano de Saude Unimed Campinas (desc 20% folha - 84,40 (total plano 421,00)Plano Odontologico Odontoprev (19,94)Total PassShow moreShow less",N/A,On-site/Hybrid,https://www.linkedin.com/jobs-guest/jobs/api/jobPosting/4381753584,2026-03-10
Oportunidades de Carreira: Cientista de Dados (LLM/IA) com Perfil Backend (Microserviços) - RAG Essencial (AWS) | PROADI - SUS (1308767),Einstein Hospital Israelita,"São Paulo, São Paulo, Brazil",6 days ago,"Com 70 anos de existência, o Einstein Hospital Israelita ainda mantém uma premissa: inovar e crescer, sempre com excelência. Ajudamos a salvar vidas, difundir o conhecimento em educação, prevenção e inovação em saúde. Além da atuação em setores assistenciais, temos oportunidades na área de Inovação, Tecnologia, Pesquisa, Ensino, entre outras. Seguimos oferecendo qualidade, afirmando nosso compromisso com a Responsabilidade Social e com o propósito de levar uma gota de Einstein para cada cidadão. Valorizamos a diversidade e inclusão de todos os talentos e buscamos profissionais que compartilhem deste mesmo propósito!ResponsabilidadesImplementar *RAG ponta a ponta*: ingestão, chunking, embeddings, indexação vetorial, retrieval, reranking/grounding e resposta.Implementar *agentes/orquestração* com *CrewAI + Langflow + LangChain (e/ou LlamaIndex)*, integrando ferramentas e fluxos.Construir *avaliação contínua* de LLM/RAG: golden set, métricas (groundedness/factualidade, relevância), testes de regressão e monitoramento.Integrar com serviços e dados em AWS (S3, bancos, mensageria, cache) e garantir observabilidade, resiliência e custo/latência sob controle.Atuar dentro do *pipeline CI/CD* (Azure DevOps): entender stages/gates e debugar falhas de build/test/deploy do próprio serviço.Trabalhar em métodos ágeis: refinamento, planning, dailies, reviews e retrospectivas.RequisitosExperiência sólida com *LLMs aplicados*: prompting avançado, function calling/tools, gestão de contexto e saída estruturada (JSON schema/validação).RAG ESSENCIAL* em produção: embeddings, retrieval, avaliação e melhoria contínua.Vector DB ESSENCIAL* (ao menos um): *Qdrant / Weaviate / Chroma / Pinecone*.Agentes e orquestração ESSENCIAL: **CrewAI, **Langflow* e *LangChain* (e/ou *LlamaIndex*).Avaliação de LLM/RAG ESSENCIAL*: golden set, métricas de groundedness/factualidade, testes de regressão e monitoramento.Vivência com CI/CD (entender e operar dentro do fluxo; *não* administrar a plataforma).DiferenciaisBackend; Python (preferência FastAPI) e/ou Node; design de APIs e microserviços.Experiência prática em AWS*: S3, IAM, CloudWatch; deploy em ECS/EKS/Lambda conforme stack.Recuperação avançada: busca híbrida (BM25+vetorial), query rewriting, filtros por metadados, deduplicação.Segurança para IA: mitigação de prompt injection, redaction de PII, controle de acesso por tenant/documento e logging seguro (LGPD).Otimização de custo/latência: cache, batch/streaming, fallback de modelos, circuit breaker e filas.Fine-tuning leve/PEFT/LoRA quando fizer sentido, com avaliação antes/depois.Manipulação de imagens médicas (DICOM): leitura/parse, extração de metadados e processamento básico (ex.: pydicom, conversão/normalização, integração com pipelines de IA).Einstein Benefícios – Compartilhando Bem-EstarCuidados com a saúde: Programa Cuidar com serviços realizados no Einstein para promover a saúde e bem-estar dos colaboradores e dependentes, Clínicas Einstein, Telemedicina, Convênio Farmácia, Convênio Médico, Assistência Odontológica e Consultório Dental in Company.Bem-Estar: Wellhub (Gympass), TotalPass, Coral, Programa de Orientação Pessoal e SESC.Para você e sua família: Licença paternidade estendida, Seguro de Vida, Creche ou Auxílio Creche para mães ou pais com guarda legal, Auxílio para Filhos com Deficiência e Previdência Privada com taxa zero.Alimentação: Vale Alimentação, Vale Refeição ou Refeitório no local de trabalho.Mobilidade: Vale Transporte, Fretado, Estacionamento, Aplicativo de Caronas e Circular Metrô.Clube de Benefícios: Para economizar e obter vantagens nas compras de produtos e serviços de diversas categorias, como Beleza e Fitness, Comer e Beber, Compras, Cultura e Lazer, Educação Ensino Einstein, Turismo e muito mais.Programa Mais Conectados: Trabalho remoto nas modalidades Teletrabalho ou Híbrido conforme atividade e área de atuação.Os benefícios podem sofrer alteração de acordo com a convenção coletiva, unidade de trabalho e políticas vigentes.Show moreShow less",N/A,On-site/Hybrid,https://www.linkedin.com/jobs-guest/jobs/api/jobPosting/4379461680,2026-03-10
