title,company,location,posted,description,applicants,work_mode,link,data_coleta
Engenharia de IA (Agentes de IA),banco BV,"São Paulo, São Paulo, Brazil",2 weeks ago,"Somos obanco BV, uma dasmaiores instituições financeiras da América Latina, com mais de 37 anos de experiência no mercado. Temos como propósitoviabilizar os sonhos e projetos dos nossos clientes, transformando crédito em relacionamento.E pelo segundo ano consecutivo, fomos reconhecidos como a Melhor Instituição Financeira para Trabalhar, segundo o ranking 2025 do GPTW!A nossa cultura éágil,digitalecentrada no cliente. Combinamos pessoas e tecnologia para orquestrar e impulsionar as nossas entregas.O nosso crédito não é apenas um número. É relacionamento forte e real.Responsabilidades :- Projetar e implementar agentes de GenAI, garantindo escalabilidade e governança;- Domínio avançado da plataforma Gemini Enterprise e ferramentas (ADK, AgentSpace, AgentEngine, crewAI);- Expertise em LLMs, frameworks de IA generativa e soluções de workflow/orquestração low-code;- Definir estruturas de prompts, estratégias de fine-tuning e avaliação de modelos;- Identificar oportunidades de automação, estrutura casos de uso e business cases, validando viabilidade técnica e regulatória;- Acompanhar pilotos, define critérios de sucesso e orienta evolução para escala;- Promover redução de dívida técnica, modularidade e práticas avançadas de observabilidade.- Disponibilidade para modelo híbrido em São Paulo (região Morumbi).Requisitos:Forte experiência como Engenheiro de IAUso de ferramentas de IA generativa (frameworks como ADK, LangChain/LangGraph,crewAI, agentspace, agentengine, LLMs, soluções de workflow e orquestração low-code), RAGConhecimento de APIs, integração e orquestraçãoExperiência com criação de agentesConhecimento de estruturas de prompts e refino de modelos orientados a tarefaDiversidade e inclusão* Convidamos pessoas negras, mulheres, profissionais com deficiência, comunidade LGBTQIA+ e pessoas de qualquer idade a conhecerem a gente um pouco mais e a se inscreverem nesta vaga.We may use artificial intelligence (AI) tools to support parts of the hiring process, such as reviewing applications, analyzing resumes, or assessing responses and identifying potential inconsistencies or verification signals in application materials based on available information. These tools assist our recruitment team but do not replace human judgment. Final hiring decisions are ultimately made by humans. If you would like more information about how your data is processed, please contact us.Show moreShow less",N/A,On-site/Hybrid,https://www.linkedin.com/jobs-guest/jobs/api/jobPosting/4402021012,2026-06-14
Cientista de Dados Sênior,Porto,"São Paulo, São Paulo, Brazil",1 day ago,"Descrição da vagaGerencia responsável pela disciplina de ciência de dados e analytics, focada em desenvolvimento de modelos preditivos para o PortoBank.Responsabilidades e atribuiçõesO cientista será responsável por todo o ciclo de desenvolvimento e implantação de modelos e estimativas de renda presumida.Atuará monitorando continuamente a performance e a estabilidade das estimativas, assegurando a aderência às melhores práticas de mercado e às regulamentações internas.Também será responsável por propor novas abordagens, técnicas e integrações de dados que tragam melhorias constantes aos modelos.É esperado que o profissional se mantenha atualizado(a) sobre tendências, tecnologias e avanços em machine learning, inteligência artificial e análise de risco, aplicando esses conhecimentos para fortalecer as soluções desenvolvidas.Desenvolver, implantar e aprimorar modelos de renda presumida, garantindo precisão, estabilidade e alinhamento com as áreas de negócios e resultados.Propor novas abordagens e fontes de dados, enquanto se mantém atualizado(a) nas tendências de machine learning e inteligência artificial para melhorar continuamente as estimativas.Requisitos e qualificaçõesExperiência com dados financeiros e modelos de estimativa de renda.Habilidade para comunicar resultados técnicos de forma clara para públicos não-técnicos.Formação em Estatística, Matemática, Engenharia, Economia ou áreas correlatas.Linguagens: Python, R ou outras apropriadas.Experiencia em DataBricks e Azure são diferenciais.Informações adicionaisBENEFÍCIOSVale Alimentação e Refeição Flexíveis;Plano de Saúde;Plano Odontológico;Wellhub e TotalPass;Academia Bio Ritmo exclusiva para Colaboradores:no Complexo Matriz;Participação nos Lucros - PLR;Programa de Ações: Porto em Ação:complementar à PLR até 2025;Quadras de Areia e Poliesportiva:no Complexo Matriz;Vale-Transporte;Serviços de Transporte de Vans;disponibilizadas nas principais estações de acesso à Porto (Luz, Barra Funda, Santa Cecília e Júlio Prestes);Licença Parental Estendida:até 40 dias para todas as configurações familiares;Licença Maternidade Estendidade 6 meses.;Ambulatório Médico com Especialidades:no Complexo Matriz e Barra Funda;Auxílio creche ou babá;Seguro de Vida;Previdência Privada - PortoPrev;Desconto em Produtos e Serviços;Bolsa de estudos: Reembolso para graduação, pós ou MBA;Corridas mensais:subsídio para as principais corridas de ruas de São PauloReembolso para idiomas (inglês ou espanhol);Teatro Porto:sessões exclusivas para Colaboradores;Biblioteca;Sala de descanso:no completo MatrizSalão de jogos:no complexo MatrizServiços de massagem e podologia:no completo MatrizLocal de trabalho:Local (Atuamos com modelos híbridos, que serão explorados no processo seletivo);Na Porto, Você Importa!A Porto é muito mais que uma seguradora: é um ecossistema gigante que utiliza tecnologia para criar soluções, através de quatro verticais de negócio:Porto Bank, Porto Saúde, Porto Seguro e Porto Serviço.A reputação e o reconhecimento conquistados ao longo de mais de 7 décadas reforçam o tamanho da Porto, uma empresa referência em negócios, feita para e por pessoas.Aqui, bate no peito de 13 mil colaboradores oorgulho de fazer parte de uma organização sólida e ética,que transforma sonhos em realidades fantásticaspara os nossos mais de 15,8 milhões de clientes. São mais de 101 sucursais e escritórios regionais em todo o Brasil.O aprendizado faz parte do nosso DNA, e aqui, você teráincentivos, ferramentas e gente boa para você aprender e crescer, a cada dia,um ambiente de acolhimento e segurança, onde cada um possa ser e se orgulhar de quem se é, promovendo um espaço de respeito evivendo de forma integral e com bem-estar, em uma empresa genuinamente humana.DIVERSIDADE & INCLUSÃO NA PORTOAqui na Porto, valorizamos a diversidade e acreditamos que um time plural é imprescindível para o desenvolvimento de todo o nosso negócio, da sociedade, e de cada pessoa, pois entendemos que cada indivíduo é único na construção de um ambiente mais inovador e inclusivo. Juntos, trabalhamos diariamente para construirmos um espaço seguro, livre e acolhedor, com mais pluralidade e respeito. Por isso,incentivamos fortemente a inscrição de mulheres, de pessoas negras e indígenas, de pessoas com deficiência e de pessoas LGBTQIA+em todas as nossas vagas.Show moreShow less",N/A,On-site/Hybrid,https://www.linkedin.com/jobs-guest/jobs/api/jobPosting/4428116832,2026-06-14
"Cientista de Dados - Python, AWS, ML",Capgemini,"Barueri, São Paulo, Brazil",3 weeks ago,"Nossa OportunidadeVocê é apaixonado(a) por tecnologia, inovação e quer fazer parte de um ambiente inclusivo, colaborativo e em constante evolução? Então essa oportunidade é para você!Na Capgemini, valorizamos o equilíbrio entre vida pessoal e profissional. Por isso, oferecemos modelos de trabalho flexível, híbrido, de acordo com as necessidades do projeto. Nosso objetivo é proporcionar a melhor experiência para você, respeitando seu estilo de vida e promovendo bem-estar.Estamos em busca de um(a) Cientista de Dados com foco em Python, AWS e Machine Learning,para compor nosso time.ResponsabilidadesDesenvolver, treinar e realizar o deploy de modelos de Machine Learning, garantindo escalabilidade e performanceConstruir e manter pipelines de treinamento e inferência utilizando AWS SageMakerAtuar com serviços da AWS como S3, EC2, Lambda, SageMaker e IAM, assegurando boas práticas de arquitetura e segurançaDesenvolver soluções de dados utilizando Python e suas principais bibliotecas (Pandas, NumPy, Scikit-learn, TensorFlow, PyTorch)Implementar e sustentar práticas de MLOps, incluindo automação, versionamento e monitoramento de modelosTrabalhar com práticas de CI/CD para integração contínua e entrega de modelos em produçãoRealizar manipulação e integração de dados utilizando bancos relacionais e não relacionais (SQL e NoSQL)Colaborar com times técnicos e de negócio para entender demandas e traduzir em soluções baseadas em dadosGarantir versionamento de código e boas práticas de desenvolvimento utilizando GitRequisitosExperiência em desenvolvimento e deploy de modelos de Machine LearningDomínio em serviços AWS (S3, EC2, Lambda, SageMaker, IAM)Experiência na construção de pipelines de treinamento e inferênciaConhecimento avançado em Python e bibliotecas de Data Science (Pandas, NumPy, Scikit-learn, TensorFlow ou PyTorch)Experiência com práticas de MLOps e CI/CDConhecimento em bancos de dados SQL e NoSQLExperiência com versionamento de código (Git)Inglês Intermediário/avançado (leitura técnica e comunicação)Diversidade, Inclusão e PertencimentoNa Capgemini, você pode ser quem você é. Valorizamos a diversidade em todas as suas formas e promovemos um ambiente inclusivo por meio de comitês como:Women@Capgemini – Empoderamento feminino e equidade de gênero.Capgemini Black – Representatividade e valorização da cultura negra.LGBTQIA+@Capgemini, Capgemini Accessibility, entre outros.Nosso compromisso é contínuo: somos reconhecidos pela GPTW, Bloomberg Gender Equality Index, EDGE e Ethisphere como uma das empresas mais éticas e inclusivas do mundo. Nossas vagas são para todas as pessoas, independentemente de cor, etnia, religião, idade, identidade de gênero, orientação sexual ou deficiência.Desenvolvimento e BenefíciosAqui, você é protagonista da sua carreira! Oferecemos:Plano de carreira estruturado e trilhas personalizadas de aprendizado.Universidade Corporativa, com acesso a Harvard, Udemy.Certificações oficiais com parceiros como SAP, AWS, Microsoft, Salesforce.Idiomas com EF Education First (Inglês, Espanhol, Francês e Alemão).Bem-estar CompletoAssistência médica e odontológica.Wellhub e Equilibrium (saúde física e mental).Previdência privada e seguro de vida.Programa Family Care: licenças maternidade e paternidade estendidas, apoio à fertilidade, orientação personalizada em saúde e bem-estar.Vale-refeição, clube de benefícios e muito mais!Make It RealNa Capgemini, liberamos a energia humana por meio da tecnologia para construir um futuro mais inclusivo, sustentável e inovador. Se você compartilha desses valores, venha transformar o mundo com a gente!Show moreShow less",N/A,On-site/Hybrid,https://www.linkedin.com/jobs-guest/jobs/api/jobPosting/4416992292,2026-06-14
Cientista de Dados Híbrido,QSOFT,"São Paulo, São Paulo, Brazil",2 months ago,"🔶SOBRE NÓS:A QSOFT é uma consultoria líder em Data & Analytics, especializada em soluções de Business Intelligence e parceira oficial de empresas como Tableau e Altair. Com uma carteira de mais de 500 clientes, , estamos em uma trajetória de crescimento e inovação contínuos.Para saber mais sobre nós e o trabalho que realizamos, visite:www.qsoft.com.br🔶O QUE BUSCAMOS:Estamos buscando um Cientista de Dados altamente qualificado para se juntar à nossa equipe dinâmica. O candidato ideal deve ser apaixonado por dados, com habilidades excepcionais de análise e modelagem, e ter um histórico comprovado em gerar insights acionáveis a partir de grandes conjuntos de dados.Principais atividades e responsabilidades:Desenvolver e implementar modelos estatísticos e algoritmos de machine learning.Analisar grandes conjuntos de dados para identificar tendências, padrões e insights valiosos para os negócios.Colaborar com diferentes equipes para entender necessidades de negócios e fornecer soluções baseadas em dados.Apresentar resultados de análises de maneira clara e influente para stakeholders.Pré-requisitos mínimos:Graduação em Ciência da Computação, Estatística, Matemática, Engenharia ou áreas relacionadas.Experiência comprovada em análise de dados e modelagem estatística.Proficiência em linguagens de programação como Python, R ou SQL.Experiência com ferramentas de BI como Tableau ou PowerBI é um diferencial.Perfil psicodinâmico:Com organização e comprometimento;Habilidade de resolução de problemas e raciocínio lógico;Fortes habilidades de comunicação para reporte de ações e lógicas do sistema sendo construídas;🔶O QUE OFERECEMOS?Plano de Saúde e Odontológico Sem Coparticipação (SulAmérica);Seguro de Vida;Day Off no Aniversário;Total Pass;C4life;VR e Auxílio Home Office no cartão Flash;Plataforma Alura 50% Off.Show moreShow less",N/A,On-site/Hybrid,https://www.linkedin.com/jobs-guest/jobs/api/jobPosting/4402084359,2026-06-14
"Senior Data Scientist - Risk Analytics (Contract, São Paulo)",First Help Financial,Greater São Paulo Area,6 days ago,"First Help Financial (FHF) is a fast-growing and culturally diverse company in the U.S. We provide auto loans to the underserved and care for our customers and partners with exceptional service. Through flexible financing options and tri-lingual support, we offer consumers an easier way to finance their first car. We lend to and support our portfolio which has consistently grown 30%+ each year over the last nine years.Here you will find hard-working colleagues who come from over 20 countries. We hold ourselves to the highest standards of professionalism but also enjoy our work. Our culture and benefits are geared towards making you successful in life and comfortable at work.Your Title:Senior Associate, Risk Data Science.Your Location:Hybrid/Brazil HQ address - Nações Unidas 12901 - São Paulo - SP (this role requires ONE day per week in the office on a rotating schedule, plus an additional day in the office each month.)You Report To:Associate Director, Risk Data Science.Learn more about our awesomeAnalytics Team.About the Opportunity:First Help Financial, recently voted as a ""Great Place to Work"" for the fifth year in a row is seeking a Machine Learning Engineer to join our highly skilled and innovative team. First Help Financial is embarking on a new growth phase involving multiple game-changing projects.What you will do:Design, develop, validate, and continuously enhance end‑to‑end risk models and scorecards across the credit lifecycle, including Originations, Pricing, Loss Forecasting, Servicing, and Collections.Partner closely with Risk, Finance, Product, and Operations teams to translate business problems into analytical solutions that drive measurable outcomes.Evaluate and integrate new data sources, features, and modeling approaches, assessing their incremental value, robustness, and impact on risk and profitability.Lead what‑if, stress testing, and scenario analyses to support strategic initiatives, new programs, and policy changes.Ensure models are interpretable, stable, and production‑ready, balancing predictive power with regulatory and operational constraints.Own the ongoing monitoring and performance tracking of models, identifying degradation, bias, or drift and proactively proposing improvements.Stay current on regulatory expectations and industry best practices in credit risk modeling, particularly within the auto finance space, and incorporate them into modeling standards and documentation.What you bring:Bachelor's degree in Statistics, Mathematics, Engineering, Computer Science, Physics, or a related quantitative field (Master's or PhD is a plus).5+ years of hands‑on experience building and deploying predictive models in a production environment, preferably within credit risk, lending, or financial services.Proven experience developing scorecards and statistical models using techniques such as logistic and linear regression, tree‑based methods, ensemble models, time series, survival analysis, clustering, and/or machine learning methods.Strong proficiency in Python and SQL, with the ability to manipulate, analyze, and extract insights from large, complex, and imperfect datasets.Solid understanding of the full model lifecycle — from data exploration and feature engineering to validation, monitoring, and retraining.Ability to communicate complex analytical findings clearly and confidently to both technical and non‑technical stakeholders.A pragmatic mindset: you know when to optimize for accuracy, explainability, speed, or compliance — and how to make trade‑offs responsibly.FHF Benefits:Great Perks - We offer generous salaries, social activities, monthly lunches, and a robust employee recognition and talent development program to enhance your career with us.Culture - We are believers in maintaining a healthy work-life balance. While we work hard and care deeply about our customers and partners, we want you to have room for your family, friends, and yourself.Growth - Company growth provides unprecedented career growth. FHF's extraordinary year over year growth in revenue and new markets provides opportunity for you to establish and develop your career growth. We engage each employee to build a career plan that benefits everyone, and we have a proven record of investing inyou.Diversity and InclusionFHF is committed to building a culture that respects and embraces all walks of life, inclusive of all genders, race, culture, age, sexual orientation, and other identities. We will make accommodations when interviewing anyone with special needs.Show moreShow less",N/A,On-site/Hybrid,https://www.linkedin.com/jobs-guest/jobs/api/jobPosting/4421927546,2026-06-14
Cientista de Dados Pleno,Comerc Energia,"São Paulo, São Paulo, Brazil",2 weeks ago,"Responsabilidades:Desenvolver, treinar e validar modelos preditivos e de machine learning aplicados às soluções da empresa;Participar da construção de arquiteturas modernas de IA, incluindo uso de LLMs, RAG e pipelines de ML;Colaborar na criação de produtos de dados e serviços inteligentes para apoiar jornadas corporativas;Desenvolver APIs e serviços em Python (FastAPI) para disponibilizar modelos e funcionalidades de dados;Construir e manter pipelines de dados eficientes usando Python, SQLRequisitos:Inglês intermediário para leitura de documentações técnicasExperiência em Python (pandas) e SQL.Noções de RAG, embeddings e tokenização.Conhecimento em MLOps.Familiaridade com boas práticas de governança de dados e documentação.Experiência com cloud.Formação Acadêmica:Ensino superior completo em Ciências da Computação, Estatística, Engenharia, Matemática Aplicada, Sistemas de Informação ou áreas correlatas.Outros Requisitos Diferenciais:Desejável pós-graduação em Machine Learning, IA, Engenharia de Dados ou áreas afins.Vivência com pipelines distribuídos (Spark/PySpark) e dados estruturados em formatos modernos.Experiência em Machine LearningBenefícios:Vale Refeição;Vale Transporte;Assistência Médica;Assistência Odontológica;Vale Cultura;Totalpass;PLR;Day Off de Aniversário;Seguro de Vida e muito mais...Informações da Empresa:São Paulo - SPModelo de Trabalho HíbridoShow moreShow less",N/A,On-site/Hybrid,https://www.linkedin.com/jobs-guest/jobs/api/jobPosting/4418289390,2026-06-14
Cientista de Dados Sênior | Dados,Banco PAN,"São Paulo, São Paulo, Brazil",1 month ago,"Somos oPANÁgeis, flexíveis e criativos, exploramos possibilidades com disposição e desejo de fazer acontecer. Sempre prontos para encarar novos desafios, nutrimos líderes que, além de ter garra, são abertos e empáticos, veem na proximidade das relações, o elo entre cada um.Nossa missão, se faz cumprida quando transformamos a vida dos outros através dos nossos conhecimentos. Nossos pilares de cultura, reforçam nossa postura idealizadora e com desejo de fazer acontecer:Intensidade, Inconformismo, Eficiência, Espirito de equipe e Integridade.Somos seu aliado financeiro, trazendo soluções inteligentes que ajudam você a alcançar seus objetivos com segurança e confiança.Principais desafios:Atuar com times de CRM, B2C e Marketing, traduzindo dados em ação;Projetar, treinar e implementar modelos baseados em LLMsAlinhar e apresentar resultados para stakeholders técnicos e não técnicos.Criar e evoluir modelos preditivos voltados para o ciclo de vida do cliente (aquisição, upsell, retenção, margem);Apoiar decisões com base em análises técnicas e dados estruturados;Desenvolver soluções com impacto direto em resultado de negócio;Participar de todo o ciclo de vida do modelo: da prototipação ao deploy;Trabalhar com boas práticas de MLOps para garantir escalabilidade e monitoramento dos modelos.Quais as principais competências para a posição?Experiência com AWS (S3, Sagemaker, athena);Experiência com modelos preditivos e llmProgramação em Python e domínio de bibliotecas como Pandas, PySpark e Spark;Vivência com processos de deploy e automação de modelos preditivos;Familiaridade com práticas de MLOps (monitoramento, versionamento, pipeline de entrega);Visão de negócio orientada a resultados, com foco no cliente e na performance.Boa capacidade de comunicação e visão analítica.Desejável:Ter experiência com com redes neurais, modelos de imagem ou NLTer atuado com modelos de recomendaçãoModelo de atuação: Híbrido (4 dias presenciais no escritório e 1 dia de home office)Benefícios do PAN:Bônus / PLRVale RefeiçãoVale Alimentação13º de Vale AlimentaçãoConvênio Médico (internação em apartamento para titular e dependentes)Convênio Odonto/OrtodônticoAmbulatório Médico no escritórioTelemedicina Dr. Alper (Einstein Conecta) ilimitado.Seguro de VidaDescontos em mais de 10 mil farmácias4 Sessões de psicoterapia por mêsLicença familiar estendida (Responsável 6 meses e corresponsável 30 dias)Auxílio Creche / BabáAcomPANha (programa de acompanhamento para gestantes)Wellhub/TotalpassAuxílio tecnologia assistivas (reembolso de 85% para colaboradores com deficiência)Programas de desenvolvimentoSalão de beleza no escritórioPAE (Orientação Jurídica, Financeira, Psicológica e Social)Portal de descontos em diversos segmentos (Allya)Campanha de vacinação (colaborador e dependente)Facilitação no financiamento de veículos (Mediante análise)Cartão de crédito PAN com limite diferenciado (Mediante análise)Vale Transporte (desconto de apenas 4%)Assistência FuneralShow moreShow less",N/A,On-site/Hybrid,https://www.linkedin.com/jobs-guest/jobs/api/jobPosting/4410993829,2026-06-14
AI Trainer - Freelance Data Annotator,Toloka Annotators,"São Paulo, São Paulo, Brazil",2 weeks ago,"Please submit your resume in English and indicate your level of English.At Toloka, we connect smart, curious people from around the world with freelance online tasks that train and improve artificial intelligence.What We DoThe Toloka Annotators connects individuals with Generative AI projects from leading tech innovators. Our mission is to unlock the full potential of AI by involving real people from around the world in the development process.About The RoleAnnotation is what helps AI make sense of the world. As an annotator, you may be invited to take part in online projects such as rating AI-generated content, evaluating factual accuracy, or comparing responses - when projects are available.Responsibilities:Carefully review provided data (text, images, or videos)Label or classify content based on project guidelinesIdentify and flag factually incorrect, sensitive, inappropriate, or unclear materialImportant note:This is project-based work. Tasks are availableonly when projects are active. You may be invited to one or more projects depending on your profile and current opportunities.Each project has its own compensation level based on scope and expertise required. On this project, AI trainers earn up to$9 per hour equivalent.RequirementsBachelor's degree in any disciplineMinimum 1 year of experience in any professional roleAdvanced level of English (C1 or higher), both written and spokenLogical thinking, fact-checking and reasoning abilitiesStrong attention to detail and ability to understand and follow complex instructionsStrong communication skills, including the ability to ask clarifying questions when neededGenuine interest in technology and artificial intelligenceBenefitsWhy this freelance opportunity might be a great fit for you?Take part in a part-time, remote, freelance project that fits around your primary professional or academic commitmentsWork on advanced AI projects and gain valuable experience that enhances your portfolioInfluence how future AI models understand and communicate in your field of expertiseShow moreShow less",N/A,Remote,https://www.linkedin.com/jobs-guest/jobs/api/jobPosting/4418962387,2026-06-14
