title,company,location,posted,description,applicants,work_mode,link,data_coleta
Cientista de Dados Especialista - Vida e Ramos Elementares,Porto,"São Paulo, São Paulo, Brazil",1 hour ago,"Descrição da vagaNossa área é responsável por desenvolver, implementar e monitorar modelos de risco para Ramos Elementares e Vida. Este trabalho é essencial para a tomada de decisões estratégicas, garantindo a solidez e a competitividade dos nossos produtos.Responsabilidades e atribuiçõesConstruir, validar e monitorar modelos de risco;Colaborar de perto com a equipe de Pricing para dar suporte na precificação de produtos RE e Vida;Pesquisar e aplicar novas métricas e técnicas de modelagem, mantendo nossos métodos sempre atualizados e eficazes;Participar do ciclo de vida dos modelos, desde a concepção até a implementação, garantindo a correta aplicação e o sucesso das soluções;Ser referência para a equipe no ponto de vista técnico e de negócio.Requisitos e qualificaçõesPré requisitos:Formação superior em áreas como Estatística, Matemática, Engenharia, Ciência da Computação, Física, Economia ou áreas correlatasExperiência sólida em modelagem estatística e aprendizado de máquinaConhecimento com linguagens de programação para análise de dados como Python e SQLExcelentes habilidades de comunicação para apresentar ideias de forma clara e objetiva e interagir com diferentes públicosAtitude colaborativa e capacidade de trabalhar em equipe em um ambiente dinâmicoOrientado para solução, capaz de identificar e implementar caminhos práticos e eficientesDiferencial:Experiência com ferramentas de visualização de dados, conhecimento em GCP, ou experiência prévia em projetos de modelagem, familiaridade com produtos de ramos elementares e vida.Informações adicionaisBENEFÍCIOSModelo de trabalho:HíbridoVale Alimentação e Refeição Flexíveis;Plano de Saúde;Plano Odontológico;Wellhub e TotalPass;Academia Bio Ritmo exclusiva para Colaboradores:no Complexo Matriz;Participação nos Lucros - PLR;Programa de Ações: Porto em Ação:complementar à PLR até 2025;Quadras de Areia e Poliesportiva:no Complexo Matriz;Vale-Transporte;Serviços de Transporte de Vans;disponibilizadas nas principais estações de acesso à Porto (Luz, Barra Funda, Santa Cecília e Júlio Prestes);Licença Parental Estendida:até 40 dias para todas as configurações familiares;Licença Maternidade Estendidade 6 meses.;Ambulatório Médico com Especialidades:no Complexo Matriz e Barra Funda;Auxílio creche ou babá;Seguro de Vida;Previdência Privada - PortoPrev;Desconto em Produtos e Serviços;Bolsa de estudos: Reembolso para graduação, pós ou MBA;Corridas mensais:subsídio para as principais corridas de ruas de São PauloReembolso para idiomas (inglês ou espanhol);Teatro Porto:sessões exclusivas para Colaboradores;Biblioteca;Sala de descanso:no completo MatrizSalão de jogos:no complexo MatrizServiços de massagem e podologia:no completo MatrizLocal de trabalho:Local (Atuamos com modelos híbridos, que serão explorados no processo seletivo);Na Porto, Você Importa!A Porto é muito mais que uma seguradora: é um ecossistema gigante que utiliza tecnologia para criar soluções, através de quatro verticais de negócio:Porto Bank, Porto Saúde, Porto Seguro e Porto Serviço.A reputação e o reconhecimento conquistados ao longo de mais de 7 décadas reforçam o tamanho da Porto, uma empresa referência em negócios, feita para e por pessoas.Aqui, bate no peito de 13 mil colaboradores oorgulho de fazer parte de uma organização sólida e ética,que transforma sonhos em realidades fantásticaspara os nossos mais de 15,8 milhões de clientes. São mais de 101 sucursais e escritórios regionais em todo o Brasil.O aprendizado faz parte do nosso DNA, e aqui, você teráincentivos, ferramentas e gente boa para você aprender e crescer, a cada dia,um ambiente de acolhimento e segurança, onde cada um possa ser e se orgulhar de quem se é, promovendo um espaço de respeito evivendo de forma integral e com bem-estar, em uma empresa genuinamente humana.DIVERSIDADE & INCLUSÃO NA PORTOAqui na Porto, valorizamos a diversidade e acreditamos que um time plural é imprescindível para o desenvolvimento de todo o nosso negócio, da sociedade, e de cada pessoa, pois entendemos que cada indivíduo é único na construção de um ambiente mais inovador e inclusivo. Juntos, trabalhamos diariamente para construirmos um espaço seguro, livre e acolhedor, com mais pluralidade e respeito. Por isso,incentivamos fortemente a inscrição de mulheres, de pessoas negras e indígenas, de pessoas com deficiência e de pessoas LGBTQIA+em todas as nossas vagas.Show moreShow less",N/A,On-site/Hybrid,https://www.linkedin.com/jobs-guest/jobs/api/jobPosting/4390879512,2026-06-18
Data Scientist III - Estratégia de Cash,Banco Bradesco,"Osasco, São Paulo, Brazil",1 week ago,"Sobre o BradescoO Bradesco é um dos maiores grupos financeiros do Brasil, com uma história marcada pelo pioneirismo e inovação. Por meio da nossa carteira amplamente diversificada de produtos financeiros, serviços bancários e de seguros contribuímos com a realização das pessoas e o crescimento sustentável de empresas e sociedade. Venha fazer parte do nosso ecossistema financeiro e impactar a experiência de milhões de pessoas!No Bradesco valorizamos a diversidade em todas as suas formas. Por isso, as nossas vagas são abertas a todas as pessoas, independentemente de gênero, raça, orientação sexual, deficiência, idade ou qualquer outra característica.Saiba mais em https://banco.bradesco/html/classic/sobre/index.shtmResponsabilidades e atribuiçõesO que é o nosso time de Pricing?Somos responsáveis pela definição e gestão estratégica de preços e condições financeiras dos produtos do banco, equilibrando rentabilidade, competitividade e risco. Atuando com dados, modelagens e inteligência de mercado para apoiar decisões comerciais e impulsionar resultados sustentáveis em diversas linhas de negócio.Modelo de trabalho : Híbrido - 3x PresencialUnidade: Osasco/SPComo será seu dia a dia?Sendo Data Scientist III - Estratégia de Cash, atuará na gerência Cash Pricing e suas principais atividades serão:Desenvolver análises e estudos que suportem a definição e revisão da estratégia de precificação de Cash (PF e PJ)Traduzir guidelines estratégicos em parâmetros para input em modelos e definição de preço recomendadoRealizar análises aprofundadas sobre produtos de Cash, incluindo preços, condições comerciais e descontos, identificando tendências, oportunidades e potenciais riscosMonitorar a performance das estratégias implementadas, avaliando indicadores, identificando desvios e propondo otimizaçõesDefinir e apoiar evoluções tecnológicas necessárias para aprimorar os processos de precificação e garantir a captura de receitaGerar, estruturar e comunicar insights acionáveis para suportar decisões estratégicas de pricingRequisitos e QualificaçõesO que você precisa ter ou saber?Ensino superior completo em Economia, Engenharia, Estatística, Administração ou áreas correlatasSólida experiência com análise de dados, modelagem financeira e precificação, preferencialmente com foco em produtos de CashConhecimento do mercado e da regulamentação aplicável a CashConhecimento em estratégias de precificação, análise de rentabilidade e requisitos regulatóriosExcel avançado e SQLSerá um diferencial se você tiver:Experiência com PythonO que nós oferecemosNo Bradesco valorizamos a saúde e bem-estar, oferecendo um extenso portfólio de benefícios a todas nossas pessoas funcionárias:PLR ou Bônus: Conforme a elegibilidade de cargo*Convênio MédicoConvênio OdontológicoSeguro de VidaVale AlimentaçãoVale Refeição13º Cesta AlimentaçãoTotal PassVale Transporte (adesão opcional)Descontos em produtos e serviços em empresas parceirasPrevidência Privada (adesão opcional, com participação financeira da Organização Bradesco)Viva Bem Bradesco: programa de saúde, bem-estar e qualidade de vidaUnibrad: Universidade Corporativa BradescoIsenção de Tarifas: condições especiais em diversos produtos e serviçosAuxílio Creche ou BabáLicença Paternidade estendida de 20 diasLicença Maternidade de 180 dias, acompanhamento assistencial da gestação até o pós-partoShow moreShow less",N/A,On-site/Hybrid,https://www.linkedin.com/jobs-guest/jobs/api/jobPosting/4417404912,2026-06-18
Data Scientist III,Banco Bradesco,"Osasco, São Paulo, Brazil",6 days ago,"Sobre o BradescoO Bradesco é um dos maiores grupos financeiros do Brasil, com uma história marcada pelo pioneirismo e inovação. Por meio da nossa carteira amplamente diversificada de produtos financeiros, serviços bancários e de seguros contribuímos com a realização das pessoas e o crescimento sustentável de empresas e sociedade. Venha fazer parte do nosso ecossistema financeiro e impactar a experiência de milhões de pessoas!No Bradesco valorizamos a diversidade em todas as suas formas. Por isso, as nossas vagas são abertas a todas as pessoas, independentemente de gênero, raça, orientação sexual, deficiência, idade ou qualquer outra característica.Saiba mais em https://banco.bradesco/html/classic/sobre/index.shtmResponsabilidades e atribuiçõesO que é o nosso time de Avaliação Independente de Modelos (AVIM) ?Em se tratando de simplificações da realidade, os modelos são sujeitos a riscos, que podem desencadear perdas relacionadas a decisões baseadas em estimativas incorretas ou obsoletas ou, ainda, uso inapropriado. Para identificar e mitigar esses riscos, nós da Área de Avaliação Independente de Modelos (AVIM) atuamos efetivamente no fortalecimento do uso de modelos, realizando ações de aculturamento e disseminando as boas práticas em modelagemModelo de trabalho : Híbrido - 2x PresencialUnidade: Osasco - SPComo será seu dia a dia?Sendo Data Scientist III, atuará na gerência Analytics e suas principais atividades serão:Construção de dashboards executivos e operacionais;Manipulação e cruzamentos de dados em diferentes plataformas;Interpretação dos dados;Traduzir problemas de negócio em problemas analíticos;Sustentação e manutenção da plataforma watsonx.governance da IBM (Open Pages e Open Scale).Requisitos e QualificaçõesO que você precisa ter ou saber?Superior Completo;Conhecimento na plataforma watsonx.governance da IBM (Open Pages e Open Scale);Conhecimento em DatabricksConhecimento em Power BI;Conhecimento em Cognos;Experiência em riscos de instituições financeiras.Será um diferencial se você tiver:InglêsO que nós oferecemosNo Bradesco valorizamos a saúde e bem-estar, oferecendo um extenso portfólio de benefícios a todas nossas pessoas funcionárias:PLR ou Bônus: Conforme a elegibilidade de cargo*Convênio MédicoConvênio OdontológicoSeguro de VidaVale AlimentaçãoVale Refeição13º Cesta AlimentaçãoTotal PassVale Transporte (adesão opcional)Descontos em produtos e serviços em empresas parceirasPrevidência Privada (adesão opcional, com participação financeira da Organização Bradesco)Viva Bem Bradesco: programa de saúde, bem-estar e qualidade de vidaUnibrad: Universidade Corporativa BradescoIsenção de Tarifas: condições especiais em diversos produtos e serviçosAuxílio Creche ou BabáLicença Paternidade estendida de 20 diasLicença Maternidade de 180 dias, acompanhamento assistencial da gestação até o pós-partoShow moreShow less",N/A,On-site/Hybrid,https://www.linkedin.com/jobs-guest/jobs/api/jobPosting/4417492963,2026-06-18
Especialista Cientista de Dados I,PagBank,"São Paulo, São Paulo, Brazil",2 days ago,"Descrição da vagaQuando você pensa em carreira, o que vem à sua mente? Propósito? Colaboração? Ser protagonista para fazer a diferença? No PagBank temos tudo isso e muito mais. 💛Estamos em busca de pessoas que vistam a camisa com orgulho. Gente com vontade de facilitar a vida financeira das pessoas e impulsionar negócios!Tá a fim de uma carreira que rende mais?Confira essa oportunidade e #VemProPags!Responsabilidades e atribuiçõesResponsável por liderar e evoluir soluções avançadas de Analytics e Machine Learning aplicadas a risco (crédito, fraude, PLD e cobrança), conectando dados e modelos à estratégia do negócio, com forte atuação em modelagem, criação de variáveis e tomada de decisão.Pesquisar e inovar novas abordagens e metodologias.Atuar como referência técnica em modelagem preditiva e engenharia de dados.Participar ativamente em conferências e eventos técnicos.Liderar tecnicamente projetos estratégicos de modelagem e Advanced Analytics.Desenvolver variáveis e modelos preditivos avançados (credit scoring, fraude, cobrança, etc.).Construir frameworks e boas práticas para desenvolvimento e monitoramento de variáveis e modelos.Atuar próximo a stakeholders de negócio para traduzir problemas em soluções analíticas.Contribuir em estudos de Negócio, testes de hipóteses e iniciativas de IA/ML.Requisitos e qualificaçõesDomínio avançado em Python, SQL e Spark. Somando a conhecimentos de arquitetura de código, paralelização, otimização de performance e automações.Experiência com Arquitetura, e esteira de machine learning em larga escala (MLOps, Eng. De dados aplicado a ML e feature store).Domínio avançado em criação de book de target no universo de riscos e criação de book de covariáveis (feature Engineer e feature Store)Experiência avançada e sólida com Machine Learning aplicado a riscos.Domínio de técnicas avançadas de deeplearning, machine learning e IA.Conhecimento em Github.Expertise em estratégias de mitigação de risco e previsões de comportamento de clientes a longo prazo.Informações adicionaisPara se destacar nesta posição seria legal se você também tivesse:Experiência com riscos ou áreas correlatas.Olá, somos o PagBank!Talvez você nos conheça por maquininhas ou comerciais que ficam na memória, mas somos muito mais!Todos os dias desenvolvemos produtos e soluções inspiradas pelo nosso propósito: facilitar a vida financeira das pessoas e negócios.Trabalhamos para transformar a forma como as pessoas lidam com dinheiro abrindo novas possibilidades para alcançarem seus sonhos.Como fazemos tudo isso?💛Com genteSomos um time que joga junto! Aqui valorizamos todas as diversidades, seja de raça/etnia, gênero, idade, origem, pessoa com deficiência, orientação afetivo-sexual, constituição familiar e estética.💛Com tecnologiaO espírito disruptivo e inovador está no nosso DNA: somos parte do Grupo UOL, empresa 100% brasileira, foi pioneira na internet e transforma a vida das pessoas desde 1996.💛Com uma só culturaTemos uma cultura forte e única, capaz de nos levar além, para continuarmos crescendo e perpetuando o nosso negócio.Somos um dos maiores bancos digitais do país e uma das fintechs mais rentáveis do segmento e certificados como um Excelente Lugar para Trabalhar pela Great Place to Work.Para vivenciar tudo isso, você terá um pacote completo de benefícios que fazem toda a diferença:Vale-alimentação e/ou refeição.Plano de saúde e odontológico.Seguro de vida.Parceria com TotalPass e ZenKlub.Licença maternidade e paternidade estendidas.Auxílio-creche.Descontos de até 50% em pós-graduação e MBA de grandes instituições, como FIA, FAAP e PUCRS.E tem mais:No dress code: o importante é você usar o que te faz bem.#TáDeParabéns: Day off no aniversário.Baby Gift: presente para recém-nascidos.Tá a fim de uma carreira que rende mais?Vem pro nosso time imbatível!#VemProPags.Show moreShow less",N/A,On-site/Hybrid,https://www.linkedin.com/jobs-guest/jobs/api/jobPosting/4418200168,2026-06-18
Data Science Manager,Banco Bradesco,"Osasco, São Paulo, Brazil",5 days ago,"Sobre o BradescoO Bradesco é um dos maiores grupos financeiros do Brasil, com uma história marcada pelo pioneirismo e inovação. Por meio da nossa carteira amplamente diversificada de produtos financeiros, serviços bancários e de seguros contribuímos com a realização das pessoas e o crescimento sustentável de empresas e sociedade. Venha fazer parte do nosso ecossistema financeiro e impactar a experiência de milhões de pessoas!No Bradesco valorizamos a diversidade em todas as suas formas. Por isso, as nossas vagas são abertas a todas as pessoas, independentemente de gênero, raça, orientação sexual, deficiência, idade ou qualquer outra característica.Saiba mais em https://banco.bradesco/html/classic/sobre/index.shtmResponsabilidades e atribuiçõesO que é o nosso time de Crédito?Temos como missão garantir uma gestão eficiente na concessão e manutenção de crédito, que assegure rentabilidade e o crescimento com solidez dos ativos da Organização.Modelo de trabalho : Híbrido - 2x PresencialUnidade: São Paulo - OsascoComo será seu dia a dia?Sendo Data Science Manager, atuará na gerência Crédito e suas principais atividades serão:Modelagem específica para provisionamento (resolução 4966, PD/EAD/LGD);Identificação de oportunidade nas aplicações dos modelos;Identificação de melhorias em modelos existentes;Análise de dados;Alinhamento estratégico.Requisitos e QualificaçõesO que você precisa ter ou saber?É necessário e mandatório o conhecimento em provisionamento/Resolução 4966.Será um diferencial se você tiver:Conhecimentos em Python / Databricks.O que nós oferecemosNo Bradesco valorizamos a saúde e bem-estar, oferecendo um extenso portfólio de benefícios a todas nossas pessoas funcionárias:PLR ou Bônus: Conforme a elegibilidade de cargo*Convênio MédicoConvênio OdontológicoSeguro de VidaVale AlimentaçãoVale Refeição13º Cesta AlimentaçãoTotal PassVale Transporte (adesão opcional)Descontos em produtos e serviços em empresas parceirasPrevidência Privada (adesão opcional, com participação financeira da Organização Bradesco)Viva Bem Bradesco: programa de saúde, bem-estar e qualidade de vidaUnibrad: Universidade Corporativa BradescoIsenção de Tarifas: condições especiais em diversos produtos e serviçosAuxílio Creche ou BabáLicença Paternidade estendida de 20 diasLicença Maternidade de 180 dias, acompanhamento assistencial da gestação até o pós-partoShow moreShow less",N/A,On-site/Hybrid,https://www.linkedin.com/jobs-guest/jobs/api/jobPosting/4418176401,2026-06-18
Cientista de Dados,OXXO Brasil,"São Paulo, São Paulo, Brazil",2 weeks ago,"Estamos construindo um dos maiores ecossistemas de varejo de proximidade do Brasil. Desde 2020, quando abrimos nossa primeira loja, aOXXO Brasilcresce de forma acelerada no varejo de proximidade, sempre acreditando que cada nova esquina é uma oportunidade de estar mais próximo, salvar o dia e fazer parte da rotina das pessoas.Fazemos parte da divisão FEMSA Proximidade, Américas e Mobilidade e nossa cultura marcada pelo“Sempre Próximo”se reflete em comportamentos como disciplina, foco nas pessoas e desenvolvimento de talentos.Se você valoriza melhoria contínua, tem foco no cliente e quer crescer em um negócio em constante evolução, aqui é o seu lugar.Venha fazer parte da OXXO Brasil e construa com a gente um futuro mais próximo, simples e humano.Buscamos uma pessoa Cientista de Dados para atuar na construção de modelos analíticos e preditivos, apoiando decisões estratégicas do negócio. Essa pessoa será responsável por explorar dados, identificar padrões, desenvolver modelos estatísticos e de machine learning, além de traduzir resultados em insights acionáveis para diferentes áreas.Responsabilidades e atribuiçõesDesenvolver e implementar modelos de Machine Learning aplicados a problemas reais de negócio;Explorar grandes volumes de dados para identificar padrões, tendências e oportunidades;Conduzir análises avançadas para direcionar decisões estratégicas;Comunicar resultados e insights por meio de visualizações claras e objetivas;Atuar em parceria com áreas de negócio, traduzindo problemas em soluções analíticas de impacto.Requisitos e qualificaçõesEnsino superior completo;Experiência sólida em modelagem estatística e técnicas de Machine Learning,Manipulação de grandes volumes de dados estruturados e não estruturados;Vivência com Python, SQL, Spark e ferramentas de processamento e análise de dados;Experiência com deploy de modelos e acompanhamento em produção;Experiência com modelos de classificação, regressão e séries temporais;Informações adicionaisBenefícios:Vale transporte ou estacionamento no local;Vale Refeição;Assistência Médica;Assistência Odontológica;Seguro de Vida;Auxílio creche ou acompanhante;Cooperativa de crédito – Barracred;Clube de descontos – Allya;Previdência Privada;Convênio academia – Gympass;Sistema de trabalho híbrido - presencial e à distância.Show moreShow less",N/A,On-site/Hybrid,https://www.linkedin.com/jobs-guest/jobs/api/jobPosting/4423327683,2026-06-18
Cientista de Dados Especialista - Vida e Ramos Elementares,Porto,"São Paulo, São Paulo, Brazil",16 hours ago,"Nossa área é responsável por desenvolver, implementar e monitorar modelos de risco para Ramos Elementares e Vida. Este trabalho é essencial para a tomada de decisões estratégicas, garantindo a solidez e a competitividade dos nossos produtos.Responsabilidades e atribuiçõesConstruir, validar e monitorar modelos de risco;Colaborar de perto com a equipe de Pricing para dar suporte na precificação de produtos RE e Vida;Pesquisar e aplicar novas métricas e técnicas de modelagem, mantendo nossos métodos sempre atualizados e eficazes;Participar do ciclo de vida dos modelos, desde a concepção até a implementação, garantindo a correta aplicação e o sucesso das soluções;Ser referência para a equipe no ponto de vista técnico e de negócio.Requisitos e qualificaçõesPré requisitos:Formação superior em áreas como Estatística, Matemática, Engenharia, Ciência da Computação, Física, Economia ou áreas correlatasExperiência sólida em modelagem estatística e aprendizado de máquinaConhecimento com linguagens de programação para análise de dados como Python e SQLExcelentes habilidades de comunicação para apresentar ideias de forma clara e objetiva e interagir com diferentes públicosAtitude colaborativa e capacidade de trabalhar em equipe em um ambiente dinâmicoOrientado para solução, capaz de identificar e implementar caminhos práticos e eficientesDiferencial:Experiência com ferramentas de visualização de dados, conhecimento em GCP, ou experiência prévia em projetos de modelagem, familiaridade com produtos de ramos elementares e vida.Informações adicionaisBENEFÍCIOSModelo de trabalho:HíbridoVale Alimentação e Refeição Flexíveis;Plano de Saúde;Plano Odontológico;Wellhub e TotalPass;Academia Bio Ritmo exclusiva para Colaboradores:no Complexo Matriz;Participação nos Lucros - PLR;Programa de Ações: Porto em Ação:complementar à PLR até 2025;Quadras de Areia e Poliesportiva:no Complexo Matriz;Vale-Transporte;Serviços de Transporte de Vans;disponibilizadas nas principais estações de acesso à Porto (Luz, Barra Funda, Santa Cecília e Júlio Prestes);Licença Parental Estendida:até 40 dias para todas as configurações familiares;Licença Maternidade Estendidade 6 meses.;Ambulatório Médico com Especialidades:no Complexo Matriz e Barra Funda;Auxílio creche ou babá;Seguro de Vida;Previdência Privada - PortoPrev;Desconto em Produtos e Serviços;Bolsa de estudos: Reembolso para graduação, pós ou MBA;Corridas mensais:subsídio para as principais corridas de ruas de São PauloReembolso para idiomas (inglês ou espanhol);Teatro Porto:sessões exclusivas para Colaboradores;Biblioteca;Sala de descanso:no completo MatrizSalão de jogos:no complexo MatrizServiços de massagem e podologia:no completo MatrizLocal de trabalho:Local (Atuamos com modelos híbridos, que serão explorados no processo seletivo);Show moreShow less",N/A,On-site/Hybrid,https://www.linkedin.com/jobs-guest/jobs/api/jobPosting/4427802359,2026-06-18
