title,company,location,posted,description,applicants,work_mode,link,data_coleta
Data Scientist,Zicasso,"São Paulo, São Paulo, Brazil",1 week ago,"Company OverviewEstablished in 2008, Zicasso is the most-reviewed and highest-rated luxury travel company, specializing in immersive custom tours, vacations, and safaris. Our Zicasso travel specialists are the world's top 2% of boutique tour operators and travel agents, pre-vetted and handpicked to compete in creating itineraries tailored to each of our travelers' unique preferences. Joining Zicasso, you'll play a key role in bringing our travelers' dreams to life—pushing the boundaries of what's possible with luxury travel experiences.As a member of our team, you'll be part of a company recognized for its strong brand reputation among discerning travelers. Our authority in the luxury travel industry is consistently affirmed through features in top media outlets, including The New York Times, The Wall Street Journal, BBC, Forbes, CNN, and Condé Nast Traveler, to name a few. See our press coverage here.We are a fully remote company spanning five continents, and we foster a dynamic, progressive global work environment that values creativity, initiative, and continuous learning. We're seeking passionate, data-driven individuals who thrive in a high-performance environment and are eager to contribute to our innovative company culture, underpinned by a consistent pursuit of excellence, integrity, and teamwork.Our global team comes together biannually for international retreats and summits. These are typically held for a week at a new location each time, providing opportunities to share ideas, collaborate in person, and strengthen our culture, all while learning firsthand about the destinations we serve. These events embody our commitment to both professional growth and the transformative power of travel.Join us in shaping the future of luxury travel while working towards our vision—creating a more connected humanity through travel. To learn more, visit https://www.zicasso.com/careers.The RoleAs a Data Scientist at Zicasso, you will have the opportunity to leverage your expertise in data analysis and modeling to extract valuable insights that will drive the company's strategic decision-making. You will work closely with cross-functional teams to develop and implement data-driven solutions that improve operations, enhance customer experiences, and optimize business performance.This is aninternational, fully-remote, freelance contractorposition, working from home, at a location outside of the United States. We are particularly seeking candidates who are based in Latin America.There is flexibility in your work hours but we expect that you will generallymaximize your overlap with California hours(eg. until 3pm Pacific Time Zone).The work will all be conducted in English.Key ResponsibilitiesAnalyze large datasets to uncover trends, patterns, and insights that drive strategic business decisionsDevelop and refine predictive models for customer segmentation, pricing optimization, and demand forecastingBuild and enhance recommendation systems to personalize travel experiences and increase customer engagementDesign, implement, and analyze A/B tests and other experiments to evaluate the impact of product and operational initiativesAnalyze user behavior across the entire customer journey to identify friction points, optimize conversion funnels, and uncover opportunities for growthProvide actionable data insights to support targeted marketing campaigns, customer retention strategies, and personalized communicationPartner with product, marketing, and customer experience teams to uncover opportunities for conversion and retention improvementCreate and maintain data pipelines, dashboards, and automated reporting systems using best-in-class toolsApply advanced statistical methods and machine learning techniques to solve complex business problems and improve operational efficiencyCollaborate with data engineering to ensure data quality, consistency, and scalability across systemsDocument methodologies and communicate findings clearly to both technical and non-technical stakeholdersContribute to fostering a data-driven culture by sharing insights, tools, and best practices across teamsRequired ExperienceBachelor's degree in Statistics, Mathematics, Computer Science, or a related field. Master or Ph.D. preferredProven experience as a Data Scientist in a fast-paced and data-driven environmentExpertise in statistical analysis, machine learning, and predictive modeling techniquesProficiency in programming languages such as Python or RStrong SQL skills and experience working with large-scale datasetsExperience with data visualization tools such as Tableau or Power BIExcellent problem-solving skills and ability to translate business requirements into analytical solutionsStrong communication skills and ability to present complex findings to both technical and non-technical stakeholdersAbility to thrive in a fully remote environment, working independently while maintaining close collaboration with cross-functional teamsMinimum of 3 years of experience embedded within or consulting for a marketing department. Ability to translate complex statistical findings into actionable insights for non-technical stakeholdersDeep technical expertise in navigating and extracting data from the Google ecosystem (Google Ads, GA4, and Search Console). Proven track record of using BigQuery to join disparate marketing datasets for cross-channel analysis and attribution modelingWhat We OfferRemote work from your home base and flexible hours that allow you to enjoy a great work-life balanceInnovative, fast-paced and collaborative culture that values diverse voices and opinionsLearning and development annual budgetTwo company-sponsored business trips each year at international destinations we serve!All applications should be submitted in English.Show moreShow less",N/A,Remote,https://www.linkedin.com/jobs-guest/jobs/api/jobPosting/4402013062,2026-04-23
Data Scientist Spec IV,Santander Brasil,"São Paulo, São Paulo, Brazil",1 week ago,"Country: BrazilAo integrar o time deRisk Models & Analytics PJ do Santander, você atuará em uma área responsável pelos modelos e ratings para o segmento de Pessoa Jurídica da organização, com papel central na evolução da agenda analítica de risco de crédito. Buscamos um profissional com forte profundidade técnica e atuação hands-on, capaz de liderar tecnicamente frentes de maior complexidade, estruturar abordagens metodológicas robustas e contribuir de forma decisiva para a evolução dos modelos, indicadores e estratégias de crédito, sempre em aderência aos requerimentos regulatórios e às necessidades do negócio.Aqui, sua atuação será:Liderar tecnicamente o desenvolvimento, evolução e recalibração dos modelos estatísticos e de machine learning aplicados a risco de crédito (credit scoring, behaviour scoring, ratings, entre outros) para concessão e manutenção de crédito.Definir e propor abordagens metodológicas mais complexas, contrapondo com o cenário atual (as is) e buscando ganhos de performance, robustez e eficiência no ciclo de desenvolvimento.Estruturar soluções que combinem modelagem analítica, automação e uso aplicado de inteligência artificial generativa, com foco na transformação de processos críticos da área e no aumento de produtividade do time.Atuar como referência técnica para cientistas de dados do time e influenciar tecnicamente decisões relevantes da área.Interagir de forma próxima com stakeholders de Riscos, Política, Negócios, Dados e Tecnologia, traduzindo necessidades estratégicas em soluções analíticas sustentáveis para a companhia.Conectar-se com times do Santander Global para benchmarking metodológico, acompanhamento de projetos e incorporação de novas abordagens e melhores práticas.Acompanhar a performance e estabilidade dos modelos em produção, identificando deteriorações, desvios, drift e oportunidades de evolução ou recalibração.Formação e IdiomasGraduação completa em Estatística, Ciência da Computação, Física, Matemática Aplicada, Engenharias e correlatas. Preferencialmente graduação em cursos de exatas.Pós-graduação ou especialização em Data Science, Risco de Crédito, Gerenciamento de Projetos são considerados desejáveis.Mestrado e/ou Doutorado são diferenciais.Inglês ou Espanhol são fundamentais em contatos com equipes globais.Hard SkillsObrigatórioSólida experiência em estatística aplicada, modelagem preditiva e machine learning.Domínio de SQL e Python, com experiência em manipulação e processamento de grandes volumes de dados.Capacidade de estruturar e sustentar decisões metodológicas com autonomia e profundidade técnica.Vivência em ambientes analíticos complexos, com forte interface entre negócio e técnica.Experiência com monitoramento, validação, estabilidade e performance de modelos em produçãoDesejável:Experiência em modelagem de crédito PF ou PJ.Experiência com ambiente cloud: Azure, GCP, entre outros.Experiência com Databricks.Soft Skills:Habilidade de desafiar hipóteses e modelo de trabalho atual com embasamento técnico.Autonomia e postura propositiva frente a temas estratégicos.Comunicação clara e capacidade de traduzir temas técnicos em recomendações claras para públicos de negócio e liderança.Atuar como referência técnica dentro do time de Risk Models & Analytics.Capacidade de equilibrar rigor técnico, pragmatismo e viabilidade prática na tomada de decisão.Show moreShow less",N/A,On-site/Hybrid,https://www.linkedin.com/jobs-guest/jobs/api/jobPosting/4400654652,2026-04-23
Especialista Cientista de Dados (Foco: IA Generativa),Minerva Foods,"São Paulo, São Paulo, Brazil",3 weeks ago,"A Minerva Foods é líder na exportação de carne bovina na América do Sul e atua no segmento de carnes processadas, comercializando seus produtos em mais de 100 países. Além do Brasil, a Minerva Foods está presente na Argentina, Colômbia, Paraguai, Uruguai e possui plantas especializadas em ovinos na Austrália e Chile.A área de Business Analytics tem como propósito resolver problemas de negócio complexos. Em outras palavras, a equipe de Business Analytics utiliza técnicas de estatística, algoritmos, IA, métodos estocásticos e de otimização para modelar dados internos e externos para gerar informações valiosas que possam conduzir ações de melhoria de negócios.Estamos em busca de um candidato que traga um pensamento estruturado, um viés para a ação (hands-on), com experiência em projetos de agentes e LLM (Generative AI), habilidades de comunicação e um espírito de colaboração.Responsabilidades e atribuições:Desenvolver soluções eagentesbaseadas emmodelos de linguagem natural (LLMs)para aplicação em produtos, processos e serviços da empresa;Realizarfine-tuning e customização de modelos pré-treinados;Projetar e implementarpipelines de dados para treinamento e avaliação de modelos, incluindo pré-processamento, tokenização e curadoria de datasets;Integrar modelos deIA generativa a sistemas corporativos, APIse fluxos de negócio, promovendo automação e geração de valor;Explorar e aplicartécnicas de RAG, embeddings e arquiteturas híbridas quando necessário;Explorar e aplicar técnicas deengenharia de prompt;Monitorar e avaliar o desempenho de modelos com métricas adequadas;Propor melhorias contínuas nos sistemas, buscando inovações e melhores práticas em desenvolvimento;Atuar junto a times de desenvolvimento, dados e produto para garantir soluções robustas, seguras e alinhadas às necessidades do negócio;Documentar processos, experimentos e boas práticas, contribuindo para a evolução do conhecimento técnico da área.Requisitos e qualificações:Graduação completa emCiência da Computação,Engenharia da Computação,Sistemas de Informação,Matemática,Estatísticaou áreas correlatas;Pós-graduação, MBA ou mestrado emInteligência Artificial,Machine Learning,Ciência de DadosouComputação Cognitiva(desejável);Conhecimento demodelos de linguagem, seus limites e capacidades;Proficiência na linguagem Python;Familiaridade comciclo de vida de modelos de IA: desde o desenvolvimento até o deploy e monitoramento;Proficiência com ferramentas de versionamento;Boa comunicação para explicar abordagens técnicas a públicos não técnicos;Proatividade, curiosidade e aprendizado contínuo.Informações adicionais:Experiência com o desenvolvimento de API’s REST em Python (Flask, Django, FastAPI etc);Conhecimento em aplicações web, integrações, APIs e webservices;Conhecimento em integrações com whatsapp;Experiência com tecnologias em nuvem (preferencialmente Azure) e on-premises;Experiência de no mínimo 3 anos atuando em projetos de IA aplicados a casos reais (não específico generativa);Conhecimento em orquestração de containers Docker;Inglês - Nível Avançado;Espanhol - Nível Intermediário.Show moreShow less",N/A,On-site/Hybrid,https://www.linkedin.com/jobs-guest/jobs/api/jobPosting/4356437426,2026-04-23
Data Scientist – People Analytics & Data Quality,Thermo Fisher Scientific,"São Paulo, São Paulo, Brazil",2 weeks ago,"Work ScheduleStandard (Mon-Fri)Environmental ConditionsOfficePosition SummaryThe Data Scientist – People Analytics & Data Quality is responsible for ensuring accurate, consistent, and well-governed personnel data and transforming it into insights, dashboards, and scalable analytics solutions. The role supports HR Business Partners (HRBPs) and business leaders by enabling data-driven workforce decisions through automation, advanced analytics, and AI-enabled use cases.This role partners closely with HR, IT, and People Analytics stakeholders and plays a key role in improving trust in HR data while expanding analytical maturity across the organization.Scope & ImpactLeads complex, cross-functional people analytics initiatives with broad business impact.Owns data quality strategy, advanced analytics solutions, and automation design for multiple HR domains.Acts as a trusted analytics advisor to senior HR and business stakeholders.Key ResponsibilitiesOwn and drive the quality, consistency, and governance of personnel data across HR systems and analytics platforms.Define and implement data quality frameworks, validation rules, and reconciliation processes to ensure trusted HR data.Design, maintain, and evolve scalable workforce data models integrating multiple HR data sources (e.g., HCM, ATS, LMS).Lead the development of advanced dashboards and self-service analytics solutions for HRBPs and business leaders.Translate complex and ambiguous business and workforce questions into structured analytical approaches and actionable insights.Identify, design, and implement automation solutions to streamline HR reporting, data preparation, and recurring analyses.Lead AI-enabled and advanced analytics use cases (e.g., attrition prediction, workforce forecasting, skills and mobility insights).Act as a trusted analytics advisor to senior HR and business leaders, influencing decision-making through data storytelling.Partner with HR, HRIS, IT, and data governance teams to align analytics solutions with enterprise data architecture and standards.Mentor and provide technical guidance to junior data scientists or analysts within People Analytics.Ensure responsible, ethical, and compliant use of employee data in line with privacy, security, and regulatory requirements.Continuously improve people analytics capabilities, standards, and best practices across the organization.Knowledge, Skills & ExperienceBachelor’s or Master’s degree in a quantitative field.Typically 4+ years of experience in data science, advanced analytics, or people analytics.Advanced proficiency in SQL and Python/R, including automation and modeling.Strong experience with BI tools and data visualization best practices.Proven experience applying machine learning or advanced statistical techniques.Deep understanding of HR data, governance, and employee data privacy.Strong influencing and stakeholder management skills.Critical Success FactorsHigh trust in HR data through strong quality and governance practices.Scalable, automated analytics that reduce manual effort.Clear, actionable insights that support workforce decisions.Effective collaboration across HR, IT, and business teams.Alignment with Thermo Fisher’s values: Integrity, Intensity, Innovation, and Involvement.Show moreShow less",N/A,On-site/Hybrid,https://www.linkedin.com/jobs-guest/jobs/api/jobPosting/4397883941,2026-04-23
Analista Jr. de Excelência Operacional | Engenharia de Processos,Shopee,"São Paulo, São Paulo, Brazil",2 weeks ago,"About The TeamSobre a ShôAqui na Shô, acreditamos que cada membro de nossa equipe é fundamental para o nosso sucesso, e que diversidade de perspectivas e vivências são essenciais para movimentar nosso negócio e impulsionar o nosso propósito de mudar o mundo para melhor.Fazer parte do nosso time é a oportunidade de se desenvolver dentro de uma cultura de muita agilidade. Se você ama assumir grandes responsabilidades e fazer o que nunca foi feito, a Shô é seu lugar. Aqui você terá grandes desafios, trabalhará em colaboração com um time diverso e contribuirá para o futuro do e-commerce no Brasil, criamos impacto positivo na vida de milhões de pessoas.Job DescriptionSua missãoApoiar análises de processos, estudos de capacidade e modelagens básicas, contribuindo para diagnósticos e melhorias operacionais. Atuar junto ao time para gerar informações confiáveis que sustentem decisões e planejamento de recursos.Como será seu dia a diaApoiar análises de processos e estudos básicos de capacidade, coletando dados e organizando insumos.Construir e atualizar modelos simples de capacidade e produtividade sob orientação.Participar de diagnósticos operacionais, mapeando restrições e oportunidades de melhoria.Preparar relatórios, planilhas e materiais de acompanhamento.Atuar como suporte no relacionamento com times de network design, automação, operação, e outras áreas.Acompanhar simulações e cenários, garantindo atualização dos dados.Contribuir em tarefas hands‑on nas operações durante medições ou validações.Documentar processos, hipóteses, premissas e resultados das análises.Auxiliar em apresentações internas, consolidando informações.Apoiar a execução de melhorias definidas pelo time.RequirementsO que você vai precisar para assumir o desafioEnsino Superior completo em Engenharias, Administração ou áreas correlatas;Conhecimento avançado em Pacote Office; Google Workspace é um diferencial;Conhecimento em ferramentas de dados (Power BI, DataStudio);Inglês básico;Desejável: SQL Básico.BenefíciosAssistência médica e odontológica, estendendo-se aos dependentes;Parceria com Gympass e TotalPass;Vale Refeição/Alimentação flexível;Vale Transporte, Vale Mobilidade ou Estacionamento no local;Benefício flexível;Zenklub;Bônus anual discricionário atrelado à performance.Diversidade e InclusãoValorizamos talentos diversos e incentivamos a candidatura de pessoas de todas as origens, sem distinção de raça, gênero, orientação sexual, deficiência, idade ou qualquer outra característica. Trabalhamos continuamente para promover um ambiente acolhedor, com iniciativas e grupos de afinidade que fortalecem uma cultura cada vez mais inclusiva.Queremos ser o lugar onde você possa ser quem é, se desenvolver com autonomia e contribuir para transformar o futuro ao nosso lado. É a partir dessa pluralidade que geramos impacto e construímos o futuro do e-commerce no Brasil.O QUE TE FAZ ÚNICO, NOS FAZ MELHORES!E NOSSO IMPACTO DEIXA MARCA!N-A30Show moreShow less",N/A,On-site/Hybrid,https://www.linkedin.com/jobs-guest/jobs/api/jobPosting/4374088492,2026-04-23
Data Scientist - Fluent English,Artefact,Greater São Paulo Area,1 day ago,"The current vacancy is for the Brazilian office and we work in a Free Office model.Who We AreAt Artefact LatAm, we believe in and live a culture based on empathy!A healthy work environment is a place where all voices are heard, respected, and valued.Our commitment is to build a more diverse and inclusive environment, because empathy is for everyone, regardless of ethnicity, color, gender, sexual orientation, gender identity, disability, or religious belief.We want incredible minds and hearts to join us! Come be Artefact!What You Will Be DoingYou will join our Data and Consulting team, which helps clients transform and improve their data strategy by applying advanced analytics to generate insights that create business value from big data and artificial intelligence.Innovate. You will work with your team, consisting of consultants, data scientists, and engineers, to identify client needs and define innovative solutions.Learn and Share. You will work in a collaborative team that promotes knowledge sharing. You will learn from others, share knowledge, and stay up to date with industry news/updatesDevelop. You will be involved in the solution from start to finish. With the help of senior scientists, you will manage the design and implementation, as well as optimize performance and scalability.Work across the entire project value chain (data collection and processing, exploratory data analysis, application of machine learning models, model production)Demystify technical terms or solutions for more business-oriented profiles, can work in a team with very diverse profilesPrioritize your tasks, respect deadlines, and raise your hand in case of risks or problemsWhat We Are Looking ForHaving completed an undergraduate course in data science, machine learning, mathematics, computer science, statistics, engineering, economics, or a related field.Desirable a first knowledge in statistics and programming (Python/R).Curiosity: you are always looking for innovative solutions for your clients. You are involved in the entire value chain.Collaboration: knowledge sharing is essential for you and you actively participate in the dissemination of information within Artefact.Entrepreneurship: you bring solutions, new ideas, innovations.Fluent English: You are comfortable communicating in English, as it is essential for working in our international environmentWhat We OfferMeal/Transportation Allowance (VR/VT)Free Office (work from home or anywhere you want!)GympassInsurance: Life, Health, and DentalBi-monthly Meetings (our “Get Together” where we meet to be together, with workshops, lectures, training, and a happy hour!)Woba (you can book coworking spaces anywhere you want!)Semi-annual evaluations (with opportunities for promotion)Why you should join usArtefact is the place to be: come and build the future of marketingProgress: every day offers new challenges and new opportunities to learnCulture: join the best team you could ever imagineEntrepreneurship: you will be joining a team of driven entrepreneurs. We won’t give up until we make a huge dent in this industry!Come join us!Show moreShow less",N/A,On-site/Hybrid,https://www.linkedin.com/jobs-guest/jobs/api/jobPosting/4404826291,2026-04-23
Visagio Talentos - Estágio: Data Science e IA Generativa SP,Visagio,"São Paulo, São Paulo, Brazil",2 days ago,"Destinado a universitários dos cursos de Engenharias, Administração, Economia, Estatística, Matemática, Ciência da Computação e Sistemas de Informação, com foco de atuação em projetos envolvendo Ciência de Dados e IA Generativa (Inteligência Artificial, Machine Learning, NLP, IA Generativa, Otimização, Simulação, entre outros). Você trabalhará com um time multidisciplinar, direcionado ao desenvolvimento de análises e à implantação de soluções baseadas em dados para geração de valor para nossos clientes.Responsabilidades e atribuiçõesIdentificar oportunidades de melhoria em áreas do negócio, propondo soluções baseadas em dados;Realizar análises de dados para apoiar diagnósticos e tomadas de decisões;Desenvolver e implantar soluções baseados em Machine Learning, NLP, IA Generativa, Otimização, Simulação, entre outros;Acompanhar e gerenciar projetos através de metodologias ágeis;Desenvolvimento interpessoal através de cursos, contato direto com clientes e trabalho em equipe.Requisitos e qualificaçõesGraduandos, a partir do 3º ano, dos cursos de Engenharias, Administração, Economia, Estatística, Matemática, Ciência da Computação e Sistemas de Informação;Bom raciocínio lógico, capacidade analítica e criatividade para propor e implantar as soluções;Visão crítica, habilidade de comunicação e apresentação, e bom relacionamento interpessoal;Rápido aprendizado, com alta curiosidade para aprender continuamente sobre novas tecnologias, além de vontade de fazer a diferença;Preferível experiência em atividades extracurriculares (ex: empresa júnior, PET, iniciação científica, etc).Recomendado o conhecimento dos conceitos de Ciência de Dados, NLP, IA Generativa, Estatística, Banco de Dados e SQL, além de domínio de linguagens de programação (Python, R ou outros).Informações adicionaisConforme necessidade, alguns candidatos, que concluírem todas as etapas online, poderão ser convocados antecipadamente para a etapa de entrevistas.Show moreShow less",N/A,On-site/Hybrid,https://www.linkedin.com/jobs-guest/jobs/api/jobPosting/4401926682,2026-04-23
