title,company,location,posted,description,applicants,work_mode,link,data_coleta
Data Scientist [All Levels],Nubank,"São Paulo, São Paulo, Brazil",1 week ago,"About UsNu was born in 2013 with the mission to fight complexity to empower people in their daily lives by reinventing financial services. We are one of the world’s largest digital banking platforms, serving millions of customers across Brazil, Mexico, and Colombia. For more information, visit our institutional page https://international.nubank.com.br/careers/Data Science at NubankData Science is essential to every part of the business at Nubank, since Day 1. Most areas of the company use data science to some extent. Data Scientists are responsible for translating business needs into models and other types of data-driven solutions.As a Data Scientist, you’re expected toInteract with other team members to understand how to best apply data science and artificial intelligence to Nubank’s problems;Investigate problems and discover insights through exploratory data analysis and other quantitative methods;Have great numerical and analytical literacy, including knowledge of statistics and linear algebra as needed;Work on multiple stages of the ML model lifecycle–from ideation to training and steady-state operation;Work across multiple types of models, algorithms and learning paradigms;Communicate technical points, decisions and tradeoffs to peers and stakeholders;Our ideal candidateHas experience working with ML models in a production environment;Understands possible pitfalls and tradeoffs when applying ML to real-word, sometimes messy problems;Is familiar with the technical aspects of learning theory and algorithms and is able to discuss details if needed;Has experience working with the Python scientific stack (Numpy, Pandas, Scipy, Sklearn, Boosted Tree Libraries, etc);Has experience working with Tensor/Deep Learning libraries such as Tensorflow and Pytorch;Is able to connect analytical outcomes to business priorities and advise stakeholders on the best course of action;Has good communication skills and is able to convey technical topics and decision points to diverse audiences;Has experience writing general-purpose code using modern tools;Understands the implications of causality when applying ML to problems;Is up-to-date with recent developments in the area as a whole and is able to identify opportunities for improvement and innovation;Our BenefitsChance of earning equity at NubankFood/ Meal Card (Vale-Refeição and/or Vale Alimentação)Public Transportation Commuting Benefit (Vale-Transporte)NuCare – Psychological, Financial and Legal Assistance ProgramLife InsuranceMedical PlanDental PlanNuLanguage – Language Course ProgramNucleo - Our learning platform of coursesExtended Parental LeaveDaycare AllowanceParental ConsultancyWork-from-home AllowanceGym Partnerships30 days of paid vacationWork Model for this RoleHybrid 2-3 times/week:Our hybrid work model brings us to the office at least twice a week, on strategic days designed to maximize team connection and collaboration. For more details, visit https://building.nubank.com/nu-hybrid-work-model/Show moreShow less",N/A,On-site/Hybrid,https://www.linkedin.com/jobs-guest/jobs/api/jobPosting/4364197061,2026-02-21
"Cientista de Dados (Brasil, Remoto)",Dell Technologies,"São Paulo, São Paulo, Brazil",3 hours ago,"A área de Engenharia Centrada em IA é dinâmica e empolgante, fazendo parte do Escritório do CTO (OCTO) da Dell. Conduzimos pesquisas e engenharia voltadas para o futuro da Dell Technologies em um ambiente de alta visibilidade e colaboração intensa. Nossa equipe é especializada no desenvolvimento de soluções avançadas de IA que capacitam empresas a inovar, se comunicar e otimizar operações de maneiras nunca antes possíveis. Somos compostos por pessoas apaixonadas e dedicadas a ultrapassar os limites da tecnologia de IA.Junte-se a nós para realizar o melhor trabalho da sua carreira e causar um impacto social profundo comoCientista de Dadosem nossa equipe no Brasil (remoto).O que você conquistaráComoCientista de Dadosvocê será responsável por contribuir com a estratégia de negócios e influenciar a tomada de decisões com base em informações obtidas por meio de análises aprofundadas. Você produzirá recomendações acionáveis e envolventes ao interpretar insights de conjuntos de dados complexos. Também irá projetar processos para consolidar e examinar dados não estruturados, gerando insights relevantes. Além disso, colaborará com líderes de negócios, engenheiros e especialistas da indústria para construir modelos preditivos, algoritmos e motores de probabilidade.Você IráColaborar com equipes internas e externas para entender os requisitos dos clientes e desenvolver soluções personalizadas utilizando modelos de IA generativa;Desenvolver aplicações de IA utilizadas em diferentes áreas da Dell, com o objetivo de transformar e modernizar a empresa;Desenvolver e conduzir testes para avaliar a eficácia de algoritmos em diferentes casos analíticos;Manter-se atualizado com os avanços mais recentes em pesquisa de IA e aplicar técnicas de ponta para aprimorar o desempenho dos modelos;Realizar testes rigorosos, validação e avaliação de desempenho das soluções de IA.Dê o primeiro passo em direção à carreira dos seus sonhosCada Membro Da Equipe Da Dell Technologies Traz Algo Único Para a Mesa. Aqui Está o Que Estamos Procurando, Com Esta FunçãoRequisitos EssenciaisFormação acadêmica: Graduação completa em Ciência da Computação, Engenharia (Computação, Software, Elétrica, Controle e Automação), Estatística, Matemática, Física ou áreas correlatas. Pós-graduação stricto sensu (Mestrado ou Doutorado) em áreas relacionadas à Inteligência Artificial, Aprendizado de Máquina ou Ciência de Dados;Domínio avançado do inglês, necessário para interação constante com times internacionais;Sólidas habilidades de programação em Python;Compreensão dos conceitos de Aprendizado de Máquina (Machine Learning);Conhecimento e familiaridade com os conceitos fundamentais de design e análise de algoritmos, além de forte conhecimento em matemática e estatística.Requisitos DesejáveisCompreensão sólida de arquiteturas de Deep Learning, com experiência em ajuste fino e personalização de modelos pré-treinados para aplicações específicas. Proficiência em Python e nas bibliotecas/frameworks relevantes (ex.: TensorFlow, PyTorch);Experiência com modelos de linguagem de grande escala e familiaridade com técnicas e aplicações de processamento de linguagem natural (PLN).Quem somosAcreditamos que cada pessoa tem o poder de gerar impacto. É por isso que colocamos as pessoas da nossa equipe no centro de tudo o que fazemos. Se você está procurando uma oportunidade de desenvolver a sua carreira em um ambiente de trabalho inclusivo e diverso, com a tecnologia mais avançada do setor, estamos procurando por você.A Dell Technologies é uma família única de empresas que ajuda pessoas e organizações a transformar a forma como trabalham, vivem e se divertem. Junte-se a nós para construir um futuro que funcione para todas as pessoas, porque o progresso precisa de nós.A Dell Technologies está comprometida com o princípio de oportunidades iguais de emprego para todas as pessoas, e em fornecer às pessoas da equipe um ambiente de trabalho livre de discriminação e assédio. Leia a nossa Política de Oportunidades de Emprego aqui.Job ID:R283866Show moreShow less",N/A,On-site/Hybrid,https://www.linkedin.com/jobs-guest/jobs/api/jobPosting/4344395115,2026-02-21
Oportunidades de Carreira: Cientista de Dados - Análises Avançadas e Multiômica (1307589),Einstein Hospital Israelita,"São Paulo, São Paulo, Brazil",1 week ago,"Com 70 anos de existência, o Einstein Hospital Israelita ainda mantém uma premissa: inovar e crescer, sempre com excelência. Ajudamos a salvar vidas, difundir o conhecimento em educação, prevenção e inovação em saúde. Além da atuação em setores assistenciais, temos oportunidades na área de Inovação, Tecnologia, Pesquisa, Ensino, entre outras. Seguimos oferecendo qualidade, afirmando nosso compromisso com a Responsabilidade Social e com o propósito de levar uma gota de Einstein para cada cidadão. Valorizamos a diversidade e inclusão de todos os talentos e buscamos profissionais que compartilhem deste mesmo propósito!Informações sobre a área de trabalhoÁrea: Análises Avançadas e MultiômicaHorário: 09h às 19hModelo: Híbrido ou remotoSumárioResponsável por identificar soluções para os problemas de negócios e contribuir nas tomadas de decisões, usando habilidades de matemática, de estatística, de programação, de machine learning e de mineração de dados. Comunicar previsões e resultados para o cliente demandante, através de visualizações de dados eficazes. Desenvolver arquiteturas, algoritmos e soluções inovadoras para saúde. Projetar novos modelos estatísticos e ferramentas de coleta de dados e usar técnicas avançadas de análise estatística, probabilidade e deep learning.ResponsabilidadesTratar, transformar e organizar dados desorganizados (estruturados, semi-estruturados ou não estruturados), com uso de habilidades em matemática, estatística, programação, machine learning e outros, aplicando suas capacidades analítica, de conhecimento de negócio, de compreensão contextual, para identificar soluções para os problemas de negócios e contribuir na tomada de decisões e estratégias da instituição.Realizar pesquisas sem direção e formular perguntas abertas aos dadosExtrair grandes volumes de dados de múltiplas fontes internas e externasEmpregar os programas de análise sofisticadas, machine learning e métodos estatísticos para preparar os dados para uso em modelagem preditiva e prescritivaExplorar e analisar dados de uma variedade de ângulos para determinar fraquezas escondidas, tendências e / ou oportunidadesConceber soluções orientadas a dados para os desafios mais prementesInventar novos algoritmos para resolver problemas e criar novas ferramentas para automatizar o trabalhoComunicar previsões e resultados para o cliente demandante, através de visualizações de dados eficazesRecomendar mudanças nos procedimentos e estratégias da Instituição""No Segmento De Machine LearningPesquisar e desenvolver novos algoritmos.Aplicar esses algoritmos e criar soluções.""Desenvolver e ajustar modelos fundacionaisNo Segmento De Visualização De DadosEntender os dados do projeto em desenvolvimento e reproduzir os mesmos de forma visual que atendam as demandas do cliente.Adotar gráficos, tabelas, relatórios e, principalmente, narrativas para apresentar a um público não técnico as conclusões de um projeto de análise de dados.RequisitosMatemática: cálculo multivariável e álgebra linear (matrizes, autovalores e autovetores, regra da cadeia, matriz de jacobiana, gradiente, tensores e maldição da dimensionalidade) ;Estatística descritiva: média, mediana, moda, distribuições (tais como: normal, poisson, binomial e chi-square), correlação, variância, teorema do limite central e desvio padrão e variância;Estatística inferencial: teste de hipótese (tais como: p-values, intervalos de confiança), testes de significância (tais como: z-test, t-test e ANOVA) e regressão (regressão linear e regressão logística);Probabilidades: regra do produto, inferência bayesiana x frequentista, variáveis aleatórias, independência, condicionalidade, marginalização e lei da probabilidade total;Data wrangling: limpeza e manipulação de dados, extrair informações de arquivos (tais como: CSV e XML), regular expressions, transformações matemáticas e domínio de queries em banco de dados relacionais;Programação em linguagens de data science (tais como: R, Python, SQL e Matlab). Conhecimentos de pacotes open source especificos para Data Science como: Tensorflow, Pytorch, Transformers, Unsloth ,Keras, Numpy, Pandas, Tidyverse, entre outros;Métodos de machine learning: aprendizagem supervisionada (tais como: decision trees, naive bayes, logistic regression, random forest, SVM e redes neurais) e aprendizagem não supervisionada (tais como: algoritmos de clusterização, PCA e SVD);Métodos de deep learning: adaptação de modelos grande e leves através de técnicas como LoRA, QLoRA, GRPO, GPO e aprendizado não supervisionado como contrastive learning;Comunicação, visualização de dados e data storytelling: conhecimento do negócio do cliente, entendendo os dados de forma visual da área e sabendo comunicar sob forma de vizualização seus insights para o mesmo. Bibliotecas de vizualização de dados (tais como: GGPLOT, SHINY, MATPLOTLIB e SEABORN);Conhecimento de processos de dados e analytics.DesejávelGraduação completa;Nível de inglês avançado;Outros Métodos de machine learning: reinforcement learning (tais como: Q-learning, TD-learning e algoritmos genéticos) e deep learning (tais como: redes neurais, CNN, RNN e GAN);Otimização. Conhecimento de algoritmos de otimização e utilização de softwares como Gurobi;Experiment Design: teste A/B, controle de variáveis, escolha de bons grupos de teste e controle, tamanho da amostra, nivel de confiança, estatística bayesiana, bootstrapping, simulação e experimento SMART (Specific, Measurable, Actionable, Realistic, Timely);Outras ferramentas: Debugging, testing, controle de versão (Git) e model deploy;Conhecimento de funcionamento e manutenção de banco de dados NoSQL. (Tais como: Cassandra, MongoDB, CouchDB, Documento de grafos, entre outros);Configuração e manutenção do ecosistema Hadoop (tais como: HDFS, Spark, MapReduce, Pig, Hive, Impala, Flume, Sqoop, Zookeeper, Oozie, Hue, Kafka, Scala e Python;Conhecimento de funcionamento e manutenção de banco de dados relacionais. MS SQL Server, Oracle, MySQL e PostgreSQL.Einstein Benefícios – Compartilhando Bem-EstarCuidados com a saúde: Programa Cuidar com serviços realizados no Einstein para promover a saúde e bem-estar dos colaboradores e dependentes, Clínicas Einstein, Telemedicina, Convênio Farmácia, Convênio Médico, Assistência Odontológica e Consultório Dental in Company.Bem-Estar: Wellhub (Gympass), TotalPass, Coral, Programa de Orientação Pessoal e SESC.Para você e sua família: Licença paternidade estendida, Seguro de Vida, Creche ou Auxílio Creche para mães ou pais com guarda legal, Auxílio para Filhos com Deficiência e Previdência Privada com taxa zero.Alimentação: Vale Alimentação, Vale Refeição ou Refeitório no local de trabalho.Mobilidade: Vale Transporte, Fretado, Estacionamento, Aplicativo de Caronas e Circular Metrô.Clube de Benefícios: Para economizar e obter vantagens nas compras de produtos e serviços de diversas categorias, como Beleza e Fitness, Comer e Beber, Compras, Cultura e Lazer, Educação Ensino Einstein, Turismo e muito mais.Programa Mais Conectados: Trabalho remoto nas modalidades Teletrabalho ou Híbrido conforme atividade e área de atuação.Os benefícios podem sofrer alteração de acordo com a convenção coletiva, unidade de trabalho e políticas vigentes.Show moreShow less",N/A,On-site/Hybrid,https://www.linkedin.com/jobs-guest/jobs/api/jobPosting/4370428500,2026-02-21
Criador de Agentes de IA,KPMG Brazil,"São Paulo, São Paulo, Brazil",1 month ago,"Inclusão e respeito à diversidade e equidade fazem parte do DNA da KPMG.Aqui valorizamos todas as pessoas, encorajando e empoderando os nossos profissionais para que se sintam parte das nossas conquistas.Independente da sua idade, gênero, raça, cor, credo, orientação, sexual, etnia, origem nacional ou deficiência, te convidamos a fazer a diferença. Venha fazer parte do time KPMG!️‍ ️‍⚧️ ♿ ✊✝️Inspire Confidence. Empower Change.Aqui na KPMG:Fazemos o que é certo #IntegrityAprendemos e nos aprimoramos #ExcellencePensamos e agimos de maneira arrojada #CourageRespeitamos uns aos outros e nos e nos fortalecemos com nossas diferenças #TogetherFazemos o que realmente importa #For BetterResponsabilidades e atribuições:Caso seja aprovado(a), você terá a oportunidade de:Desenvolver agentes inteligentes com Copilot Studio.Integrar soluções utilizando Power Apps e Power Automate.Estudar e acompanhar atualizações das ferramentas de IA.Colaborar em projetos voltados para automação e inovação.Trabalhar em equipe para entrega de soluções eficientes.Requisitos e qualificações:O que procuramos em você?Cursando graduação na área de Tecnologia da Informação ou correlatas.Dedicação em ferramentas de IA e desenvolvimento de agentes.Experiência: Projetos pessoais ou cursos voltados para IA (diferencial).Competências: Comunicação, trabalho em grupo, proatividade e busca contínua por conhecimento.Ferramentas e TecnologiasCopilot Studio Microsoft Power Platform (Power Apps, Power Automate)Certificações Microsoft (diferencial)Quais as vantagens de ser KPMG?Aqui atuamos com as mais novas tecnologias;Nossos profissionais são referência no mercado;Somos uma das maiores empresas de prestação de serviço do mundo;Quais benefícios oferecemos?Vale RefeiçãoVale AlimentaçãoAssistência MédicaAssistência OdontológicaVale TransporteBenefício Bem-estar (Academia)Convênio FarmáciaSeguro de VidaKPMG PrevAuxílio CrecheIncentivo a GraduaçãoIncentivo à IdiomasSubsídio de Órgão de ClasseBrinde CasamentoBrinde NascimentoLicença Maternidade estendidaJornada de Trabalho FlexívelMeu Tempo: até 6 dias inteiros por ano — ou 12 meios períodos — para você fazer uma pausa, cuidar de si e usar como quiser, quando precisar.PPLShow moreShow less",N/A,On-site/Hybrid,https://www.linkedin.com/jobs-guest/jobs/api/jobPosting/4362154583,2026-02-21
CIENTISTA DE DADOS I,Grupo HDI,"São Paulo, São Paulo, Brazil",1 week ago,"Acreditamos no sonho de construir omelhor grupo seguradore valorizamos a colaboração e a solução de problemas com criatividade e transparência, de forma que reflita em nossos produtos, serviços e novas parcerias.Aqui, a gente se importa pessoalmente.Este é o propósito que define a essência de tudo aquilo que fazemos e valorizamos, dentro e fora dos nossos escritórios.Procuramos um talento para atuar no time dePlan Info Gerenciais Sinistrosda diretoria deOperações e Sinistros, área responsável pela criação e acompanhamento de painéis e indicadores de performance, desenvolvimento de controles, projeções e estudos, visando a identificação de desvios de resultados e mapeando oportunidades de otimização de custos em linha com a nossa estratégia, visão e missão.Buscamos um(a) Cientista de Dados para integrar nossa equipe deinteligência analíticae o desafio será desenvolver modelos preditivos, estruturar análises avançadas e transformar dados em insights estratégicos para apoio na tomada de decisão e evolução contínua dos nossos processos de negócio.Responsabilidades e atribuiçõesNo seu dia a dia, você irá:Desenvolver, treinar e validar modelos preditivos e prescritivos utilizando algoritmos de Machine Learning e técnicas estatísticas;Realizar análises exploratórias de dados (EDA) para identificação de padrões, oportunidades e tendências;Criar e manter pipelines de dados estruturados e escaláveis;Tratar, limpar e preparar grandes volumes de dados de múltiplas fontes;Construir e acompanhar métricas de performance para avaliação dos modelos implementados;Realizar estudos estatísticos, simulações e testes de hipótese para resolução de problemas de negócio;Documentar processos, modelos e metodologias desenvolvidas;Contribuir para melhoria contínua de políticas, padrões, governança e qualidade dos dados.Requisitos e qualificaçõesComo requisitos básicos, você deve ter:Graduação em Ciência de Dados ou áreas correlatas (obrigatório);Experiência em Python e bibliotecas de ML (obrigatório);Experiência com Data Lake, Data Warehouse e arquiteturas de dados modernas (diferencial);Vivência com grande volume de dados, estruturação de datasets, GIT e versionamento de código (obrigatório);Vivência em projeto de IA generativa e LLMs (diferencial);Domínio em SQL e bancos relacionais e não relacionais (obrigatório);Conhecimento sólido em estatística aplicada e regressão/classificação (obrigatório);Conhecimento de processamento de linguagem natural (NLP), visão computacional, MLOps, CI/CD e deploy de modelos (diferencial);Familiaridade com ferramentas de visualização como Power BI, Tableau e Looker (diferencial).Informações adicionaisNossa jornada diária possui horários flexíveis, incentivamos a saúde e a qualidade de vida com assistência médica, odontológica e Wellhub, além de outros benefícios como vale-transporte ou fretado, vale-refeição e alimentação, previdência privada, PLR, day off no aniversário, desconto em produtos do Grupo HDI, auxílio babá ou creche, seguro de vida e muito mais!E aí,#vamojunto?Show moreShow less",N/A,On-site/Hybrid,https://www.linkedin.com/jobs-guest/jobs/api/jobPosting/4363811375,2026-02-21
Cientista de Dados Júnior - Engajamento e Rentabilização de Cliente PJ (Vaga afirmativa para Mulheres),Itaú Unibanco,"São Paulo, São Paulo, Brazil",1 week ago,"O Itaú é a marca mais valiosa do Brasil, a melhor empresa para trabalhar segundo o Great Place to Work e o maior banco da América Latina. Nós impactamos diariamente mais de 98 milhões de clientes em 18 países.Somos feitos de pessoas e acreditamos que ter um time com pluralidade de origens, culturas, crenças, experiências, raças, deficiências, gêneros, orientações afetivo-sexuais e gerações ampliam as perspectivas e contribuem para um clima de respeito e valorização das diferenças.Estamos buscando uma pessoa para a posição de Cientista de Dados Júnior, que queira se desenvolver e aprender, compartilhar, colaborar e inovar, entregando valor para todos os nossos clientes.Estamos criando uma disrupção no modelo de atendimento a PMEs (Pequenas e Médias Empresas) com produtos de IA Generativa e precisamos de um talento nessa área para nos ajudar a evoluir produtos de grande sucesso e criar outros que vão impactar diretamente o negcio.Nessa Função Você VaiMergulhar a fundo no negócio para entender as jornadas e dores do usuárioEvoluir e criar grafos de multiagentes conectando com a nossa arquiteturaExperimentar e propor novas features baseadas em GenAIFormação: Superior Completo - Ciência Da Computação , Superior Completo - Análise De Sistemas , Superior Completo - Engenharia , Superior Completo - Estatística Superior Completo - MatemáticaCompetências Técnicas: sql , Frames de GenIA: langchain, langgraph etc, Python,Prompt EngineeringAo se tornar um ituber você tem_Vale-TransporteVale-Refeição (Restaurantes) / Vale-Alimentação (Supermercados)Plano médico (Fundação Saúde Itaú ou Central Nacional Unimed)Plano odontológico (Odontoprev ou Interodonto)Seguro de VidaPLR – Participação nos Lucros e Resultados (Mediante resultados do banco)Previdência privadaDescontos exclusivos em nossos produtos financeirosLicença maternidade e paternidade estendidaAuxílio Creche / Babá (para papais e mamães)Incentivo a estudosWellhub ou TotalPassAcesso aos Clubes de Lazer Itaú (Guarapiranga / Itanhaém e São Sebastião)+ Algumas vantagens que você pode conhecer durante o processo 😊Conheça mais sobre nossa cultura: https://www.itau.com.br/relacoes-com-investidores/noticias/cultura-itubers-e-nosso-novo-conjunto-de-valores/Estimulamos candidaturas de pessoas com deficiência em todas as nossas posições, sendo assim, sinta-se à vontade para se candidatar em vagas sinalizadas como exclusivas ou não para pessoas com deficiência. Somos comprometidos com a inclusão e valorizamos a diversidade.#VemProItaú #VemSerItuberShow moreShow less",N/A,On-site/Hybrid,https://www.linkedin.com/jobs-guest/jobs/api/jobPosting/4371287005,2026-02-21
