title,company,location,posted,description,applicants,work_mode,link,data_coleta
Cientista de Dados Jr.,PagBank,"São Paulo, São Paulo, Brazil",3 days ago,"Descrição da vagaQuando você pensa em carreira, o que vem à sua mente? Propósito? Colaboração? Ser protagonista para fazer a diferença? No PagBank temos tudo isso e muito mais. 💛Estamos em busca de pessoas que vistam a camisa com orgulho. Gente com vontade de facilitar a vida financeira das pessoas e impulsionar negócios!Tá a fim de uma carreira que rende mais?Confira essa oportunidade e #VemProPags!Responsabilidades e atribuiçõesDesenvolver modelos para otimização de processos de banking ou adquirência.Analisar grandes volumes de dados transacionais para identificar padrões, tendências e oportunidades de melhoria nos processos.Implementar algoritmos de segmentação de clientes e predição de comportamento para aumentar a eficiência e a personalização dos serviços oferecidos.Trabalhar em estreita colaboração com equipes de engenharia, produto e negócios para definir e implementar soluções de dados que atendam às necessidades do cliente e da empresa.Fornecer insights complexos de maneira clara e eficaz para stakeholders não técnicos, ajudando na tomada de decisões estratégicas.Requisitos e qualificaçõesSuperior completo ou em andamento em Ciências da Computação, Engenharia, Matemática, Estatística ou áreas relacionadas.Experiência com análise de grandes volumes de dados para a geração de insights para times de negócio.Experiência com ferramentas de análise de dados e programação como SQL, Python, R ou bibliotecas de machine learning (TensorFlow, PyTorch, Scikit-Learn, etc.).Habilidade para resolver problemas complexos de maneira criativa e inovadora.Conhecimento de processos de versionamento de código (Git, Github).Habilidade para traduzir dúvidas e necessidades dos times de negócios em requisitos para as análises.Olá, somos o PagBank!Talvez você nos conheça por maquininhas ou comerciais que ficam na memória, mas somos muito mais!Todos os dias desenvolvemos produtos e soluções inspiradas pelo nosso propósito: facilitar a vida financeira das pessoas e negócios.Trabalhamos para transformar a forma como as pessoas lidam com dinheiro abrindo novas possibilidades para alcançarem seus sonhos.Como fazemos tudo isso?💛Com genteSomos um time que joga junto! Aqui valorizamos todas as diversidades, seja de raça/etnia, gênero, idade, origem, pessoa com deficiência, orientação afetivo-sexual, constituição familiar e estética.💛Com tecnologiaO espírito disruptivo e inovador está no nosso DNA: somos parte do Grupo UOL, empresa 100% brasileira, foi pioneira na internet e transforma a vida das pessoas desde 1996.💛Com uma só culturaTemos uma cultura forte e única, capaz de nos levar além, para continuarmos crescendo e perpetuando o nosso negócio.Somos um dos maiores bancos digitais do país e uma das fintechs mais rentáveis do segmento e certificados como um Excelente Lugar para Trabalhar pela Great Place to Work.Para vivenciar tudo isso, você terá um pacote completo de benefícios que fazem toda a diferença:Vale-alimentação e/ou refeição.Plano de saúde e odontológico.Seguro de vida.Parceria com TotalPass e ZenKlub.Licença maternidade e paternidade estendidas.Auxílio-creche.Descontos de até 50% em pós-graduação e MBA de grandes instituições, como FIA, FAAP e PUCRS.E tem mais:No dress code: o importante é você usar o que te faz bem.#TáDeParabéns: Day off no aniversário.Baby Gift: presente para recém-nascidos.Tá a fim de uma carreira que rende mais?Vem pro nosso time imbatível!#VemProPags.Show moreShow less",N/A,On-site/Hybrid,https://www.linkedin.com/jobs-guest/jobs/api/jobPosting/4416323402,2026-06-14
Cientista de dados Junior,Avanade,"São Paulo, São Paulo, Brazil",4 days ago,"Mergulhe no mundo da Engenharia de IA, onde a análise e o design de soluções transformam desafios em oportunidades, colaborando com especialistas para criar inovações impactantes em ambientes de nuvem.Como parte da equipe de Engenharia de IA, você estará no centro da inovação, transformando requisitos de negócios em soluções práticas. Seu papel será entender problemas complexos, projetar soluções eficazes e colaborar com equipes multidisciplinares para implementar essas soluções. Junte-se a nós e faça parte de um time que valoriza cada indivíduo e promove um ambiente de trabalho inclusivo.Together we do what matters.Saiba Mais Sobre Alguns De Nossos BenefíciosVale refeição ou alimentação;Cartão Multibenefícios até Consultor Sênior;Convênio médico e odontológico;Certificações e treinamentos;Seguro de Vida;Previdência Privada;Avababy: acompanhamento da gestação e kit para os novos pais e mães Avanade;Participação nos resultados da empresa;Wellhub;Auxílio Creche;Orientador de Carreira - Mentoria de carreira;Política de Birthday Off em seu aniversáriO;Sessões de Bem-Estar;Para função gerencial ou superior - Veículo corporativo, estacionamento e auxílio combustível.ResponsabilidadesExperiência com desenvolvimento e manter pipelines de dados (ETL/ELT) utilizando Python e Modelos preditivos e machine learning (classificação, regressão, LLM , etc.)Estatística aplicada e validação de modelos.Experiência com resolução de problemas de negócio com dados.Requisitos técnicos (suporte).Python (bibliotecas de ciência de dados).Manipulação de dados (pySpark/Pandas), pois temos grandes volumes de dados.SQL - para análise e integração de bases corporativas para análise dos dados.Git - para versionamento do código.QualificationsHabilidades e experiências:Atuação em ciência de dados, com desenvolvimento e análise de modelos preditivos, experimentação e geração de insights para apoio à decisão de negócio.Show moreShow less",N/A,On-site/Hybrid,https://www.linkedin.com/jobs-guest/jobs/api/jobPosting/4426391265,2026-06-14
Data Scientist II,Banco Bradesco,"Osasco, São Paulo, Brazil",4 days ago,"Sobre o BradescoO Bradesco é um dos maiores grupos financeiros do Brasil, com uma história marcada pelo pioneirismo e inovação. Por meio da nossa carteira amplamente diversificada de produtos financeiros, serviços bancários e de seguros contribuímos com a realização das pessoas e o crescimento sustentável de empresas e sociedade. Venha fazer parte do nosso ecossistema financeiro e impactar a experiência de milhões de pessoas!No Bradesco valorizamos a diversidade em todas as suas formas. Por isso, as nossas vagas são abertas a todas as pessoas, independentemente de gênero, raça, orientação sexual, deficiência, idade ou qualquer outra característica.Saiba mais em https://banco.bradesco/html/classic/sobre/index.shtmResponsabilidades e atribuiçõesO que é o nosso time de Crédito?Modelo de trabalho : Híbrido - 2x PresencialUnidade: Osasco/SPComo será seu dia a dia?Sendo Data Scientist II, atuará na gerência Crédito Rotativo e suas principais atividades serão:Definir políticas de pricing, estabelecendo o melhor preço cliente a cliente para produtos de Desconto (Duplicata, Cheque e Antecipação de Cartões) e Rotativos (Cheque Empresarial, Conta Garantida e Giro Empresarial);Monitorar e analisar os principais KPIs do negócio (spread bruto, duration, perda esperada, spread líquido, RAR e EVA);Conduzir estudos de elasticidade de preço para otimizar decisões comerciais;Avaliar competitividade de mercado e posicionamento dos produtos;Identificar e propor oportunidades de aumento de rentabilidade dos produtos.Requisitos e QualificaçõesO que você precisa ter ou saber?Graduação completa em áreas de tecnologia ou Analytics;Perfil analítico, estratégico e orientado a dados, com senso crítico sobre resultados;Experiência em pricing ou risco de crédito;Domínio de ferramentas de manipulação e análise de dados (SAS, SQL e Python);Familiaridade ou interesse prático em aplicações de IA no dia a dia;Experiência no mercado de crédito/bancário.Será um diferencial se você tiver:Conhecimentos nos produtos ( Desconto e rotativo) PF ou PJ.O que nós oferecemosNo Bradesco valorizamos a saúde e bem-estar, oferecendo um extenso portfólio de benefícios a todas nossas pessoas funcionárias:PLR ou Bônus: Conforme a elegibilidade de cargo*Convênio MédicoConvênio OdontológicoSeguro de VidaVale AlimentaçãoVale Refeição13º Cesta AlimentaçãoTotal PassVale Transporte (adesão opcional)Descontos em produtos e serviços em empresas parceirasPrevidência Privada (adesão opcional, com participação financeira da Organização Bradesco)Viva Bem Bradesco: programa de saúde, bem-estar e qualidade de vidaUnibrad: Universidade Corporativa BradescoIsenção de Tarifas: condições especiais em diversos produtos e serviçosAuxílio Creche ou BabáLicença Paternidade estendida de 20 diasLicença Maternidade de 180 dias, acompanhamento assistencial da gestação até o pós-partoShow moreShow less",N/A,On-site/Hybrid,https://www.linkedin.com/jobs-guest/jobs/api/jobPosting/4426368713,2026-06-14
Data Scientist,DoorDash,"São Paulo, São Paulo, Brazil",1 day ago,"About The TeamThe Analytics team is looking for experienced Data Scientists to guide measurement, strategy, and tactical decision-making across the company across a variety of teams and levels. Data Scientists at DoorDash work to uncover insights and turn them into relevant recommendations, driving decisions for the entire organization. Analytics is integral to all operational areas at DoorDash.Please apply here for all non-managerial levels within the following analytics teams:Consumer & GrowthBusiness OperationsDasher & LogisticsCustomer Experience & IntegrityMerchant, Ads & SalesNew VerticalsInternational Data ScienceAbout The RoleAs a Data Scientist at DoorDash, you'll use your quantitative background to mentor other scientists and dive into large datasets to guide decision-making. We solve a multitude of exciting challenges including customer acquisition, fraud and support, marketing, balancing supply and demand, new city launches, marketplace efficiency, and more. If you enjoy finding patterns amidst chaos, and have experience using analytics to affect revenue, growth, operations or beyond, we're looking for someone like you!You're Excited About This Opportunity Because You Will…Use quantitative analysis and the presentation of data to see beyond the numbers and understand what drives our businessBuild full-cycle analytics experiments, reports, and dashboards using SQL, R, Python, or other scripting and statistical toolsWork with and mentor junior analysts on how to use more advanced methods and solve challengesProduce recommendations and use statistical techniques and hypothesis testing to validate your findingsProvide insights to help business and product leaders understand marketplace dynamics, user behaviors, and long-term trendsIdentify and measure levers to help move essential metrics and make recommendationsWork backwards from understanding and sizing problems to ideating solutionsReport against our goals by identifying essential metrics and building executive-facing dashboards to track progressCollaborate with engineering to implement, document, validate, and monitor our loggingWe're Excited About You Because You Have…A degree in Math, Physics, Statistics, Economics, Computer Science, or a similar domain2+ years of experience in data analytics, consulting, or related roleExperience working with funnel optimization, user segmentation, cohort analyses, time series analyses, regression models, etcExpertise of SQL queries, ETL, A/B Testing, and statistical analysis (e.g. hypothesis testing, experimentation, regressions) with statistical packages, such as Matlab, R, SAS or PythonProficiency in one or more analytics & visualization tools (e.g. Chartio, Looker, Tableau)The insight to take ambiguous problems and solve them in a structured, hypothesis-driven, data-supported wayAre able to work in our office in São Paulo, BrazilNotice to Applicants for Jobs Located in NYC or Remote Jobs Associated With Office in NYC OnlyWe use Covey as part of our hiring and/or promotional process for jobs in NYC and certain features may qualify it as an AEDT in NYC. As part of the hiring and/or promotion process, we provide Covey with job requirements and candidate submitted applications. We began using Covey Scout for Inbound from August 21, 2023, through December 21, 2023, and resumed using Covey Scout for Inbound again on June 29, 2024.The Covey tool has been reviewed by an independent auditor. Results of the audit may be viewed here: CoveyAbout DoorDashAt DoorDash, our mission to empower local economies shapes how our team members move quickly, learn, and reiterate in order to make impactful decisions that display empathy for our range of users—from Dashers to merchant partners to consumers. We are a technology and logistics company that started by enabling door-to-door delivery, and we are looking for team members who can help us go from a company that is known as the place you order food to a company that people turn to for any and all goods.DoorDash is growing rapidly and changing constantly, which gives our team members the opportunity to share their unique perspectives, solve new challenges, and own their careers. We're committed to supporting employees’ happiness, healthiness, and overall well-being by providing comprehensive benefits and perks.Our Commitment to Diversity and InclusionWe’re committed to growing and empowering a more inclusive community within our company, industry, and cities. That’s why we hire and cultivate diverse teams of people from all backgrounds, experiences, and perspectives. We believe that true innovation happens when everyone has room at the table and the tools, resources, and opportunity to excel.This position is open to candidates with disabilities. DoorDash welcomes applicants registered with the national autism registry (SisTEA) and others who seek an inclusive workplace.If you need any accommodations, please inform your recruiting contact upon initial connection.We use Covey as part of our hiring and/or promotional process for jobs in certain locations.The Covey tool has been reviewed by an independent auditor. Results of the audit may be viewed here:https://getcovey.com/nyc-local-law-144To request a reasonable accommodation under applicable law or alternate selection process, please inform your recruiting contact upon initial connection.Show moreShow less",N/A,Remote,https://www.linkedin.com/jobs-guest/jobs/api/jobPosting/4354742212,2026-06-14
Data Scientist Specialist,Banco Bradesco,"Osasco, São Paulo, Brazil",2 days ago,"Sobre o BradescoO Bradesco é um dos maiores grupos financeiros do Brasil, com uma história marcada pelo pioneirismo e inovação. Por meio da nossa carteira amplamente diversificada de produtos financeiros, serviços bancários e de seguros contribuímos com a realização das pessoas e o crescimento sustentável de empresas e sociedade. Venha fazer parte do nosso ecossistema financeiro e impactar a experiência de milhões de pessoas!No Bradesco valorizamos a diversidade em todas as suas formas. Por isso, as nossas vagas são abertas a todas as pessoas, independentemente de gênero, raça, orientação sexual, deficiência, idade ou qualquer outra característica.Saiba mais em https://banco.bradesco/html/classic/sobre/index.shtmResponsabilidades e atribuiçõesO que é o nosso time de Crédito?Temos como missão garantir uma gestão eficiente na concessão e manutenção de crédito, que assegure rentabilidade e o crescimento com solidez dos ativos da Organização.Modelo de trabalho : Híbrido - 2x PresencialUnidade: São Paulo - OsascoComo será seu dia a dia?Sendo Data Scientist Specialist, atuará na gerência Crédito e suas principais atividades serão:Modelagem específica para provisionamento (resolução 4966, PD/EAD/LGD);Identificação de oportunidade nas aplicações dos modelos;Identificação de melhorias em modelos existentes;Análise de dados;Melhoria de processo.Requisitos e QualificaçõesO que você precisa ter ou saber?É necessário conhecimentos em provisionamento/Resolução 4966 e mercado financeiroSerá um diferencial se você tiver:Conhecimentos em Python / Databricks e estatística.O que nós oferecemosNo Bradesco valorizamos a saúde e bem-estar, oferecendo um extenso portfólio de benefícios a todas nossas pessoas funcionárias:PLR ou Bônus: Conforme a elegibilidade de cargo*Convênio MédicoConvênio OdontológicoSeguro de VidaVale AlimentaçãoVale Refeição13º Cesta AlimentaçãoTotal PassVale Transporte (adesão opcional)Descontos em produtos e serviços em empresas parceirasPrevidência Privada (adesão opcional, com participação financeira da Organização Bradesco)Viva Bem Bradesco: programa de saúde, bem-estar e qualidade de vidaUnibrad: Universidade Corporativa BradescoIsenção de Tarifas: condições especiais em diversos produtos e serviçosAuxílio Creche ou BabáLicença Paternidade estendida de 20 diasLicença Maternidade de 180 dias, acompanhamento assistencial da gestação até o pós-partoShow moreShow less",N/A,On-site/Hybrid,https://www.linkedin.com/jobs-guest/jobs/api/jobPosting/4418031756,2026-06-14
Data Scientist III - Estratégia de Investimentos,Banco Bradesco,"Osasco, São Paulo, Brazil",3 days ago,"Sobre o BradescoO Bradesco é um dos maiores grupos financeiros do Brasil, com uma história marcada pelo pioneirismo e inovação. Por meio da nossa carteira amplamente diversificada de produtos financeiros, serviços bancários e de seguros contribuímos com a realização das pessoas e o crescimento sustentável de empresas e sociedade. Venha fazer parte do nosso ecossistema financeiro e impactar a experiência de milhões de pessoas!No Bradesco valorizamos a diversidade em todas as suas formas. Por isso, as nossas vagas são abertas a todas as pessoas, independentemente de gênero, raça, orientação sexual, deficiência, idade ou qualquer outra característica.Saiba mais em https://banco.bradesco/html/classic/sobre/index.shtmResponsabilidades e atribuiçõesO que é o nosso time de Pricing?Somos responsáveis pela definição e gestão estratégica de preços e condições financeiras dos produtos do banco, equilibrando rentabilidade, competitividade e risco. Atuando com dados, modelagens e inteligência de mercado para apoiar decisões comerciais e impulsionar resultados sustentáveis em diversas linhas de negócio.Modelo de trabalho : Híbrido - 3x PresencialUnidade: Osasco/SPComo será seu dia a dia?Sendo Data Scientist III - Estratégia de Investimentos, atuará na gerência Investimentos Pricing e suas principais atividades serão:Desenvolver análises que suportem a definição e revisão das estratégias de pricing para produtos de investimentos (ex.: depósitos, LCI, LCA)Avaliar estruturas de taxas, descontos e incentivos comerciais, identificando oportunidades com base em rentabilidade, competitividade e perfil de cliente, além de elaborar planos de açãoMonitorar a adesão à política de alçadas para descontos comerciais, garantindo o tratamento adequado de desviosOrquestrar e priorizar, junto às áreas de tecnologia, os desenvolvimentos necessários para evolução da precificação, definindo planos de ação e acompanhando sua execuçãoRealizar estudos de mercado, análise de performance de produtos e identificação de oportunidades em novos negóciosGerar, estruturar e comunicar insights acionáveis para suportar decisões estratégicas de pricingRequisitos e QualificaçõesO que você precisa ter ou saber?Ensino superior completo em Economia, Administração, Engenharia ou áreas correlatasSólida experiência com análise de dados, modelagem financeira e precificação, preferencialmente aplicada a produtos de investimentos (ex.: CDB, LCI, LCA)Conhecimento do mercado e da regulamentação de investimentos bancáriosConhecimento em estratégia de precificação e análise de rentabilidadeExcel avançado e SQLSerá um diferencial se você tiver:Experiência com PythonO que nós oferecemosNo Bradesco valorizamos a saúde e bem-estar, oferecendo um extenso portfólio de benefícios a todas nossas pessoas funcionárias:PLR ou Bônus: Conforme a elegibilidade de cargo*Convênio MédicoConvênio OdontológicoSeguro de VidaVale AlimentaçãoVale Refeição13º Cesta AlimentaçãoTotal PassVale Transporte (adesão opcional)Descontos em produtos e serviços em empresas parceirasPrevidência Privada (adesão opcional, com participação financeira da Organização Bradesco)Viva Bem Bradesco: programa de saúde, bem-estar e qualidade de vidaUnibrad: Universidade Corporativa BradescoIsenção de Tarifas: condições especiais em diversos produtos e serviçosAuxílio Creche ou BabáLicença Paternidade estendida de 20 diasLicença Maternidade de 180 dias, acompanhamento assistencial da gestação até o pós-partoShow moreShow less",N/A,On-site/Hybrid,https://www.linkedin.com/jobs-guest/jobs/api/jobPosting/4417407822,2026-06-14
Data Scientist II,Banco Bradesco,"Osasco, São Paulo, Brazil",1 day ago,"Sobre o BradescoO Bradesco é um dos maiores grupos financeiros do Brasil, com uma história marcada pelo pioneirismo e inovação. Por meio da nossa carteira amplamente diversificada de produtos financeiros, serviços bancários e de seguros contribuímos com a realização das pessoas e o crescimento sustentável de empresas e sociedade. Venha fazer parte do nosso ecossistema financeiro e impactar a experiência de milhões de pessoas!No Bradesco valorizamos a diversidade em todas as suas formas. Por isso, as nossas vagas são abertas a todas as pessoas, independentemente de gênero, raça, orientação sexual, deficiência, idade ou qualquer outra característica.Saiba mais em https://banco.bradesco/html/classic/sobre/index.shtmResponsabilidades e atribuiçõesO que é o nosso time de Controladoria?Temos a missão de garantir ao Grupo Bradesco informações gerenciais, resultados, análises e projeções com governança, bem como ser referência em análises, estudos e projeções de finanças para aumentar a qualidade e precisão das decisões tomadas pela Organização.Modelo de trabalho : Híbrido - 2x PresencialUnidade: Osasco - SPComo será seu dia a dia?Sendo Data Scientist II, atuará na gerência FP&A Prime e Principal e suas principais atividades serão:Desenvolver análises e estudos de desempenho.Elaborar projeções e forecasts financeiros.Apoiar construção e acompanhamento de orçamento.Analisar indicadores e performance de negócio.Manipular grandes volumes de dados.Construir dashboards e relatórios gerenciaisAplicar análise estatística.Interagir com áreas de negócio.Requisitos e QualificaçõesO que você precisa ter ou saber?Experiência com análise de dados.Conhecimento avançado em SQL.Experiência com Databricks.Conhecimento em SAS.Experiência com Power BI.Noções de estatística.Conhecimento em finanças.Capacidade analítica e organização.Será um diferencial se você tiver:Experiência em FP&A.Vivência no setor financeiro.Experiência com projeções financeiras.Boa comunicação com áreas de negócio.O que nós oferecemosNo Bradesco valorizamos a saúde e bem-estar, oferecendo um extenso portfólio de benefícios a todas nossas pessoas funcionárias:PLR ou Bônus: Conforme a elegibilidade de cargo*Convênio MédicoConvênio OdontológicoSeguro de VidaVale AlimentaçãoVale Refeição13º Cesta AlimentaçãoTotal PassVale Transporte (adesão opcional)Descontos em produtos e serviços em empresas parceirasPrevidência Privada (adesão opcional, com participação financeira da Organização Bradesco)Viva Bem Bradesco: programa de saúde, bem-estar e qualidade de vidaUnibrad: Universidade Corporativa BradescoIsenção de Tarifas: condições especiais em diversos produtos e serviçosAuxílio Creche ou BabáLicença Paternidade estendida de 20 diasLicença Maternidade de 180 dias, acompanhamento assistencial da gestação até o pós-partoShow moreShow less",N/A,On-site/Hybrid,https://www.linkedin.com/jobs-guest/jobs/api/jobPosting/4428178345,2026-06-14
