title,company,location,posted,description,applicants,work_mode,link,data_coleta
Cientista de Dados III,Bunge,"São Paulo, São Paulo, Brazil",2 days ago,"City :Sao PauloState :São Paulo (BR-SP)Country :Brazil (BR)Requisition Number :42627Bunge has an exciting opportunity available for a Principal Data Scientist. In this role you will be part of a global team working on challenging, meaningful projects impacting core business activities. Since 1818, Bunge has been connecting farmers to consumers to deliver essential food, feed, and fuel to the world. Looking to the future, our ambition is to continuously reinvent ourselves, leveraging data to be at the forefront of analytics, technology and talent to accomplish our purpose in a better, faster and simpler way. Bunge is committed to operating and thriving in the digital world – creating world class agile teams where teammates are empowered and encouraged to collaborate and test and learn to succeed.At Bunge, people don’t just come here to work, they come here to grow – solving challenges that directly impact the world with a diverse team of thinkers and doers. Bunge offers a strong compensation and benefits package, generous paid time off program, flexible work arrangements, and opportunity to progress. Our hybrid work environment provides a balance of in-office and remote work.Most importantly, in all we do we live our values:Act as One Team by fostering inclusion, collaboration, and respectDrive for Excellence by being agile, innovative and efficientDo What's Right by acting safely, ethically, and sustainablyOverview:We are seeking a highly motivated and experienced Principal Data Scientist with strong expertise in pricing optimization to join our growing team. As Principal Data Scientist, you will be a critical technical lead of the Business Technology Data and Analytics team, responsible for leading the construction and optimization of large-scale models to solve business problems and communicate the value to the business stakeholders. You will also be responsible for working with cross-functional teams to identify and prioritize data analytics initiatives, driving significant impact throughout our global value chains.Essential Functions:Main AccountabilitiesDesign, create, test and implement complex modeling and algorithmic systems that drive value throughout the organization.Responsible for leading large-scale data science initiatives from POC to productionDesign and structure reusable codebase utilizing data science best practice and supports the sustainability of our technical portfolio.Collaborate with various stakeholders to understand business problems to implement scalable and sustainable solutions.Work closely with Data Scientists, Analysts and Data Engineers to build and deliver valuable analytical solutions.Communicates and document the design, functioning and output of the analytical models/solutions developed to a variety of audience.Ensure timely deliverables and testing for regular maintenance of solutions over timeCommunicate data insights and value articulation to stakeholders.Serve as a technical lead and point of contacts to product managers, business partners and collaborators.Contribute to a culture of learning through technical mentoring and tools sharing.Major Opportunities and DecisionsThe problems faced are difficult and often complex and multi-dimensional. Decisions and problem-solving are guided by policies, procedures, and business plan; Anticipates and interprets internal or external issues and recommends solutions/best practices. Applies acquired expertise to analyze and solve problems without clear precedent.Management/LeadershipManages operational plans, large projects and/or processes with limited oversight from manager. Leads and/or participates with comparable influence in large projects/initiatives; AND/OR provides leadership to professionals and support. Contributes to short to mid term (1-3 years) talent optimization plans to execute on strategies in job area.Key Relationships, Stakeholders & InterfacesStakeholders of this role include Leadership team members, business leaders as well as technical experts making highly developed interpersonal & soft skills are important. One should be tech-savvy and business-savvy as well, should understand business, different types of data analytics technologies, apply methods to valuable authentication, prevent frauds. It is crucial to shape data products in alignment with corporate strategy and provide data insights leading to business directions.Minimum Requirements:Post graduate degree in STEM field or bachelor’s degree with a combination of 5 + years of experience as in Data Science or Computer Science, IT or a related field.Strong foundations in math, analytics and computer science, knowledge of machine learning methods, statistical models, advanced data science programming.5+ years of hands-on working experience / fluency in Python and SQL.Comfortable with scripting language such as bash.Experience writing reusable and maintainable code with version control, ability to transform a project from POC to production.Experience building and deploying resilient data and modeling pipelines in the cloud environment.Experience with at least one major cloud platform (GCP, AWS or Azure), with preference to GCP services including but not limited to Compute Engine, Big Query, Cloud Run, and Cloud Composer.Creative and self-motivated. Demonstrate drive to learn new skills and solve challenging problems.Act as a great team player in a global environment, take responsibility to consistently build better solutions both in technical quality and business impact.Preferred Qualifications:Good understanding of software development, best practice, and ability to apply that to machine learning projects, including unit tests, CI/CD integration.Experience using Infrastructure as Code (IaC) such as Terraform.Experience implementing Kubernetes and Docker (or similar container engine) solutionsObtained Google Cloud Professional certifications in areas such as MLE, data engineer, DevOps engineer.Experience working with customer analytics and pricing optimization, and domain knowledge in global agri-business is a plus.At Bunge (NYSE: BG), our purpose is to connect farmers to consumers to deliver essential food, feed and fuel to the world. As a premier agribusiness solutions provider, our team of :37,000 dedicated employees partner with farmers across the globe to move agricultural commodities from where they’re grown to where they’re needed—in faster, smarter, and more efficient ways. We are a world leader in grain origination, storage, distribution, oilseed processing and refining, offering a broad portfolio of plant-based oils, fats, and proteins. We work alongside our customers at both ends of the value chain to deliver quality products and develop tailored, innovative solutions that address evolving consumer needs. With 200+ years of experience and presence in over 50 countries, we are committed to strengthening global food security, advancing sustainability, and helping communities prosper where we operate. Bunge has its registered office in Geneva, Switzerland and its corporate headquarters in St. Louis, Missouri. Learn more at Bunge.com.Every day our people exemplify these values, which represent Bunge at its core:We Are One Team – Collaborative, Respectful, InclusiveWe Lead The Way – Agile, Empowered, InnovativeWe Do What’s Right – Safety, Sustainability, With IntegrityIf this sounds like you, join us! We value and invest in people who believe in our purpose and are excited to live it every day – people who are #ProudtoBeBungeShow moreShow less",N/A,Remote,https://www.linkedin.com/jobs-guest/jobs/api/jobPosting/4361620449,2026-01-16
Cientista de Dados Júnior,Farmtech,Greater São Paulo Area,1 week ago,"VENHA TRANSFORMAR O AGRO COM A GENTE!O#TeamFarmestá crescendo e queremos você com a gente!Desde 2017, lideramos a revolução do crédito no agronegócio. Já viabilizamos mais deR$ 25 bilhõespara fortalecer esse ecossistema tão importante, conectando todos os elos da cadeia agro: da indústria ao produtor rural. Nosso time é feito de#farmers incríveis, com diferentes histórias e experiências, unidos por um propósito:facilitar o acesso ao crédito rápido, simples e seguro e liderar a transformação do agro no Brasil.Aqui na Farm, fazemos do nosso jeito, com a nossa cara:Cliente no centro de tudo.Colaboração que transforma.Acreditamos que o agro muda o mundo. E você pode fazer parte dessa mudança!Vem com a gente“Do clique pra dentro”.______________________________________________________________Sobre a oportunidade:Na Farmtech, dados são parte central da tomada de decisão. Buscamos uma pessoa Cientista de Dados Júnior que tenha curiosidade analítica, vontade de aprender e interesse em transformar dados em informação útil para o negócio. Essa posição é ideal para quem está no início da carreira em dados e quer se desenvolver em um ambiente dinâmico, com acompanhamento técnico, desafios reais e contato próximo com áreas de negócio, crédito e tecnologia.Principais atividades:Apoiar na manipulação e análise de bases de dados estruturadas e não estruturadas;Apoiar na criação, atualização e manutenção de relatórios gerenciais e dashboards;Auxiliar na geração de insights para o negócio a partir de análises de dados;Apoiar estudos estatísticos básicos para identificação de padrões, tendências e desvios;Auxiliar em backtests simples, validações e monitoramento de indicadores, modelos ou segmentações;Apoiar testes de parâmetros e análises exploratórias de dados;Contribuir na organização, documentação e entendimento de processos internos relacionados a dados;Apoiar iniciativas de automação e padronização de rotinas de coleta e análise de dados;Interagir com áreas parceiras (crédito, produtos, tecnologia e negócios) de forma colaborativa.Hard Skills (requisitos Técnicos)Conhecimento em análise de dados (Excel avançado ou similar);Noções de SQL para consulta e manipulação de dados;Experiência acadêmica ou inicial com ferramentas de BI (Power BI, Looker, Tableau ou similares);Conhecimento básico em estatística descritiva;Familiaridade com documentação de análises e processos;Noções de versionamento de código (Git é diferencial);Inglês técnico para leitura e entendimento de materiais.Conhecimento básico em Python ou R;Experiência acadêmica ou estágio em dados, crédito, risco, modelagem ou áreas correlatas;Diferenciais (não obrigatórios):Vivência com ferramentas de organização (Jira, Confluence, Notion, Monday).FormaçãoEnsino superior completo ou em fase final em: Estatística, Matemática, Engenharia, Economia, Ciência da Computação, Sistemas de Informação ou áreas correlatas.Soft SkillsPensamento analítico e curiosidade intelectual;Organização e gestão do tempo;Atenção aos detalhes;Proatividade e vontade de aprender;Boa comunicação e clareza ao explicar análises;Capacidade de receber feedback e evoluir;Trabalho em equipe e colaboração;Adaptabilidade e resiliência;Senso de responsabilidade.O que esperamos dessa posiçãoEvolução técnica ao longo do tempo;Desenvolvimento de autonomia gradual;Capacidade de transformar dados em informações úteis;Crescimento para níveis mais avançados da área de dados._________________________________________________Por que a Farm?Além de um ambiente de aprendizado contínuo, colaborativo e dinâmico, aqui você terá a chance de participar de um projeto com impacto real no agro brasileiro. Com a gente, você vai crescer, desafiar o status quo e construir o futuro do crédito.Show moreShow less",N/A,On-site/Hybrid,https://www.linkedin.com/jobs-guest/jobs/api/jobPosting/4358582528,2026-01-16
Intern Data Scientist Brazil,Artefact,"São Paulo, São Paulo, Brazil",1 day ago,"Who We AreArtefact is a new generation of a data service provider, specialising in data consulting and data-driven digital marketing, dedicated to transforming data into business impact across the entire value chain of organisations. We are proud to say we’re enjoying skyrocketing growth.Our broad range of data-driven solutions in data consulting and digital marketing are designed to meet our clients’ specific needs, always conceived with a business-centric approach and delivered with tangible results. Our data-driven services are built upon the deep AI expertise we’ve acquired with our 300+ internation brands around the globe.We have 800+ employees across 16 offices in 13 countries who are focused on accelerating digital transformation. Thanks to a unique mix of company assets: State of the art data technologies, lean AI agile methodologies for fast delivery, and cohesive teams of the finest business consultants, data analysts, data scientists, data engineers, and digital experts, all dedicated to bringing extra value to every client.What You Will Be DoingYou will join our Data Marketing Consulting team which helps clients transform and improve their marketing strategy by applying advanced analytics to generate value-creating insights from big data and artificial intelligence.Key ResponsibilitiesAs a Data Scientist Intern, your role will encompass:Conducting ambitious projects in the transformation of clients through dataCollaborating with the other Divisions (Activation, Creativity, and Strategy) to provide comprehensive services to your clientsDeveloping privileged relationships with our clients, using your technical abilities to assist in the transformation of their marketing departmentAmong your responsibilities as a Data Scientist Intern, you will be responsible for:Performing data projectsSecuring delivery on your projectsCommunicating your work and achievements among the teamWorking closely with your Consulting counterpart to build and maintain strong relationships with your clients and best understand their needsEnsuring that your solutions are bringing values to the client problematicBeing a good team player, knowing your role and responsibility in the global ambitionBeing a great tech personDemonstrating the skill and credibility required to ensure the success of our clients’ initiativesResearching and developing new technical approaches to address problems efficientlySharing best practices and contributing to Artefact’s institutional knowledgeEmbodying Artefact’s values and inspiring others to do the sameWhat We Are Looking ForCurrently pursuing a BA/BS or MA/MS in machine learning, mathematics, computer science, or related fields (computer science, statistics, engineering, economics, or a related field) from an accredited college or university.0-1 years of related experience supporting engineering, information technology or other technical operations. A first experience (internship, school project, Junior Entreprise, etc.) in consulting and/or data ecosystem would be a plus.Good understanding of the digital and data ecosystem and its technologies: web analytics, programmatic, DMP, Datalake, dataviz, data science, etc.Strong interest in marketing & business issuesIntellectual curiosity, along with on excellent problem-solving skill, including the ability to disaggregate issues, identify root causes and recommend solutionsA practical and analytical mind-set, you will be passionate about the creation of bespoke solutions for our clientsContinuously striving for high performance in all you doGood Communication skillsIdeal candidates should be passionate about using business acumen along with big data and analytics to address real-world problems and drive significant change.Why you should join usArtefact is the place to be: come and build the future of marketingProgress: every day offers new challenges and new opportunities to learnCulture: join the best team you could ever imagineEntrepreneurship: you will be joining a team of driven entrepreneurs. We won’t give up until we make a huge dent in this industry!Come join us!Show moreShow less",N/A,On-site/Hybrid,https://www.linkedin.com/jobs-guest/jobs/api/jobPosting/4308483980,2026-01-16
Data Scientist (Contract),Counterpart,"São Paulo, São Paulo, Brazil",1 month ago,"Machine Learning Engineer (Contract)Location: Argentina, Brazil, Colombia, Chile, Mexico, Dominican RepublicJob DescriptionCounterpart is a modern management & professional liability insurance platform for the 21st century workplace. platform for the 21st century workplace. We offer products and services to help companies align the risks and incentives of creating great organizations. Our platform is designed to measure risk more efficiently using the most advanced rating system in the industry, while also proactively mitigating the risks of our insureds. Ultimately, we provide businesses with the framework to be the best versions of themselves. That's where you come in.As a Data Scientist, you will balance being a prolific individual contributor to our pipelines, tables, and models while steering the development of our products and services through the development, maintenance, and application of data. You will help bridge the gap between Engineering & Business with insights while driving the development of our data services.AS A DATA SCIENTIST YOU WILL:Collaborate with insurance domain experts and engineering team members to predict insurance claims based on hundreds of different variables using sophisticated data science techniques.Support the production of new data sources (e.g. web scraping, public/private APIs,) in a manner that minimizes development cycles while maximizing potential business applications.Continuously challenge how we can improve our underwriting while reducing the number of questions that need to be answered in an application.Maintain a clean production environment such that the data models can be easily interpreted and built upon by other data science and engineering team members.Present your work, findings, and opinions to both technical and non-technical stakeholders.Build and support a team of data scientists and analysts to accelerate our learnings and elevate our product offerings.WE LOOK FOR TEAMMATES WHO HAVE:Bachelor/Master in quantitative discipline (computer science, mathematics, statistics, economics, physics, engineering or related field).3+ years of experience as a data scientist, data analyst or machine learningExperience training machine learning models that have been deployed to execute business decisions5+ years experience with Python, including the typical data science stack (pandas, scikit-learn, numpy, scipy, Jupyter, etc)Strong understanding of data science metrics and methodologies for measuring model performanceExperience tracking model performance in productionComfortable building clean, repeatable experiments in a notebook environmentCommunications skills for translating technical or statistical analysis results into business recommendations.Familiarity with the tradeoffs of scaling data infrastructure and database systems.Bias to practical action and creativity using data (we value past or present projects that support this).WHO YOU WILL WORK WITH:Elizabeth Barsalou, Manager Data Scientist:Before joining Counterpart, Elizabeth worked as a full stack data scientist in small business lending for Kabbage and BHG. She specialized in building data science models, infrastructure and strategies to extend credit to small businesses. She lives in New York and spends her free time singing opera and playing with her dog.Stanley Wang, Director, Pricing Analytics:Before joining Counterpart, Stanley worked as an actuary within the pricing solutions and methods team at USAA to combine actuarial pricing with data science models. Before that, he was a leading data scientist for Digital Partners, a Munich Re Company where he specialized in building data science models and insights for leading insurtech companies. He has had many other relevant roles such as capital modeling, risk management etc. He lives in New York with his growing family.Newton Troung, Lead Data Engineer: Newton has almost a decade of experience in platform and data engineering. In his last company Thrive Market, he had a hand in building out new microservices and architecting data pipelines with Airflow and Spark. He's vegetarian and loves trying new restaurants when traveling. Nowadays he's busy keeping up with his 2-year-old and doing outdoor activities with his family.COUNTERPART'S VALUESConjoin Expectations- it is the cornerstone of autonomy. Ensure you are aware of what is expected of you and clearly articulate what you expect of others.Speak Boldly & Honestly- the only failure is not learning from mistakes. Don't cheat yourself and your colleagues of the feedback needed when expectations aren't being met.Be Entrepreneurial- control your own destiny. Embrace action over perfection while navigating any obstacles that stand in the way of your ultimate goal.Practice Omotenashi(""selfless hospitality"") - trust will follow. Consider every interaction with internal and external partners an opportunity to develop trust by going above and beyond what is expected.Hold Nothing As Sacred- create routines but modify them routinely. Take the time to reflect on where the business is today, where it needs to go, and what you have to change in order to get there.Prioritize Wellness- some things should never be sacrificed. We create an environment that stretches everyone to growWE OFFERWork from Anywhere- Counterpart is a fully distributed company, meaning there is no office. We allow employees to work from wherever they do their best work, of course prioritizing meetings that often happen in US time zones.Language Classes -We sponsor up to $100 per calendar year to be used towards language classes to help support your English language skills.Paid Vacation and Time OffParental Leave -Development Partners will be eligible for unpaid Parental Leave to bond with a newborn, newly-adopted, or newly placed child. Under this policy, development partners and independent contractors will be eligible for up to 8 weeks of unpaid parental leave. Any time off will be subject to approval and must be requested at least 45 days in advance.Computer -We reimburse you for your locally procured Macbook Pro. If you are still with the company after one year, it is yours to keep!Our estimated pay range for this role isUSD $70,000 - $80,000 annually. Contractor compensation is determined by a variety of factors, including but not limited to, market data, location, internal equitability, and experience.We are committed to being a welcoming and inclusive workplace for everyone, and we are intentional about making sure people feel respected, supported and connected at work—regardless of who you are or where you come from. We value and celebrate our differences and we believe being open about who we are allows us to do the best work of our lives.We are an Equal Opportunity Employer. We do not discriminate against qualified applicants or employees on the basis of race, color, religion, gender identity, sex, sexual preference, sexual identity, pregnancy, national origin, ancestry, citizenship, age, marital status, physical disability, mental disability, medical condition, military status, or any other characteristic protected by federal, state, or local law, rule, or regulation.Show moreShow less",N/A,On-site/Hybrid,https://www.linkedin.com/jobs-guest/jobs/api/jobPosting/4342532184,2026-01-16
