title,company,location,posted,description,applicants,work_mode,link,data_coleta
Data Scientist [All Levels],Nubank,"São Paulo, São Paulo, Brazil",4 days ago,"About UsNu was born in 2013 with the mission to fight complexity to empower people in their daily lives by reinventing financial services. We are one of the world’s largest digital banking platforms, serving millions of customers across Brazil, Mexico, and Colombia. For more information, visit our institutional page https://international.nubank.com.br/careers/Data Science at NubankData Science is essential to every part of the business at Nubank, since Day 1. Most areas of the company use data science to some extent. Data Scientists are responsible for translating business needs into models and other types of data-driven solutions.As a Data Scientist, you’re expected toInteract with other team members to understand how to best apply data science and artificial intelligence to Nubank’s problems;Investigate problems and discover insights through exploratory data analysis and other quantitative methods;Have great numerical and analytical literacy, including knowledge of statistics and linear algebra as needed;Work on multiple stages of the ML model lifecycle–from ideation to training and steady-state operation;Work across multiple types of models, algorithms and learning paradigms;Communicate technical points, decisions and tradeoffs to peers and stakeholders;Our ideal candidateHas experience working with ML models in a production environment;Understands possible pitfalls and tradeoffs when applying ML to real-word, sometimes messy problems;Is familiar with the technical aspects of learning theory and algorithms and is able to discuss details if needed;Has experience working with the Python scientific stack (Numpy, Pandas, Scipy, Sklearn, Boosted Tree Libraries, etc);Has experience working with Tensor/Deep Learning libraries such as Tensorflow and Pytorch;Is able to connect analytical outcomes to business priorities and advise stakeholders on the best course of action;Has good communication skills and is able to convey technical topics and decision points to diverse audiences;Has experience writing general-purpose code using modern tools;Understands the implications of causality when applying ML to problems;Is up-to-date with recent developments in the area as a whole and is able to identify opportunities for improvement and innovation;Our BenefitsChance of earning equity at NubankFood/ Meal Card (Vale-Refeição and/or Vale Alimentação)Public Transportation Commuting Benefit (Vale-Transporte)NuCare – Psychological, Financial and Legal Assistance ProgramLife InsuranceMedical PlanDental PlanNuLanguage – Language Course ProgramNucleo - Our learning platform of coursesExtended Parental LeaveDaycare AllowanceParental ConsultancyWork-from-home AllowanceGym Partnerships30 days of paid vacationWork Model for this RoleHybrid 2-3 times/week:Our hybrid work model brings us to the office at least twice a week, on strategic days designed to maximize team connection and collaboration. For more details, visit https://building.nubank.com/nu-hybrid-work-model/Show moreShow less",N/A,On-site/Hybrid,https://www.linkedin.com/jobs-guest/jobs/api/jobPosting/4364197061,2026-04-23
Data Scientist I - AI Engineer,Banco Bradesco,"São Paulo, São Paulo, Brazil",5 days ago,"Sobre o BradescoO Bradesco é um dos maiores grupos financeiros do Brasil, com uma história marcada pelo pioneirismo e inovação. Por meio da nossa carteira amplamente diversificada de produtos financeiros, serviços bancários e de seguros contribuímos com a realização das pessoas e o crescimento sustentável de empresas e sociedade. Venha fazer parte do nosso ecossistema financeiro e impactar a experiência de milhões de pessoas!No Bradesco valorizamos a diversidade em todas as suas formas. Por isso, as nossas vagas são abertas a todas as pessoas, independentemente de gênero, raça, orientação sexual, deficiência, idade ou qualquer outra característica.Saiba mais em https://banco.bradesco/html/classic/sobre/index.shtmResponsabilidades e atribuiçõesO que é o nosso time de Operações de Negócios (ON)?Somos responsáveis por executar com eficiência as atividades de pós-comercialização dos produtos e serviços da Organização, atendendo as solicitações dos clientes e oferecendo soluções operacionais possibilitando o autosserviço.Modelo de trabalho : Híbrido - 1x PresencialUnidade: Vila Leopoldina/SPComo será seu dia a dia?Sendo Data Scientist I - AI Engineer, atuará na gerência IA e Operações e suas principais atividades serão:Apoiar o desenvolvimento de experimentos de Inteligência Artificial e análises de dados.Auxiliar na criação, testes e validação de soluções iniciais de IA, incluindo uso de IA Generativa.Realizar análises exploratórias de dados e apoiar a validação de hipóteses.Contribuir na elaboração de materiais, apresentações e workshops sobre IA e dados.Documentar experimentos, aprendizados, decisões e resultados obtidos.Trabalhar de forma colaborativa com pessoas mais experientes, aprendendo boas práticas técnicas e analíticas.Requisitos e QualificaçõesO que você precisa ter ou saber?Graduação em andamento ou concluída em Ciência de Dados, Ciência da Computação, Engenharia ou áreas correlatas.Desejável experiência inicial em Ciência de Dados, Analytics ou Inteligência Artificial, adquirida por meio de Estágio, Projetos acadêmicos, Bootcamps e Projetos pessoais.Python (básico a intermediário).Bibliotecas de dados como Pandas e NumPy (nível básico).Noções fundamentais de Machine Learning e Inteligência Artificial.Uso de VS Code com GitHub Copilot+ ou interesse em utilizá-lo.Será um diferencial se você tiver:Interesse ou contato inicial com IA Generativa, LLMs ou automação inteligente.Familiaridade básica com visualização de dados ou análise exploratória.Curiosidade por aplicações práticas de IA em problemas reais.O que nós oferecemosNo Bradesco valorizamos a saúde e bem-estar, oferecendo um extenso portfólio de benefícios a todas nossas pessoas funcionárias:PLR ou Bônus: Conforme a elegibilidade de cargo*Convênio MédicoConvênio OdontológicoSeguro de VidaVale AlimentaçãoVale Refeição13º Cesta AlimentaçãoTotal PassVale Transporte (adesão opcional)Descontos em produtos e serviços em empresas parceirasPrevidência Privada (adesão opcional, com participação financeira da Organização Bradesco)Viva Bem Bradesco: programa de saúde, bem-estar e qualidade de vidaUnibrad: Universidade Corporativa BradescoIsenção de Tarifas: condições especiais em diversos produtos e serviçosAuxílio Creche ou BabáLicença Paternidade estendida de 20 diasLicença Maternidade de 180 dias, acompanhamento assistencial da gestação até o pós-partoShow moreShow less",N/A,On-site/Hybrid,https://www.linkedin.com/jobs-guest/jobs/api/jobPosting/4403482174,2026-04-23
Data Scientist Specialist,Banco Bradesco,"Osasco, São Paulo, Brazil",1 week ago,"Sobre o BradescoO Bradesco é um dos maiores grupos financeiros do Brasil, com uma história marcada pelo pioneirismo e inovação. Por meio da nossa carteira amplamente diversificada de produtos financeiros, serviços bancários e de seguros contribuímos com a realização das pessoas e o crescimento sustentável de empresas e sociedade. Venha fazer parte do nosso ecossistema financeiro e impactar a experiência de milhões de pessoas!No Bradesco valorizamos a diversidade em todas as suas formas. Por isso, as nossas vagas são abertas a todas as pessoas, independentemente de gênero, raça, orientação sexual, deficiência, idade ou qualquer outra característica.Saiba mais em https://banco.bradesco/html/classic/sobre/index.shtmResponsabilidades e atribuiçõesO que é o nosso time de Crédito?Temos como missão garantir uma gestão eficiente na concessão e manutenção de crédito, que assegure rentabilidade e o crescimento com solidez dos ativos da Organização.Modelo de trabalho : Híbrido - 2x PresencialUnidade: Osasco/SPComo será seu dia a dia?Sendo Data Scientist Specialist, atuará na gerência Gestão de portfólio projetos e suas principais atividades serão:Direcionar a estratégia de originação, garantindo o cumprimento das concentrações máximas estabelecidas para as carteiras.Realizar estudos de mercado para identificar oportunidades de negócio e recomendar ações aos diferentes segmentos de clientes.Definir e revisar fronteiras Hard/Soft em conjunto com a área de Riscos, apresentando os limites aos segmentos envolvidosDesenvolver análises de clusterização, identificando perfis ideais e padrões relevantes para apoio à decisão.Monitorar limites de risco e acionar a área de Riscos para emissão de alertas aos segmentos quando houver aproximação dos limites definidos.Realizar segmentações e análises de cluster para apoiar estratégias comerciais e de risco.Manipular grandes bases de dados, estruturando informações para análises e tomadas de decisão.Avaliar soluções analíticas internas e externas, identificando ferramentas, metodologias e tecnologias que possam agregar valor ao negócioRequisitos e QualificaçõesO que você precisa ter ou saber?Experiência nas áreas de Modelagem Estatística, Políticas de Crédito e Gestão de Portfólio.Domínio em programação Python e SQL.Inglês intermediário a avançado.Será um diferencial se você tiver:Conhecimento em SAS.O que nós oferecemosNo Bradesco valorizamos a saúde e bem-estar, oferecendo um extenso portfólio de benefícios a todas nossas pessoas funcionárias:PLR ou Bônus: Conforme a elegibilidade de cargo*Convênio MédicoConvênio OdontológicoSeguro de VidaVale AlimentaçãoVale Refeição13º Cesta AlimentaçãoTotal PassVale Transporte (adesão opcional)Descontos em produtos e serviços em empresas parceirasPrevidência Privada (adesão opcional, com participação financeira da Organização Bradesco)Viva Bem Bradesco: programa de saúde, bem-estar e qualidade de vidaUnibrad: Universidade Corporativa BradescoIsenção de Tarifas: condições especiais em diversos produtos e serviçosAuxílio Creche ou BabáLicença Paternidade estendida de 20 diasLicença Maternidade de 180 dias, acompanhamento assistencial da gestação até o pós-partoShow moreShow less",N/A,On-site/Hybrid,https://www.linkedin.com/jobs-guest/jobs/api/jobPosting/4402068083,2026-04-23
Analista Cientista de Dados I,Serasa Experian,"São Paulo, São Paulo, Brazil",1 week ago,"Company DescriptionExperian is a global data and technology company, powering opportunities for people and businesses around the world. We help to redefine lending practices, uncover and prevent fraud, simplify healthcare, create marketing solutions, and gain deeper insights into the automotive market, all using our unique combination of data, analytics and software. We also assist millions of people to realize their financial goals and help them save time and money.We operate across a range of markets, from financial services to healthcare, automotive, agribusiness, insurance, and many more industry segments.We invest in people and new advanced technologies to unlock the power of data. As a FTSE 100 Index company listed on the London Stock Exchange (EXPN), we have a team of 22,500 people across 32 countries. Our corporate headquarters are in Dublin, Ireland. Learn more at experianplc.com.Job DescriptionJob descriptionFormaçãoCiência da Computação / Engenharia de Software / Sistemas de Informação / TI;Matemática / Estatística / Ciência de dados;ou áreas técnicas afins.Qualificação e HabilidadesConhecimento em metodologias ágeis (Scrum, Kanban);Noções de arquitetura de software e APIs;Linguagens de análise de dados (Python, R, SQL)Experiência com ferramentas de BI (Power BI, Tableau);Habilidades InterpessoaisComunicação clara com áreas de negócio.Capacidade crítica, analítica e resolução de problemas.Organização e documentação.Principais ResponsabilidadesExecução das configurações e Parametrizações de Orquestração;Prestar atendimento as Demandas do Setor;Apoio Técnico a Projetos (Ágeis , Preditivos);Execução de Documentação Tecnica e funcional;Consolidação e Apresentação dos dados e Métricas;Analise de Dados;Geração de Dashboards;Preparar/Executar Plano de Ação dos apontamentos identificados;Analise Técnica ;Levantamento de requisitos;Analise das execuções de orquestração;Identificação de padrão/insights;. Suporte à tomada de decisão baseada em dadosQualificationsQualificationsSQLPYTHONPOWERBIFRAUD PREVENTIONDATA MODELINGANALYTICSAdditional InformationA Serasa Experian é muito mais do que você imagina. Com o propósito de criar um futuro melhor, ampliando oportunidades para pessoas e empresas, no Brasil somos mais de 4 mil pessoas que atuam em diversos times e especialidades. Aqui, cada conhecimento e diversidade se complementa e você pode trabalhar no que mais ama, estamos comprometidos a construir uma cultura inclusiva e um ambiente no qual pessoas possam equilibrar a carreira com seus compromissos e interesses pessoais, prezando pelo bem-estar.A gente se dedica muito em ser uma das melhores e mais inovadoras empresas para se trabalhar do país, possibilitando experiências e carreiras incríveis para nossas pessoas. Nossa forte abordagem de pessoas em primeiro lugar é reconhecida externamente por meio de diversas certificações de mercado: fomos premiados pelo Great Place To Work™ em 24 países e pela certificação internacional Top Employers, além de sermos reconhecidos como uma das melhores empresas para jovens profissionais e contarmos com uma avaliação de 4,6 no Glassdoor. Cada reconhecimento nos indica que estamos no caminho certo, proporcionando um ambiente de trabalho cada vez melhor para nossos talentos.Experian Careers - Creating a better tomorrow togetherFind out what its like to work for Experian by clicking hereShow moreShow less",N/A,On-site/Hybrid,https://www.linkedin.com/jobs-guest/jobs/api/jobPosting/4400682126,2026-04-23
Data Scientist Specialist,Banco Bradesco,"Osasco, São Paulo, Brazil",6 days ago,"Sobre o BradescoO Bradesco é um dos maiores grupos financeiros do Brasil, com uma história marcada pelo pioneirismo e inovação. Por meio da nossa carteira amplamente diversificada de produtos financeiros, serviços bancários e de seguros contribuímos com a realização das pessoas e o crescimento sustentável de empresas e sociedade. Venha fazer parte do nosso ecossistema financeiro e impactar a experiência de milhões de pessoas!No Bradesco valorizamos a diversidade em todas as suas formas. Por isso, as nossas vagas são abertas a todas as pessoas, independentemente de gênero, raça, orientação sexual, deficiência, idade ou qualquer outra característica.Saiba mais em https://banco.bradesco/html/classic/sobre/index.shtmResponsabilidades e atribuiçõesO que é o nosso time de Controladoria?Temos a missão de garantir ao Grupo Bradesco informações gerenciais, resultados, análises e projeções com governança, bem como ser referência em análises, estudos e projeções de finanças para aumentar a qualidade e precisão das decisões tomadas pela Organização.Modelo de trabalho : Híbrido - 3x PresencialUnidade: Osasco/SPComo será seu dia a dia?Sendo Data Scientist Specialist, atuará na gerência Finance Analytics e suas principais atividades serão:Elaborar estudos de performance financeira envolvendo business units, produtos, canais e clientes, trazendo análises diagnósticas e recomendações para apoiar decisões estratégicas do Banco;Analisar a rentabilidade e o resultado de produtos e clientes em diferentes perfis e segmentos, incluindo projeções de cenários, investigação de variações e identificação de oportunidades;Aplicar técnicas estatísticas descritivas e preditivas que suportem as análises de performance financeira, conferindo embasamento científico aos estudos;Utilizar modelos de Machine Learning, supervisionados e não supervisionados, para responder a perguntas de negócio no contexto financeiro;Analisar e interpretar dados financeiros combinados com dados não financeiros e qualitativos, identificando padrões e tendências que apoiem a tomada de decisões estratégicas;Construir dashboards que ofereçam suporte às análises financeiras;Utilizar tecnologias de dados como SQL, Python, Spark, Databricks e Power BI para extração, manipulação, consolidação e visualização dos dados necessários aos estudos de performance financeira.Requisitos e QualificaçõesO que você precisa ter ou saber?Graduação em Economia, Estatística, Ciência de Dados, Matemática, Engenharias ou Contabilidade;MBA ou Pós-graduação em Controladoria, Finanças ou Business Analytics & Big Data;Conhecimento em análise de P&L e rentabilidade de produtos, canais e segmentos;Conhecimento em produtos e serviços bancários e no mercado financeiro;Experiência em Bancos ou Fintechs nas áreas de Finance/FP&A;Habilidade na manipulação de grandes volumes de dados utilizando SQL, Python e Spark;Conhecimento avançado em Power BI e DAX ou outra ferramenta de DataViz.Será um diferencial se você tiver:Conhecimento em modelos de Machine Learning, supervisionados e não supervisionados, aplicados ao contexto financeiro;Vivência em projetos de BI e/ou estudos de Data Analytics relevantes para o negócio;Experiência com produtos bancários.O que nós oferecemosNo Bradesco valorizamos a saúde e bem-estar, oferecendo um extenso portfólio de benefícios a todas nossas pessoas funcionárias:PLR ou Bônus: Conforme a elegibilidade de cargo*Convênio MédicoConvênio OdontológicoSeguro de VidaVale AlimentaçãoVale Refeição13º Cesta AlimentaçãoTotal PassVale Transporte (adesão opcional)Descontos em produtos e serviços em empresas parceirasPrevidência Privada (adesão opcional, com participação financeira da Organização Bradesco)Viva Bem Bradesco: programa de saúde, bem-estar e qualidade de vidaUnibrad: Universidade Corporativa BradescoIsenção de Tarifas: condições especiais em diversos produtos e serviçosAuxílio Creche ou BabáLicença Paternidade estendida de 20 diasLicença Maternidade de 180 dias, acompanhamento assistencial da gestação até o pós-partoShow moreShow less",N/A,On-site/Hybrid,https://www.linkedin.com/jobs-guest/jobs/api/jobPosting/4402151378,2026-04-23
Cientista de Dados (Prevenção à Fraude) - Pleno,Serasa Experian,"São Paulo, São Paulo, Brazil",11 hours ago,"Company DescriptionA Serasa Experian é a primeira e a maior Datatech do Brasil. Líder em soluções de inteligência para análise de riscos e oportunidades, com foco nas jornadas de crédito, autenticação e prevenção à fraude. Com tecnologia de ponta, inovação e os melhores talentos, transforma a incerteza do risco na melhor decisão, ajudando pessoas a realizarem seus sonhos e empresas de todos os portes e segmentos a prosperarem.Temos 22.000 pessoas operando em 32 países e a cada dia estamos investindo em novas tecnologias, profissionais talentosos e inovação para ajudar todos os clientes a maximizarem cada oportunidade. Com sede corporativa em Dublin, Irlanda, a Experian está listada na Bolsa de Valores de Londres (EXPN) e compõe o índice FTSE 100.Job DescriptionJob descriptionSomos Uma Área Que Combina Habilidades Técnicas, Conhecimento De Negócio e Visão Analítica. Nossas Decisões São Orientadas Por Dados, Sempre Com o Objetivo De Maximizar Os Resultados Para Nossos Clientes e Aumentar o Valor Gerado. O Que Esperamos De Você Para Essa PosiçãoFormação em Estatística, Ciência de Dados, Matemática, Engenharia ou áreas correlatas.Experiência em análise de dados e conhecimentos em lógica de programaçãoProficiência em SQL, Python, Databricks e PowerBIFacilidade para trabalhar com números e análise de dadosVisão analítica e orientação para resultadosBoa comunicação para apresentar insights de forma claraOrganização e atenção aos detalhesInteração com outras áreasProatividade e vontade de aprenderQualificationsQualificationsFormação em Estatística, Ciência de Dados, Matemática, Engenharia ou áreas correlatas.Experiência em análise de dados e conhecimentos em lógica de programaçãoProficiência em SQL, Python, Databricks e PowerBIAnálise de DadosAutomação de ProcessosCapacidade AnalíticaAdditional InformationA Serasa Experian é muito mais do que você imagina. Com o propósito de criar um futuro melhor, ampliando oportunidades para pessoas e empresas, no Brasil somos mais de 4 mil pessoas que atuam em diversos times e especialidades. Aqui, cada conhecimento e diversidade se complementa e você pode trabalhar no que mais ama, estamos comprometidos a construir uma cultura inclusiva e um ambiente no qual pessoas possam equilibrar a carreira com seus compromissos e interesses pessoais, prezando pelo bem-estar.A gente se dedica muito em ser uma das melhores e mais inovadoras empresas para se trabalhar do país, possibilitando experiências e carreiras incríveis para nossas pessoas. Nossa forte abordagem de pessoas em primeiro lugar é reconhecida externamente por meio de diversas certificações de mercado: fomos premiados pelo Great Place To Work™ em 24 países e pela certificação internacional Top Employers, além de sermos reconhecidos como uma das melhores empresas para jovens profissionais e contarmos com uma avaliação de 4,6 no Glassdoor. Cada reconhecimento nos indica que estamos no caminho certo, proporcionando um ambiente de trabalho cada vez melhor para nossos talentos.Experian Careers - Creating a better tomorrow togetherFind out what its like to work for Experian by clicking hereShow moreShow less",N/A,On-site/Hybrid,https://www.linkedin.com/jobs-guest/jobs/api/jobPosting/4405495194,2026-04-23
