title,company,location,posted,description,applicants,work_mode,link,data_coleta
Especialista Cientista de Dados,Serasa Experian,"São Paulo, São Paulo, Brazil",1 day ago,"Company DescriptionA Serasa Experian é a primeira e a maior Datatech do Brasil. Líder em soluções de inteligência para análise de riscos e oportunidades, com foco nas jornadas de crédito, autenticação e prevenção à fraude. Com tecnologia de ponta, inovação e os melhores talentos, transforma a incerteza do risco na melhor decisão, ajudando pessoas a realizarem seus sonhos e empresas de todos os portes e segmentos a prosperarem.Temos 22.000 pessoas operando em 32 países e a cada dia estamos investindo em novas tecnologias, profissionais talentosos e inovação para ajudar todos os clientes a maximizarem cada oportunidade. Com sede corporativa em Dublin, Irlanda, a Experian está listada na Bolsa de Valores de Londres (EXPN) e compõe o índice FTSE 100.Job DescriptionO DataLab é a unidade de pesquisa e inovação do grupo Experian na América Latina junto com a Serasa Experian no Brasil. Temos o objetivo de ser propositivo, antecipando o futuro, e consultivo, identificando oportunidades de evolução no mercado, por meio de técnicas de Inteligência Artificial e Machine Learning combinada com uso de novas fontes de dados.Criamos soluções inovadoras avançadas, que ajudam clientes e mercado a se prepararem hoje para o amanhã de decisões mais assertivas. Além de termos um olhar 360º para trocar com o que há de melhor no âmbito global, considerando o todo e produzindo soluções capazes de alcançar grande escalabilidade.Como Especialista em Ciência de Dados, você terá um papel central no time, utilizando sua experiência e conhecimentos em Machine Learning, GenAI, programação, tratamento e análise de dados para liderar tecnicamente projetos junto aos times de engenharia e negócios.Principais ResponsabilidadesPropor e implementar análises de dados avançadas e modelos de Machine Learning;Manipular eficientemente grandes volumes de dados;Colaborar com times de Engenharia de Dados, Engenharia de Software, Produtos e Negócios para entender as necessidades, sugerir soluções orientadas a dados e influenciar positivamente o rumo dos projetos;Explorar continuamente novas fontes de dados e novidades técnicas;Manter-se atualizado com as últimas pesquisas e avanços em GenAI e Machine Learning.Apresentar os resultados e recomendações para stakeholders e times executivos;Desenhar roadmaps de desenvolvimento de produtos data-driven em concordância com as necessidades de negócio;Conduzir experimentos e testes de forma ágil visando decisões conclusivas.O Que Estamos BuscandoBacharelado em Ciência de Dados, Estatística, Ciência da Computação, Engenharia, Física ou cursos relacionados;Sólidos conhecimentos em Python, principalmente em manipulação de dados, bibliotecas de análise (ex. Pandas, Numpy) e frameworks de Machine Learning (ex. scikit-learn, TensorFlow);Experiência na manipulação de grandes bases de dados, em especial armazenadas em ambiente Hadoop (HDFS), processamento distribuído de dados (PySpark) e linguagem SQL;Experiência em desenvolver e implantar modelos de Machine Learning, com bons conhecimentos em validação, tuning e monitoramento de modelos;Experiência em versionamento de código;Habilidade para o entendimento e a resolução de problemas de negócios de forma versátil e ágil;Habilidade de comunicação com pares, áreas parceiras e executivos, incluindo apresentações e tradução de insights em ações de negócios;Colaboração e trabalho em equipe;Aprendizado constante;Inglês avançado;Disponibilidade para atuação híbrida (2x na semana) em São Paulo/SP (Chácara Santo Antônio).DiferenciaisMestrado ou doutorado em alguma das áreas correlatas;Conhecimento e experiência com processamento de grafos e redes complexas;Conhecimento de frameworks de GenAI como LangChain, LangGraph, Agno ou equivalentes;Atuação prévia em produtos corporativos baseados em LLMs, RAG, MCP e sistemas multiagentes.QualificationsData sciencePythonCodingBig dataAIStatisticsAdditional InformationA Serasa Experian é muito mais do que você imagina. Com o propósito de criar um futuro melhor, ampliando oportunidades para pessoas e empresas, no Brasil somos mais de 4 mil pessoas que atuam em diversos times e especialidades. Aqui, cada conhecimento e diversidade se complementa e você pode trabalhar no que mais ama, estamos comprometidos a construir uma cultura inclusiva e um ambiente no qual pessoas possam equilibrar a carreira com seus compromissos e interesses pessoais, prezando pelo bem-estar.A gente se dedica muito em ser uma das melhores e mais inovadoras empresas para se trabalhar do país, possibilitando experiências e carreiras incríveis para nossas pessoas. Nossa forte abordagem de pessoas em primeiro lugar é reconhecida externamente por meio de diversas certificações de mercado: fomos premiados pelo Great Place To Work™ em 24 países e pela certificação internacional Top Employers, além de sermos reconhecidos como uma das melhores empresas para jovens profissionais e contarmos com uma avaliação de 4,6 no Glassdoor. Cada reconhecimento nos indica que estamos no caminho certo, proporcionando um ambiente de trabalho cada vez melhor para nossos talentos.Experian Careers - Creating a better tomorrow togetherFind out what its like to work for Experian by clicking hereShow moreShow less",N/A,On-site/Hybrid,https://www.linkedin.com/jobs-guest/jobs/api/jobPosting/4367331072,2026-02-21
Cientista de Dados Sênior - Área Consórcio,Itaú Unibanco,"São Paulo, São Paulo, Brazil",1 week ago,"O Itaú é a marca mais valiosa do Brasil, a melhor empresa para trabalhar segundo o Great Place to Work e o maior banco da América Latina. Nós impactamos diariamente mais de 98 milhões de clientes em 18 países.Somos feitos de pessoas e acreditamos que ter um time com pluralidade de origens, culturas, crenças, experiências, raças, deficiências, gêneros, orientações afetivo-sexuais e gerações ampliam as perspectivas e contribuem para um clima de respeito e valorização das diferenças.Estamos buscando uma pessoa para a posição de Cientista de Dados, que queira se desenvolver e aprender, compartilhar, colaborar e inovar, entregando valor para todos os nossos clientes.Nessa Função Você VaiA Diretoria Applied Analytics do Itaú Unibanco está em busca de profissional cientista de dados, para atuar através do uso de técnicas de Machine Learning e GenAI, compreender e resolver problemas complexos de negócio em cases de alto impacto dentro da comunidade de consórcios. É desejável que, para a vaga de Cientista de Dados o candidato:Desenvolvimento de modelos Machine LearningAgentes de IA GenerativaSoluções de otimizaçãoMonitoramento de resultados dos modelosAnalises para direcionamento de tomada de decisõesDeploy de modelos de machine LearningVaga Hibrida para São PauloFormação em Estatística, Ciência da Computação, Matemática, Física, Engenharia ou áreas correlatas.Mestrado ou Doutorado serão considerados diferenciais.Conhecimento ou experiência em modelagem estatística e técnicas de Machine Learning, incluindo manipulação de grandes volumes de dados estruturados e não estruturados.Vivência com Python, SQL, Spark e ferramentas para processamento e análise de dados.Conhecimento em novas tecnologias, como Deep Learning e GenAI, com interesse em explorar soluções inovadoras.Motivação para atuar em um time multidisciplinar, desenvolvendo soluções aplicadas a diferentes etapas do ciclo de vida do cliente.Conhecimento em modelos de classificação aplicados à concessão de crédito.Experiência com ferramentas e frameworks de IA generativa, como LangChain e LangGraph.Vivência ou interesse em fine-tuning de modelos de linguagem e construção de soluções multiagentes aplicadas a ferramentas conversacionais.Ao se tornar um ituber você tem_Vale-TransporteVale-Refeição (Restaurantes) / Vale-Alimentação (Supermercados)Plano médico (Fundação Saúde Itaú ou Central Nacional Unimed)Plano odontológico (Odontoprev ou Interodonto)Seguro de VidaPLR – Participação nos Lucros e Resultados (Mediante resultados do banco)Previdência privadaDescontos exclusivos em nossos produtos financeirosLicença maternidade e paternidade estendidaAuxílio Creche / Babá (para papais e mamães)Incentivo a estudosWellhub ou TotalPassAcesso aos Clubes de Lazer Itaú (Guarapiranga / Itanhaém e São Sebastião)+ Algumas vantagens que você pode conhecer durante o processo 😊Conheça mais sobre nossa cultura: https://www.itau.com.br/relacoes-com-investidores/noticias/cultura-itubers-e-nosso-novo-conjunto-de-valores/Estimulamos candidaturas de pessoas com deficiência em todas as nossas posições, sendo assim, sinta-se à vontade para se candidatar em vagas sinalizadas como exclusivas ou não para pessoas com deficiência. Somos comprometidos com a inclusão e valorizamos a diversidade.#VemProItaú #VemSerItuberShow moreShow less",N/A,On-site/Hybrid,https://www.linkedin.com/jobs-guest/jobs/api/jobPosting/4372210854,2026-02-21
Product Data Scientist,NielsenIQ,"Cotia, São Paulo, Brazil",20 hours ago,"R25_0014938In 100 countries around the world, NielsenIQ provides clients the most complete understanding of how the FMCG market evolves and what consumers buy. As a global leader in measurement and information, we believe providing our clients a precise understanding of the consumer is the key to making the right decisions -- decisions that can lead to profitable growth. At NielsenIQ, we’re always innovating to keep pace with emerging market trends and the increasingly diverse, demanding and connected consumer.The Product organization drives forward our product strategy for NielsenIQ’s product portfolio. From measurement strategy to delivery mechanism and applications suite, the Product Organization identifies market opportunities and shapes product offerings to enable our clients’ strategic business decision making.Job DescriptionBeing a Data Scientist in theProduct Data Science, you will play a critical role in developing the next generation of solutions we offer our clients, powered by algorithms and AI and leveraging large volumes of internal data, client data and third-party data.You’ll be actively participating with other team members in the overall Product creation process. You will be participating with other team members in the overall Product creation process. You’ll work alongside a group of talented individuals with different areas of expertise including best in class data scientists.On a daily basis you’ll be expected to:Read, write, comment, maintain, enhance, and share legible, well documented, and quality computer code translated from technical specification to fulfill product requirementsAdapt and plan implementation of statistical and analytical models (including ML/AI approaches) to production platform, guiding their integration with other production processesMaintain data integrity and quality throughout the development lifecycleActively participate in Agile workflows with the broader team which incQualificationsBachelors or Masters degree in Computer Science, Data Science, Statistics, Mathematics, Engineering or related field requiring outstanding analytical expertise and strong technical background3+ years of experience in data science/analytics/software engineering related product development and/or data solutions developmentKnowledge of statistical and machine learning methodologies: Sampling theory, Probability Theory, Variation analysis, Outlier identification techniques, Regressions, Classification, Time series analysis, Clustering, Neural Networks, etcAbility to prototype as well as support pilot programs for R&D purposes. The primary areas include – but not limited to – trend analyses, identifying gaps for improvements in coverage, representation/sampling, bias reduction, indirect estimation, data integration, automation, generalization, harmonization as well as working with different data sourcesProficient inPython, SQL, Statistical packages(scipy, sklearn, statsmodels, etc), and version control (Github)Proficient in English languagePreferred:Experience withCloud computing, ETL,advanced data processing techniques (Spark, pySpark, Hadoop, etc)Additional InformationFlexible working environmentVolunteer time offLinkedIn LearningEmployee-Assistance-Program (EAP)Our BenefitsFlexible working environmentVolunteer time offLinkedIn LearningEmployee-Assistance-Program (EAP)About NIQNIQ is the world’s leading consumer intelligence company, delivering the most complete understanding of consumer buying behavior and revealing new pathways to growth. In 2023, NIQ combined with GfK, bringing together the two industry leaders with unparalleled global reach. With a holistic retail read and the most comprehensive consumer insights—delivered with advanced analytics through state-of-the-art platforms—NIQ delivers the Full View™. NIQ is an Advent International portfolio company with operations in 100+ markets, covering more than 90% of the world’s population.For more information, visit NIQ.comWant to keep up with our latest updates?Follow us on: LinkedIn | Instagram | Twitter | FacebookOur commitment to Diversity, Equity, and InclusionNIQ is committed to reflecting the diversity of the clients, communities, and markets we measure within our own workforce. We exist to count everyone and are on a mission to systematically embed inclusion and diversity into all aspects of our workforce, measurement, and products. We enthusiastically invite candidates who share that mission to join us. We are proud to be an Equal Opportunity/Affirmative Action-Employer, making decisions without regard to race, color, religion, gender, gender identity or expression, sexual orientation, national origin, genetics, disability status, age, marital status, protected veteran status or any other protected class. Our global non-discrimination policy covers these protected classes in every market in which we do business worldwide. Learn more about how we are driving diversity and inclusion in everything we do by visiting the NIQ News Center: https://nielseniq.com/global/en/news-center/diversity-inclusionShow moreShow less",N/A,On-site/Hybrid,https://www.linkedin.com/jobs-guest/jobs/api/jobPosting/4339036457,2026-02-21
Cientista de Dados - Centro de Inteligência Analítica (T.I),Manserv,"São Caetano do Sul, São Paulo, Brazil",2 weeks ago,"DESCRIÇÃODescrição Das ResponsabilidadesRealizar análises exploratórias e avançadas de dados estruturados e não estruturados.Desenvolver modelos estatísticos, preditivos e de machine learning.Construir hipóteses analíticas e validará resultados com base em dados.Gerar insights e recomendações para apoio às decisões estratégicas.Monitorar o desempenho, a acurácia e a estabilidade dos modelos.Documentar modelos, premissas, métricas e resultados.Requisitos e QualificaçõesEnsino superior completo em áreas como Estatística, Matemática, Ciência da Computação, Engenharia, Economia, Física ou áreas correlatas.Pós-graduação, MBA ou especialização em Ciência de Dados, Estatística Aplicada, Inteligência Artificial, Machine Learning ou Analytics.Experiência prática em projetos de análise de dados e/ou ciência de dados.Vivência no desenvolvimento, validação e acompanhamento de modelos analíticos.Experiência em interação com áreas de negócio para entendimento de problemas e apresentação deresultados.Experiência em ambientes corporativos de médio ou grande porte.Inglês técnico para leitura de documentos.Linguagens de programação: Python (obrigatório)Bibliotecas: Pandas, NumPy, Scikit-learn (obrigatório)SQL para consulta e manipulação de dadosFerramentas de visualização de dadosNoções de versionamento de código (Git)Conhecimento em ambientes cloud e/ou Big DataConhecimentos em modelos de linguagem LLMs e aplicações de IA generativa, como RAG, será considerado diferencial.BenefíciosOferecemos um pacote de benefícios atrativo, incluindo diversas vantagens que valorizam o bem-estar e a satisfação dos nossos colaboradores.Todos os processos seletivos são inclusivos e consideram pessoas com ou sem deficiência, desde que qualificados para as vagas anunciadas.Número de vagas: 2Local de trabalho: São Caetano do Sul, SPRegime de contratação de tipo: Efetivo – CLTJornada: Período IntegralÁrea e especialização profissional: Informática, TI, Telecomunicações - Administrador de Banco de DadosNível hierárquico: EspecialistaREQUISITOSEscolaridade Mínima: Pós-graduação - Especialização/MBABENEFÍCIOSWellhubParcerias EducacionaisCartão Multi BenefíciosSeguro de VidaAssistência médicaVale TransporteVale RefeiçãoAssistência odontológicaShow moreShow less",N/A,On-site/Hybrid,https://www.linkedin.com/jobs-guest/jobs/api/jobPosting/4369743305,2026-02-21
CIENTISTA DE DADOS ESPECIALISTA,Suzano,"São Paulo, São Paulo, Brazil",10 hours ago,"Descrição da vagaQUEM SOMOS?Prazer, somos a Suzano!Aqui a gente acredita que inovação e sustentabilidade caminham juntas. Dessa união, nasce uma atitude plena de significado: a inovabilidade. Pautados por ela, pensamos fora da caixa e enxergamos longe para lidar com os desafios do século 21. Nós plantamos e cultivamos árvores para transformar essa matéria-prima renovável em Bioprodutos para o dia a dia de mais de 2 bilhões de pessoas. Cultivamos a vida na folha do caderno que alfabetiza as crianças, na fralda que protege os bebês, no copo de café que não prejudica o meio ambiente, em papéis absorventes e na comodidade do uso de uma embalagem sustentável.PLURALIguais e diferentes. Singulares e plurais. Acreditamos que a diversidade nos fortalece, por isso, não fazemos distinção entre candidatos seja por deficiência, gênero, orientação sexual, raça/etnia, idade, origem, constituição familiar ou estética. Aqui você pode descobrir novos desafios, novos horizontes, novos objetivos e até mais sobre si mesmo!Responsabilidades e atribuiçõesDadosGS: 16Local: São Paulo - SP (Hibrido Flexível)Inscrições até: 22/02/2026O QUE VOCÊ VAI FAZER?Criar modelos e ensembles de modelos usando técnicas combinadas de Machine Learning, estatística e otimização para solução de problemas de negócio;Construir e gerenciar análises de múltiplas bases de dados de grande volume usando diversas ferramentas técnicas (SQL, Python, Excel) para criar análises fundadas com qualidade e rigor;Desenvolver modelos de otimização linear inteira, inteira mista, algoritmos evolutivos modelos utilizando técnicas de Inteligência Artificial para solução de problemas de negócio;Definir o frame do problema, suas features e a melhor forma de criar modelos para soluções de problemas;Interpretar resultados e gerar visualizações e conclusões de análises que construam histórias relevantes e conjunto de ações para a organização;Construir forte relacionamento com diversas áreas internas a empresa de modo a garantir entendimento compreensivo dos requisitos do negócio;Trabalhar em modelo ágil e de forma colaborativa dentro de squads;Definir junto com times de parceiros de tecnologia requisitos de Arquitetura, Segurança e Infraestrutura para garantir robustez e automação nas soluções desenvolvidas.Requisitos e qualificaçõesQUEM NOS INSPIRA?Alguém que acredite em nossos valores;Com iniciativa;Perfil analítico;Que proponha ideias e soluções.O QUE A SUZANO ESPERA DE VOCÊ?Superior Completo em Engenharia, Ciências da Computação ou áreas correlatas;Conhecimento prático em ferramentas e bibliotecas de ciência de dados (Python, SQL, R, Excel);Conhecimento em pesquisa operacionalConhecimento praticoConhecimento e vivência com técnicas de Analytics e desenvolvimento voltados para aplicações de negócio;Curiosidade e disposição em se aprofundar nos desafios.Disponibilidade para atuação em modelo de trabalho hibrido flexivel.Informações adicionaisNÓS TEMOS MUITO MAIS QUE UM PAPEL NA SUA VIDA!Cuidados da sua saúde: Plano Médico, Odonto e Seguro de Vida;VR ou Refeitório, VA para ajudar nas compras do mercado e, no final do ano, VA adicional;Sabemos que a renda fixa é importante, mas, além disso, oferecemos uma renda extra por meio do nosso Programa de Remuneração Variável (Anual);Para você se preparar para o futuro temos a Previdência privada;Praticamos o home office em áreas corporativas, a flexibilidade de horários, além do dress code casual;Para gerar e compartilhar valor disponibilizamos cursos e treinamentos E-learning em nossa plataforma digital, o UniverSuzano;Na Suzano, só é bom para nós se for bom para o mundo! Por isso, durante o ano realizamos muitas ações legais e você poderá se tornar um voluntário do nosso programa Voluntariar;Também contamos com um Clube de Descontos, com diversos parceiros, para você aproveitar!PARA A FAMÍLIAComo empresa cidadã, entendemos a importância da chegada de uma criança. Por isso, oferecemos extensão da licença paternidade para 20 dias e maternidade para 180 dias. O benefício também vale para papais e mamães que adotarem ou obtiverem a guarda judicial da criança e para casais homo afetivos;Para as mamães retornarem tranquilas ao trabalho, oferecemos um auxílio creche bem bacana.Pensando em oferecer sempre as melhores condições para nosso time e suas família, disponibilizamos um auxílio mensal em dinheiro que se aplica ao pai ou mãe que tiver sob sua guarda filho ou filha com alguma necessidade especial;Aqui seus filhos e filhos não ficam de fora, oferecemos um vale brinquedo e um kit material escolar recheado! E, se no final do ano os filhos mandarem bem na escola, reconheceremos o seu esforço por meio do nosso programa Estudar é Crescer, com um prêmio em dinheiro que poderão usar como preferir.SUZANO FAZ BEMOFaz Bemtem um cuidado especial para você, colaborador(a) e sua família, confira baixo:Tele Faz Bem: Atendimento gratuito e confidencial ao colaborador(a) Suzano e seus(as) dependentes(as) nas seguintes frentes: Apoio psicológico e de assistência social, orientação jurídica, financeira, de atividade física e nutricional;Plataforma de saúde mental – A Wellz, oferece sessões de terapia online subsidiadas pela Suzano de forma confidencial, além de várias oportunidades de auto cuidado como jornadas, diário de humor, terapia em grupo, entre outros;Plataforma de saúde física – A Wellhub é uma plataforma completa de bem estar com acesso a academias, aplicativos e aulas on-line com liberdade de escolha de atividades.Programa de gestantes – O programa “Bebê Saudável” realiza o acompanhamento gestacional através de contato telefônico e abordagens, além do recebimento de um kit personalizado.#VemSerSuzano #PlantamosOCuidado #OrgulhoEmPertencerMUITO PRAZER, NÓS SOMOS A SUZANO! 🌱Somos umaempresa multinacional brasileira, referência global no desenvolvimento de soluções sustentáveis e inovadoras, de origem renovável, por meio do plantio de árvores de eucalipto. E elas estão no centro do nosso propósito, que é o de “renovar a vida a partir da árvore”. É assim quenós plantamos um futuro mais sustentável para o planeta e para as pessoas.Temos 100 anos de vida, e hoje,somos a maior fabricante de celulose do mundo e uma das maiores produtoras de papéis da América Latina. Nossos produtos atendem mais de 2 bilhões de pessoas ao redor do planeta e nós exportamos para mais de 100 países. Quanto às unidades, entre administrativas e operacionais, estamos presentes também internacionalmente na Argentina, Áustria, Canadá, China, Estados Unidos, Finlândia, Israel e Suíça.E, tudo isso só é possível por causa das pessoas da Suzano:somos a soma de cerca de 20 mil colaboradores(as) próprios(as) e mais de 20 mil terceiros e terceiras, além de 300 colaboradores(as) em nossos escritórios internacionais. Trabalhamos para ser uma empresa competitiva e protagonista na transformação da nossa cadeia de valor e da sociedade.Para saber mais acesse: www.suzano.com.brShow moreShow less",N/A,On-site/Hybrid,https://www.linkedin.com/jobs-guest/jobs/api/jobPosting/4374682632,2026-02-21
