title,company,location,posted,description,applicants,work_mode,link,data_coleta
Cientista de Dados Especialista,Porto,"São Paulo, São Paulo, Brazil",5 days ago,"Descrição da vagaNossa área é responsável por desenvolver, implementar e monitorar modelos de risco para Ramos Elementares e Vida. Este trabalho é essencial para a tomada de decisões estratégicas, garantindo a solidez e a competitividade dos nossos produtos.Responsabilidades e atribuiçõesConstruir, validar e monitorar modelos de risco;Colaborar de perto com a equipe de Pricing para dar suporte na precificação de produtos RE e Vida;Pesquisar e aplicar novas métricas e técnicas de modelagem, mantendo nossos métodos sempre atualizados e eficazes;Participar do ciclo de vida dos modelos, desde a concepção até a implementação, garantindo a correta aplicação e o sucesso das soluções;Ser referência para a equipe no ponto de vista técnico e de negócio.Requisitos e qualificaçõesPré requisitos:Formação superior em áreas como Estatística, Matemática, Engenharia, Ciência da Computação, Física, Economia ou áreas correlatasExperiência sólida em modelagem estatística e aprendizado de máquinaConhecimento com linguagens de programação para análise de dados como Python e SQLExcelentes habilidades de comunicação para apresentar ideias de forma clara e objetiva e interagir com diferentes públicosAtitude colaborativa e capacidade de trabalhar em equipe em um ambiente dinâmicoOrientado para solução, capaz de identificar e implementar caminhos práticos e eficientesDiferencial:Experiência com ferramentas de visualização de dados, conhecimento em GCP, ou experiência prévia em projetos de modelagem, familiaridade com produtos de ramos elementares e vida.Informações adicionaisBENEFÍCIOSModelo de trabalho:HíbridoVale Alimentação e Refeição Flexíveis;Plano de Saúde;Plano Odontológico;Wellhub e TotalPass;Academia Bio Ritmo exclusiva para Colaboradores:no Complexo Matriz;Participação nos Lucros - PLR;Programa de Ações: Porto em Ação:complementar à PLR até 2025;Quadras de Areia e Poliesportiva:no Complexo Matriz;Vale-Transporte;Serviços de Transporte de Vans;disponibilizadas nas principais estações de acesso à Porto (Luz, Barra Funda, Santa Cecília e Júlio Prestes);Licença Parental Estendida:até 40 dias para todas as configurações familiares;Licença Maternidade Estendidade 6 meses.;Ambulatório Médico com Especialidades:no Complexo Matriz e Barra Funda;Auxílio creche ou babá;Seguro de Vida;Previdência Privada - PortoPrev;Desconto em Produtos e Serviços;Bolsa de estudos: Reembolso para graduação, pós ou MBA;Corridas mensais:subsídio para as principais corridas de ruas de São PauloReembolso para idiomas (inglês ou espanhol);Teatro Porto:sessões exclusivas para Colaboradores;Biblioteca;Sala de descanso:no completo MatrizSalão de jogos:no complexo MatrizServiços de massagem e podologia:no completo MatrizLocal de trabalho:Local (Atuamos com modelos híbridos, que serão explorados no processo seletivo);Na Porto, Você Importa!A Porto é muito mais que uma seguradora: é um ecossistema gigante que utiliza tecnologia para criar soluções, através de quatro verticais de negócio:Porto Bank, Porto Saúde, Porto Seguro e Porto Serviço.A reputação e o reconhecimento conquistados ao longo de mais de 7 décadas reforçam o tamanho da Porto, uma empresa referência em negócios, feita para e por pessoas.Aqui, bate no peito de 13 mil colaboradores oorgulho de fazer parte de uma organização sólida e ética,que transforma sonhos em realidades fantásticaspara os nossos mais de 15,8 milhões de clientes. São mais de 101 sucursais e escritórios regionais em todo o Brasil.O aprendizado faz parte do nosso DNA, e aqui, você teráincentivos, ferramentas e gente boa para você aprender e crescer, a cada dia,um ambiente de acolhimento e segurança, onde cada um possa ser e se orgulhar de quem se é, promovendo um espaço de respeito evivendo de forma integral e com bem-estar, em uma empresa genuinamente humana.DIVERSIDADE & INCLUSÃO NA PORTOAqui na Porto, valorizamos a diversidade e acreditamos que um time plural é imprescindível para o desenvolvimento de todo o nosso negócio, da sociedade, e de cada pessoa, pois entendemos que cada indivíduo é único na construção de um ambiente mais inovador e inclusivo. Juntos, trabalhamos diariamente para construirmos um espaço seguro, livre e acolhedor, com mais pluralidade e respeito. Por isso,incentivamos fortemente a inscrição de mulheres, de pessoas negras e indígenas, de pessoas com deficiência e de pessoas LGBTQIA+em todas as nossas vagas.Show moreShow less",N/A,On-site/Hybrid,https://www.linkedin.com/jobs-guest/jobs/api/jobPosting/4390879512,2026-04-23
Cientista de dados,Tata Consultancy Services,Greater São Paulo Area,5 days ago,"A Tata Consultancy Services (TCS) é líder global em serviços de TI, consultoria & soluções de negócios com uma grande rede de centros de inovação & entrega.Fomos reconhecidos como um Global Top Employer e nossa capacidade de fornecer carreiras holísticas de longo prazo baseadas em aprendizado contínuo impulsionado por nosso ecossistema de aprendizagem digital nos ajuda a desenvolver os melhores talentos!E convidamos você a fazer parte da nossa equipe!Estamos em busca de um(a)profissional apaixonado(a) por dados e inteligência artificial, que queira atuar com grandes volumes de informações e desenvolver modelos de aprendizado de máquina que gerem impacto real no negócio.Responsabilidades:Trabalhar comgrandes conjuntos de dadosutilizando algoritmos deMachine LearningDesenvolver, treinar e otimizar modelos preditivosInterpretar e explicar o comportamento dos modelosde forma clara, objetiva e acessível para diferentes públicosColaborar com times técnicos e de produto no desenvolvimento de soluções escaláveisRequisitos Técnicos:Mínimo de 3 anos de experiênciana áreaBachareladocompleto (áreas correlatas à tecnologia, dados ou engenharia)Proficiência em PythonExperiência comReactFamiliaridade comAWSMandatório: Inglês Intermediário B2Modelo de contratação:CLT Full + BenefíciosBenefícios TCS – Brasil:Plano de SaúdePlanos OdontológicoSeguro de VidaVale TransporteVale Refeição/AlimentaçãoAuxílio CrecheGympassTCS Cares – 0800 gratuito que fornece assistência psicológica (24 hrs/dia), jurídica, social e financeira aos associadosParceria com SESCReembolso de CertificaçõesPortal de aprendizagem gratuito da TCS – cursos online e treinamentos ao vivoOportunidade de experiência internacionalParceria de descontos com Universidades e escolas de idiomasBring Your Buddy – Ao indicar pessoas você se torna elegível a receber um bônus para cada contrataçãoTCS Gems – Reconhecimento por performanceXcelerate – Plataforma de carreira com mentoria gratuitaOperamos em escala global, com diversas bases de talentos representando 156 nacionalidades, em 55 países. Na Tata Consultancy Services promovemos uma cultura inclusiva, sempre trabalhamos pela equidade. Isso se traduz em Gênero, Pessoas com Deficiência, LGBTQIA+, Religião, Raça, Diversidade de experiências e Etnia, ou seja, todas as nossas vagas são trabalhadas com esses princípios.Show moreShow less",N/A,On-site/Hybrid,https://www.linkedin.com/jobs-guest/jobs/api/jobPosting/4403445938,2026-04-23
Zé Delivery | Analista de Planejamento e Performance Jr (São Paulo - SP),Ambev,"São Paulo, São Paulo, Brazil",2 weeks ago,"Descrição da vagaAtualmente a nossa Cultura passa por um processo de transformação e evolução. A nossa história e o nosso jeito de ser são marcados porsonhos grandesque nos trouxeram até aqui e que nos enchem de orgulho! Mas acreditamos que o momento de evoluir é sempre o agora e poder fazer isso junto com a nossa gente é o que torna nossa jornada ainda mais incrível.Nossa cultura honra o passado e hoje também é norteada por3 principais valoresque nos guiam para sermos uma cia cada vez mais inclusiva, diversa, colaborativa, tecnológica e conectada ao futuro do mundo e da nossa plataforma de negócios, são eles:Escuta Ativa, Colaboração e Visão de Longo Prazo, cada um abarcando outras competências que fazem parte do nosso jeito de ser.Nos orgulhamos da nossa capacidade de realização e paixão que nos trouxeram até aqui e para continuarmos a evoluir juntos te convidamos a fazer parte também dessa jornada. Prazer,somos a Ambeve adoraríamos te ter com a gente. Vamos juntos?!Responsabilidades e atribuiçõesElaboração de materiais de gestão, resumo executivo e apresentações;Organização e padronização de processos;Gestão de ativos de giro, emissão e recolha de comodatos;Gestão do fluxo de pagamentos do pacote de Sales & Marketing;Gestão do fluxo de ressarcimento das franquias;Gestão da arquitetura de preços e política comercial do Chopp;Elaboração de insights e análises para o time comercial;Apoio técnico ao time, assegurando boas práticas e consistência das entregas.Requisitos e qualificaçõesEnsino superior completo;Desejável experiência em gestão de dados e apresentação de indicadores de desempenho;Será considerado como diferencial experiência com Metabase e Databricks;Buscamos um perfil organizado, com senso de urgência, proatividade e sede de aprendizado.Informações adicionaisHoje Na AMBEV Nós Trabalhamos Com Os Melhores Benefícios Para Você e Também Para Os Seus Dependentes Legais! Aqui Na Companhia Nós Conseguimos Te ProporcionarMais cuidado com a sua saúde através de Plano Médico, Odontológico, Telemedicina, Seguro de Vida e Gympass;Saúde mental com a Telemedicina Dasa;Consumir nossos produtos com um super desconto (é isso mesmo, nós temos venda de produtos para funcionários no precinho!);Reuniões de final de ano com a família ainda mais prazerosas, pois oferecemos Cesta de Natal e ainda brinquedo para quem tem filhos;Proteção financeira com a nossa previdência privada;A possibilidade de você fazer um bom mercado ou comer no restaurante que você gosta com Vale Alimentação ou Refeição, pois você poderá optar por um destes benefícios;O vale transporte é opcional e você pode conferir no modelo da vaga;Ter a oportunidade de receber um abono assiduidade, que nada mais é do que o 14º salário para nossos colaboradores, um salário extra no ano!;Auxílio Creche ou Auxílio babá;Participação dos Lucros da companhia.Além de sonhar, se desenvolver, construir e crescer dentro de um ambiente meritocrático e inclusivo e ser capaz de fazer a diferença unindo as pessoas por um mundo melhor!Seja bem-vindo à AmbevENTRE PARA UM TIME QUE SONHA TÃO GRANDE COMO VOCÊ!Somos milhares de apaixonados e apaixonadas pelo que fazemos. Temos um orgulho imenso do nosso poder de impacto positivo e reconhecemos que, agindo como donos e donas, cada um de nós desempenha um papel fundamental no sucesso do nosso ecossistema. Somado a isso, todas nossas grandes conquistas tem o sabor da colaboração! Nosso sucesso é compartilhado e acreditamos que por meio da colaboração podemos encantar ainda mais o nossos clientes com as marcas que eles amam hoje, ao mesmo tempo em que podemos atender aos gostos de amanhã.🍻A Nossa Cultura é focada em construir um ambiente inclusivo e colaborativo, onde as pessoas possam ser o melhor delas mesmas - e nos ajudar a ser a nossa melhor versão! Procuramos gente com paixão, curiosidade e coragem para fazer a diferença aqui.Acolhemos talentos diversos, porque acreditamos que grandes ideias vêm de pessoas com diferentes trajetórias. Oferecemos oportunidades para talentos que estão ingressando no mercado de trabalho e somos apaixonados por impulsionar a nossa gente.É trabalhando e crescendo juntos que atingimos o nosso propósito: Sonhamos Grande por um Futuro com Mais Razões para Brindar!Show moreShow less",N/A,On-site/Hybrid,https://www.linkedin.com/jobs-guest/jobs/api/jobPosting/4394739019,2026-04-23
LWSA | Coordenador(a) de Gestão de Riscos | Cientista de Dados | Híbrido,LWSA,"São Paulo, São Paulo, Brazil",2 weeks ago,"A LWSA é a união de diversas empresas que oferecem as mais diferentes soluções, mas que se complementam, com um único objetivo: transformar negócios para crescerem e prosperarem por meio da tecnologia. Com a nova estruturação, inclusive de marca, hoje somos a LWSA, um ecossistema de marcas integradas que oferece soluções completas e modulares para todos os tamanhos de negócio. Dentre os serviços estão plataforma de e-commerce, ERP, integração com marketplace, PDV, recorrência, geração de leads, crédito e logística, entre outros.Conheça um pouco da área para esta oportunidade 🎯A área deGestão de Riscos, Compliance e Controles Internosda LWSA tem a missão de atuar como um pilar estratégico e tecnológico.Buscamos um perfilhands-onque una o conhecimento técnico de riscos com a capacidade analítica de um cientista de dados para antecipar cenários e automatizar o monitoramento de controles dentro do nosso ecossistema digital.Responsabilidades e atribuições📝 Como será seu dia a dia:Inteligência e Hipóteses: Desenvolver e testar hipóteses de riscos, utilizando métodos estatísticos para identificar vulnerabilidades em diversos cenários antes que se tornem perdas reais;Desenvolvimento de Ferramentas: Criar, manter e aprimorar ferramentas internas de monitoramento e automação utilizando Google Apps Script e integrações do Google Workspace;Dashboards de Riscos: Desenvolver e gerir dashboards dinâmicos (Looker Studio / Power BI) para visualização de indicadores de risco (KRI’s) e performance (KPI’s);Mapeamento e Melhoria: Identificar riscos e controles em processos críticos, propondo melhorias baseadas em evidências quantitativas, análise de grandes volumes de dados;Interface Executiva: Conduzir reuniões e comitês, traduzindo modelos complexos e métricas de dados em apresentações executivas para a liderança; Elaborar reportes periódicos;Gestão de Equipe: Desenvolver o time técnico, fomentando uma cultura de inovação e automação;Requisitos e qualificações🎯 E para tirar de letra, você precisará:Domínio de Riscos: Experiência sólida em Gestão de Riscos, Mapeamento de Processos e Testes de Controles;Programação e Automação: Conhecimento em lógica de programação e desenvolvimento de scripts (foco em Google Apps Script / Java Script);Cientista de Dados: Capacidade de manipulação de dados, desenvolvimento de hipóteses e criação de dashboards;Ecossistema Google: Conhecimento em Google Sheets (Query, filtros dinâmicos e automações) e Looker Studio;Formação: Ensino superior completo (Engenharias, Ciência da Computação, Estatística, Economia, Contábil ou correlatas).Experiência em Gestão e mercado financeiro: Histórico comprovado na liderança de equipes e gestão de pessoas e vivência no segmento de Banking ou FinTechs;Background em Auditoria e/ou Controles Internos: Experiência prévia como auditor ou área de controles internos e gestão de riscos.🎯E se tiver isso, melhor ainda (Diferenciais):Conhecimentos em Riscos Financeiros: Experiência com modelos e indicadores de Risco de Crédito, Capital, Tesouraria e Liquidez; Conhecimento Contábil.Informações adicionais📍O que a LWSA oferece de benefícios?🏥Assistência Médica;🦷Assistência Odontológico;🚋 Vale-Transporte ou Estacionamento gratuito;🚍 Serviço gratuito de vans do terminal João Dias para a Locaweb;🥘Vale Refeição/ Alimentação:👶Auxílio Creche;🤗 Seguro de Vida;🏋️‍♀️ Gympass;✈ Férias & Co;☕ Máquinas de café a vontade;💆‍♀️ Massagem e ginástica laboral in company;🎮Sala de Relax com TV, mesa de bilhar, carteado, tênis de mesa, vídeo games e puffs;🏖️ Day off;💸 PPR anual;🍃 Programa de Qualidade de Vida e bem-estar;📚 Parceiras com instituições de ensino e lazer;Onde estamos:📍 Rua Itapaiúna, 2434 - Parque do Morumbi, São Paulo - SP | 05707-001Importante ressaltar:Essa e todas as vagas abertas da companhia LWSA são elegíveis para todas as pessoas, independente de gênero, etnia, orientação sexual, acessibilidade e/ou condição social.Ressaltamos que nossas vagas estão abertas para todas as pessoas com deficiência (PcDs).Show moreShow less",N/A,On-site/Hybrid,https://www.linkedin.com/jobs-guest/jobs/api/jobPosting/4397972800,2026-04-23
Cientista de Dados,UY3,"São Paulo, São Paulo, Brazil",2 weeks ago,"Estamos em busca de uma pessoa para atuar comoCientista de Dadosna UY3, com forte atuação em análise de crédito e aplicação de inteligência artificial. Esse(a) profissional será responsável por transformar dados em insights estratégicos, apoiando a construção de políticas, estratégias e tomadas de decisão ao longo da jornada de crédito.Buscamos alguém com perfil analítico, visão de negócio e atuação hands on, capaz de estruturar análises estatísticas avançadas, desenvolver modelos preditivos e identificar oportunidades de otimização na concessão e gestão de crédito. Sua atuação será fundamental para garantir decisões mais assertivas, redução de riscos e evolução contínua dos nossos produtos, em um ambiente dinâmico e orientado a dados.Quem somosA UY3 é uma instituição financeira que atua no mercado de crédito e soluções financeiras, conectando estratégia, tecnologia e execução para viabilizar operações de forma estruturada, eficiente e escalável. Em um setor essencial para o funcionamento da economia, nosso papel é tornar o crédito mais acessível, inteligente e orientado a dados, apoiando empresas na expansão de suas operações e na geração de valor sustentável.Trabalhamos próximos às decisões que movem o negócio, com foco em execução de alto nível e construção contínua. É um contexto voltado para profissionais que buscam evolução consistente, exposição a desafios relevantes e participação ativa na construção de soluções.Aqui as decisões são rápidas e o desenvolvimento acontece na prática com espaço para construir, não apenas executar.Sobre a oportunidadeEssa posição tem papel estratégico e analítico na evolução das decisões de crédito da companhia, com forte atuação na construção de modelos, análises estatísticas e aplicação de inteligência artificial. Você será responsável por transformar dados em insights acionáveis, apoiando diretamente a definição de estratégias, políticas e decisões ao longo da jornada de crédito, sempre equilibrando risco, performance e crescimento do negócio.A atuação envolve desde a exploração e tratamento de dados até o desenvolvimento e acompanhamento de modelos preditivos, com uma visão hands on no dia a dia. Ao mesmo tempo, o papel exige proximidade com áreas de negócio como Crédito, Risco e Produto, garantindo que as análises sejam aplicáveis, escaláveis e alinhadas aos objetivos da operação.Além disso, você terá papel importante na evolução da maturidade analítica da empresa, contribuindo para a melhoria contínua dos modelos, monitoramento de performance e adaptação a mudanças de comportamento e cenário, em um ambiente dinâmico e orientado a dados.Principais responsabilidadesDesenvolver análises estatísticas e modelos preditivos para apoiar decisões de crédito;Construir, validar e monitorar modelos de risco (score de crédito, inadimplência, fraude, entre outros);Explorar e tratar grandes volumes de dados, garantindo qualidade, consistência e confiabilidade das informações;Traduzir dados em insights acionáveis para definição de estratégias, políticas e tomadas de decisão;Atuar na definição e evolução de políticas de crédito, com base em análises quantitativas e comportamento da carteira;Aplicar técnicas de Machine Learning e Inteligência Artificial para otimização de processos e aumento de performance;Monitorar a performance dos modelos e propor melhorias contínuas;Construir dashboards e relatórios para acompanhamento de indicadores da área;Trabalhar em conjunto com áreas de Crédito, Risco, Produto e Tecnologia;Garantir documentação, rastreabilidade e governança dos modelos e análises desenvolvidas.O que buscamosExperiência prévia como Cientista de Dados ou em áreas analíticas, preferencialmente com foco em crédito, risco ou produtos financeiros;Forte capacidade analítica e raciocínio estatístico para construção de modelos e tomada de decisão;Experiência com linguagens de programação para análise de dados (Python e/ou R);Conhecimento em técnicas de Machine Learning e Inteligência Artificial aplicadas a problemas de negócio;Experiência com manipulação e análise de grandes volumes de dados;Conhecimento em SQL e ferramentas de análise e visualização de dados (ex: Power BI);Capacidade de traduzir dados complexos em insights claros e acionáveis para o negócio;Boa comunicação para interação com áreas técnicas e não técnicas;Perfil proativo, com senso de dono e foco em geração de impacto;Organização, atenção a detalhes e compromisso com qualidade e governança dos dados;Interesse em atuar em ambiente dinâmico, com foco em evolução contínua e tomada de decisão orientada a dadosSe você busca um ambiente dinâmico, com desafios reais, oportunidades consistentes de crescimento e autonomia para fazer acontecer, a UY3 é o seu lugar. Queremos conhecer você!Show moreShow less",N/A,On-site/Hybrid,https://www.linkedin.com/jobs-guest/jobs/api/jobPosting/4394703121,2026-04-23
Data Scientist,4flow,"São Paulo, São Paulo, Brazil",2 weeks ago,"We're looking for a talented Data Scientist to join our growing team and contribute to the development of data-driven software solutions. You'll leverage your expertise in data science and machine learning to identify opportunities, design solutions, and translate them into real-world applications.What your new challenge will look likePartner with stakeholders across the organization to understand business needs and translate them into practical, scalable solutions with measurable real-world impactDesign and develop advanced statistical models and machine learning algorithms to solve complex business problemsWork with large datasets to uncover patterns and predict future outcomesConduct comparative analyses, such as A/B testing and experimental design, to evaluate the impact of initiatives and support data-driven decision-makingBe part of the development of a new solution powered by GenAI technologyCommunicate complex technical concepts to both technical and non-technical audiencesStay up-to-date on the latest trends and advancements in data science and machine learning to continuously improve capabilitiesWhy you belong at 4flowYou have a good university degree in Statistics, Computer Science, Data Science or a related field (or equivalent experience)Strong proficiency in statistical analysis, machine learning, and data visualization.Hands-on experience applying data science, machine learning and GenAI technologies to develop innovative solutions⁠ Practical experience with Python, including libraries and frameworks such as Pandas, NumPy, FastAPI, PyTorch, Hugging Face, Scikit-learn, and LangGraph, along with foundational knowledge of SQL or NoSQL databases.⁠You communicate confidently in EnglishExperience collaborating within data-focused teams to develop AI-driven systems that solve real-world problems and deliver measurable impactExperience with cloud platforms (e.g., AWS, Azure, GCP)Availability to work hybrid at our Campinas officeWhat we offerCome join us! As part of a highly international, fast-growing company with a vibrant corporate culture, you will enjoy a competitive base salary, an attractive bonus system, and a great benefits package that includes:Caju multi-benefit cardFuel or transportation allowanceComprehensive health and dental plans fully covered for employees and dependentsLife insuranceComprehensive well-being initiatives, including Wellhub, our Employee Assistance Program for mental health, and dedicated committees for health and well-beingOutstanding opportunities for your individual development (e.g., individual learning budget, access to LinkedIn Learning and internal training program)Hybrid working model for flexibility and work-life balanceAnd there is more!Exciting international projects as well as rapid career development and personal development planningCompany with German roots that offers a clearly defined vision and job securityTeam events and company getawaysFree fruit, snacks, drinks, and coffee at the officePermanent position (CLT)We are committed to equal opportunities and welcome applications from all individuals, regardless of age, gender, origin, disability, sexual orientation, religion, or any other legally protected characteristic.Ready for 4flow? Then please apply online. Please upload an English version of your resume when applying.Show moreShow less",N/A,On-site/Hybrid,https://www.linkedin.com/jobs-guest/jobs/api/jobPosting/4384877960,2026-04-23
