title,company,location,posted,description,applicants,work_mode,link,data_coleta
Cientista de Dados Sr. – (Modelagem Crédito Cartões),Banco PAN,"São Paulo, São Paulo, Brazil",1 week ago,"Somos oPANÁgeis, flexíveis e criativos, exploramos possibilidades com disposição e desejo de fazer acontecer. Sempre prontos para encarar novos desafios, nutrimos líderes que, além de ter garra, são abertos e empáticos, veem na proximidade das relações, o elo entre cada um.Nossa missão, se faz cumprida quando transformamos a vida dos outros através dos nossos conhecimentos. Nossos pilares de cultura, reforçam nossa postura idealizadora e com desejo de fazer acontecer:Trabalho em equipe, Transparência , Excelência e Eficiência com profundidade.Dominamos nossos processos e trazemos melhorias para quem deseja ter umavida financeira mais inteligente.Principais desafios:Desenvolver modelos preditivos, para apoiar a tomada de decisão da área de crédito;Atuar com Machine Learning e Gen-IA, para soluções de clusterização, regressão, classificação e criação de features;Atuar no processo de deploy de modelos (MLOp) de acordo com a melhores práticas;Lidar com drivers da concessão e manutenção de crédito, como credit score, endividamento, capacidade de pagamento e rentabilidade;Analisar impactos e variações dos negócios/produtos, buscando propostas de soluções data-driven;Explorar as informações disponíveis para entendimento do portfólio, tendências e oportunidades de negócio;Acompanhar e propor métodos de monitoramento da qualidade dos modelos, visando melhorias.Quais as principais competências para a posição?Formação acadêmica dentre os cursos de Matemática Aplicada, Estatística, Computação Científica, Engenharias ou similares;Experiência no setor financeiro/bancário com: modelos de crédito, score de crédito;Experiência específica em cartões é desejável;Conhecimento em dados do Banco Central (SCR) seria um grande diferencial;Domínio de programação em SQL e Python;Capacidade de trabalhar com fontes distintas de dados, incluindo dados não estruturados;Domínio sobre as principais técnicas estatísticas de modelagem, de avaliação de performance dos modelos, testes de hipóteses e seus usos;Conhecimento das principais implementações dos algoritmos de Machine Learning e Gen-IA.Modelo de atuação: Híbrido (4 dias presencial no escritório e 1 dia de home office)Benefícios do PAN:Bônus / PLRVale RefeiçãoVale Alimentação13º de Vale AlimentaçãoConvênio Médico (internação em apartamento para titular e dependentes)Convênio Odonto/OrtodônticoAmbulatório Médico no escritórioTelemedicina Dr. Alper (Einstein Conecta) ilimitado.Seguro de VidaDescontos em mais de 10 mil farmácias4 Sessões de psicoterapia por mêsLicença familiar estendida (Responsável 6 meses e corresponsável 30 dias)Auxílio Creche / BabáAcomPANha (programa de acompanhamento para gestantes)Wellhub/TotalpassAuxílio tecnologia assistivas (reembolso de 85% para colaboradores com deficiência)Programas de desenvolvimentoMassagem e AuriculoterapiaSalão de beleza no escritórioPAE (Orientação Jurídica, Financeira, Psicológica e Social)Portal de descontos em diversos segmentos (Allya)Campanha de vacinação (colaborador e dependente)Facilitação no financiamento de veículos (Mediante análise)Cartão de crédito PAN com limite diferenciado (Mediante análise)Vale Transporte (desconto de apenas 4%)Assistência FuneralAssim como todas as nossas vagas, essa também é destinada à diversidade e inclusão. Independentemente de qualquer fator, perfil ou característica,Expanda sua carreira no PAN!Para conhecer mais sobre nossos benefícios e cultura, acesse o Trabalhe Conosco:https://www.bancopan.com.br/trabalhe-conosco/Show moreShow less",N/A,On-site/Hybrid,https://www.linkedin.com/jobs-guest/jobs/api/jobPosting/4370180093,2026-02-21
"Analista de Melhoria Contínua, ACES",Amazon,"Cajamar, São Paulo, Brazil",1 week ago,"DescriptionA equipe da Amazon Brasil está em busca de um(a) Analista de Melhoria Contínua para integrar o time de melhoria contínua. Esta pessoa será responsável por liderar iniciativas de otimização de processos por meio de Kaizens, realizar análises profundas (dive deep) para identificação e solução de problemas operacionais, além de apoiar a gestão de dados e processos do Fulfillment Center (FC), garantindo desempenho, eficiência e conformidade das operações.Essa pessoa atuará em um ambiente altamente colaborativo e multidisciplinar, trabalhando de forma próxima à operação e às áreas de suporte. Espera-se que prospere e entregue resultados em um ambiente dinâmico, acelerado e com alto grau de ambiguidade, onde a análise de dados e a tomada de decisão baseada em fatos são fundamentais para o sucesso do negócio.Key job responsibilitiesRealizar análises detalhadas (dive deep) para identificar oportunidades de melhoria nos processos operacionais;Conduzir investigações de causa raiz para problemas operacionais, utilizando metodologias estruturadas;Propor e implementar soluções simples, eficazes e sustentáveis para problemas complexos, com base em dados e observações in loco (gemba);Desenvolver, manter e aprimorar dashboards, relatórios e indicadores de desempenho operacional;Analisar dados provenientes de diferentes fontes, identificar tendências relevantes e apoiar a tomada de decisões do negócio;Apoiar a configuração e o uso de sistemas e ferramentas com foco na otimização de processos;Criar e implementar ferramentas analíticas que contribuam para o aumento da eficiência operacional;Atuar de forma colaborativa com diferentes áreas para garantir a execução e a sustentação das melhorias implementadas.Basic QualificationsGraduação completa ou em andamento em Engenharia ou áreas correlatas;Experiência com melhoria contínua, análise de processos, operações ou áreas similares;Experiência no uso de Excel ou ferramentas similares para manipulação e visualização de dados;Capacidade de interpretar dados operacionais e transformá-los em ações práticas de melhoria;Conhecimento básico de SQL ou outras ferramentas de consulta e manipulação de dados.Preferred QualificationsExperiência em ambientes logísticos, industriais, centros de distribuição ou operações de grande escala;Conhecimento em metodologias de melhoria contínua, como Lean, Kaizen e/ou Six Sigma;Experiência com ferramentas de BI (ex.: Power BI, QuickSight);Experiência no desenvolvimento e manutenção de dashboards e indicadores de desempenho (KPIs);Vivência em projetos de otimização de processos e redução de desperdícios;Inglês intermediário para leitura de documentações e interação com times globaisOur inclusive culture empowers Amazonians to deliver the best results for our customers. If you have a disability and need a workplace accommodation or adjustment during the application and hiring process, including support for the interview or onboarding process, please visit https://amazon.jobs/content/en/how-we-hire/accommodations for more information. If the country/region you’re applying in isn’t listed, please contact your Recruiting Partner.Company- Amazon Servicos de Varejo do Brasil Ltda. - C41Job ID: A3161392Show moreShow less",N/A,On-site/Hybrid,https://www.linkedin.com/jobs-guest/jobs/api/jobPosting/4363836368,2026-02-21
"Analista de Melhoria Contínua, ACES",Amazon,"Cajamar, São Paulo, Brazil",2 weeks ago,"DescriptionA equipe da Amazon Brasil está em busca de um(a) Analista de Melhoria Contínua para integrar o time de melhoria contínua. Esta pessoa será responsável por liderar iniciativas de otimização de processos por meio de Kaizens, realizar análises profundas (dive deep) para identificação e solução de problemas operacionais, além de apoiar a gestão de dados e processos do Fulfillment Center (FC), garantindo desempenho, eficiência e conformidade das operações.Essa pessoa atuará em um ambiente altamente colaborativo e multidisciplinar, trabalhando de forma próxima à operação e às áreas de suporte. Espera-se que prospere e entregue resultados em um ambiente dinâmico, acelerado e com alto grau de ambiguidade, onde a análise de dados e a tomada de decisão baseada em fatos são fundamentais para o sucesso do negócio.Key job responsibilitiesRealizar análises detalhadas (dive deep) para identificar oportunidades de melhoria nos processos operacionais;Conduzir investigações de causa raiz para problemas operacionais, utilizando metodologias estruturadas;Propor e implementar soluções simples, eficazes e sustentáveis para problemas complexos, com base em dados e observações in loco (gemba);Desenvolver, manter e aprimorar dashboards, relatórios e indicadores de desempenho operacional;Analisar dados provenientes de diferentes fontes, identificar tendências relevantes e apoiar a tomada de decisões do negócio;Apoiar a configuração e o uso de sistemas e ferramentas com foco na otimização de processos;Criar e implementar ferramentas analíticas que contribuam para o aumento da eficiência operacional;Atuar de forma colaborativa com diferentes áreas para garantir a execução e a sustentação das melhorias implementadas.Basic QualificationsGraduação completa ou em andamento em Engenharia ou áreas correlatas;Experiência com melhoria contínua, análise de processos, operações ou áreas similares;Experiência no uso de Excel ou ferramentas similares para manipulação e visualização de dados;Capacidade de interpretar dados operacionais e transformá-los em ações práticas de melhoria;Conhecimento básico de SQL ou outras ferramentas de consulta e manipulação de dados.Preferred QualificationsExperiência em ambientes logísticos, industriais, centros de distribuição ou operações de grande escala;Conhecimento em metodologias de melhoria contínua, como Lean, Kaizen e/ou Six Sigma;Experiência com ferramentas de BI (ex.: Power BI, QuickSight);Experiência no desenvolvimento e manutenção de dashboards e indicadores de desempenho (KPIs);Vivência em projetos de otimização de processos e redução de desperdícios;Inglês intermediário para leitura de documentações e interação com times globaisOur inclusive culture empowers Amazonians to deliver the best results for our customers. If you have a disability and need a workplace accommodation or adjustment during the application and hiring process, including support for the interview or onboarding process, please visit https://amazon.jobs/content/en/how-we-hire/accommodations for more information. If the country/region you’re applying in isn’t listed, please contact your Recruiting Partner.Company- Amazon Servicos de Varejo do Brasil Ltda.Job ID: A3161395Show moreShow less",N/A,On-site/Hybrid,https://www.linkedin.com/jobs-guest/jobs/api/jobPosting/4363846004,2026-02-21
Copilot Specialist,Tata Consultancy Services,"São Paulo, São Paulo, Brazil",1 week ago,"Come to one of the biggest IT Services companies in the world!! Here you can transform your career!Why to join TCS? Here at TCS we believe that people make the difference, that's why we live a culture of unlimited learning full of opportunities for improvement and mutual development. The ideal scenario to expand ideas through the right tools, contributing to our success in a collaborative environment.We are looking forCopilot Specialistwho wants to learn and transform his career.Mandatory SkillsAdvanced EnglishExperience in AI/ML engineering, with a strong focus on Microsoft AI technologies.Proven expertise in designing, developing, and deploying intelligent copilots using Microsoft 365 Copilot and Copilot Studio.Hands-on experience with Azure AI Foundry/Studio for building, managing, and deploying AI models and applications, including Azure OpenAI Service.Deep understanding and practical application of prompt engineering and Retrieval-Augmented Generation (RAG) techniques to enhance AI model accuracy and contextual relevance in M365 Copilot chat.Proficiency in integrating Microsoft Copilot with Microsoft 365 applications (e.g., Teams, Outlook, SharePoint) and enterprise systems using Microsoft Graph API, connectors, and plugins.Desirable SkillsFamiliarity with the broader Microsoft Power Platform (Power Apps, Power Automate) for low-code/no-code AI solution development and workflow automation.Experience in data management, data preparation, and building robust data pipelines for AI/ML workloads on Azure.Understanding of AI orchestration, governance, compliance, security best practices, and responsible AI principles in enterprise environments.Prior experience with other enterprise AI platforms (e.g., Google Gemini) and an understanding of AI migration strategies.Experience with MLOps practices, CI/CD pipelines for AI solutions, telemetry dashboards, and monitoring tools.Relevant Microsoft certifications (e.g., Microsoft Certified: Azure AI Engineer Associate, Microsoft 365 Fundamentals).What can you expect from us?• Professional development and constant evolution of your skills, always in line with your interests.• Opportunities to work outside Brazil• A collaborative, diverse and innovative environment that encourages teamwork.What do we offer?TCS Benefits – Brazil:Health insuranceDental PlanLife insuranceTransportation vouchersMeal/Food VoucherChildcare assistanceGympassTCS Cares – free 0800 that provides psychological assistance (24 hrs/day), legal, social and financial assistance to associatesPartnership with SESCReimbursement of CertificationsFree TCS Learning Portal – Online courses and live trainingInternational experience opportunityDiscount Partnership with Universities and Language SchoolsBring Your Buddy – By referring people you become eligible to receive a bonus for each hireTCS Gems – Recognition for performanceXcelerate – Free Mentoring Career PlatformAt TATA Consultancy Services we promote an inclusive culture, we always work for equity. This applies to Gender, People with Disabilities, LGBTQIA+, Religion, Race, Ethnicity. All our opportunities are based on these principles. We think of different actions of inclusion and social responsibility, in order to build a TCS that respects individuality. Come to be a TCSer!#BuildingonbeliefShow moreShow less",N/A,On-site/Hybrid,https://www.linkedin.com/jobs-guest/jobs/api/jobPosting/4371020896,2026-02-21
Data Scientist – People Analytics & Data Quality,Thermo Fisher Scientific,"São Paulo, São Paulo, Brazil",21 hours ago,"Work ScheduleStandard (Mon-Fri)Environmental ConditionsOfficePosition SummaryThe Data Scientist – People Analytics & Data Quality is responsible for ensuring accurate, consistent, and well-governed personnel data and transforming it into insights, dashboards, and scalable analytics solutions. The role supports HR Business Partners (HRBPs) and business leaders by enabling data-driven workforce decisions through automation, advanced analytics, and AI-enabled use cases.This role partners closely with HR, IT, and People Analytics stakeholders and plays a key role in improving trust in HR data while expanding analytical maturity across the organization.Scope & ImpactLeads complex, cross-functional people analytics initiatives with broad business impact.Owns data quality strategy, advanced analytics solutions, and automation design for multiple HR domains.Acts as a trusted analytics advisor to senior HR and business stakeholders.Key ResponsibilitiesOwn and drive the quality, consistency, and governance of personnel data across HR systems and analytics platforms.Define and implement data quality frameworks, validation rules, and reconciliation processes to ensure trusted HR data.Design, maintain, and evolve scalable workforce data models integrating multiple HR data sources (e.g., HCM, ATS, LMS).Lead the development of advanced dashboards and self-service analytics solutions for HRBPs and business leaders.Translate complex and ambiguous business and workforce questions into structured analytical approaches and actionable insights.Identify, design, and implement automation solutions to streamline HR reporting, data preparation, and recurring analyses.Lead AI-enabled and advanced analytics use cases (e.g., attrition prediction, workforce forecasting, skills and mobility insights).Act as a trusted analytics advisor to senior HR and business leaders, influencing decision-making through data storytelling.Partner with HR, HRIS, IT, and data governance teams to align analytics solutions with enterprise data architecture and standards.Mentor and provide technical guidance to junior data scientists or analysts within People Analytics.Ensure responsible, ethical, and compliant use of employee data in line with privacy, security, and regulatory requirements.Continuously improve people analytics capabilities, standards, and best practices across the organization.Knowledge, Skills & ExperienceBachelor’s or Master’s degree in a quantitative field.Typically 4+ years of experience in data science, advanced analytics, or people analytics.Advanced proficiency in SQL and Python/R, including automation and modeling.Strong experience with BI tools and data visualization best practices.Proven experience applying machine learning or advanced statistical techniques.Deep understanding of HR data, governance, and employee data privacy.Strong influencing and stakeholder management skills.Critical Success FactorsHigh trust in HR data through strong quality and governance practices.Scalable, automated analytics that reduce manual effort.Clear, actionable insights that support workforce decisions.Effective collaboration across HR, IT, and business teams.Alignment with Thermo Fisher’s values: Integrity, Intensity, Innovation, and Involvement.Show moreShow less",N/A,On-site/Hybrid,https://www.linkedin.com/jobs-guest/jobs/api/jobPosting/4373457888,2026-02-21
Cientista de Dados,Stocci,"São Paulo, São Paulo, Brazil",8 months ago,"Procuramos uma pessoa Cientista de Dados para integrar nosso time de Soluções IA e contribuir com o desenvolvimento de análises avançadas, modelos preditivos e algoritmos que impactem diretamente objetivos estratégicos de nossos clientes.Esta pessoa terá um papel relevante na aplicação de machine learning e inteligência artificial, colaborando com equipes multidisciplinares para transformar dados em soluções acionáveis e de alto valor para o negócio. A posição está aberta para profissionais com diferentes níveis de experiência, desde quem está iniciando na área até quem já possui trajetória consolidada.Se você possui paixão por ciência de dados, inovação e busca um ambiente desafiador e dinâmico, queremos conhecer você!Responsabilidades:Integrar ou liderar projetos de ciência de dados, desde a identificação de problemas de negócios até a entrega de soluções analíticas que gerem impacto mensurável.Criar, implementar e manter modelos preditivos e soluções de machine learning, utilizando grandes volumes de dados estruturados e não estruturados.Conduzir análises exploratórias, fornecendo insights estratégicos e recomendações baseadas em dados para apoiar a tomada de decisão.Colaborar com equipes de engenharia de dados, produto e negócios para integrar modelos e algoritmos aos sistemas e fluxos operacionais.Pesquisar e implementar novas técnicas, ferramentas e frameworks em machine learning e inteligência artificial, acompanhando tendências de mercado e tecnologia.Compartilhar boas práticas com o time, promovendo uma cultura de excelência técnica e colaboração.Garantir que as soluções entregues sejam escaláveis, interpretáveis e alinhadas às melhores práticas de ciência de dados e engenharia.Monitorar e avaliar o desempenho dos modelos implementados, propondo melhorias contínuas.Capacidade de traduzir hipóteses de negócio em modelos.Trabalhar com Product Managers e Designers de Soluções para transformar entregas em “templates e agentes reutilizáveis”.Requisitos:Graduação completa ou em andamento em Ciência da Computação, Estatística, Matemática, Engenharia ou áreas correlatas.Programação em Python ou R.Bibliotecas e frameworks de análise e modelagem de dados (ex.: Pandas, Scikit-learn, TensorFlow, etc.).Fundamentos de estatística, probabilidade e modelagem preditiva.Manipulação de bancos de dados relacionais (SQL) e/ou não relacionais.Ferramentas de visualização de dados (Power BI, Tableau ou similares).Diferenciais:Experiência prática com Deploy e monitoramento de modelos em produção.Vivência com ambientes de computação em nuvem (AWS, Azure ou GCP).Conhecimento em frameworks de MLOps e plataformas no/low-code.Participação em projetos estratégicos de ciência de dados aplicados ao negócio.Experiência em explicabilidade de modelos, engenharia de features e integração via APIs.Perfil profissional:Visão analítica e foco em resultados.Curiosidade intelectual e disposição para explorar novas abordagens e tecnologias.Capacidade de trabalhar em equipe, colaborar com diferentes áreas e comunicar soluções técnicas de forma clara.Proatividade, organização e autonomia para conduzir projetos.Facilidade para lidar com desafios complexos, propondo soluções criativas e práticas.Se você se identificou com a oportunidade, inscreva-se! Valorizamos potenciais, trajetórias diversas e acreditamos no desenvolvimento contínuo.Show moreShow less",N/A,On-site/Hybrid,https://www.linkedin.com/jobs-guest/jobs/api/jobPosting/4242248792,2026-02-21
Especialista em Data Science / Modelagem Analítica de Risco de Crédito,FOURSYS,"Barueri, São Paulo, Brazil",1 week ago,"A Foursys é um time apaixonado por inovação, design e transformação digital.Somos globais, somos GPTW.🌈 👵 ♿️👩🏾 Na Foursys, celebramos a diversidade e acreditamos que são as diferentes ideias e perspectivas que nos enriquecem. Portanto, sua cor, religião, gênero, raça, nacionalidade, idade, origem, identidade de gênero, deficiência ou orientação sexual não são barreiras para se juntar à nossa equipe.#VemSerFoursys!Que tal se juntar a nós e se tornar um(a) #FourTalent?Então se liga nessa oportunidade incrível: 👇Se você é apaixonado(a) por dados, estatística e modelos analíticos que realmente impactam decisões estratégicas, essa oportunidade é pra você! 📊🚀Buscamos um(a)Especialista em Data Science com foco em Modelagem Analítica de Risco de Crédito, que atue como referência técnica no desenvolvimento, evolução e sustentação de modelos estatísticos, considerando tanto variáveis financeiras quanto fatores doagronegócio.O profissional terá atuação próxima às áreas de Risco, Dados e Negócio, com forte interface internacional, garantindo robustez estatística, qualidade analítica e geração de insights acionáveis para a tomada de decisão. 🌱💡Responsabilidades e atribuiçõesDesenvolver, validar, evoluir e sustentar modelos analíticos e estatísticos de risco de créditoRealizar análises exploratórias e estudos estatísticos aprofundados sobre grandes volumes de dadosSelecionar, tratar e avaliar variáveis relevantes para modelagem, incluindo dados financeiros e do contexto agroAvaliar performance, estabilidade, sensibilidade e aderência dos modelos ao longo do tempoApoiar a definição de premissas, regras e lógicas de decisão utilizadas pelas áreas de riscoConduzir pesquisas aplicadas e estudos analíticos para suporte a decisões estratégicasGarantir qualidade, governança, documentação e rastreabilidade dos modelos desenvolvidosAtuar como referência técnica em modelagem analítica de risco de créditoTraduzir análises técnicas em insights claros para públicos técnicos e não técnicosInteragir de forma contínua com times de Data Science, Engenharia de Dados, Produto, Risco e stakeholders internacionaisHabilidades e RequisitosFormação sólida em Matemática, Estatística, Ciência de Dados ou áreas correlatasExperiência com risco de crédito aplicado ao agronegócioConhecimento de variáveis agro (clima, produtividade, sazonalidade, ciclos agrícolas) e sua incorporação em modelosExperiência comprovada em modelagem estatística e/ou machine learningVivência prática com modelos de risco de créditoForte capacidade analítica, estatística e de resolução de problemasExperiência em análise de grandes volumes de dados estruturadosConhecimento em estatística aplicada, análise de dados e validação de modelosCapacidade de documentar modelos e comunicar resultados de forma clara e estruturadaInglês avançado ou fluente (obrigatório) para interação recorrente com stakeholders internacionaisDiferencialAtuação em ambientes reguladosPerfil com base acadêmica sólida e/ou experiência em pesquisa aplicadaFormato de trabalhoModeloHíbrido – 3 dias presenciaisLocal:Região de Alphaville – Barueri / SPE temos também o Clube da Four que oferece ótimas vantagens! 👇🩺 Assistência médica;🍲 VR e VA flexível;🏋️ Gympass e Wellz;⚽ Parceria com o SESC;🍣 Descontos em restaurantes;📚 Descontos em cursos técnicos e de ensinos superior;🧠 Descontos em escolas e plataformas de idiomas.E aí, aceita o desafio? Então conclua sua candidatura e #VemSerFoursys! Boa sorte! 🍀Show moreShow less",N/A,On-site/Hybrid,https://www.linkedin.com/jobs-guest/jobs/api/jobPosting/4371009384,2026-02-21
