title,company,location,posted,description,applicants,work_mode,link,data_coleta
Product Data Scientist,NielsenIQ,"Cotia, São Paulo, Brazil",2 days ago,"R25_0014938In 100 countries around the world, NielsenIQ provides clients the most complete understanding of how the FMCG market evolves and what consumers buy. As a global leader in measurement and information, we believe providing our clients a precise understanding of the consumer is the key to making the right decisions -- decisions that can lead to profitable growth. At NielsenIQ, we’re always innovating to keep pace with emerging market trends and the increasingly diverse, demanding and connected consumer.The Product organization drives forward our product strategy for NielsenIQ’s product portfolio. From measurement strategy to delivery mechanism and applications suite, the Product Organization identifies market opportunities and shapes product offerings to enable our clients’ strategic business decision making.Job DescriptionBeing a Data Scientist in theProduct Data Science, you will play a critical role in developing the next generation of solutions we offer our clients, powered by algorithms and AI and leveraging large volumes of internal data, client data and third-party data.You’ll be actively participating with other team members in the overall Product creation process. You will be participating with other team members in the overall Product creation process. You’ll work alongside a group of talented individuals with different areas of expertise including best in class data scientists.On a daily basis you’ll be expected to:Read, write, comment, maintain, enhance, and share legible, well documented, and quality computer code translated from technical specification to fulfill product requirementsAdapt and plan implementation of statistical and analytical models (including ML/AI approaches) to production platform, guiding their integration with other production processesMaintain data integrity and quality throughout the development lifecycleActively participate in Agile workflows with the broader team which incQualificationsBachelors or Masters degree in Computer Science, Data Science, Statistics, Mathematics, Engineering or related field requiring outstanding analytical expertise and strong technical background3+ years of experience in data science/analytics/software engineering related product development and/or data solutions developmentKnowledge of statistical and machine learning methodologies: Sampling theory, Probability Theory, Variation analysis, Outlier identification techniques, Regressions, Classification, Time series analysis, Clustering, Neural Networks, etcAbility to prototype as well as support pilot programs for R&D purposes. The primary areas include – but not limited to – trend analyses, identifying gaps for improvements in coverage, representation/sampling, bias reduction, indirect estimation, data integration, automation, generalization, harmonization as well as working with different data sourcesProficient inPython, SQL, Statistical packages(scipy, sklearn, statsmodels, etc), and version control (Github)Proficient in English languagePreferred:Experience withCloud computing, ETL,advanced data processing techniques (Spark, pySpark, Hadoop, etc)Additional InformationFlexible working environmentVolunteer time offLinkedIn LearningEmployee-Assistance-Program (EAP)Our BenefitsFlexible working environmentVolunteer time offLinkedIn LearningEmployee-Assistance-Program (EAP)About NIQNIQ is the world’s leading consumer intelligence company, delivering the most complete understanding of consumer buying behavior and revealing new pathways to growth. In 2023, NIQ combined with GfK, bringing together the two industry leaders with unparalleled global reach. With a holistic retail read and the most comprehensive consumer insights—delivered with advanced analytics through state-of-the-art platforms—NIQ delivers the Full View™. NIQ is an Advent International portfolio company with operations in 100+ markets, covering more than 90% of the world’s population.For more information, visit NIQ.comWant to keep up with our latest updates?Follow us on: LinkedIn | Instagram | Twitter | FacebookOur commitment to Diversity, Equity, and InclusionNIQ is committed to reflecting the diversity of the clients, communities, and markets we measure within our own workforce. We exist to count everyone and are on a mission to systematically embed inclusion and diversity into all aspects of our workforce, measurement, and products. We enthusiastically invite candidates who share that mission to join us. We are proud to be an Equal Opportunity/Affirmative Action-Employer, making decisions without regard to race, color, religion, gender, gender identity or expression, sexual orientation, national origin, genetics, disability status, age, marital status, protected veteran status or any other protected class. Our global non-discrimination policy covers these protected classes in every market in which we do business worldwide. Learn more about how we are driving diversity and inclusion in everything we do by visiting the NIQ News Center: https://nielseniq.com/global/en/news-center/diversity-inclusionShow moreShow less",N/A,On-site/Hybrid,https://www.linkedin.com/jobs-guest/jobs/api/jobPosting/4339036457,2026-02-23
Data Scientist Intern - Latin America Internship Program,Procter & Gamble,"São Paulo, São Paulo, Brazil",1 day ago,"Job LocationPANAMA BUSINESS CENTERJob DescriptionLocation:Panama City, PanamaWork Hours:Flexible working hours (20-40 hours weekly)Profile:Active undergraduate student in Latin America with a background in Science, Technology, Engineering, or Mathematics.Salary:Competitive salary and benefits program.Duration:Minimum of 6 months.Accommodations:P&G is committed to providing accommodations to any applicant with a disability during the recruitment, assessment, and selection process. If you need an accommodation related to your disability in order to participate in the recruitment process, please click here to submit your request. If you require an accommodation for the assessment process: 1) submit your request, 2) do not complete either assessment until you have been contacted for documentation verification.Are you ready to leverage your international academic background and join a globally recognized company? We are looking for a passionate student eager to make an impact and take on new challenges! Join us now and be part of the P&G Latin America Internship program.Job Overview:As a Data Scientist Intern, you will join a renowned company, working with a large team of Data Scientists to improve the lives of billions of consumers. You will take ownership of an algorithm/model need and apply state-of-the-art artificial intelligence to formulate problems, analyze data, and present solutions.Key Responsibilities:Mine terabytes of data and develop models and algorithms to derive actionable insights.Partner with business leaders to understand problems and collaborate with data engineers to automate and deploy models.Analyze and model big datasets, translating consumer behavior into actionable recommendations.Answer business questions and propose solutions using machine learning techniques and algorithms.Discover and invent next-generation analytic capabilities for category analysts and business partners.Job QualificationsWe are looking for a student who:Is an active undergraduate student in Latin America with 6-24 months left to graduate.Has academic background in Science, Technology, Engineering, or Mathematics.Has knowledge in algorithmic development, deployment, and monitoring practices.Is fluent in Python, working with cloud environments, software development best practices.Capable of developing Machine Learning and/or optimization models.If not located in Panama, can move to Panama until graduation and fully commit to delivering projects that will last at least 6 months.Has written and spoken proficiency in Spanish and English.Displays strong teamwork, analytical skills, problem solving and an end-goal oriented attitude.Is comfortable collaborating with people from different levels, backgrounds and experiences.Shows strong passion to continuously learn new things and grow as a professional.Hard Skills:Knowledge in algorithmic development, deployment, and monitoring practices.Proficient in Python and experience working with cloud environments.Capable of developing Machine Learning and/or optimization models.Soft Skills:Strong teamwork and analytical skills.Problem-solving and end-goal oriented attitude.Comfortable collaborating with diverse individuals at various levels.Nice to Have Skills:Experience with industry certifications or internal development programs.Important Note for Candidates:Before submitting your application, we encourage you to review our Hiring Process and Assessment Information. Familiarizing yourself with this content will help you prepare for online assessments and enhance your chances of success.What We Offer:Responsibilities from Day 1, allowing you to own and lead projects.Continuous coaching and mentorship to improve your knowledge and management abilities.A dynamic and respectful work environment that promotes agility and work/life balance.Opportunities to become a full-time employee following successful completion of your internship.Relocation support to Panama and work in international teams.About Us:P&G serves consumers worldwide with a strong portfolio of trusted brands, including Always®, Ariel®, Gillette®, Pampers®, and Tide®. Our community operates in approximately 70 countries. We value diversity and are committed to building a winning culture based on inclusion.Job ScheduleFull timeJob NumberR000144663Job SegmentationInternshipsShow moreShow less",N/A,On-site/Hybrid,https://www.linkedin.com/jobs-guest/jobs/api/jobPosting/4356771777,2026-02-23
Copilot Specialist,Tata Consultancy Services,"São Paulo, São Paulo, Brazil",1 week ago,"Come to one of the biggest IT Services companies in the world!! Here you can transform your career!Why to join TCS? Here at TCS we believe that people make the difference, that's why we live a culture of unlimited learning full of opportunities for improvement and mutual development. The ideal scenario to expand ideas through the right tools, contributing to our success in a collaborative environment.We are looking forCopilot Specialistwho wants to learn and transform his career.Mandatory SkillsAdvanced EnglishExperience in AI/ML engineering, with a strong focus on Microsoft AI technologies.Proven expertise in designing, developing, and deploying intelligent copilots using Microsoft 365 Copilot and Copilot Studio.Hands-on experience with Azure AI Foundry/Studio for building, managing, and deploying AI models and applications, including Azure OpenAI Service.Deep understanding and practical application of prompt engineering and Retrieval-Augmented Generation (RAG) techniques to enhance AI model accuracy and contextual relevance in M365 Copilot chat.Proficiency in integrating Microsoft Copilot with Microsoft 365 applications (e.g., Teams, Outlook, SharePoint) and enterprise systems using Microsoft Graph API, connectors, and plugins.Desirable SkillsFamiliarity with the broader Microsoft Power Platform (Power Apps, Power Automate) for low-code/no-code AI solution development and workflow automation.Experience in data management, data preparation, and building robust data pipelines for AI/ML workloads on Azure.Understanding of AI orchestration, governance, compliance, security best practices, and responsible AI principles in enterprise environments.Prior experience with other enterprise AI platforms (e.g., Google Gemini) and an understanding of AI migration strategies.Experience with MLOps practices, CI/CD pipelines for AI solutions, telemetry dashboards, and monitoring tools.Relevant Microsoft certifications (e.g., Microsoft Certified: Azure AI Engineer Associate, Microsoft 365 Fundamentals).What can you expect from us?• Professional development and constant evolution of your skills, always in line with your interests.• Opportunities to work outside Brazil• A collaborative, diverse and innovative environment that encourages teamwork.What do we offer?TCS Benefits – Brazil:Health insuranceDental PlanLife insuranceTransportation vouchersMeal/Food VoucherChildcare assistanceGympassTCS Cares – free 0800 that provides psychological assistance (24 hrs/day), legal, social and financial assistance to associatesPartnership with SESCReimbursement of CertificationsFree TCS Learning Portal – Online courses and live trainingInternational experience opportunityDiscount Partnership with Universities and Language SchoolsBring Your Buddy – By referring people you become eligible to receive a bonus for each hireTCS Gems – Recognition for performanceXcelerate – Free Mentoring Career PlatformAt TATA Consultancy Services we promote an inclusive culture, we always work for equity. This applies to Gender, People with Disabilities, LGBTQIA+, Religion, Race, Ethnicity. All our opportunities are based on these principles. We think of different actions of inclusion and social responsibility, in order to build a TCS that respects individuality. Come to be a TCSer!#BuildingonbeliefShow moreShow less",N/A,On-site/Hybrid,https://www.linkedin.com/jobs-guest/jobs/api/jobPosting/4371020896,2026-02-23
N/A,N/A,N/A,N/A,N/A,N/A,On-site/Hybrid,https://www.linkedin.com/jobs-guest/jobs/api/jobPosting/4371786827,2026-02-23
N/A,N/A,N/A,N/A,N/A,N/A,On-site/Hybrid,https://www.linkedin.com/jobs-guest/jobs/api/jobPosting/4362570938,2026-02-23
Cientista de dados Pleno | Inflação,Warren Investimentos,"São Paulo, São Paulo, Brazil",3 weeks ago,"Na Warren, confiança é a base de tudo. Nossos clientes sabem, com total transparência, como seus investimentos são geridos, quais as taxas envolvidas e o nível de risco de cada um. Nosso propósito é eliminar o conflito de interesses no mercado de investimentos brasileiro: não somos comissionados pelos produtos sugeridos, garantindo que o perfil e os objetivos de cada cliente estejam no centro de todas as decisões.Se você acredita em ummercado financeiro mais transparente, capaz de oferecer a melhor experiência de investimentos para seus clientes, a Warren é o seu lugar. Aqui, você terá a oportunidade de se desenvolver enquanto atua em um ambiente de alta performance, aprendendo com os melhores profissionais do mercado. Buscamos pessoas que valorizam o trabalho em equipe, sempre prezando pela ética e excelência em suas entregas.Somos uma empresa para todas as pessoas que desejam fazer o seu melhor todos os dias, independentemente de gênero, etnia, orientação ou qualquer outra condição, e nosso processo seletivo é baseado na neutralidade.Responsabilidades e AtribuiçõesÉ uma vaga ideal para quem tem interesse em trabalhar com dados aplicados à macroeconomia..Criar relatórios e dashboards que auxiliem no acompanhamento de coleta de preços;Garantir a interface com o time de dados interno, alinhando demandas e consolidando informaçõesRequisitos e QualificaçõesDatabricksAWSLógica de programaçãoBoa comunicaçãoSQLPythonExcelSerá considerado um diferencialConhecimento em limpeza com arquivos Excel e ou CSV.Experiência com ETL/ELT.Extração de dados via API.Pensamento analítico.Matemática e Estatística.O que a Warren te proporciona?Cultura de inovação com times multidisciplinares e estrutura horizontal, focados em desenvolver as melhores soluções para nossas pessoas usuárias. Possibilidade de contribuir em frentes diversas para o seu crescimento.Plano de Saúde SulAmérica para você e seus dependentes;Plano Odontológico Care Plus para você e seus dependentes;Benefício VR e VA;Licença maternidade estendida;Licença paternidade estendida;Day off de aniversário;2 Day Offs remunerados por ano;Auxílio Creche;Auxílio Transporte;Programa de Partnership: seja uma pessoa sócia da Warren.Bonificação Variável Semestral;TotalPass;Seguro de Vida Prudential.Show moreShow less",N/A,On-site/Hybrid,https://www.linkedin.com/jobs-guest/jobs/api/jobPosting/4367025775,2026-02-23
Analista de qualidade,Seara,"São Paulo, São Paulo, Brazil",1 week ago,"Atividades a serem desenvolvidas:• Estruturação e Atualização dos indicadores estratégicos da diretoria• Acompanhar e analisar os indicadores da área, consolidando informações para agilizar tomadas de decisões• Elaboração e acompanhamento do orçamento de gastos da diretoria• Desdobramento e apuração das metas• Elaboração de relatórios analíticos e materiais para reuniões e check de metasPré-requisitos:• Excel Avançado• Power Point• Desejável conhecimento em Qlik SenseShow moreShow less",N/A,On-site/Hybrid,https://www.linkedin.com/jobs-guest/jobs/api/jobPosting/4363903864,2026-02-23
Pessoa Assistente de Qualidade de Dados | Vaga Afirmativa PCD,METARH,"São Paulo, São Paulo, Brazil",2 weeks ago,"Na METARH, acreditamos que a diversidade de pessoas fortalece a qualidade das decisões e dos dados. Por isso, esta é uma vaga afirmativa para Pessoas com Deficiência (PCD).Buscamos uma pessoa para atuar como Assistente de Qualidade de Dados, integrando a área de BI, com foco em sustentação, validação e padronização de dados.Descrição de atividades:Validar e auditar bases de dadosIdentificar inconsistências, dados faltantes ou cadastros incorretosApoiar a padronização de dados, principalmente relacionados à área de RHInteragir com áreas internas para correção e alinhamento das informaçõesApoiar no desenho e melhoria de processos de qualidade de dadosDar suporte operacional à área de BIRequisitos:- Ensino Superior Cursando ou Completo;- Conhecimento em Excel;- Experiência em funções de informações gerenciais;- Boas habilidades analíticas e atenção aos detalhes;- Habilidades de comunicação verbal e escrita;- Conhecimento em Power BI será considerado um diferencial.Benefícios: Vale Refeição / Vale Alimentação / Assistência médica / Assistência odontológica / Seguro de vida / Convênio Farmácia / Estacionamento no local ou Vale Transporte / Gympass / Day Off Aniversário.Show moreShow less",N/A,On-site/Hybrid,https://www.linkedin.com/jobs-guest/jobs/api/jobPosting/4369523519,2026-02-23
Cientista de Dados Pleno IA e Machine Learning,Agility,"São Paulo, São Paulo, Brazil",1 month ago,"Atuação comoCientista de Dados Pleno, com foco emMachine Learning e IA Generativa, participando do desenvolvimento, evolução e operação de modelos de dados e soluções de IA, em colaboração com times técnicos e áreas de negócio.A pessoa atuará de formahands-on, contribuindo em novos projetos de dados e IA.Responsabilidades e atribuiçõesDesenvolver, treinar, avaliar e melhorar modelos preditivos e de Machine Learning;Apoiar a construção e evolução de soluções de IA incluindo uso de LLMs, RAG e pipelines de ML;Construir e manter pipelines de dados utilizando Python e SQL;Realizar análises estatísticas, EDA e testes de hipótese, gerando insights para apoiar decisões de negócio;Colaborar na criação de produtos de dados e soluções inteligentes, junto aos times técnicos e áreas de negócio;Atuar na implantação e melhoria contínua de práticas de MLOps/LLMOps, como versionamento, automação de pipelines, monitoramento básico e documentação;Documentar modelos, dados e fluxos, seguindo boas práticas de governança de dados;Acompanhar tendências, ferramentas e boas práticas em IA e Machine Learning, aplicando aprendizados no dia a dia.Requisitos e qualificaçõesConhecimentos Imprescindíveis:Experiência prática com Machine Learning e análise de dados;Experiência com Python e SQL para manipulação e análise de dados;Vivência com pipelines de dados e integração via APIs;Noções de IA Generativa, incluindo conceitos de LLMs, RAG e tokenização;Conhecimento básico/intermediário em MLOps (ex.: Git, Docker, MLflow, Airflow/Prefect ou similares);Experiência ou contato com ambientes cloud (AWS, Azure ou GCP);Familiaridade com boas práticas de documentação e governança de dados;Mínimo de 3 anos de experiência atuando com dados, ciência de dados ou áreas correlatas.Conhecimentos desejáveis:Experiência com modelagem de dados, ETL e análise exploratória de dados (EDA);Vivência com frameworks e ferramentas de IA Generativa;Conhecimento em metodologias ágeis e práticas de DevOps;Noções de LLMOps/MLOps, como monitoramento, avaliação de qualidade de modelos e controle de custos;Boa comunicação e capacidade de trabalho colaborativo com diferentes áreas.Informações adicionaisIdioma:Inglês IntermediárioFormação Acadêmica:Ensino superior completo em Ciência da Computação, Estatística, Engenharia, Matemática, Sistemas de Informação ou áreas correlatas;Pós-graduação emMachine Learning, IA, Engenharia de Dados ou áreas afinsserá considerada um diferencial.Show moreShow less",N/A,On-site/Hybrid,https://www.linkedin.com/jobs-guest/jobs/api/jobPosting/4351217351,2026-02-23
Estamos com oportunidade para atuar com Dados/ IA /RPA /Python,KPMG Brazil,"São Paulo, São Paulo, Brazil",2 weeks ago,Acesse as oportunidades pelo link abaixo🚀Desenvolvedor RPA Pythonhttps://lnkd.in/dEzpTiEj🚀Consultor de Inteligência Artificial (IA)https://lnkd.in/dt2VH_at🚀Analista de Dadoshttps://lnkd.in/diH2-TsVShow moreShow less,N/A,On-site/Hybrid,https://www.linkedin.com/jobs-guest/jobs/api/jobPosting/4358878610,2026-02-23
Cientista de Dados SR,Pottencial Seguradora S.A,"São Paulo, São Paulo, Brazil",2 days ago,"Responsável por desenvolver, validar e aprimorar modelos preditivos de alta complexidade para suportar a definição das estratégias de precificação dos principais produtos da companhia. Atuará aplicando técnicas avançadas de Machine Learning, Estatística e Matemática para transformar dados em inteligência de negócio, apoiando decisões estratégicas e garantindo a rentabilidade, competitividade e sustentabilidade dos produtos. Também será responsável por atuar em parceria com as áreas de negócio, contribuindo para a evolução contínua das estratégias de pricing e para o fortalecimento de uma cultura orientada a dados.Responsabilidades e atribuiçõesDesenvolvimento de Modelagem de Ponta: Liderar o desenvolvimento de modelos de precificação e subscrição automatizados, garantindo o uso de técnicas avançadas e métricas adequadas cada modelo;Visão Estratégica de Negócio: Colaborar ativamente com as áreas de Subscrição e Produto para garantir que os modelos sejam aplicáveis e tragam impacto real no P&L (Loss Ratio e rentabilidade);Validação e Experimentação: Validar tecnicamente a utilidade dos modelos através de testes A/B, planejamento de experimentos e controles de intervenção para garantir a performance e estabilidade;Ciclo de Vida e Monitoramento: Acompanhar o ciclo de vida dos modelos, monitorando a consistência das premissas versus valores observados e identificando necessidades de retreino ou ajustes;Governança de Preços: Apresentar resultados de análises e status de projetos em comitês técnicos e executivos, garantindo o nível de governança definido para o processo de precificação;Mentoria Técnica: Atuar como referência técnica para os níveis Junior e Pleno, promovendo o compartilhamento de conhecimento e boas práticas de codificação.Requisitos e qualificaçõesFormação: Graduação completa em Ciências Atuariais, Estatística, Matemática, Economia, Engenharia ou áreas correlatas;Experiência: Mínimo de 4 anos de atuação na área ou similares;SQL e SAS: Intermediário;Python, Git e OOP: Avançado;Modelagem Estatística e Machine Learning: Avançado;Data Wrangling e Visualização de Dados: Avançado;IA Generativa: Prompt Engineering e uso de LLMs (vide coding);Alta capacidade de agência, foco em resultados, atuação estratégica, liderança técnica, flexibilidade e excelente capacidade de trabalho em equipe.Informações adicionaisVR (R$ 997,70/ mês);VA (R$ 771,13 / mês);Plano de Saúde Sul América;Plano Odontológico Sul América;PLR;Vale Cesta de Natal Alelo R$ 771,13;Seguro de vida;Auxílio creche ou Babá (R$ 502,29 até 6 anos);Licença maternidade de 6 meses e paternidade de 20 dias;Day off no dia do seu aniversário;Antecipação do 13º no mês de maio.Show moreShow less",N/A,On-site/Hybrid,https://www.linkedin.com/jobs-guest/jobs/api/jobPosting/4373762060,2026-02-23
